Username,location,friend_count,review_count,photo_count,rating,date,review,Url
Brett S.,"Houston, TX",12,49,2,3.0,10/13/2016,"This is my first time at bjs. I had the jalapeño burger, it was pretty good. Good atmosphere and waiter was friendly. Definitely won't be my last bj.",https://www.yelp.com/biz/bjs-restaurant-and-brewhouse-shenandoah?start=60
Bob H.,"Spring, TX",0,24,,4.0,6/23/2016,"I had the flatbread pizza and my wife had the Cobb salad , both very good. Service was excellent.  Returned once again. I had the North Beach Mali and Shrimp. Excellent. My wife had the Parmesan crusted chicken and it was excellent as well",https://www.yelp.com/biz/bjs-restaurant-and-brewhouse-shenandoah?start=60
FoodMakes M.,"Houston, TX",1,88,28,3.0,7/18/2016,"Drink - watermelon basil margarita.  Too much syrup though the alcohol content was on par.  It would have been more refreshing if it weren't so thick.  I attempted to let the ice melt, but it didn't help the texture much. Appetizer - sampler of mozzarella sticks, avocado egg rolls, garlic parmesan boneless chicken wings, and spinach artichoke dip with chips.  Cheese sticks and marinara met expectations.  Nothing bad to say.  Avocado rolls had too much avocado and not much else.  The tamarind sauce on the side is what made it worthwhile.  Very great flavor that I used to dip the garlic parmesan bites into.  The chicken was tender and lightly breaded, but could have used more sauce drizzle.  Some what dry but rectified with the tamarind sauce intended for the avocado rolls.  And the dip would have been okay had it not been dried out.  I prefer creamy and less clump so I can actually get it on the chip without breakage.  $17.95 for the platter was a bit pricy. Side salad - romaine, iceberg, and spinach.  Strawberry vinaigrette was light enough.  Normal enough salad. Main entrée - Mediterranean Chicken Pita Tacos.  Decent size and good amount of protein.  Just seemed like something was missing and it was very dry.  I asked for cucumbers and red onions to be removed....but think they also left out the cilantro.  Reasonably priced at $9.95 since I substituted the side grains for the side salad. The desserts were limited.  I didn't bother to try the pizookie they seem to be known for.  They had options but it just didn't seem like what I wanted to complement the meal.  Overall, I enjoyed that our server knew the menu well.  She never hesitated in answering our questions.  She was however not very attentive and we could have used refills on waters.  At the end of the meal, we waited too long for her to return and take payment that we decided to pay at the take out register. I probably would only come back for a happy hour special but there was nothing to draw me back.  I have enjoyed other trips to BJ's in other states (Cali/Washington) but didn't feel the same about the dining experience here.",https://www.yelp.com/biz/bjs-restaurant-and-brewhouse-shenandoah?start=60
Misty K.,"New Caney, TX",19,8,24,3.0,6/6/2016,"Great food, love the Deco and atmosphere, however, don't go here hungry, we've been twice and they are VERY slow and our waitress was rubbing her/and other waiters back (yea, gross!) And she had no clue how to work their app and she called a manager over and she didn't know how it worked either.. all else aside they are very SLOW to bring your food out. Inexcusable with such a huge staff, unless only like one cook. JS",https://www.yelp.com/biz/bjs-restaurant-and-brewhouse-shenandoah?start=60
Jeremiah K.,"Houston, TX",4,15,10,5.0,3/21/2016,The app and ease of payment were great for the lunch rush. Great unlimited salad and soup combo deal.,https://www.yelp.com/biz/bjs-restaurant-and-brewhouse-shenandoah?start=60
Levi G.,"Spring, TX",0,3,,1.0,7/24/2017,"Finally decided to give this place another chance after 2 years of staying as far away as possible. They still have average food but the service is what has kept us away in the first place. The waiter was very nice and apologized to us multiple times for waiting an hour for our food. The actual food order was taken 20 minutes after we ordered our drinks and the drinks themselves took 20 minutes to arrive. All of this could be overlooked but when the hostess rolls her eyes when you ask for a highchair, well you kind of get upset. We won't be giving this place another chance and hope that you won't either.",https://www.yelp.com/biz/bjs-restaurant-and-brewhouse-shenandoah?start=60
Niabi R.,"Westside, Houston, TX",0,3,,1.0,7/23/2017,"This used to be one of our fav spots for both food and drink. This time we waited 20 minutes for the waiter to even approach our table and the restaurant was far from busy. Eventually I complained to the hostess and she went to find our waiter. When the waiter finally came, he didn't apologize or introduce himself; he just asked what we wanted to drink..... literally ""what do you want to drink"". Took another 15 minutes before bringing the water... still didn't bring the wine so we informed the hostess we were going to the bar. We hoped for better service. Service was faster but the bartender's personality was 0. She was nearly scowling and did not speak unless spoken to. At least the food was ok although overpriced (it really wasn't THAT good) and the bazookies were amazing.",https://www.yelp.com/biz/bjs-restaurant-and-brewhouse-shenandoah?start=60
Todd L.,"Spring, TX",24,1,,5.0,7/22/2017,Derek was a fantastic waiter! Our food was incredible and they had great service. Fish and chips are delicious and the beer is awesome. Would highly recommend for a date night!,https://www.yelp.com/biz/bjs-restaurant-and-brewhouse-shenandoah?start=60
Alex D.,"Spring, TX",1,20,18,1.0,1/25/2016,"Went out the eat here on a Friday night.  We got there around 9:45.  The place was not busy. We got seated. Waited 30 minutes for our waiter just to ask for our drinks. While she came by to take our drink order we ordered food, because who knew when she would be back around. We waited another 45 minutes for our pizza to come out. While the pizza came out, we had no silverware to eat with. We waited another 10 minutes for our waiter to come by and ask us if we needed anything. We had no silverware to eat with. Our food had gotten cold by this point. While we were eating the waiter did not come by to ask us if we needed a refill which we were out on drink. She came by asked us if we wanted dessert and we said yes, and she just bought the check out thinking we were done eating and having drinks. Had our dessert and left. Did not want to be had this place with the waiter not offering good service.  Mostly would not go back to this location again.",https://www.yelp.com/biz/bjs-restaurant-and-brewhouse-shenandoah?start=60
Julia K G.,"Montgomery, TX",1,18,9,1.0,5/25/2017,"The following is a copy of a letter that I composed and sent to corporate offices that I never received the consideration in a response in ---------- Forwarded message --------- Date: Tue, Feb 3, 2015 at 11:38 PM Subject: Inappropriate attention to detail To:  02-03-2015 Location of complaint: The Woodlands TX, 19075 I-45 South, 600, Shenandoah, TX 77385 I am stating a formal complaint regarding the disregard in professional accommodation to a client's needs in diplomacy to mutually resolve unsatisfactory food and beverage requests. My grievances include several circumstances that occurred the evening of 02-03-2015, and are described as follows: All soda beverages were not carbonated and service was unacceptable in having the drinks replaced. My son and I were never able to have this issue resolved and much to my dismay I was furthered charged per drink, so I was inconvenienced into dispute resolution with a manager to elevate the problem. My primary complaint and concerns are the result of an order of ""Garlic Chicken Wings"" and when we realized that the inside meat was frozen and there was visual evidence of blood. I brought this to the waiter's attention and he offered to have them ""cooked up more"". I declined his offer and advised him to remove the order from my bill. Unwilling to do so, It was necessary to request a manager. Unfortunately our waiter was not attentive in compelling this particular individual to join us at our table or the manager refused to do so. The disconcerting  attention of the manager proved to be apathetic and noncompliant in professionally offering concessions for the unacceptable circumstances in a regrettably disrespectful and argumentative approach. The manager denied the problem and informed me that he would agree to recook the item or replace it with the same item, but refused to replace the order with another selection associated with the uncooked meat. I declined this offer and proceeded to inform him that I would insure that my credit card company decline the charge to BJ's if the fountain drinks and raw meat appetizer wasn't removed from my charges. The manager begrudgingly then removed the charges from my bill. I was not offered qualifying options to rectify or compensate me for the problem. This circumstance was my first and last encounter with the ""BJ's"" brand.",https://www.yelp.com/biz/bjs-restaurant-and-brewhouse-shenandoah?start=60
Lari R.,"Conroe, TX",0,1,,5.0,6/18/2017,"Great food and service!!  Kierra is the best, she's attentive, positive and has a great personality.  She went out of her way to accommodate my son while we dined!!",https://www.yelp.com/biz/bjs-restaurant-and-brewhouse-shenandoah?start=60
Jay R.,"Houston, TX",0,21,42,5.0,10/22/2016,"5 stars for the awesome customer service received by our waiter, Mitchell!  He was great from beginning to end...I ended up having  an issue with my food but he quickly resolved the problem and with a smile ! I will return again for that level of customer service alone",https://www.yelp.com/biz/bjs-restaurant-and-brewhouse-shenandoah?start=60
Rocheryl T.,"Secaucus, NJ",0,2,,1.0,10/7/2017,"I only gave 1 star because of the final waitress we had which I will get to later. This was by far the worst experience I have had at a BJ's. This was the Woodlands location. Let me start by saying I made reservations a week in advance so they were aware of the large party. However, the size of the party had nothing to do with it. We arrived at the restaurant and still had to wait 15-20 min to be seated. When we reached our seats we waited another 15-20 minutes before we were informed that they were backed up and our waitress would be with us. After another 15-20 min still no visit from our assigned waitress, Kierra. After approaching the hostess stand to ask who our waiter/waitress was I was told she was wrapping up with another large party and would be with ya shortly. After about 5-10 min the HOSTESS comes over and says she will have to take our drink order. We requested to put in orders for appetizers and were told that she couldn't take appetizer order, I understand you are a hostess. We are 45 min in and  still no visit from Kierra. I only know her name because we were told that's who our waitress was when we requested to speak with a manager.  We are now an hour in and the hostess brings waters to the table behind us but don't serve us. She just sits them on the table behind us. 1:10 we decide to flag down Alexis who has been diligently waiting on her tables and ask for a manager and explained we still have not received drinks and were told we could not order appetizers. This is the same waitress that came to apologize for Kierra early. She confirmed our drink orders that we gave the hostess got them to our table and put in our appetizers. She also got the manager who did NOTHING except say we will get 2 waiters to make up which did not happen. I failed to get his name but it doesn't matter because we will not be back. Alexis my message to you is to go to a restaurant where they will appreciate your hard work. Try Grotto they were excellent. Alexis you did excellent and because of you we will possibly visit a different BJ's. Keep up the good work.",https://www.yelp.com/biz/bjs-restaurant-and-brewhouse-shenandoah?start=60
Casey F.,"Richmond, TX",1,2,,5.0,4/30/2017,We decided to stop at bjs last night and had a great experience!! Food was delicious and the staff was very friendly and helpful! Had a small issue with our drinks not being correct but the general manager stopped by the table and quickly corrected the issue and made sure we left happy!! We will definitely be back!!,https://www.yelp.com/biz/bjs-restaurant-and-brewhouse-shenandoah?start=60
Alex N.,"Spring, TX",18,101,42,5.0,4/24/2015,"BEEEEEEEEER Das Gut!. I like good beer. This place has a lot of it.  FOOOOOOOOD noms. Wife approved=me getting to go back and drink more beer. #holla  We got some goofy appetizers (I randomly picked).... calamari and some ahi tuna. both were great. Wife got a burger, and liked the hell outta it.  I got some random pizza the server said to get.... It aint no pizza zone, but it was still good. SERRRRRVIIIICCCCEEE really bueno. Server knew his beers- Although we argued on what beer was better (I like stouts, he likes IPA's) it all in a fun joking manner.  Waiter said they used to have a 8 beer sampler, but patrons were getting too drunk. Pansies. I drank 12. No, I didn't drive afterwards. Overall, this is a nice place, nicely set up, beer is gud, food is gud, service is gud.  What's there to complain about?",https://www.yelp.com/biz/bjs-restaurant-and-brewhouse-shenandoah?start=60
Micki T.,"Houston, TX",0,3,1,5.0,2/2/2016,"I just went here for the first time and all I can say is wow! I had the Bacon Avocado burger with a lemonade and the chocolate chip pizookie for dessert. The burger was fully loaded, messy, and cooked to perfection. The pizookie is something that is a must! It was warm with the cookie but cold with the ice cream on top.  The atmosphere was very friendly and casual. Everyone there working also seemed very professional and polite. I would recommend this for anyone going on a date, dinner with the family, or just to have a drink by yourself.",https://www.yelp.com/biz/bjs-restaurant-and-brewhouse-shenandoah?start=60
Carter D.,"Conroe, TX",0,4,,3.0,5/26/2017,"Ok. So I really have a love/hate relationship with this place. They get a 5 for their food. However, every time I have been, the service has been atrocious! We barley ever see our servers and everything takes so long to get delivered to our table. The soft drinks are never carbonated and are always flat and sweaty. On several occasions, the food has taken an hour plus to make. Managers all always at people's tables cleaning up employees mistakes and apologizing. It takes about 20-30 minutes for appetizers to come out, followed shortly with the main course. I will say the pizookie is the reason I keep coming back, it is wonderful. But it takes about half an hour to get to our table too. It is really sad because I love the food, but the service is always awful. It doesn't matter if it's a week night or weekend, busy or not, it is awful every time. Also, there is always a wait when there are several open tables, and when I went on a date one night, we were seated in a circular booth for 6. Really hope they can get their act together with the service, because the food really is amazing.",https://www.yelp.com/biz/bjs-restaurant-and-brewhouse-shenandoah?start=60
Tim V.,"Cedar Park, TX",19,258,133,3.0,3/2/2015,"Was here for my daughters soccer tournament and brought the girls in.  The staff did a fair job trying to accommodate such a large drop in party BUT could have done a better job. The food was on par with all the other BJ's i have been too and i love the beer selection.  Our server was a bit slow on service and drink re-fills.   Seems like every BJ's I go to there is alwas something they miss, if its wait time, food order wrong, slow staff, bill mix ups (like this one).   I'd just like some consistency.",https://www.yelp.com/biz/bjs-restaurant-and-brewhouse-shenandoah?start=60
Annie A.,"Conroe, TX",66,73,16,5.0,8/17/2016,"We loved the vast menu and the Nitwit shandy was delicious.  We were celebrating, so we had the party pizookie and it was amazing.",https://www.yelp.com/biz/bjs-restaurant-and-brewhouse-shenandoah?start=60
Jamie A.,"Spring, TX",127,304,760,4.0,10/7/2014,"BJ's is a fantastic place to hang out with your friends, have some great drinks, and good food.  It's always pretty busy, but they do offer a call ahead service.  Just call before you leave your house, get your name on the list, and you will be seated shortly after you arrive.  They also have a great rewards program.  You get special offers via email and you earn points for free stuff every time you dine. They have over 50 handcrafted beers to choose from as well as a full bar.  I'm a vodka kind of gal and they serve up a nice strong Cosmo!  I keep wanting to try new things, but my favorite starter is the fried artichoke hearts with lemon aioli.  So addictive!  This time I added a mozzarella and tomato salad.  It was fresh tasting and beautifully presented, but the cherry tomatoes lacked flavor.  Some nice heirloom tomatoes would have really completed the dish. Their pizzas look fantastic, but again being the creature of habit that I am, I have a heard time straying away from my favorite dish. The Parmesan Crusted Chicken is my jam. Marinated chicken breasts coated with Parmesan cheese and crunchy Panko bread crumbs and fried golden brown. Served with white cheddar mashed potatoes, steamed broccoli, and topped with a lemon Chardonnay butter sauce. Yum!  It is a healthy sized portion and can be shared with two people, unless of course I'm one of those two people. If you have room for dessert, definitely try a Pizookie.  It's a cookie in a deep dish pizza pan served hot with a big scoop of ice cream on top.  It comes in a wide variety of sinfully delicious combinations.  You will Leave BJ's full and happy.",https://www.yelp.com/biz/bjs-restaurant-and-brewhouse-shenandoah?start=60
Patricia M.,"Spring, TX",0,7,1,4.0,10/17/2015,"Okay, so I have a friend in from Holland who is leaving tomorrow.   All she's heard about for 3 months is Watermelon Mojitos at BJ's!!!  Couldn't wait to bring her here for one.  Showed up and was just told ""Oh sorry, that's not on the menu anymore.  They just changed the menu and they don't have the ingredients for it.  I think it's seasonal or something.""  So yeah, pretty disappointed since Watermelons are still being sold in stores.  I actually buy watermelon year round so I know they can get it.  I went ahead and ordered a Strawberry Mojito but I'm reluctant to get attached now that I know they don't keep their menu consistent.  Boooo!   I generally love this place.   The truth is I should have already written a good review for them.   But just like people usually do, we are quick to review what's wrong but slow to review what's right.  So with that consideration I'm going to say that I have loved this place.   TVs to watch sports, great atmosphere, comfortable booths, food is great and it's a convenient location.  Get the rewards card, it's a nice bonus. Put Watermelon Mojitos back on the menu please.  =)",https://www.yelp.com/biz/bjs-restaurant-and-brewhouse-shenandoah?start=100
Jessica C.,"Spring, TX",5,3,,1.0,12/6/2014,If I could help it I would give it a -5 stars.   Seating for this place is a mess and makes no sense.  You tell someone your name for them to write a receipt for someone else to call your name which could be another 10 minutes even when it's not busy.  Strange.   Then you order.  As we ordered a small pizza.  It comes out not cooked inside and only on the outside.  Logically. If we say it isn't cooked.  The pieces on out plates are not cooked either.  Why would you only tKe back the part in the pan and just have the cooks just throw it in the oven to cook more and not ask us for the uncooked pieces on our plates also or just make a new one.  Or even call the manager to see us.  And charge us for everything knowing we were not satisfied.   It's very disheartening to me to see so many uncaring restaurants now who do not care about the customer.  Just there money.,https://www.yelp.com/biz/bjs-restaurant-and-brewhouse-shenandoah?start=100
Jeff W.,"Spring, TX",0,4,1,2.0,3/16/2015,"Love BJs but tonight was crap!!!!! First off. Asian chopped salad.  You need to add dressing to greens before dressing.  Not after ten minutes of asking to be brought to the table.  Secondly.  That flat bread pizza you charge$14 for are you freaking kidding me!!!!????   It does it have 12 serving pieces.  It is cut into 12 pieces.  There's a difference.   Thirdly, learn the difference between medium well to nuclear terd.  There's a difference.   That is all for now.",https://www.yelp.com/biz/bjs-restaurant-and-brewhouse-shenandoah?start=100
Sabeena C.,"Spring, TX",0,3,,2.0,7/29/2015,"Service was terrible from the start. I am not usually a critical customer, I know being a waiter is not an easy job, but we were completely neglected as if our business was a burden to our waiter.  My mom and I came in for lunch and were seated and given menus. No one came by to get our drink or food order, so we eventually asked a waiter from another table if they could get our waiter for us. The gentleman was nice enough to take our drink and food order and pass that along to our waiter, Robert (although we still had no idea who he was). Later, a female waitress brought out our appetizers without bringing us plates. She walked away so quickly, before we even had a chance to ask for some. Our waiter, Robert, still had not come to our table, so we ended up asking another waiter to bring us plates. After we finished our appetizers, we stacked all of the plates on top of each other, as they usually give you a fresh plate for your entrée. However, when Robert finally came to the table with our pizza, he said, ""Oh did you want a new plate?"". Yes, of course I do, mine is now dirty and stacked between other dirty plates. I also ordered ranch with my pizza, but had to ask for it a second time before they brought it out. That's not a big deal, I was not upset by that. What did upset me is that they did not refill our drinks once during the entire meal. Our glasses were nearly empty before the food came out, and they never once came to check on us unless we called them first. I have never been treated so poorly at a restaurant, and although we don't believe Robert deserved a tip, we gave him 15% anyway. We were really disappointed in this service, and we'll be taking our business elsewhere next time.",https://www.yelp.com/biz/bjs-restaurant-and-brewhouse-shenandoah?start=100
Ashlee H.,"Spring, TX",37,3,,5.0,7/28/2016,Omg good food and great service! This is also a hot spot for Pokemon go! We stopped in here out of curiosity and man I must say they have some foods that are a little different but seriously it tastes amazing. The Brussel sprouts they had weren't really as good as I thought they would be but the Mediterranean tacos that o had were spot on in taste and texture!,https://www.yelp.com/biz/bjs-restaurant-and-brewhouse-shenandoah?start=100
Paul K.,"Spring, TX",0,4,,4.0,11/17/2014,"This is a good place to meet up and hang with friends.  The food is pretty good...  It not the cheapest place to go, but everything on the menu is pretty reasonable.   Service is normally good, considering how busy this place gets.  I like to go every now and then, and I will definitely be back!",https://www.yelp.com/biz/bjs-restaurant-and-brewhouse-shenandoah?start=100
Marian D.,"Conroe, TX",0,12,,3.0,9/12/2015,"My boyfriend and I stopped by as a recommendation from a friend. Overall, I like the environment and the decor is right up my alley but... I hated the service. We stopped by at around 10:30-11pm for a late dinner, the place was not packed but it wasn't empty either - if it had been packed then I would understand why our waiter only stopped by the table twice and took both of our orders wrong and why the food took a ridiculous amount of time to come. Not only were both of our orders wrong but the food was cold. I don't want to give them a bad review, maybe I just got the wrong server, who knows? I'm not opposed to coming again and giving it a second shot but I highly doubt we would return.",https://www.yelp.com/biz/bjs-restaurant-and-brewhouse-shenandoah?start=100
Maria E.,"Houston, TX",0,6,,1.0,5/14/2016,"I have been to this location several times and always had a good experience. The last time I was there on May 12th for my graduation my family and I had a bad time. One of the guests at my table paid for the bill and another was going to leave cash $$ for tip. We still hadn't gotten our deserts, well, I gives the waitress though we weren't giving her a tip because we put no tip on the credit card charge and she basically threw the desert plates and silverware at us. She was annoyed had a nasty attitude, we asked for extra plates and she rolled her eyes and chunked them at the table and walked off. I asked to speak to a manager and no one came, she came over and asked ""do you need something"" with a bad attitude. I couldn't believe this, I have never been treated so rudely at a restaurant before. I told her you know we were going to leave a cash tip you didn't have to treat us so nasty because you thought we weren't going to tip you. She just kept saying ""sorry about that"", too freaking late you ruined my graduation lunch!! Never going here again!!",https://www.yelp.com/biz/bjs-restaurant-and-brewhouse-shenandoah?start=100
