Username,location,friend_count,review_count,photo_count,rating,date,review,Url
Yalda S.,"Plano, TX",41,5,48,5.0,10/28/2016,"I love this place , The food is awesome and the people who works there they always willing to help you out to get the right order I had the amazing dinner with my family and that was my first time I really enjoyed I absolutely recommend it",https://www.yelp.com/biz/bjs-restaurant-and-brewhouse-allen?start=60
Mark R.,"Melbourne, FL",11,64,151,4.0,6/25/2015,"Pasta with scampi-Plenty of shrimp good flavor. The clam chowder is very tasty. SantaFe salad-this salad will fill you up, lots of blackened chicken, tortilla chips & lettuce.",https://www.yelp.com/biz/bjs-restaurant-and-brewhouse-allen?start=60
Kaci H.,"Dallas, TX",2,10,33,1.0,10/26/2014,"I hadn't been to BJ's in a while and some friends and I went to the Allen location yesterday. The waitress Alexandera was nice and polite and did a good job. We ordered 3 cesar salads and 3 personal pizzas. When the salads came out, mine looked different. (The salad looked wilted and there were no croutons. They are the best part, right?!!!) I tried to eat it anyway but eventually I was just stirring it around. Then I found something interesting...A LARGE BEETLE!!! When we brought it to the managers attention he apologized. But then he stated that he was very proud of the restaurants cleanliness and that the salad was prepackaged. I'm not sure what he was getting at because either the bug was in the  prepackaged salad or it was in the restaurant. Either way, it shouldn't have made its way into my salad! Our pizzas were fine and the manager took all the salads off of our bill and paid for my meal. That was nice enough and what I would've expected a manager to do in that situation. But when my bill came I was still charged for my soda which was $2.95! (That is outrageous!!) They ended up taking that off the bill too but needless to say, we will not be returning.",https://www.yelp.com/biz/bjs-restaurant-and-brewhouse-allen?start=60
Khushbu B.,"Plano, TX",0,4,,5.0,4/1/2017,"This is a family favourite due to their large variety! My family is vegetarian. We get their amazing, juicy burgers! (Try the crispy jalapeño and portobello burger). Their tomato soup is my mom's favorite! It's super rich and good. Their pizzokie is to die for! (Cookie and cream is my favorite). They also have a good variety of apps. We have tried and loved their queso, spinach artichoke dip, avacado rolls and their flatbreads. DONT EVER LEAVE BJ's WITHOUT GETTING A PIZZOKIE.",https://www.yelp.com/biz/bjs-restaurant-and-brewhouse-allen?start=60
Der Juana T.,"Richardson, TX",48,6,,2.0,9/24/2016,The food was ok ! My Jalapeno Margarita was delish!! We (my out of town guest) ordered the wings which were good. My Mediterranean Pizza not so good. I wish I would have ordered the thin crust. Perhaps if my not so good waiter would have reminded me of the choices. I would have ordered the thin crust as illustrated in the menu picture. My waiter Issac was in an obvious rush to get to the next table!! He was kinda rude with his fake smile. So next time we will perhaps get a nicer waiter .,https://www.yelp.com/biz/bjs-restaurant-and-brewhouse-allen?start=60
Bonnie L.,"Mexia, TX",31,16,1,4.0,9/10/2016,"Great food! Service was a little off tonight, but will definitely be back! Waitress was friendly,  just had too many tables.",https://www.yelp.com/biz/bjs-restaurant-and-brewhouse-allen?start=60
Douglas B.,"Prosper, TX",3,23,4,1.0,9/7/2015,"I have gone to BJ's frequently and my parents love their craft beer and food when they visit from out of state. Today we went to BJ's and it was the worst experience in several aspects. Our calamari appetizer was dark brown with dark brown grease on the plate. One bite and you could tell the grease needed to be changed out. I informed the waitress and five min later another server brings me the same exact calamari re-dipped in the same grease.  It was even worse. My mother ordered pizza and it came with half the ingredients she asked for. When the check came they charged me for two calamari apps and when I asked the waitress stated ""oh yeah I meant to take that off. Sorry"". She was anything but sincere.  It's really too bad because while I don't frequent chain restaurants, this one was an exception. Poor service, horrid food, and a half-ass apology just cost this restaurant several customers.",https://www.yelp.com/biz/bjs-restaurant-and-brewhouse-allen?start=60
Jeff D.,"Frisco, TX",17,32,27,1.0,11/19/2015,Had the chicken fried steak - not good.  It was dry and over cooked.  Service sucked.  Complained to manager but he said he was sorry but nothing else.  Most food items are $12+ so be prepared to spend $60 for family of 4. I will not return to another BJs based on this experience.,https://www.yelp.com/biz/bjs-restaurant-and-brewhouse-allen?start=60
Nicole S.,"Allen, TX",0,32,5,3.0,3/5/2017,"So so... if you are up for having ""chain food"" I suppose it's a good choice. Today I ordered their pizza smallest size, supreme. Honestly, I've made Stouffers in the toaster oven with better appeal. The crust was ""doughy"" and it was served on a little white plate. Maybe in a cast iron skillet would have looked more authentic. My son ordered Broccoli cheese soup in a bowl. We both had a Caesar salad. The salad was good, lettuce was fresh and I was pleased they used romaine lettuce since last time my Caesar salad was made with iceberg. Service was a little slow for not being very busy. Server was nice though. In fact, the server have always been very nice and aim to please at this location. Filled the void but just nothing outstanding.",https://www.yelp.com/biz/bjs-restaurant-and-brewhouse-allen?start=60
Barry B.,"Allen, TX",0,11,1,2.0,6/2/2016,"I haven't been going to BJ's because the food is good one time and bad the next.  I went this week for the first time in months.  I ordered fish tacos, the waiter assured me they were really good.  When they arrived it was like trying to bite thru cold canvas.  No a good experience",https://www.yelp.com/biz/bjs-restaurant-and-brewhouse-allen?start=60
Tina H.,"McKinney, TX",51,5,1,5.0,10/1/2016,"First time! And I don't know what I have been waiting for! Good drinks, good food, and excellent service! The server GiGi was very helpful and provided suggestions that turned out great! I will be back!",https://www.yelp.com/biz/bjs-restaurant-and-brewhouse-allen?start=80
Mileena D.,"Allen, TX",24,120,198,1.0,7/26/2014,"A few months back, I remember complaining to BJ's on their Facebook page about my experience. They deleted my comment.  Anywho, I came on a Friday night with a couple of friends. It took 20 minutes just for our waiter to finally approach our table. Then it took another 10 minutes to actually get our drinks to us. She didn't even bother taking our order... After waving her down, we  give her our orders. I don't think it takes close to an hour to get our food?  I must say, the food was great . However, our waitress barely came to check on us throughout the whole time we were there. She never even apologized or notified us of the long wait. We then asked her for dessert when we flagged her down again, and after 30 minutes of waiting again, she got our orders wrong. Whatever. She even seemed to have an attitude.  We spent more than 2 hours here, and we had terrible service, so we didn't bother giving her a tip since she was so bad. We walked outside the restaurant to chat a bit before we left, and before you know it the waitress chased us out to the parking lot to yell at us for not giving her a tip.. Really? How unprofessional . I understand that tips are a huge deal for waitresses as I used to waitress at 2 restaurants myself, but when you can't even serve us yourself ( I saw other servers come to us for help more than she did ) , you don't deserve a tip.. I always hesitate to come back because I never want to see her again",https://www.yelp.com/biz/bjs-restaurant-and-brewhouse-allen?start=80
April B.,"McKinney, TX",120,728,447,5.0,1/15/2016,Always good service and great food. Love the lunch specials. Pazookie is very addictive.  This is my daughters favorite place to eat.,https://www.yelp.com/biz/bjs-restaurant-and-brewhouse-allen?start=80
Arika C.,"Allen, TX",0,19,15,5.0,8/7/2016,Stopped in after back to school shopping and had a great experience. Our server Tim was attentive and the food was good. The manager stopped by the table at the end of the meal and our kids loved the triple chocolate pazookie. Glad we choose to eat here.,https://www.yelp.com/biz/bjs-restaurant-and-brewhouse-allen?start=80
Anj L.,"Irving, TX",321,392,472,3.0,6/17/2014,"We usually go to the Lewisville BJs, but my hubby wanted a beer before hitting the Allen Outlet, so I figured it would be the same. Definitely not. We (party of 4) ordered as soon as our drinks arrived. One tomato salad, Ahi Poke, and 2 flatbreads. And then we waited..  The tomato salad arrived... we watched her eat almost all of it. I had to ask for a refill, it was taking that long. I was really surprised. Now, if you have ever had Ahi Poke, it is served raw. No cooking needed. It took 25 minutes to receive it. That arrived with the 2 flatbread pizzas. Had to ask for plates. The saving grace was that the food was good.  I will stick to the Lewisville location.",https://www.yelp.com/biz/bjs-restaurant-and-brewhouse-allen?start=80
Charlie S.,"Melbourne, FL",64,118,131,4.0,11/18/2015,"Can't go wrong here. Huge menu with something for everybody and everything I have tried has been very good.  The service is always top notch and people are very friendly. The prices are reasonable and portion sizes are above average. The pizzas, sante fe salad, and Parmesan chicken I would highly recommend, for appetizers the ahi poke, and bruschetta are excellent. Full bar with craft beers and several TVs all over the restaurant.",https://www.yelp.com/biz/bjs-restaurant-and-brewhouse-allen?start=80
Mike W.,"Colorado Springs, CO",2,5,2,2.0,5/5/2016,This places kitchen has gone down hill.  Service was ok. Had a reservation for 8 still had to wait for table with 1/2 full restaurant. Server was great.  Ahi salad was terrible used to be great.  Beer the same but food sucked all around table.  Bummers :/,https://www.yelp.com/biz/bjs-restaurant-and-brewhouse-allen?start=80
Polly S.,"Little Elm, TX",215,238,352,4.0,7/4/2015,This place is nice. Bartender I think his name was Mike was really sweet (evening though it was about closing time.) he also asked me for ID lol so bonus points! Lols get the Tickled Pink its good if you dont like Absolut Vodka then not for you,https://www.yelp.com/biz/bjs-restaurant-and-brewhouse-allen?start=80
Danielle M.,"McKinney, TX",0,16,7,5.0,8/13/2016,My boyfriend and I have been really into Pokemon go & they put a stop inside of BJ's! It's made us go there more often at night to get appetizers and beer and just chill out and play for awhile. I get the watermelon feta salad and I'm absolutely obsessed! I also get the fried portobello mushrooms and those are equally as amazing. My boyfriend always gets himself a beer and a pizookie which makes him really happy. We have never had bad service thus far.,https://www.yelp.com/biz/bjs-restaurant-and-brewhouse-allen?start=80
Myia B.,"Dallas, TX",502,698,850,3.0,5/20/2014,"Came here on Sunday and decided to dine on the patio. There was a decent crowd but it quickly dwindled around 8:30pm.  David was our server and did an okay job of being friendly. I was hoping they'd have some type of reverse happy hour (even though I promise I don't drink ;p) but they didn't.  Tried the calamari (around $10) and it was nothing spectacular. It needed salt. The wind (which we miscalculated to be much calmer than it was) quickly chilled us and our appetizer which didn't help the fairly bland flavor of the dish. It was served with a pretty ""mayo-y"" aioli and a marinara sauce.  Tried the Mediterranean pan pizza (around $16) after being steered in the pizza direction by David upon contemplating between a pie and a burger. I ordered it with extra pesto. The dough was good. The toppings were ehhh. The peperoncinis could be replaced by onions or something else with bite on this pie. The Kalamata olives and the peppers were competing for flavor punch. The dough would have been even better had it not been so dry - even though I asked for a little extra pesto, I barely got any. I ended up requesting some on the side (it was brought out ice cold but was tasty and did the trick at wetting the thick dough). Tried a slice of the chicken bacon ranch pie and also filed it as ""okay."" The menu offers up a decent selection of different food items (wings, pasta, steak, ribs, burgers, salads, sandwiches, seafood dishes, pizzas, etc). I've tried the grilled chicken pasta before but wasn't impressed. The next time I venture in I'll try something else - their double burger. I'm not in a hurry though.",https://www.yelp.com/biz/bjs-restaurant-and-brewhouse-allen?start=80
Fernando M.,"Dallas, TX",12,16,10,1.0,6/5/2015,"A book full of food for a menu, half of which is beer - duh, it's a brewhouse... I was probably expecting a much better experience, but these franchises never fail when slammed with large crowds all at once (Allen High School's Class of 2015 just let out of Eagle Stadium). Our food was cold, unflavored, and well, what more can I say? Over-iced soft drinks meant flat soda pretty fast... Such a let down.  Will I give it another chance? Nooooo...",https://www.yelp.com/biz/bjs-restaurant-and-brewhouse-allen?start=80
Tiffany W.,"Lower Greenville, Dallas, TX",133,125,104,5.0,5/18/2015,"We came here on Saturday to celebrate my son getting his Black Belt, we had just left his test. Everyone from the hostess to the waiters to the manager was extremely helpful and service was stellar! Our food was great and we had a large party of 15. I appreciate them accomidating us with a large party and keeping service top notch!",https://www.yelp.com/biz/bjs-restaurant-and-brewhouse-allen?start=80
Amanda P.,"Killeen, TX",46,16,6,5.0,8/2/2015,"My husband loves the beer and I love the food. We tried BJs a while ago closer to where we live and it was horrible. We stopped here on the way home from a weekend with family. This place has changed my opinion of BJs. We had the potstickers, mahi mahi and shrimp and a black and blue house burger. Everything was so so so so good. My fav was the mahi mahi and shrimp.",https://www.yelp.com/biz/bjs-restaurant-and-brewhouse-allen?start=80
Christy V.,"McKinney, TX",26,12,,5.0,7/2/2016,"Great selection of craft beers, terrific food and awesome service! We have been to BJ's many times but Daniel has been our favorite server by far. Ask for Daniel, he will make sure you are taken care of!",https://www.yelp.com/biz/bjs-restaurant-and-brewhouse-allen?start=80
Bill N.,"Allen, TX",314,52,7,4.0,12/22/2016,We have eaten here many times but first review. My wife and I ate there last night. We had great service. We were seated immediately and our server was great. He listened well ( I also placed an order to go). I had the BBQ Brisket Burger. It was excellent. Cooked just exactly as I had asked. My wife got a club sandwich and she said that it may be the best club sandwich she ever ate. I should know because she orders them almost everywhere we go. BJ's food is usually good quality and they have a very diverse menu. BTW we order the queso and it was excellent also.,https://www.yelp.com/biz/bjs-restaurant-and-brewhouse-allen?start=80
Shelly N.,"McKinney, TX",15,15,5,5.0,6/20/2016,The root beer bbq ribs are amazing.  We hae been going there for years and always love everything we have.  The staff is very attentive and kind.  Pazooki desert is a must try.,https://www.yelp.com/biz/bjs-restaurant-and-brewhouse-allen?start=80
Kristen G.,"McKinney, TX",125,9,,5.0,2/26/2016,"This is my favorite BJ's in the area. All are great but this one has such a friendly and helpful staff. The food always comes out hot and fresh, the menu selection is large, and the prices are fair. The service is always fantastic. The bartenders know what they are doing. Alexis was our server and she was knowledgeable and high-energy. Great place to go. Highly recommend trying this one.",https://www.yelp.com/biz/bjs-restaurant-and-brewhouse-allen?start=80
Justin L.,"Metairie, LA",297,109,8,3.0,1/27/2015,"Man, I just wrote a three-star review 10 mins ago. This place is another stretch for a 3-star as well. We ordered the veggie egg rolls. Wow. Uh. So not impressed. I should warn you that any time I eat a Mexican-style-western-style egg rolls, it's pretty weak in general. Egg rolls are an Asian thing, not a white-man thing (usually). It's like buying a Pitt bull but getting a rat terrier in strength.Yeah, both are loveable dogs but that's about it in similarity. The  fried calamari appetizer was pretty decent. I mean, its a fried food. Just b/c you are in the south doesn't make you an expert, but the batter was decent and the calamari was pretty fresh. However, it is a franchise so how good can you really make it?  Then we ordered the Mediterranean pizza (deep dish, large). Decent pizza; crust similar to that of Pizza Hut's (PH) pan pizza. Although PH is cheap, it's so much more delish...b/c it's cheap. But if I'm paying $25 for a large, i rather take my money and go to Whole Foods. They have some legit pizza, and it's a Grocery store.  So if you care about ambiance and a bar, they make strong drinks and it does look nice. But if you come here for food (Tuesday night), it's at par at best.",https://www.yelp.com/biz/bjs-restaurant-and-brewhouse-allen?start=80
Scott M.,"Aubrey, TX",16,59,19,5.0,6/17/2016,"So grateful for Kevin and his team at BJ's. My wife and I always have a great time when we come here for dinner with our son. It's like our go-to spot to eat out. This last week we had a very uncharacteristic experience that wasn't at all like the service that we have enjoyed on countless other occasions.  Leaving us feeling kind of sad. But Kevin runs a tight ship, and went above and beyond to make sure that the situation was corrected. We were once again convinced that BJ's is still the restaurant we know and love. Highly recommend!!! Even if you're not hungry, you MUST get a pizookie! There is always room for a giant cookie with ice cream. :)",https://www.yelp.com/biz/bjs-restaurant-and-brewhouse-allen?start=80
Kelly T.,"McKinney, TX",70,220,14,2.0,12/24/2015,"I can't remember the food being stellar but it was passable for a chain. In a recent return the burger I had was super creamy and greasy. I tried to scrape off some of the mayo/sauce to make it edible, but in the end left most of it. Won't be returning for some time.  Everything we had was just way over seasoned or greasy.",https://www.yelp.com/biz/bjs-restaurant-and-brewhouse-allen?start=80
John P.,"Bloomington, IL",144,79,377,3.0,1/10/2015,"Very long wait, very average food, high price for the average quality food. I doubt I'll be back to this place. Not impressed. Too many better options around town!!!!",https://www.yelp.com/biz/bjs-restaurant-and-brewhouse-allen?start=100
Rochelle C.,"McKinney, TX",71,129,98,4.0,11/30/2014,"Great chicken club sandwich (the garlic mayo ties it all together) but the skinny fries weren't edible once they cooled down. Great double deluxe burger too and really good service too. I just don't understand  why restaurants make kids' grilled cheese sandwiches with cheddar? $5.50 for a glass of milk and some grapes that were eaten from the other fruit served from the daughter's meal. The peanut butter s'mores Pizookie was mind-blowing! I honestly couldn't have cared less about the vanilla bean ice cream melting on top! Carmelized marshmallows on top of Godiva chocolate on top of a peanut bitter cookie? Yes, please!!",https://www.yelp.com/biz/bjs-restaurant-and-brewhouse-allen?start=100
Audrey L.,"McKinney, TX",4,5,1,3.0,3/13/2016,"The food is really good, the staff is really nice, the decor is nice, it's not really loud, the bar is really cool! But it takes FOREVER for your food to come out. It tasted good (the horse radish wasn't spicy, it was really sweet, which is weird) But don't come here if you're short on time! The pizookies are really good too! But they take a long time to come out too.",https://www.yelp.com/biz/bjs-restaurant-and-brewhouse-allen?start=100
Jack L.,"Greenville, SC",22,537,343,3.0,2/5/2015,"I have to go to Texas for corporate meetings about three times a year, and at least once per year, our large group of people (about 50) goes to BJ's. This was the first one I ever went to, and I enjoyed myself. The beers are decent, but not the best in the world. The food is average and doesn't always seem to be fresh. Service has always been a bit slow, whether we have a large group or just a group of 4. The flatbread pizzas are probably the thing on the menu. I also had some Moroccan chicken that was pretty good, but everything else I have had has been completely average to subpar. With all of that being said, I always enjoy myself when I go here, so I keep going back whether mandated by the suits in corporate or not.",https://www.yelp.com/biz/bjs-restaurant-and-brewhouse-allen?start=100
Michael W.,"McKinney, TX",143,13,8,3.0,12/7/2014,"This was our first time to eat at BJ's. A little word to the wise, if you are an indecisive person this place isn't for you. There is no theme here. There is Italian food, Mediterranean food, Burgers, steak and potatoes, Fish and even clam chowder in a bread bowl! I had a Jalapeño burger, which was delicious! I ordered it Medium and it was perfect! Being a Sunday afternoon, it was pretty busy. The service overall was pretty good, but I had to be on the lookout for my waitperson a time or two. The atmosphere was great. Lots of energy. Plus, there were plenty of screens to watch some football! BTW, they have a large variety of beers, especially local brews. I LOVED the Revolver Blood & Honey. If I was to compare it to a more popular beer, it would be Shock Top. My wife enjoyed her Chicken Alfredo and my 2 year old, Maximus, loved his Sliders.",https://www.yelp.com/biz/bjs-restaurant-and-brewhouse-allen?start=100
Katie R.,"Frisco, TX",199,312,645,4.0,6/4/2013,"The avocado spring rolls are delicious. That may be all that you need to know. Oh, and they brew their own beers, so be sure to try those out! The service is typical bar/restaurant. Bar area is seat yourself, which is what we chose at a high top table. Their appetizer platter is only $17 and came with a lot of food! I was expecting perhaps 2 egg rolls, 2 -4 cheesesticks, etc. but those numbers were doubled! Such a good price for the quantity - without suffering quality.  Lots of TVs so there's always a game to watch or something to catch while you're there.  And I know from previous experience that you should try the pizookie.  Also, they have a loyalty/points club. You can sign up with the KEYRING app on iphone or android.",https://www.yelp.com/biz/bjs-restaurant-and-brewhouse-allen?start=100
Damon B.,"Arlington, TX",541,287,77,3.0,9/16/2014,"OK, this is a first.  Normally when I go to BJs it's not during lunch time (no beer for me today), so it's nice to go during the day.  We had 5 in our party and 2 had the beef dip, 1 had the chicken Caesars salad, 1 had the lunch bbq platter, and I had the California chicken club. The club was ok, not great.  The chicken had no flavor and the sandwich was dry.  I asked for a side of mayo, hoping it would have been the roasted garlic mayo that came in the sandwich (which if it did, I did not taste it) and here comes regular mayo (dang IT). It did little to add any flavor.  The avocado was real soft and I thought it was guacamole (I even looked).  The skinny fries are a nice touch, but next time, wedge cut fries.  The club that I am used to has three slices of bread.  This sucker had two thick pieces which added to the blandness and dryness of the sandwich.  Will not order that again. The service was good, and the tea and waters we had were refilled.  Too bad I could not order a beer...and maybe the beer has always helped when tasting the food... Stay hungry me friends...",https://www.yelp.com/biz/bjs-restaurant-and-brewhouse-allen?start=100
Robin L.,"Kingwood, Houston, TX",19,67,57,3.0,3/1/2016,"stopped in while visiting some friends in the area. Not bad, but in the same vein as Applebee's, etc. Good for the prices, but don't get too excited if its not all that. Good value for the prices.",https://www.yelp.com/biz/bjs-restaurant-and-brewhouse-allen?start=100
Ronnie S.,"Lawrenceville, GA",276,71,39,5.0,11/25/2015,"BJ's is an excellent resturant to go as a group. My first experience was amazing! The waitress was nice and explained the menu very well. We ordered the 24"" chicken bacon ranch deep dish pizza. It tasted very good and well worth $24.95 which we split. Along with that we also ordered the white chocolate macadamia nut pizookie. What a great way to end the night off with.",https://www.yelp.com/biz/bjs-restaurant-and-brewhouse-allen?start=100
