Username,location,friend_count,review_count,photo_count,rating,date,review,Url
Bill P.,"Dallas, TX",1,65,,4.0,10/18/2014,"Nice ""brew house"" atmosphere- really good menu that doesn't challenge the staff too  much. It's hard to knock a chain when they actually deliver on a consistent basis, been to several and they always seem to get it right. Always a line at dinner time so I hit the bar, there's always some sports on the TV but not so many TV's that you feel like you're in a sports bar. The place is kept nice and clean, have some decent ""home brews"" too as well as a decent wine selection and full bar.  Once again, these places are usually in the 'burbs so there's not a whole lotta competition.",https://www.yelp.com/biz/bjs-restaurant-and-brewhouse-allen?start=140
Don C.,"Dallas, TX",4,1,,1.0,1/25/2015,Went to have dinner with my wife and kid. I arrived early and was seated in a booth to wait for my family. After about 5 minutes not a single person had come by to say hello or even ask what I was doing.  A family of 3 came in shortly thereafter and was seated 2 booths down.  A server immediately came and greeted them and took their order.  I watched as he went and got their drinks and came back and took their order.  Still to this point not a single person even acknowledged my presence.  so I went to the hostess and asked to speak with a manager.  she turned and pointed to the bar at a man and went and told him I would like to speak with him.  He looked at me and turned and walked into the back and sent out another manager.  If the manager of the store wont even acknowledge your presence why should the staff?  I wont state the obvious but I will NEVER go there again.,https://www.yelp.com/biz/bjs-restaurant-and-brewhouse-allen?start=140
Luis H.,"McKinney, TX",160,7,3,2.0,4/27/2015,Went here on a Sunday night pretty busy waiter Tom Tom ? Was rushing us all night as previously stated no theme here they have a variety of everything hard to make a decision so I went with good ole bacon cheeseburger and thin and crispy fries I'll tell you those fries were thin and crispy and stale the burger halfway through the meat was dry whatever not my night my fiancée's dish was Parmesan crusted chicken really good ! We got the cream sodas for grand total of 51.47 now here's the funny part our server who was rushing us all night couldn't even get our check on time we told him we had to leave by a certain time gave him 15 minute notice in grand total took him 17 minutes,https://www.yelp.com/biz/bjs-restaurant-and-brewhouse-allen?start=140
Brent B.,"McKinney, TX",100,107,,5.0,10/28/2012,"My wife and I went here last night.  The place was crowded.  On a Saturday, that can be expected when you arrive after 5:30. For appetizers, we had the avocado spring rolls.  There were six of them and they were excellent.  With the spring rolls, they have the hot mustard and sweet/sour sauce that you can dip them in. From there, I had maui fish tacos and my wife had a vegetarian pizza.  I also had a small side salad with the fish tacos.  There were only two fish tacos so I would not necessarily say that I left full. Because I did not leave full, we were talked into a dessert that was a heated berry affair with two scoops of vanilla ice cream that was unreal.  It was very very good.  It has been so long since I have had any hot dessert ice creams. I think this is our favorite restaurant and don't forget they have a variety of beers.",https://www.yelp.com/biz/bjs-restaurant-and-brewhouse-allen?start=140
Leslie W.,"Sugar Land, TX",1,18,,2.0,3/14/2015,"Service was poor, food was adequate, and it felt like the longest meal ever.  Won't be back",https://www.yelp.com/biz/bjs-restaurant-and-brewhouse-allen?start=140
Shari J.,"Irving, TX",0,4,,1.0,9/1/2015,"Went to the Allen location yesterday with a co-worker for happy hour.  We have a few happy hour items, drinks and then get the bill. My co-worker has the mobile app that allows payment etc.. So after the bill is split between food on one tab and drinks on the other ($12.99 food and $16.99 drinks), I give my card to pay the food tab which I agreed to pay. The server swipes my card and brings back the slips for me to complete the sale. She takes the competed bill I've tipped and signed for and my co-worker stated that they've already paid their check on the mobile app. The server stated that she had to look for the mobile app transaction because she could not see it as competed on her end. She goes back to the computer and brings ME back the check I'VE already had my card swiped for and says that the check paid on the mobile app HAD PAID THE CHECK MY CARD WAS SWIPED FOR and closed the ticket..... So the higher bill was unpaid. Huh? I was  confused as to how another payment was allowed to be processed and closed out on the same ticket whilst another payment was still processing. I also did not understand how she couldn't find the payment from my co-worker but all of a sudden it was closed out and off of her computer. The server said she wasn't sure because of visibility on the mobile app being private. So I was assured that the payment swiped on my card would not process so I paid the $16.99 tab. The manager came over and gave about just as poor of an explanation as the server did of why the mobile app allowed two payments to process on one check but allowed the mobile app to pay and close out the wrong ticket completely. How do you not have any knowledge of the app related to services within your establishment works? Well after the server hands me back the original ticket I thought I was paying for and says that it won't go through because she didn't close the ticket out I am a little peeved because that is not the case. Both transactions were processed on my card... Even though supposedly one check had already been closed out on the app. So I do a little research on the app and see that it allows the person to split the check, pay for whatever they want or NOT pay whatever they want. My co-worker stated that they paid the balance that was left after my card was swiped..Interesting....that would mean the balance would've been $16.99.  So there's a red flag. Where is the disconnect between the mobile app and the restaurant's financial / reimbursement process? How does the app allow a patron to control the closing out of payments? Isn't that the servers job?  BJ's in Allen  Tx owes me an explanation because I'm furious. It's not the difference in bill totals that is my issue; it's the principle and lack of accountability by the staff. Not to mention the mobile app allowing the account holder to divide the check between anyone ordering on the same ticket to their liking/advantage  and giving them the ability to give the illusion that they've divided fairly but actually allows manipulation of the system that has now created a bad taste in my mouth with the restaurant and a suspicion of dishonest behavior from my co-worker. I'm going to contact the technical support for that mobile app and see if I can get my questions answered. I'm sure they have visibilty to transactions that are linked to table or ticket numbers especially when a 20% discount from the app was applied to the sale. What if a stolen credit card was used under a fake profile to pay for a check on their app? I'm going to also write a formal complaint to their corporate office for the lack of training and inability to correct the situation or truly show that they understood their app process in the first place. No app should allow the closing of sale by a patron until all payments have processed accordingly or allow another method of payment to be allowed to process on the same tab simultaneously when there is already a payment still in pending status that has not been cancelled by the MOD. I just want a true explanation and accountability; from all involved if the arrows point in my co-workers direction as well. I am EXTREMELY angry with this situation.",https://www.yelp.com/biz/bjs-restaurant-and-brewhouse-allen?start=140
Melody T.,"Las Colinas, TX",608,639,2758,5.0,8/23/2012,Love this place! Super clean and I always sit at the bar. I love the late night happy hour which is sunday-Thursday's from 9 till close! It's super good. The bartender always remembers me!!! And always check out the small bites menu! The ma and cheese is worth every bite!!,https://www.yelp.com/biz/bjs-restaurant-and-brewhouse-allen?start=140
Loni H.,"Allen, TX",19,13,1,2.0,6/2/2015,"I really came here with a friend to have dinner and a pazookie for dessert.   However, service was dismal.  We ordered sliders with wedge fries; spring rolls; and water.  My friend emptied her water and it took forever to get a refill, so she just asked for a second glass.  It took forever for our food to arrive and when it did the spring rolls were soggy and barely warm; the sliders were warm not piping hot; and the delay was because they were still cooking fries.  The spring rolls were inedible, so we sent them back.  By this time, my friend was tired of waiting and now not in the mood for any food or the long wait to follow.  My fries arrived at the table and were the only thing piping hot.  We had trouble getting refills on water and it took forever to get the check.  A manager did stop by to apologize.   I skipped the pazookie because it was clear that neither the kitchen staff nor our waiter were on the ball on this night.",https://www.yelp.com/biz/bjs-restaurant-and-brewhouse-allen?start=140
Christina M.,"Karnes City, TX",0,4,,5.0,12/28/2015,"Love this place, the food is great! Fish tacos, California chicken club and the salted caramel pizookie are my favs.  Our waitress Samantha was amazing and super friendly, she recommended the pizookie and I'm sure glad I tried it, it was to die for.  First time bringing my dad to try it and he loved it, plenty of options for every taste bud.  He really loved the California chicken club with the super good toast as the bun and he kept saying how good the fries were.",https://www.yelp.com/biz/bjs-restaurant-and-brewhouse-allen?start=140
Raza G.,"Munich, Germany",1,1,,4.0,12/1/2013,"This place is excellent if you just want to have a laid back time and relax. The outside sitting is very comfy and homely as well. They have a good beer menu and the bar area is quite good.  Prices are reasonable as well and the service is great. If you are looking for a decent beer + hangout place, this is it.",https://www.yelp.com/biz/bjs-restaurant-and-brewhouse-allen?start=140
Brian G.,"Fairview, TX",0,10,,5.0,5/30/2015,Definitely my favorite restaurant! Tremendous beer variety at great prices. Huge food selection between $10 & &18. Fabulous service.,https://www.yelp.com/biz/bjs-restaurant-and-brewhouse-allen?start=140
Brad N.,"Frisco, TX",486,1057,234,4.0,12/21/2010,"We visited this location for the first time after the Texas Stampede Rodeo at the Allen Event Center (great show, BTW). We had a friend who had flown in from out of town, and we wanted to get some decent eats if possible at this late hour.  It was quickly obvious that they served a limited menu after midnight, and we were very apprehensive to the point of almost leaving, but there aren't that many alternatives in this area, so we stuck it out. They were still serving their always outstanding pizzas plus ""anything fried"", so we chose some buffalo wings and pizzas; all were delicious and cooked to perfection. The pizza had a crisp crust and fresh ingredients, and while the wings could have used some more heat, they did have a good flavor. My Blue Moon beer went down nice and cold, and all in all, we did have a decent experience here despite the limited menu.  I know some will complain about the prices, but I'd rather pay more for good food than less for crappy food. I've never had crappy food at BJ's.",https://www.yelp.com/biz/bjs-restaurant-and-brewhouse-allen?start=140
Jim M.,"McKinney, TX",25,85,2,4.0,7/18/2012,"Have gone to this location with a small group and a large group - always have been seated very quickly.  Lots of options on the menu from beer to burgers to salads to steaks - just a great selection of food. Love the appetizers - chicken pot stickers, nachos and sliders - yummy. Love the beer - normally get the blonde but enjoyed the pale ale and jermiah red.",https://www.yelp.com/biz/bjs-restaurant-and-brewhouse-allen?start=140
Jennifer H.,"Frisco, TX",0,1,,1.0,11/7/2015,Saturday afternoon lunch. Understaffed. Poor waitress at the bar working hard with no help.  Food can out cold for us and others. Don't recommend!,https://www.yelp.com/biz/bjs-restaurant-and-brewhouse-allen?start=140
Dylan T.,"North Dallas, Dallas, TX",0,2,,1.0,4/24/2015,Absolutely terrible service at the bar. Lisa (I think that's what her name was she never told me had to ask) was to busy doing her closing side work and talking to her coworkers to refill water and even ask us if we wanted to order food. Once she got me my first beer she never said one word to me again. And once I paid out not a thank you or a have a nice night just gave me he credit card receipt and walked away.,https://www.yelp.com/biz/bjs-restaurant-and-brewhouse-allen?start=140
Karen L.,"Dallas, TX",385,505,3058,3.0,8/28/2012,"Good food. Average service. They're always busy and the servers tend to forget to check up on you. If you plan to go on the weekends for dinner, expect long lines. Pizza is always a good choice. Salads are huge. Cajun pasta is delectable. Ribs are juicy and tender. Beer is refreshing. Definitely worth trying!",https://www.yelp.com/biz/bjs-restaurant-and-brewhouse-allen?start=160
Chassity F.,"Howe, TX",16,48,9,4.0,1/21/2012,"It has its good and bad. I went for the first time with a group of 8 on a Friday night. We had an hour wait and it was no big deal. We lost track of time so i asked the hostess how long was left and this was her reply ""We quoted you 1 hour and its ONLY been EXACTLY 53 minutes so hopefully within 10 minutes."" I asked nicely so I did NOT need attitude. A few minutes later they tell us our table is ready but we would have to site at two different tables. This was a female manager tell us that our group could sit at 2 half circle booths next two each other. Why would we go out as a group to sit separate? This was annoying! Finally we got a table! Server: I do not remember his name sadly but he was great with our group. Drinks: All the drinks we had were great! Our favorites were the Irish Root beer, Strawberry Patch, A Drink Like That (yes that's the name), Throw Back Cherry Cola, house Margarita. Food: Great! Large portions and yummy. I had BBQ pulled pork Sanchez and most of the people had burgers. I also had dessert. The baked bengiet. Almost as good as in New Orleans.  Overall I will go back and hope that management and hostess are not as rude.",https://www.yelp.com/biz/bjs-restaurant-and-brewhouse-allen?start=160
Shariq A.,"Allen, TX",2,60,,2.0,5/10/2015,This place has gone downhill.  Filthy restaurant with mediocre food.  The 2 stars is for the exceptional service.  Will not be back and very sad about it!,https://www.yelp.com/biz/bjs-restaurant-and-brewhouse-allen?start=160
Joe S.,"Allen, TX",0,1,,2.0,7/31/2015,"The place was very busy on a Thursday night but we were seated quickly. Service was slow, beer was great, food was lukewarm and tasteless. I do not think I will go back.",https://www.yelp.com/biz/bjs-restaurant-and-brewhouse-allen?start=160
Jazmine D.,"Allen, TX",1,14,4,3.0,12/12/2014,"Ordered take out. The service was prompt and fast so that's mainly where the three stars come from. However, the jambalaya was waaay too salty. Cajun is supposed to be spicy, not salty.",https://www.yelp.com/biz/bjs-restaurant-and-brewhouse-allen?start=160
Deborah K.,"Richardson, TX",242,127,31,4.0,9/5/2011,"How lucky am I to be able to enjoy a nice dinner out on the patio with the boyfriend and family when the Tejas heat finally cools down! Perfecto weather!  I'm sure we all know BJ's is known for their pizza and brewery which is exactly what we decided to get along with a few other pasta dishes and what not.  Now if you're wondering about a particular dish I'm sure other reviews will provide. All I'm here to do is talk about the red velvet pazookie. When the hell did they start making this and where the hell was I during this glorious birth of such a lovely creation?!?!  Anyway, aside from the always good chocolate chip pazookie the red velvet definitely made a statement. It's exactly how it sounds. Red velvet cake in the form of a cookie, cooked for 6 minutes with a scoop of vanilla ice cream on top. Cant get any better than that folks! *happy dance* from me!!! Hallelujah I've found another damn good dessert. Booyahhhhhh!!!",https://www.yelp.com/biz/bjs-restaurant-and-brewhouse-allen?start=160
Lena L.,"McKinney, TX",31,16,9,1.0,4/21/2013,This place sucks! Food comes out raw after waiting 30 min for a burger? Never Again!,https://www.yelp.com/biz/bjs-restaurant-and-brewhouse-allen?start=160
Alex S.,"Frisco, TX",302,293,,4.0,8/25/2011,"If you've never been through the shopping center this location rests in, do yourself a favor and give yourself 15 minutes more time than you think you need to find the place.  You can see it with no trouble from 75 and you'll probably be able to get to it easily... you'll more than likely be stuck behind other drivers not sure of where they're going or what they're looking for since literally every business that has ever existed is within a two-mile radius of this shopping center and you can be sure you'll be stuck behind the guy doing a whopping 5 mph looking for the antique lamp store.  But once you get there, then you have to find parking since this BJ's does a phenomenal amount of business after 6:00 p.m. You'll come in through a revolving door and be in a small waiting room for the crowds that are usually generated - they have benches outside for overflow but if it's a typical day of Texas-style heat, you may be better off finding any standing room you can inside.  The front desk staff has always been attentive and quick to meet your requests if you ask ahead of time (read: if you want to sit in a booth, ask when you put your name in, not when they take you to a table and then you blame them for your own lack of planning).  Speaking of which, one thing you may want to take advantage of is their wait list phone-ahead offer - I believe if you call them before driving out there in the evening, they'll add your name to the wait list upon receiving your call so when you arrive, the wait time is minimal.  And even if it is long, another waiter/waitress can be seen walking through the waiting area with free samples of pizza for customers who have not yet been seated.  Bonus! The place is packed on a regular basis, usually with Allen families, visiting shoppers or folks getting together for whatever random occasion they feel like celebrating then and there.  I always make a beeline for the bar area because not only is it self-seating, but it's elevated above the rest of the place, giving you a great view of two other dining rooms that look like controlled chaos.  There's a number of booths up there and some high-top tables, along with a fairly expansive bar that seats more than you'd initially think when you first see it. A number of ex-Cheesecake Factory executives have made the transition to BJ's in recent years and the food selection shows.  The menu is vast to the point where if you can't find something you want to eat across its many pages, either you were reading it upside down or you decided to declare war on food.  And because it's a brewery, you can be sure they take special pride in their handcrafted beers, which you will hear about when you sit down through the pre-programmed delivery of the host/hostess.  Stick with the Jeremiah Red if you want one of their own, otherwise browse the pages and enjoy some lesser-seen selections (Ugly Pug!). Back to the food, though: it's easy to get overwhelmed by the selections.  Come for lunch and enjoy their special lunch deals (that lunch chicken parmesan is an essential meal).  Split a large pizza with your group (just stay away from the bacon cheeseburger pizza - in the ""mini"" size, I'm pretty sure it's lethal; in a ""large"" size, I'm sure it's illegal to serve).  Chow down on a number of teriyaki dishes, munch on their sandwiches (French dip for the win) and then save room for their famous Pizookie desserts, which sounds like a crime against humanity a la Dr. Frankenstein (what with the blending of ""pizza"" and ""cookie"" into one very holy union) but in reality is a gift from heaven above.  Just be sure and avoid the overly chocolate one and go off the beaten path with a peanut butter cookie in your selection. There's televisions lined throughout the place but if you're expecting to really get engrained in a game, stick to the bar.  The other dining rooms get too crowded for their own good and you don't always have the best view of the TV you're looking for. Plan ahead, get their early, sit in the bar and repeat.",https://www.yelp.com/biz/bjs-restaurant-and-brewhouse-allen?start=160
Dallas F.,"Dallas, TX",0,5,1,1.0,12/21/2015,"Truly enjoy certain items on this menu or had before. We called ahead of time and got sat promptly, which was great! We were able to semi-customize our order, which was good. The pita tacos weren't as great tasting as they once had been, this time around. It was my father bday so a few of us got steaks. Unfortunately, the girl that served our food took some plates without asking if we were done. Which had my toddlers muffin on it. This was disappointing and rude if you want to call it serving. Always ask first! Like last time we came we waited 25+ mins for our food. This was VERY crappy, considering we had movie tickets. Which we had to trade for another day and time, while waiting. Mind you this is still my father bday, so we asked about a bday dessert. He ordered one, then the server said they were out of that kind. So he ordered another kind and then we waited another 20 mins. Really??? What crap! As we were leaving, after paying over an $90 dollar bill with tip. I mentioned to the server we never got the damn bday dessert. She said hold while she gets it Togo. Then she came back and said unfortunately it went to another table. If we waited another 2 mins she could get it to go. That was it! 2 mins to get it after 20 mins of waiting and 90$ later? This place and service is a joke. My dad was so let down. I spoke to the manager and all he could say was he was sorry. Really? If you were truly sorry, you would comp our meal or offer something for our second terrible experience. I mean no dessert and no movie for my father b/c of the crappy service. The owner of this place should be ashamed of himself and his investment.",https://www.yelp.com/biz/bjs-restaurant-and-brewhouse-allen?start=160
Lashuna J.,"McKinney, TX",14,27,5,2.0,2/21/2014,I ordered the vegetarian hand tossed pizza and I swear Chuck E Cheese pizza tastes better. I forced myself to eat it.. Would have done better jst ordering Dominoes,https://www.yelp.com/biz/bjs-restaurant-and-brewhouse-allen?start=160
Eric H.,"Allen, TX",8,12,,4.0,5/29/2014,"The deep dish pizza I had was delicious. Service was great and the setting was enjoyable. Nice and up to date flat screen televisions and if there is a particular channel you would like to view, they were willing to change the channel without any hassle. Prices were reasonable depending on what you ordered. Very tasty desserts.",https://www.yelp.com/biz/bjs-restaurant-and-brewhouse-allen?start=160
Lindsay P.,"Rancho Santa Margarita, CA",427,67,8,5.0,1/31/2014,"My husband and I went there with our son. They brought my son's food out with the drinks, which I was very impressed with. He loved the food too. We had the Cajun pasta, avocado egg rolls and turkey burger. Everything was very delicious. The waitress was extremely prompt and such a great server. A little pricey but honestly worth every penny.",https://www.yelp.com/biz/bjs-restaurant-and-brewhouse-allen?start=160
Lianne K.,"McKinney, TX",0,2,,3.0,3/15/2014,"The food was amazing but the service was awful! Not only did they not have our reservation ready, they also didn't even get the number of chairs right and our MORP group had to split into 3 tables.",https://www.yelp.com/biz/bjs-restaurant-and-brewhouse-allen?start=160
A L.,"Highland Park, Dallas, TX",405,152,39,1.0,9/1/2013,"The food was overwhelmingly underwhelmingly..yuck i spent 53 dollars on this I was so ticked..We tried appetizers,we tried entrees chicken,burgers,pizza..Oh my gosh it is just awful..Guys rethink your cooks,rethink the menus do something I have tried this location now twice/I sure do dislike dishing bad reviews but this is very necessary..Eeeks!",https://www.yelp.com/biz/bjs-restaurant-and-brewhouse-allen?start=160
Elaine A.,"Allen, TX",8,96,,5.0,3/9/2013,"Possibly one of my favorite restaurants.  their deep dish pizza is sooo good, I hate to say that I fantasize about it sometimes.  otherwise, their appetizers are excellent, and their desserts and stupid good... [PIZOOKIE - I want to make love to you].",https://www.yelp.com/biz/bjs-restaurant-and-brewhouse-allen?start=160
