Username,location,friend_count,review_count,photo_count,rating,date,review,Url
Jay S.,"Orange Park, FL",75,216,466,4.0,3/30/2011,"We are HUGE fans of the Cheesecake factory and this was probably the best tasting meal I have ever had in a branch of this chain. Strong and potent long island iced tea for beginners, then moved onto  the BLT salad with big chucks of blue cheese and tasty bacon,beautifully split in two for Dane and I to share. Being from New Orleans I had to have the Louisiana Pasta that was perfect and just what I wanted this evening....a cajun inspired mildly spicy cream sauce and bow tie pasta served with about three breaded,hot and juicy chicken breast on top...absolutely delicious! Finished with their new Mango Macaroon Key Lime cheesecake that melted in our mouths. Fantastic meal all around and the best thing, the place is open till 11PM and we didn't even have to wait for a table! WOW, that is unheard of our in California where no matter what night you go, expect to wait at least an hour!",https://www.yelp.com/biz/the-cheesecake-factory-tulsa?start=80
Joyce D.,"Tulsa, OK",240,257,629,4.0,1/8/2009,"Finally a Cheesecake Factory in Tulsa.  I finally made the visit to Tulsa's Cheesecake Factory.  I had it in other parts of the country and always knew one would go over well here.  Cheesecake Factory has a colorful menu and I always have such a hard time deciding what to eat here.  I get something different every time and still get confused on what I want.   In the past I have got the lemonades they make here and they kick ass.  The meatloaf is fantastic.  The Chicken and Biscuits are good.  The pastas all rock and the Asian salad is great as well.  This time I ordered the Cuban Sandwich, my sister got some chopped salad, and my girlfriend ordered the Pasta Carbonara.  And of course I had to get some cheesecake.  I split a slice of Snickers Chunks and Cheese Cake. Cuban Sandwich-  This was all around pretty terrific other than the bottom of the sandwich being a bit soggy.  I have had better cuban sandwiches but this one hit the spot.  The fries here are out of this world. Pasta Carbonara-  This got better the deeper into the dish you got.  I think more of the flavors came out after the top was gone.  Very good though. Snickers Chunks and Cheesecake-  One thing you need to know about Cheesecake Factory is, they do cheesecake right!  And when you see the extensive list of cheesecakes to choose from your head might just explode.  The Snickers and cheesecake combo was sinful and made me cry.  DAMN GOOD!",https://www.yelp.com/biz/the-cheesecake-factory-tulsa?start=80
Dana S.,"Juneau, AK",1,97,4,5.0,8/4/2009,"I love this restaurant!  Fantastic selection, excellent food quality, good service, big portion sizes, decent prices, wonderful cheesecake, you can't go wrong.  I wish we had one of these where I live.  I got an appetizer for my main meal and didn't even finish it, then got some cheesecake and didn't finish it either, so I had plenty left over which is cool.",https://www.yelp.com/biz/the-cheesecake-factory-tulsa?start=120
Ken H.,"Tulsa, OK",10,83,,3.0,6/19/2008,"A huge menu -- I mean the selection is awesome -- and great food presentation.  Too bad the food itself doesn't quite live up to the reputation as often as not.  The serving sizes are far more than the average person can eat, so plan to take some home -- you definitely are paying for it!  The tab at Cheesecake Factory always manages to be considerably more than you had planned to spend.  Great decor.  Loud.  Busy.  Over-rated.",https://www.yelp.com/biz/the-cheesecake-factory-tulsa?start=120
cyndee m.,"Tulsa, OK",1,44,,3.0,3/10/2009,"i love the food! i dislike the service, the wait to be seated, the loudness, the crowd, trying to park, the hike to the door after i park and i don't know why the $ was only marked 2x- if you get an appetizer and a meal with drink (and I'm not talking alcoholic beverage either)and cheesecake to go~ because your too full to eat it there. did i mention HUGE portions?  it's and easy hundred dollar outing.  i still love the food! :)",https://www.yelp.com/biz/the-cheesecake-factory-tulsa?start=120
