,Username,location,friend_count,review_count,photo_count,rating,date,review,Url,roll25,roll100,roll250,special_25,Final_Rating
59,Joe R.,"Quincy, MA",16,20,7.0,2.0,2016-07-27,"I would avoid this restaurant. I went in with my mother for a simple lunch. It took a few minutes for someone to greet us at the door and seat us. Then several minutes for our server to show up. We then waited approximately 30 minutes just to receive our drinks. When the food came (well, most of it), they brought the wrong food and forgot the soup. I had ordered a lunch combo and they didn't put it in as a combo. They gave me the mac an cheese but didn't put the chicken with it as I requested. My mom ordered the onion soup as did I. She got her soup right away, but mine didn't come until we were done with everything else. I should note that the place wasn't too busy and the server didn't seem too concerned with the speed of everything. I was hoping this place would be good since it's so close to my house, but I won't be returning.",https://www.yelp.com/biz/applebees-neighborhood-grill-and-bar-dorchester-3,2.6,2.6,2.6,1.6400000000000001,2.6
13,dajian x.,"North Andover, MA",6,140,1.0,1.0,2016-08-18,"I made a mistake on reading a hand written sign.  I asked the waiter who called a manager and corrected me.  The waiter disappeared.  I waited and waited.  Finally, I went to the bar and asked for a waitperson. I waited and ordered with my son.  For an appetizer, we ordered chicken wings.  The waitperson disappeared.  After over 1/2 an hour we left. On the way out my son told me the manager said to take their time serving me, Hearing this I would give this place minus 10.",https://www.yelp.com/biz/applebees-neighborhood-grill-and-bar-dorchester-3?start=20,2.6,2.6,2.6,1.5080000000000002,2.6
11,Maggie S.,"Boston, MA",0,8,,2.0,2016-08-26,"Eh. Id come here to get a beer/glass of wine and belly up to the bar but not much else.  I walked in and sat at the bar and ordered a house margarita. The bartender Kellee was incredibly nice and service was quick. She kept the bar clean and did a great job. That being said - the margarita was terrible. Not her fault but I couldn't even finish it. I ordered a tall glass of wine instead and got a great pour.  Ordered a few apps and was pretty disappointed in the size, presentation and taste of the food. The pretzels were falling off the plate, only got 5 tiny shrimp tossed haphazardly on the plate and just didn't taste all that great. I really wanted to enjoy this because the bartender was so good. I wish they'd fix the food because they have the potential. I'll be back for Kellee and a glass of wine but not much else.",https://www.yelp.com/biz/applebees-neighborhood-grill-and-bar-dorchester-3?start=20,2.56,2.56,2.56,1.608,2.56
9,Neese P.,"Boston, MA",123,2,1.0,1.0,2016-08-26,The worst restaurant I've ever been to. Employees were unorganized and took forever to seat us when the restaurant wasn't busy at all. It took over 20 minutes just for a waitress to take our order for drinks!!!! I counted over 20 employees and half of them were slacking off doing nothing. I will never come here again I'm so disappointed I didnt even stay for food!!,https://www.yelp.com/biz/applebees-neighborhood-grill-and-bar-dorchester-3?start=20,2.44,2.44,2.44,,2.44
5,Anthony D.,"Boston, MA",2,9,,1.0,2016-09-11,"Two words, ""don't go"" longest service ever for microwaved food. I thought this place was getting better.",https://www.yelp.com/biz/applebees-neighborhood-grill-and-bar-dorchester-3?start=20,2.36,2.36,2.36,,2.36
4,CHACHI M.,"Boston, MA",99,8,10.0,2.0,2016-09-26,"Came for drinks and apps. The calm chowder cost $5 and they didn't even fill it to the brim..it had half of what it was supposed to. And it wasn't  appetising.  Iasked for a beer and was brought out  obviously dirty glasses on 2 separate occasions after asking for a clean one. We asked for a combo plate and they ran out of mozerella sticks..it's only 8pm.. I'll only be back for drinks in a bottle,no drafts..nothing else..in other words this place is a No",https://www.yelp.com/biz/applebees-neighborhood-grill-and-bar-dorchester-3?start=20,2.4,2.4,2.4,,2.4
53,Amress B.,"Boston, MA",2,36,37.0,2.0,2016-10-17,Fries tasted like cardboard . They were so gross .   The waitress was nice but seemed really stressed out and It was making us uncomfortable .  She didn't know the beer prices when my bf asked . If she offered to go check he would have gotten a beer but he ended up not getting one .  The mozz sticks and chicken tenders were a 6out of 10..,https://www.yelp.com/biz/applebees-neighborhood-grill-and-bar-dorchester-3,2.32,2.32,2.32,,2.32
55,Roscoe G.,"Boston, MA",90,1,3.0,1.0,2016-10-26,I came to Applebee's tonight to have a drink dinner and watch the  game but as I was sitting at  the I noticed  rodents running around above my head my night ended with taking my meal.,https://www.yelp.com/biz/applebees-neighborhood-grill-and-bar-dorchester-3,2.16,2.16,2.16,,2.16
50,Joshua S.,"Boston, MA",0,5,,1.0,2016-12-21,"If good service is important to you, don't bother coming to this location. Literally wasted an hour just now.  Sat down, our server got us our drinks and appetizer within the first 10 minutes. Then, she never stopped by our table again for the next 50 minutes, even when we pushed for the ""call server"" button after 20 minutes of waiting.  Our server literally walked around the divider in the middle of the restaurant instead of walking past our table. After she dropped off our appetizer she ran away like we had ahe plague (and we aren't even sick!). There were about 3 other servers who walked by our table and no one thought to ask if we were doing okay or went to get our server. After an hour we just paid and left.  Is it really THAT hard to just get our order? It takes like, less than a minute.. We went in being nothing but nice.  The pretzel and beer cheese appetizer was good though, but our server cost this location anything higher than a 1 star. The pretzels (and yelp, by mainly yelp) saved this location from getting no stars at all.  I will be taking this place off my ""I'm starving and just want cheap fat food, but not to the extent of McDonald's and Co."" list.",https://www.yelp.com/biz/applebees-neighborhood-grill-and-bar-dorchester-3,2.08,2.08,2.08,,2.08
12,Erin O.,"Boston, MA",46,7,,2.0,2016-12-27,"My parents and I got takeout dinner here on Christmas Eve because it was the only place open near the hotel. I had the brunch burger and my parents shared the Southwestern Salad. We both ordered medium rare, but everything ended up pretty well done. We had emphasized that we wanted medium rare to the guy manning the takeout counter, and he definitely put it down, I guess the kitchen just doesn't know how to cook it. The burger was good otherwise, nothing special. The steak on the southwestern salad was so extremely tough though, you had to chew for a solid minute before you could swallow it. I don't think I've ever had such a tough steak. I also got an raspberry iced tea, which I thought was regular iced tea with a flavored syrup but tasted more like the cheap Brisk tea. My father and I had a cocktail each while waiting for the takeout, he had a Myers & Tonic and I had the raspberry cosmo. He said his was good, but I couldn't taste the alcohol in mine at all. For some people that's a good thing, but I like to know that I actually have alcohol in my drink if I'm paying $9 for it. Both the bartender and takeout guy were super nice and really accommodating, but the food/drink is ehh overall.",https://www.yelp.com/biz/applebees-neighborhood-grill-and-bar-dorchester-3?start=20,2.08,2.08,2.08,,2.08
49,Michael R.,"Natick, MA",5,22,5.0,3.0,2017-01-12,Went there for lunch after having been there last about two years ago. I think it will be another two years before I go back. Service was friendly but slowwww. It was not crowded so I can't blame it on that. The burger and fries were ok but nothing special. Tasted like a standard frozen patty that is frozen with an odd shape to make it look like it was fresh. Fries heavily salted but satisfactory. In the end one of my biggest complaints was the electronic tablet menu/bill device. As far as my friend and I could tell there was no option to pay the bill in cash. We waited about five minutes for the server to return but they seemed to busy talking to members of the opposite sex. We ended up paying by card just to get out of there.,https://www.yelp.com/biz/applebees-neighborhood-grill-and-bar-dorchester-3,2.12,2.12,2.12,,2.12
0,Richard R.,"Lynn, MA",0,6,,2.0,2017-02-04,As I'm here with my friend waiting for our main entrees. There's a young female employees screaming and cussing at another employee.   So loudly that the whole restaurant got quiet and turned around to see the commotion   We are also waiting for a while for our food.   I have to say that though the food is really good.,https://www.yelp.com/biz/applebees-neighborhood-grill-and-bar-dorchester-3?start=20,2.08,2.08,2.08,,2.08
58,Spiro G.,"Dorchester Center, Boston, MA",0,5,1.0,5.0,2017-02-22,"This is my place. When I'm having a tough week, I can always rely on a good time--food and staff. The staff is always friendly and consistently gives great suggestions! The food is fantastic... if you haven't tried cheeseburger egg rolls, you need to now!",https://www.yelp.com/biz/applebees-neighborhood-grill-and-bar-dorchester-3,2.2,2.2,2.2,,2.2
7,Trung B.,"Boston, MA",0,46,2.0,1.0,2017-02-27,"This place is poorly ran by mgmt and I can tell staff hate to work there, but have to make their ends meet. Sat down with my family with young kids quite fast this time. Waitress Kimberley  F. served us and was quite nice and pleasant. I can see the hostess is being pushy ordering her around to clear the tables, but hello, she is serving us at the moment. She took our order and then told us that many items on the menu were out of the food, such as shrimp, kids chicken tenders, and a few entrees. Also, they were out of apple juice, which my two kids wanted. Ordered and substituted on the food selections as my kids were hungry. Food came at quite a good pace, but a little slower than what I have experienced at the Quincy Applebees. My food was dried as sh!t and I had to request gravy or some sauce just to moist my food (ordered the steak tips with mash potatoes and onion rings on top). The onion rings were not crunchy and were soaked in grease. The guests on the other table waited for more than an hour to be seated and for food to come out and they were heated and the table behind me had their orders mixed up with other patrons. First, I think mgmt needs to be retrained on how to manage a restaurant and how the kitchen functions, as when foods comes out,the servers are all taking random dishes and serving their customers. It was chaotic and unorganized restaurant/establishment. Pretty much the kitchen is hurting the servers on their performances and obviously they will be tipped less due to the unorganized kitchen. How on Earth a franchise be out of foods and not tell the servers ahead of time before customers order? This branch should be shut down due to lack of menu selections, poor kitchen quality foods, and unmanageable environment. It was one of the worst dinner I had with my family in my life!",https://www.yelp.com/biz/applebees-neighborhood-grill-and-bar-dorchester-3?start=20,2.04,2.36,2.36,,2.232
48,Aly I.,"Johnston, RI",4,20,6.0,1.0,2017-03-11,"Called in a 2 for $20 meal at 10:30, arrived at 11pm, and they were dead.  I sat at the pick up area, nobody saw or spoke to me for about 15 minutes.  Finally got up and spoke to someone to hurry things along.  Got food stacked up in two ripped bags -- asked ""could I have another bag, are these sturdy?"", they replied yes.  I got two steps out of the building, artichoke dip is all over everything after a bag splits.  I go back in, ask for bags, saying my bag broke.  No real apology, no offer to rebag things for me.  Was an overall horrible experience.  Get back to the hotel, everything is ice cold, and one entrees is wrong. This place was horrible, do not go here.",https://www.yelp.com/biz/applebees-neighborhood-grill-and-bar-dorchester-3,2.0,2.34,2.34,,2.2039999999999997
44,Elva L.,"San Francisco, CA",0,1,,1.0,2017-03-17,"Had a new definition of ""suck service"". My husband and I had a long day of moving to Boston, and this place is the nearest restaurant we could find. The waiter, male, around 50years old with glasses, was impatient to take our order, and it took him quite a long time to bring the food. What's worse, since the restaurant use an tablet-like screen on each table for customers to pay by themselves, I accidently hit 14% instead of 15% for the tips, which I didn't even realize that. When we about to leave, the waiter THROW the receipt on our table with a huge hand-draw CIRCLE of the suggested tips. When he passed by us, I heard him whisper ""F**K"" to us. I was so pissed off, but too tired to talk to his manager. But, it really hurt my first impression on Boston.  Never would come to this place again!!!!!!",https://www.yelp.com/biz/applebees-neighborhood-grill-and-bar-dorchester-3,1.92,2.3,2.3,,2.1479999999999997
57,Brittany H.,"Mashpee, MA",0,2,1.0,1.0,2017-03-25,"Found a piece of CHEWED gum in my French fries. The manager refused to give me a refund over the phone unless I came in, I live out of town so I offered to email a copy but they refused. Horrendous don't go here",https://www.yelp.com/biz/applebees-neighborhood-grill-and-bar-dorchester-3,1.92,2.29,2.29,,2.1420000000000003
56,Jeffrey C.,"Dorchester Center, Boston, MA",0,1,,1.0,2017-04-25,"This place sucks , food was cold and after being seated it takes the waitress 20 minutes too take you're order and the place is empty.",https://www.yelp.com/biz/applebees-neighborhood-grill-and-bar-dorchester-3,1.92,2.27,2.27,,2.1300000000000003
54,Nijkah M.,"Boston, MA",197,1,,1.0,2017-06-03,"Me and my coworker came into Applebee's at 9:05. We were seated & forgotten about. It took them until 9:35 just to come and ask us if we needed drinks. They took 15 mins to bring 2 sodas & a margarita , which was watered down! A whole passed and still no food has been brought to us. .. it sucks here! & servers wonder why they never get tips!",https://www.yelp.com/biz/applebees-neighborhood-grill-and-bar-dorchester-3,1.88,2.26,2.26,,2.1079999999999997
51,Louisa M.,"Methuen, MA",0,46,,3.0,2017-06-08,"What a disappointment. We picked Applebee's over Olive Garden. Huge mistake! The place was just about empty yesterday afternoon.  If u do not use the computer like way of ordering u do not get waited on. I ordered onion soup, bowl, and salad. Salad was ok however my bowl of soup was half full and small. While everyone was nice but that did not make up for skimpy soup and ok salad. Had to get someone to get our waitress twice. Once when we were first seated. No one came. Had to get someone to find our waitress. Got a drink but had to flag her down again for another drink. To bad as they have what it takes but just seems as if the wait staff could care less about service. U will still be hungry when u leave. My sisters meal was ok. Way to much to go through for not enough food and disappearing wait staff. Oh well it is not like the Applebee's up my way.",https://www.yelp.com/biz/applebees-neighborhood-grill-and-bar-dorchester-3,1.92,2.27,2.27,,2.1300000000000003
2,Tee T.,"Hyde Park, Hyde Park, MA",0,3,,1.0,2017-07-01,My chicken wantons was not crispy to much Sauce. The bartender Wendy is very judgmental listen to the way she rips apart customers the bartender my wantons was so soggy.,https://www.yelp.com/biz/applebees-neighborhood-grill-and-bar-dorchester-3?start=20,1.8,2.26,2.26,,2.076
46,Jim K.,"ROSLINDALE, MA",105,10,3.0,2.0,2017-09-03,Our meals were tasty and a good value but service was very inattentive. Will return nonetheless but hope for a better server.,https://www.yelp.com/biz/applebees-neighborhood-grill-and-bar-dorchester-3,1.84,2.27,2.27,,2.0980000000000003
43,Bella C.,"Dorchester, Boston, MA",0,2,,2.0,2017-09-10,"the one thing I'm going to say is stop bringing my damn food with your disgusting finger in my plate. I couldn't even eat my food after I saw the waitress' thumb in the plate almost touching my food. I get it's hard to carry a bunch of plates in your hands but seriously I would prefer you either bring them out one by one or at least get a f*cking cart to bring the food out. It's disgusting like seriously you guys need to train your stupid staff to carry the food with their hands UNDER the plate. I don't know where your fingers have been, I don't know if you even washed your hands, it's just disgusting. Do better. *EDIT I also forgot to add that the utensils are DISGUSTING. I understand it may be a pain in the ass to stand there and wash alllllll those dishes but when I picked up my spoon I noticed it had stains on it. It looks like they just water the utensils down and then put them back out. If you need to hire 10 people to wash and scrub dishes THEN DO IT. I don't want to eat my food with a fork or spoon that has stains on it from previous people using it. Literally made me want to puke. I ended up asking the waitress if they just had plastic utensils (the ones that come in the little bags). Ugh so disgusted.",https://www.yelp.com/biz/applebees-neighborhood-grill-and-bar-dorchester-3,1.72,2.28,2.28,,2.056
47,Julie D.,"Lynn, MA",87,6,,2.0,2017-09-20,"I used to love Applebee's, until my last visit, I might never go back. Our waitress, I forgot her name and I don't want to sound insensitive but she has a big tooth in the front  (I'm so sorry ) was very forgetful and our drinks took pretty long. She doesn't seem to know enough about the menu because she seemed lost and didn't know the answer to some of our questions. She bought over the wrong foods and tried to tell US that they were and that we ordered this even though we didn't. Plus the food was pretty basic. It was bland and nothing special like it usually is. It was not worth the price. This really turned me off from Applebee's, I used to love you guys so much but, it's time to say goodbye. And I'm not one to write bad reviews but after this experience...I had to.",https://www.yelp.com/biz/applebees-neighborhood-grill-and-bar-dorchester-3,1.76,2.29,2.29,,2.0780000000000003
40,Allison J.,"Hollis, NH",249,12,5.0,4.0,2017-10-06,"Honestly do not understand the hate here. I am enjoying such a special birthday dinner with two of my closest girls. The 1 dollar margarita tastes like I'm in Cabo. The atmosphere feels like I'm at Disney. Don't ask me why, it just does. They made my friends birthday feel like the presidential inauguration. This is awesome. I highly suggest the you pick 3 appetizer option. See you soon, Abees.",https://www.yelp.com/biz/applebees-neighborhood-grill-and-bar-dorchester-3,1.8,2.32,2.32,,2.112
41,Roshunda S.,"Edmond, OK",18,14,23.0,1.0,2017-10-15,We have the worst experience every time we go to this Applebee's! Horrible won't ever go back there!,https://www.yelp.com/biz/applebees-neighborhood-grill-and-bar-dorchester-3,1.76,2.3,2.3,,2.084
42,Felicia C.,"Braintree, MA",24,3,,1.0,2017-11-04,Bad service- waitress should have stayed home because she was not feeling well. I didn't know this until I saw her feeling her head and talking with other staff. Sad that the manager would allow them to come to work and spread germs. I am so done with Applebee's.,https://www.yelp.com/biz/applebees-neighborhood-grill-and-bar-dorchester-3,1.76,2.29,2.29,,2.0780000000000003
