,Username,location,friend_count,review_count,photo_count,rating,date,review,Url,roll25,roll100,roll250,special_25,Final_Rating
10,Samantha Y.,"Georgetown, MA",0,3,,1.0,2017-04-01,"I typically like Applebee's especially for the half priced apps but this one is horrible. We ordered a Jack and Coke and the waiter didn't even know what it was... seriously? Then we ordered apps and they were basically frozen. The server was slow, the food was cold, and the food was actually not as good as usual. Wouldn't recommend.",https://www.yelp.com/biz/applebees-neighborhood-grill-and-bar-savannah-8,2.24,2.24,2.24,,2.24
9,Dorothea S.,"Wallingford, CT",20,11,,1.0,2017-04-15,My son and I both had the 8 oz sirloin steak. Grissle and could not chew it. Showed it to manager and gave us $3.00 off each one. Do not waste your money.,https://www.yelp.com/biz/applebees-neighborhood-grill-and-bar-savannah-8,2.12,2.12,2.12,,2.12
3,Shawn S.,"Savannah, GA",77,43,82.0,2.0,2017-06-25,"I dont even want to waste time writing a review about a chain place that just seems to be failing in every state that I have visited  one in. However because its in my blood i will at least write a little something to make the yelp machine happy lol. To sum it all up i 100% purely regret  going here for lunch. I mean applebees used to be a decent chain  but i guess due to the changing  generations  and our differences  in what we call service and quality, this chain is just ugh. Food all tasted the same Service was slow. Kitchen staff was slow.. my.great grandmother moved faster than these kids do. I csnt even type any more.. i trully think im done with applebees",https://www.yelp.com/biz/applebees-neighborhood-grill-and-bar-savannah-8,2.16,2.16,2.16,,2.16
6,Stanley M.,"North Augusta, SC",25,55,114.0,5.0,2017-07-05,you can't always go by reviews in town for the 4th walked across the street to applebees the food was great the drinks the service excellent I don't know maybe other people went on bad nights but hey I enjoyed myself,https://www.yelp.com/biz/applebees-neighborhood-grill-and-bar-savannah-8,2.2,2.2,2.2,,2.2
1,Roy S.,"Nokomis, FL",0,20,,1.0,2017-08-21,"Fist off, I do not like it when a bartender calls me ""baby"".  I'm old enough to be your grandfather....... I ordered a burger, medium with fries well done.  The burger came out medium well and dry as a bone.  Everything was just thrown on the plate.  Very appertizing...  When the bartender asked how everyone was, I just stated that it was OK.  Well, if looks could kill.  Hey, you asked. And speaking of staff, I have seen a better accumulation of people at a circus side show. You have one waitress that is the better part of 50 with blonde????hair hanging all the way to her butt.  Nice on a 20 year old, not so much on her.   Another with a blonde/brown boys haircut and a sleeve full of tats.  I have nothing against tats, but in a business/resteraunt atmosphere the company should make them wear long sleeves. And, the management staff looked like they have been eating Applebees food since they were three.  Nuff said....",https://www.yelp.com/biz/applebees-neighborhood-grill-and-bar-savannah-8,2.2,2.2,2.2,,2.2
4,Melody C.,"Columbia, SC",2,39,5.0,2.0,2017-10-09,"After waiting 10 minutes for service,  we headed for the door. To our surprise we were stopped my the most sincere and apologetic manger, thus the 2 star rating.   Food mediocre, our new waitress tried really hard to please us the bitter taste remained.",https://www.yelp.com/biz/applebees-neighborhood-grill-and-bar-savannah-8,2.16,2.16,2.16,,2.16
5,Karen B.,"Savannah, GA",0,2,1.0,1.0,2017-11-19,"Decided to give this location another try after being disappointed in the past by the awful service. Once again they failed. This location's staff could use some Customer Service training ASAP! The hostess made more effort trying to serve a party of ten in which only four of the guest were there, than trying to seat my party of two. Empty tables and booths everywhere. Two of the staffers looked at us and proceeded to walk into the kitchen.  Perfect location for an Secret Shopper or a visit from Corporate!",https://www.yelp.com/biz/applebees-neighborhood-grill-and-bar-savannah-8,2.16,2.16,2.16,,2.16
2,Mercedes P.,"Lawrenceville, GA",9,136,333.0,2.0,2018-01-02,"This place was awful. You truly cant judge a book by its cover, or a restaurant. Its nice, clean, and spacious inside. The service here sucks. The baked potatoes were sent out cold. The waitress offered to reheat it. Uhh definitely not. Refills had to be requested more than once without being filled. My Aunt specifically said she was allergic to Parmesan cheese and ordered the artichoke dip without it, and lucky her boyfriend noticed they put the Parmesan on it anyway. The chicken tenders for the kids were hard and dry. We ordered a to-go order with a sandwich and soup. We got a cold sandwich and the soup was missing. Good thing we checked the bag. The service was overall just poor and slow. My husband and I frequent the location in Lawrenceville, GA and have never had such a bad experience at Applebees. I completely see why this location has such a low rating.",https://www.yelp.com/biz/applebees-neighborhood-grill-and-bar-savannah-8,2.16,2.16,2.16,,2.16
