,Username,location,friend_count,review_count,photo_count,rating,date,review,Url,roll25,roll100,roll250,special_25,Final_Rating
33,Landen Y.,"Savannah, GA",26,70,,2.0,2012-12-01,"Worst applebees experience ever.  our server was friendly enough, but he basically ignored us the entire time we were there.  we sat for ten minutes without a drink after our order was taken (this was at lunch) and we were about to leave when the appetizer we ordered came to the table. We ordered the pretzel sticks with cheese, which were amazing.  Kim had q bacon cheeseburger and i had a jalepeno chicken chop salad. The food was excellent but the service was among the worst I've ever experienced.  The manager came to our table and ended up comping some of our food, which is the only thing that kept this experience from ruining my afternoon.   We'll eat at applebees again, just not this one.",https://www.yelp.com/biz/applebees-neighborhood-grill-and-bar-savannah-8?start=20,2.088,2.088,2.088,2.088,2.088
16,Paul S.,"Reno, NV",1126,966,5332.0,4.0,2013-02-22,"February 16, 2013 Saturday - dinner 5:30 PM 1 adult & a kid Atmosphere - 4 stars Food - 4 stars Service - 4 stars Background - My daughter picked the restaurant since it was near the hotel.  Atmosphere - A standard Applebee's.  The hostess sat us an obvious dirty table with thick dried ketchup spots and crumbs.  We just got up and took the table behind us, no one even noticed.  Way to pay attention to details! Food   Appetizer - none.   Main Course - I went with the Napa Chicken and Portobello.  The meal was very flavorful for one of their health choice items.  The zucchini was slices were either paper thin or half inch think, 2 of each.  The mix of grilled onions was very good.   Dessert - none ordered today. Service - I will ding them again for the hostess sitting us at a dirty table.  My daughter ordered a milk shake with dinner Future - Probably but not during this trip.",https://www.yelp.com/biz/applebees-neighborhood-grill-and-bar-savannah-8,2.256,2.256,2.256,2.256,2.256
26,Samantha W.,"Deltona, FL",33,35,42.0,1.0,2013-08-29,"Worst food ever! We ordered via Carside Togo, so we didn't have to deal with the lines that are usually running out the front door. We have dined in a couple of times and the food then was subpar. However, this time, we quickly realized that this experience was one for the ""Worst Ever"" record books.  My husband ordered the cheesy chicken penne and I ordered the 7 ounce steak with mashed potatoes and vegetables. We got our food home and opened the containers to find dry, colorless food with an off-putting smell - yuck! We were both starving after a long day, so we choked down some of our meals and abandoned it.  The hilarious part was when the chicken bits left over from my husband's meal was discovered by my cat. He too wasn't too pleased with his portion of the meal. He grabbed a bit of my husband's leftover chicken, dropped it back on the plate shaking his head and hit it a few times with his paw. He then proceeded to pick it up again and ran away, at which time we presumed he was going to eat it. We then discovered the little scrap of chicken sticking out of his litter box slightly covered in litter! EVEN MY CAT WOULDN'T EAT THIS ""CRAP""!  Never never never again! Other customers beware!",https://www.yelp.com/biz/applebees-neighborhood-grill-and-bar-savannah-8?start=20,1.8600000000000003,1.8600000000000003,1.8600000000000003,1.8600000000000003,1.8600000000000005
35,Stephen S.,"Savannah, GA",25,48,32.0,2.0,2013-10-09,"First and foremost I will admit I'm not a huge chain restaurant fan but came here with a group so had to go with the flow. Those prejudices have nothing to do with this review because those specifically deal with food quality which wasn't an issue.  What were the issues is unfortunately a long list. We were seated and the forgotten about for 15 minuets. Then the waitress comes to take our order and we remind her we haven't even received menus yet. A few of the guys ordered a popular beer they where out of. No big deal they ordered another kind.  15 minuets later she returms to take our food order. The lady does a great job of up selling the half price appetizers which may have been the only thing she did well all night.  Then the REAL wait starts. In between the 40 minuets of waiting for the food we had one guy ask for a diet cook refill 4 times before receiving it, the beers guys order another round be told they are now out of that brand too, and when the food does come they left off my order entirely. There was 8 people in our party not 20. There may have been 25 people on the place with most of the rest sitting at the bar. Fortunately, with the exception of my food coming out 20 minuets after everyone else's, no one had major complaints about the food itself.  Long story short this place did not do much in the way of making me turn the corner on chains and this place has to go through a lot of changes before I step foot in it again.",https://www.yelp.com/biz/applebees-neighborhood-grill-and-bar-savannah-8?start=20,1.9600000000000002,1.9600000000000002,1.9600000000000002,1.9600000000000002,1.9600000000000004
30,Joseph K.,"Houston, TX",6,51,136.0,3.0,2013-10-31,"Very confinient located in front of Hampton inn... I called in for my order and just walk out to pick up. When there few times, 1 was at night time.  Called in for penne chicken and dessert... Walk down to pick up. When at the bar, told them i m picking up my order, they say no one has any take out or call in order.  I checked my phone .. Even test call to see who pick up.. It was the lady on the bar. She was the one who answer my phone and forgotten about it. I had to way another 25 mins. Next time just sit there and order.",https://www.yelp.com/biz/applebees-neighborhood-grill-and-bar-savannah-8?start=20,2.0280000000000005,2.0280000000000005,2.0280000000000005,2.0280000000000005,2.0280000000000005
36,MD C.,"Jacksonville, FL",20,15,19.0,1.0,2013-11-26,"Stopped in to grab a quick bite to eat. I ordered the lunch special, mix & match, tomato basil soup (the flavor and consistency was very good) paired with the roast beef, bacon & mushroom melt (the ""meat"" was was very dry and over cooked, bacon was super salty & not as crispy as I prefer, the bread was nicely toasted but too much butter).",https://www.yelp.com/biz/applebees-neighborhood-grill-and-bar-savannah-8?start=20,1.8920000000000003,1.8920000000000003,1.8920000000000003,1.8920000000000003,1.8920000000000003
0,Richard L.,"Boca Raton, FL",29,36,8.0,4.0,2014-01-11,Typical Applebee's restaurant.  Conviently located off of I-95 and near a group of hotel if you are on a road trip.  I went there on a friday night  since I was feeling extremely lazy and just wanted to grab a bite to eat on the way home.  I was by myself so I found a seat at the bar.  Service was good the bartender came up and asked my what  I wanted to drink while I was looking over the menu.    After looking over the menu i decided to get the Honey pepper steak.  It came out quickly and was pretty good.  I came over a bed for fried red potatoes with deep fried onion string and jalopenoes on top of it with there honey pepper sauce which in my opinion is more honey than pepper.  Overall it was a pretty good meal at a resonable price.,https://www.yelp.com/biz/applebees-neighborhood-grill-and-bar-savannah-8,2.192,2.192,2.192,2.192,2.192
22,Kim C.,"Conyers, GA",2,14,121.0,1.0,2014-01-27,"It was a slow Sunday afternoon, and they weren't busy. I expected them to be short staffed. I did expect to at least be offered water in the first 15 minutes. But after 15 minutes no one came by despite everyone around us and the new couples coming in getting service. After 20 minutes of nothing we left. Maybe the food is good, but we never got to find out.",https://www.yelp.com/biz/applebees-neighborhood-grill-and-bar-savannah-8?start=20,1.7960000000000003,1.7960000000000003,1.7960000000000003,1.7960000000000003,1.7960000000000003
24,Andrea T.,"Richmond Hill, GA",99,76,100.0,4.0,2014-03-10,Typical Applebee's but it's close to our house and everyone leaves satisfied. I usually have a burger and on Mondays they are half off so I can feed a family of 4 for about $20 that's with an appetizer too.,https://www.yelp.com/biz/applebees-neighborhood-grill-and-bar-savannah-8?start=20,2.128,2.128,2.128,2.128,2.128
34,Greg P.,"New Baltimore, MI",0,2,,1.0,2014-07-05,"Stopped in on the way to Sarasota because it is close to I-95. The restaurant is terrible.  When we entered we asked the hostess if we could have a booth. Her answer her was ""Well you know their all dirty now.""  And she proceeded to talk to the next guests and seat them. Restaurant was 1/3 full. Then a server came up to asked us to seat us and she said let me clean one off.  So we thought great.  We ordered fish and chips and a BLT sandwich. Dinner came out about 20 min later.  Not bad.  That was the end of the good experience. Bacon was hard as rock and old.  French Fries were cold and totally saturated with old burnt tasting grease.  I asked the waitress for some new hot fries and she brought them for desert 20 min later and the were the same fries just as cold.  I paid with a gift certificate and the waitress said it had been used before which it had not.  Showed her the $50 receipt that we paid for it.  She said the manager would take care of it this time.  Which leads me to believe I am supposed to have $32 balance .  I will be calling Applebee's corporate tomorrow to fix the problem.  Manager never came to the table. Told my son about the experience and he said  ""What do you expect, it's Applebee's """,https://www.yelp.com/biz/applebees-neighborhood-grill-and-bar-savannah-8?start=20,1.8600000000000003,1.8600000000000003,1.8600000000000003,1.8600000000000003,1.8600000000000005
38,Michael F.,"Cranford, NJ",10,425,,3.0,2014-11-27,"I'm not a big fan of these types of chain restaurants but when you're driving from Florida to New Jersey and it's next door to the hotel, you don't have much of an option.  It was the night before Thanksgiving so the restaurant was quiet.  We still stood there for several minutes while we waited to be seated because they had to clean a table off for us.  I noticed the bartender texting very often while we stood there.   We ordered the chips and salsa to start.  The salsa was tasty and the chips were nice and salty.  I like it that way.  I had the Thai Shrimp Salad and my wife had the chicken fajita roll up.  She was't impressed and thought it was mostly roll up and not enough chicken and substance.  The sweet potato fries were very good.  My salad was good and the portion was perfect.  Although most of our food was good, the service was very slow all night.  We never received the obligatory ""how's everything going"" halfway through our meal.  I could have used another seltzer since I was out.  We were there much longer than we should have been on a very quiet night.",https://www.yelp.com/biz/applebees-neighborhood-grill-and-bar-savannah-8?start=20,2.0600000000000005,2.0600000000000005,2.0600000000000005,2.0600000000000005,2.0600000000000005
32,Douglas G.,"Elizabeth City, NC",0,29,,1.0,2014-12-21,"First off they need to hire some people to clear tables. We arrived and I counted ten tables in sight that needed cleared?? As we stood there no one touches a table as more and more people walked in the door? Every party that arrived (about eight) they repeated the same thing ""10-15 min"". Two person tables were plentiful and they still told two person parties the same wait? Ordered aps when we ordered drinks and they never showed? Waiter was only working three tables and still had no idea we didn't get our aps? When the food arrived it was cold? No drink refills? We walked out!!",https://www.yelp.com/biz/applebees-neighborhood-grill-and-bar-savannah-8?start=20,1.8280000000000003,1.8280000000000003,1.8280000000000003,1.8280000000000003,1.8280000000000005
18,Dana S.,"Philadelphia, PA",54,247,30.0,2.0,2014-12-27,"Pretty standard for an Applebees but my food was little off.  It was a rest stop for me on a roadtrip and we stopped for dinner.  I order a sirlion steak over some grains and spinach.  The grains and spinach were delicious, the steak was beyond well done but they quickly ordered up another one.  I'm not sure if I was biased from seeing the first one but the steak was just ok or a little less.  Friendly service for the most part. Ok food.  Clean bathrooms.  Good for its purpose of stretching legs and getting some food, but I may consider some of the other restaurants on the exit.",https://www.yelp.com/biz/applebees-neighborhood-grill-and-bar-savannah-8,1.9280000000000002,1.9280000000000002,1.9280000000000002,1.9280000000000002,1.9280000000000004
29,Dustin W.,"Hamilton, OH",232,11,,2.0,2015-03-06,My fries were old the salads were tiny and the fiesta roll up down sized by half. Waitress was nice.,https://www.yelp.com/biz/applebees-neighborhood-grill-and-bar-savannah-8?start=20,1.9280000000000002,1.9280000000000002,1.9280000000000002,1.9280000000000002,1.9280000000000004
25,Jeffery S.,"Bluffton, SC",25,5,,2.0,2015-03-13,"My daughter and I ate dinner this evening and I give this location two stars.  Not because the food was bad, it's Applebee's the food lived up to the consistent standard of assembled food at a large chain restaurant. It was the service. It was too quick. I know this doesn't seem bad right? Well I ordered and my appetizers came out in perfect time. Both the Sriracha shrimp and brisket nachos were well cooked and presented. In fact I managed to get one bite of each before I turn my head And my dinner was being delivered.  So now I'm faced with the dilemma of which do I let get cold. All the food runner can say is ""That was quick I don't know what's up with the kitchen but I hope they keep it up"" unacceptable.",https://www.yelp.com/biz/applebees-neighborhood-grill-and-bar-savannah-8?start=20,,,,,
27,April F.,"Barstow, CA",80,11,1.0,5.0,2015-04-28,I normally do not like applebees but this applebees was an exception. After alot of driving and needing to stop for the night for some food and sleep and I found  applebees and my husband  told me to try it out. I didn't order much but the boneless wings I ordered were way better than I remember them being. The bartender here was very nice and made some great jello  shots.. I normally hate going out alone and feeling awkward. But i didn't tonight. Thank yall for making my first  time out alone on the other side of the country very comfortable :),https://www.yelp.com/biz/applebees-neighborhood-grill-and-bar-savannah-8?start=20,,,,,
19,Dani N.,"Kingsland, GA",0,11,1.0,1.0,2015-06-30,"This is the worst Applebee's!!  The Service is terrible!!  There were 8 tables and 6 people at the bar.  I ordered the 3 appetizers.  After waiting 45 minutes the food came out, but only 2 of the appetizers.  The food was cold.",https://www.yelp.com/biz/applebees-neighborhood-grill-and-bar-savannah-8,,,,,
20,Rachel M.,"Columbus, GA",4,31,4.0,1.0,2015-11-06,"We have come here twice and it is TERRIBLE! This is the first time in my life I have ever sent food back. Hubs wants the 2 for $25 so I took my chances with the Sirloin Steak and ordered it Medium. Cut open the center, the outside was Well-Done and the inside was straight up RAW. The meat had a weird grey color, it was obviously put directly on the grill frozen. The staff is wonderful, 2 other tables sent food back. I feel bad for whoever works here, we def tipped out poor waitress well as the kitchen is screwing her over. They also put anyone with a small child on one side of the restaurant, and any patrons that are 60+ on the other side. Being in our 20's, perhaps they thought we had children and wouldn't mind, but one child crying sets off an entire chain reaction. We don't mind children, but probably not the best business practice.",https://www.yelp.com/biz/applebees-neighborhood-grill-and-bar-savannah-8?start=20,,,,,
14,Brittani T.,"West Sacramento, CA",55,43,39.0,3.0,2015-11-25,"Not always the best service, food is average. Nothing really stands out here. They do have happy hour after 9 and half off appetizers though!",https://www.yelp.com/biz/applebees-neighborhood-grill-and-bar-savannah-8,,,,,
28,Kjj T.,"Crestview, FL",0,9,1.0,1.0,2016-03-29,"Food was lousy. I should have read the reviews but Applebees is usually pretty ok, skip this one!",https://www.yelp.com/biz/applebees-neighborhood-grill-and-bar-savannah-8?start=20,,,,,
23,Steve W.,"Sneads, FL",11,8,5.0,3.0,2016-06-05,"Few cars in the parking lot at 5PM. Waited 5 minutes inside front door with another couple to be seated and restaurant was empty (employees walking by, but looked like wait staff was in meeting in back corner). Out of Michelob Ultra draft listed as one of happy hour specials. Server was courteous and prompt. Ordered steak with roasted quinoa, tomatoes & spinach. Asked for Pittsburgh rare since they r advertising a new fire grill. Reply came back that they could not do that. When dish was served, looked just like it was dumped out of a frozen dinner tray after being microwaved. No visible tomato or spinach & gravy smears all around dish. Asked for manager and she came promptly. She apologized and told me she would prepare the dish correctly for me. When she returned with dish, it was so much more visibly appealing. I went on to order desert, churros with chocolate marshmallow dip. Mini marshmallows were not melted and I could not dip them. Asked server to please microwave. Took a few minutes. Did not ask for any discount. When check came, manager had credited entree on check & it was very much appreciated! I have usually chosen Applebee's because I have felt that I received more value and quality for my buck. In finally realizing that they r franchises, at one location a side salad is beautiful and covers bowl and at next location (Did I mention I work on the road & eat out 4 or 5 days a week?)  it covers half the bowl. In summary, (too late, right!) I am so happy to see Applebee's offering more healthy choices! However, they r deleting many of the reasons I go there, i.e. side salad at lower cost with an entree, hot bacon salad dressing and pretzel sticks with caramel sauce, and they change menu so often that staff training on preparation is not keeping pace!",https://www.yelp.com/biz/applebees-neighborhood-grill-and-bar-savannah-8?start=20,,,,,
21,Tammy W.,"Bonita Springs, FL",0,2,,5.0,2016-06-26,Went tonight after having a long travel day heading back on I-95. Arrived late and the staff was very caring and attentive. Food and service was great. Our server Janet was sweet and took good care of us tired travelers.,https://www.yelp.com/biz/applebees-neighborhood-grill-and-bar-savannah-8?start=20,,,,,
31,Scott H.,"Canonsburg, PA",28,16,,2.0,2016-07-26,"You might want to skip this one.   We were seated and the table was greasy/sticky as though the cleaning rag had been in use for too long.  My kids ordered appetizers and we ordered a 2 for $25.  There was a trainee waitress shadowing the regular waitress and the place was not busy so we should have had pretty good coverage.   Nope.   The trainee seemed pretty good but she disappeared after she took our order.  Food came and my steak was OK but my potato, ordered with butter only, had no butter in it.  My wife's ribs were burned with no Sauce and they did not have the baked potato she ordered, saying it would take 5 minutes.  At that point no waitress appeared for 15 minutes.  When she did (the regular waitress), she said the potato would just be another few minutes, but we were all done with dinner...except I still wanted the butter for my potato.   I asked for the bill and asked if they could do anything about the potato we didn't get.  The waitress went away and came back a few minutes later with a slightly reduced bill.  So this is the part that really blew my mind.  The waitress, with my bill in her hand, stopped to talk to the people at the table next to us.  Without saying a word to me, she reached over to hand me the bill while talking to the people who were complaining at the next table.  She never said a word to me.  I looked at the bill, added a very small tip, signed it and left.  As I walked out, I heard this waitress telling somebody sitting at another table as she was bussing a different table ""These people didn't leave a tip either"".   I was not surprised, since the service was pretty bad.  You have to wonder how servers in a restaurant ever expect to get a good tip if they don't know how to provide good service.....",https://www.yelp.com/biz/applebees-neighborhood-grill-and-bar-savannah-8?start=20,,,,,
11,Dave Y.,"Enterprise, AL",0,51,9.0,1.0,2016-09-02,"Half-assed, mediocre service and marginal food.  Brought the family here because of its next door proximity to our hotel. Arrived at 9:30 on a Friday night. No one in front of us. Waited 10 minutes to be seated. Three different hosts came by to inform us, "" someone will be right with you"".  Mind you, my wife was standing there with a cane...when we asked for a booth, we had to wait another five minutes so one could be cleaned.  After finally getting our table, we were anxious to order after reviewing the menus which had a lot of tantalizing options. The excitement ended, however, when the food came out. It looked nothing like in the menu. I had the apple chutney pork chop, which actually wasn't bad tasting despite being too tough, but the puréed sweet potatoes and green beans that accompanied it were straight from a microwave. Bland, soulless food. My wife's chicken tenders and macaroni and cheese was depressing to look at. I could have made it better myself with some Kraft Mac and cheese and a few chicken strips from Popeyes. Looked like cafeteria food. My daughter's corn dog was still partially frozen in the center. When we requested a new one be brought out, it took well over 15 minutes. By the time it came out we had all finished eating and my daughter was full from sharing food off of our dishes. My Manhattan was watered down and had no garnish. No staff offered to comp us or offer a discount on the check. Amateur hour at Applebee's! I'll never eat at this, or any other Applebee's again.  I should have read the reviews on this place first...",https://www.yelp.com/biz/applebees-neighborhood-grill-and-bar-savannah-8,2.32,2.32,2.32,,2.32
13,Megan B.,"Fort Lauderdale, FL",4,67,2.0,4.0,2016-09-06,"This is a quiet clean location. Our server Brianna was fabulous, very attentive and friendly. Our food came out quickly and to our specifications. The classic burger with bacon and cheese came out hot and fresh, the fries were also very good. The lunch combo in my opinion was a great value, my choice of a Caesar salad and the three cheese cavatappi with chicken was the perfect size. Next time I'm passing through the area I will keep this location in mind!",https://www.yelp.com/biz/applebees-neighborhood-grill-and-bar-savannah-8,2.36,2.36,2.36,,2.36
17,D.L. S.,"FOREST HILLS, NY",0,18,,1.0,2016-10-10,"Door was locked, though people were inside. Apparently, this is what they do when they think they have enough customers. Doesn't seem very safe--a violation of the fire code?",https://www.yelp.com/biz/applebees-neighborhood-grill-and-bar-savannah-8,2.32,2.32,2.32,,2.32
8,Tommy M.,"Cape Coral, FL",12,126,20.0,1.0,2016-11-24,Well were do I start.  Let go with I should if payed  attention to the first few reviews. This place needs new management and staff. It's funny because a lot of three stuff folks were saying was true. I went in with my family of 5 the place was empty beside 2 couples they tried to seat us at the front right by the salad bar. I request to sit a bit further away and you might of thought I was asking to much being no one was in the place.  A group of waiters were in a corner complaining about everything under the sun. Then you have to read the fine print when attempting to use your coupons because it's all a scam to get you in the door. We had to ask for the bread that you get with the table. And that seemed to be an inconvenience to them. The food came out good but they could use a few classes in just overall services.,https://www.yelp.com/biz/applebees-neighborhood-grill-and-bar-savannah-8,2.2,2.2,2.2,,2.2
7,Bridget M.,"Westfield, MA",0,29,1.0,1.0,2016-12-28,Dirty restaurant. I ordered a salad and it didn't even come with all the fixings. Very slow service as well & they just did not seem like they knew what was going on at all in there.,https://www.yelp.com/biz/applebees-neighborhood-grill-and-bar-savannah-8,2.2,2.2,2.2,,2.2
12,Deanna M.,"Port Wentworth, GA",33,7,,1.0,2017-01-28,"The food is horrible they must have made up their own recipe. My son's Mac and cheese was disgusting, my burger was not cooked properly and my sweet potatoe fries were burnt beyond recognition. Service was the only decent thing here! Save your money and time.",https://www.yelp.com/biz/applebees-neighborhood-grill-and-bar-savannah-8,2.16,2.16,2.16,,2.16
15,Roger D.,"Arcadia, FL",3,18,,5.0,2017-02-20,The four of us went here for dinner. We had four different items and all were great. Waitress was attentive. No waiting line this time of year. The other reviews here that are less than three stars are just chronic complainers.,https://www.yelp.com/biz/applebees-neighborhood-grill-and-bar-savannah-8,2.24,2.24,2.24,,2.24
