,Username,location,friend_count,review_count,photo_count,rating,date,review,Url,roll25,roll100,roll250,special_25,Final_Rating
79,Sagine G.,"Randolph, MA",37,2,,1.0,2014-12-05,"Worst experience ever! Me and my friend decided to try this place after work. The second we entered we should have done a 180. Even the greeting from the hosts were half-assed. Our waiter was adorable and awesome and it was clear she had a lot of tables to wait but she was patient and helpful. We ordered the strawberry mango sangria which was the only upside of our experience. We ordered two pasta dishes which, unfortunately, were not delivered by our waiter, but by a rude chick who literally threw our plates on the table, didn't tell us which dish was which, and walked away without even giving us any utensil to eat with. My friend was fed up. When our sweet waiter came back, my friend asked for our check. The manager came out to apologize on her staff's behalf and told us to take the entrees home as compliments but we weren't having it. She charged us for just the drinks and we tipped our waitress and hauled the heck out and went to Panera, which was a few steps away.",https://www.yelp.com/biz/applebees-neighborhood-grill-and-bar-dorchester-3?start=60,2.76,2.76,2.76,2.18,2.76
19,Michelle B.,"Nashville, TN",158,26,1.0,5.0,2014-12-10,"Stellar! From the moment we walked in & the host held the door open (especially appreciated in this rain!) & he was so polite & friendly. You could tell he was genuine with his ""how are you?"". Our waitress Ashlee was great too, very kind & attentive & our food came out in decent time & was delicious. Manager was walking around checking in on customers as well, which I always give kudos for. All four of us in my party felt it was a great experience & while at the table we said ""we have to yelp this!"" Kudos Applebees! :)",https://www.yelp.com/biz/applebees-neighborhood-grill-and-bar-dorchester-3?start=20,2.88,2.88,2.88,2.612,2.88
6,Alisson D.,"Boston, MA",35,11,24.0,3.0,2014-12-17,For a chain restaurant food was not bad. Our server Chantel was very nice to us!!! Perfect Margarita was good. They bring a shaker to keep that cool.,https://www.yelp.com/biz/applebees-neighborhood-grill-and-bar-dorchester-3?start=20,2.96,2.96,2.96,2.38,2.96
66,Anonymus N.,"Dorchester, MA",0,15,1.0,5.0,2014-12-31,"The service here is much better than Olive Garden which is right next door, I cam bet you that. I have came to Applebee's a few times and I absolutely love it. Wonderful staffs and all, very well coordinated and organized. There was never a problem within  eating here at all.",https://www.yelp.com/biz/applebees-neighborhood-grill-and-bar-dorchester-3?start=60,3.0,3.0,3.0,2.516,3.0000000000000004
63,Derek L.,"Boston, MA",2,18,,2.0,2015-02-22,Got the carside to go 10.95 lemon garlic chicken and rice and got skimped with the food when I grabbed the box of food to go I immediately knew this was a skimp. I took the food to the car and ate hoping I would be pleasantly surprised and not have to request a refund of sorts. I did and after 45 secs and 7 or 8 bites it was gone. I went back inside and instead of giving me a refund he was able to give me another order of the chicken that's why I gave a 2 star and not a 1.,https://www.yelp.com/biz/applebees-neighborhood-grill-and-bar-dorchester-3?start=60,2.92,2.92,2.92,2.216,2.92
69,Danielle E.,"Boston, MA",14,23,6.0,1.0,2015-03-05,"We came in-- a group of 3 adults and two children around 230 pm.  We were seated next to the bathroom-- although there were multiple booths that were available. We sat for 15 minutes without a server nor a staff person acknowledging our presence, when a waitress finally stopped she let us know that she would be with us shortly. Although she apologized-- we still waited another 5 minutes before she came back JUST for our drink order. When the waitress returned we were able to put in an appetizer order-- Once  we got our drinks we still waited another 20 minutes for our waitress to come back to the table to take our order for the actual entree. We waited 30 minutes for our food(which was barely hot-- go figure!!) which means that at this point it had been about an hour of just waiting around.. while waiting though we asked the TV's which was on a snoop Dog documentary channel. We asked multiple staff members who told us they would change the channel and didn't. We finally asked for the restaurant manager-- he came by-- refused to give direct eye contact, was dismissive of our request-- and told us he needed to speak to the bartender he wasn't sure if they were able to change the channel--  he never checked back in with us-- but 10 minutes later all of the TVs in the entire restaurant portion-- not the bar were changed to NASCAR.... When i expressed my complaint to our waitress about the mangers lack of follow through she stated ""oh he's just like that""... Although we had super slow service and our food was poor, our waitress was friendly-- they were understaffed-- so I don't blame her.. but the restaurant not being clean! and being seated by the bathroom! unacceptable. I will never be returning to this location.",https://www.yelp.com/biz/applebees-neighborhood-grill-and-bar-dorchester-3?start=60,2.92,2.92,2.92,2.084,2.92
81,Tim B.,"Hatfield, MA",0,3,,1.0,2015-03-12,I won't even give this place 1 star. It's more like negative stars. THE lamest overpriced salad I have ever had. First I wasn't saved even though multiple wait staff walked by and totally ignored me. HD to ask to be helped. When my salad came it looked like the cook had literally grabbed a handful of lettuce and threw it on the plate. And where the heck Re the crispy buys. Not there. I ate a soggy unfulfilling meal. I will never go back to this hole again! Don't waste tor time going here!,https://www.yelp.com/biz/applebees-neighborhood-grill-and-bar-dorchester-3?start=80,2.92,2.92,2.92,2.148,2.92
61,Francilia J.,"Dorchester Center, MA",0,2,,1.0,2015-04-02,This place sucks.  Food was disgusting and management had an attitude taking care of it. Everything is mispriced. Customer service was great ( Ebony is AMAZING) Dont come here on a late night unless youre drunk and everything will be good.,https://www.yelp.com/biz/applebees-neighborhood-grill-and-bar-dorchester-3?start=60,2.92,2.92,2.92,2.18,2.92
16,Josie G.,"Boston, MA",349,216,20.0,3.0,2015-04-16,"Exactly what it says, this place is A-OK. I've been here a few times since my last post in 2010 (!!!) - usually after I pick up stuff at Target or Old Navy.  The bartenders have been attentive, and beers are cheap.   The food isn't anything special.  It all tastes quite similar to something that you'd buy in the frozen section and re-heat, but what do you expect?  It's a chain! It's what you think it would be.",https://www.yelp.com/biz/applebees-neighborhood-grill-and-bar-dorchester-3?start=20,2.96,2.96,2.96,2.38,2.96
78,Hank A.,"Boston, MA",0,14,,4.0,2015-04-23,"Great customer service staff is professional, attentive and friendly. Surpassed my expectations",https://www.yelp.com/biz/applebees-neighborhood-grill-and-bar-dorchester-3?start=60,2.96,2.96,2.96,2.448,2.96
29,Nicole M.,"Boston, MA",1,20,11.0,3.0,2015-05-06,"Since this review, service has been a bit better. We ended up going back 2 times within the past 7 days to put it to the test. New and more management staff on hand. Lots of new faces, some still the same. I believe its new management at night too, which is greatly appreciated. The only complaint I have now is that our waitress had been arguing with another waitress in front of guests....pretty unprofessional.....We ended up tipping both. The one who started the argument recieved a bit less than the one who wasn't trying to argue......Besides that, I can say we have had pretty okay experiences....so hopefully it lasts.",https://www.yelp.com/biz/applebees-neighborhood-grill-and-bar-dorchester-3?start=40,2.92,2.92,2.92,2.252,2.92
75,Thomas S.,"Boston, MA",0,22,3.0,1.0,2015-05-31,I did like Applebee's I had good service before and I posted good things. This time I can't and I won't infact I wouldn't eat in there for free again. Was there last Thursday the place had not many people . We sat and waited for the waitress we ordered drinks and salad and fingers and fries and I got a burger. We waited 45 min for the salad that was wilted and old looking I asked the waitress what's taking so long she left us for 25 min at a time after a hour and a half we got our food . I think she was chillin with the kitchen staff or something . I asked her why it take so long she said the kitchen was backed up ..no way I took a bite of my burger it was so hot I spit it out .it was microwaved .then they left a huge mess beside us at a different table she walked past it and didn't care I had to move a high chair so someone can get by in a wheel chair they just looked at me even the waitress didn't care so sad. I say our waitress was nice but LAZY .,https://www.yelp.com/biz/applebees-neighborhood-grill-and-bar-dorchester-3?start=60,2.8,2.8,2.8,1.988,2.8
3,Gerald N.,"Boston, MA",151,419,244.0,4.0,2015-06-04,"Pretty nice applebees conveniently located in the strip mall. The staff is friendly and the restaurant is nice. There's electronic pay stations at each table which surprised me. Got the spinach dip and it came out hot and the chips weren't salty at all. Also got the riblets and they are good for a snack. Hot and juicy!  Overall, I'd come back for a late night snack.",https://www.yelp.com/biz/applebees-neighborhood-grill-and-bar-dorchester-3?start=20,2.76,2.76,2.76,2.32,2.76
30,Mandy D.,"Everett, MA",2,7,1.0,5.0,2015-07-31,"Great customer service, great food, love the margarita. The combo 2 meals and 2 side salads for $25 is a great price. One of my favorites of all times.",https://www.yelp.com/biz/applebees-neighborhood-grill-and-bar-dorchester-3?start=40,2.92,2.92,2.92,2.356,2.92
31,Dj M.,"ROXBURY CROSSING, MA",195,14,3.0,3.0,2015-09-02,Cool bartenders  but not so much liqour selections and beer on tap  needs to be updated to beers that's not at every other bar . Wait Staff needs training on when not to swear in front of guest and be more inviting . Food is decent salmon is overrated salad are drenched with salad dressing too much .,https://www.yelp.com/biz/applebees-neighborhood-grill-and-bar-dorchester-3?start=40,2.84,2.84,2.84,2.0280000000000005,2.84
72,Nathan C.,"Ellijay, GA",0,5,12.0,2.0,2015-10-05,"Excited to try one of their new burgers. Well, went with portobello Swiss with sweet potato fries. Fries were pretty decent. Burger was not great. Hardee's has a better burger. Also, the bun seemed old with hard spots that were attempted to be covered by buttering and cooking.",https://www.yelp.com/biz/applebees-neighborhood-grill-and-bar-dorchester-3?start=60,2.84,2.84,2.84,1.864,2.84
24,Scott N.,"Boston, MA",1,3,,2.0,2015-11-17,Crappy. Have to head out of town tomorrow stopped for a bite between errands. No point giving a blow-by-blow of the experience.  Servers were rude and the food was bad.  All you need to know. Two stars because at least the manager got involved twice without my asking (it was that bad) so that's something.,https://www.yelp.com/biz/applebees-neighborhood-grill-and-bar-dorchester-3?start=40,2.72,2.72,2.72,1.864,2.72
8,Beth R.,"Boston, MA",158,393,111.0,3.0,2015-12-26,"Surprisingly, I like this Applebee's. I'm usually not too fond of the chain, but this location wasn't bad. The service was average & attentive when needed and the atmosphere was comfortable. Obviously, the menu is the same everywhere, but the drinks were right on. I love their Coronaritas.",https://www.yelp.com/biz/applebees-neighborhood-grill-and-bar-dorchester-3?start=20,2.8,2.8,2.8,1.9960000000000002,2.8
52,Sasha M.,"Somerville, MA",149,141,219.0,2.0,2016-01-05,"Ok...so first off, I never liked Applebee's at all but I decided to come here with my sister last night on a whim because it was convenient. My sister wanted to sit at the lounge side instead of the restaurant and at most places we go to, you get to grab any seat or 2-top and the bar/lounge server will be there to service you.... My sister and I grabbed a 2-top and as I was putting my bag down, this man (server) told us to go back to the front and someone will seat us. Alright, so I was thinking, ""new policy? new thing? I never heard of it"" And as my sister and I were walking out to the front, the woman said, ""No, you can go back in and sit down wherever...you don't need us to seat you"" RED FLAG there for me...already I was getting bad vibes.  While we were waiting for a server, we saw that gentleman half ass walking toward us and then flagging down the other server to grab our table. I THINK that they don't do sections for bar areas, but I could be mistaken. He wasn't particularly friendly to us but was busy flirting with a hightop nearby most of the time we were there.  ANYWAY, I digress....our server was named Maria, she was the sweetest! I was so happy that she was our server instead of the man from before. I ordered a burger & fries which came out quickly and was very tasty. For drinks, I ordered a Gin Martini. I definitely should have thought twice on it because it was terrible to swallow but I forced myself to drink it. Maria asked me how it was and looked so worried so I told her it was fine because she was just so nice. I had to order a Sprite to chase my martini with.  Overall........Maria is the only reason why I even gave any stars to this place. I will NEVER come back here again...I'll take my chances ANYWHERE else.",https://www.yelp.com/biz/applebees-neighborhood-grill-and-bar-dorchester-3,2.72,2.72,2.72,1.864,2.72
15,Taryn S.,"Jamaica Plain, MA",1,31,,5.0,2016-01-21,"A few years ago I went to Applebee's for a normal meal. The food I got was a hamburger, macaroni and cheese, and fruit. For the people who are vegetarians, there are lots of salads and they are a big hit! I would give this restaurant 5 stars because the food comes quickly. The service is good because the people there treat you very well. It's quite a lot of money but they make it up to you by giving you the best food in Boston.  - Written by Ms.Taryn's third grade student, Iyla L.",https://www.yelp.com/biz/applebees-neighborhood-grill-and-bar-dorchester-3?start=20,2.72,2.72,2.72,2.2600000000000002,2.72
60,Sarah T.,"Boston, MA",80,2,,2.0,2016-02-24,"I didn't want to take to Yelp, but felt compelled to share our now 3 in a row negative South Bay Plaza Applebee's experiences.  I'm fully aware that Applebee's is not The Ritz, but my comments will have nothing to do with atmosphere or the food.  This restaurant is clean, spacious, and the food is good!  Prices are great.  The service and staff are what's bringing this Applebee's down.  My husband and I live in the area and Applebee's was our savior last winter during all the bad snowstorms.  We had a routine of digging out the car and heading over to Applebee's to enjoy the drink specials (how can you go wrong with a $4 house margarita/$3 Coors?) and tasty appetizers- we really had a good thing going for its convenience and price.  Consistent good food, clean, nice atmosphere.  Something must have changed over the course of the year (Staffing?  Management?) because our last 3 experiences have been frustrating.  I'd like to first share the night before Thanksgiving 2015- not a crowded night at Applebee's, plenty of staff on hand, we were quickly seated in the dining room.  After waiting at least 15 minutes for a server to come over to take our drink request, we put in an appetizer and then ordered our entrees to avoid another wait- we thought we were doing the server a favor.  Appetizer came out and my entree immediately followed, drinks brought over, though, we both asked twice for waters and never got them, but oh well.  The kicker is that my husband's entree never made it.  We both watched the server write it down and it never even came.  We waited, we drank, seeing if it would come--nope, just the check.  We weren't charged for it, so that was fine, we moved on and were over it and ready to leave. Because it's a convenient, clean restaurant for a cheap tasty meal, we went back.  Seated in the bar area this time and had the nicest, most attentive server ever.  I wish I could remember her name so I could give her a shotout for doing her job and doing it wonderfully.  Things were fine.  Put our drinks in, got plenty of water, and ordered an appetizer and entrees.  Everything came out fine, except my husband got the wrong entree.  No problem, our server totally made up for it with her awesome customer service.  What really sealed the deal for us, was a recent night at Applebee's this February.  We waited about 20 minutes for a table, which was fine, it was Friday night after all, and were seated in the dining room.  Waited at least 20 minutes to be acknowledged by a server, put our drinks and appetizer in.  My husband's drink came over and was in a pint glass with red lipstick on it.  Not the server's fault, but come on.  Gross.  We waited so long for those drinks!  Luckily, another one quickly made it over.  Got our appetizer, put our entrees in, and were hoping for more drinks.  But our server was nowhere to be found.  By the time he came back around, we were both over it and ready to go home, so just asked for to go boxes because we had fully digested in the amount of time it took him to come back over to us- never apologizing for the wait or even asking if we needed anything else.  The to-go boxes never made it and the server disappeared again.  When I was about to get up and ask a hostess for boxes, he conveniently came back, so we grabbed the boxes and got out of there.  I just can't take the lack of customer service here--it kills me, because we really liked this Applebee's location.  If it's understaffed on a Friday night, then that needs to be addressed by Management.  People go out to eat because they want a night off from the usual routine.  They want to relax, have drinks and food with friends/family--it's a shame to see this Applebee's go under because of the poor service.  Is it a training issue?  Why are the servers so poorly trained and inattentive?  I will also add, we always left the servers 20% tips despite their sub-par service- people have off days and I know it's a living, but we just can't take it anymore and won't be coming back.  We haven't escalated our issues to Management because by the time our servers come to our attention, we just want to leave and go home without causing a fuss.  I get it, this industry can be overwhelming, but customer service is a fundamental principal of any occupation.  End rant. Get it together, Applebee's, you can be so much better!",https://www.yelp.com/biz/applebees-neighborhood-grill-and-bar-dorchester-3?start=60,2.72,2.72,2.72,1.832,2.72
38,Terry W.,"Dublin, CA",1,6,,3.0,2016-03-21,"My family of 4 had lunch there and it was not busy so we sat down right away. I enjoyed the Boston theme atmosphere. Service was good as we were undecided. The food came out fine. My wife had the Oriental chicken salad and I had the lemon chicken. No issue as it came out promptly. The kids had the chicken tenders and the steak. Again, everything was fine. After the food was served, service got a bit spotty. Refills on drinks were almost non-existant. No follow up on how we were doing. Not familiar with paying at the table's machine, it made made more sense. Servers could see that there was no need to follow though the meal any more because they don't even bring out a check. It made the whole meal experience from pretty good to so-so. A bit disappointed in getting the service that we all expect from a sit down meal.",https://www.yelp.com/biz/applebees-neighborhood-grill-and-bar-dorchester-3?start=40,2.68,2.68,2.68,1.9000000000000001,2.68
21,Carly S.,"Milford, CT",130,11,,1.0,2016-03-21,"Horrible service. Drinks, appetizers, and food took too long to come out. My server was hardly ever at our table, or passing by it to call her over. The portions of the steak were so small. Saw two women get into a fight with each other in the restaurant, then saw a man and a woman get into a fight. Not the best experience. Would not come back.",https://www.yelp.com/biz/applebees-neighborhood-grill-and-bar-dorchester-3?start=40,2.68,2.68,2.68,1.6360000000000001,2.68
20,Eddaliz D.,"Boston, MA",15,19,4.0,1.0,2016-03-25,Never again ! order for pickup - when i got back to work that i opened the plate i guess they added the water from the vegetables all over my loaded potatoes. my steak was frozen in the middle. i asked for it well done and payed extra for caramelized onions which were never added. the vegetables were stale and no taste. over it !,https://www.yelp.com/biz/applebees-neighborhood-grill-and-bar-dorchester-3?start=40,2.56,2.56,2.56,1.6360000000000001,2.56
1,Peter Y.,"Greenfield, IN",4,203,88.0,2.0,2016-04-09,"Not recommended. I ordered ribs and they were burnt and the side were horrible, especially the fries, they are completely soft. In addition, the price is unexpectedly high. Even though they barely have any service here. They recommend you pay 20% tip. Hilarious.",https://www.yelp.com/biz/applebees-neighborhood-grill-and-bar-dorchester-3?start=20,2.6,2.6,2.6,1.736,2.6
17,Kethlaine M.,"Boston, MA",229,33,16.0,2.0,2016-04-19,I've been here numerous times with my boyfriend and we've had phenomenal service. But the last 2 times that I've popped in with my best friend and my family it hasn't been the greatest. Maybe sticking with the bar service would be more ideal seeing that's where I tend to receive the best service (food and beverage),https://www.yelp.com/biz/applebees-neighborhood-grill-and-bar-dorchester-3?start=20,2.64,2.64,2.64,1.704,2.64
10,Ann H.,"Boston, MA",6,42,25.0,4.0,2016-05-06,"The service was great, waitress was super fast. Food mostly turned out great. The resturant is a bit sticky but... it's fine. This is my to go place .",https://www.yelp.com/biz/applebees-neighborhood-grill-and-bar-dorchester-3?start=20,2.6,2.6,2.6,1.936,2.6
18,Vel S.,"Randolph, MA",0,27,,1.0,2016-05-06,"Went to this Restaurant on Wednesday. Service was terrible, food was cold and there appeared to be a pair of used sneakers on the sink at the Bar.  I complained to the Manager and he appeared to be unconcerned and suggested I contact the General Manger. The General Manger also showed a lack of concern for the condition and poor service.  From all the negative reviews maybe they will be joining the Braintree and the Chestnut Hill Restaurants soon.",https://www.yelp.com/biz/applebees-neighborhood-grill-and-bar-dorchester-3?start=20,2.52,2.52,2.52,1.5400000000000003,2.52
28,Jess D.,"Salem, MA",0,5,1.0,5.0,2016-05-29,"Great food, great service. Food arrived fast, appetizers were great. Piña coladas were great. There was not wait, surprised for memorial weekend. Wendy was our server, she was great and sweet.",https://www.yelp.com/biz/applebees-neighborhood-grill-and-bar-dorchester-3?start=40,2.52,2.52,2.52,1.9720000000000002,2.52
45,Ellen H.,"Beverly, MA",402,406,21.0,1.0,2016-07-17,"Why did I do this to myself? Well, actually I know exactly why. It's because I didn't feel like spending 2 hours in traffic when I could kill one having dinner and still make it home at the same time. I don't remember Applebee's sucking so hard. Maybe I've only ever had fried options so I was ill-prepared. I don't know. What I do know is I would have been better off at Olive Garden. Or the Pizza Hut Express in Target... Seriously. First of all, LOL at the sticky tables because according to my experience and prior reviews, these things have been sticky for years. Apparently same with the service: came in, empty lobby, went to bar area where one server said ""sit anywhere"", so I chose a 2-Top. Then the hostess came over and said ""Oh did you just walk in (like I wasn't supposed to). Sorry I was in the bathroom do you want a menu?"" .... Yes that sounds delightfully appetizing, thanks .... Best part of the experience was Howard, my server. Best manners I've ever encountered from a server or probably otherwise. He was just a nice guy and I always appreciate politeness, so thanks, Howard! Unfortunately, the food was laughable. My $11 salad was smaller than appetizer size. It was a single layer of lettuce on a plate, with cubed chicken (like the kind in a tub at Subway or something!), lackluster ingredients, and zero appeal. I ate it slowly while reading reviews of this place and it was still gone in 5 minutes and I'm still hungry, but refuse to shell out another penny for that quality of food. Blech. So, I obviously won't be coming back -- completely based on portions and food quality. ** Note: after I finished this review, I went to the bathroom, where one server was on her cellphone texting, clearly hiding from her manager. Meanwhile the bathroom was a hot mess. Went outside to leave and two more servers were standing right outside the building smoking and using less-than professional language. I'm not a Sensitive Sally, but talk like that either far away from the entrance, or on your own time! Dropped to 1 star!",https://www.yelp.com/biz/applebees-neighborhood-grill-and-bar-dorchester-3,2.48,2.48,2.48,1.4760000000000002,2.48
14,Errieana T.,"Boston, MA",42,32,4.0,3.0,2016-07-27,"I went in and had a great dinner with my friend and our waiter Rafi was awesome and very observant. although the food was rushed and slightly warm. That is the only thing you guys have to work on the food,sauce and appetizers, the drinks are fine and desserts.",https://www.yelp.com/biz/applebees-neighborhood-grill-and-bar-dorchester-3?start=20,2.56,2.56,2.56,1.7080000000000002,2.56
