,Username,location,friend_count,review_count,photo_count,rating,date,review,Url,roll25,roll100,roll250,special_25,Final_Rating
387,Sheri P.,"Stockton, CA",63,14,11.0,4.0,2012-01-03,I love BJ's!! They now have a gluten free menu and are always MSG free!!!! They will also serve you the lunch menu even if it's not lunchtime.  I didn't give a 5 because sometimes there is a long wait and sometimes the service is not that great.,https://www.yelp.com/biz/bjs-restaurant-and-brewhouse-stockton?start=440,3.36,3.3,3.3,2.8960000000000004,3.3240000000000003
350,Moua L.,"Concord, CA",179,356,434.0,4.0,2012-01-08,"So glad I decided to come here instead of a Pho house.  The recommendations from the waiter was outstanding. He was so truthful and I love that. It's all about the Seared Ahi Tuna salad. This plate was enough to feed 3 of us. The salad dressing was one of the best dressings I've had in a long time as well. Hope it's not filled with high fructose corn syrup. That would be just wrong.  In addition to getting the salad, we had ourselves each a cocktail (which were on the sweeter side) and calamari appetizers. We asked the waiter if they were fresh and we got ""fresh"" calamari.    This place is now on the top of my list of places to go to when visiting Stockton.",https://www.yelp.com/biz/bjs-restaurant-and-brewhouse-stockton?start=240,3.44,3.3,3.3,2.8960000000000004,3.3560000000000003
393,Honey B.,"Oakland, CA",261,240,184.0,3.0,2012-01-11,"BJ's, you may thank your bisque for the bump up in the ratings. The tuscan tomato bisque is freakin' delicious!!! I only go there for their soup, so you must try it! Everything else is still the same. I gave their new black bean veggie burger a try, but it failed me. I even see that it was short lived and yanked from the menu. Oh well, another one bites the dust at this brewhouse. At least the soup is good.....",https://www.yelp.com/biz/bjs-restaurant-and-brewhouse-stockton?start=440,3.36,3.32,3.32,2.7640000000000002,3.3360000000000003
352,Bruce B.,"Walnut Grove, CA",43,775,1001.0,4.0,2012-01-12,Great menu here with just about Anything one could want. Great home brews and a great big tv for the games. Quick and attentive service with all the amenities makes this a great place for the big day February 5th.,https://www.yelp.com/biz/bjs-restaurant-and-brewhouse-stockton?start=240,3.32,3.35,3.35,2.8960000000000004,3.338
279,Stacey P.,"Ventura, CA",109,382,641.0,4.0,2012-01-20,"Happy Hour Review! The hours are Monday-Friday 3-7PM and and Sunday-Thursday 10PM-12AM. The specials are $2 off appetizers, $1 off well drinks and pints and 1/2 price off mini pizzas!   It's a good spot to go with friends to catch up or watch a game.  They have a huge big screen tv but it's split into 6 screens so it might not even be bigger than the TV at your own home. I ordered the Mediterranean Deep Dish Mini Pizza and with the happy hour special it was only $5!  It comes with 4 slices and it's pretty filling.  I loved the sliced peperoncinis - spicy and sour!  The crust is just amaaaaazing and a must order for happy hour.  The staff is quick and super friendly.  My birthday was last week and my friend's birthday was last month but our waiter still gave us two free mini pizookies!  Great service! Great time!",https://www.yelp.com/biz/bjs-restaurant-and-brewhouse-stockton?start=320,3.32,3.38,3.38,2.8960000000000004,3.3560000000000003
390,Angel G.,"Stockton, CA",43,66,75.0,3.0,2012-01-24,"I really like this place but at time I would get some poor costumer service.. This one time one of the host rolled her eyes at me when I asked for something and another time one of the waitress told my friend to take his straw out his glass or he mite get cooties... WTF?? She was being serious to.. Who says that kind of stuff? Were adults, so we dont need to be saying that.. Especially while your serving someone.",https://www.yelp.com/biz/bjs-restaurant-and-brewhouse-stockton?start=440,3.32,3.37,3.37,2.7,3.35
544,Casey H.,"Thornton, CA",3,9,5.0,3.0,2012-02-04,"We went on a Saturday afternoon, about 1:30, we where seated right away. Atmosphere is really nice, alittle noisy, Staff was friendly. I ordered the Double Brewhouse Burger (1lb.) $10.95. Good taste, but I asked for it medium, got it welldone, had to ask for my fries, One in our party ordered the Calzone, $9.95. Thought it was boring, not enough filling. Over all, we would go back, but not in a rush.",https://www.yelp.com/biz/bjs-restaurant-and-brewhouse-stockton?start=380,3.36,3.37,3.37,2.7,3.366
464,Madeline D.,"Poway, CA",108,156,66.0,4.0,2012-02-21,"Came here with all the other love birds last night & geez was that a bad idea. Called ahead to tell them we would be there in 30 mins, & they said they would write our name down & to just check in when we got there. Arrived & we were told the wait was 50 mins, but since we called ahead we would wait 30 mins. Ok that's fine I guess. 50 minutes later we had not been seated & so my man went to check on things. They acted shocked we didn't have the pager vibrator thing even though we had asked twice for one since arriving & both times they were out but assured us we would be called  over the speakers. We were then seated promptly since they had clearly forgotten about us. So the start to the evening was a little rough.. BUT we were seated & our server was really friendly & everything we ate was delicious, & I would order it again. Eating healthy here is difficult with many entrees being 1,000+ calories. Here is what I ate & enjoyed: - Seared ahi tuna salad- delicious dressing & lots of tuna!  - Minnestrone soup (sun- tues only) - Stuffed spinach mushrooms",https://www.yelp.com/biz/bjs-restaurant-and-brewhouse-stockton?start=420,3.4,3.37,3.37,2.8000000000000003,3.382
300,Jessica C.,"Hayward, CA",68,174,30.0,2.0,2012-03-03,"I treated my Mom's family here for my brother's farewell dinner. Our server was very pushy and when we did not order the items he mentioned, he completely neglected our table. Many times we tried to ask for a drink, or dessert  and he walked past us.  The food was great! The service was not.",https://www.yelp.com/biz/bjs-restaurant-and-brewhouse-stockton?start=340,3.28,3.35,3.35,2.6000000000000005,3.322
507,Lauren w.,"Galt, CA",0,23,12.0,1.0,2012-03-16,"I just ate here tonight, had the worst service ever, they took our order, served everyone else's food at the table except mine and my boyfriends and then came back 5 minutes later to finally tell us they were out of what we ordered and that if we hurried we could order something else but it had to be fast. We ordered something else and it took forever! We had to pay for that by the way!! We asked if we could have a free pitcher for the mess up, our waiter comes back with exact words FROM THE MANAGER ""that ain't happin"" and laughs in our waiters face.  Nice to know Bj's of Stockton is being managed by trailer trash... Just to be clear of the message that I'm trying to get across here, the server should have known when putting our order in that they were out of what we wanted, not serve the whole table their food and make us wait. Also if the pitcher couldn't be complimentary fine whatever, as a freaking manager of a business you do not talk that way in front of the actual guests you're talking about! I'm sure anyone in the food industry would agree that's not the way to treat paying customers. Right?",https://www.yelp.com/biz/bjs-restaurant-and-brewhouse-stockton?start=520,3.16,3.32,3.32,2.5640000000000005,3.2560000000000007
302,A C.,"Lodi, CA",0,24,,2.0,2012-03-17,"Great decor. I love the dark motif. Definitely an improvement over other chain restaurants which sometimes seem deliberatly loud (design as such). Thats all good I can say.  The food was atrocious. I had chicken wings which were certainly frozen and fried, not fresh. and they were cold in the middle. Sent them back. Had a salad that was drenched in dressing. very heavy handed.  lastly, had tortilla soup and tomato bisque. They were of a quality on a par with the soups you get from Safeway (Signature soups). Sure those are alright from the grocery store, full of salt, but still....they aren't bad at all. But at a restaraunt ?  I felt that they literally just opened up one of those, poured it in a bowl and served it up for a price. The soup was not fresh, thick and disgusting.  Service, atmosphere, timing of service, dealing with sent back food was all good. I will not be going back because I can get better food at the grocery store.  Also, had 2 of their beers (red, pale ale). Not exceptional, nothing to write home about and they had ample selections from the tap. kudos for that. if I wanted to go somewhere to have a drink and an appetizer, I would go back. I love the design. dark and refined.",https://www.yelp.com/biz/bjs-restaurant-and-brewhouse-stockton?start=340,3.08,3.3,3.3,2.7280000000000006,3.2120000000000006
315,Lauren N.,"Walnut, CA",112,87,16.0,3.0,2012-03-23,"The place can get loud and annoying, but I like their pizookies and fried artichoke hearts. I always get the fried artichoke hearts whenever I go. The drinks are alright. Not the best. I don't recommend their buffalo chicken pizza (way too salty).  If you like big crowds and loud restaurants, I recommend it. If not, beware!",https://www.yelp.com/biz/bjs-restaurant-and-brewhouse-stockton?start=340,3.08,3.29,3.29,2.7960000000000003,3.206
384,Brian R.,"Stockton, CA",17,279,36.0,3.0,2012-03-25,"Nice place to go, the food is okay but they are so close to being good I give them 3 stars. Good selections but they need a little more flavor across the board.",https://www.yelp.com/biz/bjs-restaurant-and-brewhouse-stockton?start=440,3.08,3.28,3.28,2.7960000000000003,3.2000000000000006
396,Barbara G.,"Lodi, CA",259,310,22.0,4.0,2012-03-30,Great white pizza is the bomb!!,https://www.yelp.com/biz/bjs-restaurant-and-brewhouse-stockton?start=440,3.08,3.28,3.28,2.9280000000000004,3.2000000000000006
471,Ryan B.,"Lathrop, CA",6,13,2.0,3.0,2012-04-27,"First off, great beer!!! But tonight we got 3 cold meals delivered. The manager was very accommodating and fixed the problem. Also took half off each meal. This was the first problem I've had here. Usually great food. Service is always slow but friendly. Very loud in there!",https://www.yelp.com/biz/bjs-restaurant-and-brewhouse-stockton?start=420,3.16,3.27,3.27,2.732,3.226
487,Cindi M.,"Stockton, CA",21,27,6.0,4.0,2012-05-01,"Above average chain restaurant / sports bar.  Great for bringing noisy kids because they place is so loud, nobody can hear them screaming.  Some stuff I love, others not so much.  Portions vary from huge to tiny, like put in a wide, yet very shallow bowl to appear large, such as their soups - as to create the perception that they're huge.  Typical college-aged servers, which is what you expect in a place like this.  Of the 20+ times I've eaten here, twice at dinner we've had apps comped because they either came out with or even after entrées arrived.  Good place to grab a beer and hang with the fam.  My fav is the BBQ chicken salad.  I needed a good replacement after CPK closed down the road, and this does the job just fine.",https://www.yelp.com/biz/bjs-restaurant-and-brewhouse-stockton?start=500,3.16,3.28,3.28,2.768,3.2320000000000007
419,Linda C.,"Lodi, CA",9,45,2.0,1.0,2012-06-17,"Not only did we have to wait over 30 minutes for our food but when it came two if the dishes were prepared wrong and one was cold.  We asked to see a manager, he made excuses, ended up comping some if the dishes...we would rather have paid in full, served good food and received good service!  Instead we got neither!!!",https://www.yelp.com/biz/bjs-restaurant-and-brewhouse-stockton?start=480,3.12,3.28,3.28,2.468,3.2160000000000006
244,Audrey L.,"Bukit Timah, Singapore, Singapore",435,798,1122.0,3.0,2012-06-18,One of the few places in Stockton you can count on to be: 1) Open late on weekdays and weekends 2) Have a decent crowd 3) Have decent (albeit large portioned) food,https://www.yelp.com/biz/bjs-restaurant-and-brewhouse-stockton?start=260,3.12,3.27,3.27,2.732,3.21
313,Mike T.,"Stockton, CA",2,11,,2.0,2012-06-20,"I normally really like this place, but I took my dad there for the first time on Father's Day.  It was really busy and they weren't ready for it.  They lost one of the orders for our table, so we had to share food with that person until their's came.  We also didn't get silverware until our food sat in front of us for several minutes. I love the Jerimiah Red beer and I will come back again, but NOT during rush times or Holidays!!!",https://www.yelp.com/biz/bjs-restaurant-and-brewhouse-stockton?start=340,3.04,3.27,3.27,2.568,3.178
375,Aaron B.,"Stockton, CA",206,102,2.0,4.0,2012-06-24,"BJ's Restaurant and Brewhouse is a great place to go whether you want to watch the sports game (go Raiders) or to entertain friends. Their selection of beer is great, they have all different types on tap and bottle, friendly and beautiful waitresses, and great food. You can get anything from a steak, to jumbalaya (my personal favorite) although they are known for their pizza and beer. And they have a healthy part to their menu (which I usually skip right past) This place is a little noisy, usually busy, and a little pricy though but what do you expect from a brewhouse?",https://www.yelp.com/biz/bjs-restaurant-and-brewhouse-stockton?start=400,3.04,3.27,3.27,2.8320000000000003,3.178
355,Karla Marie D.,"East Bay, CA",442,226,1067.0,4.0,2012-06-25,"I went here during Father's Day with my family. The wait wasn't long since we just sat in the bar area. But knowing it was Father's Day, it was definitely a wait for others. They have great and delicious deep dish pizzas here! Great White and Sweet Pizza is scrumptious and mouthwatering! I also love pasta!! I've had their Chicken Fettuccini Alfredo, also delicious.  When I went, my family and I ordered: Great White Pizza, Mini- Bruschetta, Margherita Pizza All were very satisfying. The service was great, but the only downside is their alcohol beverages. I ordered a Strawberry Mojito. It tasted great! But I hardly tasted the alcohol. Overall experience was awesome!",https://www.yelp.com/biz/bjs-restaurant-and-brewhouse-stockton?start=240,3.16,3.28,3.28,2.8320000000000003,3.2320000000000007
551,d p.,"Linden, CA",3,45,13.0,2.0,2012-06-25,This Restaurant looks nice staff is also nice although very forgetful when it comes to putting orders into the kitchen.  Our server got the wrong appetizer and the wrong dinner order.  That being said lets move on to the food i have been there two times and unless you like salty soup and pasty breading on southern fried chicken then this may not be the place for you.  We also got the sweet balsamic chicken and had good flavor but it also had a pastiness to it.. Cheers to the small thin fries and onion strings those we actually tasty.  Parmesan crusted chicken sand. also soggy and pasty.  Well i tried it and most likely wont be going back again.  I may have a more sophisticated pallet in comparison to most of their clientele.,https://www.yelp.com/biz/bjs-restaurant-and-brewhouse-stockton?start=380,3.08,3.26,3.26,2.536,3.1880000000000006
386,Robert H.,"Modesto, CA",33,22,24.0,4.0,2012-06-30,Nice place to stop in and watch the game have a drink. I had the calzone. Great.  I would recommend. It wasn't quite dinner time yet but very friendly staff.,https://www.yelp.com/biz/bjs-restaurant-and-brewhouse-stockton?start=440,3.08,3.28,3.28,2.7039999999999997,3.2000000000000006
297,Tiffany N.,"Santa Clara, CA",160,147,609.0,5.0,2012-08-18,"LOVE THIS PLACE!!!!!!!  I always, always, ALWAYS come here for birthday dinners because of the free pizookies!!!! So mouth-wateringly satisfying for dessert lovers like me!!!  I love the variety of their menu!!!!!! I also love the fact that the calories are displayed beside the menu items so it's easy to make health-conscious meal decisions!!!! Plus, you can get your pizza with WHEAT CRUST!  AVOCADO EGGROLLS ARE A MUST! Fried calamari is very crispy and delicious as well! The New Orleans Jambalaya is also one of my faves!  Price is just right and it's definitely always crowded!  The only thing I have to complain about is the wait time!!!!! Just another excuse to enjoy a few appetizers and catch up with the fam &/or friends while waiting, I guess!!!!",https://www.yelp.com/biz/bjs-restaurant-and-brewhouse-stockton?start=220,3.12,3.32,3.32,2.7079999999999997,3.2400000000000007
537,Roxy L.,"Stockton, CA",51,258,232.0,2.0,2012-09-02,"Only giving the 2stars for the food only...service horrible, cleanliness terrible, attentiveness non-existant, friendliness totally missing. Late lunch so it was not at all busy. Seated in a dirty booth. I had to use my hand and the menus to brush off the seat. After sitting down one of the Other waiters came over to ask if he could wipe down the seat. I told him no I think I just did that myself. Our waitress was totally oblivious to this conversation or just didnt care that she tried to sit me in a bed of crumbs, salt and chunks of beef. We could not decide right away what to order but that didnt matter because our M.I.A waitress, Jessica, was nowhere to be found. While in the restroom I heard 2 of the workers talking and 1 was telling the other one that some guest was requesting a new waitress, I'm guessing it was our waitress. She was just awful. Spit while she spoke to us, took forever to take our drink orders or even to give water. Honey, its like 96 degrees outside and we are roasting and we cannot even get a cold drink! Little Miss Jessica finally took our order. Then she fiiiinally brought our drinks. The food came and tasted ok, better every other time we have been there. Thanks for that experience. My daughter was home for the long holiday visiting from college. We could have went many other places but we came here. Maybe next time we won't.",https://www.yelp.com/biz/bjs-restaurant-and-brewhouse-stockton?start=380,3.12,3.3,3.3,2.2800000000000002,3.2280000000000006
150,Jerline H.,"Washington, DC",118,301,696.0,4.0,2012-10-03,"Chat conversation. ""We cannot make up our minds on where to go! I just want BJs!""  ""Haha bjs... but you probably meant pizza, burgers, and beer""  ""I set you up so well but you blew it."" ""I literally make that joke all the time. Let's be real, YOU blew it."" Anyway, I always have fun here; come by for birthdays, causal dates (the kind where you're trying to impress somebody but trying not to look like you're trying), celebrations, happy hour, and sports games!  To eat and drink and be merry: + Avocado egg rolls  + Ahi poke  + Gourmet Mac & Cheese + Shrimp scampi pasta + Jeremiah Red beer  + Piranha Pale ale  I got a sampler of all their ales, was too full to finish them all, had girlfriends who were already drunk on their margaritas, and had to call some guy friends to come join us for happy hour. :T  Anyway, sometimes you need to strongly hint that it's a person's birthday, especially when they are busy, but the waiters and waitresses are sweet - they'll flirt with you (my grandlittle) big time! I'm a fan of this BJ's!",https://www.yelp.com/biz/bjs-restaurant-and-brewhouse-stockton?start=200,3.12,3.31,3.31,2.448,3.234
269,Gigi L.,"Palo Alto, CA",234,292,1322.0,3.0,2012-10-03,"Yes, it's a chain. And, yes, the menu is mainly 'bar food'.  So, that's why I'm giving it three stars only.   I would return here just to enjoy a beer at one of their nice high-top tables in an open bar area.  It makes for a great spot to meet a small group of friends and chat a few hours away ... in Stockton. I ordered a Sierra Nevada and lettuce wraps. And, I was quite content... :) Cheers!",https://www.yelp.com/biz/bjs-restaurant-and-brewhouse-stockton?start=320,3.08,3.3,3.3,2.316,3.2120000000000006
462,Susan H.,"Harrisburg, PA",21,70,42.0,4.0,2012-10-09,"We love it here.  The beer is great (as is the hard cider) and I haven't ordered anything that I didn't like yet.  The service is always really good, particularly the waitress I've had the last 2 times, Casey.  I only wish there were one closer to me!",https://www.yelp.com/biz/bjs-restaurant-and-brewhouse-stockton?start=420,3.12,3.3,3.3,2.384,3.2280000000000006
358,Leana L.,"San Francisco, CA",322,889,281.0,4.0,2012-10-24,"This BJ's location might just have redeemed all my frustrations with the BJ's we frequent in San Bruno when I'm out to lunch with coworkers! We were seated nearly right away, pausing only so they could clean and set up a table for us. Our waiter was attentive, charismatic, knowledgeable, and prompt! He kept our waters filled, switched out empty Coke glasses for full ones, gave us a run down of all their drink specials and seasonal dishes. He encouraged dessert, but in a non-pressuring sort of way. The food was also pretty good. I had the enLIGHTened Thai Chicken Mango salad (dressing on the side). It was tasty with a good ratio of chicken to salad, which is often something lacking in low-calorie dishes. The dressing was also quite tasty. It seemed that everyone else loved their dishes also. My mom ordered the Hawaiian Mahi Mahi, my sister ordered the Chicken Fettucini Alfredo, my dad ordered the Turkey Club, and my uncle ordered the BBQ Chicken Pizza deep dish.  When my sister inquired about the garlic bread that was supposed to come with her dish according to the picture on the menu, the waitress who delivered it said it didn't come with it. However, moments later, our main waiter came by and delivered a couple slices of garlic bread saying, ""I always think the dish should look like the picture"". So nice! We were in a bit of a rush to head out towards the end of our meal, so we asked for the check and our waiter was quick to hand it over and also got a box for the other half of my uncle's pizza. Overall a great experience here! If I lived in Stockton, I'm sure this would be a great place to hang out with friends or watch the game at the bar.",https://www.yelp.com/biz/bjs-restaurant-and-brewhouse-stockton?start=240,3.12,3.31,3.31,2.352,3.234
270,Luke Y.,"Elk Grove, CA",20,82,9.0,1.0,2012-10-29,"This place is horrible; I've been to many BJ's and this one just sucks. We got there around 8:30pm; had a party of 13; the place was pretty empty, we waited 20-25 mins before getting seated because I had to go complain first. Their excuse was that they had to set the table; when we got to our table, we had no spoons or forks so I guess that 25 mins setting up our table was a lie.  Then all ended up not finishing our food, it was pretty nasty, not well made like other BJ's! Will never come here again! I'm going to call management tomorrow and find out what is up with this restaurant; this place is not like a typical BJ's!",https://www.yelp.com/biz/bjs-restaurant-and-brewhouse-stockton?start=320,3.0,3.28,3.28,1.988,3.1680000000000006
463,Miguel A.,"Stockton, CA",0,1,,3.0,2012-11-10,"""BJ's Restaurant and Brew house"" I really love the pizza from BJ's, but my only complaint is that the waiters sometimes are really slow. For example, they come to get you started with drinks but they do not usually bring them until the food arrives which is ridiculous because the drinks are ready. Let me tell you about the pizza, their menu includes a different variety of pizzas. You can choose between meat and vegetables and you can put as many ingredients as you want. One of my favorites is the BJ's Favorite, but I hate olives so I always replace them with jalapenos because I love spicy food. Another one of my favorites is the chicken BBQ pizza, so delicious which I also add jalapenos. If you love them both, you can also get two of your favorite pizzas in one, awesome right? When I cannot decide which one I want the most, I just get half of the BJ's favorite & half of the chicken BBQ. They also have a different variety of beers, which include their own beers and international beers, so you have plenty of options. I love dark beer, one of my favorites is the nutty brunette; and if you want to explore their beers you can ask to try it. Which is awesome because you try different beers and based on that you can choose which one is the best choice for you. I can say I have had good service at times but it is not consistent. Depending on the waiter that is how your experience is going to go. On my last visit I had such a great waiter, she was checking on us often which I appreciate. Obviously by the end, when my check was ready I gave her a fair tip. I must say depending on the service that is how I based the tip they will receive.",https://www.yelp.com/biz/bjs-restaurant-and-brewhouse-stockton?start=420,3.0,3.29,3.29,2.1879999999999997,3.174
472,Anthonye P.,"Richmond, CA",10,11,,3.0,2012-11-18,I went to this BJ's tonight 10/6/12 and the service was really good. Our waiter took great care of us. My girlfriends pasta was a little bland but overall a decent experience .,https://www.yelp.com/biz/bjs-restaurant-and-brewhouse-stockton?start=420,3.0,3.29,3.29,2.1559999999999997,3.174
