,Username,location,friend_count,review_count,photo_count,rating,date,review,Url,roll25,roll100,roll250,special_25,Final_Rating
168,Casey A.,"Lodi, CA",3,54,17.0,3.0,2015-09-20,"My family and I enjoy the 2 for $25.00 meal (pizza, salad & pizookie). We come here quite often when that deal is being offered. This is the closest to our house so we typically go to this location. We had a pretty bad experience that last time we were here. So bad that the Manager sent us a $10.00 gift card to use at another time. Since the deal is being offered again, we thought we would give it another shot.  We went for dinner last Saturday. We arrived early (around 4:30pm). We were seated fairly quickly since they weren't that busy but then everything went downhill from there. Since we knew what we were having, we ordered right away. We actually upgraded our pizza to a large (for $3.00 more) and added a side salad for our son. About 45 minutes went by and then our pizza finally arrived. The only issue, we never received our salads. Our waitress never came back to check on us. The person that delivered our pizza said they would check on our salads. A few minutes went by and out came our salads and then our waitress came by to say that she was sorry that no one ever brought them out. A few minutes after that the Manager came over to apologize for the delay.  I was shocked to say the least at what the Manager had to say. He apologized for the delay and then proceeded to tell us that he could not remove the price of the salads from our bill since it was part of the $25.00 deal. First of all, we never asked to speak to a Manager. Secondly, we never asked for anything to be removed from our bill. That is not in our nature. And lastly, we did order an extra side salad and I had a soda so if he really wanted to remove something from our bill, he could have removed either one of those items. For the three of us to eat a pizza and salad, we were there for almost 2 hours. I am sorry but they did not have any large parties when we arrived so I could not understand why it took so long. I did overhear another waiter telling the table next to us that they were short-staffed and that several of the waiters were picking up extra tables to help out.  Since we were disappointed once again, I do not know that we will go back to this location.",https://www.yelp.com/biz/bjs-restaurant-and-brewhouse-stockton?start=180,2.32,2.66,2.82,1.868,2.524
283,Jasmine S.,"Irvine, CA",0,6,,1.0,2015-09-25,"This is the most horrible Bjs I have been too don't deserve even one star!   Worst service ever,  chowder bowl burnt and hardly any chowder, took 30 minutes to get a new one, took 40 minutes to get our food.  By the time I got mine it was luke warm.   Sloppy presentation, way too much salt made my mouth burn.  Waitress said  even they use herbs only and no salt.  Waitress spilled drinks and don't apologize.  She acted nice but not once came to refill drinks.   I wouldn't recommend this place to anyone!  Long ticket times and no apologies for the delay is bad customer service!",https://www.yelp.com/biz/bjs-restaurant-and-brewhouse-stockton?start=220,2.32,2.66,2.816,1.6680000000000001,2.524
327,Trang H.,"Milpitas, CA",104,19,,1.0,2015-10-05,"Slow service. Appetizers took forever to come out. I'm sure the server forgot to punch it in because it shouldn't take 30 minutes to bring out chips and cheese and a couple other simple appetizers, on a slow night. Our lemonade was never refilled and we eventually got tired of waiting almost an hour for our shrimp scampi so we were trying to find our server to cancel it but she was no where in sight for a good 10 minutes so we had to ask the host to look for her. That took another 5 minutes. We were never asked how we were doing and the server did not apologize for any thing. I work in the food and hospitality industry so I'm usually lenient but tonight was just bad. I don't even want to talk about the food because it is straight up microwable food. I definitely don't recommend if you like quality food.",https://www.yelp.com/biz/bjs-restaurant-and-brewhouse-stockton?start=300,2.16,2.66,2.808,1.6680000000000001,2.46
236,Katrina A.,"Stockton, CA",8,10,1.0,4.0,2015-10-08,"I love BJ's. There food is good, and the service is great. Sometimes the wait is a little long, but that's normal.",https://www.yelp.com/biz/bjs-restaurant-and-brewhouse-stockton?start=280,2.28,2.69,2.812,2.096,2.526
4,Starr S.,"Stockton, CA",0,7,4.0,1.0,2015-10-10,"Generally good most nights but tonight? Nah. 12am, sitting in the bar area. Tall dark haired waitress named Mercedes would rather flirt with customers for over 10 minutes rather than take our orders, and then walked right past us  She was hot, but a 15 min wait for one water when we ordered two is ridiculous",https://www.yelp.com/biz/bjs-restaurant-and-brewhouse-stockton?start=60,2.2,2.66,2.8,1.8280000000000003,2.476
329,Cris G.,"Stockton, CA",0,3,,1.0,2015-10-12,"Decided to go to dinner at BJ's off Pacific Ave on a Sunday night with 3 other guests. The restaurant was about 50% filled with patrons. We were seated as soon as we walked in.  The server took our order, and we received our appetizer fairly quickly (15 min?). Then we waited for our entrée, then waited, then waited. Finally 3 of the 4 of us received our meal. The server told us that the cook forgot to make our fourth friends' meal, which were fish tacos. When she received her fish tacos, it looked more like a lettuce salad and 2 slices of hardened finger-shaped fish. Our other friend ordered the Salmon with asparagus and quinoa which looked nothing like the photo (there were probably 2 tablespoons of quinoa on the whole plate).  We asked for the manager, and the manager  said that the food is prepared in the same proportion all the time - which is not true because we've been there times before for the same meals and we had no issues with proportions before. The manager asked if we wanted another meal in replacement for the fish tacos - but we would still be charged for the fish tacos. My friend, who lost her appetite by this time, declined. The server returned and told us she was taking the tacos off the bill, but when we received our bill it was still on there, so we called for the manager again. The manager said she did not approve the tacos being taken off the bill, but we told her the server told us she would. She reluctantly said ok, rolled her eyes, and took the bill from the table to remove the taco meal.  Oh, and by the way...we were there for a total of 1 hour and 45 minutes - from the time they opened the bill to the time we stepped out. So unfortunate - the other BJ's Restaurants had wonderful service and great food, but they are not closeby.",https://www.yelp.com/biz/bjs-restaurant-and-brewhouse-stockton?start=300,2.2,2.66,2.792,1.8600000000000003,2.476
371,David C.,"Twentynine Palms, CA",0,1,,1.0,2015-10-14,"I generally like BJ's in various locations.  However tonight at this BJ's in Stockton it was consistently poor. After waiting 10 mins after being seated I finally went and asked the hostess if anyone was assigned to my area (even though several employees walked by without even glancing my direction). Finally a server arrived, so I placed my order immediately. A few minutes later she started to put a check on my table before realizing I just ordered from her.  After another 15 mins, the chili and wedge salad arrived. The chili tasted good, but was only lukewarm.  The wedge salad was mediocre at best. I never saw my server again throughout dinner and after waiting another 10-15 mins since finishing eating I finally decided I would just leave $10 to cover the dinner ($9.60 ). While I was at the hostess station getting change for a $20, the server came running with the check. I told her it was the worst service I've ever had there and gave her the $10.  I am a BJ's Rewards member because I usually like their food and service. Not at this location!  I won't be back!",https://www.yelp.com/biz/bjs-restaurant-and-brewhouse-stockton?start=400,2.04,2.63,2.788,1.924,2.394
232,M H.,"Stockton, CA",71,5,,1.0,2015-10-15,"My wife and I showed up at 7:20 and were told there would be a 15 minute wait for a table. Understandable as it was busy and it was dinner time for most people. We were seated by 7:30, however we waited 15 minutes for someone (who I would assume was a manager) to even take at least a drink /appetizer order. Another 15 minutes go by with no drinks. I then observed other tables who were seated after us, in the same section receive their drinks / appetizers before us. We waited another 5 minutes and then decided to leave due to poor service. I took our menus and silverware back up to the front desk and walked out of the door. I am a manager in customer service and have years of experience dealing with people which is why I didn't cause a scene, it's just tacky to do so. I could have probably asked to speak with a manager but I was pretty upset. It's understandable that these things just happen, but I won't be returning to my local BJs.  I've had better service at chow halls in Afghanistan.",https://www.yelp.com/biz/bjs-restaurant-and-brewhouse-stockton?start=280,2.04,2.61,2.776,2.052,2.382
160,Rene R.,"Stockton, CA",3,25,,1.0,2015-10-25,"This was the crappiest service we have had in a long long time.  Food was ok. We ordered three appetizers: the calamari, chicken wings, and stuffed mushrooms. We also ordered the burger for my son. We would have ordered more but the appetizers took so long to get to the table that we figured we were spending enough. Mushrooms were ok; they were stuffed with spinach with pesto cream sauce drizzle.  I liked the pesto flavor.  Calamari was a little overdone--the marinara sauce was flavorless, but the white dipping sauce was good and garlicky.  Chicken wings were done as expected. My son had the brewhouse burger.  He said it was good. The problem was mostly with the service. We ordered drinks and appetizers at the same time. We got nothing for the longest time. My mom was coughing and we had to ask another wait person for just some water. And still we waited!!! Rude!!!!!!!!  Then our waitress approached the table and said she was sorry but she was really busy with a large party at another table.  My mother said we would like a different waitress then.  We still had no drinks or appetizers.   The second waitress came soon after and took our entire order again.  That is when I added the burger to the order because my son was hungry.  Then we waited some more for our beverages. Finally the iced tea came but my son's cream soda had not come. The cream soda finally came. Then his burger came right afterward--before the appetizers!!!!  They were busy. It was a Sunday afternoon.  But you would think they would prepared for it. I am sure this was not a unique Sunday afternoon.",https://www.yelp.com/biz/bjs-restaurant-and-brewhouse-stockton?start=180,1.96,2.6,2.76,2.052,2.3440000000000003
153,Lolita B.,"Oakland, CA",65,10,5.0,1.0,2015-10-26,"Definitely something new going on. New management or a new chef but the food has absolutely changed. My daughters pizza tasted like it was baked on greasy focaccia but my Alfredo tasted really fresh as to where you could actually see the butter and cheese separating on the noodles which were rather dry though I asked for extra sauce with the initial order. However, the chicken was grilled really nicely. Oh and my chedder broccoli soup was less than what I'm used to. It's sourdough bowl was viciously burned and had barely been hollowed out. As to where as soon as I removed its lid for inspection the waitor instantly offered to bring additional soup. The best part was the wait staff. Their service was superior. Everyone who walked our way checked on us which made the experience not so bad.",https://www.yelp.com/biz/bjs-restaurant-and-brewhouse-stockton?start=200,1.96,2.57,2.748,2.116,2.326
267,Marlys C.,"Outer Richmond, San Francisco, CA",0,5,2.0,5.0,2015-11-14,"I've lived in Stockton 9 months and been to BJs half a dozen times. I have never been disappointed with the food or service in any way. We always sit in the bar. We generally get appetizers (great variety) or flatbread, sometimes a burger or other sandwich. Also really appreciate half price wine on Tuesdays. Yes!!",https://www.yelp.com/biz/bjs-restaurant-and-brewhouse-stockton?start=320,2.04,2.61,2.752,2.58,2.382
145,Emillio C.,"Stockton, CA",46,2,13.0,1.0,2015-11-21,I would tell you how my food was but I never got it. After waiting for 45 min after the rest of my party got their food which I did order the same thing as someone else never got my order and my son only got half of what he was supposed to get . Waiter never checked on us and someone brought the check to us. Real rating 0 stars. Get it together BJ's,https://www.yelp.com/biz/bjs-restaurant-and-brewhouse-stockton?start=200,1.96,2.57,2.74,2.18,2.326
277,Tim A.,"Stockton, CA",0,1,,1.0,2015-11-21,Had the worst service and meal tonight at BJ's on Pacific Ave. Food was heavily spiced with way too much hot seasoning for pasta dish. My wife's burger overcooked and both meals arrived late. Never eating here again. One star is too much.,https://www.yelp.com/biz/bjs-restaurant-and-brewhouse-stockton?start=320,1.88,2.56,2.728,2.18,2.2880000000000003
345,Steve W.,"Stockton, CA",0,10,,4.0,2015-11-27,"How did they get corporate to aprove that name?  High priced corporate designed restaurant and menu. Along the lines of Olive Garden, Red Lobster, Elephant Bar type restaurants",https://www.yelp.com/biz/bjs-restaurant-and-brewhouse-stockton?start=240,2.0,2.55,2.724,2.576,2.33
294,Gary L.,"Palo Alto, CA",0,8,2.0,3.0,2015-11-30,Did ray charles cut my pizza..And who made it taste like cinammon terrible lemonade was bomb though,https://www.yelp.com/biz/bjs-restaurant-and-brewhouse-stockton?start=220,1.96,2.54,2.72,2.508,2.308
340,Courtney P.,"Stockton, CA",0,3,,4.0,2015-12-11,Had the sweetest little waitress. I believe her name was Stephanie.  She was very attentive and seemed to really love her job !,https://www.yelp.com/biz/bjs-restaurant-and-brewhouse-stockton?start=240,2.04,2.54,2.72,2.576,2.34
266,Rem B.,"Stockton, CA",51,5,,1.0,2015-12-23,"Since the opening of this restaurant i've went here a lot as i worked in the same shopping center of it for a good 6 years. From all my experiences here Bjs in stockton is known for one thing. The lack of speed of service. I have come to just accept the fact that this restaurant is NEVER going to improve on that. Tonight i came here with my fiancé and two young sons meeting family for a night of drinks and appetizers, we showed up around 8 and ordered by 8:30 and boy did their slow service today really shine, by 8:55 my sons mini corndogs and fried plate came out with the flatbread pizza i ordered and holy cow were they cold. The flatbread was luke warm and very very hard and worst off they forgot my mother in laws flatbread pizza which finally came out around 9:40 and to top it off they didn't even comp it for the lack of care they put in their order. I guess they were too busy having devoted most of their servers to tending the large banquet group and forgot about the rest of the restaurant because their waitstaff was stretched thin but I've also become accustomed to that. Emily our server or Erika (not sure what her name was now) wasn't  clear and my mother in law ordered a alcoholic beverage that was far too strong and not close to what she asked for, forgot to bring my post pregnancy fiancé water she asked for to take her pain medication. Honestly im not sure if it is just this Stockton location but the food here is just awful. I only really used to come here when i worked in the area was for the wings and a handful of other items they dont even have on their menu anymore. I have had a handful of experiences here that were worse than this but i think this finally after all the years made me just not want to come here ever again. Their waitstaff has no clue what they're doing and the food varies what time of day you go. Seriously go to any other restaurant chain in stockton before coming here.",https://www.yelp.com/biz/bjs-restaurant-and-brewhouse-stockton?start=320,2.04,2.54,2.712,2.18,2.34
84,Sarah B.,"Seattle, WA",0,15,,1.0,2015-12-30,Worst service ever.  Our waitress was disinterested and not attentive. The establishment itself was extremely dirty. I've been to other chains of BJ's which we much nicer. This one definitely belonged in Stockton. They gave us extremely weak drinks. Worst part of it all? My credit card information was stolen and hundreds of dollars in charges were put on my account immediately after I left this facility. I can't be 100% sure it was my server but I had no issues with my card and less than an hour after I left this facility my card was compromised. You do the math. Criminals. This was a horrible experience and I will NEVER return to a BJ's.,https://www.yelp.com/biz/bjs-restaurant-and-brewhouse-stockton?start=100,2.0,2.53,2.7,2.18,2.318
335,La Nora W.,"Stockton, CA",1,19,7.0,2.0,2016-01-01,"Not a good experience... We waited over .45 minutes for our food... We asked our waiter to check on it and he came back and said ""they messed up on your order their fixing it, it will be a few more minutes..."" Not acceptable!!! We left hungry...",https://www.yelp.com/biz/bjs-restaurant-and-brewhouse-stockton?start=300,2.04,2.53,2.692,2.408,2.334
133,leslie e.,"Woodland, CA",40,6,,1.0,2016-01-02,"Terrible experience, not returning. Order came out wrong, waitress offered comped dessert, manager then took offer to comp us back. Then we got charged for items not ordered. Garbage  management.",https://www.yelp.com/biz/bjs-restaurant-and-brewhouse-stockton?start=160,2.04,2.53,2.68,2.34,2.334
332,Garrett B.,"Modesto, CA",222,15,,1.0,2016-01-03,"I went in here tonight to get some dinner being it was one of the only decent places open at the time. Walked in and placed my order for take out with a friendly kid. I ordered the parmesan chicken and wedge fries. Then I sat down and waited for what must've been over half an hour. Don't know why it took so long, the place was a ghost town. Finally got my food and headed home. Open up the bag to find out after all that time they even forgot my fries, lol... Not a huge deal but it's the principle... The place is dead and I still get jipped outta my fries which I paid for... So I called back and talked to Andrew, he told me he was the manager working. Told him what happened and he was very apologetic and offered to make it up to me the next time I came in. I've been in there countless times over the years, my friends and I. Spent lots of money. Have to say I'll think twice about makin a trip back...",https://www.yelp.com/biz/bjs-restaurant-and-brewhouse-stockton?start=300,2.0,2.52,2.672,2.436,2.3120000000000003
331,Danny D.,"Stockton, CA",2,25,13.0,2.0,2016-01-05,"I am writing this review to express my disappointment on the recent change in their corporate decision on the lighting in the restaurant. If you visit this restaurant during the day or when there is daylight outside you won't know any difference. I went there last night with my girlfriend and her coworkers for dinner at 6:30pm. We sat in the middle of the main dining area. At around a quarter to seven that evening the lights started to dim. It wasn't even a subtle change, the lights went from 80% to 25%. A couple people from our party had to use the flashlight app on their smart phones to see the menu. There were other people at other tables doing the same thing. ITS TOO DARK IN THERE! I want to see my average food. Its is also a safety hazard for the people working there. God forbid if a drink were to spill on the floor. You wouldn't be able to see it. Complaints were made to the manager who insisted there wasn't anything he could do at the time and that it is a decision made by corporate. Well, once accidents start to increase because people can't see and fall because of the lighting situation then a change will be made.",https://www.yelp.com/biz/bjs-restaurant-and-brewhouse-stockton?start=300,1.96,2.53,2.672,2.568,2.302
293,Isa R.,"Stockton, CA",0,11,2.0,3.0,2016-01-09,"It's what anyone can expect from a chain restaurant. Mediocre food and less than spectacular service. I've dined here several times thinking that maybe it will be better than the last experience. Nope. My plate was messy and the food unappetizing. Pizookies are good though. I mean, how bad can you mess up a giant cookie?",https://www.yelp.com/biz/bjs-restaurant-and-brewhouse-stockton?start=220,2.0,2.53,2.664,2.7640000000000002,2.318
175,Patricia A.,"Stockton, CA",0,7,,1.0,2016-01-10,"Usually have good service and brought my mother in law for the 1st time, they did not give a good impression. Service started off bad didn't come and get our drink orders after over 10 min of waiting had to get hostess to find our waitress, didn't bring plates for our appetizers had to ask, messed up on my order, didn't check on us after we got the food. Very disappointed. But she was good with refills I could tell she was trying because she knew I wasn't happy.",https://www.yelp.com/biz/bjs-restaurant-and-brewhouse-stockton?start=180,2.0,2.5,2.648,2.5320000000000005,2.3
45,Dale N.,"Stockton, CA",2196,720,6553.0,4.0,2016-01-13,"Four stars for a chain restaurant. Great servers Fun atmosphere Full Bar  (great house-made root beer) Good food Huge menu choices Great parking Yummy desserts Great hours. Fri/Sat till 1a.m., Sun-Thurs till Midnight I like BJ's better than Applebee's, Chili's, and TGI Friday's for the above reasons. Had the fish and chips tonight ($14).  Ordered the skinny fries. Yummy! Tell 'em you want your food and fries HOT!",https://www.yelp.com/biz/bjs-restaurant-and-brewhouse-stockton?start=20,1.96,2.5,2.648,2.9280000000000004,2.284
172,Julia W.,"Stockton, CA",44,171,,3.0,2016-01-13,"My husband and I used to eat here a lot years ago but we stopped when their service started going downhill. Don't get me wrong, the food is great but the service not so much. Takes a good amount of time for orders to arrive. Then when it's time to pay the bill, getting the bill itself is a task. God forbid you have to get change or have them take your debit card then returning with change or the receipt takes way too long.",https://www.yelp.com/biz/bjs-restaurant-and-brewhouse-stockton?start=180,1.96,2.51,2.648,2.8280000000000003,2.29
248,Kay L.,"San Francisco, CA",0,2,,1.0,2016-01-13,Hands down this place lacks a lot of things.especially customer service. One in particular. She a latino girl.she seem bothered annoyed for some reason.she would dispear. This place is not a solid place to eat. Really ghetto!,https://www.yelp.com/biz/bjs-restaurant-and-brewhouse-stockton?start=260,1.96,2.5,2.644,2.6920000000000006,2.284
360,Dexter A.,"Stockton, CA",0,5,,5.0,2016-01-14,"very good service, fresh food loved it , definitely go there againb",https://www.yelp.com/biz/bjs-restaurant-and-brewhouse-stockton?start=400,2.12,2.53,2.652,3.188,2.366
146,Maria V.,"Stockton, CA",181,11,20.0,5.0,2016-01-24,I loved it here if you are super hungry this is the place to go you totally get a full 4 course meal !!!!! An appitizer salad or soup your dinner with a drink and dessert for a very fair price i had to let go of my top button on my jeans lol the food is wonderful our server Was super friendly i got like a at home feeling being there totally recommend this place to all !,https://www.yelp.com/biz/bjs-restaurant-and-brewhouse-stockton?start=200,2.16,2.53,2.652,3.156,2.382
136,Dawn O.,"Tracy, CA",58,21,4.0,2.0,2016-01-29,"Came here for lunch with my roommate and her cousin. All around everything was meh and blah. We sat in the bar around 1pm. Ordered a Skinny margarita and Watermelon Basil margarita while we waited for our third person to show up. The first Skinny was great but the Watermelon Basil was PURE syrup. Made my stomach ache after one swig (ended up ordering a second Skinny one halfway through the meal and that one was on par with the Watermelon Basil). Received a little attitude from the server when we asked to replace the the Watermelon Basil with a Jameson and Ginger Ale, but felt justified when we over heard the waiter tell the manager that we wanted to send it back and the manager said ""Yeah, that looks really dark"".  Ordered the Ahi Poke for our appetizer and it was good. Ended up getting 2 Ahi Salad entrées and we were disappointed that the Ahi on the Poke appetizer was MUCH better than the Ahi on the salads. The Salad Ahi was slivered, stringy, pieces with goopy breading. The other entrée we ordered was the Lunch Special half flatbread/half salad. The Chicken Club flatbread was ""just okay"" and the salad was an optionless, plain, mediocre (""at best"") side. Yelp has a coupon that gives you buy one, get one entrée free from 11-3 which is restricted to one per table even if requesting separate checks. No biggie, but the roommate and I each have a manly man that were requesting grub so it was a slight disappointment. Probably won't return unless we're just coming for drinks.  TL;DR: Meh, you're better off going elsewhere.",https://www.yelp.com/biz/bjs-restaurant-and-brewhouse-stockton?start=160,2.2,2.52,2.644,2.7600000000000007,2.3920000000000003
148,Susan G.,"Tracy, CA",456,18,12.0,5.0,2016-01-30,"our server was friendly, prompt but not overly hovering!   Best service and timing I've had here in a while.   I'll be back!",https://www.yelp.com/biz/bjs-restaurant-and-brewhouse-stockton?start=200,2.36,2.54,2.648,3.188,2.468
