,Username,location,friend_count,review_count,photo_count,rating,date,review,Url,roll25,roll100,roll250,special_25,Final_Rating
184,Consuelo R.,"Stockton, CA",113,19,76.0,4.0,2014-06-17,"We came to BJ's to celebrate Father's Day. We like coming to BJ's because of the good food and good service. We have celebrated Mother's Day here before and were happy with the food and service.  Food was good. I enjoyed especially the appetizers we selected. I love their Chicken Pot Stickers and Chicken Lettuce Wraps. I order Classic Breakfast Sandwich. Since I love Bacon, I choose instead of ham or sausage. The sourdough bread was perfect. It is served with yummy seasoned country potatoes.  The service was great. Our server was so helpful! One of the best experience. He went out of his way to assist us.  Great environment!! My family and I are huge sports fan! Love the fact that we can watch the World Cup here while eating.",https://www.yelp.com/biz/bjs-restaurant-and-brewhouse-stockton?start=140,3.04,2.71,2.71,2.512,2.8420000000000005
280,Jasleen B.,"Stockton, CA",2,8,2.0,1.0,2014-06-22,"Bad bad manager tisk tisk!!! What a disappointing night at BJS. WE HAD TO WAIT FOR OVER AN HOUR FOR THEM TO GET OUR TAB FIGURED OUT. The heavy set manager still charged us after this long wait.  We had to request ordered drinks twice & never got them (of course they charged us). Someone ordered an extra pizooki to go after we ate ours & it never came (of course she was charged). They charged our card for the wrong amount & had to credit our card back & recharge it. He blamed it on us because we had separate tabs & it's the new waitresses fault (so unprofessional). His solution was a free pizooki. I told him we didn't want another pizooki. Then he brought a $20 gift card. Gift card? So we can come back here & spend more money? We are not stupid! I told him I didn't want a gift card because we will not be coming back. He sat it on the table & walked away. I would've tossed it to the floor but it was an employees 21st birthday & the night was already dampened enough. So we waited another 15 minutes for them to figure out someone else's tab.  My fiancé & I are both managers so we know there's a point you do what you can to keep the customer, especially when it's your fault! The correct solution would've been to APOLOGIZE & credit us back for the night, as we requested. Honestly we would've went back to BJs if he would've done all he could for waisting so much of our night. So...gift card is shredded. THANKS TO THE HEAVY SET MANAGER WE WILL NOT BE GOING BACK TO BJS.",https://www.yelp.com/biz/bjs-restaurant-and-brewhouse-stockton?start=220,2.88,2.68,2.68,2.116,2.7600000000000002
264,Chelsea A.,"Memphis, TN",17,18,1.0,1.0,2014-06-23,"If I could give 0 stars for service I would. I used to love bjs! After being stationed out of state for a while I've always loved coming home and going to BJS but the service has become horrible!!! We came in at about 1:30 and it wasn't busy, we were told it was going to be a 10 minute wait due to shift change, which is totally ok I understand that. The host was completely rude and passive!! The thing that gets me is that the host then went back to the host stand pointed at our table and started talking crap about all of us!! Hopefully management gets this place back to what it used to be because now I doubt I'll come back with service like that!",https://www.yelp.com/biz/bjs-restaurant-and-brewhouse-stockton?start=320,2.76,2.65,2.65,2.148,2.694
339,Trouble L.,"Stockton, CA",22,27,16.0,1.0,2014-06-24,Came for happy hour. At first at server was good . Asking if we need anything . Then later he just stop coming . Anyways my pizza had hair in it and he still made us paid for it wtf. I read on yelp people get there meal free when they have a problem. guess I had a-ho manager . We waited 20 min before he came to talk to us and he never said sorry. F u for your shitty hair pizza.  will never come here again.,https://www.yelp.com/biz/bjs-restaurant-and-brewhouse-stockton?start=300,2.68,2.63,2.63,2.148,2.6500000000000004
215,D'Adrea D.,"Stockton, CA",178,25,17.0,5.0,2014-06-30,"Once again my father treated myself and Breanna to BJs for our birthday! Once again...it was DELISH and the service was very good. The waitress checked on us frequently to make sure our glasses were full and delivered our food in a timely fashion.  Friday evening is a very busy night out at BJs. The ambiance is always lively with Sports on the TVs and music playing. Again we ordered the Crispy Calamari (the lemon garlic aioli is the best). We also enjoyed the Pepperoni Extreme Flatbread Pizza as an appetizer...which was really good and crispy.  For my main dish...I went with the BBQ Chicken Chopped Salad, which is a meal in itself. The serving was so huge that I had to get a ToGo Box. For Dessert (since it was my birthday), I devoured the infamous Cookies N Cream Pizookie! Ice Cream with cookie and cream whipped on top of a very rich chocolate cookie. I don't think Breanna came up for air when she was killing hers.  BJs Restaurant and Brewery is always a good time...whether it's dinner with the family or Happy Hour with girls!",https://www.yelp.com/biz/bjs-restaurant-and-brewhouse-stockton?start=120,2.84,2.64,2.64,2.612,2.72
344,Janet D.,"San Jose, CA",104,1216,1381.0,3.0,2014-07-01,"Just ok. The best part of my meal was my pizookie. Otherwise, I'd say the food was just ok. Friendly staff that seemed to be on top of their game which i appreciate.",https://www.yelp.com/biz/bjs-restaurant-and-brewhouse-stockton?start=240,2.84,2.63,2.996,2.38,2.7139999999999995
261,CDicob D.,"Stockton, CA",0,16,,4.0,2014-07-04,"My husband and I enjoy going to BJ. They have the best avocado rolls. Wonderful atmosphere, friendly staff, and a great location!",https://www.yelp.com/biz/bjs-restaurant-and-brewhouse-stockton?start=320,2.92,2.64,2.992,2.512,2.7520000000000002
438,Anna T.,"Sacramento, CA",0,22,4.0,1.0,2014-07-07,"I used to love this bj location, but the last few visits I've had was extremely terrible. The food never seems fresh anymore. Even though it takes forever to get your food, food comes out cold and nasty. It taste old and have been laying around. Some waitresses are nice, while others just plain suck. For the price you pay for the food here, I rather go somewhere else and have better service and fresh, good tasting food.",https://www.yelp.com/biz/bjs-restaurant-and-brewhouse-stockton?start=360,2.88,2.62,2.984,2.148,2.724
265,Paul C.,"Chico, CA",1,19,,1.0,2014-07-08,"I'm so tired of the incompetence of people and I understand that being new can contribute to that. Bjs!!,  what ever you do don't eat here .... I ordered take out and everyone who eat, had to go shit there brains out and 2 girls that ordered salads had hot and cold sweats and were puking all night long.  All the food looked terrible like it was just slapped together and I paid 36 bucks for a burger and salads. I am a professional chef and I understand when I go out it won't be the same standards I'm used to but you can tell the GM and managers are just not doing what they should be because all your staff from Front of house to the back of house don't know shit and suck at there jobs. Not employees fault its the GM and managers there suck. Just wanted to thank you for the shitty food and stealing my money!!!",https://www.yelp.com/biz/bjs-restaurant-and-brewhouse-stockton?start=320,2.88,2.59,2.972,2.18,2.7059999999999995
263,David E.,"Stockton, CA",29,20,2.0,1.0,2014-07-09,"Poor service, menu change for the worse. Eat somewhere else",https://www.yelp.com/biz/bjs-restaurant-and-brewhouse-stockton?start=320,2.76,2.58,2.964,2.212,2.652
237,Katie B.,"Stockton, CA",65,54,52.0,4.0,2014-07-27,"I love going to BJ's at night, in a ""let's not go to a real bar let's go to BJs instead because it's way better than Applebee's or Chili's"" type of mood. My friend and I used to go just about every other night during football season (seriously) because of the happy hour specials, and we made friends with a lot of the workers in the bar. Elaine is hands down my favorite bartender ever, and Kayla, Scott (who I don't think works there anymore), and Stephanie are my favorite servers of all time. Shoutout to Sunshine, too, who I've only had serve us a few times but she's always nice! The service in the bar gets a 10 out of 10 whenever those lovely people are working! I'd give service in the bar without them a 7.5, and service in the actual dining room a 6.5. It's not that the others aren't nice and accommodating whenever they see you, it's just that the orders usually take awhile and the drinks sometimes go unfilled.  I feel like the food is always hit or miss, with the exception of the Pizookie which is always fabulous. The beer and drinks are great, and usually I like to get pizza or fries to accompany them. My pizzas are either perfect or overcooked, which is frustrating. I love their pizza when it's perfect, and it's usually when I'm craving it the most that it's not. It's not even that it's a matter of too much sauce or picky stuff like that, it's just simply overcooked or undercooked. And I'm not one of those people who sends their food back when it's overcooked, because I worked at a pizza parlor and know how that can mess up the line, but it never hurts to just mention it. The crispy fries are my second favorite, with ranch of course, but even those sometimes come out a little lukewarm. Haven't had a bad experience with the spinach and artichoke dip yet, love the chips and that they'll bring you more if you ask.  Overall, I recommend sitting in the bar because the service is quicker and more attentive over there. The food isn't bad, the beer is refreshing, and the ambiance is nice. I'd choose here over Applebee's, Elephant Bar or Chili's any day.",https://www.yelp.com/biz/bjs-restaurant-and-brewhouse-stockton?start=280,2.76,2.61,2.976,2.6399999999999997,2.67
296,Frank N.,"San Francisco, CA",4,33,2.0,1.0,2014-07-31,"I've been to BJs many many times since they been open and I feel as though their service has been lacking as of late. Partly due to waiters and waitress but I think a good part having to management not properly scheduling or cutting cost.  The food is not bad, its what you can expect from a chain restaurant. Drinks are decent and prices okay. The one star is strictly due to their inattentive staff. The last 4-5 times I've been here there's usually one server for the WHOLE bar area. This is unacceptable especially when it was a busier night. I didn't see too many other servers throughout the restaurant either. The server would come by every once in 30-40 minutes but wouldn't really check or ask if everything was okay.",https://www.yelp.com/biz/bjs-restaurant-and-brewhouse-stockton?start=220,2.6,2.6,2.964,2.308,2.6
208,Julieanne R.,"Stockton, CA",11,121,59.0,4.0,2014-08-15,My sister and I came here for lunch.  This place is always clean and located in a nice plaza with other nice stores.  It does get busy during weekends so get here early or later. We were the first ones in with the place opening at 11 am.  But our order still took longer than expected.  We got the chicken tacos and fried chicken and they were pretty good.  We wanted to treat ourselves so we got the peanut butter smore pizookie and it was to die for!  Every one needs to try it!,https://www.yelp.com/biz/bjs-restaurant-and-brewhouse-stockton?start=120,2.68,2.61,2.968,2.6719999999999997,2.638
171,Adrionna P.,"Stockton, CA",3,14,2.0,3.0,2014-08-29,"Let me start off by saying that I HATE the hostesses. They are all so incredibly rude and b*tchy (with the exception of one shorter girl who I want to say is Latina. She's always a doll). Every time I go in they remind me why I never go as often as I used to. And they are the reason BJs gets only three stars from me. It seriously ruins my experience every time.  As far as wait staff goes, my servers are always incredibly friendly, and I always try to tip the good ones well. The food is pretty good, and if you stick to the basics it's even really good! I always get half California chicken club sandwich and half Caesar salad and its super satisfying.",https://www.yelp.com/biz/bjs-restaurant-and-brewhouse-stockton?start=180,2.76,2.61,2.976,2.572,2.67
271,Alicia W.,"Tracy, CA",12,16,18.0,2.0,2014-09-08,The food was good but then we noticed the dirty bear glass...after it was said and done.  Didn't notice the nasty spot in side the glass where the beer was housed. Did we get compensated? Nope. They just said we're sorry....I'm just saying...,https://www.yelp.com/biz/bjs-restaurant-and-brewhouse-stockton?start=320,2.76,2.59,2.98,2.472,2.6579999999999995
474,Marisela P.,"Stockton, CA",5,21,3.0,4.0,2014-09-12,i absolutely love their pizza here :))))) yum!! The servers are great and the atmosphere is nice and relaxed,https://www.yelp.com/biz/bjs-restaurant-and-brewhouse-stockton?start=420,2.84,2.6,2.992,2.6719999999999997,2.696
334,Humanios ..,"San Jose, CA",8,3,8.0,1.0,2014-09-14,"So I've been to BJ's in various other cities prior to coming to this BJ's in Stockton. It's amazing how waiters/waitresses, hostess, and presumably management can change the experience. I came here with my girlfriend on a September weekend and was amazingly disappointed and frustrated with the experience. Things started pretty well, we were greeted and shown to our table with much respect, we even had a waitress who was nice enough. We received water and our food orders were taken. I ordered and Cherry Chipotle Glazed Salmon, and she ordered the Mediterranean Chicken Pita Tacos. The chicken pita tacos comes with a side of grains which she asked to substitute with a salad. Wasn't a problem and shortly after she received her salad. This is when things took a turn in the opposite direction. No one likes to wait for their food but that experience is made worse when suddenly your server is no where to be found. Our server (Erika) never came by for another 30-40 minutes to give us any indication of whether our food would ever be coming out. At this point we assumed she forgot to place the order in. Just as we were about to get another server's attention, a different waitress (didn't get her name) came back with our food and apologized that it took long, and that my girlfriend's plate didn't have all the ingredients they were supposed to have. I assume she had other tables to wait on so she left after apologizing (on Erika's behalf I guess) that the greek yogurt was missing. A few minutes later Erika returned and apologized the food took so long. It turned out they were out Greek yogurt (topping for the pita), and rather than communicate this with us from the start had made a decision to replace it with sour cream, only after presumably waiting for the food to get cold. She also added the side of grains despite specifically asking to omit them, waste of food. Both our dishes were cold (and not very good) and she quickly exited the scene after a quick ""sorry"". We were both pretty astounded to say the least. I don't think we would've minded if they were out of yogurt if we knew at an earlier stage, but you can't just take a healthy meal, with feta cheese and light ingredients, then just pour sour cream on top instead. Those kind of decisions should be up to the customer and always communicated.  Anyways, we never received that yogurt, and neither of us finished our meals. We didn't take anything to go but were still asked for desert. No, I couldn't risk waiting another 30 minutes for our ice cream pizooki only to find that they ran out of ice cream and rather than let us know decided to let the warm cookie get cold and just put sour cream on top instead.  I hope these servers (who I'm certain are nice people) learn to communicate better with their customers. Would've made the world of difference (although the food was still crap). Save yourselves some headaches and find a better restaurant elsewhere.",https://www.yelp.com/biz/bjs-restaurant-and-brewhouse-stockton?start=300,2.72,2.57,2.984,2.2760000000000002,2.63
151,Gustavo A.,"Fresno, CA",23,22,40.0,5.0,2014-09-15,I always enjoy BJs great food and service! Always busy gets a little loud but lots of tvs to watch the game,https://www.yelp.com/biz/bjs-restaurant-and-brewhouse-stockton?start=200,2.72,2.61,2.996,2.804,2.654
225,Dixie x.,"Fresno, CA",5,32,11.0,2.0,2014-09-17,"my husband and I came to this location tonight for dinner. we were seated right away. no wait time is awesome.  our waitress came and took our drink and appetizer order as we were not ready for our main course yet. it was a very long wait just to get the spinach and artichoke dip, and it was disgusting. the dip was way too fluffy, I like mines thick and cheesey. this one looks like it was just whipped. the chips were also so thick. there were even a whole stack of them fried together in one piece. I did not enjoy it at all and asked for a salsa dip.  After that, our order was finally taken and the wait time for that was probably another 30 mins. We've ordered the shrimp scampi pasta, the pork chops plate, and stuffed mushrooms. along with one of their berry maple brew and the white peach margarita.  the margarita was so strong, I didnt even finish it. not that its a bad thing, lol. my husband's brew was good in his opinion. the stuffed mushrooms were amazing. taste and flavors were perfection! my husband had the pork chops and was so disappointed. it came with a side of green beans and mashed potatoes. everything was great expect for the pork chops. it was so damn dry, it tasted like paper. we were so disappointed.  the shrimp scampi was amazeball!!! Perfect portion, sauce, etc. but there was one thing, there was something that looked like the skin of an avocado in the pasta. because of that, I no longer ate. and with the long wait on everything and as irritated as we were, we dropped it and left. we wont be coming back.",https://www.yelp.com/biz/bjs-restaurant-and-brewhouse-stockton?start=280,2.76,2.6,2.996,2.408,2.664
256,Charmaine P.,"Sunnyvale, CA",2,6,,5.0,2014-09-23,"5 stars for that goooddddd yummy delicious Steak!!! my daughter,my bestfriends husband, & my bestfriend ate dinner here.. and it was my first time having steak at bjs.. and it was sooo good.. heavenly good.. I got it medium and it was tender and juicy.. I never had a good steak from othe restaurants but here... we never waited to be seated.. and the waitress was kept on checking on us... the price was not overpriced.. I just love it!",https://www.yelp.com/biz/bjs-restaurant-and-brewhouse-stockton?start=260,2.88,2.63,3.004,2.804,2.7299999999999995
202,Melanie M.,"Sydney, Australia",45,25,397.0,4.0,2014-09-24,"Came here last night like around 9:30pm because its like one of very few restaurants that are open later than the usual. Food: I ordered their chicken wings and avocado rolls. Wait time was 15-20min which wasn't bad at all to me, but when you wait that long, you expect freshly made food. When i did receive my food, the avocado in the rolls were already grayish/black (which means they have been sitting out for a while).  Thankfully the waiter apologized and replaced it right away for us with no hesitation. The chicken wings were delicious! No complaints about it! Service: The gentlemen that served us wasn't very talkative but he did get the job done and he did it right. He was friendly enough to make us happy. He made this review a 4 star one. As long as they promise to always bring me fresh food, i will continue to be a customer!",https://www.yelp.com/biz/bjs-restaurant-and-brewhouse-stockton?start=120,2.84,2.63,3.0,2.6399999999999997,2.7139999999999995
213,Donald A.,"Stockton, CA",16,25,108.0,4.0,2014-09-24,"Always good for if your group can't decide where to eat.  Beer: their stout and red are always on point. If your looking for something lighter,  they have few selections as well.  Food: it's not actuality fine dining, although sone items are pricey, you just need to be pay extra attention on your orders. Part of our huge HEFFA status order was fried avocado rolls. The lighting of the place could trick you so check if they are fresh and color of avocados didn't change yet, avocados tends to turn grayish/black when they been sitting. To make this short, that's what happened to our order,  so after i tried a whole piece, we asked our server to give us a fresher one which he did right away. That bumped their 3 stars to 4.  Service: they are good,  haven't experienced bad service from this place yet. Just don't be shy to say something or ask them if you need anything,  if they had allot of strikes, don't hold back and tell them, you might get a free Pozoki (that warn cookie with ice cream that smart good looking people can't spell).  Place: very cozy and clean.  My tip: Food and drinks at BJ's are pricier than other place cos they pay a lot of people. So if your service, food and experience is not good, ask for a manager to get it right for you. And if that won't change or improve anything, tell them is your bday, automatic free Pozoki without checking your ID! Lol",https://www.yelp.com/biz/bjs-restaurant-and-brewhouse-stockton?start=120,2.88,2.63,3.008,2.6079999999999997,2.7299999999999995
337,Melissa M.,"Stockton, CA",47,91,73.0,1.0,2014-09-26,"There's a lot to be said about serving alcohol to a person who didn't order an alcoholic beverage! Also a lot to be said about forgetting multiple requests if you are a server. Very poor attempt at customer service. Due to this visit, we will not be going back to BJ's in the future; went here to have a rare dinner but was sorely disappointed overall.",https://www.yelp.com/biz/bjs-restaurant-and-brewhouse-stockton?start=300,2.8,2.62,3.008,2.212,2.692
226,Jenifer L.,"South Bay, CA",29,117,113.0,2.0,2014-09-28,"I am a big fan of the chicken alfredo pasta at BJ's, but the BJ's I am referring to is the one located in San Diego. I was expecting the same great taste of the chicken alfredo pasta as SD but I was wrong. I was given very very little chicken that was over cooked. The Alfredo sauce was also too liquidy. It was not creamy like it should have been. The only plus about this pasta dish was the pasta. It was cooked perfectly, chewy and delicious. If only the alfredo sauce and chicken was better. I will not be coming back even though I love chicken Alfredo linguini.",https://www.yelp.com/biz/bjs-restaurant-and-brewhouse-stockton?start=280,2.68,2.6,3.0,2.44,2.632
310,Tiger L.,"Stockton, CA",1,8,1.0,2.0,2014-09-30,"Sub par service today. Extra long waiting time for food, burned food and warmed over. One of the worse  visits I've had.",https://www.yelp.com/biz/bjs-restaurant-and-brewhouse-stockton?start=340,2.64,2.57,3.0,2.44,2.598
276,Anita S.,"Stockton, CA",0,1,,1.0,2014-11-23,I am highly disgusted in the lack of staff ability to accommodate handicap. There is a wheel chair ramp in the very back of the restaurant. We have to find a way to get to it first. When we asked they said oh its in the back. In no way did they offer to help escort us to the rest of our party. We had to take it upon ourselves to ask patrons to move their chairs because there is absolutely no room to get through with a wheelchair. This ruined our whole experience. Even worse the one who was handicap was celebrating her birthday. Pretty sad.,https://www.yelp.com/biz/bjs-restaurant-and-brewhouse-stockton?start=320,2.52,2.56,2.992,2.308,2.544
275,Nicole C.,"Stockton, CA",0,3,,2.0,2014-11-23,"I love eating at BJ restaurant in Stockton, the food is always great but the workers never seem to care to welcome their customers. Every time I come in for a pick up order, the employees always walk back & forth with no urgency of saying "" hello we will be right with you"" or even a single saying of ""let me grab someone to help"". I waited for an hour & talked to a manager & there was no type of simpathy. Its really irritating asking people for help over and over and still no help. Its called communication in your customer service. Even if you are busy just acknowledge the customer so they know you'll be right with us!",https://www.yelp.com/biz/bjs-restaurant-and-brewhouse-stockton?start=320,2.56,2.54,2.988,2.408,2.548
330,Micheal S.,"Stockton, CA",21,24,9.0,1.0,2014-11-24,"Vomit. Constant menu changes, servers that want to get you to buy beer more than they want to keep my coffee full or my order correct. Gave them 3 chances and I quit. Never again. Just another chain with crappy food and service.",https://www.yelp.com/biz/bjs-restaurant-and-brewhouse-stockton?start=300,2.56,2.52,2.984,2.2760000000000002,2.536
543,Brayden Scott Peng V.,"Sacramento, CA",0,38,,3.0,2014-12-10,"An upgrade version of AppleBees and Chili's. Friendly workers, and good service. Nothing much about the place since the food are kind of pricey for the portion you get, but their beverages are good, can't complain there.",https://www.yelp.com/biz/bjs-restaurant-and-brewhouse-stockton?start=380,2.64,2.51,2.988,2.476,2.5620000000000003
258,Manny V.,"Stockton, CA",28,4,2.0,4.0,2014-12-11,Was looking for quick grab to eat ... came here and had the greatest experience here food is amazing the drinks are good and fast ....,https://www.yelp.com/biz/bjs-restaurant-and-brewhouse-stockton?start=260,2.6,2.51,2.996,2.576,2.5460000000000003
321,Monica T.,"Seattle, WA",161,189,36.0,4.0,2014-12-20,"Love this place.  A great selection of food.  Wait staff is really friendly.  They have a awesome bar with lots of TV's so if you want to watch a game, this is the place to be.",https://www.yelp.com/biz/bjs-restaurant-and-brewhouse-stockton?start=300,2.64,2.54,3.004,2.48,2.58
