,Username,location,friend_count,review_count,photo_count,rating,date,review,Url,roll25,roll100,roll250,special_25,Final_Rating
188,Monica S.,"Stockton, CA",2,14,65.0,1.0,2016-09-26,"Again, I decided to give BJs, yet ANOTHER chance to maybe redeem themselves from my last few visits. I am not a tough customer and I am usually very patient. I worked in food places, so I know what it is like from the other end. But I have no idea what is going on here at BJs. One of the worst restaurants in Stockton. All of their dishes taste like its from a microwave. This is definitely not the place to splurge. Everything takes forever to come out. Including drinks! Always! How hard is to get water.... I had to remind the waitress several times, and not once was I offered a refill. I know a guy that used to work here, and asked how it was. He said he stopped eating BJs food because of how disgusting they are in the back. They don't use soap of any kind to wash dishes? Gross. I'm sick of this place and will not be going back. Do NOT recommend.",https://www.yelp.com/biz/bjs-restaurant-and-brewhouse-stockton?start=140,2.68,2.82,2.716,1.7960000000000003,2.7640000000000002
48,Katie C.,"Milpitas, CA",199,108,32.0,3.0,2016-10-04,"I ordered the chicken philly pizza because it sounded amazing. However, i didn't taste the siracha cheese nor the roasted garlic! The pizza had no oomph, flavorwise.  The pizookie, as always, is amazing. I highly recommend the peanut butter smores cookie. Share it because it's super sweet!  Service was pretty good, but I waited a long time for a to go container and a water refill. The waitress was very helpful when I was asking about the rewards app!",https://www.yelp.com/biz/bjs-restaurant-and-brewhouse-stockton?start=20,2.6,2.84,2.724,1.9960000000000002,2.744
70,Bernadette F.,"Elk Grove, CA",71,26,,1.0,2016-10-17,"Nope. Nope. Nope. Go somewhere else. Seriously.  Horrible people work here. Honestly half the staff here should be written up or fired. The only people who should keep their jobs is the host with the bangs and then also the bus boy who gave us our waters after 20 minutes of waiting.  First off hosts the one with curly hair and the one with a tight pony tail-awful. You'll see them faces pinched. With no smile. My friend and I walked up to the counter, without a hello or a welcome they just looked up at us once maybe-and went back to whatever they were doing. My friend had to get their attention to get seats. And then bangs swooped in and took us to our seats-you know actually doing her job. Then our waitress comes and she is anything but pleasant. Completely sarcastic(no she didn't get tip and neither did her braided teammate who just ruined dessert.) Okay we ordered are meal and the whole time I never got a water refill was never asked-my bad, but finally I asked for water and a pazooki...20 min pass. My friend looks around, the waiters and waitresses are not taking any hints-until boom bus boy swoops in and gets us the water himself! (You know DOING OTHER PEOPLES JOBS)  15 minutes later, some other waitress-I don't know who she is-has our pazookis in bags to go. No girl-we didn't say to go. Sent her all the way back to the kitchen. and then waited another 10 min...15...20...? And our original waitress comes back with our receipt telling us there has been a mistake and that we were put up the list in priority so our pazooki's would be out soon...15 min later...we're done. Outta here. How dare you make us wait practically an hour for dessert and make us pay for it. Never eating here again. Unless they change up the staff. I'd rather drive out to some other BJs.",https://www.yelp.com/biz/bjs-restaurant-and-brewhouse-stockton?start=40,2.44,2.84,2.708,1.7640000000000002,2.68
161,Ray A.,"Tracy, CA",0,2,,1.0,2016-10-30,Appetizer plates were dirty and ordered a medium on my burger came out dryer there can be won't be coming back,https://www.yelp.com/biz/bjs-restaurant-and-brewhouse-stockton?start=180,2.44,2.81,2.708,1.7640000000000002,2.662
95,Kenya P.,"Stockton, CA",23,8,,3.0,2016-11-03,"The is okay, with a nice atmosphere. It can be a bit crowded, which is why not such a high rating. The staff is pretty friendly as well.",https://www.yelp.com/biz/bjs-restaurant-and-brewhouse-stockton?start=100,2.48,2.83,2.704,2.0600000000000005,2.6900000000000004
135,Kenny T.,"Stockton, CA",94,20,,1.0,2016-11-08,"Been coming here for years, the food was great at first. The quality of the food here now is mediocre and can be better prepared at home. Not only is the quality lacking, they began reducing the quantity in some of their appetizers. Cutting corners to save money? I dont know, but this place needs to reevaluate their standards here.",https://www.yelp.com/biz/bjs-restaurant-and-brewhouse-stockton?start=160,2.48,2.83,2.7,1.8280000000000003,2.6900000000000004
180,Jeanette T.,"Stockton, CA",16,153,891.0,1.0,2016-11-09,"If I could give a lower Yelp review I would! Sunday November 6,2016 we go to have dinner and arrive at 6:27pm. There is a crowd and we are told it would be a 35 minute wait, gave us a buzzer and we sat down. Well 35 minutes pass, 45 minutes pass and now we are going on a 70 minute wait. We should have left after 50 minutes or sooner actually. My husband goes to counter says we've been waiting for an hour now! She says we are just waiting for to clear a table. NOW mind you several people have been called while we're waiting. 2 people here, 3 people there. Why couldn't they put 2 tables together to accommodate our group. If they are taking 2,3,4 people in a party at a time? They aren't all sitting in booths! So at this point we decide to take our farewell party else where. (Our 6th grader chose Bj's as her farewell dinner before she left for science camp this week.) I was NOT happy at all!! The gal out front was not accommodating or was not very apologetic it was as if we had only been airing 15 minutes not 70 minutes!! She said the kitchen was backed up. So even if we were seated we would still have a wait for the food. This is so ridiculous, and happens often here, the kitchen is always backed up is their excuse as to why the food arrives 30-40 minutes after u order. I was so bothered. I will not go back!! Do yourself a favor GO SOMEWHERE ELSE!!!",https://www.yelp.com/biz/bjs-restaurant-and-brewhouse-stockton?start=140,2.36,2.83,2.688,1.956,2.6420000000000003
122,Ma P.,"Hughson, CA",0,37,7.0,4.0,2016-11-13,We LOVE BJS! From our experience they always have great food and customer service! They also have a good variety of food. Their pizza is the best pizza around and a pizookie for dessert always makes my day. My husband loves their craft beers while watching sports. It's very clean including restrooms. The only negative thing I have to say is sometimes the wait is a little long especially on weekends but it's like that at most restaurants.,https://www.yelp.com/biz/bjs-restaurant-and-brewhouse-stockton?start=160,2.4,2.86,2.7,2.384,2.676
106,Trina W.,"Stockton, CA",18,27,11.0,1.0,2016-11-13,"My cousin and I were seated at 8:15 pm, we received our drinks and ordered appetizers.  We waited and waited and waited...everyone around us was served ...by 9:25 pm no one checked on us we didn't receive our appetizers and the sad thing is this wasn't the first time.  Never again!  We left 10.00 for the drinks and walked out.",https://www.yelp.com/biz/bjs-restaurant-and-brewhouse-stockton?start=80,2.24,2.86,2.7,1.988,2.612
33,Colleen W.,"Sacramento, CA",521,324,425.0,5.0,2016-11-14,"This rating is based on my most recent experience at BJ's Stockton. I have been here in the past many times but its been about 6 or 7 years since then. In the past I had nothing but positive experiences and luckily the service is still the same.  We were greeted right away and sat quickly on a beautiful busy Saturday afternoon. Our server was at our table within a minute or two of sitting down and taking our drink order. Drinks were delivered in a reasonable amount of time. And so was our food. Our server was very attentive, there was one time when she went a little longer than normal between checking on us but it was nothing to be upset about. She did however apologize that it took her a few extra minutes to check on us.  Food and beer were both delicious as usual, I've never had any complaints about the food or beer at any location.  Other locations (see my BJ's Elk Grove Reviews) could learn a thing or two from this location about service  =)",https://www.yelp.com/biz/bjs-restaurant-and-brewhouse-stockton,2.4,2.9,2.716,2.388,2.7
91,Lauren N.,"Lodi, CA",0,8,,1.0,2016-11-16,"You should totally come here.... If cold food, and slow and rude service are your thing!  Manager was extremely polite, apologized on behalf of the employee however my experience was already ruined. Will not return.",https://www.yelp.com/biz/bjs-restaurant-and-brewhouse-stockton?start=100,2.36,2.86,2.716,1.988,2.66
195,Donna A.,"Stockton, CA",2,21,,3.0,2016-11-28,"I keep coming back because the food is good, and the selection is amazing.  There really is something for everyone here.  My issue lately is with the service.  In my last 4 visits I have had decent service once.  I have actually walked out once after 20 minutes of not being acknowledge once seated.  My last visit pushed those boundaries too.  After we were seated several employees walked by in the first few minutes.  It was 20 minutes after being seated that someone came to check on us, and I believe that was only because I stood up and looked around.  I was actually reaching for my jacket to leave, when someone came by to see how we were doing.  We placed our order and the food was great.  We ordered the dinner for two with salads, medium pizza, and pizooki.  We had to remind them the pizooki came with the meal and remind them of which one we ordered.  When it was time to leave, we once again had to stand up and look around to get someone's attention in order to get our check.  I am giving them the benefit of the doubt on this one since it was Monday night football.  But if the service does not improve, even great food will not get me back.  Date of visit was 11/21/2016.",https://www.yelp.com/biz/bjs-restaurant-and-brewhouse-stockton?start=140,2.32,2.88,2.724,2.1879999999999997,2.656
40,Gretchen T.,"Sacramento, CA",17,257,361.0,3.0,2016-11-29,"Got the sirloin steak with steamed vegetables and thin cut fries. The steak wasn't very flavorful and the texture could have been better. I also got a snake bite drink, which was great. There was a rather large group of us, so they put several tables together and had two waiters taking our orders, one for each side of the table.",https://www.yelp.com/biz/bjs-restaurant-and-brewhouse-stockton?start=20,2.36,2.9,2.728,2.1239999999999997,2.684
109,Luis J.,"Stockton, CA",23,52,28.0,1.0,2016-12-08,"I keep trying to give this place a shot, but yesterday I was sadly disappointing once again. I've already had an instance where I had to complain about the service, however it never seems to improve. The waitress hardly came to see how we were doing and it took about 15 mins just to get my drink. This place is terrible, not the worst in Stockton but a close runner-up.",https://www.yelp.com/biz/bjs-restaurant-and-brewhouse-stockton?start=80,2.32,2.87,2.724,1.956,2.6500000000000004
198,John F.,"Stockton, CA",0,68,,3.0,2016-12-08,"I went there with my family on a busy night.  The kitchen served our main dish before our appetizers arrived.  Normally I would have asked to cancel the appetizers but our waiter and then the manager came by to apologize for the error and insisted that we receive the appetizers complimentary.  It is refreshing to actually go some place where people are accountable.  Kudos to our waiter and the manager.  Food was good, game was on,  and the Grand Cru hit the spot.  My kids loved this place for the dessert, atmosphere, and comfort food.  Will be back and definitely appreciate staff that are accountable.",https://www.yelp.com/biz/bjs-restaurant-and-brewhouse-stockton?start=140,2.36,2.87,2.728,2.1559999999999997,2.6660000000000004
117,Zombie O.,"Manteca, CA",0,14,,1.0,2016-12-09,"So where to start.....this is about my 4th time coming to this place in the past year and every time it gets more and more disappointing, from bad service to bad food not to mention my grandma slipping and falling in there from wet floors. Now you expect these kind of things from a Denny's or ihop but even they have stepped up their performance from what they use to be. Sadly I can't say the same about this place. In a city with so many many many box chain restaurants you think something would be done to keep ppl coming back. Apparently they operate under the guise of who cares about service, and food as long as ppl pay for crap that's what they're gonna keep shoveling. I'm going to Denny's",https://www.yelp.com/biz/bjs-restaurant-and-brewhouse-stockton?start=80,2.32,2.84,2.72,1.956,2.632
219,Andie M.,"Stockton, CA",0,30,8.0,2.0,2016-12-11,Two stars so my review can be seen wow by far disgusting place went in for a night out with co workers some ordered dinner plates but we all pitched in for appetizers two chicken orders came out raw the first co worker that had gotten there before everyone never got his order who is running this place we work in a top store and know what customer service is and let me tell u that slacked and even made the visit more unpleasant will never return hope they get it together and they better hope they don't get a surprised visit from a undercover visit to see how it's being ran if they do hope they serve cooked chicken,https://www.yelp.com/biz/bjs-restaurant-and-brewhouse-stockton?start=120,2.2,2.85,2.72,2.184,2.5900000000000007
196,Ignacio C.,"Stockton, CA",1,15,1.0,1.0,2016-12-11,"i went over on 12/10/16. i spent over 70, on dinner. for me and my wife. the service was bad, the food lousy. i should have asked for a refund. they even screwed up my drink. i've been there before, it was great?",https://www.yelp.com/biz/bjs-restaurant-and-brewhouse-stockton?start=140,2.2,2.85,2.712,2.052,2.5900000000000007
61,Honest A.,"Manteca, CA",70,67,9.0,3.0,2016-12-12,"So.... somehow we had a change I  servers though our first server never left... oh well his lost.  Late last night, dec 11th was awesome with or server (thin African American with a possible fohawk).  Haven't been to bjs for some time because of the crappy service.   First off, i called before heading out to a different town... seen they brought back the pizza special for $25... called ahead of time to make sure it was still going on... the assured me they did listening i was driving dive distance to get there.   On the way in a seen a name of a bet that caught my eye, especially when i read underneath out that out was a ginger beer.  Our second server informed us it hadn't been around for months?  He went out of his way a few times to see what he could do, which was extremely appreciative.   Love bjs pizza, beers, and pazookies (and other good when i can get away from my faves) but it's been about a year since we've been because of horrible costumer service.   This guy was amazing.... if I'm every in town I'll be sure to stop by and ask for him.  .....Please make sure anyone who answers the phone doesn't answer any questions they aren't a hundred percent about.....",https://www.yelp.com/biz/bjs-restaurant-and-brewhouse-stockton?start=40,2.28,2.86,2.712,2.252,2.628
67,G J.,"Stockton, CA",3,25,19.0,5.0,2016-12-15,Been coming here for years. They never disappoint and the service is fast. We ordered the fried chicken with mash potatoes and the Mediterranean Pita tacos. For the appetizer we tried the guacamole with chips. Not bad at all. Will continue to eat here,https://www.yelp.com/biz/bjs-restaurant-and-brewhouse-stockton?start=40,2.44,2.9,2.728,2.516,2.716
71,Thomas R.,"Stockton, CA",0,8,,5.0,2016-12-16,"I come here sometimes with coworkers during lunch. We'll place our orders on the phone then swing by and pick them up. Last time I came with my buddies, we got two pizzas and they were amazing. Sweet Pig and some thin crusted pesto chicken thing. The two were enough to feed four people and the price came out pretty reasonable.  I brought my mother last night, and we had a great time. Our server, Derek, was fantastic. He was very attentive and came by to check on us regularly. He was very patient when we couldn't decide what we wanted and asked him to come back in 5 minutes.  There were some young looking servers at an empty table slamming menus down on the table. I was literally jumping in my seat from the loud noise because it kept scaring me. This is probably the only unsavory experience I've had here. This is a BJ's though, so I know better than to expect all the young employees to be professional.",https://www.yelp.com/biz/bjs-restaurant-and-brewhouse-stockton?start=40,2.52,2.94,2.728,2.484,2.7720000000000002
216,Fouka M.,"Stockton, CA",74,23,124.0,1.0,2016-12-17,"If i could no stars I definitely would! This used to be a really nice quick place to come to for casual meets and drinks. The only reason why I would give it a star is because the food is always consistent here. The drinks are good as well.  My main concern is the customer service. It sure went from a 10 to none. Ive never had a problem sittint at the bar side, usually less wait.  We found sittiny easily upon arrival.  Sat there, waited and waited.  We looked around and it was pretty slow (around 130pm) so we figured service will be on our way soon. A family of 4 sat at the booth right in front of us and right away I service rendered to them first.  The waited did not make any initiation to even ask if weve been helped or not. I waited for her to be done attending the family who came after us yet waited on before us. I had to ask if we too can get service.  She took our orders and informed us that food will be right out. Im a desert  first kind of person so I asked to see if i can have my pizooky in advanced.  20 minutes later....we asked another waitress about our orders.  We ended up getting my desert with our appetizers and food with no utensils and water. (Way to go BJ's) got up and took utensils from another table When we almost finished our food, our waiters finally came back to us and informed us that she did not realize that the other waited who was supposed to cover for her never waited on us. Most of the time im well aware when waiters switch shifts or breaks, they usually inform the customer in advance.  In this case, WE NEVER DID and puts the blame on someone else...thats shitty service. Did she deserve a tip? Definitely NOT!! As much as i like the food, if service is crappy its not worth going back!",https://www.yelp.com/biz/bjs-restaurant-and-brewhouse-stockton?start=120,2.36,2.93,2.716,2.02,2.702
5,Daniel G.,"Stockton, CA",46,107,76.0,1.0,2016-12-22,"I wish hey we're as good as the Modesto location, here they slap things together decently and hope it's comparable to what's described on the menu. Severely Over cooked meat, 38 minutes waiting and counting on a Thursday. We waited 26 minutes for our waitress to ask us if we were ready to order as she laughed and spoke with co-workers. Drinks are great, hence the second star. Although I'll be coming back for the bar this is my last time coming in for food. I've waited too long, I've had two bad past experiences and I came here reluctantly with family and now they feel the same due to these outrages wait times. We arrived at 9:15pm today as I'm typing this review it's 10:04pm and have yet to receive food. It's about 20% full and fully staffed. I could grown the ingredients from scratch and made the food myself by now lol Update: I hade to reduce another star, I gave them two stars because at least the drinks are great. Now that's the only star they have left 10:51pm now: we have just left food arrive at table at 10:19 we finished at 10:34 and have been waiting to pay since. Natalie our waitress kept forgetting we existed, first we had to wait another waitress to call our waitress to order our food after sitting for half an hour, our food came out cold (keep in mind we sat 1:04 hr before being served), luckily a really nice guy, possibly the buss boy asked us if everything was fine. Not our waitress, the buss boy, I asked him to touch my sisters food and he said ""oh no, this is colder than ice, not cool, I'll be right back"" and sure enough he came back to our table with fresh food and even brought silverware because after asking our waitress she never brought any. When it came time to pay I asked Natalie for the bill twice before leaving. It was evident I didn't like my food I left the ENTIRE meal on the plate, did not ask for a to go box, and of course she didn't pick up on the context clues. My sister did get a box to go for her almost complete meal. When she asked if everything was great I responded ""it wasn't really good, I'm sorry"" which she apologized for but that's it. I'm never going to be a snob so I reluctantly paid for a meal which I didn't eat, or like or take with me. I picked up drive thru on the way home for all of us. The bus boy (I think that's what he was) was phenomenal and i wish I could have found him on the way out I had 40.00 for him !! As for my experience, this was the final nail in the coffin, I wouldn't go back even if I was offered free food for life. Complete dog$hit experience and food. I used to love this place many years ago. I am hand to god feeding my sisters left overs to our dog Cali this very moment. Silver lining = Great dog food !!!",https://www.yelp.com/biz/bjs-restaurant-and-brewhouse-stockton?start=60,2.2,2.91,2.708,2.116,2.6260000000000003
52,Jessica M.,"Sacramento, CA",61,19,18.0,1.0,2016-12-22,"When we arrived to this place, they were not super busy. We got there around 9:15pm. The server greeted us and took our drinks orders. She brought them over within 5 minutes. Then asked if we were ready to order, we told her we needed a bit more time to look through the menu. She said ""ok, I'll be back to check on you guys"" .. SHE NEVER CAME BACK! After a 20 minute wait, I couldn't wait any longer, I was HANGRY. So I politely asked other server if we could please get someone to take our order hence we were waiting for about 20 minutes. She was nice. She apologized and said she would get our server right away. Our server was NOWHERE TO BE FOUND! Finally after another 10minutes, I saw her dealing with another tables order. The manager approached her and whispered something to her ear. She then turned around and looked at us. She continued to take the other tables order and after she was done she approached us with a HUGE ATTITUDE and said ""Are you guys ready now!?"" ..... I was so hungry that I had no time to think about going anywhere else and wait other 30min to have some food. At this point I was so annoyed by the service given to us for not reason. It was a very dissatisfied and disappointing experience. The rest is history, the food was mediocre and cold. I ordered spaghetti and meat balls and when they arrived, the meatballs were dry and cold..  Pathetic service and low standard food... OH, AND MY FOOD HAD A HAIR ON MY PLATE!!!!!!!!!!!! Never coming here again. Thanks for your unpleasant service Natalie F (server). If you do come, make sure you time your server and holla at them so they don't forget about your table....",https://www.yelp.com/biz/bjs-restaurant-and-brewhouse-stockton?start=20,2.12,2.91,2.708,2.18,2.5940000000000003
54,Jade V.,"Stockton, CA",7,25,14.0,1.0,2016-12-27,"I wanted a pizookie, so I came here. Unfortunately, I did not get my pizookie. We waited over 20 minutes for someone to serve us. We flagged the staff down several times and they kept telling us that they would send someone over. No one ever came. No water. No food. No service. We asked to talk to the manager. He never came either. It wasn't even busy. It's a Tuesday! I can't imagine the service on an actually busy weekend.  BJ's can keep their overpriced big cookie and ice cream!!! I definitely will not be coming here ever again. Please save yourself the trouble and go somewhere else.  I will also be contacting corporate about my horrible experience.",https://www.yelp.com/biz/bjs-restaurant-and-brewhouse-stockton?start=20,2.12,2.88,2.7,2.308,2.576
204,Vita S.,"Corona, CA",3,13,,1.0,2016-12-27,"Warning: horrible service here. Can't even get a waiter to get water. We tried to wave different waiters who were all huddled at one corner, some ignored us while one claim to go look for our missing waiter. We waited and waited but still no one came to take our order. After a long wait we gave up and left disappointed. I WILL NEVER EVER GO HERE AGAIN!!!!!!!! HATE HATE HATE THIS PLACE. Very crappy service.",https://www.yelp.com/biz/bjs-restaurant-and-brewhouse-stockton?start=120,2.12,2.86,2.696,2.34,2.564
187,Steve D.,"Stockton, CA",113,3,,2.0,2016-12-29,The food was fine but the service is terrible! Took forever to get drinks and our order taken. Then our appetizer food and drinks all came out at the same time and surprise we didn't even have silverware for another 5 minutes. 3rd time in a row we've had bad service.,https://www.yelp.com/biz/bjs-restaurant-and-brewhouse-stockton?start=140,2.08,2.87,2.696,2.44,2.5540000000000003
