,Username,location,friend_count,review_count,photo_count,rating,date,review,Url,roll25,roll100,roll250,special_25,Final_Rating
16,Jon R.,"Phoenix, AZ",0,7,,2.0,2016-03-30,"This is a long review, by far my longest, but I feel this must be done.    I  have been a frequent of chili's for the past 25 years. When I graduated from bootcamp (USMC), my dad asked me where I wanted to go. Could have been anywhere, and I mean anywhere, but I said Chilis because I wanted the original chicken crispers, And I have gotten the chicken crispers every time almost since the beginning. They are the best in the crisper business, especially when u pair them with chili's awesome ranch and honey mustard.  I have been coming less and less though over the past year. While service stays on par, the quality of food is going down. The crispers have gotten to the size of a MC Donald's chicken nugget and the wife and I both agree the chicken always seems chewy. Not like how it used to be. My orders of kid crispers 25 years ago had more food on the plate then my order yesterday. And it's not just this experience. It is almost every experience. I could keep going on how disappointed I am with what this location has done to my love for chilies original chicken crispers but I feel my point is made.... My wife normally gets the pasta dish on the 2/20 menu and does not order it anymore because something about it changes or they cook it wrong every time.  I will give them a high five for not messing up the side salad yet but I am not keeping my hopes up. Also the panko fried onion rings (i think it is what they were called) were pretty good and I would order them again if I return before they take them off.  So the service is decent. The bartender/ cocktail server/ hostess does her best. But whenever we are there she seems to be the only one who actually cares about customer service. She can take a while to get to you but she seems to do more then anyone there. So kudos to her. I can't remember her name but she is always in the bar it seems after 4 PM when we go.  I will also give them another high five because this location keeps it pretty clean. From the outside to the doors to the bathrooms to the floors. It's clean.  This location is right down the street from me but I will start going to different locations to see if the chicken crisper problem is this store or chain wide. I am ready to give up on this location but not my crispers.",https://www.yelp.com/biz/chilis-phoenix-22,2.92,2.92,2.92,,2.92
18,David L.,"Phoenix, AZ",111,177,34.0,3.0,2016-04-26,"Different experiences at different times and different days and even different parts of the restaurant. I guess some servers have it and some don't. What I look for in a sit-down eatery is someone who checks up, roughly 12-15 mins apart, make sure drinks are always full, and be a little friendly. Well, it doesn't always work out at this Chili's but my experience has never been bad. Just lacking sometimes.",https://www.yelp.com/biz/chilis-phoenix-22,2.88,2.88,2.88,,2.88
10,Vinodh Kumar C.,"Irving, TX",183,116,359.0,4.0,2016-06-28,The Texas cheese fries and Margarita Grilled Chicken are my favorites here. Taste of the food here at this outlet has always been good and consistent. The staff have been polite and friendly  all the time. The location is opposite an AMC which is a big PLUS. Wish to visit this place again.,https://www.yelp.com/biz/chilis-phoenix-22,2.96,2.96,2.96,,2.96
17,Steve R.,"Cave Creek, AZ",2,16,4.0,4.0,2016-07-24,"Always good service, great food usually little to no wait even on Fridays and Saturdays, the only reason it's not 5 stars is the takeout portion sometimes gets orders wrong, and or gives you cold food so if you order take out make sure you double check the order",https://www.yelp.com/biz/chilis-phoenix-22,3.08,3.08,3.08,,3.0800000000000005
28,Kotieswar Chowdary C.,"Phoenix, AZ",1,7,,3.0,2016-08-09,I felt is expensive. Food is not so great. Place is not decent as expected. I dont prefer to go again.,https://www.yelp.com/biz/chilis-phoenix-22?start=20,3.04,3.04,3.04,,3.0400000000000005
25,A T.,"Glendale, AZ",0,6,,5.0,2016-08-31,"I love coming here with my friends! It always seems to be busy but I typically do not wait at all. All of the servers I have had were very nice, as well as the bartenders. The drinks can sometimes be a little strong, which is a shock at first but I always appreciate it. The food is always exactly how I ordered it and have never had a problem with it, my favorite is the big mouth bites! so good!!!",https://www.yelp.com/biz/chilis-phoenix-22?start=20,3.08,3.08,3.08,,3.0800000000000005
11,Kail P.,"Apache Junction, AZ",117,16,2.0,4.0,2016-09-13,"I don't review chains often nor bring my business to them, unless someone's buying. It's chilis; don't get your expectations too high. Food was what it should be, Martino was very friendly. Fries aren't vegetarian from the oil it's cooked in; if you have an important dietary need, inform management and see if cooking separately is possible.",https://www.yelp.com/biz/chilis-phoenix-22,3.08,3.08,3.08,,3.0800000000000005
5,Erica B.,"Phoenix, AZ",127,237,77.0,3.0,2016-11-09,"I'm not big on chains because everything always taste like it comes out of the frozen section aisle in the grocery store (unless it's Bonefish or Outback :) Chill's is no exception!  Just go for happy hour and bar food only .. maybe even just drinks, chips and salsa. I got off work early last week and decide to grab 2 happy hour drinks at Chill's while I waited for a friend to get off work.  Besides myself there were 6 other people in the entire restaurant on a Thursday afternoon (3:30-4 ish).  I ordered the Presidente Margarita because the bartender told me how this one was so much better than the regular Margarita.  Nothing taste Presidential about the damn thing!  Cool .. I decided after my second sip that my next drink would be liquor, ice and lime.   Before my second drink I ordered the happy hour portion of Texas fries.  They look so good on the menu.  When I received mine however, they were old fries that were just sitting for a while, then thrown in the oven with cheese, bacon and peppers ... all the things I like but it seems they must have forgotten about the the Texas fries in the oven because the skillet was scorching hot but the fries taste old and the cheese was almost burnt and the bacon pieces were so hard that I just decided not to include any on my fork.  Bummer! I followed by gut and ordered just a well Tequila, on the rocks with lots of lime.  I'll go back to Chill's for happy hour ONLY because it's across the street from job.  I wouldn't bother stopping in otherwise.",https://www.yelp.com/biz/chilis-phoenix-22,3.04,3.04,3.04,,3.0400000000000005
14,Mary S.,"Glendale, AZ",22,5,,2.0,2016-12-27,The food and service were good- The problem was other employees! We were seated in a back booth-Other employees  kept talking loud and jumping up and down in booth behind me like two year olds-making our booth jolt everytime! Then they were sweeping next to booth while eating! Get this straight-We are paying guests! You work there! Never again-,https://www.yelp.com/biz/chilis-phoenix-22,3.08,3.08,3.08,,3.0800000000000005
2,Brittany C.,"Glendale, AZ",746,193,740.0,4.0,2017-01-07,"Went here today with friends and family. I love that they have so many different options on the menu that it's perfect for those that are eating healthy and those that are not. Service is always great here as well and I like their lunch specials. Everything on the menu is good priced.  I got the chicken fajitas. It's one of my favorite dishes. Simple but so much flavor. My friends got the quesadilla explosion salad and the margarita salad that  they both enjoyed. My fiancé tried one of the seasonal BBQ dishes with the sausage and crispers and didn't care for it. It was small portions and pretty bland.  I recommend to go with the classics here food wise, can't go wrong! But great place to have options. Good lunch specials, happy hour, and to go.",https://www.yelp.com/biz/chilis-phoenix-22,3.04,3.04,3.04,,3.0400000000000005
13,Jenny G.,"Phoenix, AZ",0,16,,4.0,2017-01-11,My Fiance and I love this Chili's. Mainly for the drinks and Chips -N- Salsa! The food is ok. We love the appetizers the most. We have only had one bad experience here with service. My favorite drink is the blueberry pineapple margarita and Tito's punch! Always excellent!,https://www.yelp.com/biz/chilis-phoenix-22,3.04,3.04,3.04,,3.0400000000000005
15,Subhashis C.,"Trillium At Deer Valley, AZ",0,11,,1.0,2017-04-09,"Went many times as it is very close to my home. But everytime I am seeing the same problem. 10 minutes to get greeted by someone once you arrive, this time after finishing dinner we had to wait for another 20 mins to get the bill , as the ziosk not working.. then we got a wrong bill. Another 10 mins wait for the correct bill.. never going back..",https://www.yelp.com/biz/chilis-phoenix-22,2.92,2.92,2.92,,2.92
7,Destiny H.,"Phoenix, AZ",1,4,3.0,1.0,2017-04-14,"DO NOT EAT HERE. They don't even wash off their tables. In less than ten minutes of walking into the restaurant and being seated, we noticed how sticky the table was. My partner rubbed the table down with a napkin and sanitizer, and lord Behold dirt and glitter on the napkin. The table was so dirty that the dirt appeared black on the napkin. If they can't even clean/sanitize the table then what makes you think that they can clean their plates, forks, glasses or anything else at the establishment. We were so disgusted that we walked out. Never will come back to this place. NEVER! I wish I could give it 0 starts because they don't even deserve 1.",https://www.yelp.com/biz/chilis-phoenix-22,2.92,2.92,2.92,,2.92
6,Sirk H.,"Phoenix, AZ",0,13,14.0,1.0,2017-04-14,"Walked into this Chili's this evening, April 14, 2017, and walked right back out less than 10 minutes later. We we seated right away, my lady placed her beverage order (margarita) and that came approx 3 minutes later. I noticed how sticky the table was, so I got a napkin and her sanitizer. Lo and behold, some bullshit appeared on the napkin. We closed the menus, and advised them that we would be leaving. They asked ""why"" in a concerning tone, so I showed them how clean their tables aren't! Disgusting!! The manager acted appalled as well. How could you NOT notice how dirty the tables are, when you work here and are constantly ""wiping"" them down. The napkin looked like I wiped the bottom of my Vans after walking through old car oil. No bueno!!",https://www.yelp.com/biz/chilis-phoenix-22,2.8,2.8,2.8,,2.8
9,R G.,"Glendale, AZ",0,9,,1.0,2017-06-01,"Eh. For some reason during lunch, although they did not seem busy (I'm assuming because all employees were standing around on their phones), it took about 5 minutes to be greeted, another 20 for our food, and an extra 10 to get the bill because our Ziosk wasn't working. Our server had a friendly enough voice, yet had the angriest look throughout the entire meal and right before leaving we overheard another server specifically say ""I hate Chili's so much"" to the hostess. I thought these super corporate restaurant chains were supposed to have some of the happiest employees?  Also, I'm not one for having to be dolled up every moment, but the employees here look like they've all had a rough night. It's like a weird teenage hangout, but the teenagers are adults?",https://www.yelp.com/biz/chilis-phoenix-22,2.64,2.64,2.64,,2.64
3,Tricia C.,"Phoenix, AZ",510,251,1203.0,3.0,2017-06-10,"We started with the spinach queso dip. It was decently good. I mean how can you go wrong with melted cheese? The cheese in the dip was a white cheese that had a mild flavor that went well with the spinach that was nicely chopped up in the dip. My favorite part was the scoop of guac in the center of the dip. Unfortunately, the guac was mostly one hard piece of avocado. I had to use my knife to cut it down to scoopable chip sized pieces. To make the queso dip better, I think maybe adding some garlic flavor to it should do the trick. The dip came with a large basket of chips and a small bowel of salsa. I have always loved Chili's chips. They are so thin, yet so crispy.  For dinner, we ordered the honey chipotle Chicken Crispers and a fresco side salad. The honey chipotle Chicken Crispers came served on top of waffles and were topped with applewood bacon, jalapeños and green onions.  The honey chipotle sauce was surprisingly spicier than I thought it would be, which I liked. The were supposed to drizzled with ancho-chile ranch, but I didn't really notice any ranch anywhere so it either wasn't there or was really lightly drizzled. The chicken was really good. It was nice and moist on the inside. The waffles were ok, nothing to write home about. The waffle were kind of dry and a little on the dense side. The crispers came with a side of homestyle fries and a side of honey chipotle sauce. I drizzled the extra honey chipotle sauce over my waffles to give it more flavor and help moisten them up a bit. I liked the sauce so much I also dipped my fries in it. The fresco side salad was a basic spring mix salad topped with queso fresco dressed in a honey lime vinaigrette. For a side salad, it was a decent size. It was refreshing and helped break up the heavy dinner and appetizer. I really liked the dressing that was on it.  We got our leftovers to go and our waiter brought out a bag for our chips and had some extra chips in the bag for us! OMG! Chips! I love that their bags are tailored for reheating their chips in the microwave so you can have hot chips at home! Our waiter was awesome. It think his name was Martino? (I am so sorry if that was not your name) It was like he could read my mind. Everything I needed before I even needed to ask for it or even before I knew I needed it. I wish he could be my waiter everywhere I go. 5 stars for you!",https://www.yelp.com/biz/chilis-phoenix-22,2.72,2.72,2.72,,2.72
12,Cielo C.,"Phoenix, AZ",1,20,7.0,4.0,2017-06-23,I just love coming here for lunch.  The lunch specials are such a great price for the amount of food you get plus if you come with a group they can split your check amongst your friends.  Just so happened that I left my cellphone behind and they held it in a safe place til I made it back.  Thanks Chilis!,https://www.yelp.com/biz/chilis-phoenix-22,2.68,2.68,2.68,,2.68
1,Janine D.,"Phoenix, AZ",71,143,286.0,2.0,2017-08-16,"went here after a movie. there were only a number of customers seated but yet it took a while to get our food; we only ordered appetizers by the way. we had the buffalo fried cauliflower, fresh guacamole with chips, and the margharita flatbread.  the fried cauliflower was actually good. i guess this is new in their menu. the guacomole is a miss. it felt lacking so we put a bit of lemon, salt, and black pepper on it to make it in to our liking. the flatbread tasted good but a bit burnt on the side.",https://www.yelp.com/biz/chilis-phoenix-22,2.56,2.56,2.56,,2.56
4,Dolores D.,"Buena Park, CA",111,28,80.0,4.0,2017-10-15,Love coming to this location. Especially there's a cute waiter therewas disappointed cause they did run out of queso. Had to wait 20 mins for it but it didn't even feel hot or warm and didn't feel fresh. Usually the queso is the best. Literally the only reason I love coming to Chilis with the chips and salsa. Their food is good. I usually get the chicken crispers or ribs which I love.,https://www.yelp.com/biz/chilis-phoenix-22,2.52,2.52,2.52,,2.52
8,Cornbred S.,"Canyons, Phoenix, AZ",20,3,1.0,1.0,2017-10-24,"Called for menu information and was left on hold for more than ten minutes until someone answered and was bounced around to different people, none of which could answer menu questions to the restaurant THEY WORK AT. Looking at stupidity in the rear view mirror.",https://www.yelp.com/biz/chilis-phoenix-22,2.52,2.52,2.52,,2.52
0,Nathan V.,"Santa Fe, NM",0,4,1.0,5.0,2017-12-03,"Is Chili's a five star restaurant, decorated with fine furniture, a warm atmosphere, and established as a reputable restaurant? Or is Chili's a local restaurant with charm, a bustling local scene, bursting with culture? Chili's is, in fact, both. Chili's is a blend of that hometown restaurant that only you know about as well as the great experience of a steakhouse. There's nothing better than walking into a Chili's. If you want to have a great time, you're in the right place. First, restaurant was clean, smelled great, and has music at a reasonable volume. The greeter is always attentive to welcome you in. We were seated quickly, and our server was very friendly and attentive. He quickly took care of us and gave us water (we even had 7 people at our table and he still was on top of it all). Even better, the food came out quickly, and it was hot off the grill. I personally got the Sunrise Burger, and I can tell you, it was AMAZING. It is by FAR one of the best burgers I've ever had.  Lastly, dessert. I got the molten lava cake. You've probably heard it before. It was DIVINE. Warm, delicious fudge inside a fluffy cake topped with a cool vanilla ice cream scoop. Nothing beats that! Not to mention it was my 21st birthday. And I can say that it was one of the best birthdays I've had in a LONG time. I couldn't think of anywhere else to spend my birthday other than Chili's! If you're on the fence about trying out Chili's or haven't been in a long time, it is definitely worth your time and money.",https://www.yelp.com/biz/chilis-phoenix-22,2.64,2.64,2.64,,2.64
