,Username,location,friend_count,review_count,photo_count,rating,date,review,Url,roll25,roll100,roll250,special_25,Final_Rating
52,Angel W.,"Phoenix, AZ",8,4,6.0,2.0,2013-02-02,I've been to many locations and this one was okay. The food didn't seem to be as good and the staff seemed to be unsure of what they were supposed to do. It was bizarre how different the atmosphere was from other Chilis .,https://www.yelp.com/biz/chilis-phoenix-22?start=40,2.6320000000000006,2.6320000000000006,2.6320000000000006,2.6320000000000006,2.6320000000000006
53,R. C.,"Phoenix, AZ",5,224,16.0,3.0,2013-03-18,"Ok, so far... no coronitas for margaritas, no Miller Light on draft? Service was good, food good.",https://www.yelp.com/biz/chilis-phoenix-22?start=40,2.8280000000000003,2.8280000000000003,2.8280000000000003,2.8280000000000003,2.8280000000000003
45,LeideeDie ..,"Phoenix, AZ",45,86,22.0,3.0,2013-04-25,"Food is chilis quality, nothinng too special. sometimes service is good (being served by one person) and sometimes it terrible v(was served by over 6 people and messed up order. i just like the margaritas",https://www.yelp.com/biz/chilis-phoenix-22?start=40,2.8920000000000003,2.8920000000000003,2.8920000000000003,2.8920000000000003,2.892000000000001
22,Miriam H.,"Mesa, AZ",225,144,141.0,4.0,2013-11-23,"Came here a couple nights ago and we had a pleasant experience. No wait, was seated quickly and server was nice. Food was on point and we even had dessert, try the blondie! We even got to color a chili and they said they would put it up on the wall, haha.  Taking away one star because we had to ask twice for a to-go box. But other than that it was a good trip to Chili's. :)",https://www.yelp.com/biz/chilis-phoenix-22?start=20,3.056,3.056,3.056,3.056,3.0560000000000005
35,Morris K.,"Phoenix, AZ",1172,85,,3.0,2013-12-06,"================== RETURN VISIT UPDATE ================== Came again Thursday night after a meeting I attended with nine other people. It was the same group of people I went with in my first review of this establishment.  The group was seated right away and our drink orders were taken. So why the low rating? Why? Because I ordered the Mango-Chile Tilapia. I took one bite and thought it was terrible. If you've seen my other reviews I normally like Tilapia so it wasn't the fish it was how the fish was prepared. It was cooked fine but the Mango-sauce with avocados on top was not appetizing. At this point everyone in our party was served and enjoying their meals. I was waiting for the waitress to come around and ask if anyone needed refills or how was their food, But she was nowhere to be found. When she finally did come around everyone was just about finished with their meals. Then she asks about how everyone's food was. So I told her. Someone who I assume was a manger comes over and asks if I wanted her to have my meal recooked. At first I said no I just wanted it taken off my bill.. because everyone was already done.  After awhile I reluctantly agreed to having my meal recooked without the mango sauce TO-GO..Upon reflection I should have asked for the meal to be comp'd and be done with it.  FOOD: The food is exactly what you would expect from a Chili's Restaurant. :  SERVICE: I must admit for a large group we did receive good service. PRICE: The price  for the quality of food you receive is OK. AMBIANCE: It's like every other Chili's. CONCLUSION: When this sort of thing happens I don't know about you but it can completely ruin your dinning experience. I mean nothing ruins my mood easier than a poor meal when I'm expecting something much better. How I respond depends on my mood and on the circumstances. I didn't appreciate the waitress not returning to our table for such a long time because this whole experience could have been avoided. . RETURN FACTOR 50-50....%.         ******************* What does my OVERALL rating mean? ******************** 5 stars -Highly recommended.  I would be willing to drive out of my way to this business. It is that good. This place represents their industry or cuisine very well!  4 stars - Highly Recommended. I would frequent this business.  3 stars - Not that good but not that bad. Just average. I wouldn't mind going again.  2 stars - I would not recommend this establishment to friends or family.  1 stars - DO YOURSELF A FAVOR AND DO NOT patronize this business. I would RUN AWAY from this place and you should too! DON'T WAST YOUR HARD EARNED MONEY AT THIS ESTABLISH",https://www.yelp.com/biz/chilis-phoenix-22?start=20,2.8600000000000003,2.8600000000000003,2.8600000000000003,2.8600000000000003,2.8600000000000003
51,Misty M.,"Phoenix, AZ",9,24,,2.0,2014-02-06,"I have frequented this Chili's a couple of times. The very first time I visited I was thoroughly impressed. Our waiter was genuine and so friendly. I have a daughter with special needs and often times when we go out wait staff tends to be stand offish, but not this gentleman. I wish I could remember his name but I did ask for the manager and gave a raving review at the time of our visit. The second and third times I went here I was not as impressed. The wait staff was not nearly as friendly and the last time I went there I seriously felt like my daughter and I were an inconvenience even though we were the only people in the restaurant for a good 20 minutes. The food is always good however, and I will more than likely still return.",https://www.yelp.com/biz/chilis-phoenix-22?start=40,2.7280000000000006,2.7280000000000006,2.7280000000000006,2.7280000000000006,2.728000000000001
23,Kay K.,"Glendale, AZ",23,320,6.0,2.0,2014-02-06,This place is pretty bad. I have never seen a restaurant with such great looking food on the menu deliver such lousy food. Service is not genuine.  Burgers are greasy and disgusting along with the steaks. Avoid this place no wonder how good the 2 for $20 sounds. Used to be a fan of Chili's before. What happened?,https://www.yelp.com/biz/chilis-phoenix-22?start=20,2.7280000000000006,2.7280000000000006,2.7280000000000006,2.7280000000000006,2.728000000000001
30,Ebony K.,"Phoenix, AZ",544,595,106.0,3.0,2014-03-31,"I have to admit, it is one of the nicest Chili's I have been to in quite some time. Albeit it was a Sunday afternoon so it was a smidge slower than say a Friday night, it was still a nice. The chips we had for the chips and salsa were warm and delicious and the lighter fare chicken salad was excellent. One of the waitresses however seem to be having a bad day as it appeared she was in some type of disagreement with one of her tables. I actually felt bad for her because like everyone else, I couldn't help but stop and stare like everyone else. All in all, we will be back again soon.",https://www.yelp.com/biz/chilis-phoenix-22?start=20,2.7960000000000003,2.7960000000000003,2.7960000000000003,2.7960000000000003,2.7960000000000003
21,Jonathan G.,"Mesa, AZ",18,22,13.0,3.0,2014-06-16,"Well. Overall I do like this place. They have good food and reasonable prices. However, I wouldn't order any steaks. I do know they are not a steak house and they prove it. First, they cook steaks on a flat top not an open grill which just leaves to sit and cook in its own juices, second, they go by temperature of the meat to tell them when it's done not the feel which is ok if you make sure that the temperature is consistent through out the meat. I have been to a couple of chilis and both the same result. I order medium and it ends up where most of the stake is almost still raw, purple, not just link with blood, raw.  I was told that medium is mostly pink and pointed to the menu that states medium is ""light pink with no traces of red"" so obviously the cooks don't understand the different temperature of meat.  If you order a steak tear it a part. Don't just cut into the center because that will not give you the whole story...",https://www.yelp.com/biz/chilis-phoenix-22?start=20,2.732,2.732,2.732,2.732,2.7320000000000007
32,Brianna T.,"Phoenix, AZ",0,44,69.0,3.0,2014-06-20,"I came here once and tried their chipotle steak it was yummy but didn't last long because within a month it wasn't even on the menu. Came there a second time and got a bowl, it's very small (maybe have the size of the chipotle burrito bowl :/) so it didn't fill me up. I preferred chipotles bowl over this.",https://www.yelp.com/biz/chilis-phoenix-22?start=20,2.668,2.668,2.668,2.668,2.668
43,Lisa M.,"Phoenix, AZ",6,114,29.0,4.0,2014-07-09,"After not eating at a Chili's for over ten years I decided to give them another try.   Really glad I did.   I have come back at least four times in two months.   Everything I have tried has been surprisingly great.    Items I have ordered on my previous visits include, guacamole and salsa, chicken strips, both original and crispy, fajitas, classic sirloin, ribs, corn, mashed potatoes, spinach and artichoke dip, ""big mouth bites.""   Also, have had their house margaritas and specialty margaritas and they are awesome.   Service has been polite and efficient.  Servers have knowledge of the menu items.  If you sign up for their e-mail club you are periodically sent promotional coupons.    Give them a try.   You will be pleasantly surprised.",https://www.yelp.com/biz/chilis-phoenix-22?start=40,2.7359999999999998,2.7359999999999998,2.7359999999999998,2.7359999999999998,2.736
50,Dani N.,"Glendale, AZ",0,6,1.0,2.0,2014-07-12,"I recently went to this Chili's for lunch and being lunch it was fairly busy. I ordered the bacon ranch quesadilla and after a couple of bites there was this nasty hard stuff in the quesadilla. My waitress didn't come check on me for a long time so I just sat there making faces. Finally, the manager was checking on the table next to mine, saw my face and asked if everything was alright. I showed him the hard plastic like pieces in the quesadilla and at first he tried to say it was burnt cheese. He leaves to get my waitress after I bang it on the table to show him it's not burnt cheese. The waitress comes over and says ""well what do you want us to do?"". I tell her I just want my bill so I can leave. The only reason they are getting 2 stars instead of 1 is because when she came back they comped my quesadilla, so I paid for my drink and left and won't be visiting again.",https://www.yelp.com/biz/chilis-phoenix-22?start=40,2.504,2.504,2.504,2.504,2.504
56,B M.,"Peoria, AZ",0,13,,1.0,2014-08-07,"i have never had such bad service in my life and i have never been so mad about bad service before either. My friend and I decide to go to Chili's for our 1hr lunch break. We arrive at 11am. Within 5 mins of being there we order our food. She orders hers, i order mine, and we order one to go for someone else back at work. We sit there for 45mins without receiving our food before having to track down the waitress (because no one bothered to check on us). We tell the waitress to just bring out food out to-go because now we have run out of time and need to get back to work. 5 mins later we get our food and 2 out of 3 orders are wrong! One was a completely different meal than what was ordered. i ask how long it would take to re-make them and we are told about 17mins. At this point we have 10mins to get back to work. Needless to say, we ended up leaving and going back to work without getting to eat any lunch.",https://www.yelp.com/biz/chilis-phoenix-22?start=40,2.468,2.468,2.468,2.468,2.468
48,Cynde G.,"Phoenix, AZ",2,22,10.0,4.0,2014-09-03,My turkey sandwich was excellent and my husband enjoyed the chicken enchilada soup. His quesadilla tasted good but was sloppily put together. Two pieces had no sante fe sauce on them but 1 piece had a glob of sauce. Overall the service was good.,https://www.yelp.com/biz/chilis-phoenix-22?start=40,2.8640000000000003,2.8640000000000003,2.8640000000000003,2.8640000000000003,2.8640000000000003
36,Felicia W.,"Phoenix, AZ",8,54,3.0,4.0,2014-11-21,"This is our favorite location, we've always had wonderful and attentive service and the food has been great. It's Chili's we don't expect a five course meal but it's a great spot to catch dinner or lunch. The bar drinks are inexpensive and usually pretty yummy, the bathrooms are kept clean and if you have any problem the managers are very quickly at your table to address it.",https://www.yelp.com/biz/chilis-phoenix-22?start=20,2.8320000000000003,2.8320000000000003,2.8320000000000003,2.8320000000000003,2.8320000000000007
24,Kate H.,"Auburn, WA",185,900,77.0,4.0,2014-11-28,"I ordered the Atlantic Salmon and it was pretty good. Also, my dining group ordered chips and salsa. Kudos for accommodating the vegetarian in our group. Pretty happy. The server was attentive and helpful. Everyone at my table ate EVERYTHING on their plate. Everyone was satisfied and were quite happy.",https://www.yelp.com/biz/chilis-phoenix-22?start=20,2.8640000000000003,2.8640000000000003,2.8640000000000003,2.8640000000000003,2.8640000000000003
42,Chukki S.,"Phoenix, AZ",95,1020,291.0,4.0,2014-12-06,"Love their margarita selection!  Service was awesome and I love that they have a card machine at your table, at least in the bar they did.  I counted, and I think there were only like 9 seats at the actual bar here, and then some tables a few booths in the bar.  And obviously many more seat in the restaurant part.  Our food was good, we both had chicken sandwiches.  That entree hasn't changed much since I worked at a Chili's in Seattle back in the 90s.  Their presentation has changed a lot though.  Gone are the cheesy crappy cheap plastic baskets and now the food comes on a nice white plate with a stainless steel crate for the fries.  I will say, for $50 though the dinner didn't fill me up.  I wish they had bottomless fries like Red Robin, or at least gave a bigger portion.  I think there are probably like 16 fries or something.  Kinda cheap for that.  But drinks were good.  Not a great TV set up in the bar so if you're trying to watch sports probably head to Bambinos or Buffalo Wild Wings.",https://www.yelp.com/biz/chilis-phoenix-22?start=40,2.8640000000000003,2.8640000000000003,2.8640000000000003,2.8640000000000003,2.8640000000000003
47,BillPenni A.,"Eatonville, WA",0,2,,1.0,2014-12-22,This is the worst review I have ever given restaurant. I waited 1 hour to get food and drink.  The manager did nothing except make excuses.   Totally  understaffed and poorly managed. I will never come back.,https://www.yelp.com/biz/chilis-phoenix-22?start=40,2.5320000000000005,2.5320000000000005,2.5320000000000005,2.5320000000000005,2.5320000000000005
46,Supperman F.,"Phoenix, AZ",3,14,,5.0,2015-01-30,"Awesome friendly and fast service from Sarah tonight, and my steak was cooked to perfection! Good job Chili's!",https://www.yelp.com/biz/chilis-phoenix-22?start=40,2.9640000000000004,2.9640000000000004,2.9640000000000004,2.9640000000000004,2.9640000000000004
26,Shilo H.,"Glendale, AZ",0,8,,4.0,2015-03-20,"Every time I come to this chilis, I get the honey chipoltle chicken crispers. Its amazning! All white meat-- no surprises, comes with choice of side ( i get fries and corn on the cob) the corn is over salted in my opinion but thats easily fixed with a napkin.  Our waitresses always seem to impress wiith their attentiveness and politeness. They have new ziosks, basically a little tablet you can play games on and pay your bill on. My date accidentally clicked a game and it charges us and our waitress was happy to take it off for us. Only complaint I have is if you have a party of 5 or more, you pretty much have to sit at a table because they dont have big booths. Excellent service makes up for it though.. Seriously, they servers KNOW what they are doing.",https://www.yelp.com/biz/chilis-phoenix-22?start=20,2.8320000000000003,2.8320000000000003,2.8320000000000003,2.8320000000000003,2.8320000000000007
20,Michael C.,"Lubbock, TX",142,275,346.0,4.0,2015-03-26,"I often meet people here.  They can handle a larger group and there is plenty of variety on the menu.  It is a chain with advertising on the table and cookie cutter atmosphere, but if its not broke don't fix it.  I'll be back.",https://www.yelp.com/biz/chilis-phoenix-22?start=20,2.8320000000000003,2.8320000000000003,2.8320000000000003,2.8320000000000003,2.8320000000000007
44,Jason A.,"Phoenix, AZ",0,4,,1.0,2015-04-08,Worst food. Slowest service. Never going back again! Our server Brittany was great but everything else was horrible!,https://www.yelp.com/biz/chilis-phoenix-22?start=40,2.436,2.436,2.436,2.436,2.436
34,Jennifer E.,"Phoenix, AZ",37,20,16.0,4.0,2015-04-19,"We did the 2 for $20 deal, we had the Texas Cheese Fries which were greasy, cheesy and delicious for our appetizer. I had the margarita like chicken and my fiancé had the chicken fingers, fries and corn on the cob. The service was quick and we were in and out in less then an hour.",https://www.yelp.com/biz/chilis-phoenix-22?start=20,3.0,3.0,3.0,2.7359999999999998,3.0000000000000004
38,Imran I.,"Scottsdale, AZ",1,6,,5.0,2015-05-17,"Price: Excellent!!! for $23 including tip we got two amazing entrees.  Food Quality: I had not eaten at Chilis for several years, and so I was a little afraid that the food quality might have changed. however, it was superb. The ingredients were fresh: fresh cilantro, fresh beans, gorgeous lime rice. The combinations, moreover, are truly delicious. We also got huge portions. Food Variety: Huge menu.  Service: Waitress could have been a little more attentive. Kept me waiting for a refill of water. However, you can now pay right at your table using a tiny table top computer that makes things extremely easy and fast. It will even print out your receipt. It took a few minutes for them to seat us, even though they were not busy at all. Cleanliness: I did not notice anything bad.",https://www.yelp.com/biz/chilis-phoenix-22?start=20,3.04,3.04,3.04,2.7399999999999998,3.0400000000000005
33,Royston O.,"Phoenix, AZ",2,10,7.0,1.0,2015-05-28,Ridiculous service... Been waiting for an hour now for our lunch... These guys expect us to wait for over an hour on a work day,https://www.yelp.com/biz/chilis-phoenix-22?start=20,3.04,3.04,3.04,2.212,3.0400000000000005
29,Ester M.,"Phoenix, AZ",37,48,52.0,5.0,2015-07-13,"Compliments all around... hostess, waiter, bussers, kitchen & cooks...let's not forget the FOOD. Trio Fajita, rib eye steak and onion  rings...hands down!",https://www.yelp.com/biz/chilis-phoenix-22?start=20,3.16,3.16,3.16,2.676,3.1600000000000006
27,Laraine J.,"Phoenix, AZ",45,14,13.0,5.0,2015-08-01,"Awesome chilis. Best one we've been to. Their food is always spot on. The steak is always perfect, food is always hot and service is always fast. What more can you ask for?",https://www.yelp.com/biz/chilis-phoenix-22?start=20,3.24,3.24,3.24,2.644,3.2400000000000007
37,Amrita M.,"Phoenix, AZ",3,32,22.0,5.0,2015-08-21,I absolutely love this place. Had chicken crisper with honey mustard and m in love with this dish. A must visit for all Valley people,https://www.yelp.com/biz/chilis-phoenix-22?start=20,3.32,3.32,3.32,2.548,3.3200000000000003
31,Talal A.,"Phoenix, AZ",1,3,,1.0,2015-08-24,Worst burger ever. Old French fries probably sitting out for hours. Woke up this morning with food poisoning. I will never return to a chilis location.,https://www.yelp.com/biz/chilis-phoenix-22?start=20,3.2,3.2,3.2,2.116,3.2000000000000006
40,Ryan M.,"Phoenix, AZ",37,67,11.0,2.0,2015-09-20,Place wasn't very great. We had to wait at least ten minutes before we got service and the people who came in 5 minutes after us got served first. My corn on the cob was cold twice and the chicken tenders weren't that great either.,https://www.yelp.com/biz/chilis-phoenix-22?start=40,3.16,3.16,3.16,2.216,3.1600000000000006
49,Alberta M.,"Phoenix, AZ",0,2,,2.0,2015-10-19,Our Server was very nice!! But we walked in Sunday to watch the Az Cardinals play ! We walked in the bar and Michael the bartender was wearing a Broncos shirt! The Az Cardinals game was in 2nd Qtr with no sound on ! The sound was on for the broncos game of course ! The broncos game was on 3 tvs on the bar area when there were many games playing and the Cardinals were on one! We were sitting at a booth in the bar area and I asked if we could change the 3rd TV on the broncos game to NASCAR to check the score my server said sure went to Michael and Michael said absolutely NOT!!! As a paying costumer who frequents this location often was appalled and on top of it my chk came out slimy and undercooked after we waited 45 mins for it!!! No way to treat a customer !!!,https://www.yelp.com/biz/chilis-phoenix-22?start=40,3.16,3.16,3.16,2.3120000000000003,3.1600000000000006
39,Larissa N.,"Phoenix, AZ",0,14,,1.0,2016-01-18,Every time we go into this location it takes about 10 minutes to get greeted then a extra 10 minutes on top of that to have a server come by. We decided to give it another shot last week and again nothing has changed. They aren't a busy store at all. I am a server and am appalled to see how this store is ran. The servers take a long time for any type of service as well as refilling and pre bussing. Lazy.. Wont be back.,https://www.yelp.com/biz/chilis-phoenix-22?start=20,3.12,3.12,3.12,,3.1200000000000006
19,Jerry M.,"Phoenix, AZ",0,7,,1.0,2016-03-15,"Hey just a shout out to all you fellow Yelpers. This location/franchise is rotten from the top down. The pervasive apathy of the staff, including the manager is pathetic. I had not been to a Chili's in quite some time and after my experience today, I am sure my next visit will sometime around the 1st of Neveruary! I wish I could make this blog short but no I'm sorry this deserves some detail!  So I stopped by today around 4:30 for some happy because traffic was backed up on the 101. The bar was nearly empty and a server was sitting at the bar sharing a ""bitch session"" with the bartender. I ordered only two items- a Fat Tire draft beer and an order of wings with what I think to be a simple and common request- that the wings be cooked well done and extra crispy. What I was served about ten minutes later was this hot mess pile of tiny, under cooked, over sauced, soggy, biggest insult to Buffalo wings I have ever encountered. I ate one bite of one wing and it could not have been more perfectly, 100% opposite of what I had ordered and been expecting. So I pushed them aside, finished my beer and attempted to use the little kiosk terminal on the bar to tab out, but of course it was not even close to correct so I asked the bartender for my check. She was observant enough to see I didn't eat the wings and asked what was wrong. When I told her they were not extra crispy and a soggy, hot mess she insisted they cooked them ""twice as long"" (so I assume 4 minutes in the microwave instead of 2). But no worries my phenomenal bartender says she will take them off the tab and then hand me a check for two Fat Tire drafts instead of one. When I called her out on that, she got upset and insisted I had two so I said okay, fine how about you call the manager over here for me and she said sure and left the bar.  A few minutes later, a fifty something blond lady shows up, does not even bother to introduce herself and simply says I'm the manager and asks what was wrong. I proceeded to tell her the above experience and her reply was simply "" oh well everybody makes mistakes, what are you asking me for here?"" I mean really? So that's what they taught you to say at Chili's University! Her apathetic, I could care less attitude is all I needed to know to understand just what is going on at this location. Her base, unprofessional attitude made it obvious she has no standards and therefore neither does the staff! So wow, if you have to go to a Chili's and I have no idea why you would, please for the love of God don't go to this location!",https://www.yelp.com/biz/chilis-phoenix-22,3.04,3.04,3.04,,3.0400000000000005
41,Alexia M.,"Peoria, AZ",0,7,,1.0,2016-03-25,"Went to Chili's for lunch with a few friends after school, and we all ordered water and then later my friend decided to order a different drink and the waitress acted as if it was huge hassle. I had asked to have a order of chips and salsa and she turns to me with attitude and says ""So that will be on your bill"". She said you can swipe your card on the little kiosk or cash, and we told her we were paying with cash. Then we had to wait 30 minutes to get our check. Also the chicken crisper's were anything but crispy.",https://www.yelp.com/biz/chilis-phoenix-22?start=40,2.96,2.96,2.96,,2.96
