,Username,location,friend_count,review_count,photo_count,rating,date,review,Url,roll25,roll100,roll250,special_25,Final_Rating
108,Jake V.,"Littleton, CO",19,421,214.0,3.0,2012-01-06,Good variety of burgers. Love the guac bacon burger and bleu ribbon burger. Also love this location it's smaller than most RRs but less busy also.,https://www.yelp.com/biz/red-robin-gourmet-burgers-goodyear?start=100,2.8920000000000003,2.8920000000000003,2.8920000000000003,2.8920000000000003,2.892000000000001
106,J L.,"Las Cruces, NM",3,91,2.0,4.0,2012-03-25,"First time at a Red Robin. Went in for their specialty limited time only Oktoberfest Burger. It did not disappoint. Ingredients were fresh, and the burger itself was tasty. Lots of menu choices - I only wish the pretzel bun was a regular choice. Most of all we were impressed with the cleanliness of the restaurant. Perhaps because it was relatively new, it was not very busy at the beginning of the lunch ""hour"". Waitress was attentive, honestly friendly, and very helpful (wish I remembered her name). I really liked that the tables were high, so you don't have to bend over to eat. (Parents should love this as it keeps your children from leaning their elbows on the table! ;)",https://www.yelp.com/biz/red-robin-gourmet-burgers-goodyear?start=100,2.9280000000000004,2.9280000000000004,2.9280000000000004,2.9280000000000004,2.928000000000001
109,Dean S.,"Normal, IL",2,33,,2.0,2012-04-19,"We stopped in at the Goodyear RR last night for a quick bite, second visit to this location and only the second time in a RR. The service was average, my wife's burger was good, intructions on toppings was ignored by the kitchen. My soup came out cold, two visits, two bowls of cold soup, by the time it was heated my wife was done with her dinner, this is something they need to work on. I will give them one more try before deleting them from my options for dinner, it is really a shame that all sport bar type restaurants are cut from the exact same mold, nothing new here or exciting, just noisey and pretty good food for a premium price.",https://www.yelp.com/biz/red-robin-gourmet-burgers-goodyear?start=100,2.6320000000000006,2.6320000000000006,2.6320000000000006,2.6320000000000006,2.6320000000000006
103,Jeremy S.,"Litchfield Park, AZ",27,5,,5.0,2012-08-19,Always great. Try the Royal Red Robin Burger!!,https://www.yelp.com/biz/red-robin-gourmet-burgers-goodyear?start=100,2.9000000000000004,2.9000000000000004,2.9000000000000004,2.9000000000000004,2.9000000000000004
85,Lisa K.,"Flanders, NJ",18,43,3.0,4.0,2012-09-30,"It's a Red Robin. It's great for a chain restaurant and I love their Banzai Burger! Good selection of beers and even some local brews (try the Moose Drool or Epicenter from SanTan Brewing). The service here is really great and the staff is extremely friendly. What I do like about this particular location is that the bar is on one side and there are no kids allowed in the bar area, so if you're with a group of friends, you don't have to worry about screaming kids.",https://www.yelp.com/biz/red-robin-gourmet-burgers-goodyear?start=80,2.7039999999999997,2.7039999999999997,2.7039999999999997,2.7039999999999997,2.7039999999999997
111,Canyon T.,"Goodyear, AZ",0,44,,5.0,2012-10-03,The service is always awesome. Love the Banzai burger too. My family has been going to RR for years and its always a great experience.,https://www.yelp.com/biz/red-robin-gourmet-burgers-goodyear?start=100,2.804,2.804,2.804,2.804,2.804
107,Ly H.,"Round Rock, TX",10,75,,1.0,2012-10-31,Took forever for a salad to come out and when it did it came with all of the other foods? the cheese sticks were COLD and refills took a while.... not sure it was the waitress fault i get the feeling it was the cooks fault,https://www.yelp.com/biz/red-robin-gourmet-burgers-goodyear?start=100,2.2760000000000002,2.2760000000000002,2.2760000000000002,2.2760000000000002,2.2760000000000002
102,Erin D.,"Litchfield Park, AZ",81,52,226.0,4.0,2013-01-31,"Can I tell you how much I love this place?  Because I do!  it is a perfect place to take my kiddo's and I usually try to take them here for dinner once a week.  The staff is always friendly and helpful and the food is just right.  Sometimes it takes a little too long to get our order, but all things aside it has good family atmosphere.  My daughter loves ordering their Shirley Temple drinks with extra cherries! :)",https://www.yelp.com/biz/red-robin-gourmet-burgers-goodyear?start=100,2.6399999999999997,2.6399999999999997,2.6399999999999997,2.6399999999999997,2.6399999999999997
90,Humberto A.,"Buckeye, AZ",59,9,7.0,3.0,2013-02-07,"For a chain restaurant; Red Robin is a sure family & friends sit-down place for burgers & drinks. Endless Steak Fry's, now you can't go wrong with that!",https://www.yelp.com/biz/red-robin-gourmet-burgers-goodyear?start=80,2.444,2.444,2.444,2.444,2.444
31,Judy L.,"Avondale, AZ",440,1127,1324.0,4.0,2013-03-09,"I always enjoy their service, burgers, and ENDLESS fries.  I normally only can eat the amount the give you always.  But the thought of ENDLESS fries...  hum.... I changed to have a cheeseburger with bacon today (in honor of my nephew).  7 of us came to honor my nephew and celebrate my MIL's birthday.  Red Robin was his favie place and he LOVED the fries.   1 minor con..  They stuff 7 of us in this tiny booth.  We were a tight family unit!  =)",https://www.yelp.com/biz/red-robin-gourmet-burgers-goodyear?start=20,2.48,2.48,2.48,2.48,2.48
95,Jen T.,"Gulfport, MS",134,273,487.0,1.0,2013-03-18,"Ya know we have been eating RR for a long time and after today I think I will skip it for a LONG time. Service here is hit or miss, ( San Diego is always good ) and today was a definite miss. I ordered my food with guac on the side and pickles. Never got either because our waitress didn't come back til we were pretty much done. I did get my guac finally and it was too late lol! So the waitress said ""oh my manager took off some for not getting your food right' ha ha we get the bill and he took off a $1.50 on a $10 burger. Why bother RR? I would have rather had nothing taken off because what a joke to do so little when my food sucked!!! The manager is ridiculous and I hope he reads this. Way to take care of your customers.",https://www.yelp.com/biz/red-robin-gourmet-burgers-goodyear?start=80,2.084,2.084,2.084,2.084,2.0840000000000005
52,Rob L.,"San Jose, CA",92,469,99.0,4.0,2013-03-24,"Red Robin... Yummmmmmm The Gourmet Burgers are the best chain burger option out there.  These things will kill your waistline, stretch your colon, cause minor heart calcification, and are relatively expensive.  And they are worth it!  Add the tower of onion rings and I think the paper in the basket is a template Last Will and Testament form. Very family friendly with kid options galore, a diner feel, small arcade, and even free balloons. Service can be hit or miss with younger wait staff.  Oddly, I've had three waiters-in-training with their mentors in five vists.  Good overall, though. Carry on my burger brethren...",https://www.yelp.com/biz/red-robin-gourmet-burgers-goodyear?start=40,2.448,2.448,2.448,2.448,2.4480000000000004
78,Luciana L.,"Buckeye, AZ",77,771,40.0,4.0,2013-05-18,Not a bad place to get a decent burger.  I especially like their garden burgers.  Yum!,https://www.yelp.com/biz/red-robin-gourmet-burgers-goodyear?start=60,2.48,2.48,2.48,2.48,2.48
80,Michael M.,"Goodyear, AZ",43,19,,4.0,2013-05-21,"This is a pretty good restaurant that focuses on burgers.  They have a great selection of appetizers and I would recommend getting their tower of onion rings.  Every one of the burgers I've tried from here has been good and I would recommend getting one topped with crispy onion straws.  I've also had their French Onion soup and that was very good as well. It's a great place to bring the kids as they provide some coloring material and the walls and interior are very colorful providing a good distraction for kids to look around.  The noise level is also conducive to kids as you won't get a lot of strange looks if your child happens to get a little loud.  They also have a good selection of chicken sandwiches as well if you aren't in the mood for a burger.  Their steak fries are good and come in a bottomless bucket, with as many refills as you want.   If you are in the mood for a decent priced burger and looking for quick service I would recommend checking Red Robin out.  I've never had a bad experience with the restaurant.",https://www.yelp.com/biz/red-robin-gourmet-burgers-goodyear?start=80,2.448,2.448,2.448,2.448,2.4480000000000004
110,Conrad J.,"Goodyear, AZ",0,6,1.0,5.0,2013-05-30,This Red Robin is right down the street from my house and I am there on a monthly basis. The food is just like any other Red Robin really good but what really sets this location apart is the staff. I always get the best service no matter what waiter or waitress I get. The last time I was there one of the waitresses recognized us from a couple weeks before and made sure to come by and bring us a basket of fries and a large thing of ranch before our food came out. I have never had better service.,https://www.yelp.com/biz/red-robin-gourmet-burgers-goodyear?start=100,2.452,2.452,2.452,2.452,2.452
77,James A.,"Avondale, AZ",9,99,42.0,3.0,2013-08-05,"I love burgers, but everytime I eat here, I fill up so fast and the burgers never sit right. They are tasty but they just don't sit right for some reason. Endless french fries could be the problem. I'll skip the steak fries and trow down another burger and see how that goes. Always good service.",https://www.yelp.com/biz/red-robin-gourmet-burgers-goodyear?start=60,2.1239999999999997,2.1239999999999997,2.1239999999999997,2.1239999999999997,2.1239999999999997
71,Mandy J.,"Newark, DE",34,21,,3.0,2013-08-27,"I tend to avoid chains and I don't eat burgers and fries very often, so this place isn't really catering to me, anyhow... but for what it was, I didn't love it and I didn't hate it. Here's what I didn't love: I thought that the fries were supposed to be bottomless, but the server did not replenish them.  The restaurant is really loud. For what I had -- burger, fries, and a soda -- I ended up leaving $20 for my portion of the meal. That's too expensive for what I had. I don't want to pay that much for a meal like that unless I'm at a theme park or somewhere else with more of a geographic monopoly... or unless it's like the best burger and fries of all time, which it wasn't. Here's what I did like:  Even though the restaurant was crowded, we were seated quickly (party of 4).  The two teenagers who were in our party wanted to share a milkshake and the server brought it already split into two for them, which was nice.  My burger (guacamole bacon) was cooked the way I asked (medium rare -- sometimes places like this overcook even when I ask for medium rare) and tasted pretty good. It wasn't my favorite burger, but it was fine.  I upgraded to sweet potato fries, and I liked them! Anyhow, it's Red Robin. It's a chain. You know what it's going to be before you go, probably. We went because the teenagers in our party wanted to go. It wasn't my choice, but I thought I would share. There is a Red Robin really n ear my house in Delaware, and I never go and likely won't go. No judgment if you like it... it's just not my thing!",https://www.yelp.com/biz/red-robin-gourmet-burgers-goodyear?start=60,2.1559999999999997,2.1559999999999997,2.1559999999999997,2.1559999999999997,2.1559999999999997
92,Katie M.,"Surprise, AZ",0,13,1.0,2.0,2013-09-06,"I have been to this location a number of times. Each time, the service has not been great. We have waited too long for menus, drinks, and for our order to be taken. We were given our food and still had no silverware. Three separate people in our party asked for silverware at different times. We still never received it and had to walk up to the hostess to get some on our own so we could eat our food! The food and drinks are pretty good but I will never return to this location due to the poor service.",https://www.yelp.com/biz/red-robin-gourmet-burgers-goodyear?start=80,2.024,2.024,2.024,2.024,2.024
88,Joe G.,"Goodyear, AZ",8,34,4.0,5.0,2013-11-24,"What's not to like? The fish n chips, AMAZING. The pretzel bites, Outstanding. The booze, WOW. Don't forget the burgers. I like the RED ROYAL ROBIN. Delicious. Easily my favorite upper scale burger place.",https://www.yelp.com/biz/red-robin-gourmet-burgers-goodyear?start=80,3.56,3.56,3.56,2.356,3.5600000000000005
69,Edward D.,"Surprise, AZ",791,1051,183.0,3.0,2013-12-02,"Management gave me a call today, apologizes, and said they have taken steps to cure the issues. That is a great thing when a restaurants can admit they have an problem and his taking steps to get better. They were very sincere and apologetic. For this reason alone I will be adding a star to their rating.",https://www.yelp.com/biz/red-robin-gourmet-burgers-goodyear?start=60,3.48,3.48,3.48,2.0280000000000005,3.4800000000000004
72,Gabe L.,"Fremont, CA",31,22,17.0,4.0,2014-01-02,"We stopped by for the Tavern Double Tuesday. It was the last of the Cardinal's football season which is a buy a double tavern and get another burger free promotion. We've been to other Red Robin's but interestingly have never been to this location that is so close to our house. When we stop by Red Robin it's usually for a burger and crispy fish sandwich. The bottomless fries come with both so we'll usually get onion rings with one of the meals and share. We know what to expect with the burgers which is well cooked and pretty tasty. We enjoy our favorite burger spots too much to stop her often but it's about as good as you'll get without stepping up to a gourmet burger. For example, they don't ask how you want it cooked. I like the crispy fish sandwich though and get it each visit. The seasoning for the fries is nice but we always seem to fill up on the fries waiting for the meal so not sure why we ordered a hummus plate appetizer. The hummus was the plain type but had some flavor. Would be nice for the plate to come with a couple different types of hummus. I can't say it was freshly made but it was good with the carrots, cucumbers and kettle chips. Their service was good. We had to wait a couple minutes to be seated. There wasn't anybody up front so we kind of stood there for a while. Our server was awesome. She was very friendly, had some good recommendations for appetizers and was attentive. This location is clean and not too noisy. They have TV screens to catch the game but the volume is low so you can't hear it unless your in the bar area. We'll be back sometime to try something other than burgers.",https://www.yelp.com/biz/red-robin-gourmet-burgers-goodyear?start=60,3.52,3.52,3.52,2.096,3.5200000000000005
96,Bill H.,"Goodyear, AZ",18,52,20.0,2.0,2014-01-04,"So.. Ordered takeout.. Got home to wrong order.. An inconvenience, but we go back to get our actual order.. 45 minutes late, we get home with our order... and it's screwed up....  I like red robin.. This one seems to have some issues.. Have experienced some issues while eating in as well.. Only gave them another chance because I got a gift card for Christmas....won't be back...",https://www.yelp.com/biz/red-robin-gourmet-burgers-goodyear?start=80,3.44,3.44,3.44,1.8960000000000001,3.4400000000000004
84,Bryan M.,"Goodyear, AZ",36,4,,1.0,2014-03-02,"This was the worst experience we have had in a long time. Burgers were just ok. First the hostess took way too long to seat us and was in no rush to get customers in even though it was busy. The food was just ok. For the price I think it was not worth it and I would have enjoyed in-n-out much more. Then when it came time to pay, we waited for 20 minutes to get out of that place. I will never return...",https://www.yelp.com/biz/red-robin-gourmet-burgers-goodyear?start=80,3.28,3.28,3.28,1.8280000000000003,3.2800000000000002
65,Bridget A.,"Goodyear, AZ",42,113,263.0,4.0,2014-03-29,I love me some Red Robin! I am never disappointed with their burgers. I have tried almost all of them. My favorite is the royal red robin!! They have good drinks and specials. Also the service is pretty great! Rocio attended us tonight and she was AMAZING!! Rocio always had our drinks coming and she was accurate on our order and fast! Love coming here.,https://www.yelp.com/biz/red-robin-gourmet-burgers-goodyear?start=60,3.24,3.24,3.24,2.2239999999999998,3.2400000000000007
79,Morgan N.,"Phoenix, AZ",15,25,8.0,1.0,2014-05-06,"Shady much? We went in for lunch on Sunday. After the back messed up my burger, the waiter argued with me about if it was the right burger or not. Then, after a 10 minute wait for the right burger, he stated he would remove the burger from the bill for the wait.  Here's where it gets shady. He comes with the bill and says manager wouldn't approve the removal. Alright, no biggie. But then he takes the bill back and offered to pay $5 on it, but brings back a different bill instead for $45. I pay with credit, he turns around and charges my card for $60 and hands me back the receipt which says it was ran for the $60, but no itemized bill. Didn't say a thing, brought it to me quickly with his head down, dropped it and ran. Couldn't find him after that to clear it up.  I didn't much care for the wait and I'm not upset that my order was put in wrong. I'm not even put off by being told they'd clear the burger off my receipt, then them not doing it. Instead, I'm a bit worried at how shady that waiter was, changing out receipts, charging more then he was supposed to, then disappearing instead of speaking up about it. If he's acting shady about a receipt, I wonder what else he is doing....",https://www.yelp.com/biz/red-robin-gourmet-burgers-goodyear?start=60,3.24,3.24,3.24,1.8920000000000003,3.2400000000000007
100,bert p.,"Lakeside, OR",0,15,,1.0,2014-05-22,"Went for lunch May 21, 2014. Not real busy in fact more help standing around doing nothing than customers. Waited 20 minutes for 2 simple burgers and fries. served with small piece of lettuce, onions strings not even a slice, and two paper thin unripe tomatoes. Nothing on the buns and nothing like mayo or mustard on tables. GET A CLUE PEOPLE.  Terrible service and very marginal food. Had similar experiences several times at other location near 99th ave and McDowell. they have lost me and my family forever.",https://www.yelp.com/biz/red-robin-gourmet-burgers-goodyear?start=100,3.16,3.16,3.16,1.8920000000000003,3.1600000000000006
76,L L.,"Mesa, AZ",215,309,65.0,1.0,2014-05-26,"I just had the $13.99 plus $1.35 for canned mushrooms French dip. Really, a $15.00 French dip that is so pueney?? Besides being small, it was way too salty!! The mushrooms tasted like they just came right out of the can! I've had waaaaay better AND bigger French dips for $10.00. Not going back because I feel ripped off.",https://www.yelp.com/biz/red-robin-gourmet-burgers-goodyear?start=60,3.04,3.04,3.04,1.8920000000000003,3.0400000000000005
50,Tim T.,"Goodyear, AZ",2,1,1.0,1.0,2014-07-17,Really disappointing service.  This restaurant was in my regular list but not anymore.  I sat at the bar for 10 minutes at lunch and didn't have a single employee acknowledge my presence.  I wasn't greeted at the door either.  This is lunch hour.  No wonder the parking lot is empty! !!,https://www.yelp.com/biz/red-robin-gourmet-burgers-goodyear?start=40,3.0,3.0,3.0,1.924,3.0000000000000004
99,Lauren R.,"Goodyear, AZ",2,15,,2.0,2014-07-23,"This Red Robin really struggles getting it right.  Our food is consistently not hot when it arrives at our table.  We ate lunch yesterday  (restaurant  was only half full) and I watched our food sit under the warming lights for at least 8 minutes.  The waiter kept telling me our order would be our shortly.  I gave them the benefit of the doubt and waited to see if this was indeed our food and it was.  Fries were soggy and cold burger was only warm, kids meals were luke warm.  I sent the burger back and told him I watched the food sit there the whole time under the lamps and wanted a fresh one made.  Manager came over and gave us some hot fries while they remade the food but that was about it.  Not really any apologies were made.  This Red Robin is getting taken out of our rotation of restaurants.",https://www.yelp.com/biz/red-robin-gourmet-burgers-goodyear?start=80,2.88,2.88,2.88,2.024,2.88
83,Gretchen N.,"Goodyear, AZ",65,94,9.0,4.0,2014-08-01,"I do love this place. I find it a bit on the pricey side, but the cost is worth the service. Sometimes the food isn't perfect, but they always try to make it right.",https://www.yelp.com/biz/red-robin-gourmet-burgers-goodyear?start=80,2.88,2.88,2.88,2.192,2.88
82,Jamie K.,"Buckeye, AZ",28,15,,1.0,2014-08-05,"Not at the top of my list anymore! Ordered the royal burger, when the burger came the egg was still runny in spots. A server came by and told me that that is how they cook them now. It will be a long time before i go back to any red robin. never saw a manager, never got refills on the drinks, had to ask for everything we wanted, ex. extra napkins. POOR SERVICE. POOR FOOD.",https://www.yelp.com/biz/red-robin-gourmet-burgers-goodyear?start=80,2.72,2.72,2.72,1.924,2.72
24,Beth C.,"Buckeye, AZ",43,248,237.0,3.0,2014-08-08,"We hadn't been to Red Robin in many years, but having been given a gift card, we had a good reason to eat there. We visited on a Tuesday at 11:30am. The place was already busy and getting busier by the minute. The hostess sat us and no one came by our table for over ten minutes. We had time to review the whole menu, and it's a long menu, and then spent a few minutes trying to catch a server's eye. I really needed water. Our server finally introduced himself and we placed our full order. Our service was fine after that. We tried the pretzel bites as an appetizer. They weren't bad, but the texture inside wasn't that chewy. They were VERY hot on the outside, so that was in their favor. I told my husband, ""They must have a really good heat lamp back there."" The cheese dip wasn't that good. It was watered down Cheez Whiz, basically. I had the southwestern salad with grilled chicken. I asked for no jalapeno coins and for my dressing to be on the side, and it came out as requested. The salad was okay, though I make better at home. It was watery beneath the salad greens. My husband liked his hamburger, but his overall opinion was it was ""okay."" He much prefers Smashburger or Five Guys, which are also cheaper. Red Robin serves fewer fries on the side than they used to, which was quite fine, really, and makes sense since they offer bottomless fries. Our server did come by to ask if he wanted more fries. The food just didn't stand out to me. I realized I haven't missed Red Robin at all. We have plenty of other restaurants nearby that offer better and cheaper food, though this ended up being pleasant enough as a little lunch date for us.",https://www.yelp.com/biz/red-robin-gourmet-burgers-goodyear?start=20,2.8,2.8,2.8,2.1239999999999997,2.8
49,Ray T.,"Goodyear, AZ",0,220,,1.0,2014-08-22,"All waitstaff please pay attention... Do not take the glasses from our table to refill them, disappear for five minutes, and return with a tray of drink refills for other tables all mixed together with ours. I got my refilled drink back with a chewed straw and I didn't chew it. Our waitress got very upset when I informed her that our refilled glasses did not belong to us and she took them away again to refill them or get us new ones. Who knows? Then she was so upset that I questioned her, she wouldn't even return to our table with the check and made another server do it. NEVER WILL WE RETURN TO THIS LOCATION. Rocio, you only got a tip because my teenage daughter was upset that I wasn't going to tip you even with the poor service and bad attitude. I DO NOT WANT TO DRINK OUT OF SOMEONES GLASS OR USE SOMEONES CHEWED UP STRAW. Bring me a new drink or a pitcher to refill our iced teas. Also, that french dip is WAY TOO salty. I've never had anything so salty.",https://www.yelp.com/biz/red-robin-gourmet-burgers-goodyear?start=40,2.68,2.68,2.68,1.8600000000000003,2.68
58,Bekah L.,"Scottsdale, AZ",0,18,5.0,1.0,2014-09-05,"So sad to have to update this review negatively. We used to enjoy this Red Robin often when the food used to come out hot and tasty but it has now become a place of bland cold burgers with the worst service. Servers and those running food have no clue what they're doing. Don't get excited when your food finally comes after a long wait, it's probably some other tables food.  Alexis was our server and she is the cherry on top of why we will not be returning to Red Robin in the near future. They will rush you to pay your check before you finish chewing on your second bite of your burger. No offering desserts. No cleaning trash off your tables. So glad we came to enjoy a Friday night here to indulge..... NOT. Bye bye Red Robin.",https://www.yelp.com/biz/red-robin-gourmet-burgers-goodyear?start=40,2.6,2.6,2.6,1.8920000000000003,2.6
105,Darren L.,"Phoenix, AZ",0,3,,1.0,2014-09-21,"We came in and was assigned a table .  15 minutes later, no one bothered to serve us (not even a drink to start with). They seemed way too busy.  Two waiters walked past us, looking at our table and just walked away as if they were too busy taking care of others.  We walked out, telling them we waited too long; they said sorry but it was too late!  Too crowded; long wait; unfriendly (stressed out) waiters ; we feel sorry for them!  Chick fil a is  healthier with much friendlier service!",https://www.yelp.com/biz/red-robin-gourmet-burgers-goodyear?start=100,2.48,2.48,2.48,1.8920000000000003,2.48
