,Username,location,friend_count,review_count,photo_count,rating,date,review,Url,roll25,roll100,roll250,special_25,Final_Rating
32,Ann H.,"Phoenix, AZ",0,23,,5.0,2016-08-09,"Went on a busy Saturday evening. First tried the one off of 99th ave and McDowell but the wait was more than 30 mins so we drove a little further to this one and they stated the wait was 10 mins but we barely sat down and then they called our name. Our server Alexia was awesome from the very beginning until the very end of our visit. Alexia was friendly, prompt, remembered everything we asked for, made sure we all had everything we needed and more. She kept asking if we had any questions she would be happy to answer, would frequently check up on us it was great. I have been to the other Red Robin numerous times and have never had service as great as this one. The manager also was making the rounds to make sure everyone was taken care of. The food was good but everything seemed so much better due to the service that Alexia provided. Very happy customers!!",https://www.yelp.com/biz/red-robin-gourmet-burgers-goodyear?start=20,3.44,3.44,3.44,3.124,3.4400000000000004
10,Angie V.,"Phoenix, AZ",7,19,9.0,1.0,2016-09-20,We were sat at a dirty table to start. Under the table was filled with someone's spilled drink and it was covered with paper towels and placed with a wet floor sign on top. And that's where she sat us. Seriously moved the wet floor sign an inch and sat us at the dirty wet table. There's two other tables open but I'm like whatever don't let it get to you. Someone started to clean it maybe they'd be back. Nope wrong. Had to flag down the hostess again as she was sitting a different set of guest at a clean table. By now four servers has passed us but none have greeted us. Someone comes to clean the mess and is even surprised we were sat there and apologies. Then leaves Still haven't been greeted. Waiting  Waiting  Oh look the people sat after us are being greeted and getting drinks Yeah we left and we are now at the Applebee's down the way. Not what we wanted but we walked in and were sat at a clean table and were greeted within one minute. Didn't think that was much to ask for from a restaurant. At least say hey be right with you. Damn,https://www.yelp.com/biz/red-robin-gourmet-burgers-goodyear,3.44,3.44,3.44,2.6280000000000006,3.4400000000000004
38,Wanda L.,"Goodyear, AZ",0,2,,1.0,2016-10-10,"Had dinner here 10-10-2016. Haven't been here in a long time (almost a year) cause I had noticed it was going down hill. Thought I would try it again, I should have not bothered! Awful, first off waitress brought my ice tea in a dirty glass. When pointed it out to her she reluctantly changed it out. While waiting for our meal asked for fries, they were old and could tell they were sitting there for awhile. Thought that maybe the fries coming with meal would be fresh.... One could only wish! They were the same, so asked server for fresh fries, they put them back in fryer and reserved them to us. Still tasted awful! Will not be coming back to this location ever!!!!",https://www.yelp.com/biz/red-robin-gourmet-burgers-goodyear?start=20,3.28,3.28,3.28,2.7560000000000002,3.2800000000000002
17,Hector P.,"Glendale, AZ",0,10,9.0,5.0,2016-10-12,"Never was a big fan of Red Robin's, it's not that I didn't like it I just never bother going. But when I heard about the bees knees I wanted to give it a try and it was so delicious! Totally something different and people should give it a try. Customer service was great as well didn't have any problems and was very friendly!",https://www.yelp.com/biz/red-robin-gourmet-burgers-goodyear,3.44,3.44,3.44,3.156,3.4400000000000004
26,Cassandra C.,"Glendale, AZ",3,29,27.0,5.0,2016-11-16,Free birthday sandwich! I ordered a chicken sandwich and did not like it grilled too much. The manager had the kitchen make a new sandwich with the crispy chicken even though I said it was fine! Good customer service. Unlimited basket of fries.,https://www.yelp.com/biz/red-robin-gourmet-burgers-goodyear?start=20,3.6,3.6,3.6,3.124,3.6000000000000005
30,Kevin R.,"Avondale, AZ",0,77,2.0,4.0,2016-12-16,"Staff very friendly, prime chophouse burger very good as was the French dip , only problem they forgot to give the $10 bonus when we ordered $50 card, otherwise very good.",https://www.yelp.com/biz/red-robin-gourmet-burgers-goodyear?start=20,3.68,3.68,3.68,2.9280000000000004,3.6800000000000006
54,Stacy C.,"Glendale, AZ",0,4,1.0,1.0,2017-01-05,"We will not return back to Red Robin. We went after Christmas and once we were seated it took forever for someone to come and greet us. Once they did we order drinks and food at the same time. I ordered and ice tea without lemon and when arrived it has lemon and she left so fast I couldn't even ask for sweet and low I had to go find some on another table. When our food arrived my son who requested no tomatoes had tomatoes on his burger. Again she took off so quick you couldn't request anything like mustard. The manager came over and I vented to him but he really didn't seem to be bothered by it. In fact, I heard him tell our waitress what a great first day she is having. That explained it all. So then our waitress comes back so we can pay and tells me to use the kiosk if I'm using my card and shortly realizes we don't have one on our table. She then takes my card to pay the bill and we asked for a to go box. Well here she comes with my receipt and again no to go box. We sat there for a little bit waiting but never saw her again. I once again had to get up and go find someone to get us a box so we could get out of there. For the money you would expect better service and we do so we will not be going back to Red Robin there are too many other options out there with better service than this.",https://www.yelp.com/biz/red-robin-gourmet-burgers-goodyear?start=40,3.68,3.68,3.68,,3.6800000000000006
5,Anna R.,"Goodyear, AZ",28,217,43.0,3.0,2017-01-09,"Ok, red robin is my kids favorite restaurant.  I'm not sure why, but we still frequent it often despite my best efforts.  I have officially learned my lesson and will not be ordering chicken again.  I love both their bruschetta chicken and teriyaki chicken sandwiches but I cannot get over the rubber chicken texture, and the yummy sandwich flavors masking the actual chicken flavor isn't cutting it for me anymore.  This last time I ordered the Caesar chicken wrap and again, the chicken is so gross!  Not to mention the wrap itself was dry and tasteless.   I love their fries.  Like seriously I am in love with their fries.  And we always have great service at this location.  I just wish they would change the chicken!  It tastes like fast food chicken (NOT GOOD). From now on I'll just order fries!!",https://www.yelp.com/biz/red-robin-gourmet-burgers-goodyear,3.76,3.76,3.76,,3.76
23,Katrina S.,"Goodyear, AZ",49,31,10.0,5.0,2017-01-13,Service was great as always. The freckled lemonade is delicious! The one with vodka of course! Burgers are great. I tried the fish sandwich this time and it was great also :)  Will be back.,https://www.yelp.com/biz/red-robin-gourmet-burgers-goodyear?start=20,3.76,3.76,3.76,,3.76
7,John M.,"Peoria, AZ",4,215,161.0,3.0,2017-01-30,"well the bottomless fries are bottomless cause they never bring them to you.  although I like going here for the burgers,  I find them very stingy with the first order and takes them a long time to refill.  The back ground music is to loud to have a normal conversation.",https://www.yelp.com/biz/red-robin-gourmet-burgers-goodyear,3.72,3.72,3.72,,3.7200000000000006
34,Jim P.,"Goodyear, AZ",0,9,,2.0,2017-02-12,"We went at 9PM on a Saturday and the crowds had left by then.  The service was extraordinary but I had expected more from the food.  The Fried Pickles, a favorite appetizer that more restaurants seem to be serving lately, were poor quality, not very tasty and coated with a thick coating that had more taste than the pickle.  The serving size was stingy for a $5 appetizer.   The basic red robin cheeseburger was a disappointment, not very tasty and condiments on the burger were stingy.  The gourmet burgers on the menu looked tempting but the prices were too expensive and better values can be found at other local restaurants.",https://www.yelp.com/biz/red-robin-gourmet-burgers-goodyear?start=20,3.6,3.6,3.6,,3.6000000000000005
22,Becky W.,"Goodyear, AZ",0,29,,1.0,2017-03-14,"Our family went for my husband's birthday.  Another year, another disappointment.  All our orders were missing something or cook incorrectly.  We had to ask for drink, French fry & broccoli refills....More than once.  The Mgr (assuming) did come over when she heard us asking for refills & apologized on behalf of the waitress as it was busy.  Unfortunately, this happens every time regardless is their business.  See you next yr for another update.",https://www.yelp.com/biz/red-robin-gourmet-burgers-goodyear?start=20,3.44,3.44,3.44,,3.4400000000000004
21,Michelle B.,"Buckeye, AZ",23,51,135.0,5.0,2017-03-19,Love Red Robin. They have a great selection of burgers and kids meals. I love there French fries. Service at this location is always great. We had a slight glitch with our order this past visit and the manager took care of it right away. Will definitely be back.,https://www.yelp.com/biz/red-robin-gourmet-burgers-goodyear?start=20,3.44,3.44,3.44,,3.4400000000000004
15,Cindy S.,"Phoenix, AZ",65,60,15.0,5.0,2017-04-02,"All of the Red Robin's that I've ever been to have been located inside malls so I was surprised to see one sitting in a vast parking lot with nothing else surrounding it. Very odd indeed. With that being said, I figured that with this restaurant being so randomly placed, I'm sure that it will be completely empty at 2PM on a Sunday. I was wrong. Although there were numerous parties already seated and enjoying their meals and the restaurant looked like it was filled to the brim, we (party of 2 and an infant) were seated immediately. Our server, Rebecca, was great! She had a chipper personality and was always around whenever we needed her with a freckled lemonade in hand. Thank you, Rebecca. You made our experience at this location fantastic! We look forward to coming back and being seated in your area again.",https://www.yelp.com/biz/red-robin-gourmet-burgers-goodyear,3.48,3.48,3.48,,3.4800000000000004
8,Kim L.,"Litchfield Park, AZ",35,14,1.0,5.0,2017-04-09,"This is the best Red Robin in town. All because of server, Beka. She is knowledgeable, fast, attentive, and makes every visit special!",https://www.yelp.com/biz/red-robin-gourmet-burgers-goodyear,3.64,3.64,3.64,,3.6400000000000006
13,Ken B.,"Litchfield Park, AZ",102,8,2.0,1.0,2017-04-15,Bad bad bad...overprice over cooked!! Save your money and go to whataburger! Not even worth the free bday burger we got!,https://www.yelp.com/biz/red-robin-gourmet-burgers-goodyear,3.48,3.48,3.48,,3.4800000000000004
19,Shelly L.,"Goodyear, AZ",1,17,1.0,5.0,2017-04-29,"We love Red Robin! Food is always good! Lots of items are bottomless, including the fries and kids Mac and cheese! And they are wonderful with food allergies. This is one of the few places I trust to bring my child with food allergies.",https://www.yelp.com/biz/red-robin-gourmet-burgers-goodyear,3.52,3.02,3.02,,3.2200000000000006
20,Brett R.,"Avondale, AZ",11,4,,3.0,2017-05-15,Great time for a quick bite before heading off to a Mothers Day matinee. Burgers and bottomless fries,https://www.yelp.com/biz/red-robin-gourmet-burgers-goodyear?start=20,3.52,3.0,3.0,,3.2080000000000006
9,D B J L.,"Avondale, AZ",2,47,44.0,5.0,2017-05-19,"Great Mai Tais and Fish and Chips. We get the fish and chips and yam fries and a burger of the day with fries and a sauce medley. The place is clean and the service is very good. Always. We love it here after a hike in the mountains on the way home. If I could get a salad I would, I swear ; )",https://www.yelp.com/biz/red-robin-gourmet-burgers-goodyear,3.56,3.02,3.02,,3.2360000000000007
3,Andrew K.,"Phoenix, AZ",317,210,310.0,5.0,2017-05-24,"Honestly, the service here was excellent. I can't complain at all. Our server was on the ball, right there ready and available for refills with a genuine smile on her face. The Whiskey River Burger she recommended was filling and good. The games provided kept the kids entertained. And yeah, Red Robin have the hookup on/around your birthday, which is way cool. I don't always hit up chain restaurants, but when I do, it's Red Robin.",https://www.yelp.com/biz/red-robin-gourmet-burgers-goodyear,3.56,3.03,3.03,,3.242
14,Nikki J.,"Buckeye, AZ",31,36,14.0,1.0,2017-06-04,"Well. This is the last time I will be coming to this Red Robin. We were seated promptly but it took forever to get the server to even get us a drink order. Finally they took our order and the next long wait came for our food. Now, this it the reason I will not come back. The food came out on dirty plates like they have never been washed. The manager was the one who brought the food out and when it was brought to her attention she blew it off. Obviously with this lack of concern I would hate to see what the back looks like. The food, well it used to be halfway decent. Save your money and go down to burger king or McDonalds.  You will save money and time!",https://www.yelp.com/biz/red-robin-gourmet-burgers-goodyear,3.44,2.99,2.99,,3.17
16,Daisy S.,"North Mountain Village, Phoenix, AZ",31,6,1.0,2.0,2017-06-07,"We've been coming here for years and recently the service has been absolutely terrible. We asked for the fries while waiting for drinks, Brian brought us 8 fries in a basket. So we asked for refills and waited a long time for them. He said he was new, but he forgot a lot of stuff we needed. Our food was the only thing good! We won't be coming back to this location.",https://www.yelp.com/biz/red-robin-gourmet-burgers-goodyear,3.32,2.96,2.96,,3.104
27,Cindy K.,"Goodyear, AZ",0,21,,3.0,2017-06-29,You can't go wrong getting a burger at this place. The fries are good when they come out hot and fresh unfortunately not like on our last visit. Cold and soggy fries. Please don't serve that to customers. I would rather wait 10 minutes for fresh fries. Servers are generally pleasant and helpful.,https://www.yelp.com/biz/red-robin-gourmet-burgers-goodyear?start=20,3.36,2.98,2.98,,3.132
25,Anton E.,"Goodyear, AZ",44,11,,1.0,2017-08-09,"This location never seems to get it right. I like to say good things about Red Robin, but I can't here. From overdone burgers time after time again (Seriously, I've sent the same burger back 3 times and it still comes well done dry a flavorless)  to lousy service and unattentive wait staff, to an argumentative manager who's only concern last night was if I cussed in front of his server. Our server got us drinks, appetizer and even our entrees quick enough...but then never returned for nearly a half hour. Wouldn't change the TV to let us watch the local baseball game, no refills on iced tea, no refill on fries, no extra ranch or dipping sauce, and no care about it when I called her out. Just, ""I'll get my manager."" And everyone in our section was doing the same scan around looking for her. Drive 4 miles east to the 103rd Ave location.",https://www.yelp.com/biz/red-robin-gourmet-burgers-goodyear?start=20,3.24,2.96,2.96,,3.0720000000000005
18,K B.,"Waddell, AZ",0,1,,5.0,2017-09-08,Awesome Smoke & Pepper Burger! Nice staff. The service was was great & staff very accommodating. We received the wrong order and it was corrected quickly. The manager even came out to make sure we received everything ok.,https://www.yelp.com/biz/red-robin-gourmet-burgers-goodyear,3.28,2.97,2.97,,3.0940000000000003
6,Nora W.,"Goodyear, AZ",0,4,,2.0,2017-10-22,"The last few times we have been there, the service is just not up to par. I ordered the Avo-Cobb-O salad...cobb salad with avocado. it comes out with no avocado on it. It's literally in the name of the salad. I couldn't care less about bottomless fries, just get my order correct. it's a salad for goodness sake. it doesn't seem all that difficult. I would rather go somewhere else...pay a little more for better quality food and better service. just because you call the burgers ""gourmet"" doesn't mean they are good. We won't be going back there. I've given them 3 chances...2 too many in my book.",https://www.yelp.com/biz/red-robin-gourmet-burgers-goodyear,3.16,2.97,2.97,,3.0460000000000003
0,Donna L.,"Woodstock, IL",86,6,3.0,5.0,2017-11-29,Have been to many of your branches. Found this cute one on McDowell Road near Goodyear we went again right before Thanksgiving. Had a great server her name was Britt. Out of all the Red Robin Gourmet Burgers we have gone to with our family I would go back if I could sit in her section only she was pleasant she represents you very well and we have had some horrible servers there. She constantly runs I've seen her clean her own tables my daughter is a fast food MCD server so I know what it's like she is a good representation of your establishment and should be known don't know how long she's been there don't know how long she works with you what I do know is that I will come back to the one on McDowell and I drove an hour to get there. Always want to say that I give good and bad when it's deserved she deserves a raise.  I really think you're losing money on your bottomless fries as great as you think they are I don't believe people are ordering your appetizers we honestly could say we didn't I would've like something besides french fries but I think you need to rethink that one.  See you next time  Thanks  Mike,https://www.yelp.com/biz/red-robin-gourmet-burgers-goodyear,3.32,2.97,2.97,,3.1100000000000003
4,Daisy H.,"Buckeye, AZ",0,1,,1.0,2017-12-30,If there was a way to give this restaurant no starts I would because one star is way too many!! It's 3 am and I just finished puking the last of the nasty burger. Me and my husband were there last night and had 2 different burgers. While eating my burger I started to feel sick right away. So I only ate half. My husband on the other hand ate his whole burger. As we are getting home he start to complain about his stomach and that he feels awfully sick. Upon arriving home he throws up right away.  We both got really sick. It was our first time going and let's just say we will NEVER be back again... oh and the service was horrible!!,https://www.yelp.com/biz/red-robin-gourmet-burgers-goodyear,3.32,2.94,2.94,,3.092
2,Daysi S.,"Goodyear, AZ",3,53,22.0,4.0,2018-01-07,"Having a nice lunch with my kids. The steak fries are the best with the garlic parm over them as well as the garlic aioli. Burgers are always juicy and the meal is always on time. Our waiter could have used a happy pill because it was the beginning of the lunch time but over all we had a great time. My burger was delicious. Just the way I make it at home. Mushrooms with carmalized onion, lettuce, tomato, and avocado.  yummm",https://www.yelp.com/biz/red-robin-gourmet-burgers-goodyear,3.28,2.93,2.93,,3.0700000000000003
1,Nick M.,"Surprise, AZ",3,104,52.0,2.0,2018-01-14,When coming here stick to the burgers and Frys. Had the croissant and clam chowder. Was not impressed. The best part of the meal was the fries and ranch.   My kids got Mac and cheese and they give it in a small bowl. My boys are 7&9 they were still really hungry.,https://www.yelp.com/biz/red-robin-gourmet-burgers-goodyear,3.16,2.94,2.94,,3.0280000000000005
