,Username,location,friend_count,review_count,photo_count,rating,date,review,Url,roll25,roll100,roll250,special_25,Final_Rating
81,Melanee M.,"Buckeye, AZ",32,14,2.0,3.0,2014-10-05,"Something wrong is going on at this location and I don't mean the remodel. We use to have a visit to our table by management, no more, that hasn't happened in months. They use to have fun, really good wait staff, that seems to have disappeared too. My waiter is one I've had before, tonight he was off his game and just appeared overwhelmed, I think maybe understaffed for a Saturday. Food was fine, although the time before last they messed up and sent out meat instead of the ordered Veggie Pattie, a suggestion-maybe, plate them or wrap them different so staff can tell the difference and not serve it.",https://www.yelp.com/biz/red-robin-gourmet-burgers-goodyear?start=80,2.56,2.56,2.56,2.0920000000000005,2.56
37,Daniel B.,"Goodyear, AZ",3,23,16.0,5.0,2014-10-24,"This is a nice local place for us.   I was very impressed with their server  staff that didn't refer back to the main server.  Most places would just say, I'll let your server know, but here it didn't matter if it was their table or not, they were quick to take care of us. Great visit! Thanks",https://www.yelp.com/biz/red-robin-gourmet-burgers-goodyear?start=20,2.6,2.6,2.6,2.356,2.6
73,Michael S.,"Buckeye, AZ",22,120,3.0,3.0,2014-12-09,"We have eaten here several times and the service is hit or miss.  We have had absolutely horrible service and then good service.  Today was good service.  Van was our server.  She was bubbly and on top of things.  My parents got the bottomless rootbeer float.  We have ordered these in the past and notice that for whatever reason they never seem to have enough ice cream. The food is always ok at Red Robin.  Based on today's visit RR would get a 4 but based on all visits together it is about 2.5 and that is largely based on the less than stellar service that we usually get from here.  The food however, has always been good.",https://www.yelp.com/biz/red-robin-gourmet-burgers-goodyear?start=60,2.56,2.56,2.56,2.1239999999999997,2.56
101,Gabe A.,"Goodyear, AZ",0,11,,1.0,2015-01-03,"Total disaster from start to finish. We went in New Years about 6:30 or so. We were told there would be a 10 min wait. it was 30 min, and when we were seated there were at least 8 empty tables. Service was seriously lacking, servers and even the manager were sliding their butts on the back of our chairs because they were to lazy to walk around, lifting large trays over as they slid through. The food took way longer than it should have and was cold when it arrived. My little girl wanted some more fires, after waiting more than 20 min for a refill, were told it was going to be a while because they had to fill orders before they could refill my daughters fries. The restroom was discusting, there were towels on the floor and two of three stalls had no toilet paper. I've had better experiences at McDonald's, we couldn't have had a worse first meal of the year. Needless to say we will not be returning.",https://www.yelp.com/biz/red-robin-gourmet-burgers-goodyear?start=100,2.44,2.44,2.44,1.988,2.44
59,Alicia R.,"Phoenix, AZ",0,10,,1.0,2015-02-15,All I am going to say is that our server Miranda was the worst waitress we have EVER had by far at any restaurant!!!!!! She obviously hates her job because you could read it all over her face! I have never been so appalled with food service in my life! You have defenitely lost my family as customers!! GOODBYE!,https://www.yelp.com/biz/red-robin-gourmet-burgers-goodyear?start=40,2.28,2.28,2.28,2.116,2.28
39,B C.,"Kingman, AZ",0,43,5.0,4.0,2015-02-20,"FOOD, SERVICE, ATMOSPHERE EXCELLENT...BUT!!! Our server Kyline was so sweet and charming.  We enjoyed her so much.  She is a hard worker and very attentive.  In fact every one of the staff were so sweet and welcoming.   The food taste and quality were EXC...but here's the BUT:  the reason I can't give 5 stars is the portions are way UNDER SIZE.  My friend had a burger that looked OK size wise to me but they shrink the size of your fries order.  I had the chicken wrap....ABSOLUTELY DELICIOUS....BUT....here again the fries order was small served in this tiny stainless steel ring and the wrap looked like it was about 3/4 size it used to be.  The check was just over $30 (no booze) and for that money they better fill up those plates if they want me back.  A full good looking plate is what will bring me back.  Too much empty space on the plate for my money.   RR: WAKE UP and smell the French Fries!!!!!",https://www.yelp.com/biz/red-robin-gourmet-burgers-goodyear?start=20,2.32,2.32,2.32,2.544,2.32
98,Sam D.,"Avondale, AZ",0,2,1.0,2.0,2015-02-22,"We used to love this place. We go almost once a week, usually during a weekday. Food is great, but service is so so so slow and seems to get slower each time we go in. It takes up to 20 minutes sometimes just to get a refill on fries and then when they finally do come, you get like 6 in a basket. We usually go here because it's family friendly. But I consider family friendly rather timely, in that little ones don't have the patience or capability to wait 20+ minutes for their food. Hoping they get it together soon, because we really do love this place. Just hate spending 2 hours there each time.",https://www.yelp.com/biz/red-robin-gourmet-burgers-goodyear?start=80,2.28,2.28,2.28,2.3440000000000003,2.28
60,Jade W.,"Goodyear, AZ",18,321,20.0,3.0,2015-02-22,"Went to Red Robin for dinner the other night. We got the Chili Chili Con Queso as an appetizer. When it came out, I was surprised to see how few chips were on the plate. Most places give you a big basket of chips. $7 worth? Not so much. We forgot to say no salsa garnish on the queso so we had to scoop off the tomato chunks. But the queso tasted good and we even had some left over to dip our fries in. I ordered the Banzai Burger (no pink), and no lettuce, tomato, or mayo. That is one of three burgers I like to get. My other favorites are the Whiskey River BBQ Burger and the Royal Red Robin. My burger was cooked right and tasted good. I enjoyed dipping the fries in the leftover queso dip. I have to say I kind of miss the days when your food came in a basket and the burger was partly wrapped in paper. They are trying to be fancy now with the rectangular plates and bottomless metal cylinder for the fries. We asked our server for some more napkins and she brought us two. They sure are stingy with napkins here! She did a pretty good job keeping our waters refilled. And while she didn't ask if we wanted more fries, my friend requested some and she brought us a basket. Yay steak fries! Red Robin... YUMMMM",https://www.yelp.com/biz/red-robin-gourmet-burgers-goodyear?start=60,2.32,2.32,2.32,2.412,2.32
97,Tammie A.,"Buckeye, AZ",0,3,,1.0,2015-02-26,"We normally have fantastic service at this Red Robin. Went tonight and ordered 2 salads, had LEXI as a waitress she took our order then we sat there for 40 minutes, she never once checked on us. We finally had to ask the host to check on our salads, still Lexi never came back. Finally one of the guys from the kitchen came out apologizing and trying to recite our order and getting it wrong. Still Lexi did not come over to apologize.  Absolutely worst service ever, actually we received no service while watching many others get seated and receive their food.  Red Robin hire people who care about customer service. She was terrible!  We left with no food.",https://www.yelp.com/biz/red-robin-gourmet-burgers-goodyear?start=80,2.16,2.16,2.16,2.2760000000000002,2.16
47,Dawn D.,"Avondale, AZ",2,37,,2.0,2015-02-28,"We haven't been to Red Robin in several years. It will be several more years before we go back.  It has nothing to do with the service, it has everything to do with the food.  We both ordered one of there Gourmet burgers, one Chophouse and the Blue burger. Over priced and undersized!  A gourmet burger joint should sell hand pattied, thick juicy burgers.  These burgers are frozen 1/4"" thick burgers.  Yes the burger looks huge when you get it because the bun is filled with toppings.  Reminds me of the old commercial ""Where's the Beef?"" and fries were nothing special, frozen steak fries and a very small portion at that. The best burgers in Goodyear are served at the Haymaker on Litchfiled Rd, just north of Mc Dowell.  This is not a chain....and the food is wonderful!  Price wise I do believe it's cheaper and much tastier! Great fries too!",https://www.yelp.com/biz/red-robin-gourmet-burgers-goodyear?start=40,2.12,2.12,2.12,2.472,2.12
56,Dailesa B.,"Avondale, AZ",7,9,,4.0,2015-03-06,I posted a review on the red robin in surprise and it was not a great experience. I received a gift card for the horrible service so we decided to try the one in Goodyear. This was way better than our last experience. Our server named mike was excellent. The food was great as well. The only thing I would say about this visit was it took a while to get bottomless sweet potato fries.,https://www.yelp.com/biz/red-robin-gourmet-burgers-goodyear?start=40,2.12,2.12,2.12,2.7039999999999997,2.12
91,Cesar C.,"Phoenix, AZ",0,6,,3.0,2015-04-02,food was great waiters don't pay much attention you have to call them over in order for them to notice you need something,https://www.yelp.com/biz/red-robin-gourmet-burgers-goodyear?start=80,2.16,2.16,2.16,2.604,2.16
86,Greg P.,"Phoenix, AZ",3,51,,4.0,2015-04-16,We heard back from red Robin and they did a great job to make our experience much better the next time that we went.  I really appreciate their efforts to improve and provide great customer service.,https://www.yelp.com/biz/red-robin-gourmet-burgers-goodyear?start=80,2.28,2.28,2.28,2.768,2.28
11,Deni G.,"Avondale, AZ",1594,715,1998.0,3.0,2015-05-03,"Great Place For The Kids  I have to admit Red Robin usually isn't my first choice of places to grab a quick bite to eat.  However, my nephew loves Red Robin and it's a great place for the kids.  The burgers, California chicken burger, and onion ring tower are great and have never been a disappointment.  Although, I think the burgers are getting smaller.  The fries are also very good and I love their salt. My nephew enjoys the fries because they are ""endless"" and he can eat as many as he wishes.  Service is usually fast, prices are reasonable, and the food is good.  You could do worse in a pinch.",https://www.yelp.com/biz/red-robin-gourmet-burgers-goodyear,2.24,2.24,2.24,2.668,2.24
66,Lisa K.,"Buckeye, AZ",38,6,4.0,1.0,2015-06-12,"I will not be returning to this location. 3 times they brought overcooked/burnt pretzels and jalopeno coins. I just couldnt believe the manager was ok with serving me burnt food 3 times and didnt even ask if he get me something else, all he said was he would remove the item from my check, then left me sitting there to watch my friend eat her burger, had to stop another waitress to order something. Worst service!",https://www.yelp.com/biz/red-robin-gourmet-burgers-goodyear?start=60,2.24,2.24,2.24,2.5320000000000005,2.24
87,Stan B.,"Goodyear, AZ",0,8,,1.0,2015-06-19,"No, just no!  That manager lady is clueless about customer service and serving hot food.  When will Goodyear folks start to stand up to these crappy chain restaurants. Stop giving them your hard earned money.",https://www.yelp.com/biz/red-robin-gourmet-burgers-goodyear?start=80,2.24,2.24,2.24,2.5640000000000005,2.24
70,Sarah B.,"Goodyear, AZ",20,10,8.0,2.0,2015-06-23,"I've been a red robin cluxks and fries fan for a very long time, this being said, when my way over cooked cluxks showed up I immediately knew. The manager said that's how they are and offered to bring me some more.... They never showed up! Also, red robin used to be the place for ""families"" now, not so much. They've taken a turn for the worse in my opinion. Still friendly, still bottomless fries, still probably the last time I'll come to this one again...until the kids request it!",https://www.yelp.com/biz/red-robin-gourmet-burgers-goodyear?start=60,2.28,2.28,2.28,2.7600000000000007,2.28
68,Derrick C.,"Avondale, AZ",6,11,,1.0,2015-07-03,"Order was not staged, ordered wings as an appatizer they were cold, frys were cold, burger temp not great, refills took entirely to long, seemed rushed out after we asked for check, ordered a burger thinking it would count as our free birthday burger to later find out that it did not. Manager never came to check on us. Normally when we stop at a Red Robin we almost always see the manager in the dining room. This will be our last trip to this location. Very Disappointed!",https://www.yelp.com/biz/red-robin-gourmet-burgers-goodyear?start=60,2.28,2.28,2.28,2.724,2.28
51,Joanne L.,"Buckeye, AZ",0,24,2.0,1.0,2015-08-13,"Red robin... umm... Seriously the worst service I have ever received in any restaurant in my whole entire life. ""Blue jay"" the rudest manager ever in the bluest shirt I have ever seen, charged us 2.19 for ""bottomless fries"" after already purchasing bottomless fries. We didn't even eat them and when we asked her to return them she did this weird thing with her mouth and didn't give an answer. Our waiter kept rubbing her stomach like it was a genie bottle, I felt like I was on the Aladdin ride at Disneyland. Such terrible service and this is from a restaurant worker myself.",https://www.yelp.com/biz/red-robin-gourmet-burgers-goodyear?start=40,2.24,2.24,2.24,2.8520000000000003,2.24
57,Piranha P.,"Goodyear, AZ",0,18,,5.0,2015-08-18,"Just tried the turkey burger and it is awesome! I try to watch what I eat and not eat fast food, but this is a place I'm willing to visit often.",https://www.yelp.com/biz/red-robin-gourmet-burgers-goodyear?start=40,2.28,2.28,2.28,3.2520000000000002,2.28
29,Glenda E.,"Goodyear, AZ",10,59,50.0,1.0,2015-08-25,Still sucks!!!! Corporate needs to step in and make some changes and retrain the staff.,https://www.yelp.com/biz/red-robin-gourmet-burgers-goodyear?start=20,2.28,2.28,2.28,2.724,2.28
53,Gabriela T.,"Avondale, AZ",2,13,2.0,1.0,2015-09-06,"We have been to Red Robin a few times. Some times service is great, some times it is not. Some times the food has been great some times the food hasn't been good at all.  Pretty much they are not very consistent... But today I was VERY disappointed with Red Robin. We have a toddler and a two week old newborn. If you are a parent; when you go out you want things to go as smooth as possible. So we decided to bring the stroller, so I could rock the stroller and put baby to sleep if need so to be.  The place was not busy, it was pretty empty. So we walk in and the first thing they say is ""oh you can't have a stroller inside, you can leave it up here but you cannot take it to the sitting area. I simply ask ""why?"". Their answer was that the space was reduced, but they could put one of those slings for the car seat.  This made me upset, because the things that hold the car seats there are the same size as our stroller. Also if they don't have a lot of people why is it a big deal. This doesn't make it a kid friendly place to me. Therefore I will not be returning to Red Robbin. I have two kids!",https://www.yelp.com/biz/red-robin-gourmet-burgers-goodyear?start=40,2.2,2.2,2.2,2.8520000000000003,2.2
64,Terry H.,"Glendale, AZ",1,27,44.0,2.0,2015-09-17,"Ok, I have been going to red robin for like over 20 years. I just went last night and was so terribly disappointed. The portions have become so much smaller than they used to be. I used to look forward to treating myself to a really good juicy burger...not do last night. Service was ok, food was just...kind of bland...didn't wow me. I was so disappointed I doubt I will ever go back.",https://www.yelp.com/biz/red-robin-gourmet-burgers-goodyear?start=60,2.24,2.24,2.24,3.0800000000000005,2.24
67,Ana P.,"Goodyear, AZ",151,5,,1.0,2015-09-17,My experience a the Red Robin in McDowell was not the best. I was catered by an employee named Bailey and she was extremely rude. She approached my group of friends and I inefficiently with her poor manners and harsh remarks.,https://www.yelp.com/biz/red-robin-gourmet-burgers-goodyear?start=60,2.24,2.24,2.24,3.0440000000000005,2.24
63,Veronica D.,"Buckeye, AZ",0,1,,1.0,2015-09-26,We always liked Red Robin burgers. They had excellenr portions prices and service. This is my third time coming here with the family. The technology fee is not expense but it should be an option if parents want it to be turned on. It's a stupid fee. The portions have gotten smaller and the prices have risen. The plates are basically the same size as the kids meals.. This place will only be a date night place but not for family meals. Not worth paying that much for OK food.,https://www.yelp.com/biz/red-robin-gourmet-burgers-goodyear?start=60,2.24,2.24,2.24,3.0440000000000005,2.24
55,Oak C.,"Buckeye, AZ",8,19,6.0,5.0,2015-10-07,Ate here for lunch today.  The service was responsive and fast.  The food was good.  All I look for in a lunch spot.,https://www.yelp.com/biz/red-robin-gourmet-burgers-goodyear?start=40,2.32,2.32,2.32,3.508,2.32
46,Tami A.,"Goodyear, AZ",29,29,7.0,4.0,2015-11-06,"My husband and I ate lunch here today, our server was very attentive and even boxed up my request for extra  bottomless Fries. I know this is a burger place but my absolute favorite thing is the BLTA Croissant and fries.....Yummy! !",https://www.yelp.com/biz/red-robin-gourmet-burgers-goodyear?start=40,2.28,2.28,2.28,3.408,2.28
61,Kayla S.,"Phoenix, AZ",58,5,1.0,5.0,2015-12-18,I always enjoy the food that I have here. I know that when I come I will be greeted with a smile and our server is always nice. We had Angie this time and she was so sweet.,https://www.yelp.com/biz/red-robin-gourmet-burgers-goodyear?start=60,2.36,2.36,2.36,3.4760000000000004,2.36
44,Verna H.,"Avondale, AZ",13,3,16.0,5.0,2015-12-26,Great family restaurant!! Love the loyalty program. My son loves fries. Red Robin has all you can eat fries. Which make him very very happy.,https://www.yelp.com/biz/red-robin-gourmet-burgers-goodyear?start=40,2.52,2.52,2.52,3.3800000000000003,2.52
42,Bao N.,"Phoenix, AZ",25,49,14.0,5.0,2015-12-29,Had my usual chicken tender salad. It was good as always but this time they substitute it with the chicken from the sand which in stead. Was very tasty. The manager also came to inform us that the chicken was substitute and not normally served this way. I though it tasted really good. I definitely recommend it if you ever try the crispy chicken salad.,https://www.yelp.com/biz/red-robin-gourmet-burgers-goodyear?start=40,2.68,2.68,2.68,3.2520000000000002,2.68
28,Jennifer H.,"Helena, MT",177,87,332.0,4.0,2016-01-26,"It's red robin. We have visited probably 15 locations around the country and they are all fairly standard. Our waitstaff was pleasant, our order was correct. What else could I write.",https://www.yelp.com/biz/red-robin-gourmet-burgers-goodyear?start=20,2.68,2.68,2.68,3.152,2.68
75,Theresa S.,"Goodyear, AZ",0,3,,1.0,2016-01-30,Worse place ever to have to have dinner. Started off with greater telling us problems with staff. No one on the place. Manager came over and stated will talk to him. Good out cold and manager stated will fix and and never did. Need new managers.,https://www.yelp.com/biz/red-robin-gourmet-burgers-goodyear?start=60,2.64,2.64,2.64,2.8840000000000003,2.64
48,Amy M.,"Phoenix, AZ",0,25,4.0,5.0,2016-02-12,I go to this Red Robin often and have never left dissapointed. One of my favorite things is that they seat people without kids in the bar section so you don't have to worry about loud or upset kids. The staff is always very friendly. The food is always good and fast. We've only had to wait once and it was for about 10 minutes. I have noticed that larger families have to wait quite a bit longer.,https://www.yelp.com/biz/red-robin-gourmet-burgers-goodyear?start=40,2.72,2.72,2.72,3.4120000000000004,2.72
74,James E.,"Goodyear, AZ",0,7,,4.0,2016-03-13,Red Robin has great burgers and great food.  However I would avoid their doh nuts not worth the high price they are pretty much tasteless!   Stick to their other desserts.,https://www.yelp.com/biz/red-robin-gourmet-burgers-goodyear?start=60,2.84,2.84,2.84,3.184,2.84
45,Maggy B.,"Goodyear, AZ",99,114,7.0,3.0,2016-04-04,"Good food. But overpriced. Why pay $10 for a burger? Although they do have endless fries! Fun family place but again, overpriced.",https://www.yelp.com/biz/red-robin-gourmet-burgers-goodyear?start=40,2.88,2.88,2.88,3.1160000000000005,2.88
41,Dawnyale M.,"Buckeye, AZ",5,27,51.0,4.0,2016-04-09,Had lunch here with my daughter. I had the BLTA Croissant which was very tasty. My daughter had the kids pizza with broccoli and a  chocolate shake. The waiter was nice and the food came out fast. My daughter being the picky eater she is asked why the pepperoni on her pizza was not shaped like a smiley face like the one on the menu. She also asked for sprinkles in her milk shake because the one on the menu had some.,https://www.yelp.com/biz/red-robin-gourmet-burgers-goodyear?start=40,2.88,2.88,2.88,3.216,2.88
40,Dashon H.,"Phoenix, AZ",145,10,14.0,5.0,2016-04-11,"We frequent this location and the one in Peoria but, this is the location closest to our home. The service is always outstanding.  From the host to the server to the management always stellar.  The food is fresh and cooked to our specifications without errors.  The management team does a great job each experience.  Always start with a freckled lemonade!!! Today we did something different and came here for lunch we usually do dinner.  We were warmly greeted by Dominic and promptly brought to our area of choice (always try to sit at the red chairs in the middle of the restaurant... So comfortable). Veronica was an amazing server! Her knowledge of the menu (Dominic was a menu guru too), we never waited for drink refills or anything. The I made a bold decision to try the Red Ramen burger (with an egg, ramen extra crispy) and it was a game changer! I must also commend the manager Natalie as well.  She was so personable and took the time out talk to us and really make us feel welcome.  Veronica did her job so well we tipped 25%+. I can't say enough about the food and experience that we have her every time. Christian is a great server.  We also love the manager Nick! Your guys rock!!! Kudos!!!",https://www.yelp.com/biz/red-robin-gourmet-burgers-goodyear?start=40,2.96,2.96,2.96,3.3480000000000003,2.96
43,Lisa L.,"Avondale, AZ",46,10,107.0,4.0,2016-04-13,"I had the mushroom and swiss burger with a side of macaroni and cheese. Both were very good. The service was slow and while not rude, was also not friendly.",https://www.yelp.com/biz/red-robin-gourmet-burgers-goodyear?start=40,2.96,2.96,2.96,3.248,2.96
35,Rebecca M.,"Phoenix, AZ",5,11,3.0,5.0,2016-05-13,Loved the food! Manager came and said hey! Told him to make sure to get his free check presenters from American Express! The server was awesome played along with our crazy family. Not usually a fan but today I am! This location was over all fantastic! Our server Sarah rocks! (:,https://www.yelp.com/biz/red-robin-gourmet-burgers-goodyear?start=20,3.04,3.04,3.04,3.2520000000000002,3.0400000000000005
33,Panama R.,"Avondale, AZ",1,69,,2.0,2016-05-20,Very disappointed.  Went with a $14 premium burger. (It was some bacon cheddar burger)  Nothing premium about it.  They did a great job on menu making it sound great but it underwhelmed.  Endless fries is cool but how about seasoning them? I Like the auto pay at table but did feel ripped off.  It's a shame to get one night out a month and not that we had high expectations but it was so disapointing.  Lesson learned.,https://www.yelp.com/biz/red-robin-gourmet-burgers-goodyear?start=20,3.08,3.08,3.08,2.8560000000000003,3.0800000000000005
12,Keniff K.,"Goodyear, AZ",17,89,215.0,4.0,2016-05-22,"I thought the service here was great for a full house. The waiter came by often to check up on us despite juggling a few other tables. They also have tablet on each table that offers a digital menu, games for the kids, ask for a server and pay your bill conveniently if you plan to pay with a card but you can view your bill or even split it if you have a big party.  The food came out hot. What can I say about the food it's your typical chain food restaurant so it's nothing special but if your craving a burger and can't decide what kind you want they have a pretty big selection of burgers and they offer bottomless fries",https://www.yelp.com/biz/red-robin-gourmet-burgers-goodyear,3.2,3.2,3.2,3.088,3.2000000000000006
36,Jena J.,"Tempe, AZ",179,29,2.0,4.0,2016-07-08,Red Robins is AMAZING! I don't recommend getting an appetizer because your actual meal will really full you up. Loved the Cupcake shake. Their burgers and wraps are also so yummy! Try!,https://www.yelp.com/biz/red-robin-gourmet-burgers-goodyear?start=20,3.28,3.28,3.28,2.9920000000000004,3.2800000000000002
