,Username,location,friend_count,review_count,photo_count,rating,date,review,Url,roll25,roll100,roll250,special_25,Final_Rating
93,Sean B.,"Pomona, CA",95,13,2.0,1.0,2014-05-17,"I just experienced the worst service at this place. A big group of us sat down before midnight on a Saturday night and it took well over an hour for us to get our food. Our server took our drink orders and then came back a half hour later with half of our drinks and told us she had spilled the whole tray. I don't know if she was new, but if she was then she shouldn't have been assigned to a big party. I actually felt bad for her. When the food finally came out, it wasn't even worth the wait. My steak was cold, the salad tasted like paper and the portions were small. The manager didn't even come out to apologize for the long wait. There was no reason it should have taken that long. That's the last time I'll be going to a TGIF.",https://www.yelp.com/biz/tgi-fridays-chicago?start=100,2.24,2.24,2.24,1.7000000000000002,2.24
170,Robert C.,"Glens Falls, NY",0,15,,3.0,2014-05-19,"I've been to a lot of different Fridays all over the states, it's all generally the same food, so no complaints there. We had a nice lunch outside- but our server was the NICEST girl ever. We appreciated her so much. Even the hostess was so kind. Over the top staff- great job.",https://www.yelp.com/biz/tgi-fridays-chicago?start=120,2.16,2.16,2.16,1.9640000000000002,2.16
90,stan a.,"Novi, MI",1,4,,1.0,2014-06-30,I experienced the worst service at this restaurant. Waited 10 min to order even water. No table setting and waited it in front of food for 5 min. They are working hard I guess but way far away from customer service.,https://www.yelp.com/biz/tgi-fridays-chicago?start=100,2.04,2.04,2.04,1.8280000000000003,2.04
166,Frank T.,"Oakland, CA",43,383,212.0,3.0,2014-07-09,Watched Germany trash Brazil.  Endless appetizer interesting draw. Its great if you like the appetizers that they chose.  I decided against the boneless wings and had the traditional which was perfect and a nice portion. Lots of screens to watch the games. Service was 4-5 stars,https://www.yelp.com/biz/tgi-fridays-chicago?start=40,2.0,2.0,2.0,2.0280000000000005,2.0
163,Sharon C.,"Chicago, IL",426,382,29.0,3.0,2014-07-15,"I was here with a group of five other people for the unlimited appetizers deal, which is, obviously, an incredible amount of food for $10, especially because we shared all of our appetizers and got three rounds of each. In case you have less than six people, here are the things we got, in order of how much I liked them:  1. Loaded potato skins. Always the loaded potato skins, which I crave when I can't get, and which I have resorted to buying frozen from Costco in desperate times. These were crunchy, with generous amounts of cheese and an acceptable, if not as generous, sprinkling of fresh bacon. Definitely the favorite dish we got.  2. Bruschetta. One of the things we were on the fence about ordering, but it ended up being a fantastic choice (for those of us who liked tomatoes... so not me). It was the perfect blend of sweet and salty, and really refreshing, especially against the other, heavier things we ordered.  3. Mozzarella sticks. Arrived at the table at the perfect temperature - almost nothing more disgusting than lukewarm mozzarella sticks - and the perfect proportions of coating to cheese.  4. Boneless buffalo wings. I'm not a fan of boneless buffalo wings in general, but these were particularly one-dimensional and featured a very, very thick coating of batter with a small piece of meat.  5. Potstickers. Generic, definitely not something we would have ordered if we had had fewer people. The sauce was the only part of this appetizer that was interesting or different. Would not recommend.  6. Spinach dip. Definitely not worth ordering, it's a huge portion of spinach dip paired with a small serving of chips. The dip was bland and insufficiently creamy, with a weird, buttery aftertaste. Would not recommend.  We also ordered a short glass of Angry Orchard and one of 312, both on tap. Our waitress initially brought us two glasses of Angry Orchard, but she was quick to correct her mistake once we pointed it out.  Service overall, however, was lacking. I understand that, since the bill was so small, she wasn't anticipating much of a tip, but she dropped by our table to check on us only once, mumbling something that only one person heard, and we  only saw her three times more - twice when she asked if we wanted more food (yes), and once when we asked her for the check. Our food was brought out by other people, and she never actually brought us our check. At least ten minutes after we asked, another girl saw us waiting, asked if we needed our check, and brought it to us within minutes.  I'm going to give this experience three stars because service was pretty much nonexistent and because of the wait times, which were far too long considering there weren't that many people in the restaurant. This deal, however, is definitely worth going in for - and it ends August 24!",https://www.yelp.com/biz/tgi-fridays-chicago?start=40,2.04,2.04,2.04,1.9640000000000002,2.04
102,Stephanie R.,"Round Rock, TX",49,14,19.0,1.0,2014-07-17,Food was super greasy and our burgers were falling apart. The waitress ignored us and only got us one drink and zero napkins.  Would NOT return.,https://www.yelp.com/biz/tgi-fridays-chicago?start=80,2.04,2.04,2.04,1.7960000000000003,2.04
182,Mae L.,"Chicago, IL",1,3,1.0,1.0,2014-07-19,"Worst service of my life. I love Fridays but this on sucked. Got seated and took about 10 minutes for the server to ask us what we wanted to drink. We asked the server if we could get out table wiped, he asked another server and she never wiped down the table but she did wipe down the table next to us. As I finished ordering, our server went to the other table with a plate of food and asked a costumer to remove the wings and keep the mozzarella sticks. What? Might as well give them the whole tray. It took over 30 mins for our food to come. When I got my food I was missing mozzarella sticks. I choose from the 2 for $12. I asked the server where they were and he goes ""I don't know where they are. I can check on them if you still want them."" OFCOURSE I WANT THEM. I didn't order for no reason! other costumers look unhappy. In guessing we're not the only ones getting his horrible service! Costumer service sucks, never going back at this location again. This place is ridiculous!",https://www.yelp.com/biz/tgi-fridays-chicago?start=120,2.04,2.04,2.04,1.7960000000000003,2.04
164,Lauren B.,"Chicago, IL",12,183,51.0,4.0,2014-07-31,"Pay $10 for selected endless appetizers! Service from Tanesha was fabulous, and we ate 3 plates of baked potato skins, 2 plates of mozerella sticks, and 4 plates of boneless wings. Loved the location too.",https://www.yelp.com/biz/tgi-fridays-chicago?start=40,2.16,2.16,2.16,2.128,2.16
94,Ryan H.,"Chicago, IL",149,38,34.0,2.0,2014-08-01,It's been 16 minutes and still no drink (water) or silverware on my table. How long is it acceptance to have no beverage keeping in mind it's water?,https://www.yelp.com/biz/tgi-fridays-chicago?start=100,2.16,2.89,2.89,1.832,2.5980000000000008
111,Shaneika B.,"Chicago, IL",136,4,,1.0,2014-08-29,"I love TGIF resturaunt every since I was younger, it was always a treat to dine here. Recently I dined in with my little sister as a going away to college lunch. Had a great time and great service. I had such great service i deceided to return a week later 8/25/14 with my roomate. It started with our waitress we were seated and that pretty much all we saw of her. We requested to have the unlimited appetizers 1st and becuase she for got to put the order in and we waited so long, she brings out 4 platters instead of 2 at one time of the appetizers. The table was cluttered and it she never came to remove any of our used plates and glasses, i had to flag down other waiters to assist my table. When she saw me speaking with other waiters she would YELL from across the room that she was coming to assist me. After I had already been helped. My water refills were all done by waiters I had to flag down. Also by the time the entree came, we were full off appetizers so we asked for a TO-GO box. instead she brings out more appetizers. Before I could say anything the waitress turns to me and says: ""You cant take those appetizers home, we will have to call the police if you try to leave with them and we have people watching!"" I was extremely offended!! 1st they are $10 appetizers and i'm sure the police isn't making arrests over something this petty as taking 3-4 potstickers home in our order. In my previous visit the week before, we had a few of our appetizers left and were able to take them home. My point to her was, if she would have brought them out ON TIME, instead of trying to DOUBLE UP and bring out TWICE as MANY at 1 time, we wouldnt have needed to take any home. So we left our TABLE w/4 platters of FRESH APPETIZERS LEFTOVER!!...It seemes like such a terrible waste. Overall, I dont appreciate being told, the police woould be called on me if I took a cheestick or any other appetizer out of their resturaunt, that I essentially PAID for.OVERALL TERRIBLE SERVICE! Very unhappy!!",https://www.yelp.com/biz/tgi-fridays-chicago?start=80,2.0,2.86,2.86,1.7320000000000002,2.516
168,Ahmed A.,"Highbridge, United Kingdom",20,1,1.0,1.0,2014-09-08,I just got out from there . It was one of the worse experiences ever . really poor service  . slow waitress.,https://www.yelp.com/biz/tgi-fridays-chicago?start=120,2.0,2.83,2.83,1.7640000000000002,2.498
62,Shane O.,"Port Byron, IL",1,25,7.0,1.0,2014-09-09,"I like Fridays and I understand people being busy, but with that being said. All we came here for was drinks. We waited over 10 minutes to have someone come to the table and another 13 minutes just to get 4 drinks. We almost left right before he came out so instead of leaving we stayed. When he dropped off the drinks we decided to order another round right then so by the time we were finished we would have another round without waiting.",https://www.yelp.com/biz/tgi-fridays-chicago?start=140,1.92,2.8,2.8,1.7640000000000002,2.448
61,Eric C.,"Chicago, IL",0,1,,1.0,2014-09-19,"Don't normally take the time to complain but this was the last straw. My coworkers and I have been going here just about every week for the past few months because it is steps away from work and the lunch special. We only have a 45 minute lunch break so the location is very convenient. Over time we got used to the slow service and just dealt with it and were usually late getting back because we could not be served and eat in 40 minutes apparently. We would mostly order soup and salad, rarely entrees because of time constraints, and always sat at or by the bar. This particular time it was taking more time than usual to get our food after we ordered a little bit before 12:30. Lunch break ends at 1:00. We started paying our bill around 12:55 because we were trying to save time after we ate and not have to worry about it. Some people got to pay, some people didn't because the bartender walked away. At 1:00 we had to tell the kitchen staff, the bartender wasn't at the bar, to please just box up our food to go because we're already late. This was 5 lunch special orders, mix of soups and salads and 1 chicken tenders. This is Friday's, I don't think the chefs were growing their own lettuce back there or making the soup of the day specially for individuals. The place was not busy at all. It appeared that there was about one employee per every two customers there. People that sat at the bar after us received their food before us. At 1:05, the bartender gave us 2 large bags with our to go food, apologized to us, and we left. We were shocked that the manager didn't apologize, we were not offered anything, and since we all had already paid to save time there was no discount. When we all got back to the office to pass out our food, of course the chicken tenders were missing and a salad was missing. I called the manager and explained the situation and he kept referring to our pick up order. No, this was dine in. He proceeded to tell me that he has my food ready for pick up.  He refused to send somebody over to drop it off after I asked. I had to leave work again to pick it up, no apology, nothing. He just handed me the food and walked away. Unacceptable.  Not going back again.",https://www.yelp.com/biz/tgi-fridays-chicago?start=140,1.92,2.78,2.78,1.7640000000000002,2.436
53,Asenath N.,"Chicago, IL",114,344,192.0,2.0,2014-10-14,"I personally like TGIF, but this location was one of the worst services ever!  This is located right off Michigan ave. I would expect them to have the best service ever! My friend and I went here for lunch on her lunch break.  It took 30 mins for us to get out beers and water. REALLY!!  And the food took another 45 mins to come out,. No one seem to have answers to any of our questions.  I was not impressed!  Please train your employees and work on customer service!",https://www.yelp.com/biz/tgi-fridays-chicago?start=20,1.84,2.76,2.76,1.864,2.392
81,Brian D.,"Chicago, IL",22,14,,1.0,2014-10-18,Such bad service. Was charged double for advertised half off beer. Extremely slow and unknowable service. Disrespectful and had to argue with a manager who had no idea what she was talking about. Never coming back again. Ever. Never have I had to sit so long to wait on a check either. Do yourself a favor and not come here.,https://www.yelp.com/biz/tgi-fridays-chicago?start=100,1.84,2.75,2.75,1.7320000000000002,2.386
64,Bobby D.,"Chicago, IL",34,459,,2.0,2014-11-12,"Somehow, This TGI Fridays has somewhat devolved. Yes, They still have some pretty decent memorabilia on the walls. But as for the music. It is very unintelligible, And IMO.....Rather inane indie. Not the music that SHOULD be in tune with the franchise, The more older music. The service too was rather substandard. Yet the food wasn't exactly that bad.",https://www.yelp.com/biz/tgi-fridays-chicago?start=140,1.88,2.72,2.72,1.864,2.3840000000000003
152,Lisa W.,"Chicago, IL",0,5,3.0,1.0,2014-12-07,"Horrible service and management by manager Johnny. Steer clear of server Moses. Visited on December 6 with four friends for lunch. We traveled from Hyde Park to near north side, just for TGIFriday's. Our server Moses was terrible. He rarely came to our table which made a lunch, that should've been closer to an hour, stretch into three hours-mostly waiting for him to take our order. We sat dow at 3p and couldn't leave until 6:15p. We also had to track him down for the bill.  Service: Moses would never come to our table, rather he would come in the vacinity and we had to actually call him over by name.  Again, it was five of us. Moses never explained the endless appetizer deal that wasn't on the menu when we asked about it. A friend at the table, who knew what the deal was, had to do his job and help the rest of us.  Once we ordered, Moses only gave us three plates for our appetizers and never brought us napkins the entire time and never brought the rest of our plates. Two of use had to eat using the appetizer dishes. Also he only came to remove appetizer dishes once. So we had to start putting our empty drink glasses, empty appetizer plates on an empty table as he would bring a few more items on the half hour. We didn't have any more room at the table. My friend's were never able to get a refill on their pop in the entire three hours. I do not eat pork and would get sick if I did. I mentioned that I didn't eat pork when I was ordering my appetizer so he could tell me which ones had pork. I came to enjoy a Jack Daniels burger with no bacon/onion, an appetizer, and a dessert. An hour after ordering, he shows up with a dbl cheese burger full of bacon and proceeds to argue that I ordered this bacon burger and tried to shove it in my face because he didn't want to admit he was wrong. Who does that? He took no responsibility, gave no apology, and his customer service skills were offensive.  I unfortunately, had to cancel my order because I didn't have another hour to wait for him to get it wrong again and our friend's valet time was expiring after dealing with this nonsense.  I spoke to manager, Johnny, who didn't introduce himself nor wear a nametag. We had to get his name from another employee. I informed him of how our service was not good and how I came to enjoy a JD burger and had a bacon burger shoved in my face and the server tell me it would be a ""long time"" before I get my correct order. The manager did not take responsibility nor ownership of his server's poor service, and gave no apology. All he said was, ""I don't think I can get your order out to you faster."" I canceled my order and didn't order anything else. I expect better from TGI Friday's, especially since the manager claimed the Erie St location as the flagship.  During our visit we also had to deal with gnats flying around. The ""loaded"" potato wedges were anything but and they looked and tasted like the restaurant ran out of the appropriate cheese and they substituted with an Aldi brand spray cheese. Never dine here.",https://www.yelp.com/biz/tgi-fridays-chicago?start=40,1.88,2.68,2.68,1.7320000000000002,2.3600000000000003
167,C B.,"Chicago, IL",0,2,,1.0,2014-12-14,"I went to the Fridays on Erie 2 weeks ago and got sick to my stomach from just a drink within 30 minutes (only a beer which I drink elsewhere with no problems).  I was sick-to-my stomach for 3 solid days and ate nothing.  Thought it was the flu I returned last night, 2 weeks later.  Had a full dinner.  And AGAIN am totally sick to my stomach. I won't be going back to this location.  There is something seriously wrong with the cleanliness.",https://www.yelp.com/biz/tgi-fridays-chicago?start=120,1.88,2.65,2.65,1.7320000000000002,2.342
91,Monique B.,"Chicago, IL",51,447,53.0,2.0,2014-12-15,"Stopped by for lunch with my mom while on Michigan Ave.  The food was blegh, definitely not as good as I remember at a Friday's.  The service was good, but almost over-attentive, if that's possible.  The restaurant is a Friday's so full of SWAG and knick knacks on the wall.  The prices were in line with all the Friday's, but the food was just not cooked well.  I had an appetizer trio and my dumplings looked and tasted uncooked.  The boneless buffalo wings were dry and the seasoning wasn't good.  And the cheesesticks were a little light on the cheese and overcooked.  Generally, just not a good experience.  Go somewhere else.",https://www.yelp.com/biz/tgi-fridays-chicago?start=100,1.88,2.64,2.64,1.864,2.3360000000000003
160,Andii W.,"New York, NY",23,57,6.0,1.0,2015-02-27,"Omg i will never come back here again.... my experience  was absolute  bullshit from the time my brother and i walked in the door until we left... we asked and indicated that we'll  wait for a booth the greeter said it would  be at least 40 min but as we were walking to our table we saw at least 4 open booths. So we asked to sit in one of them. Then i asked for the SAME EXACT thing i got the last time I was there (5 days ago) and i was told there was no such thing. So i ordered something else with the exclusion of some things.. then 20 min later the waitress comes back to tell me i couldnt get it the way i asked. 20 damn minutes!!!!! Took her about 5 min to ask if i wanted something else... at this point I'm over it... not to even mention that we didn't get silverware until 45 min into being there...i mean our waitress was a mess. It took the manager to come over to try to fix it... All in all, we will never be back like ever.. we made it clear as we got up from the table.. All the servers greeters etc act as if they don't want to work and don't  care about their customer service or lacl there of... I was  so shocked. And my brother normally tries to see the good  in everything  but  he complained  and made it clear  that he won't be back..",https://www.yelp.com/biz/tgi-fridays-chicago?start=40,1.8,2.63,2.63,1.8600000000000003,2.298
60,Sunny H.,"Chicago, IL",0,19,8.0,1.0,2015-03-27,"This location is lucky it is getting one star. It is because the bartender was wonderful. I do not remember her name, I am sorry. The problem with this location is everything else. Management is lousy and the food is even worse. I ordered a pecan crusted chicken salad with grilled chicken instead and the chicken was burnt and tough. There were supposed to be cranberries in this salad; there were 5 at most. This salad consisted mostly of lettuce chopped to a killing. Steer clear of this place. I hate saying that...but, I do.",https://www.yelp.com/biz/tgi-fridays-chicago?start=140,1.72,2.61,2.61,1.8600000000000003,2.2540000000000004
83,Aalayha R.,"Chicago, IL",94,12,27.0,4.0,2015-04-13,"Great place to hang for late nights.. the only place that's open when I get off work and the good is good, service could be better but all around really like this place",https://www.yelp.com/biz/tgi-fridays-chicago?start=100,1.84,2.61,2.61,2.256,2.3020000000000005
119,Ellen G.,"Chicago, IL",4,20,,5.0,2015-04-21,"I had the best steak ever here, and the spinach was amazing.  The steak rivaled any high end steak place in Chicago, which is saying something.  $11.90 for 6 oz sirloin and 2 sides.  The spinach has mushrooms and onions, which I've never had together before.  Perfect with the steak.  The jasmine rice was excellent.  The steak had no fat, cooked perfectly, juicy, thick.  They have 10 oz also.   I also had the bacon mac & cheese bites, which I would not get again.  I asked the waiter if the bacon was mixed in with the mac & cheese and he said it was, but that is not the case--he must have misunderstood the question.  They are fried mac & cheese balls with a piece of bacon on top.  4 to an order.  Not worth the calories.  OK to share with 2-4 people, but I was by myself.  Service was great, steak cooked to order.  If you're in the mood for a steak dinner in a casual atmosphere at a reasonable price, check out TGI Friday's in Streeterville!",https://www.yelp.com/biz/tgi-fridays-chicago?start=80,1.84,2.61,2.61,2.2920000000000003,2.3020000000000005
147,Michelle P.,"Chicago, IL",60,30,33.0,5.0,2015-04-23,This Thursday night my boyfriend and I wanted to go out to dinner. We looked up places thinking we might try some place new but decided on TGI Fridays because we knew it would be good. That being said... We had a great experience! We got seated and then asked to move to the bar to watch the bulls game and the host was so nice and she gave awesome recommendations.  Our server Augusto was so great. He gave drink recommendations and was just so pleasant. I'm a server so I think I pay extra close attention to the people who are my servers and he was just great!!!  We had the spinach flatbread and garlic parm buffalo wings for an appetizer (1/2 price apps if you sit in the bar area). Both were great. Then we both got the ribeye with lobster tail and it was all delicious! So much food omg! We got the broccoli and the mashed potatoes for our sides. Get the mashed potatoes!!! You'll thank me. I don't even like mashed potatoes and these were awesome. For dessert we had the Oreo madness. So good! For drinks my boyfriend got a house Long Island iced tea and then a blackberry Long Island. I had the berry mojito (SOOO GOOD!!!) and the Barbados rum punch. That was good but I wanted something a little stronger. It took a while for us to get our drinks but whatever that can't be avoided sometimes.  Everything was soooo good! Sometimes I feel like it can be a hit or a miss with chain restaurants. They tend to be very mediocre. Our experience tonight was just awesome. Oh I had left my wallet and Augusto ran out to our car to give it to me. I thought that was sooooo nice since I had no idea. He's awesome I think we'd come back just for him. And the drinks!,https://www.yelp.com/biz/tgi-fridays-chicago?start=40,2.0,2.63,2.63,2.164,2.378
