,Username,location,friend_count,review_count,photo_count,rating,date,review,Url,roll25,roll100,roll250,special_25,Final_Rating
124,Chad O.,"Chicago, IL",18,37,19.0,2.0,2012-01-29,"For ""downtown Chicago"" this is suburb quality, at best..,  But as far as compared to the rest of the chain, this place is exactly what you would expect... It's a good restaurant, great services, quick lunches.. I still go back",https://www.yelp.com/biz/tgi-fridays-chicago?start=160,2.84,2.84,2.84,2.216,2.84
184,A J.,"Panama City Beach, FL",13,55,191.0,4.0,2012-02-14,"For a chain, Friday's does a good job of updating their menu. This Friday's provided great service.",https://www.yelp.com/biz/tgi-fridays-chicago?start=120,2.84,2.84,2.84,2.448,2.84
84,Claudy C.,"Chicago, IL",11,184,119.0,4.0,2012-03-08,"I'm not sure why this place has really bad reviews. Just went to this TGIF last night and the workers were very nice. Our waiter was patient and asked us if we were doing alright with our food. The place is a little loud but its probably b/c of the bar. The food was very good, especially the Cajun shrimp and chicken pasta! The vanilla bean cheesecake was ok. Will come back to this place!",https://www.yelp.com/biz/tgi-fridays-chicago?start=100,2.96,2.96,2.96,2.416,2.96
110,Belle L.,"Chicago, IL",87,838,1916.0,5.0,2012-03-15,"Dropped by for a quick meal (30 mins) before appointment.  It would be a good change from Corner Bakery. Excellent VALUE for your $.  Lunch special -- soup and 1/2 sandwich (about $10) -- was great with generous portions.  French Onion Soup had good proportion of soup, onion chunks, and cheese.  1/2 of club sandwich looked an entire sandwich from Potbelly's. Service was quick.  When I informed waiter of my in-and-out lunch....the dishes came quickly as well.",https://www.yelp.com/biz/tgi-fridays-chicago?start=80,3.12,3.12,3.12,2.42,3.1200000000000006
135,Melissa P.,"Chicago, IL",8,132,69.0,5.0,2012-03-24,"I absolutely love TGI Friday's.  I don't understand why they don't have more stars.  I go there for a meal or drinks just about every time I go downtown.  Their bartenders are so friendly and they don't mind if you sit at the bar and order your food there.  I know they are busy sometimes but Chicago is a big tourist destination and you have to understand that restaurants are going to be really packed on the weekends for dinner.  I've always liked everything I ordered from there including drinks.  I love their fried mozzarella sticks, their loaded potato skins, Tuscan Spinach dip, Sesame Jack chicken strips, and crispy green bean fries.  It's hard to choose an appetizer because I love most of them.  Jack Daniel's salmon and chicken and shrimp are both awesome.  I love all of their seafood options, especially the salmon topped with langostino lobster.  Their bruschetta chicken pasta and parmesan chicken pasts are so delicious.  My sister loves their black angus burgers and pulled pork sandwich.  I usually get the vanilla bean cheesecake for dessert but the chocolate peanut butter pie is also very good.  My sister likes the brownie obsession and oreo madness.  I love their margaritas and sangria.  They always make a good drink there and the price is very reasonable.  If I'm really hungry or really thirsty for some alcohol, I always come here just because I know I'm going to leave happy.  You can't go wrong with this place.  I don't care what anyone else says.  They are one of the best chain restaurants out there.",https://www.yelp.com/biz/tgi-fridays-chicago?start=160,3.12,3.12,3.12,2.42,3.1200000000000006
72,Joe A.,"East Dubuque, IL",40,31,,1.0,2012-05-12,"HORRIBLE tasting food, drink didn't have any alcohol in it, and way overpriced. This place ruined TGIF's for me! Couldn't get the taste of vaporized chicken out of my mouth for hours.",https://www.yelp.com/biz/tgi-fridays-chicago?start=140,3.12,3.12,3.12,1.8920000000000003,3.1200000000000006
171,Nick H.,"Chicago, IL",0,36,,2.0,2012-07-21,"Food is pretty good as is the price. Sweet potato fries were over-seasoned. 2 loud people behind us cursing and acting like they were out of their minds ugh. Server made sure we knew her name 'Vanessa' (told us about 4 times) yet she was never around, pointless knowing her name then :/",https://www.yelp.com/biz/tgi-fridays-chicago?start=120,3.04,3.04,3.04,1.9920000000000002,3.0400000000000005
71,Laina W.,"Detroit, MI",0,7,,5.0,2012-09-19,AMAZING. I live in Detroit and TGIF's is usually a last resort but WOW. The service is EXTRAORDINARY! Seriously! It's just so on point. The food is as you'd expect from a chain restaurant but I was seriously astonished by how awesome the service is!! Keep up the GREAT work!!,https://www.yelp.com/biz/tgi-fridays-chicago?start=140,3.2,3.2,3.2,2.2920000000000003,3.2000000000000006
173,Daniel N.,"Seattle, WA",165,204,36.0,4.0,2012-09-28,"Honestly, there are a TON of options available to get some food around MIchigan Ave. TGIFs isn't my first go to choice, but I do go here for some Streeterville Open Gaming every other week and stick around for the great bar prices. I mean $3 light beers and half off apps at the bar. Not bad for a week night. Addendum: Just bumped up to 4 stars cause they have WIFI! It is amazing how much that little thing can make a difference. I mean I am sitting at the bar, updating them to 4 just because of free wifi!",https://www.yelp.com/biz/tgi-fridays-chicago?start=120,3.24,3.24,3.24,2.128,3.2400000000000007
78,Joanna G.,"Middleton, United Kingdom",0,4,,4.0,2012-10-30,"Does what it says on the tin. Not fine dining, but decent food served pleasantly and promptly. Good range of beers available.",https://www.yelp.com/biz/tgi-fridays-chicago?start=140,3.28,3.28,3.28,2.032,3.2800000000000002
181,Dallas A.,"Peoria, AZ",4282,334,649.0,2.0,2012-11-09,Don't eat the broccoli and cheese soup! You'll be peeing outta your butt for a couple days! Other than that everything was peachy.,https://www.yelp.com/biz/tgi-fridays-chicago?start=120,3.16,3.16,3.16,1.8,3.1600000000000006
95,Mikee R.,"Murphy, NC",88,973,97.0,1.0,2012-11-24,"Truth be told... Friday's Sucks everywhere. This place is one of the worst I have ever eaten at. I ordered a medium rare Black Angus Ribeye and half rack of ribs with sweet potato fries and slaw. I got a well done peice of sirloin, half rack, steak fries and slaw. I didn't even bother to send it back or complain. I already knew I would never return to a Friday's. Remember twenty years ago when TGI Friday's was a cool place to go and eat?",https://www.yelp.com/biz/tgi-fridays-chicago?start=100,3.12,3.12,3.12,1.7320000000000002,3.1200000000000006
73,Ethel I.,"Chicago, IL",64,53,,1.0,2013-01-06,"The food is great, However the bathrooms are horrific, like a scary movie.  I told the management and they seemed not to care. I have a friend that lives down the block. She has also complained about the nasty bathroom and I have tried going over and over because i do truly like their ribs, but cannot do it anymore because of the restrooms. what a shame to loose customers in your neighborhood over that, especially when they and their friends have brought it to management attention.",https://www.yelp.com/biz/tgi-fridays-chicago?start=140,3.0,3.0,3.0,1.7320000000000002,3.0000000000000004
197,Stefan Fisher P.,"Chicago, IL",0,1,,1.0,2013-02-08,"The treatment I received in this restaurant  recently was so horrible and insulting, I will NEVER step foot in a TGI Fridays again!! My brother and I were in the restaurant on Erie on February 1st when we were assaulted by a woman and her female companion.  One of the ladies threw a drink on my brother while the other pulled a knife on me.  We didn't know either of these women and had not ever spoken to them before.  I notified security who refused to intervene because he said he didn't see the knife.   I asked him to call the police and he refused.  I then spoke with the 2 managers on duty and they started badgering me about whether or not I was going to pay the bill.  REALLY!!! Then they called the police who came in asking me whether or not I was going to pay my bill.  What about the water and the knife!!!  I filed a complaint on the website and received a call back from a man in guest relations who stated they don't have any control over the contracted security they hire.  They also claimed that the incident occurred between 2 patrons so their policy is to just ask both of them to leave.  So your policy is if someone comes into your place of business, gets harassed, and assaulted, oh well, both of you get the hell out.  That's BULLSHIT!  I'm telling everyone I know to never go there again!",https://www.yelp.com/biz/tgi-fridays-chicago?start=180,2.96,2.96,2.96,1.7320000000000002,2.96
92,Matt G.,"Eagan, MN",115,183,280.0,2.0,2013-02-19,"I don't know if this place is closing soon or what but when trying to order the waiter told us what we couldn't have instead of what we should try.  Not a good way to sell your product. Needless to say we stopped in for a drink, ordered chips and salsa and left. In a city like this there are way better choices.",https://www.yelp.com/biz/tgi-fridays-chicago?start=100,2.92,2.92,2.92,1.9280000000000002,2.92
121,A. M.,"San Jose, CA",0,5,1.0,5.0,2013-03-10,"I'm not sure why there are so many negative reviews for this Friday's. I am a regular here and it's definitely the best one I have ever been to. I grew up in the Chicago suburbs and have been to many different Friday's, and this one tops them all when it comes to food quality. They do a good job of cooking meats perfectly and I have not had a bad meal here yet. Their servers are usually friendly and attentive, but when it's really busy they tend to not come around enough.",https://www.yelp.com/biz/tgi-fridays-chicago?start=160,2.96,2.96,2.96,2.228,2.96
85,Sevun H.,"Chicago, IL",35,57,2.0,1.0,2013-04-14,"Bathroom was disgusting!!!!!  30 minute wait and there were empty tables everywhere.  Forgot to bring out main course and when we reminded the server she brought the wrong thing and said, ""I'm sorry, you said this but my mind said that ..would you like to order anything else""? WTF!!!???  One of the servers lost a patrons credit card!  Took two hours just to have a few appetizers and 1 entree!",https://www.yelp.com/biz/tgi-fridays-chicago?start=100,2.8,2.8,2.8,1.7000000000000002,2.8
177,Sharina R.,"Chicago, IL",47,152,189.0,3.0,2013-05-05,"TGIF, oh how I love your daily Sunday-Thursday specials. Especially Thursdays. $3 drinks and $3 appetizers really can't get ANY better. We've been seeing each other for awhile now, and you've never disappointed me until recently. Your servers are a little questionable. Especially that one guy who likes to leave me waiting for 10 minutes after I've finished my meal, so he can sit at the table of someone he knows and gossip about the rest of your employees, but somehow asks me to come back and see him, and thinks I will. Your food is still good, your broccoli cheddar soup is still delicious. Oh yeah, thanks for putting the sauce on the side of my Jack Daniels burger, it was a bit strong for my liking, so I'm glad you didn't drown my burger in it. Your bathroom makes me fear I'll catch something so I'm a little hesitant to use the potty after slurping down your $3 Thursday mojito, so I'll hold it and go elsewhere.",https://www.yelp.com/biz/tgi-fridays-chicago?start=120,2.8,2.8,2.8,1.9000000000000001,2.8
186,Maria L.,"Chicago, IL",2,31,2.0,1.0,2013-05-16,"Just went there for my birthday yesterday... The food was awful. I ordered the Jack Daniels chicken... It's a simple meal that I purchase at every TGIF: Two grilled chicken breasts with two sides -- I chose broccoli and mashed potatoes for my sides.  One of my chicken breasts was undercooked and tasted like a rubber ball. The broccoli was not steamed at all. In fact, I believe they dipped it in hot water for 30 seconds to give the allusion that they were steamed. The only things that were OK on my plate were the mashed potatoes and one chicken breast... I was so disappointed.  Not to mention the waitress and her assistant (a new hire) completely forgot about me. Funny thing is, the seasoned server didn't ask me if I wanted a refill or if anything was ok at all, but strolled by my table about an hour after I received my food and said ""Sweety, I just wanted to let you know I didn't forget about you."" Talk about a dead giveaway. Drive the extra 15 miles to the TGI Friday's near Midway or find another restaurant downtown. There are a ton to choose from that are much better in quality and service than this one.",https://www.yelp.com/biz/tgi-fridays-chicago?start=120,2.8,2.8,2.8,1.6360000000000001,2.8
39,Nelson M.,"Champaign, IL",246,817,1528.0,4.0,2013-06-09,"Restaurant Review Pick 2 for 10 enticed me to this location in downtown. With the slumping economy in these chain restaurants, they are offering bargain prices for meals not often seen. I was a bit skeptical at first, but what can you ask for 10 dollars. I left with a smile. It was not too busy on a weekend for lunch. They easily squeezed my wife, a child in a stroller, and me in a table. The waitress was super nice and took our orders quickly. I picked the fried mozerrela which was small planks of fried cheese with marinara sauce. No complaints here, there was more than 6 of these small patties and was the perfect appetizer to share. My wife got the chicken florentine flat bread which was cooked well and perfectly seasoned. My entree was the Bruschetta Chicken Pasta with slices of tomato, cheese, and chicken. The chicken was tender and not too overseasoned. There was a strong grill flavor to the chicken but it went well with the pasta. I can honestly say that I was pleased to pay 10 dollars for this meal which is why 4 stars for a chain restaurant. Pro- friendly service, 2 for 10 menu, perfect menu size Con- none Hidden deal- Pick 2 for 10 dollars Use your TGIF card to earn points for stripe rewards! If you forget your card save your reciept and enter it online afterwards",https://www.yelp.com/biz/tgi-fridays-chicago?start=60,2.8,2.8,2.8,1.936,2.8
69,D S.,"Philadelphia, PA",0,6,,1.0,2013-08-07,"The worst Friday's!!!!! Ok, so we fly to chi-town every year, this year we went with 8 of our friends, most are over 40. We have 3 children in our group total. So on July 12, 21013 we go to Friday's because of their not being no one sitting outside. We go in and a black guy the manager (nuckle head) said that we could not eat outside even though it was 8pm and another worker later told us that outside closes at 830, and they didn't know why he said that.......we were also told that we needed ID to eat at that location.......... WHAT!!!!!!!!!!!!!!!!! WE DON'T EVEN LOOK LIKE KIDS! I am pissed at this point, then to top it all off they end up giving us a buzzer. We wait outside they said 10min noone wzs inside tables were open ALL OVER. A white family comes in and they seat them right away and at the table they cleared for us. We know because the girl upfront told us she works their. THIS WAS A HOT MESSDOTCOM!!!!!!! Does anybody hear me?????? If we were alone I would have called the manager and told him a thing or two. I decided to write headquarters as well.",https://www.yelp.com/biz/tgi-fridays-chicago?start=140,2.8,2.8,2.8,1.5720000000000003,2.8
82,Tri R.,"Bronzeville, Chicago, IL",11,15,6.0,1.0,2013-11-16,My friend & I came here the other day for drinks and I can honestly say the drinks were horrible!!! As you can see in my check in /pic I posted this isn't my first time having their Long Islands. Three out of 6 of our drinks had to be sent back. Way to sweet and all you could taste was the coke that is only suppose to be a splash !!! The other 3 we just drank cause we were tired of complaining .Our service was not good compared to my past experiences. Defiantly not coming back for drinks food only !!! Just because it's a drink special doesn't mean it needs to taste like a kiddie cocktail !!!!,https://www.yelp.com/biz/tgi-fridays-chicago?start=100,2.64,2.64,2.64,1.5720000000000003,2.64
123,Debbie W.,"Chicago, IL",34,19,1.0,1.0,2013-12-10,"Regardless of the specials or cheaper menu the service here by everyone (servers, manager and bartenders) is just completely awful. Good luck getting your food, another drink (beer or h20) or anyone checking back on you. Not worth being annoyed the whole time your there.",https://www.yelp.com/biz/tgi-fridays-chicago?start=160,2.52,2.52,2.52,1.604,2.52
109,Kevin T.,"Denton, TX",62,7,1.0,1.0,2013-12-22,"This has to be the worst TGI Fridays I have ever been too, my significant other and I got the 2 for 15 deal, to start I got the Tuscan spinach dip and he got the pot stickers, they weren't bad but the dip seemed to be reheated and luke warm. We waited about 30 minutes to finally get our entrees, we both got the sizzling chicken, but mine was with cheese and his was with shrimp, we soon discovered that the cheese itself was actually American cheese, which is not something I remember having on it since it was both of our favorite dishes from the restaurant. It was our first time to the city restaurant, and it was very disappointing. To come into the city and have subpar food and subpar service was very irritating. Now back to our food, his chicken was mostly burnt on the bottom, his shrimp was bland, it sat out too long in the window, the onions and green peppers were over cooked, mine was the same experience but without the shrimp. They have an obnoxious amount of servers, I mean I understand for it being a game day, but it is also before holiday and most people are going to be out of town. They have us sat at a small bar table and plenty of open tables surrounding us, which is ridiculous that they are filling in the tables appropriate to the patron than the patron who comes first.  TL;DR: Bad service, bad food, don't come here.",https://www.yelp.com/biz/tgi-fridays-chicago?start=80,2.48,2.48,2.48,1.604,2.48
175,Chrystal S.,"Chicago, IL",14,17,3.0,2.0,2014-01-27,Talk about annoying. As I am sitting here at this moment with a waiter that is a complete jackass. With no name tag. He never even told us his name. My husband took me here for my birthday dinner then a novo we just missed our movie time now we get to wait until 10pm never mind we don't need to be home. Worst service ever! Oh and the broccoli was under cooked and so was my steak.,https://www.yelp.com/biz/tgi-fridays-chicago?start=120,2.52,2.52,2.52,1.704,2.52
185,Tammy M.,"Greenville, WI",13,18,,3.0,2014-03-10,We stopped in here for a late Sunday dinner after a day of site-seeing. They were the only place we found open. The place was pretty empty because it was 10pm. We were seated right next to where the waitresses pour huge crates of ice. It was really loud and unnecessary since there were dozens of other tables. The waitress was nice. Food was standard. Drinks were fine. My only complaint is that we had to wait 20 minutes for our bill. The place was dead. This wasn't cool. It was nice to get food so late at night. If this was at 6pm I'd give it 2 stars in comparison to all of the other options around the area. Due to convenience I give it 3.,https://www.yelp.com/biz/tgi-fridays-chicago?start=120,2.56,2.56,2.56,1.804,2.56
104,Yolanda T.,"Bellwood, IL",118,108,71.0,3.0,2014-03-25,"I've been here several times, and actually this is one of the better Friday's restaurants that I've been to. Their food is good. Steak hot, well done to my specifications. Their vanilla bean cheesecake is to die for! The last time I went, I had 2 servers. One of them was named Monique. The other one was a server in training. I forgot his name. But anyways, the last time I went, I was disappointed. I ordered the Jack Daniel's Steak with the shrimp scampi. The totally forgot about the shrimp scampi! The place wasn't crowded. How in the hell can 2 servers forget about shrimp scampi?! I told them don't worry about it, but I was disappointed. The food was good nonetheless, especially my favorite, the wedge salad. The manager need to train the waiters to LISTEN and listen CAREFULLY. I was nice about it, but they may run into somebody that's not so nice!",https://www.yelp.com/biz/tgi-fridays-chicago?start=80,2.52,2.52,2.52,1.7400000000000002,2.52
98,Jessica H.,"Orlando, FL",3,14,1.0,1.0,2014-04-12,"I went to this Friday's with a friend and my little brother, who is 13, and they refused to let us eat at this restaurant. It was about 9:02 PM and they notified us that they carded everyone after 9 PM. My friend is 25 and I'm 23. My brother, of course, had no ID because he is a 13 year old 7th grader. They refused to let us in because he had no ID and because I was not his legal guardian. Are they checking birth certificates of all kids that enter after 9PM with adults for guardianship?? We even spoke with a manager and got the same story. I was appalled. To make matters worse, two more groups walked in behind us, with children in tow, and were not given the same requirements. Never going here again.",https://www.yelp.com/biz/tgi-fridays-chicago?start=100,2.4,2.4,2.4,1.4760000000000002,2.4
70,Tyler G.,"River Grove, IL",0,1,,5.0,2014-05-01,"My girlfriend and I were walking around the Water Tower Place and we were starving to get a bite to eat. Of course there are probably many well-known places to eat around the Water Tower, but we were craving for some Hamburgers and we both knew that T.G.I Fridays has the Jack Daniels Burger. As soon as we entered T.G.I Fridays the hostess greeted us and she showed us to our seats. As we were passing through the seats, I couldn't keep my eyes off the decoration around me. I saw a long canoe on the ceiling, which I was at awe for that it, was very big. One of the decorations that specially caught my eye was a medium size statue of the Blues Brothers, which I enjoy seeing their signature dance time to time. Like I said there are many things to look at on the walls and everything is nicely lighted and everything is clean. The restaurant gives a good relaxed vibe and with the great service that makes it worthwhile to eat here.  When we sat at our table, we were greeted with a waiter I probably wont ever forget. He looked like Ray Liotta with a personality of a modern Elvis. He starts off with saying his name and then he asked us what we wanted to drink, so we told him we want water. He was nice and patient as we were looked at all the delicious foods and forgot why we even came here.  After we were given a generous amount of time to look at the menu, we decided to get 2 burgers and 3 appetizers.   The three appetizers that we got were called Thai Pork Taco, AHI Tuna Nacho, and the Cornbeef and Swiss Slider. The Thai Pork Tacos look like any ordinary taco with pork, onions, cilantro, and the corn tortilla, but what made it different was the sweet Thai sauce on the taco. The taco was good and filled with pork, but I felt that it had too much cilantro in it. The next appetizer was the AHI Tuna Nacho, which had the strip of tuna on a nacho chip with avocado, Sriracha sauce, and wasabi mayonnaise. The chips were good especially with the tuna strips and the generous portion of avocado that can cancel out the Sriracha sauce and the wasabi mayonnaise if you want. Lastly from the appetizers were the Cornbeef and Swiss Slider that happen to be fairly packed with the cornbeef. The Swiss was melted on the cornbeef and had pickles and onions on it. Out of all the appetizers, my favorite was the CornBeef and Swiss Slider since it was the closest thing to my soon to come double-stacked burger.   The two burgers we got are called the Jack Daniel's Burger and the All-American Stacked Burger. I had the All-American Stacked Burger, while my girlfriend had the Jack Daniel's Burger. The All-American is a big burger that consists of lettuce, tomatoes, onion, bacon, thousand-island sauce, cheddar cheese, and two beef patties. The burger was tall enough that it needed a long toothpick to stabilize it. The burger itself was delicious with all kinds of juices from the thousand island and the patties itself was dripping down my hand. The Jack Daniels is personally on of my favorite burgers since it had the sweet-alcoholic hint from the Jack Daniels sauce. The sauce comes in a cup so you can pour as much as you desire on the burger or you can dip your fries in it. The Jack Daniels has bacon, lettuce, tomatoes, onions, provolone cheese, and a meaty patty. The Jack Daniels sauce is what makes the burger, so I bet you can ask for some and not miss out on the burger itself. Over all T.G.I Fridays near the Water Tower gets a 5/5 for their great restaurant service devoted to the customers experience.",https://www.yelp.com/biz/tgi-fridays-chicago?start=140,2.4,2.4,2.4,1.9720000000000002,2.4
75,Audra W.,"Chicago, IL",134,65,4.0,1.0,2014-05-05,"I used to like this place... Was a member of the stripes club and would visit frequently. But then, when my boyfriend accidentally forgot his credit card in the check presenter our thieving ghetto waitress stole the card and used it at several locations the next morning. If I could give it zero stars I would. VERY unhappy and disgusted.",https://www.yelp.com/biz/tgi-fridays-chicago?start=140,2.24,2.24,2.24,1.5720000000000003,2.24
178,Angel D.,"Washington Heights, Chicago, IL",1,26,7.0,2.0,2014-05-17,Same food just another TGIF. What makes me come to fridays are the staff here they were pretty mediocre! But to sit at the bar and drink it's fine!,https://www.yelp.com/biz/tgi-fridays-chicago?start=120,2.28,2.28,2.28,1.8,2.28
