,Username,location,friend_count,review_count,photo_count,rating,date,review,Url,roll25,roll100,roll250,special_25,Final_Rating
27,Alex R.,"Greensboro, NC",250,359,155.0,2.0,2012-04-08,No impressed at all. The greeters were sluggish and could clearly care less about being there doing their jobs. We were placed in one of the booths for two. There is honestly no wiggle room there.  Our server was one of those...fake nice kind of people. She smiled and sounded nice but as soon as she turned away her smile turned into a scowl. She wasn't in a good mood and it showed in her performance as a server.  The food was over priced and the portions were unbelievably small. They really shouldn't put a picture of the food on the menu if it is going to look like the kid size version of the meal. I honestly chuckled when I saw how small the portions were especially compared with the price.  I'm sorry but when you laugh at the food...there is an issue.,https://www.yelp.com/biz/tgi-fridays-greensboro-2?start=40,2.024,2.024,2.024,2.024,2.024
45,Michael C.,"Richmond, VA",43,30,1.0,1.0,2012-07-07,"OK so I dont usually waste my time reviewing chain restaurants but this one was sooooooo bad that I wouldnt feel good unless I put this out there. It was Monday night and we shouldve known when the other four chains within a stones throw were slammed packed and Fridays was empty that something was amiss.  We go and sit at the bar, as we do at chains just to get faster drink service. The service at the bar was the only high light of the evening.  The bar was sticky and in a sad state of disrepair. It smelled like they mopped the floor with the swill from the bar mats, the bar stock was more than half empty... a liquor shelf with 50% stock gone and a visible back up liquor cabinet with 2 bottles in it??? After inquiring about why half of the liqour (Most useed to make Friday's signature drinks) had not been stocked, we got the reply ""Well we have a new bar manager.""  On several occasions we noticed most of the staff hanging out at the service bar or the host stand ""goofing off"" with who I am guessing was the manager on duty...The whole attitude of the staff was unprofessional and almost like they couldnt be bothered.  The food... wow... crap at best. Te spicy craft beer cheese burger... well it wasnt spicy, the cheese tasted like yesterday, and I have seen better burger buns on a Gas Station burger! Silverware dirty, fries luke warm... but the beer... it was cold and filled when we wanted!  the two bar tenders on duty were great, attentive when needed, and seemed to be great stars who needed a better venue to perform.",https://www.yelp.com/biz/tgi-fridays-greensboro-2?start=60,1.8920000000000003,1.8920000000000003,1.8920000000000003,1.8920000000000003,1.8920000000000003
44,Jaimey H.,"Durham, NC",104,163,27.0,2.0,2012-11-27,"They got my order wrong 3 times, but the waitress and manager were on it and very nice.  Even though it was A&T's Homecoming, the place wasn't that packed so I would expect better service.  Honestly, I did enjoy the bar atmosphere here when I used to go to school and live in Greensboro, so if you are looking for a late night watering hole I would look this place up.  Otherwise, skip the meals.",https://www.yelp.com/biz/tgi-fridays-greensboro-2?start=60,1.9920000000000002,1.9920000000000002,1.9920000000000002,1.9920000000000002,1.9920000000000004
32,Jared M.,"Whitsett, NC",4,39,7.0,2.0,2013-11-07,"The staff was adequate, though a little slow. Not to mention, they sent out my party's meals at different times. How odd is it to have to wait ten minutes for someone else at your table to get their food before you start eating? Very odd. To top it off, the food was simply not up to par. I ordered the Korean Steak Tacos. If there was steak in my tacos, I sure couldn't find it. Honestly, the rice was the most flavorful part of my meal, and that's not saying much. The child screaming at the table across from us and the kid yelling and climbing all over the booth behind me sure didn't help. Let's just say that this location attracts a fairly tawdry customer base. Had I of known this before hand, I would not have stopped here to eat. TGI Friday's is one place I will not be returning to.",https://www.yelp.com/biz/tgi-fridays-greensboro-2?start=40,1.9600000000000002,1.9600000000000002,1.9600000000000002,1.9600000000000002,1.9600000000000004
30,Christy L.,"Charlotte, NC",34,109,435.0,3.0,2013-12-01,"Our server was great! We each ordered the 2/$10 which included an entree and appetizer. We had the beefy queso dip and pot stickers. Both were delicious.  Our entrees were the steak tacos and brucetta chicken pasta. The tacos looked better than they tasted, but they were ok. The pasta was very good with plenty of large slices of chicken. We were happy with our meal and experience.   We were glad to see they had remodeled since our last visit which was years ago. They now have booths against the front windows rather than the ugly red  and white striped tables. They changed the wall to the bar area to a nice glass wall with frosted stars on it. Much classier looking and not as dark. We will go back and order off of the same menu. Ask for the 2/$10 if you don't see it. It is hidden on the small menu booklet on the tables. This deal is not on the regular menu.",https://www.yelp.com/biz/tgi-fridays-greensboro-2?start=40,2.0600000000000005,2.0600000000000005,2.0600000000000005,2.0600000000000005,2.0600000000000005
21,Matthew R.,"Raleigh, NC",6,25,21.0,4.0,2014-01-22,"Like most chains, Fridays features the same menu at all its locations. They have an array of burgers, pastas, steaks, etc. Their new tasting menu seems very interesting and good for groups. Prices range from about 9$ to 15$ dollars. Our server, James, seemed very attentive, but the restaurant was also very slow when we went. Our food arrived quickly and was tasty.  The only thing that we did not like was the music. Which sounded like some kind of weird dance club re-mix. Otherwise we had a very pleasant experience.",https://www.yelp.com/biz/tgi-fridays-greensboro-2?start=40,2.096,2.096,2.096,2.096,2.096
43,Tanya M.,"Fancy Gap, VA",2,10,2.0,2.0,2014-04-28,"I ate there last night and usually when we do it's because they are open later. The food was good, but I never got my salad I ordered and there was no offer to fix it and we never got anything we asked for. We only saw our server twice and it was to get our drinks and the check. Service is usually better.",https://www.yelp.com/biz/tgi-fridays-greensboro-2?start=60,1.8960000000000001,1.8960000000000001,1.8960000000000001,1.8960000000000001,1.8960000000000001
40,Jonathan O.,"Jamestown, NC",4,11,5.0,1.0,2014-05-08,"Horrible food and the absolute worst service. The only reason I even tried it is because it was late and there wasn't much open. But I tried to order the queso fries and they were out of queso. She then offered me this bottomless fries deal. She never came back and checked on us. She acted as if it was a burden to speak to us, to refill our drinks or ask if I wanted anymore fries. She even avoided walking past our table. I've never had such awful service from such an awful person. As someone who has been a waiter before, she'd be fired in three seconds if she had my manager. The food was mediocre but that's to be assumed from a chain.",https://www.yelp.com/biz/tgi-fridays-greensboro-2?start=60,1.7640000000000002,1.7640000000000002,1.7640000000000002,1.7640000000000002,1.7640000000000002
38,J T.,"York, SC",3,32,17.0,3.0,2014-06-04,"I thought, ""Haven't been to Fridays for a while..."" Then I went there and now I remember why. Inattentive service & very average food sum it up. Prices seem up and quality down. This chain needs a reboot.",https://www.yelp.com/biz/tgi-fridays-greensboro-2?start=40,2.0920000000000005,2.0920000000000005,2.0920000000000005,2.0920000000000005,2.0920000000000005
36,Mindy S.,"Greensboro, NC",0,4,,1.0,2014-09-05,We were in tonight and it took 15 minutes to get a drink order. When our waitress finally  came she could not tell me what soups they had. She clearly couldn't be bothered to check either. She came to our table only twice and she took 20 minutes to refill our drinks. When she returned with our sons drink she forgot our water and it took 20 more minutes and a different server to fill our glasses. She then took a long while to bring our check. When she returned with our debit card she left no pen so I had to track down some one at the front to give me one. Very poor service!!!,https://www.yelp.com/biz/tgi-fridays-greensboro-2?start=40,1.8280000000000003,1.8280000000000003,1.8280000000000003,1.8280000000000003,1.8280000000000005
23,Andrew L.,"Carrboro, NC",109,330,33.0,2.0,2014-09-11,"I went here on a weekend evening while staying in a nearby hotel with my girlfriend. We sat at the bar, and ordered an appetizer, two entrees, and a few drinks each. While the service was good and the drink specials were also good, the food quality simply left a lot to be desired. My jack Daniels chicken had a weird spongey texture to it. Her teriyaki chicken was kind of like what you'd find at a mall Chinese place. The potato skins had a weird nacho cheese like topping on them that wasn't appetizing. Not a bad location or atmosphere, and I might even hit the bar for drinks if I'm in a hotel here again, but I doubt I'll be returning for food especially with so many other options.",https://www.yelp.com/biz/tgi-fridays-greensboro-2?start=40,1.9280000000000002,1.9280000000000002,1.9280000000000002,1.9280000000000002,1.9280000000000004
34,Julie B.,"Greensboro, NC",13,2,1.0,1.0,2014-10-22,"Absolute zoo. Just don't come on a weekday evening past 10 PM unless you want to see the workers laying down on the customers' waiting benches, your food totally forgotten and never ordered, and and listen to extraordinarily loud screaming between servers.",https://www.yelp.com/biz/tgi-fridays-greensboro-2?start=40,1.7960000000000003,1.7960000000000003,1.7960000000000003,1.7960000000000003,1.7960000000000003
25,Lorenzo I.,"High Point, NC",1,10,16.0,4.0,2014-12-10,This location is less than a mile from our home & my girlfriend loved the Boneless Wings With Jack Daniel's sauce so it's very convenient. The wait times are never extreme and the food and service here are usually pretty solid.,https://www.yelp.com/biz/tgi-fridays-greensboro-2?start=40,2.096,2.096,2.096,2.096,2.096
37,Socrates G.,"West Palm Beach, FL",0,2,,5.0,2014-12-15,"Driving through on the way to Atlanta. Stopped to grab a bite to eat. Service gets an A+!!  Food was good, beer was great!!",https://www.yelp.com/biz/tgi-fridays-greensboro-2?start=40,2.1,2.1,2.1,2.1,2.1
29,Kelly R.,"Victorville, CA",4,3,,2.0,2015-01-09,"So disappointing in so many ways. The entire staff was very friendly & welcoming. The servers were great, when you could actually get some service. Our server was AWOL for most of the night. The soft pretzel & beer cheese appetizer was wonderful, however that was the only enjoyable part of the meal. Items were missing from my burger (how can anyone forget pickles, tomato & sauce??)  The ""bartender"" used blue cheese stuffed olives as the garnish in my dirty Grey Goose martini (in over 2 decades I've never had one served his way.) The flavor was disgusting since the cheese permeating the entire drink, giving it a rancid taste, not to mention I'm allergic to blue cheese.  My husbands burger was well done & was supposed to be rare.  The room we were seated in must have been an afterthought add-on room as there were no air vents for heat & the wall next to our booth had no insulation. It was 10°F outside. Needless to say we were freezing throughout the entire dinner. No, we're never going back.",https://www.yelp.com/biz/tgi-fridays-greensboro-2?start=40,1.6720000000000002,1.6720000000000002,1.6720000000000002,1.6720000000000002,1.6720000000000002
65,Chad T.,"Greensboro, NC",44,114,13.0,2.0,2015-03-09,So it has been a few years since I have been to a TGI Fridays. I went on Friday night when I was acutally on my way to another resturant and as I was driving by decided to eat here instead. The food was ok nothing speical but I couldnt get over how expensive it was. my friend and I both had burgers that were like 13 bucks a piece.. Ended up paying around 35 for a meal that consisted of burgers with a side and sweet tea to drinik. If i knew it was gonna be that expensive I would have went to a trendy-er place to eat with a better atmosopher. I dont rememeber TGI Fridays being so expensive.,https://www.yelp.com/biz/tgi-fridays-greensboro-2?start=20,1.736,1.736,1.736,1.736,1.736
28,Jeffrey C.,"Skipwith, VA",5,15,1.0,1.0,2015-04-05,Does anyone serve good food anymore??? I am sick of getting crapped on at restaurants first print works and now this...wtf Greensboro...its getting to where I don't want to eat out in this town anymore... got some salmon and it was overly salty...still waiting to hear from waitress...this sucks. Okay I ordered something else...when I cut into the steak it looked OK but was too chewy and raw and lobster tail was overly salty too...NEVER COMING HERE AGAIN!!!,https://www.yelp.com/biz/tgi-fridays-greensboro-2?start=40,1.7320000000000002,1.7320000000000002,1.7320000000000002,1.7320000000000002,1.7320000000000002
33,Stephen H.,"Pfafftown, NC",7,5,,5.0,2015-04-16,Had the all American burger. It was amazing! Everything tastes great along with the fries. Service at the bar was great. Overall good experience at this location,https://www.yelp.com/biz/tgi-fridays-greensboro-2?start=40,2.2600000000000002,2.2600000000000002,2.2600000000000002,2.2600000000000002,2.2600000000000002
66,Michael H.,"Kernersville, NC",3,27,,2.0,2015-06-19,I don't know why I am a sucker for punishment. We went to this restaurant a few months ago and had horrible service. Today there was no improvement.  Sat down in a booth and my hand landed on some sticky messy food on the bench. Lucky it was my hand and not my clothes.  We went for lunch and ordered from the lunch menu. It took 20+ minutes for the food to arrive. Did I mention waiting 10 minutes to place my order?  I was expecting a faster experience for lunch so plan on at least an hour just to eat here.,https://www.yelp.com/biz/tgi-fridays-greensboro-2?start=20,1.832,1.832,1.832,1.832,1.8320000000000003
54,Siddharth A.,"Atlanta, GA",82,43,145.0,1.0,2015-06-25,The worst T.G.I Fridays I have been to.  They served bacon in the veggie black bean burger.!  I am a vegetarian and I am really offended.  The drinks sucked too. The Long Island ice tea was tasting purely like a lemonade.,https://www.yelp.com/biz/tgi-fridays-greensboro-2?start=20,1.7000000000000002,1.7000000000000002,1.7000000000000002,1.7000000000000002,1.7000000000000004
56,Jessica J.,"Greensboro, NC",79,79,68.0,3.0,2015-07-16,"Let's start with the good... then the bad.. & and finish with some 'ooh ok I guess I can deal' The good: my table was the first table that Steve (formally known as the bartender)had ever waited on. He was awesome and kind & super attentive. He brought our drinks and endless apps promptly. I ordered a 10 Oz steak... and so starts the bad. The bad: I ordered my stake medium well. I just wanted a Lil pink in the middle to keep it tender. It came out to me a bloody rare mess. . . Steve apologized and took it back. Meanwhile my two very hungry pregnant friends continued to munch on.  Steak ##2 arrives and it's only less worse than the first. Steve looks at this steak like Dear Lord, what are they doing back there lol... (there's no way that steak was close to medium ANYTHING)He Flys off to get steak ###3. At this point I tell Steve to tell the cook to burn it to a crisp and put it in a box, by this time everyone else is finished and full :( The 'ooh ok I guess I can deal': The manager came out and introduced herself. She said my steak was on the house... (3rd steak was well done!) She was sweet. Steve was awesome. .. they made right of the numerous wrongs so I can deal. I'd def. go back but I'LL NEVER ORDER A STEAK AGAIN lol. And I made sure I tipped Steve well b/c he got a good workout running my steaks back and forth to the kitchen hahaa. Good staff really makes or breaks a bad ordeal, they're full staffed with great folks! Even tho I left hungry lol",https://www.yelp.com/biz/tgi-fridays-greensboro-2?start=20,2.4,2.4,2.4,1.9000000000000001,2.4
63,Carley M.,"Silver Spring, MD",17,161,218.0,1.0,2015-07-28,"The server was nice and personable, however, the cooks in the back do not pay attention to the orders. I ordered a gluten free all american stacked burger, no bacon onion jam no thousand island dressing. It comes back with the dressing all over the burger. The server came back when i was sopping it up with a napkin and was going to reorder me a new one but i asked for a top bun because i was hungry and didnt feel like waiting. the burger was already cold so with my new bun i just took it to go. fries were lukewarm. my alcoholic beverages however were great! kudos to the bar. thumbs and toes down to the cooks.",https://www.yelp.com/biz/tgi-fridays-greensboro-2?start=20,2.28,2.28,2.28,1.7000000000000002,2.28
26,Carley H.,"High Point, NC",4,2,,5.0,2015-09-02,Went here with me and four other friends on a Friday night for their $10 endless apps deal. We sat in a big booth in the bar and our waitress/barista was awesome! She knew exactly when we wanted more apps and when to refill. Food was good and service was great.,https://www.yelp.com/biz/tgi-fridays-greensboro-2?start=40,2.32,2.32,2.32,2.228,2.32
62,Jennifer S.,"Marietta, GA",1,34,96.0,1.0,2015-09-21,"I must report that this was the worst TGI's that I've ever been at.    THE GOOD: The waitress was very very nice.   she interacted with Adanna and was helpful with our menu selections.  THE BAD: the food.   We opted for the select three Appitizers (pot stickers, traditional wings and mozzarella sticks).  The pot stickers looked old and grey.   the wings were not that bad after eating 2 I called it a day.  The cheese inside the mozzarella sticks had a soft and funny consistency.  We also got one rack of baby back ribs with a side of mashed potatoes and macaroni and cheese.  The ribs had little to no meat on top.   My cousin mentioned that they were baby backs and that could be the cause.  Ok, I'll take that since there was meat in between the bones.   The bq sauce,  really there's no comment.  The mashed potatoes had to have come from a box.  They had that see through look about them.   The macaroni was ok but not enough for Adanna to finish them.   Needless to say we left most of the food behind.    I wanted to exchange the food but my cousin mentioned that it couldn't be any better then what we got and she picked through what she could.  I must also report that unfortunately she felt I'll after leaving.   I was lucky because  I'm gifted with a stomach that willnot allow me to eat what i don't like.  She did eat the most.",https://www.yelp.com/biz/tgi-fridays-greensboro-2?start=20,2.32,2.32,2.32,1.7320000000000002,2.32
41,Clarence G.,"Greensboro, NC",0,6,,1.0,2015-09-26,Good and terrible. Wife's chicken was undercooked. Entrees did not look anything like the menu. Caesar salad came with Italian dressing. Worst restaurant we have been to.,https://www.yelp.com/biz/tgi-fridays-greensboro-2?start=60,2.28,2.28,2.28,1.7320000000000002,2.28
60,Jim Z.,"Greensboro, NC",65,142,5.0,1.0,2015-09-30,This is by far the worst TGI Friday's I have been to in a long time. We were seated quickly which is a plus but then waited for our server to come and take our drink order. By the way the place was so crowded that everyone was seated immediately.  We ordered the endless apps which were fine though I am not very found of the way that Friday's does their potato skins. The mozzarella sticks were not very full of cheese either. I will think twice before stepping back into this location.,https://www.yelp.com/biz/tgi-fridays-greensboro-2?start=20,2.24,2.24,2.24,1.7320000000000002,2.24
22,Dimitri S.,"Randolph, NJ",242,15,69.0,1.0,2015-11-06,This TGI Fridays was a poor example of a restaurant that should be a nice place to eat. The waitress did not pay attention to our table and once a plate was dropped it took more than 30 minutes to replace it. The service was not friendly and not fast paced. One of the guest at our table asked for a straw and the waitress did not even respond to us. Our visit here was not pleasant or enjoyable. The staff should trained more about how guest come first.,https://www.yelp.com/biz/tgi-fridays-greensboro-2?start=40,2.24,2.24,2.24,1.7320000000000002,2.24
20,May R.,"Pinehurst, NC",90,56,36.0,1.0,2015-12-04,Terrible service. Had our bill revised three times!! Food was a disappointment. The endless share apps just became a nightmare.. Our waitress was all over the place.,https://www.yelp.com/biz/tgi-fridays-greensboro-2?start=40,2.2,2.2,2.2,1.7320000000000002,2.2
58,Rod R.,"Greensboro, NC",185,2,7.0,2.0,2016-02-28,Horrible service. Waiting almost 20 minutes at the bar before bartender offered us menus. Staff is very unprofessional.,https://www.yelp.com/biz/tgi-fridays-greensboro-2?start=20,2.2,2.2,2.2,1.832,2.2
35,Ashley B.,"Greensboro, NC",0,3,,1.0,2016-03-21,The potato skins used to be good but now they are garbage used to go all the time and get the sizzling chicken and it was always over cooked,https://www.yelp.com/biz/tgi-fridays-greensboro-2?start=40,2.12,2.12,2.12,1.7000000000000002,2.12
15,Nazmul S.,"Greensboro, NC",86,140,331.0,4.0,2016-05-21,"I decide to wonder into TGIF because the line at cookout was long and I was craving some steak. I decided to indulge in a New York Strip with shrimp and seasoned fries. Unless I am in a really high end restaurant I never take steak that's not well done, I got it well done here and the jack Daniels sauce was great! However I wish they gave me more shrimp, after all it was quite a pricey meal relatively speaking.",https://www.yelp.com/biz/tgi-fridays-greensboro-2,2.12,2.12,2.12,2.0,2.12
57,Jason R.,"Tempe, AZ",0,9,,1.0,2016-05-22,"If I could use a red X instead of a single golden star I would.  Second visit to this location. Appetizer was not correct sent back, asked server 15 min later where it was? Following the question server said it will be out shortly. No appetizer arrived. Server spilled a coca cola on pier. Completely insulted by the service provided. Total visit 2 hours. Total time waiting for table and food 1 hour 45 min. Not coming back. Kitchen did very well with the meals. Good food.",https://www.yelp.com/biz/tgi-fridays-greensboro-2?start=20,2.08,2.08,2.08,1.6360000000000001,2.08
67,Myra M.,"Greensboro, NC",0,1,4.0,5.0,2016-05-28,This is awesome guys again $12 that includes entree and drink with or without alcohol.,https://www.yelp.com/biz/tgi-fridays-greensboro-2?start=20,2.24,2.24,2.24,2.036,2.24
24,Heather H.,"Summerfield, NC",0,1,,1.0,2016-07-31,"Can't rate the food, but the service was awful. We just left after sitting in a booth for 15 minutes without being waited on. Plenty of people walking past us, including hostesses, but not one person greeted our table to at least say ""we'll be with you in a minute"".  Had they been busy, I would have at least understood what may be causing a delay, but they weren't busy. Won't be back.",https://www.yelp.com/biz/tgi-fridays-greensboro-2?start=40,2.16,2.16,2.16,1.5080000000000002,2.16
64,Aaron K.,"Burlington, VT",12,15,,1.0,2016-08-10,our company sticks us at the la quinta a few blocks from this restaurant. sadly we arrive around midnight pretty often. everything else around here is closed so we always head over for food / beer in evening. ive had good food from the kitchen and so so food from the kitchen on these occasions. this review is not about late night.  three days ago we had an overnight here that began around 4pm... so my crew & i headed over at supper time... we sat at the bar... starving and ordered a few burgers. i got the jack daniel burger she got the jd chicken sandwich... the food well my food came out luke warm... it looked awful... the cheese on it looked like it was made a while ago... i was like whatever im freaking starving... so i dump some mayo and some jd sauce on the burger... take a bite... the bun literally cracks apart in my hand...  yeah at like 6pm on a weekend night... stale effing hamburger bun... disgusting... cold burger... its a gross chain i get it... i never send anything back anywhere but give me a fuchqing break kitchen really... like every big mac sandwich every where is always like light years better than this ... ugh... cant even.... why does mcdonalds not serve beer already...  anyway no i dont review chain restaurants but this was effing pathetic. deserved zero stars... bartender where we were sitting was like? was your food good... and i told her not so much... she's like you should have told me i would have had them remake it... yeah fat chance... thanks though... barf... anyway thats it for me... next gso overnight... im getting beer from a gas station and hotel van to either mcdonalds or whatever fast food is open... cant even... sad... if you want to eat here and have a car do yourself a favor drive to greensboro and goto the mellow mushroom or some actual real restaurant that gives two shifts... like a lol... mcdonalds or something!  tgi's.... =  no bueno,https://www.yelp.com/biz/tgi-fridays-greensboro-2?start=20,2.16,2.16,2.16,1.5080000000000002,2.16
