,Username,location,friend_count,review_count,photo_count,rating,date,review,Url,roll25,roll100,roll250,special_25,Final_Rating
1,Gerald S.,"Newtown, PA",1012,2191,6425.0,3.0,2016-12-14,"This is the TGI Fridays that is within the campus of Oxford Valley Mall, Langhorne (Middletown), Pa. It has the conventional layout of the older version of this national franchise, with a large bar and booths/tables all around.  The atmosphere is casual and bustling, and has the feel of the roadhouse it was meant to be.  We chose this spot as representative of contemporary popular American cuisine for our friends who had just arrived from Asia. They wanted something traditionally American.  What is better than nachos, burgers, salad, fried chicken and chicken/shrimp combos on top of pasta?   Don't answer that!  We had about a 10 minute wait for seating on a busy Saturday night.  Service was friendly and acceptably prompt given the crowd.  Our server was patient as we perused, translated and sought direction from our guests.  The youngest had no problem finding the fried chicken sandwich.  The mother and grandmother were slower in understanding meals without rice, but ultimately selected a traditional cheeseburger, and a grilled chicken pasta dish.  Of course, there was also the issue about western utensils vs. chopsticks, but we worked through that with the help of the large wooden spikes used to hold things together.  We natives moved more quickly to the salads, sliders and shrimp/chicken plates.  Everything was served together, and I watched as our friends took their first close up look at American food.  It was a cross between confusion and incredulousness. Big pieces. Nothing cut into small bite size morsels. Okay. They would just have to figure it out and dig in.  The rest of us went quickly to work on our Jack Sliders (very good), BBQ chicken salad (plentiful and tasty), chicken/shrimp combo (loved the shrimp, but left most of the chicken to take home). The fried chicken sandwich was devoured with relish.  So far. So good. Our second oldest guest just ate the fries around the burger.  She didn't seem to know where to begin.  I think she did not want to use her hands to pick up her food.  I asked if she would like to exchange a small slider for her half pounder, and she gratefully accepted.  She ate it with the spike holding the entire thing like a burger on a stick.  She liked it.  Her burger was pretty good, but a step below what I have sampled in places like Chilis or Applebees. It was not the medium finish requested, but far closer to well done. Granny was able to eat her pasta with the spike, but seemed tentative the whole way.  It wasn't the noodles she was accustomed to, but she was game.  All in all, it was a fairly good introduction to fast casual, something almost totally lacking in their part of Asia. They were impressed by the size of the crowd, and its diversity.   Welcome to America, sisters!  You aren't in homogenous Asia any more.  You'll love it once you figure it all out.",https://www.yelp.com/biz/tgi-fridays-langhorne,2.92,2.92,2.92,,2.92
13,Kailey G.,"Evesham Township, NJ",0,10,,5.0,2017-01-09,"My boyfriend and I go here every single time we are by the Oxford Valley mall. And every single time we get amazing food with even better service. Since going to Fridays in Langhorne we haven't had a single bad waiter. I remember one time I was being super picky with my food, haha, and the waitress never gave me a hard time about it and fixed everything I needed fixed. Let's just say she got an amazing tip! I love this place and will continue to come here in the future :)",https://www.yelp.com/biz/tgi-fridays-langhorne,2.96,2.96,2.96,,2.96
4,Tom O.,"Levittown, PA",0,34,,1.0,2017-02-16,"Dirty. Horrible service. Cold food. The place needed a good cleaning. It took over a half hour for a server to come to our table, it was the same in the entire section we sat in. People were getting up and leaving without ordering. After we ordered it took another 45 minutes for food to come, cold. The people at the table asked for their check when we ordered, they still didn't get it when our food came. Oh, by the way, the place wasn't crowded at all, less than half full. We won't be back.",https://www.yelp.com/biz/tgi-fridays-langhorne,2.92,2.92,2.92,,2.92
27,Frank A.,"Levittown, PA",1,17,,4.0,2017-03-02,"Glad to see they brought back the endless apps at a reasonable price point ($10/pp).unfortunately they limited the menu. No more fried green beans. They did add some new items, fried pickles and meatballs. Meatballs were good. A suggestion, they need to accommodate single parties who would rather a half order instead of a full order. Who can eat a full order of fried potato skins and anything more? I'd rather a half order so I could order a half order of something else. You won't leave hungry!",https://www.yelp.com/biz/tgi-fridays-langhorne?start=20,3.0,3.0,3.0,,3.0000000000000004
17,Pete L.,"New Cumberland, PA",8,2,,5.0,2017-03-07,"Awesome lunch!  I had the Cajun shrimp and chicken pasta.  It was delicious, and very quick.  My wife got the JD sampler.  I helped her with that too.  The people there were really friendly.  I tried my best not to get any sauce on my favorite shirt, but it was inevitable.  As I was dabbing at the spot, the waitress said she had something to get that out.  While she was gone, the manager brought me a towel with some seltzer water on it.  Then the waitress came back with some wet wipes.  The spot was literally the size of a sesame seed!  What a great dining experience.",https://www.yelp.com/biz/tgi-fridays-langhorne,3.12,3.12,3.12,,3.1200000000000006
11,Cheryl D.,"Levittown, PA",0,3,,1.0,2017-05-13,"I have been here many times, but this will be my last, sadly there was nothing good about this visit. We ordered drinks that took 10 minutes to arrive ( nothing from the bar) Our server left without asking us if we were ready to order. 15 minutes later the server returned. At this time we placed our order for apps and our meals. 30 minutes later we still did not have our apps and we all had empty glasses. When we received our app we were not asked if we wanted refills on our empty drinks. When the meal finally did come out it was cold and not all at the same time. The manager did come over and offered to reheat our food. We were a party of 5 at 2:30 in the afternoon the restaurant was not busy.",https://www.yelp.com/biz/tgi-fridays-langhorne,3.0,3.0,3.0,,3.0000000000000004
5,Shaq N.,"Trenton, NJ",180,3,,2.0,2017-06-03,"Today the boneless wings were cold and the celery looked as if they were thrown in dirt, and not wash off. In other words they were looking like it was expiring.",https://www.yelp.com/biz/tgi-fridays-langhorne,2.88,2.88,2.88,,2.88
16,H S.,"New York, NY",1,141,,5.0,2017-07-24,"Steaks were perfect, went Sunday afternoon, party of 10, whole group got good service, drinks refilled.  Our steaks were PERFECT, cooked exactly to order.  The broccolli had some black pepper on it which was odd so I couldn't eat it but my son's didn't have any on his.  All in all, fresh food, exactly as ordered, quick, friendly service.",https://www.yelp.com/biz/tgi-fridays-langhorne,2.88,2.88,2.88,,2.88
10,David M.,"Levittown, PA",0,6,,5.0,2017-09-03,Always a great time here. This place always changing the menu around. I just wish that they fix the traffic signal sign that's been upside down for years.,https://www.yelp.com/biz/tgi-fridays-langhorne,2.96,2.96,2.96,,2.96
0,Krystal S.,"University City, Philadelphia, PA",2,80,20.0,3.0,2017-10-29,"The food is more like 3.5 stars, but service about 3.  Hostess sat us and said she'd be back with silverware, but that never happened.  The waiter was meh.  Not rude, but just not as friendly/attentive as I'm used to.  The service was slow, but the food was good.  I don't come here often, but when I'm in the mood I'll be back.",https://www.yelp.com/biz/tgi-fridays-langhorne,2.88,2.88,2.88,,2.88
15,Rebecca S.,"Darby, PA",2,66,1.0,1.0,2017-10-29,"I went to this TGIFridays with my husband and a friend. We were in a great mood and were joking around a lot. I ordered a pinot grigio and some apps. After my pinot grigio, I ordered a glass of champagne. We were munching on our apps for a while, and had been there about an hour and a half when the main courses came out. I said ""I think I'll have one more glass of wine with my main entree."" The waitress looked askance and then said ""I don't think I can serve you another drink."" I said ""Excuse me? why not?"" She mumbled something about only being allowed to serve ""two drinks per hour."" I said I had never heard of such a thing. I said ""and I'm not even driving!"" She looked around the table and said ""well who IS driving?"" I said ""my husband!"" He, by the way, had been nursing one beer the entire time we were there, which was a total of over two hours, and he didn't even finish it. She said she would go and check whether or not I was allowed to have another wine. Awhile later she returned with a third champagne (which I didn't want: I was going to switch to a red wine, but since she was arguing with me about the two drinks an hour"" rule and nosing into who would be driving, that she didn't even listen to what kind of drink I actually wanted.) Now mind you, we had been there well over an hour anyway by the time I asked for an additional wine. I am now wondering if she thought we were intoxicated (we absolutely were not) because we were joking around and having a good time. May I also mention that I am 47 years old and my husband and friend are also in their 40s. It's not as if we were a bunch of college kids. We had zero drinks before entering the restaurant and had just come from a movie. I have NEVER heard of any ""two drinks per hour"" rule at any restaurant in my life before. I have never had a problem of any kind ordering wine at a restaurant and I have been eating out at least five times a week for the last 20 years. I would like to know if this is an actual rule or if the waitress was just being exceptionally judgmental. She ruined our afternoon and our good mood. I won't be returning.",https://www.yelp.com/biz/tgi-fridays-langhorne,2.84,2.84,2.84,,2.84
14,Julie L.,"Levittown, PA",0,3,,1.0,2017-11-20,"We hadn't been to this Friday's in years, and after this experience, I can't see that we'll ever be back. We walked in on a slow Sunday afternoon, and no one was at the hostess stand. The women who would end up being our server walked past us twice before acknowledging us. When she finally did, she asked us to follow her to our table. Her pants were falling down, and we could plainly see her thong and the top of her butt! This someone who is serving food! That was unappetizing. After bringing us our drinks, she took our orders, then disappeared. We waited nearly 40 minutes for a sandwich and some pasta. Meanwhile, tables around us were filthy with dirty dishes and wadded up napkins of guests that were long gone. Not the server's fault - either a lack of guidance from management or poor staffing, but again, it's pretty unappetizing. When our food finally came, my husband's pasta was cold. We had to wait for our server to appear again, and when he said that his was cold, she seemed surprised. She took it to the manager who came to our table. Ultimately we decided not to get his meal after waiting so long and having to get on our way. The manager was quite apologetic, but there was just some many things wrong with this experience to justify going back here again.",https://www.yelp.com/biz/tgi-fridays-langhorne,2.84,2.84,2.84,,2.84
