,Username,location,friend_count,review_count,photo_count,rating,date,review,Url,roll25,roll100,roll250,special_25,Final_Rating
5,Dana M.,"Richmond, VA",12,190,19.0,3.0,2017-03-27,"Three stars is actually fabulous, b/c, after all..it IS a Friday's.... MY disclaimer, though...as others have mentioned...is this (HOPEFULLY!!!!) used to be the worst Friday's I'd ever set foot into.  It appears things (may have...) changed?!?!  Fingers crossed! NOW...onto my review...after swearing off this location, guess what?  I was back.  Not by my choosing...it was late-ish & the BF got home starving & craving their ""Endless Aps"".  Sigh....  Being the fab GF that I am, I (begrudgingly...) agreed.  Wow!  Our server, Tamoria was SPOT ON!  I also noticed, there were a ton of runners & even the bartender walked over to check on us. Seems they're going for more of a 'teamwork' approach?  Idk what it is, but it won me over & I'll return.  The entire staff had smiles on their faces the entire time & they were SLAM PACKED!!!  BRAVO!!!!!!!!!!",https://www.yelp.com/biz/tgi-fridays-richmond-5,2.16,2.16,2.16,,2.16
3,Paula J.,"Smithtown, NY",111,145,43.0,2.0,2017-05-19,"Wait staff very friendly,  but quite a LONG wait for our food considering it was NOT busy at ALL and there was no reason for it to be so.  My BFF requested her chicken be pretty much over cooked,  or ""burnt""  to be specific,  but it was barely done.   I asked for my sirloin to be medium,  though I was thinking of asking for it to be medium-rare in case it was over-cooked --which is exactly what it ended up being...over-cooked.  The sesame jack chicken strips were delicious though!    They have this awesome new bubble tea available that I partook of and I'm super glad I did!  I really wanted to provide 3 stars because the waiter was great,  but the wait and the deviations from how we ordered our food made it so I had to deduct a star.",https://www.yelp.com/biz/tgi-fridays-richmond-5,2.2,2.2,2.2,,2.2
4,Zamora B.,"Richmond, VA",74,93,45.0,2.0,2017-06-17,"First let me start by saying that the staff were super friendly and helpful. We had a wonderful server and she was very attentive.  The food was blah. Bland, unseasonably bland and not wonderful. I ate half and didn't bring it home.",https://www.yelp.com/biz/tgi-fridays-richmond-5,2.24,2.24,2.24,,2.24
6,Andres V.,"Richmond, VA",27,3,2.0,1.0,2017-07-06,I ordered a mozzarella tomato salad as a side replacement and it was the worst cheese I've had. It certainly doesn't look fresh. The cheese was bitter so I didn't finish it. I brought it to the servers attention and she said that the cheese is supposed to be bitter.,https://www.yelp.com/biz/tgi-fridays-richmond-5,2.24,2.24,2.24,,2.24
1,Marcus H.,"Chesterfield, VA",55,75,26.0,1.0,2017-10-22,"Now avoiding this franchise.  Walked in went to the host and told them I was here to pick up a online order for Harris. Then I waited 50 mins before a waitress walked up and said the name Harris. I walked up and it was the wrong order. I stated it wasn't my order and she said ""oh you must not have heard me then, I said Hairrs"" I smiled and said ""yes, My name is harris"". She walked away and no one came back out to figure out what was going on with my order or even talk to me. After simply asking for a refund so I can leave I was asked did my order come to the correct store I stated the store number in my electronic receipt. And not to my surprise, neither of the two ladies even know what the store number was. I was told it would take 24/72 hours to get my money back for the food I never received. Of course not to my surprise again. Patiently awaiting the ZERO star update for yelp ‍",https://www.yelp.com/biz/tgi-fridays-richmond-5,2.2,2.2,2.2,,2.2
10,Phoebe S.,"Mechanicsville, VA",48,7,,1.0,2017-11-23,"I'm giving this one star because no stars is not an option. I came here on Thursday evening to have dinner with my boyfriend at 10pm at night. Within 12 minutes they turned the music up so loud I literally could not hear my boyfriend speak across the table. We asked the waitress what was going on and she said ""this is how it is on Thursdays""......apparently they hire a DJ on Thursdays to play music that could drown out a club sound track while people are trying to eat. The guests around us were visibly uncomfortable but the staff seemed to ignore the music level regardless. The waitress set the check down and rushed away. After we paid and asked the hostess if this was normal she explained that ""the guests always complain about it'.......why is this allowed?? It's Fridays not a club? I can make cheap fried food at home without bad 80s music so loud it hurts my ears and drowns out all conversation.",https://www.yelp.com/biz/tgi-fridays-richmond-5,2.16,2.16,2.16,,2.16
0,Alisha H.,"Richmond, VA",150,85,253.0,2.0,2018-01-10,"I'm soooo not surprised to have to give this place a low review, yet it's consistent with the current 2 star rating.  The Ill mannered hostess who answered my call as I drove the 4 mins here, looked like ""awww, damn"" when she saw me walk in with my phone in my hand...  as she looked at her phone still flashing, yet too scared to pick it up or address the obvious for another 2 mins.  I finally called her out once the server came to take my order.   I'm here because it's late and I don't want fast food AND I have a BOGO coupon.  The manger tried to apologize and salvage the debacle unfolding only gave 50% effort at best.  One of the ladies behind the bar was attentive, apologetic and saved their receiving a (1) Star....  I'll stay away from this location when possible.  The up side is that the food was hot as ordered.",https://www.yelp.com/biz/tgi-fridays-richmond-5,2.16,2.16,2.16,,2.16
2,Heather B.,"Morton, PA",0,6,,5.0,2018-01-13,Went to TGIFridays with our volleyball team at the MLK Richmond tournament. So accommodating and Nick the bartender did a great job with a big crowd. Definitely recommend coming. Family environment and great staff!,https://www.yelp.com/biz/tgi-fridays-richmond-5,2.24,2.24,2.24,,2.24
