,Username,location,friend_count,review_count,photo_count,rating,date,review,Url,roll25,roll100,roll250,special_25,Final_Rating
87,Kim S.,"River Forest, IL",0,4,2.0,1.0,2015-05-06,"I was a fan of TGI Friday's, up until yesterday!  My co-workers and I have been going to this location for years as it is right across the street from the office.  We arrived yesterday at 1:00.  It was not crowded.  We reminded our server that as employees of the hospital, we receive an employee discount (10%).  He said he was unaware of this and went to ask the manager.  When he returned he stated that we could only get the discount on items that are not already discounted, so not on the lunch special we were all ordering.  This was new, we have always gotten the discount in the past.  Fine, it's only 10%, moving on.  Next, the food took 40 minutes to come out.  Keep in mind we are on our lunch hour.  There were 4 of us and my food did not come out with the others.  And the best part was that we all ordered the 1/2 sandwich salad combo.  I ordered the exact same thing my co-worker ordered so the sandwich would have just been cut in half to split between us?!  He said, ""Oh they are still working on yours so I brought your salad out.""  I ordered ranch dressing, it came with blue cheese.  And it took another 10 minutes for me to get my half sandwich.  That's 50 minutes.  Back to the other gals orders, the lunch special has the option of a garden salad or a Ceasar salad.  They opted for the Ceasar Salad.  When it came out, it was basically a garden salad, with tomatoes, radichio and romaine, with a few sprigs of parmesan cheese and vinegar and oil dressing.  This is NOT a Ceasar salad.  When they questioned it he said, ""Yes, that's our Cesar salad, I know it's weird.""  Also of note, the ""au jus"" for our French Dip sandwich was the French Onion Soup that was one of the soup options.  Good thing we all liked onions :)   When the bill came, no efforts at all to remove anything, comp dessert, NOTHING...except excuses from the server on why it was not his fault that our experience was bad. On my receipt it showed a ""rush"" order on my food.  That tells me that the server forgot to put it in at the time of the rest of the order.  It's a shame Friday's, we been faithful customers for years but we will definitely be taking our business elsewhere and letting others now how you've gone downhill.",https://www.yelp.com/biz/tgi-fridays-chicago?start=100,1.96,2.6,2.6,1.6360000000000001,2.3440000000000003
46,Maria G.,"Chicago, IL",3,140,172.0,4.0,2015-05-08,"Typical chain restaurant casual fast food dining and drinks.  In my opinion, the Tostada Nachos, Spinach Dip and Pot Stickers are the best appetizers on the menu. Definitely skip the green beans, which are garbage! I wish Fridays would bring back the steak hibachi skewers, which were delicious! For my entree, I usually get the Sizzlin Chicken & Spinach or the Jack Daniels Ribeye, which is always good. I prefer this location over Oak Park because the customer service and management at the Oak Park location is absolutely awful! The head hostess at this Chicago location, I believe her name is Angela, is ALWAYS very welcoming and accommodating. THE BEST server here is Mireya! She is ALWAYS professional, attentive and friendly and the reason why I return when I'm in the area.  FYI...Sign up for their Give Me More Stripes program and get rewarded for food/drink and to receive special offers/coupons.",https://www.yelp.com/biz/tgi-fridays-chicago?start=20,2.08,2.6,2.6,1.936,2.3920000000000003
28,Pia K.,"Newton, MA",43,5,1.0,5.0,2015-05-10,"I am vegan and ordered a starter that sounded like it had no diary or meat in it but it ended up having cheese on top of it. We got it for free and the manager or chef himself came to help me find a vegan option. They were very nice and kind. My mom said her burger was the best she ever ate. Our waiter was very cute, forgot his name. Great experience.",https://www.yelp.com/biz/tgi-fridays-chicago?start=60,2.16,2.61,2.61,1.9400000000000002,2.43
100,Emily S.,"Dublin, Republic of Ireland",34,67,27.0,1.0,2015-05-23,The staff were lovely but the food was awful.  Greasy and tasteless. I had a burger and my friend had a salad both were awful,https://www.yelp.com/biz/tgi-fridays-chicago?start=80,2.16,2.58,2.58,1.4440000000000002,2.412
106,Anthony A.,"Chicago, IL",1,4,,1.0,2015-06-06,"Late night around 10:30 on a Saturday night. Place was not that busy. Walked in and there was a line because the hostess with an attitude was explaining to a couple first of all that they needed I.d. and  couldn't sit upstairs because they had a kid. I understand policy but never am able to accept attitude, rudeness in a customer service business. Next comes our turn...table for 3 possibly in the 3 empty booths in front of us. Sorry have to wait because server cannot handle more than one table in that section!? Get seated at table, server Sarahson who obviously could care less about wether we have an enjoyable experience takes our order. The plates then proceed to come out at different times from entree first to appetizer(dried up old potato skins) to my entree and then proceed to wait for the third entree which takes forever. At this point we cancel the third order, which our server could care less once more. I tell the rest of my party to head home because obviously at this point she was taking forever to bring my check. Never one apology! Ask who the manager is... She gives the name but per restaurant policy is not able to write it down, I need to walk outside the restaurant and write it down myself.  I have been a neighbor and patron of this TGI for over 10+ years. Their service and quality of food has dropped exponentially over the years. How these businesses with subpar service and food continue to stay in business continues to baffle me, but I guess we support the behavior. I gave 1 star for the fact that this evening was the first time in my history that I did not give a tip of some sort. For that reason TGI should be given some recognition for that historic event. Needless to say I will not support our frequent this chain one more time!",https://www.yelp.com/biz/tgi-fridays-chicago?start=80,2.08,2.55,2.55,1.4440000000000002,2.362
107,Lisa F.,"Temecula, CA",907,374,332.0,4.0,2015-06-13,"Really great food (salmon with lobster and tomato salad and broccoli ...yum!!!  ) she Never came back to fill our water or coffee but the food came out quick , was good and she was very very friendly .   If we really wanted it bad and we needed drinks , I guess we would have asked for it hough",https://www.yelp.com/biz/tgi-fridays-chicago?start=80,2.12,2.57,2.57,1.7760000000000002,2.39
118,May J.,"Downtown Minneapolis, Minneapolis, MN",1,1,,1.0,2015-06-15,The food was great but the service was terrible!!!! The waitresses like to take away our food before we finished. Worst TGIF ever,https://www.yelp.com/biz/tgi-fridays-chicago?start=80,2.12,2.55,2.55,1.3800000000000003,2.378
80,Tj S.,"Chicago, IL",6,4,13.0,2.0,2015-07-14,"As a chain I like TGIF, but this particular location needs improvement. Seemed under-staffed on a weekend night. One plate was dirty (out of the dishwasher). The burger was assembled poorly. The Chicken & Shrimp was fine. Portion size is good. Water arrived half way through the meal. The final check was incorrect and had to be re-done. The waiter was polite and patient.",https://www.yelp.com/biz/tgi-fridays-chicago?start=100,2.16,2.56,2.56,1.4800000000000002,2.4000000000000004
172,Annie D.,"University Village, Chicago, IL",1,42,,1.0,2015-07-19,"Went there on Saturday for early dinner, around 5. Place was not too busy, but there was a line by the door due to the hostess taking forever seating everyone. Waited for at least 15 minutes for the hostess to come back from some place, people were just standing around in the front area, not sure how they know who was the next in line. Very confusing, they need to stream line the front area. Dinner was ok. They would not take any of my coupons, which was the main reason for going there. Left my son's hat there, tried to call after leaving the restaurant, was put on hold for 20 minutes, end up hanging up. Never going there again, the food was ok",https://www.yelp.com/biz/tgi-fridays-chicago?start=120,2.04,2.53,2.53,1.3480000000000003,2.334
103,Meylon J.,"Matteson, IL",7,16,11.0,2.0,2015-07-25,"Food was ok....not hot for the amount of time we waited, but just ok. Out of 5 meals 1 was correct the way it was ordered.  Other than the food issues, our server Constance was an absolute delight. She was very courteous and worked hard to ensure we were satisfied.  Will probably return if in the area and wanting something familiar.",https://www.yelp.com/biz/tgi-fridays-chicago?start=80,2.04,2.51,2.51,1.4800000000000002,2.322
159,Kelly B.,"Chicago, IL",4,63,,2.0,2015-07-26,"Stopped in here for pick up the other night, per usual.  One of the shorter female waitresses, literally was cussing at the hostess in front of many customers. Complaining about how many tables she had, saying all of this is ""irritatin!"" Asking if she was the only server on the floor etc. So unprofessional, I was actually appaled that she had the nerve to act that way in front of customers.  Food is always good though, I guess that's what matters to me since I never eat in the actual restrauant.",https://www.yelp.com/biz/tgi-fridays-chicago?start=40,2.08,2.5,2.5,1.4480000000000002,2.332
117,Michael P.,"Chicago, IL",4,2,,1.0,2015-08-01,"So my family and I went here at around 12. After getting a table we had to wait about 15 minutes until a waitress even saw us to order drinks and it took another 30 minutes to even get them. I ordered the loaded potato skins and the potatoes were hard and the cheese was like rubber. If I could give 0 stars, I would. I would never eat here again even if I was paid to.",https://www.yelp.com/biz/tgi-fridays-chicago?start=80,2.08,2.48,2.48,1.4440000000000002,2.3200000000000003
174,Lori P.,"Pompano Beach, FL",0,6,,1.0,2015-08-01,I would NEVER  eat at this nasty discussing dump again!!!!! Service stunk!!! Food was soooooo nasty had to give it back!!!!! If I was a starving Ethiopian and they were giving away free meals I would avoid them like the plague and eat rocks!!!!!!!!,https://www.yelp.com/biz/tgi-fridays-chicago?start=120,2.08,2.48,2.48,1.4440000000000002,2.3200000000000003
114,Renee E.,"Chicago, IL",0,3,6.0,1.0,2015-08-02,"Fruit fly infestation. I mean, really bad gnat situation in this place. Consistent lack of basic service. Dirty dishes. Irritated, non-attentive, attitudinal staff. I have so much to say, but I will keep it simple. Do not eat here. EVER. Take your money somewhere that cares about their guests, and that won't put you at risk of getting sick from eating there.",https://www.yelp.com/biz/tgi-fridays-chicago?start=80,2.08,2.46,2.46,1.4440000000000002,2.308
158,C G.,"Pacifica, CA",0,17,,1.0,2015-08-23,"In one word....HORRIBLE!  The food was gross, the service was horrible and slow and the bartender took so long with drinks we left without even getting them and so did other tables. We ate our dried out potato skins and another gross appetizer and still didnt have a drink. Will not go back with so many wonderful places around there to eat and drink.",https://www.yelp.com/biz/tgi-fridays-chicago?start=40,2.04,2.42,2.42,1.4760000000000002,2.268
36,Derek B.,"Chicago, IL",3,16,,2.0,2015-09-06,The service here is terrible. You walk into an almost empty restaurant and wait for a good five minutes for a hostess to come up front to take you to a table. This has happened to me multiple times. They act like you are an inconvenience to their social hour. I needed silverware and it took me five minutes to flag down the wait staff. Pretty sure they were all in the back on their cell phones. It's fairly inexpensive for a restaurant right off Michigan Avenue and you know the food will be okay because it's a chain. They really need to clean up the management at this location. Not what you would expect for downtown in a major city.,https://www.yelp.com/biz/tgi-fridays-chicago?start=60,2.08,2.43,2.43,1.576,2.2900000000000005
34,Brandi W.,"Chicago, IL",219,15,10.0,1.0,2015-09-20,I have never experienced a place so full of negativity waiters we absolutely rude I came in and was asked for an ID well behind me walked in someone whom admitted to being 18 the waiter smiled and sat her is on the other hand was asked to wait I'm 23 and I had my passport he didn't accept it,https://www.yelp.com/biz/tgi-fridays-chicago?start=60,2.04,2.43,2.43,1.4760000000000002,2.2740000000000005
112,ivan m.,"Chicago, IL",0,4,,1.0,2015-09-28,The worst staff ever. The hostess was rude. The general manger was worse. Denied seating at 930pm because my girlfriend didn't have her id. Even though I had mine. (I'm 35 btw) To eat dinner?Manager refused to give me his name or business card. Corporate already emailed.,https://www.yelp.com/biz/tgi-fridays-chicago?start=80,2.04,2.41,2.41,1.5400000000000003,2.2620000000000005
88,Jorge M.,"Cicero, IL",1,1,1.0,2.0,2015-10-18,"We love going to Friday's but yesterday was just an unpleasant visit. The waiter was nice and started us off with water, gave us some time to look through the menu. Everything was going fine, we ordered some appetizers and drinks. Once our appetizers arrived though, that's  where it went down hill, they hadn't brought us any plates or silverware, were we expected to eat these appetizers with our hands or what? So we waited to see if maybe our waiter would pass by, nothing not even the other employees that were just walking around, yeah it was a bit busy but come on like 4 different employees passed by and didn't even look to see that we were annoyed, then we see everyone standing at the computer where the waiter/waitress puts in the order talking  and then my partner had to put his hand up to at least get one of their attentions, he even had to waive just to catch someone's eye until one of the ladies looked and at first she had on this look like we had bothered her by raising our hand, we wouldn't be raising our hand if at least our waiter or any employee was attentive to the guest which I'm sure is the priority right? So then she had the host come to our table to see what was wrong and told him we needed silverware and plates, he brought us the silverware still no plates, then we just decided to eat. The drinks also took a while to arrive I'm not sure if they only had one bartender that night or the drink took a while to make but we had to wait on them too. I also work in the restaurant business and having to have the guest waiting for something or not following up on their table is a big no-no for us. Other than that the food and drinks were good, it was just the service that kind of tanked, and yeah it was a bit busy but when you have 4 or 5 employees running or standing around talking and the guest having to raise their hand to get their attention makes you wonder if the guest is their first priority or not.",https://www.yelp.com/biz/tgi-fridays-chicago?start=100,2.08,2.39,2.39,1.768,2.2660000000000005
45,Valsielen M.,"Chicago, IL",57,86,398.0,5.0,2015-10-31,"Really good food!!! I recommend this restaurant, specially for lunch!!! Recomendado!!! Voltaremos em breve!!!",https://www.yelp.com/biz/tgi-fridays-chicago?start=20,2.2,2.39,2.39,2.036,2.3140000000000005
89,Michael C.,"Chicago, IL",57,4,,1.0,2015-11-23,"Wow Tgi Fridays I never knew your service could be so horrific. Walked in from Northwestern and got serves quickly but never got plates for the appetizer I ordered until I called a girl over and asked her what was wrong with is, this being eating food on a napkin. 15 minutes later a drink came as we were leaving. Such horrible service never had such bad service in my life. Don't even walk in go to the corner backery they will get you better food and service. You would Friday's would get this better but no chance. The waitress didn't even know Glinlivet is .. Wow the worst in my life!!!!!!'",https://www.yelp.com/biz/tgi-fridays-chicago?start=100,2.2,2.35,2.35,1.5080000000000002,2.2900000000000005
161,Yvonne Y.,"Los Angeles, CA",2,6,14.0,4.0,2015-11-26,"I'm a vegetarian but the waiter said I could take out the shrimp and chicken from the Cajun pasta, the pasta was very creamy but I still found two pieces of chicken inside, not sure why. I liked the pasta though, the spiciness was perfect! I also asked for avocado on top of the pasta and they did it. As for my friend she ordered s combo with grilled ribs. Apparently it was a bit over grilled and tasted bitter due to the burnt parts.",https://www.yelp.com/biz/tgi-fridays-chicago?start=40,2.32,2.35,2.35,1.8080000000000003,2.338
30,Sandi K.,"Farmington, MI",10,39,,2.0,2015-11-28,I know it is busy on Saturday night -especially thanksgiving weekend....but we waited for 45 minutes just for drinks.,https://www.yelp.com/biz/tgi-fridays-chicago?start=60,2.24,2.36,2.36,1.512,2.3120000000000003
153,Cesar R.,"Sacramento, CA",2,14,1.0,1.0,2015-11-30,"As a chain it's typically good.   This location needs major improvements in the customer service department. Bartender was rude, made a crappy drink and basically ignored me the entire meal. The sandwich was poorly made.   one half had zero meat.   The other had all the meat falling out because it was over stuffed.    I left and no one acknowledged I was even there. Won't be going back",https://www.yelp.com/biz/tgi-fridays-chicago?start=40,2.08,2.36,2.36,1.5080000000000002,2.248
31,Burton L.,"Waterford, WI",68,29,17.0,1.0,2015-12-05,Tried to eat here there was a 25 min wait and we could literally see over 10 tables that were empty but needed tone cleaned. Staff was moving slowly and didn't seem to care.,https://www.yelp.com/biz/tgi-fridays-chicago?start=60,1.92,2.32,2.32,1.5080000000000002,2.16
37,Sonia R.,"Park Ridge, IL",40,2,,1.0,2015-12-23,"The food was good, however the service was horrible. The waittress we had never came to check on us. She took forever to bring us the check and never came back to pick up the payment. Finally we gave it to the hostess on our way out and the waittress came out of nowhere,  nearly bone rushed us at the door as if we were trying to leave without paying. I will never go back here.",https://www.yelp.com/biz/tgi-fridays-chicago?start=60,1.92,2.32,2.32,1.5080000000000002,2.16
99,Sassy B.,"San Jose, CA",0,6,,1.0,2016-01-04,"This place robbed the hell out of us. Don't come here, this place is a scam. Our drinks had no liquor at all and the nachos were crap.",https://www.yelp.com/biz/tgi-fridays-chicago?start=100,1.8,2.29,2.29,1.5080000000000002,2.0940000000000003
96,kimberly r.,"Maywood, IL",0,9,,2.0,2016-01-18,Had a late lunch food & service was ok. They have a problem with bar flies thier were SO MANY they are flying around the seating eating area. Dont know if I'll be back there!,https://www.yelp.com/biz/tgi-fridays-chicago?start=100,1.68,2.3,2.3,1.608,2.052
38,Kayley R.,"Chicago, IL",0,2,,1.0,2016-01-23,"The food was delicious but I have been to TGI Fridays several times and have never received this terrible of service. Not only have I had to show my ID 3 times for two drinks but I have had to wait over 10 minutes for a server to approach me so I could order. Further more the restaurant was completely dead. I was told our server wouldn't be back but then he apparently turned into the bus boy and our finished drink dishes never got cleaned up which barely gave me any room to eat my food. Never coming back. In addition their valets seemed to be getting high and we smoking cigarettes directly in front of the entrance. As a non-smoker, who is highly against smoking cigarettes I was extremely disappointed that the first thing I smelled was burning chemicals and tobacco and not food.",https://www.yelp.com/biz/tgi-fridays-chicago?start=60,1.68,2.28,2.28,1.604,2.04
33,Geno T.,"Canton, MI",2,21,171.0,2.0,2016-02-06,"Just like any other Friday's.  Got in and sat down right away. We had to ask for refills. I ordered some ribs had to ask for  water, hand wipes, and the bill. Definitely need so work",https://www.yelp.com/biz/tgi-fridays-chicago?start=60,1.72,2.27,2.27,1.704,2.0500000000000003
101,Sue J.,"Chicago, IL",105,6,3.0,1.0,2016-02-15,"Generally, TGIFridays is an ok place with fun servers. However, this location dropped the ball on customer service and based on all the other reviews, looks like I'm not alone in thinking that the service is terrible. First, we had to wait over 5 minutes upon arriving before anyone even said a word to us, meanwhile 4 servers walked right past us, no smiles or saying hi. Then our server, Robertin, was very rude. The service was so unacceptable, will not be going back to that location.",https://www.yelp.com/biz/tgi-fridays-chicago?start=80,1.6,2.23,2.23,1.7000000000000002,1.978
113,Anonymous T.,"Chicago, IL",0,4,,1.0,2016-02-25,"This by far is the WORST TGI Friday's ever!!!! The service is horrible and has been getting worse over the years. I, personally, do not enjoy this particular restaurant; but I will attend maybe once every other year if a close friend insists. On February 25, 2016 (around 9pm), however, my father was extremely excited to spend his birthday evening here with his family. Worst birthday experience thus far. From the moment we stepped in the door , we were not impressed as the host just leaned on the wall barely greeting us. Then we had the privilege to sit at a booth next to a dirty table, that hadn't even attempted to be cleaned until my father spoke up on it 45 minutes into our dining time. Even then, it was only partially picked up with more to come its way later on. Unfortunately, for us there was only one waitress in our entire section and she wasn't particularly ecstatic about serving. To try and shorten what could go on for lengths, my father spoke with the manager about his dissatisfaction which continued with long waits for food, lack of service alertness, incorrect orders, unclean restrooms and dining area, and not so great meals. After being asked to be spoken with a second time, the manager never showed her face and did not even attempt to provide concern for such grievances. To top things off, my sister and I each had one of the chicken selections, and I can't help but to think that our aching stomachs are a result of the food. This is by far a horrible restaurant in its chain and should be shut down, especially, since it is located in downtown Chicago. It gives our city a bad look. I plan to contact the corporate office about this place. -0 stars if possible",https://www.yelp.com/biz/tgi-fridays-chicago?start=80,1.6,2.22,2.22,1.7000000000000002,1.9720000000000004
27,Sarah T.,"Los Angeles, CA",244,82,71.0,1.0,2016-02-27,"Walked in on a Friday night and sat at the bar for 8 minutes and was never greeted, wasn't that busy. Very disappointing",https://www.yelp.com/biz/tgi-fridays-chicago?start=60,1.56,2.19,2.19,1.7960000000000003,1.938
35,Dave M.,"Naperville, IL",0,12,,2.0,2016-02-29,"The service was very slow.  The check in texting service was nice and let us walk around while we waited for an available table.   Once at our table, it was 15min until my one took our drink and food order and another 30 min for the food to arrive.  The food is typical.  Good but not great but a nice value.  My steak was prepared to order. A side was missed and it took so long we ignored it.   If you are in a rush. It does the job.",https://www.yelp.com/biz/tgi-fridays-chicago?start=60,1.6,2.19,2.19,2.024,1.954
21,Noor I.,"Downers Grove, IL",0,1,,1.0,2016-02-29,Do not go to this location!! Service was horrible and on top of that the valet service failed to lock my doors so my shoes got stolen and items in my car were misplaced. DO NOT VALET.,https://www.yelp.com/biz/tgi-fridays-chicago?start=60,1.56,2.17,2.17,1.956,1.926
29,Stephanie C.,"Long Beach, CA",89,12,4.0,5.0,2016-03-27,5 stars because I'm from California and over there we never got the perfect chips to spinach dip ratio. We got it here. It felt so satisfying.,https://www.yelp.com/biz/tgi-fridays-chicago?start=60,1.68,2.18,2.18,2.356,1.98
59,David C.,"Chicago, IL",102,415,469.0,1.0,2016-03-27,"We came here after hearing about the endless appetizers for $10 on the TV. When we got there, the check-in process was disorganized and chaotic. We were told that they sold appetizers for $5 at the bar and the endless appetizers only at tables. So we waited for a table. The waiter was actually the bartender and he was attentive. He explained that this location had not received the menus for the deal and explained it was $12. He honored the deal and the food was what we expected...fried and salty. What upset me the most was we asked to take the leftover food and were told we could not have it due to the deal. So, they prefer to throw it away then have someone take it home...this is wrong on so many levels!!! If I could give 0 stars I would. I will not be returning...even for the endless appetizers!!",https://www.yelp.com/biz/tgi-fridays-chicago?start=20,1.68,2.14,2.14,1.8920000000000003,1.956
24,Kevin Z.,"Los Altos, CA",299,42,15.0,1.0,2016-04-07,"If you've been to a Friday's before you know the food is decent. Especially with all the specials going on, it's a great place to get decent food on a budget. However, this Friday's hires staff that is slow, borderline unprofessional, and incredibly incompetent. Expect long waits for already open tables, inattentive waiters/waitresses, and managers that won't show sympathy. Expect a ""quick bite to eat"" to take at least 45 minutes to an hour or more.",https://www.yelp.com/biz/tgi-fridays-chicago?start=60,1.68,2.12,2.12,1.924,1.944
