,Username,location,friend_count,review_count,photo_count,rating,date,review,Url,roll25,roll100,roll250,special_25,Final_Rating
31,Rick T.,"Westminster, SC",0,30,,1.0,2016-10-25,"Never ever again, however it is a very good location for someone to build a good restaurant!  Now before you think I am being mean, think again.  Once you know how bad it really was you will understand.  I ordered a cob salad with grilled shrimp (Japanese spicy).  My wife French onion soup and a side salad.  Some time later her order arrived and I was told mine was coming.  Much much later mine arrived.  Mind you hers was hot (soup)and ready to eat. She said the soup was good.  When my salad finally arrived every thing was ice cold including the shrimp and bacon.  The only excuse here if I am allowed to guess - they grilled what they had to and then put it all in a freezer.  Had the shrimp not been frozen cold along with the bacon  and hard boiled eggs it would have been good.  The avocado was a nice touch.  I was ask if the vinaigrette would be ok. and I said sure but was never told they charged an extra $3.75 for a little blue cheese sprinkled on one side.  At that rate a small container of cheese must make them around $100.00 per small container. I remind you the cheese was never ordered.  Worse yet was tea - hot poured over ice which of course melted 90% of the ice.  Never got a refill or ice to chill the tea.  At $2.68 for a glass of watered down week lousy tea - you can say rip off again and again.  After the meal was almost over napkins finally came out.  A sure sign of a bad place to eat.  As bad as the service was it cut their rating way down  but not saying it was a frozen salad made it unbearable.  I ask you why are they not even close to serving both meals together.  Worse yet why do they grill shrimp and bacon and then freeze it.  Why not just serve boiled shrimp if they must ruin it by being to cold to eat.  Then rip people off by putting on an upcharge you did not order?  Tea at almost three bucks and never refill it. unforgivable to say the least.  Now my next comment should be against the law and any decent person will agree.  There is never a reason not to allow clean napkins on a table.  Your dinner ware delivered to the table wrapped in a paper napkin is not a napkin you should put to your mouth.  You have no idea how many people with unwashed hands handling the flatware inside a surely unsanitary paper napkin - just not good anyway you argue it.  Would not suggest this place to anyone I liked - don't walk away - RUN",https://www.yelp.com/biz/tgi-fridays-greensboro-2?start=40,2.12,2.12,2.12,1.604,2.12
14,Cedric B.,"Greensboro, NC",23,1,,1.0,2016-11-27,"I visited this location on Wendover Ave in Greensboro, NC this evening to redeem a gift card given to me.  I haven't been to Friday's in years but decided to use the card after work.  I tried to order a classic cheeseburger with gouda online but I couldn't find a gift card option so I called it in.  I asked for my total and was told, ""I don't know, I just put in the order."" I arrived at the restaurant about 20 minutes later and still ended up waiting about another 15 minutes to get my food.  However, it felt more like 45 because there was someone who appeared to be homeless and/or with mental health issues at the bar who wouldn't stop talking to me/himself.  When my food finally made it out my pre-tax total was $10.39 (online to the pre-tax total was $9.90, including) and that struck me as odd.  Nonetheless, I gave the server my $10 gift card and a $5 to cover the total check ($11.09).  After another lengthy wait, the server returned with $3.00 change.   After she walked off, I went and found her and essentially confirmed that I had been shorted my change and she simply replied that she didn't have any change.  At this point, I was so upset, tired, and hungry that I wished her a good night and walked out.   When I get home about 10 minutes later my burger was essentially cold and the cheese was unmelted.  After microwaving it and taking 2 bites I gave up and started writing this.  I could typically handle any of these issues individually.  But all this occurring at once after driving across town at the end of a long cold day of work was a bit much.  The bar nor the restaurant were busy (to the point that many of the servers were sitting around enjoying their down time). This was a pretty unfortunate first time back and I should be happy it only cost me $2 (including the server's ""self tip""). But it is highly unlikely that I will return to my local Friday's anytime soon or recommended it to friends, family or Greensboro visitors.",https://www.yelp.com/biz/tgi-fridays-greensboro-2,2.12,2.12,2.12,1.6680000000000001,2.12
9,Teresa G.,"Greensboro, NC",8,11,11.0,1.0,2016-11-27,"would never go here again! dry and hard ""fresh"" burger buns and dry-burnt patties. Took 50 minutes to receive food, a lot of dishes were sent back to be corrected. Waitress also took more than 15 minutes to deliver drinks when the place is not busy at all (some waitresses are lounging). After getting my order ""fixed"" they only replaced the bun and kept the dry burnt patty. I can tell because of the one bite mark out of it and the ketchup I left under the patty that was not there when I received the order originally. I am speechless.",https://www.yelp.com/biz/tgi-fridays-greensboro-2,2.0,2.0,2.0,1.6680000000000001,2.0
59,Brigitte N.,"McLeansville, NC",0,2,,1.0,2016-12-26,"Went here to celebrate our daughter's birthday this evening. There were only eight of us who were there for some food, laughter and fun! Well lets see where to start first...! I ordered the appetizers which consisted of traditional wings, pot stickers, and mozzarella sticks. The pot stickers where not the best, the wings were actually very good and so were the mozzarella sticks. The problem... the service sucked beyond sucking!!! When I went to complain to the manager he actually said that the waitress had complained about our table because she felt overwhelmed with our party of eight people.  I informed him that this was my first time in his establishment and he acted like he could have cared less! We waited 50mins to receive our food and because two of us wanted to separate so that we could have more elbow room the waitress wanted to know if we could make up our minds where we wanted to sit! I will NEVER eat here again and would advise others NOT to waste your money!!! He did adjust our checks in all fairness but even he acted like we were a bother to him! The entire staff needs an attitude adjustment!",https://www.yelp.com/biz/tgi-fridays-greensboro-2?start=20,1.84,1.84,1.84,1.6680000000000001,1.8400000000000003
17,Kevin H.,"Raynham, MA",23,15,13.0,4.0,2017-02-06,I live in Los Angeles and I have visited this restaurant twice. The steak was really good! I'd like to recommend the steak to everyone.,https://www.yelp.com/biz/tgi-fridays-greensboro-2,1.92,1.92,1.92,2.0,1.92
61,Cathleen F.,"Greensboro, NC",125,1,,5.0,2017-02-14,"I started coming here last week on my lunch break. I sit at the bar and have a light lunch. Food is always delicious and timely. Denise the bartender is refreshing, friendly, and prompt. The rest of the staff are very welcoming also. Just what i need to relax and mentally prepare for my night shift. Theyve definitely got a regular in me.",https://www.yelp.com/biz/tgi-fridays-greensboro-2?start=20,2.04,2.04,2.04,,2.04
4,SA K.,"South Plainfield, NJ",142,4,3.0,5.0,2017-02-15,"Food is tasty as usual but the special surprise drink stop me to write a review which is made by Mr Bran  . , its awesome thank you so much bran  I'll come back soon  Thanks TGI",https://www.yelp.com/biz/tgi-fridays-greensboro-2,2.2,2.2,2.2,,2.2
51,Jenee' M.,"Greensboro, NC",0,1,,1.0,2017-02-26,"I've only been two times and I will never go back. The food is disgusting and the service is horrible. I wouldn't recommend anybody go to this restaurant, it was so bad I don't even want to go to another T.G.I. Friday's. It was a 30 minute wait for me and two of my friends, but there were seats available everywhere. Everyone was trying to figure out what was going on because it was a bunch of people waiting. I was highly disappointed",https://www.yelp.com/biz/tgi-fridays-greensboro-2?start=20,2.04,2.04,2.04,,2.04
48,Alicia D.,"Summerfield, NC",1,3,,1.0,2017-04-30,Wouldn't know - got up and walked out. Counted 5 waitresses and the manager just standing around.  Never took our drink order after 20 mins.  Good luck if your actually trying to eat.,https://www.yelp.com/biz/tgi-fridays-greensboro-2?start=20,2.0,2.0,2.0,,2.0
13,Heidi S.,"Colfax, NC",79,2,,1.0,2017-05-04,"I was there with a few coworkers after work on a slow Wednesday afternoon.  Our server was friendly but not attentive.  We received our food after 20 min of ordering before our waters even arrived. We ordered the endless apps and the bbq chicken arrived on the smallest plate.  The server (Not when our server)9 brought the wrong one out. She never brought the full size out.  When we ordered our drinks from the Happy Hour menu and showed the server we wanted the $5 Peach Sangria she failed to mention the Peach want included and would be $11. (We showed her our choice from the menu!!!)  The food was good,  despite the BBQ chicken flatbread being burned)but we will never go back.",https://www.yelp.com/biz/tgi-fridays-greensboro-2,2.0,2.0,2.0,,2.0
49,Valerie J.,"High Point, NC",7,17,,3.0,2017-05-08,"I was so surprised by the sad salad I got! I ordered the salad with steak and that is what I got!! Nothing but lettuce and unsliced steak, in finer restaurants they make a presentation by adding color like carrot shavings but not TGIF. What a boring salad and the loaded potato skins were not very loaded at all! We started out with endless appetizers but had to change to just the one order after seeing the sad ""loaded"". TGIF has gone downhill! What happened to presentation? The cooks are better off cooking for McDonald's!",https://www.yelp.com/biz/tgi-fridays-greensboro-2?start=20,2.0,2.0,2.0,,2.0
55,J M.,"Point Pleasant Beach, NJ",0,3,,5.0,2017-07-14,"Not usually a chain restaurant fan, but the hubs wanted endless appetizers.  When our kids' Mac n cheese came out, the side of fruit was so fresh and seasonal!  I was very impressed that it wasn't previously frozen.  My shrimp naan was delicious and looked more like a 5 star restaurant quality!  We were very pleased with how fast everything came out.  Will definitely be back.",https://www.yelp.com/biz/tgi-fridays-greensboro-2?start=20,2.16,2.16,2.16,,2.16
53,Sierra A.,"Hilo, HI",0,13,1.0,2.0,2017-07-26,We Ordered the jack Daniels ribs and a BBQ chicken salad. The ribs was good but the salad was a mess and was missing the kale and avocado. The server was nice but seemed timid and shy. The place seem to lack customer service. We probably won't come back here as it wasn't worth it.,https://www.yelp.com/biz/tgi-fridays-greensboro-2?start=20,2.04,2.04,2.04,,2.04
52,Joeyj C.,"Raleigh, NC",0,3,,1.0,2017-07-27,Are table wasn't even wiped she told us to sit at a dirty table and had an attitude when I asked if she could wipe down at least the seats,https://www.yelp.com/biz/tgi-fridays-greensboro-2?start=20,2.04,2.04,2.04,,2.04
7,A'Zane T.,"Burlington, NC",5,1,1.0,1.0,2017-07-30,"First of all this entire experience started off wrong. We had a party of 8 and they did not seat us until 45 minutes later. Next, we ordered dribks and thst took 30 minutes. When the waitress brought the drinks she had an attitude. She took our orders and that took 15 more minutes which is okay. Because that is standard wait time. Next, we ran out of drinks for the entire meal. The wait staff was slacking the entire time, having conversations by the kitchen. The food was just disappointing. And left the entire party hungry afterwards. Most definitely would not recommend coming back.",https://www.yelp.com/biz/tgi-fridays-greensboro-2,2.04,2.04,2.04,,2.04
18,Greg S.,"Siler City, NC",14,4,2.0,1.0,2017-08-06,"The last time we will visit this location. 1st of all why would a restaurant in the south get rid of sweet tea? 2nd when asked for a half cup of hot water in order to dissolve sugar to make tea our own sweet tea (you would think that it would be brought in a coffee cup with a handle not a full drinking glass), it wouldn't take thirty minutes. 3rd I had to go to the bar and order my wife a soda due to the disappearance of our waitress. 4th we had to find our own silverware & napkins. This is very ridiculous to come and spend $20+ dollars and be ignored. I would not recommend this location to any of my friends,family, nor you!!",https://www.yelp.com/biz/tgi-fridays-greensboro-2,2.04,2.04,2.04,,2.04
16,Olivia B.,"Chapel Hill, NC",48,1,,1.0,2017-08-10,This was one of the worst experiences I ever had. Food took 1.5 hours to be delivered. DJ was extremely rude. Managers and servers were inadequate and unprofessional. Please don't ever come here. Food was mediocre. It was upsetting. DON'T COME HERE PLEASE. It was a waste of time. I'll be calling corporate because it was that bad.,https://www.yelp.com/biz/tgi-fridays-greensboro-2,2.04,2.04,2.04,,2.04
19,Elizabeth D.,"Corona, CA",0,20,,1.0,2017-08-27,"This place is a joke! We came during slow business hours and the food was an absolute ripoff! I ordered the BBQ Chicken salad which was missing about half the ingredients. The menu said the salad came with romaine and kale but instead it was only ice berg (either that or only the white parts of romaine) Not only that, but it was missing cucumbers, cilantro, and tortilla strips. The ingredients that it did have were extremely minimal (ex: 5 total black beans) My husband ordered the Strawberry Fields salad. His too had ice berg instead of mixed greens, and void of several other ingredients like goat cheese and the pecans. These salads looked nothing like the pictures on the menu. The presentation was hideous! We never complain about things, but this was bad. We did not want to pay for salads with missing ingredients! It took about 10 minutes for the manager to come out, and her explanation was that ""they forgot"" or that some of ingredients went rotten a few days ago.  Listen to the reviews people and stay away!",https://www.yelp.com/biz/tgi-fridays-greensboro-2,2.04,2.04,2.04,,2.04
50,Jim C.,"Greensboro, NC",0,13,,1.0,2017-08-31,"We got there around 6:30ish tonight(Thursday) and were seated in the dining room area near(but not too near) a group of 8 people who were celebrating a birthday. When the waitress came over we asked about their local draft beers. ""I'm kinda new here, let me go check"". Ten minutes later she came back to advise(I got the Red Oak). A few minutes go by and we start hearing profanities from the birthday table. I am, by no means, a saint. If I think it's bad, well it's bad. Things get louder & louder. Then it quiets down & the waitress stops by and apologizes. Lo & behold a few minutes go by and the F bombs(+ a few other choice words) start flying again, getting louder & louder, to the point that I contemplate dialing 911. Then the pushing/shoving/slapping started! When sisters started slamming each others heads against the windows/window frames & the 3 male TGIFridays employees rushed over to break things up I called the cops. My wife's BBQ chicken salad appeared to be fresh, she said it tasted good. My flat iron steak with Jack Daniel's glaze tasted alright. Whilst eating, the manager stopped by & said ""Sorry about earlier"" & went on his way. When the waitress stopped by again I asked for the check & said ""So, this is your first night(based on her earlier ""I'm kinda new here, let me go check"") what did you think of the birthday party. She said ""Oh, I've been here about a month"". Been there a month & she doesn't know what local draft beers they have?? Then she brings the check. We had to deal with a birthday party turned brawl, wherein 3 large male employees had to keep to women from bashing each others heads into plate glass windows(to the point that called the cops), our waitress & the manager come over apologize about the ""floor show"" and we get dinged for the full meals. I wasn't expecting to walk out without paying a penny but the manager should've comped part of our meal(or something). As we were leaving, I noticed that the crew did a half-a$$ed job of cleaning up the party table. Plates/etc had been removed but they barely wiped down the table & didn't get the trash off the floor. Good chain restaurant, just STAY AWAY FROM THIS LOCATION based of these reviews.",https://www.yelp.com/biz/tgi-fridays-greensboro-2?start=20,2.0,2.0,2.0,,2.0
10,Charity T.,"Atlanta, GA",0,3,,1.0,2017-09-02,This has to be the worse service ever. From the waitress to the management. We had a party of 5. Endless appetizers and waters. Our food took forever to come out and only half of the order came out We literally stopped eating because we had nothing to drink. The managers asked us if everything was okay. We told him no and asked if we could at least get something to drink. He said yes and walked off. 20 mins later NO DRINKS. Manager name is Marcus. I wish I had got the name of the waitress . She was not personable or apologetic. I've worked in hospitality for and this this gets a F. Do not.... I repeat DO NOT EAT HERE!,https://www.yelp.com/biz/tgi-fridays-greensboro-2,2.0,2.0,2.0,,2.0
3,Cari L.,"Jamestown, NC",34,48,11.0,2.0,2017-09-04,"They used to have the BEST ribs-Jack Daniel's baby Back ribs. They were always reliably tender. The past 3 times we have ordered them-only once were they tender. They have been overcooked and hard to chew. For $20 and change for 1 rack-I expect to be able to eat them. Tonight for our wedding anniversary we ordered a rack and a half to go. Let's just say 1/2 rack eaten by us and one rack in the trash. Unfortunately they were also out of the green bean appetizers. So this was a crummy anniversary meal-and expensive for 2 side caesar salads and 1/2 rack ribs. I had to heat mashed potatoes and mac-n-cheese just to have something else for us to eat. I would have cooked something else, but I didn't have anything else for us to eat as I wasn't planning on having to cook on my 19th wedding anniversary. SOOOOO disappointed.",https://www.yelp.com/biz/tgi-fridays-greensboro-2,1.92,1.92,1.92,,1.92
12,Lucas G.,"Greensboro, NC",38,20,,1.0,2017-09-20,"Ugh. Where to start. We waited about 15 minutes to even get greeted because the server said she ""didn't see us."" As a former server, I know the first impression is the most important and getting drink orders within 2 minutes (max) is standard for restaurants. I ordered a $15 steak and it was the smallest steak I've ever seen... what a rip! My coleslaw wasn't that good, my boyfriend's chicken sandwich was ""alright."" We didn't get checked on by management at all, and every time we asked for something (like steak sauce, our check, etc) it took a LONG time to get it. Displeased.",https://www.yelp.com/biz/tgi-fridays-greensboro-2,1.92,1.92,1.92,,1.92
8,rebecca m.,"Greensboro, NC",0,25,2.0,1.0,2017-09-24,"This was by far the worst Fridays I've ever been to.  I've been here a total of 3 times and I will never go back.  Food was not up to par for the chain, pretty sad actually.  Service was bad too.",https://www.yelp.com/biz/tgi-fridays-greensboro-2,1.76,1.76,1.76,,1.7600000000000002
11,Nancy V.,"Greensboro, NC",110,4,2.0,1.0,2017-09-24,"They took 20 mins to bring out our drinks, and we waited for more than 40 minutes for our food.",https://www.yelp.com/biz/tgi-fridays-greensboro-2,1.76,1.76,1.76,,1.7600000000000002
6,Vickie C.,"Greensboro, NC",103,38,26.0,4.0,2017-10-01,The husband and I had a belated birthday dinner Sat night.  There was no wait.  Our server was very sweet and made sure we were well taken care of. Our food came out quick and was very good.  We enjoyed ourselves and will return.,https://www.yelp.com/biz/tgi-fridays-greensboro-2,1.88,1.88,1.88,,1.88
0,Abry O.,"Greensboro, NC",115,16,,3.0,2017-10-30,I should give them a 1 star but since the food was so good I'll give them 3 stars. We got there and it was very crowded but there were open tables here and there so we were able to sit down as soon as we came in. The waitress came about 10 minutes after we sat down asked for our drink orders..me and my boyfriend both asked for a beer and she told us she didn't have it but she wanted to check so she went to ask the bartender and she came back and said she had the beer we wanted so we ordered that....took about 15 minutes just for her to come back and tell us she didn't have the beer so we got a different one instead. Took another 10 for her to bring the beers and our appetizer which didn't even come with the sauce it was suppose to come with....my boyfriend was having the hardest time getting her attention..she would wait on the table right beside of us but then would just completely ignore us and walk away. So I don't know if she was scatter brained or what. We got our food and it was DELICIOUS!!!!! No complaints on the food at all just the service. Would recommend this place when it's not so busy!,https://www.yelp.com/biz/tgi-fridays-greensboro-2,1.96,1.96,1.96,,1.96
5,Rebecca L.,"Franklin, OH",7,17,4.0,1.0,2017-11-07,"We were greeted right away by the hostest and when she took us to our table and we asked to move she accommodated us right away, but thats where the good review stops. When seated we had two waitresses greet us not knowing who was taking our order and the second that asked us seemed pissed at us. Our server was pushy and expected us to be ready to order within us being seated for a minute. She brought out my lava flow drink and it was flowing over everywhere and caused a mess. My husbands glass ran empty and had to ask for a refil twice before receiving one. Our waitress also didn't card me and yes i am legal but I am 22. She could have been giving a drink to a minor. When we did order she did not ask how i wanted my steak prepared and was not going to let me know that they were out of broccoli which was the default listed side.  Once the food was here it tasted flavorless and the cold slaw was over pickled and the parsley was not needed. My husband's mac burger was disgusting. The bacon if thats what you call it was barley even there with the two shriveled up peices and the fries were so under seaoned.",https://www.yelp.com/biz/tgi-fridays-greensboro-2,1.96,1.96,1.96,,1.96
1,Joe M.,"Yorba Linda, CA",16,5,1.0,1.0,2017-12-07,Terrible watered down drinks! Ordered margaritas with Patron and all tasted like water! Terrible will never go there again!,https://www.yelp.com/biz/tgi-fridays-greensboro-2,1.96,1.96,1.96,,1.96
2,Linda L.,"Austin, TX",0,17,2.0,2.0,2017-12-28,We waited forever for our food. The order came out wrong. The tables around remained dirty while employees walked by empty handed.,https://www.yelp.com/biz/tgi-fridays-greensboro-2,2.0,2.0,2.0,,2.0
