,Username,location,friend_count,review_count,photo_count,rating,date,review,Url,roll25,roll100,roll250,special_25,Final_Rating
244,Susanne M.,"Topeka, United States",37,124,66.0,4.0,2017-01-05,Cheesecake Factory is generally expensive and offers huge dishes!  I was able to sit outside on a gorgeous night. Drinks were good & strong.  Pasta was al dente & tossed in sauce without being Too much.  It was called mac & cheese but was more like vodka cream sauce. Service is good but slow movers in general.  I was in no hurry so it was nice.,https://nz.yelp.com/biz/the-cheesecake-factory-bridgewater?start=20,3.6,2.99,3.256,3.024,3.234
58,Bob P.,"Toms River, NJ",8,38,11.0,5.0,2017-01-10,The name says it all cheese cake factory has all the best cheese cakes so many to choose from always fresh and clean,https://www.yelp.com/biz/the-cheesecake-factory-bridgewater?start=40,3.64,2.99,3.26,3.0920000000000005,3.25
198,Deonna M.,"Kissimmee, United States",28,7,5.0,2.0,2017-01-10,Everything was Burnt today. I am so disappointed. Miguel is an awesome server very attentive and friendly.  He is the reason for the two stars otherwise I would have said zero.,https://nz.yelp.com/biz/the-cheesecake-factory-bridgewater,3.6,2.96,3.256,2.7280000000000006,3.216
26,Sheila R.,"Summit, NJ",109,288,1251.0,4.0,2017-01-28,"We had a very nice dinner during the week at the Bridgewater cheesecake factory. They have an excellent wine by the glass list, so we started with wine. For dinner, we both got the salads. Each was very different, but tasty. Huge portions of mixed greens were tossed with quinoa or super antioxidants!!! Delicious.  Overall, service was excellent and setting was very nice. Great option in the bridewater mall.",https://www.yelp.com/biz/the-cheesecake-factory-bridgewater,3.68,2.95,3.26,2.9600000000000004,3.242
77,Rich R.,"Belle Mead, Belle Mead, NJ",0,11,,5.0,2017-01-28,Excellent service and food.  Everything there was wonderful. My family enjoyed it. We will be going more often.  Kid friendly. Our server was so attentive to our children. A ++,https://www.yelp.com/biz/the-cheesecake-factory-bridgewater?start=60,3.84,2.99,3.26,2.9960000000000004,3.33
267,Rich R.,"Belle Mead, Belle Mead, United States",0,11,,5.0,2017-01-28,Excellent service and food.  Everything there was wonderful. My family enjoyed it. We will be going more often.  Kid friendly. Our server was so attentive to our children. A ++,https://nz.yelp.com/biz/the-cheesecake-factory-bridgewater?start=60,4.0,3.03,3.26,2.9000000000000004,3.418
196,Sheila R.,"Summit, United States",109,288,1251.0,4.0,2017-01-28,"We had a very nice dinner during the week at the Bridgewater cheesecake factory. They have an excellent wine by the glass list, so we started with wine. For dinner, we both got the salads. Each was very different, but tasty. Huge portions of mixed greens were tossed with quinoa or super antioxidants!!! Delicious.  Overall, service was excellent and setting was very nice. Great option in the bridewater mall.",https://nz.yelp.com/biz/the-cheesecake-factory-bridgewater,4.0,3.06,3.264,2.768,3.4360000000000004
38,S J.,"Summit, NJ",0,25,,1.0,2017-02-09,"Fried chicken was included in our ""vegetarian"" appetizer ...   we sent it back and the manager came over and said ""sorry mistakes happen""  After paying a tab over $100...   mistakes shouldn't happen and when it does at-least have the decency to offer a dessert on the house or a credit on the bill.    Attitude ruined our meal tonight!",https://www.yelp.com/biz/the-cheesecake-factory-bridgewater,3.88,3.06,3.256,2.5960000000000005,3.3880000000000003
205,Marc D.,"Allentown, United States",31,9,,2.0,2017-02-09,"Flies everywhere, tomatoes not fresh, just gross. I would not go back.  I am adding a bunch of extra words so that Yelp does not convert this to just a tip (hate that).",https://nz.yelp.com/biz/the-cheesecake-factory-bridgewater,3.8,3.07,3.252,2.6000000000000005,3.362
183,Terry W.,"Dunellen, NJ",42,54,15.0,3.0,2017-02-11,"I've never been to a Cheesecake Factory, but I received a gift card from someone and on a long work evening, I grabbed up my husband and we went to this location near our home. I loved the decor, very large but inviting. There was a wait of about 10 minutes for a 2 top and so we made our way to the bar to wait.  I ordered one of their new signature cocktails; cucumber mojito - it was very good and I appreciated the bar tender letting me know it was gin and not rum before making it for me.  I prefer gin, but it was nice he thought to ask.  We were buzzed and got our table. It took a bit for our waiter to show up and when he did he looked at our table and said ""oh, you got drinks already, I'll get some bread"" and walked away.  That was it! No hi, no do you have questions on the menu, have you been here before, welcome - nothing and then he was gone - for a good ten minutes! He came back and just seemed like he was bothered to even wait on us - had a bit of an attitude.  Asked for our order, we order the chicken pot stickers to share, I got the catfish and my husband got a combo of Steak Diane and shrimp.  He repeated the orders and my husband asked for a glass of the house cab as well - that seemed to throw him off.  He asked ""you want it now?"" Yes, yes he did. lol  He then repeated our order and left. The glass of wine and our appetizer was delivered by a runner.   The pot stickers were ok.  We love potstickers and I thought I would really like them, but the chicken was a bit heavy for the light potsticker shell and fell out on every bit and seemed thick and mushy.  The soy was good, over all, I wouldn't order them again, but they weren't terrible. Our meals came and the waiter again seemed pissed off to be there - the placed the dishes in front of us and I had to act quickly as he turned to ask if I could have some extra lemon - he had already turned and was walking away! No asking if we needed anything else, no words, nothing, *slam, here's your plates, goodbye*. He brought back a small cup of lemon slices for me but literally kind of slid it onto the table as he walked by.  My husband looked at me and said ""guess he's in a mad rush for the next tip he won't get"". The catfish was good, not great, but good.  The mashed potatoes were heavy and dry.  The green beans were so far overcooked they were shriveled up bits of blackened green on my plate.  I ate one, pushed them aside.  The country corn was nice, with a bacon-y flavor with a huge amount of corn silk in it. My husband ate his with little comment, he was hungry, but afterwards said it was just *ok*.   We thought to possible get some cheesecake, after all, that is the name of the place. Someone came and took our plates, and the next thing we know, our waiter is there with words! lol  He says ""want anything else?"" Wow.  What a salesman! My husband then says ""no, I think we'll pick up someone on the way out to go"".  He walks away, and comes back five minutes later to do his slide and run again, this time with the check. By that time I had my coat and and just wanted to leave - ever feel like you're not welcome some place? Yeah, that was the feeling.  We won't be back.  What a shame.",https://www.yelp.com/biz/the-cheesecake-factory-bridgewater?start=20,3.8,3.09,3.252,2.9240000000000004,3.374
210,Helen L.,"NJ, United States",2,130,,5.0,2017-02-18,"We had a gift card and decided to use it for lunch.   Our favorite has always been the Chicken and Shrimp Bang Bang.  I actually prefer their version over the local Thai restaurant.  Then I became vegan.......  However upon looking at their menu prior to going there, I was surprised they actually have Vegan Cobb Salad.  I hate that my options are usually just salads but this salad was amazing!!  Now if they would only make a vegan cheesecake!",https://nz.yelp.com/biz/the-cheesecake-factory-bridgewater?start=40,3.8,3.13,3.252,3.188,3.398
40,Helen L.,"NJ, NJ",2,130,,5.0,2017-02-18,"We had a gift card and decided to use it for lunch.   Our favorite has always been the Chicken and Shrimp Bang Bang.  I actually prefer their version over the local Thai restaurant.  Then I became vegan.......  However upon looking at their menu prior to going there, I was surprised they actually have Vegan Cobb Salad.  I hate that my options are usually just salads but this salad was amazing!!  Now if they would only make a vegan cheesecake!",https://www.yelp.com/biz/the-cheesecake-factory-bridgewater?start=40,3.84,3.16,3.252,3.156,3.4320000000000004
177,Ally P.,"Raritan, NJ",61,16,8.0,3.0,2017-02-27,"Be prepared to wait when coming here. Almost every time I have been to this Cheesecake Factory the time from ordering to receiving my meal has tipped on the side of too long. You should expect to be here for an hour at least.  That being said, Cheesecake Factory's food never seems to disappoint. There are options for every diet palate and need. My personal favorites are the Buffalo blasts and the Americana cheeseburger.",https://www.yelp.com/biz/the-cheesecake-factory-bridgewater?start=20,3.8,3.16,3.26,2.9240000000000004,3.4160000000000004
237,Ally P.,"Raritan, United States",61,16,8.0,3.0,2017-02-27,"Be prepared to wait when coming here. Almost every time I have been to this Cheesecake Factory the time from ordering to receiving my meal has tipped on the side of too long. You should expect to be here for an hour at least.  That being said, Cheesecake Factory's food never seems to disappoint. There are options for every diet palate and need. My personal favorites are the Buffalo blasts and the Americana cheeseburger.",https://nz.yelp.com/biz/the-cheesecake-factory-bridgewater?start=20,3.76,3.16,3.252,2.8600000000000003,3.4000000000000004
221,Kasia R.,"Bernards, United States",35,4,,1.0,2017-03-08,"Whenever I come to the bridgewater Cheesecake Factory I have to wait... wait to be seated, wait for drinks, and wait to be served a meal. I waited so long ( 45 minutes) I asked to have my meal packaged up so that I can go home and put my kid to bed..... no worth it. Next time I'll go to Somerville.",https://nz.yelp.com/biz/the-cheesecake-factory-bridgewater?start=40,3.68,3.14,3.236,2.6920000000000006,3.3560000000000008
200,Derek B.,"Old Bridge, United States",46,2,2.0,1.0,2017-03-12,They've messed up my order 4 times in the last year for pickup. So disorganized. Everyone there is just looking to have conversations and don't care about getting things right.,https://nz.yelp.com/biz/the-cheesecake-factory-bridgewater,3.6,3.13,3.228,2.8200000000000003,3.318
242,Tami B.,"Round Rock, United States",18,16,9.0,1.0,2017-03-18,"Completely awful visit. We checked in at 5:39, were told an hour and a half wait. It is now 7:52 and we are still waiting for a table. Every time we ask how much longer, we are told just a few more minutes. We could have taken our kids to another restaurant by now, but they kept saying just a few more minutes. This is utter nonsense.",https://nz.yelp.com/biz/the-cheesecake-factory-bridgewater?start=20,3.44,3.13,3.228,2.9480000000000004,3.254
182,Tami B.,"Round Rock, TX",18,16,9.0,1.0,2017-03-18,"Completely awful visit. We checked in at 5:39, were told an hour and a half wait. It is now 7:52 and we are still waiting for a table. Every time we ask how much longer, we are told just a few more minutes. We could have taken our kids to another restaurant by now, but they kept saying just a few more minutes. This is utter nonsense.",https://www.yelp.com/biz/the-cheesecake-factory-bridgewater?start=20,3.36,3.13,3.228,3.0760000000000005,3.222
49,Jacquelyn H.,"Phillipsburg, NJ",0,9,1.0,5.0,2017-03-20,"Don't listen to the bad reviews... Been here over a dozen times and it's always great. Food, service, drinks... Always perfect. On our most recent visit this past week our waiter, Max, was exceptional. I've never had such an amazing server in my life. Give that man a raise!!",https://www.yelp.com/biz/the-cheesecake-factory-bridgewater?start=40,3.44,3.13,3.232,3.508,3.254
219,Jacquelyn H.,"Phillipsburg, United States",0,9,1.0,5.0,2017-03-20,"Don't listen to the bad reviews... Been here over a dozen times and it's always great. Food, service, drinks... Always perfect. On our most recent visit this past week our waiter, Max, was exceptional. I've never had such an amazing server in my life. Give that man a raise!!",https://nz.yelp.com/biz/the-cheesecake-factory-bridgewater?start=40,3.48,3.13,3.236,3.604,3.27
73,Ingrid K.,"Doylestown, PA",13,1,,5.0,2017-04-01,"I was here last night and ordered 16 slices of cheesecake to go using my free slices you get when you buy gift cards on Black Friday. There was a long line at the bakery register. It was the last day before the free slices expired and the bakery was slammed! You would think they would be slightly annoyed or frustrated when I showed them the free slices on my phone ( I hadn't printed them because I thought they could scan them) because even though there's a barcode, they have to be entered manually. Instead, Dominick Rossi, the bakery manager stepped in and took me to a different register to let the line continue. He was gracious, kind, patient and understanding. Instead of feeling like I'd created so much extra work, under pressure, he made me feel like my business was truly appreciated! I left feeling like I had made a friend. I wish every place treated you like that! Not only is the cheesecake the best anywhere, the staff is the best too! Thank you Dominick!!!",https://www.yelp.com/biz/the-cheesecake-factory-bridgewater?start=60,3.52,3.14,3.24,3.4120000000000004,3.2920000000000007
224,Charles V.,"Raritan, United States",36,41,,5.0,2017-04-01,"They're very good, the only problem is that they're often crowded on the weekend so that there's a wait.  Their food is good though, and the service is outstanding.",https://nz.yelp.com/biz/the-cheesecake-factory-bridgewater?start=40,3.56,3.18,3.244,3.2840000000000003,3.3320000000000007
203,Peter V.,"Plainfield, United States",59,24,3.0,1.0,2017-04-09,"I ordered three entrees, an appetizer and a piece of cake, on the phone, for pickup. When II went to pick up the order I asked if there were three entrees and was told yes. When I got home I only found two entrees. When I called to relay this experience the woman who answered was very unapologetic. I don't recommend ordering  to go from this location.",https://nz.yelp.com/biz/the-cheesecake-factory-bridgewater,3.44,3.15,3.236,2.7560000000000002,3.266
171,Mohit T.,"Raritan, NJ",0,11,1.0,5.0,2017-04-09,"I visit this place almost once a month and I love it everytime. Have not been to other cheesecake factory but this one is a very nice place, staff is very welcoming and has good ambience. My personal favorites are Avocado egg rolls, Cashew chicken and Thai glazed salmon.",https://www.yelp.com/biz/the-cheesecake-factory-bridgewater?start=20,3.44,3.19,3.244,3.156,3.29
53,Todd K.,"Arlington, VA",18,1,,1.0,2017-04-09,"With a Toddler, on a weeknight, we waited 90 minutes for our food. And we didn't even get an apology from the waiter or management. It was the single worst restaurant experience I ever had. I'd be more inclined to donate money to see this branch close than go back.",https://www.yelp.com/biz/the-cheesecake-factory-bridgewater?start=40,3.28,3.15,3.232,2.6280000000000006,3.202
195,Natalie A.,"Clark, United States",50,205,460.0,3.0,2017-04-10,Only came to this Cheesecake Factory to do a pickup order of cheesecake. It was tucked into the back section of the mall but there was plenty of parking and even some to go spots that I was able to park in and run in.  My order was ready when I got there and customer service was great but I did find that the cheesecake at this location taste it different than others I have been to. Some of the cheesecake slices that I picked up we're also very tiny and cut smaller than usual. All in all the cheesecake was great but I think I prefer other locations better.  I had ordered the Hershey's chocolate cheesecake and the chocolate tasted a little different I'm wondering whether it was sitting out for over a day or if it was actually made differently I'm not sure if the cheesecakes are just shipped to the store directly so perhaps it was just old. I also picked up an Adams peanut butter cheesecake and the slice was almost half the size of the Hershey's chocolate cheesecake. It was sliced thinly and the end of the slice was falling apart.  Overall everything was good though.,https://nz.yelp.com/biz/the-cheesecake-factory-bridgewater,3.24,3.13,3.228,2.9560000000000004,3.174
37,Cody O.,"Hillsborough Township, NJ",141,145,208.0,3.0,2017-04-18,"Cheesecake Factory has some quality food and a huge variety.  You may have to wait quite a while before getting a table because this spot is extremely popular. The cocktails are fresh and flavorful.Their entrees are always delicious and the burger I got was cooked to my specifications and came with a side of delicious french fries. The cheesecake is tremendous but it seemed as if they had not prepared enough of each variety as several members of our party had to change their order because they hadn't defrosted any of the kind they wanted. Overall, I had a positive experience, I just wish they had defrosted more of the cheesecakes so that the people I enjoyed dinner with could have had their first pick.",https://www.yelp.com/biz/the-cheesecake-factory-bridgewater,3.16,3.15,3.228,3.0200000000000005,3.154
207,Cody O.,"Hillsborough Township, United States",141,145,208.0,3.0,2017-04-18,"Cheesecake Factory has some quality food and a huge variety.  You may have to wait quite a while before getting a table because this spot is extremely popular. The cocktails are fresh and flavorful.Their entrees are always delicious and the burger I got was cooked to my specifications and came with a side of delicious french fries. The cheesecake is tremendous but it seemed as if they had not prepared enough of each variety as several members of our party had to change their order because they hadn't defrosted any of the kind they wanted. Overall, I had a positive experience, I just wish they had defrosted more of the cheesecakes so that the people I enjoyed dinner with could have had their first pick.",https://nz.yelp.com/biz/the-cheesecake-factory-bridgewater,3.2,3.13,3.232,2.9560000000000004,3.158
179,Brandan H.,"NJ, NJ",31,2,,2.0,2017-04-23,"I have been here multiple times as a sit down customer and over the phone orders and since my first time here the service and wait time have gotten worse every visit. Very popular place so I can understand a wait to sit down and eat however the last two times I've placed food orders to go, I've waited a combine time of a half hour JUST TO ORDER OVER THE PHONE. I have no idea what happened to this place but I don't think I'll go back. Food is amazing, but the wait makes you realise you'd have eaten, had drinks and been home going to Fridays compared to even getting apps here.",https://www.yelp.com/biz/the-cheesecake-factory-bridgewater?start=20,3.12,3.14,3.228,2.8560000000000003,3.1320000000000006
239,Brandan H.,"NJ, United States",31,2,,2.0,2017-04-23,"I have been here multiple times as a sit down customer and over the phone orders and since my first time here the service and wait time have gotten worse every visit. Very popular place so I can understand a wait to sit down and eat however the last two times I've placed food orders to go, I've waited a combine time of a half hour JUST TO ORDER OVER THE PHONE. I have no idea what happened to this place but I don't think I'll go back. Food is amazing, but the wait makes you realise you'd have eaten, had drinks and been home going to Fridays compared to even getting apps here.",https://nz.yelp.com/biz/the-cheesecake-factory-bridgewater?start=20,3.0,3.15,3.224,2.8880000000000003,3.09
184,Susanne M.,"Topeka, KS",37,124,66.0,4.0,2017-05-01,Cheesecake Factory is generally expensive and offers huge dishes!  I was able to sit outside on a gorgeous night. Drinks were good & strong.  Pasta was al dente & tossed in sauce without being Too much.  It was called mac & cheese but was more like vodka cream sauce. Service is good but slow movers in general.  I was in no hurry so it was nice.,https://www.yelp.com/biz/the-cheesecake-factory-bridgewater?start=20,2.96,3.14,3.236,3.088,3.0680000000000005
230,Ramon A.,"Somerset, United States",87,87,117.0,5.0,2017-05-15,"After a long morning and some shopping at the mall decided to have a late lunch here.   It was pretty busy but we know it would be like that so we put our name on the list while still having one more stop at the mall so that we would just not be waiting there. The standard at this chain is better than any other american themed restaurant.  We had the chicken samosas and loaded baked potato tots for appetizers, the samosas were small but good and the tots were simple great, they had bacon and cheese ... do I need to say more.  For lunch we had the Thai coconut-lime chicken and lemon garlic.  My wife enjoyed her shrimp and I was blown away with the Thai coconut-lime chicken.  Definitely a repeat.",https://nz.yelp.com/biz/the-cheesecake-factory-bridgewater?start=20,3.0,3.16,3.236,2.9640000000000004,3.0960000000000005
170,Ramon A.,"Somerset, NJ",87,87,117.0,5.0,2017-05-15,"After a long morning and some shopping at the mall decided to have a late lunch here.   It was pretty busy but we know it would be like that so we put our name on the list while still having one more stop at the mall so that we would just not be waiting there. The standard at this chain is better than any other american themed restaurant.  We had the chicken samosas and loaded baked potato tots for appetizers, the samosas were small but good and the tots were simple great, they had bacon and cheese ... do I need to say more.  For lunch we had the Thai coconut-lime chicken and lemon garlic.  My wife enjoyed her shrimp and I was blown away with the Thai coconut-lime chicken.  Definitely a repeat.",https://www.yelp.com/biz/the-cheesecake-factory-bridgewater?start=20,3.16,3.19,3.236,3.0920000000000005,3.178
245,Edward C.,"Warren, United States",471,12,1.0,5.0,2017-05-27,Cheese cake is bombingly delicious! Definitely worth going! Always crowded at night time means it's Waldo's has great business!,https://nz.yelp.com/biz/the-cheesecake-factory-bridgewater?start=20,3.28,3.22,3.244,2.9640000000000004,3.2440000000000007
185,Edward C.,"Warren, NJ",471,12,1.0,5.0,2017-05-27,Cheese cake is bombingly delicious! Definitely worth going! Always crowded at night time means it's Waldo's has great business!,https://www.yelp.com/biz/the-cheesecake-factory-bridgewater?start=20,3.36,3.24,3.248,2.836,3.2880000000000007
255,Gabe R.,"Manville, United States",181,14,,4.0,2017-05-29,"Good food, but kind of expensive. It's not over the top expensive, just be prepared for a little ouch when you get the check. It's worth it though - friendly staff, well-made food, the place is busy for good reason and I'll definitely be back",https://nz.yelp.com/biz/the-cheesecake-factory-bridgewater?start=60,3.32,3.25,3.248,2.7039999999999997,3.278
65,Gabe R.,"Manville, NJ",181,14,,4.0,2017-05-29,"Good food, but kind of expensive. It's not over the top expensive, just be prepared for a little ouch when you get the check. It's worth it though - friendly staff, well-made food, the place is busy for good reason and I'll definitely be back",https://www.yelp.com/biz/the-cheesecake-factory-bridgewater?start=60,3.28,3.28,3.252,2.7039999999999997,3.2800000000000002
246,Sara M.,"Plainfield, United States",0,2,,1.0,2017-06-08,Absolutely horrible. Brought my cousin here to celebrate her birthday. The waiter took 30 min to get our drinks. Our food came out before the drinks did. Then I asked the waiter to do a happy birthday candle with the Cheesecake. Never did it. If I could give this place 0 stars I would.,https://nz.yelp.com/biz/the-cheesecake-factory-bridgewater?start=20,3.2,3.28,3.244,2.404,3.2480000000000007
236,Diana C.,"Frenchtown, United States",0,13,2.0,4.0,2017-06-11,"I only go so often because the food is always great. I have my signature dish and it's always my go-to, the Skinnylicious Chicken Pasta. Hey, I know I could make it at home, but going out is so much more fun. The service is iffy, depends on your waiter and what night you go. Don't expect to go on a Friday or Saturday night and be seated immediately; I've had to wait 45 minutes. Bread is always endless and awesome, and the ranch dressing is the best I've ever had, and probably one of the highlights of my visits. I usually love this place.",https://nz.yelp.com/biz/the-cheesecake-factory-bridgewater?start=20,3.24,3.3,3.244,2.8000000000000003,3.2760000000000007
57,Sarah K.,"New Brunswick, NJ",62,5,,5.0,2017-06-22,"This is by far one of my favorite restaurants, especially the one at this location. The service is always amazing, and the food always tasted great. The only issue is that every time I've came here I've had to wait, but everything else about the restaurant overpowers that.",https://www.yelp.com/biz/the-cheesecake-factory-bridgewater?start=40,3.4,3.34,3.248,2.836,3.3640000000000003
227,Sarah K.,"New Brunswick, United States",62,5,,5.0,2017-06-22,"This is by far one of my favorite restaurants, especially the one at this location. The service is always amazing, and the food always tasted great. The only issue is that every time I've came here I've had to wait, but everything else about the restaurant overpowers that.",https://nz.yelp.com/biz/the-cheesecake-factory-bridgewater?start=40,3.56,3.38,3.256,2.836,3.4520000000000004
