,Username,location,friend_count,review_count,photo_count,rating,date,review,Url,roll25,roll100,roll250,special_25,Final_Rating
214,Domain D.,"Frisco, TX",394,76,653.0,2.0,2012-01-17,"This place is really nice, the items I've tried were terrific as well. But the star is the dessert selections. Although, everything else is decent but not a big WOW to wanna run back too.",https://www.yelp.com/biz/the-cheesecake-factory-frisco?start=220,3.4,3.4,3.4,3.3040000000000003,3.4000000000000004
213,Preston M.,"Dallas, TX",229,151,27.0,4.0,2012-01-25,"After a few hours in the mall, nothing is better for the soul than cheesecake. Our server had an interesting communication style that was slightly awkward, but that certainly didn't take away from the fact that he was friendly, fast, and made sure we had plenty of water and tea. We started with our personal favorite, the fried macaroni and cheese. So delicious. I could just eat these all day instead of actual food. Because it was lunch and I wasn't in the mood for too much food, I got the lunch pizza and a Caesar salad. I opted for the white pizza, which is covered in delicious white cheese and spinach. It was good, and there was enough that I took some home and had a good snack the next day. We did have to wait for quite a while to be seated, but it was Sunday at around 1:30-2:00, so it was going to be pretty packed.  We finished the meal with some white macadamia nut cheesecake, which is exactly as delicious as it sounds.",https://www.yelp.com/biz/the-cheesecake-factory-frisco?start=220,3.4,3.4,3.4,3.504,3.4000000000000004
187,Brandi G.,"Longview, TX",33,28,23.0,4.0,2012-03-02,This is by far my favorite place to eat in Frisco. The fried zucchini is the best. Period. We are big fans of the Fettuccine Alfredo and the Fish and Chips. In fact- I haven't had anything here that was bad. It's all good. Nothing disappoints! The only reason I took a star away is the seating here is horrendous. There is just my husband and I and they constantly try and sit us in the middle seats where you are stuck listening to everyone else conversation. They don't ask if you prefer table or booth. They just assume you are okay with sitting there.,https://www.yelp.com/biz/the-cheesecake-factory-frisco?start=240,3.4,3.4,3.4,3.472,3.4000000000000004
284,Bryce F.,"Pleasant Hill, CA",23,250,11.0,4.0,2012-04-17,"The service at this location was a tad below par for this chain, but the food quality met my high expectations.",https://www.yelp.com/biz/the-cheesecake-factory-frisco?start=280,3.4,3.4,3.4,3.472,3.4000000000000004
283,Faz I.,"Plano, TX",26,91,9.0,5.0,2012-04-28,This place has Fat Tire on draft!  Dee lish.,https://www.yelp.com/biz/the-cheesecake-factory-frisco?start=280,3.48,3.48,3.48,3.572,3.4800000000000004
182,Nicole A.,"Dallas, TX",229,147,4.0,4.0,2012-06-05,"My mom and little sister were in town and we made a trip to Ikea, shopping/walking through Ikea can make you hungry so we decided to to treat ourselves to some lunch at the nearby Cheesecake Factory. The menu is huge!  Lots of delicious food to choose from.  All of our meals were great.  Our server seemed new but she did a great job at taking care of us. The only thing that we did not really like was that when they box up your food to go, they take it out of your sight... could that be done at the table? We all split a red velvet cheesecake afterwards and oh my goodness... soo good! Everyone should experience the grandness of the Cheesecake factory at least once.",https://www.yelp.com/biz/the-cheesecake-factory-frisco?start=240,3.48,3.48,3.48,3.472,3.4800000000000004
226,lisa s.,"Rowlett, TX",21,87,26.0,5.0,2012-06-07,"So love Cheesecake Factory!  My favorite is the Southwest Eggrolls and the Thai Lettuce Wraps followed up with a piece of Red Velvet Cheesecake and a cup of their awesome coffee. Always great service, friendly staff and clean surroundings.  I think the Northpark and Allen locations are the very best though!",https://www.yelp.com/biz/the-cheesecake-factory-frisco?start=260,3.52,3.52,3.52,3.508,3.5200000000000005
219,Miss V.,"Dallas, TX",5,99,20.0,4.0,2012-06-22,"I'm a big fan of The Cheesecake Factory because their salads are huge, and I like their brown soda bread. A few tips: --Did not like the Vietnamese Tacos appetizer --their beet and goat cheese salad appetizer is good for someone with a small appetite and priced nicely at around $5. --I didn't realize this until a waiter gave me the stink eye but waiters split their tips with support staff, so I think they only get to keep like 60% of it. Normally I tip really well, but this one particular time I only tipped like 13% despite good service because I was confused about TX tax rate versus CA tax rate which is closer to 10%. Anyway, it made me feel kind of bad because he got a $7 tip for a really easy table that was gone in 40 minutes. That kind of left a bad taste in my mouth.",https://www.yelp.com/biz/the-cheesecake-factory-frisco?start=220,3.6,3.6,3.6,3.3440000000000003,3.6000000000000005
174,J P.,"Dallas, TX",48,21,46.0,5.0,2012-06-25,"Always a good place to go for dinner. Did not have to wait to be seated and the server came over right away. Our server was Raven. She was very attentive and sweet. I ordered the Parmesan Crusted Romano and it was delicious! The food was brought out quickly and was nice and hot.   The server refilled our drinks as soon as they were low. I ordered a Oreo Cheesecake Togo and it was amazing as always!! Top Cheesecakes are: Kahlua Cocoa Cheesecake White Chocolate Caramel Macadamia  and Hersheys Chocolate Bar Top Drinks are  Red Raspberry Martini Typhoon Punch This is a location in a mall but has a great patio to sit and enjoy dinner outside. There is also valet downstairs for the desirables. lol Clean Bathrooms and restaurant so A+ on that!  All in all, Great Place to eat and awesome atmosphere!",https://www.yelp.com/biz/the-cheesecake-factory-frisco?start=180,3.64,3.64,3.64,3.3480000000000003,3.6400000000000006
235,Rob M.,"Frisco, TX",69,225,2.0,4.0,2012-06-25,"We had a nice time all around, atmosphere, our waitress, and the food were all great.  They do try to pay attention to the details here.  Considering this location is at a mall I was expecting less, but I left impressed.",https://www.yelp.com/biz/the-cheesecake-factory-frisco?start=260,3.64,3.64,3.64,3.12,3.6400000000000006
258,Sarah H.,"Plano, TX",7,35,25.0,5.0,2012-07-18,"Perfect date night. The atmosphere is very romantic and classy for night-time with candle light. I have always loved Cheesecake Factory, and this is a nice location. Clean, quick service and nice. There is typically not a wait for the table unless it's dinnertime on the weekends.. ((Which is maybe 5 minutes.))   I love that my water is always refilled and they offer to sprinkle parmesan cheese on our dishes. Nice touch! Free bread as appetizer and it has been warm and delicious every time I have visited Cheesecake Factory Frisco. Note: SAVE ROOM FOR DESSERT. I make this mistake every time- I fill up on dinner and forget what Cheesecake Factory is known for.. the cheesecake. Save room for dessert!   Favorites on the Menu: Herb Crusted Salmon paired with the Steak because it is DELICIOUS and a nice portion. I can split with my husband no problem. The mashed potatoes are AMAZING and asparagus is ok. Plenty of food there and a nice bang for your buck. Pizza!!! Surprisingly the pizza here is absolutely delicious. It was not my first choice to order but my son loves pizza so I had a bite of his. WOW. THAT WAS GOOD! I have tried the pepperoni and also the veggie. The pizza is a thin crust style with flavorful cheeses and sauce. So great Cheesecake Factory I am impressed.  So-So dishes are the salads..  Cheesecakes: The cheesecakes are divine. GIANT! You get your $$ worth. You cannot go wrong ordering any of these. They come with thick whipped cream topping which I love to add to my coffee.  Cheesecake favorite is the Godiva Dark Chocolate. Makes my mouth water just typing that. HA! Warning. This is a VERY rich cheesecake. I could only handle about 3 bites and had to take the rest to go.  White Chocolate Raspberry Truffle is heavenly!!",https://www.yelp.com/biz/the-cheesecake-factory-frisco?start=200,3.68,3.68,3.68,3.22,3.6800000000000006
200,Marcia G.,"Canoga Park, Los Angeles, CA",45,242,150.0,5.0,2012-07-19,"Can never go wrong with Cheesecake Factory. The menu is so diverse, there is something for everyone and the service is always great!",https://www.yelp.com/biz/the-cheesecake-factory-frisco?start=220,3.72,3.72,3.72,3.124,3.7200000000000006
232,Saurabh S.,"Modesto, CA",22,68,2.0,4.0,2012-08-30,As good as any other cheesecake factory. This one had no wait. The food was good and heavy. The floors are slippery just like all the other cheesecake factories.,https://www.yelp.com/biz/the-cheesecake-factory-frisco?start=260,3.84,3.84,3.84,2.9600000000000004,3.84
259,Christopher M.,"Little Elm, TX",10,65,74.0,2.0,2012-09-23,Normally I would give this place 5 stars.  However after being told the wait for 3 people would be 40 minutes and it ended up being well over an hour.  Couple that with the sauce on the Herb Crusted Salmon not being right I just can't justify it this time.  Not to mention they didn't even offer to take the two salmons that we didn't eat off the bill.  Cheesecake Factory you let me down!,https://www.yelp.com/biz/the-cheesecake-factory-frisco?start=200,3.76,3.76,3.76,2.7600000000000007,3.76
237,Mike G.,"Frisco, TX",2,105,11.0,5.0,2012-09-28,"Other than the fact that you're likely to wait, you really can't go wrong with this place. If you can't find something in their phonebook-sized menu that appeals to you, you probably shouldn't eat out. And of course, save room for their cheesecakes and other desserts. Afterall, that's why you're going there in the first place, right?",https://www.yelp.com/biz/the-cheesecake-factory-frisco?start=260,3.8,3.8,3.8,3.0280000000000005,3.8
230,Jennifer H.,"Chicago, IL",3,125,126.0,2.0,2012-10-10,"You will almost always have to wait, though there's often a free seat at the bar. The bar and high top tables are self-seating. The selection of food is VAST and the quality is alright. I think the servers do the best they can, but I always seem to be there when my server is overwhelmed.",https://www.yelp.com/biz/the-cheesecake-factory-frisco?start=260,3.72,3.72,3.72,2.6960000000000006,3.7200000000000006
233,Scott F.,"Keller, TX",16,105,,4.0,2012-10-12,Huge Portions so prepare to take food home. Be sure to get there early on the weekends as there tends to be a wait. Good service for the most part too.,https://www.yelp.com/biz/the-cheesecake-factory-frisco?start=260,3.72,3.72,3.72,2.8640000000000003,3.7200000000000006
217,Owen M.,"Fort Worth, TX",125,23,23.0,2.0,2012-10-23,"The Cheesecake Factory does not live up to the expectation and the hype, as well as the price. I was let down by almost every major aspect.  The environment is great, for the most part. We where sat at a table that was just too close for comfort to the tables next to us.  The menu is huge, a staggering 21 pages of choice. On top of that, it has advertisements scattered throughout.  I ordered the BBQ pulled pork sandwich, it came with coleslaw and French fries. A standard request. It all came out delicious, except the pork. It wasn't just smothered in BBQ sauce, it was like a sloppy joe. It just wasn't good.  Overall a bad first experience for me, the only thing that could possibly convince me to come back, is how the server handled everything. He was on top of trying to get me something new to eat, and apologized for our table.",https://www.yelp.com/biz/the-cheesecake-factory-frisco?start=220,3.6,3.6,3.6,2.6000000000000005,3.6000000000000005
149,Chris L.,"Dallas, TX",194,878,245.0,3.0,2012-10-29,Had a drink and the chocolate cheese cake here. The cheesecake was tasty yet the texture was not so good. It was frozen like a brick. I've had much better cheese cake elsewhere. I was hoping for the texture to be more velvety. The chocolate was rich and good though. We wanted to get dinner here but the wait was way too long. They also don't offer reservations.,https://www.yelp.com/biz/the-cheesecake-factory-frisco?start=160,3.52,3.52,3.52,2.732,3.5200000000000005
231,MICHAEL M.,"Richardson, TX",16,55,15.0,4.0,2012-11-01,"all cheesecake factory's are all the same when it comes down to it.   however that is not a bad thing, the food is great plus the cheese cake is OUTSTANDING!!!",https://www.yelp.com/biz/the-cheesecake-factory-frisco?start=260,3.56,3.56,3.56,2.8640000000000003,3.5600000000000005
240,David N.,"Denton, TX",39,47,55.0,4.0,2012-11-18,"Good service, staff is good at handling the large crowds that come in from Stonebriar mall. You can valet your vehicle downstairs for free if you bring your Cheese Cake Factory receipt back to the valet stand when your done. Otherwise its $7 + Tip. (that's not bad at all anyways). Good quality food, well prepared, enormous servings. I had the Chicken Burrito Grande and it was huge (I had to take half of it home). I added the picture so you can see for yourself. Over all it was a very good experience.",https://www.yelp.com/biz/the-cheesecake-factory-frisco?start=200,3.64,3.64,3.64,2.8640000000000003,3.6400000000000006
225,Jessica S.,"Houston, TX",14,37,,3.0,2012-11-23,We went on a saturday night and sat by the bar area. Service was bad and he didnt even clean the table off after he said he would return to do it. He even left the waters from the previous couple.  The young girl at the bar was kind enough to check on us even tho this wasnt her area.,https://www.yelp.com/biz/the-cheesecake-factory-frisco?start=260,3.72,3.72,3.72,2.7640000000000002,3.7200000000000006
146,Myia B.,"Dallas, TX",502,698,850.0,4.0,2013-01-13,"If you've visited one Cheesecake Factory, then this one will be no different.  If you haven't been to Cheesecake Factory...then the run down: Huge Menu: there's likely something on it that everyone would like. Favorites: Chicken Carbonara, Jumbalaya Pasta, Meatloaf and Mashed Potatoes, Wedge Salad, Bang Bang Chicken and Shrimp, Oreo Cheesecake, Original Cheesecake. Twisted Salted Caramel Pretzel Spiked Milkshake is yummy (it is also around $10) Entire menu is served all day including breakfast items.",https://www.yelp.com/biz/the-cheesecake-factory-frisco?start=160,3.76,3.76,3.76,2.9280000000000004,3.76
300,Chris R.,"Carrollton, TX",0,1,,5.0,2013-01-23,The pecan crusted catfish and the potato succotash was the best meal I've had in five years. Thanks,https://www.yelp.com/biz/the-cheesecake-factory-frisco?start=300,3.8,3.8,3.8,3.0600000000000005,3.8
288,I W.,"Dallas, TX",0,338,590.0,4.0,2013-01-28,"I stopped in for Sunday lunch with a friend. The restaurant was busy and there was a wait but it wasn't too bad. Our waiter was prompt and attentive, the food was good and our tab was reasonable. No complaints.",https://www.yelp.com/biz/the-cheesecake-factory-frisco?start=280,3.88,3.88,3.88,2.9600000000000004,3.88
205,Michael K.,"Plano, TX",18,234,55.0,2.0,2013-02-02,"The food choices I make are unavailable.  Really, no seared tuna at 7PM on a Friday? What, ten minutes to get a straw? You have a runner, you have a busser, why can't a simple iced tea be refilled?  Why can't you check on your tables after the food is served? Huhh? No salsa of some sort for fish tacos? Jeez,  Taco Bell can do better ;-)  (Actually I don't know that, I ve never been!)",https://www.yelp.com/biz/the-cheesecake-factory-frisco?start=220,3.88,3.88,3.88,2.7280000000000006,3.88
247,Quest S.,"Dallas, TX",748,154,93.0,3.0,2013-02-08,"This is one of the more consistent restaurants I've ever been to. It's been a staple for me for over a decade.  Although I've eaten here at least a hundred times, this review is based on this visit only. We arrived at 8:30 and only waited 15 minutes, which is awesome for Friday night anywhere. They seated us in the side room. I despise the side room. It always feels like amateur hour, but our waitress was very prompt, and pleasant.  We started w/ the FRIED MAC-N-CHEESE (A).  For my entree I ordered the SHRIMP AND BACON CLUB (B-). (+) For the most part, the food was good. The fried macaroni and cheese has nvr been bad. And the service was accurate to the expectation. (-) The fries here are always sub-par. The ranch was thinner than usual, and had a hint of sweetness. And the shrimp on the club was waaay over cooked. They didn't even come close. Taste: 8 Quality: 7.5 Presentation: 7.5 Service: 8 Cleanliness: 9 Aesthetics: 8 Comparative: 7 OVERALL: 7.86 (C+) If it weren't so extremely dim in there, I would've taken a picture of my food. Just for kicks. We all know what the food at the Cheesecake Factory looks like.",https://www.yelp.com/biz/the-cheesecake-factory-frisco?start=200,3.84,3.84,3.84,2.7960000000000003,3.84
229,Adriana M.,"Richardson, TX",42,51,5.0,4.0,2013-02-09,Great place to get just about anything you want. The white chocolate raspberry cheesecake is the fluffiest one on the menu. Definitely their menu items are sharable.,https://www.yelp.com/biz/the-cheesecake-factory-frisco?start=260,3.84,3.84,3.84,2.9280000000000004,3.84
257,Dominic C.,"Flower Mound, TX",283,851,169.0,4.0,2013-02-13,I loved the miso salmon.  Probably get the same thing at least one more time before trying something new.,https://www.yelp.com/biz/the-cheesecake-factory-frisco?start=200,3.84,3.84,3.84,2.8640000000000003,3.84
153,Kristen D.,"Plano, TX",189,561,79.0,5.0,2013-02-15,"I am in LOVE with cheesecake factory.  They have so many menu choices.  I love that I can order a smaller portion and not feel like I am getting ripped off by the price point.    Their lunch and dinner portions are very big, so plenty for sharing.  Two of my favorite things are the spicy pasta dish and the orange chicken.  They also have fantastic chop salads, mexican salad and greek salad.  They also have a BIG skinny menu which is super nice for all of you weight watchers.  The service is always top notch.  If you dont like something, they have no problems getting you something else. (this has only happened once) The waiters check on you plenty, offer to go cups and always share with you their favorite dessert. I do not like cheesecake at all, but like I said I have recently fallen in LOVE with Cheesecake Factory and there are two cheesecakes I will eat: the Oreo Dream and Chris' Outrageous. INCREDIBLE!!!",https://www.yelp.com/biz/the-cheesecake-factory-frisco?start=160,3.84,3.84,3.84,2.9960000000000004,3.84
228,Jennifer B.,"Frisco, TX",73,224,1.0,2.0,2013-02-23,"I love Cheesecake Factory, but this location is not very good. I actually think the problem seems to lie with the managers. The staff (hosts/servers) seem unhappy and their work reflects this. I used to order the Lousiana Chicken Pasta, but it was never prepared consistently so I stopped ordering it. I moved onto the Crispy Chicken Costelleta...meh...chicken was always too well done. Now I am to the point where I will only go on a Sunday, and the only safe dish is the potato soup. Cheesecake (any flavor) is safe, but it is pre-prepared, so impossible for even this location to mess up.",https://www.yelp.com/biz/the-cheesecake-factory-frisco?start=260,3.76,3.76,3.76,2.6640000000000006,3.76
236,Chris F.,"Addison, TX",1,25,,3.0,2013-03-04,"Maybe not the best place to have lunch... how can you possibly consider everything in the Encyclopedia Brittanica of a menu they have, narrow down options, order, eat and leave within an hour? Not happening. I had to get it to go. But it was a good kobe burger...",https://www.yelp.com/biz/the-cheesecake-factory-frisco?start=260,3.68,3.68,3.68,2.8280000000000003,3.6800000000000006
245,Jill V.,"Dallas, TX",525,4,,1.0,2013-03-14,I have been going to Cheesecake for many years - usually 3-4 times per month.  I always loved their food - however - I was very disappointed with the Steak Diane - I had this dish over 30 times - the steak is always tender and juicy. I had this a few days ago - and I could barely eat the steak - it was so tough - I thought maybe I just a few bad pieces - took it home and next day - it felt like flank steak or something - my husband also said it was bad...... It was not overcooked at all - got it medium rare - which it should really be tender. I wonder if Cheesecake is switching to a poor grade of beef - to counter the sourcing food costs...... I would rather a smaller amount of meat -but the way they had it before...... I doubt I will order this again - sadly !,https://www.yelp.com/biz/the-cheesecake-factory-frisco?start=200,3.56,3.56,3.56,2.5640000000000005,3.5600000000000005
199,Kevin O.,"Bolton, CT",2,20,3.0,1.0,2013-03-24,"Server delivered my girlfriends food cold, five minutes later I got my steak which was nothing but fat. Horrible service.",https://www.yelp.com/biz/the-cheesecake-factory-frisco?start=240,3.4,3.4,3.4,2.6600000000000006,3.4000000000000004
223,Chad F.,"Garland, TX",61,100,42.0,4.0,2013-05-28,"Pricey but good food.  Love, love, LOVE the Oreo Cheesecake.",https://www.yelp.com/biz/the-cheesecake-factory-frisco?start=260,3.4,3.4,3.4,3.088,3.4000000000000004
252,Miranda J.,"Frisco, TX",84,151,27.0,2.0,2013-06-14,"As with all Cheesecake Factories, it's very easy to be forgotten about and bumped around with the mall rush.  For the price, the food just isn't that good. Way, way, wayyyyy to many choices. With such a variety, how can everything be of good quality that is clearly shown the right amount of attention? It can't. The cheesecake is just about the only thing to write home about, and that's not too hard to master in my mind.  Even the service is rushed, there are so many employees running around it's hard to ever get your servers attention and it never ever feels like a personal experience, rather someone to fill the booth and pay the check until the next butts can slide in.  It will fill you up...that's about it.",https://www.yelp.com/biz/the-cheesecake-factory-frisco?start=200,3.28,3.28,3.28,2.8240000000000003,3.2800000000000002
117,Diana N.,"Houston, TX",481,314,462.0,3.0,2013-06-19,"Last minute decision to stop by The Cheesecake Factory to watch the game last night because Third Base had an hour wait. The service was excellent. Our server (and the bartender) was laid back and easy to deal with and we got out order pretty quickly. He started getting pretty busy in the fourth quarter and more guests was coming in so we had to wait a bit for our check which is understandable.  The food was standard. I notice a lot of reviews mentioned the Thai Lettuce Wraps was delicious. I didn't think they were THAT great... I prefer P. F. Chang's any day of the week. The small tapas beet and goat cheese salad was great. The other tapas apps were pretty good and small sized; perfect for us since we always over order. The BBQ pizza was kinda blah. Not what I had expected. The tiramisu and cherry cheesecake was a hit, but we couldn't finish it all because we were so stuffed. A bit on a pricey side, but the dishes are big enough to take home and heat up for lunch. Very convenient location, right outside the Stonebriar mall.",https://www.yelp.com/biz/the-cheesecake-factory-frisco?start=140,3.2,3.2,3.2,2.9560000000000004,3.2000000000000006
186,Pam D.,"Frisco, TX",3,62,4.0,4.0,2013-06-24,"I enjoy coming here for a nice environment, knowing that I will have great service, and lots to choose from-- although I have noticed I order the same 5 dishes over and over again, but the opportunity is there to shake it up a bit.  The thai lettuce wraps are my favorite when I want to go healthy. I can usually get 2-3 meals out of this. I prefer Cheesecake Factory (CF) over PF Chang. CF's wraps are made with whole pieces of chicken...you know you are getting real whole chicken. PF Chang's is made from ground chicken-- which means you don't know what else is in it. My friend confirmed it when he told me that when he worked at PF Chang's they would put whole chunks of fat and left over chicken parts in the meat grinder to make the dish.  I also like the white bean chicken chili. It is spicy and filling. Perfect for the fall and winter. Unfortunately, this isn't as big of a serving as their other dishes. I will usually eat this in one sitting with just a tiny bit left over... too tiny to ask for a to-go container. I am not a big cheesecake eater, but the dulce de leche cheesecake is awesome and doesn't taste like cheesecake. It tastes like silky caramel. I also like the Chris' Outragous Chocolate Cake but it is so rich that I can't have more than a few bites. For babies, they will bring out a free baby plate with slices of their bread and slices of bananas. Sometimes they will bring it out on their own, sometimes you have to ask for it. This is awesome because me a chance to get settled in and look over the menu. If I could change one thing, it's the sticky and many times slick floors. It seems like there is always a layer of grease, sauce, or something on the floor and I have to be careful when I walk to make sure I don't slip. Try doing that while holding a baby, holding another kid's hand, having a diaper bag slung over your shoulder with a purse on top of it.",https://www.yelp.com/biz/the-cheesecake-factory-frisco?start=240,3.2,3.2,3.2,3.024,3.2000000000000006
