,Username,location,friend_count,review_count,photo_count,rating,date,review,Url,roll25,roll100,roll250,special_25,Final_Rating
41,Katina D.,"Dallas, TX",308,207,928.0,4.0,2015-11-20,"It's almost been 8 years since I've been here and nothing has changed at all. The only thing that changed is that they offer a ""healthy menu"" which includes many low calorie options for those who are choosing a healthier lifestyle. The healthy menu included drinks, appetizers, entrees, and dessert with the amount of calories next it.  The customer service is great as well.  I ordered the ""Skinnylicious chicken pasta"" which was surprisingly good for it being only being 540 calories. I was very satisfied with the good decision that I decided to make which later took a toll. I ordered the Smores' Cheesecake and the Oreo Cheesecake (I was sharing so don't worry lol). The Oreo cheesecake was absolutely amazing and I STRONGLY recommend everyone to try it if you're indecisive. You wont regret it! The Oreo Cheesecake contained a great combination of texture (from the actual cookie) and the cheesecake itself. It was the best 5 minutes of my life! The smore's cheesecake was too rich for me and I honestly couldn't differentiate between the melted marshmallow and white cream. I enjoyed it as well but my go-to would be the Oreo choice.  Overall: Honestly, I'm not a big fan of a big chained restaurant but I became a fan of The Cheesecake Factory after consuming the Oreo Cheesecake.  You will FOR SURE see me back here! YUM-O!!!!",https://www.yelp.com/biz/the-cheesecake-factory-frisco?start=40,3.36,3.35,3.35,3.088,3.354
63,Krystle S.,"Frisco, TX",161,326,29.0,3.0,2015-11-24,"As far as enormous chain restaurants go, this one is solid. It's hard to complain about good variety, good service, and huge portions. The food is by no means fantastic, but it's not bad.  We came on a Sunday evening shortly before 5 and there was no wait. If you've never been to a Cheesecake Factory before, the menu is a small book. It's insane. You can eat anything from an omelette to a fish entree to a burger to a ""skinny"" salad. There really is something for everyone. I opted for a giant breakfast sandwich on brioche with ham and bacon and egg and cheese. Incredibly filling and pretty tasty, but greasy. Exactly what I expected, in other words. My kiddo had corn dogs with a side of fruit and milk. Typical kids meal. The fruit was cut into non-choking hazard pieces, which I appreciated. Hubs and I shared 2 flavors of cheesecake (honestly, one slice would have been more than enough): the salted caramel and the original with fresh strawberries. LOVED the strawberry one, but the salted caramel was way too sweet for me.  Not my first choice, but I'd definitely come back just for the cheesecake.",https://www.yelp.com/biz/the-cheesecake-factory-frisco?start=100,3.28,3.34,3.34,2.9560000000000004,3.3160000000000003
139,Jamie D.,"Dallas, TX",245,128,149.0,4.0,2015-12-15,"I don't really go here, not much of an ""American"" food kind of person and sweets aren't really my thing. But we had a holiday lunch outing with my team today and this was the place decided on. They had made a reservation  early in the morning so when we came in, we were seated very promptly. Our server was very enthusiastic! I ordered the hibachi steak (medium rare) specialty with sauteed spinach and tempura green beans. This was REALLY good. Yes, all the pink/red parts in the steak- not overdone...JUST perfect. I also really enjoyed the spinach. However, i thought the tempura green beans (or was it another green veggie....I can't remember) was kind of lacking. Too much batter, not enough of the ""veggie"" flavor...did not really like it.  For dessert, each of us got a different cheesecake, I ordered the peppermint bark cheesecake. SIMPLY AMAZINGGGGG. Especially for someone not that found of sweets ;)",https://www.yelp.com/biz/the-cheesecake-factory-frisco?start=60,3.32,3.34,3.34,3.056,3.3320000000000003
201,B M.,"Frisco, TX",0,58,6.0,5.0,2015-12-21,"This location is the best one yet. Dimitri our server was excellent and attentive, the pizza was surprisingly good, and reasonably priced.",https://www.yelp.com/biz/the-cheesecake-factory-frisco?start=220,3.32,3.34,3.34,3.188,3.3320000000000003
144,Trish S.,"Frisco, TX",3,70,17.0,5.0,2015-12-28,"Thsnk you for the BEST combo of dessert cheesecakes for xmas!! Thanks for having a great person like Jenny in Bakery!! Smiling , pleasant sunny personality is what we ALL need during the Holidays! Even though another customer was being impatient and rude , she never stopped being a little beacon of light to the rest of us!! These are our unsung heros of the hectic season!! Thanks guys!!! We all need a little a positive example what we all should be doing!",https://www.yelp.com/biz/the-cheesecake-factory-frisco?start=160,3.32,3.34,3.34,3.188,3.3320000000000003
151,Monta C.,"Dallas, TX",133,29,8.0,5.0,2015-12-29,"Fave place while shopping:) always hot, fresh, and the wait goes by fast with delicious bread once you get to your table! My go to cheesecake is Red Velvet- fried Macaroni and cheese will not disappoint along with the sweet tea!",https://www.yelp.com/biz/the-cheesecake-factory-frisco?start=160,3.48,3.34,3.34,3.188,3.3960000000000004
150,Andy B.,"Plano, TX",0,33,,4.0,2015-12-30,"My family stopped here for lunch at noon.  Wait time was about 40 minutes which we spent at the Barnes and Nobles next door.  Our waitress was very nice and the food was well presented and rich in taste.  I had Boston Beef Dip and she had some kind of salad.   Unfortunately, my wife and I both had stomach ache later in the afternoon.  I don't think there was anything wrong with the food.  We're just not used to eating very rich and salty food.  Our kids were fine who were downing lot of diet Pepsi or Coke.  Overall it was fine dining experience and I would like to go back and try some other dishes.",https://www.yelp.com/biz/the-cheesecake-factory-frisco?start=160,3.48,3.35,3.35,3.056,3.402
267,Leonard C.,"Monroe, LA",0,3,4.0,4.0,2016-01-02,"Enjoy the food selections and attentive staff... It can get pretty crowded and noisy on weekends especially, but the food is always good. I visit often whenever I come to the Dallas area.",https://www.yelp.com/biz/the-cheesecake-factory-frisco?start=120,3.6,3.38,3.38,3.088,3.4680000000000004
111,Kellie P.,"Little Elm, TX",13,6,,2.0,2016-01-07,"It was my first time going and I have been looking forward to trying it. My waiter was fantastic and the customer service in all aspects was perfect! BUT the food was very sub standard, especially considering the prices. Everything was just ok. Nothing was nasty but nothing wowed me either. I've had much better food (and drinks) at other restaurants for sure.",https://www.yelp.com/biz/the-cheesecake-factory-frisco?start=140,3.56,3.36,3.36,2.7920000000000007,3.4400000000000004
42,Robert B.,"Keller, TX",430,332,960.0,4.0,2016-01-13,"We decided we need a taste of desert before hitting the road. Nice restaurant in a nice mall. Busy place, very busy. Took 40 minutes to get a table, but I won't begrudge them for being popular. The service was top notch. I have to say the waitress was a lot of fun and spot on with service. The atmosphere is really cool. If you've not been to a Cheesecake factory before, the ambience is really different in a good way. Lots to see for ADHD people. My wife and our friend were super impressed with their deserts. Mine was ok. I will confess that the reason this place doesn't get a 5 star rating is that I simply don't care for cheesecake. So, I ordered a non-cheesecake desert. It was ok. Presentation is great, but the flavor was ok. Lemon pie type deal. Tasted too much like a fluffed up piece of cheesecake to me. If you're a cheesecake lover, this is your place.",https://www.yelp.com/biz/the-cheesecake-factory-frisco?start=40,3.64,3.38,3.38,3.056,3.4840000000000004
106,Brian M.,"Upper Greenville, Dallas, TX",23,9,15.0,1.0,2016-01-16,"Unless waiting 2 hours for Chili's grade food is up your alley, find somewhere else to enjoy your Saturday evening.",https://www.yelp.com/biz/the-cheesecake-factory-frisco?start=140,3.64,3.34,3.34,2.7880000000000003,3.4600000000000004
122,Stefanie L.,"Dallas, TX",2445,953,1686.0,3.0,2016-01-28,"I'll be honest, Im typically not a Cheesecake factory fan. Their menu is huge and overwhelming and there's always screaming kids. This last time I went wasnt horrible. I was pleasantly surprised to see a ""lighter"" menu. They have their massive 15 page menu but also a separate one that has 600 and below calorie items. Be careful though because even though some of the items are low in calorie, they are still high in sodium and fat. I ordered the steak medallions from the lighter menu for my dinner. They were pretty good. It wasnt an amazing cut of meat but it had a good flavor. The asparagus was cooked well but there wasnt much of it. There was a little too much of the red wine sauce. they could have gone a little lighter there. But overall a decent meal for $16.95. The noise level is really loud and there are a lot of kids. Or at least there were when I went. Tables are close together so you're basically having a conversation with your table and the one next to you. Not the best place to go for a date if you're wanting a romantic, quiet setting. Overall an ok place to go. A bit pricey but convenient if you're at the mall",https://www.yelp.com/biz/the-cheesecake-factory-frisco?start=60,3.6,3.33,3.33,2.9880000000000004,3.438
97,Stewart P.,"Birmingham, AL",120,269,79.0,3.0,2016-01-29,"I am a fan of one thing and one thing only at The Cheesecake Factory: the cheesecake. I have eaten at many locations across the country and while they are consistent, the food is bland, boring and overpriced. With that said, I did not dine here during this visit, only ran in quickly for a piece of sweet fromage to take back to my hotel room after eating at another restaurant nearby. So, to be fair, I am only reviewing the service I received and my cheesecake.  I'll start off with the wonderful part - the cheesecake. It was good. Okay, really good. Now, I've have better, artisan cheesecake that tasted like heaven and cost 5 times as much as this but let's be honest, this is the one thing that TCF does well in honoring its namesake. I ordered the red velvet cake and it was sweet, creamy and large enough that I passed half of it off as breakfast the next morning. You can do that when you're significant other is hundreds of miles away..... The location is a bit odd. It is located in a mall, which is likely the reason it is so crowded all the time, but it doesn't make for the nicest location for those who want to grab and go. I entered through the mall (I believe there is also an outside entrance) and was met with a long line of people who were waiting for acknowledgement from the hostess. I only wanted some cheesecake so it was quite obnoxious that I had to fight for an opening to get to the cheesecake display that was moronically located right next to the host desk where everyone congregates. There was no line for the cheesecake but fighting through the crowd took some time and then getting someone's attention took another 5 minutes or so. I did that annoying throat-clearing trick to get someone to look my way but they are like my children and have selective hearing. The service at this location left a bit to be desired. The person who did eventually help me looked at me with disdain, as if I was just another person plaguing the world with my quest for diabetes. The assessment would not have been wholly inaccurate but still, it would be nice for them to fake it a bit better. We exchanged money and cake with not so much as a grunt of human friendliness from their end. I'm sticking with my assessment that TCF is a cruddy place to eat anything other than cheesecake.... but once in a while you need that cheesy goodness, and this is a decent place as any to get it.",https://www.yelp.com/biz/the-cheesecake-factory-frisco?start=80,3.64,3.32,3.32,3.0200000000000005,3.4480000000000004
101,Devi M.,"Sherman, TX",51,43,17.0,1.0,2016-02-13,"I keep hoping. Poor flavor poor service.  Stop for cheesecake and go somewhere else.  This one is the worst I've been to. Servers don't care,  management apparently doesn't either.  Sad shadow of what a CF should be.",https://www.yelp.com/biz/the-cheesecake-factory-frisco?start=140,3.48,3.32,3.32,2.8520000000000003,3.3840000000000003
68,Nicole M.,"Plano, TX",153,44,157.0,1.0,2016-02-14,"We're no strangers to Cheesecake Factory.  We love the flagship in Macy's San Francisco (we always do the Kobe Burger there), always did brunch in Waikiki (and loved the ahi tempura roll that's no longer on the menu), and it was our go to in the Woodlands when Mia was first born.  We have always had a great experience and looked forward to coming back. This location at Stonebriar in Plano, however, is the exception and has taken a poor experience to a whole new level.  Some weeks ago, my husband and I got some precious time away and thought to treat ourselves to some QT and cheesecake.  As all the other tables were served around us (although some had been seated far after we had ordered), we expressed our concern which was met wit a somewhat exasperated ""I'll check on it."" And the delivery of barely lukewarm food. It was not was we had hoped to dive into after 45 minutes of waiting--and no, there was no line.  My family had been warning me that service and food quality had been declining, but I refused to believe that an establishment with such a good reputation would be falling apart. And then today happened  It's Valentine's Day, and after church, I thought it would be sweet for us to brunch as a family. It was early, so I thought Cheesecake Factory would be a good choice. It took us 15 minutes to be seated, and our server, Patrick, was very sweet if a little harried.  This is where is goes downhill. We waited over 20 minutes again for our food, and they brought out my toddler's food (pancakes and bacon).  Another 7 minutes later, our food appeared. My husband had the Benedict with breakfast potatoes. Not only was the dish lukewarm, the potatoes were almost black from being overlooked. And then there was my Chorizo and Avocado omelette.  It looked pretty, and I cut into it.  Green peppers, chorizo....and no avocado. How does a main ingredient get left out?! I apprised our sever and a manger brogue out a replacement a few minutes later with three sad pieces of avocado stuffed inside the omelette and now, NO SOUR CREAM on the omelette. I was done. I was livid. And then and there, I realized that the poor service was not a one off, it was an indication of what was happening in their business. Maybe you can get away with it when people are willing to wait 90 minutes to get a table since there is nowhere else to eat in the mall. But if someone is will to wait 90 minutes, they'd should be deserving of at least decent service and food quality as opposed to what our experiences have been the last few times. I spoke to James, the manager, and he has only been here since November. He seems passionate about what he does, and I hope he has the ability to address this sinking service that reflects poorly on the rest of the organization.   If you are considering this location, please take my advice and reconsider. Until they are able to maintain their standards, I wouldn't return.",https://www.yelp.com/biz/the-cheesecake-factory-frisco?start=100,3.32,3.29,3.29,2.8840000000000003,3.302
116,Arhez D.,"Carrollton, TX",76,158,6.0,2.0,2016-03-01,Ehhh it's the Cheesecake Factory... Nothing too special about the food but this time we were more disappointed than normal. My husband got the shepherds pie and there was NO flavor at all! Sad part was the waitress recommended it and said it was one of her favorites. I definitely won't be coming here unless I want the avocado egg rolls because those are amazing.. Also I feel like the cheesecake slices are a bit smaller than they used to be,https://www.yelp.com/biz/the-cheesecake-factory-frisco?start=140,3.24,3.26,3.26,2.9840000000000004,3.2520000000000007
65,Priyam G.,"Santa Clara, CA",35,41,15.0,5.0,2016-03-23,"There is absolutely nothing about this place that I dont like... Oh no.. wait... there is... the really long waiting... but well i guess thats just coz this place is that awesome! Orange chicken, Pastas, Sandwhiches... everything is great The portions are huge!!! I have never finished my entire meal...like ever! Their Nachos and Guacamole is exceptionally good! It is a nice vegetarian friendly place! The cheesecakes... well... they r the best! So many flavours to choose from... you should visit simply for the cheesecakes",https://www.yelp.com/biz/the-cheesecake-factory-frisco?start=100,3.24,3.29,3.29,3.2520000000000002,3.27
76,Amanda C.,"Shreveport, LA",1,13,7.0,4.0,2016-03-25,"Excellent sausage and ricotta flatbread. Crispy and delicious.  Crispy shrimp sandwich was good. Sweet potato fries were okay, but at least they didn't have sugar on them like so many places do.  Had the Red Velvet cheesecake and it was perfect. A moist red velvet cake and wonderful cheesecake. My new favorite way to have cheesecake.",https://www.yelp.com/biz/the-cheesecake-factory-frisco?start=100,3.2,3.3,3.3,3.12,3.2600000000000007
95,Wayne W.,"McKinney, TX",89,164,23.0,4.0,2016-04-03,"Our ""GO TO"" place is the Cheesecake Factory due to the variety of selections available and the great service.  I even had a server forget to put in my meal a couple of times ago but due to the FANTASTIC service and Food we enjoy on a regular basis here I had no problems overlooking it.  He also comped my Cheesecake.  It says I've checked in here 3 times but I've forgotten 3 or 4 more times I'm sure.  Great place to hang out, enjoy some good drinks and food with great service.",https://www.yelp.com/biz/the-cheesecake-factory-frisco?start=80,3.28,3.32,3.32,3.152,3.3040000000000003
178,Kelsey H.,"Aubrey, TX",0,4,,3.0,2016-04-04,"I'll give Cheesecake Factory three stars because I've eaten here quite a few times and I am  sure to return :-).  I love this place honestly I do.  However, my last two experiences were not the best.  Long story short dirty utensils and wine glasses are not desirable and that was not the first time.  Also when it gets busy its hard to get good timely service.  The food is excellent  and the atmosphere is great. Please work on the  minor details to help with the overall experience",https://www.yelp.com/biz/the-cheesecake-factory-frisco?start=180,3.32,3.31,3.31,2.9560000000000004,3.314
140,Arlinda B.,"The Colony, TX",0,12,1.0,5.0,2016-04-18,What can I say the cheesecake factory has the best appetizers of anywhere. Their meatloaf meal is probably one of the best meals you can order there. And when you get done with that there's the fantastic choice of cheesecakes. What a great place to go double thumbs up I highly recommend it,https://www.yelp.com/biz/the-cheesecake-factory-frisco?start=160,3.36,3.31,3.31,3.124,3.33
163,Yvonne W.,"Allen, TX",0,6,,2.0,2016-05-01,My daughters and I had been anticipating a visit to Cheesecake factory at Stone Briar mall. We had been to one in Michigan and the food was excellent. We went at 4:30 PM and  our wait was not long. But the area they decided to seat us in was filthy with food and papers all over the floor and I almost slipped on the grease on the floor. The grease on the floor was very thick and invisible. The women seating us told us it was just the marble but it wasn't. We were finally seated in the center section. Everything was clean and tidy. Our server was excellent and the speed of service was good.  The next issue was the food itself . I ordered the Steak Diane-which was excellent. My daughter ordered the bang bang chicken and their was no BANG in the chicken ;it was very bland. My other daughter ordered garlic pasta with chicken and asparagus. It was very bland too without a hint of garlic. Our meal of three cost $90. Actually $75 and $15 tip .Don't think we will be going back to this Cheesecake Factory anytime soon.,https://www.yelp.com/biz/the-cheesecake-factory-frisco?start=180,3.24,3.29,3.29,2.7600000000000007,3.27
87,Lysa D.,"Rancho Cordova, CA",33,274,89.0,4.0,2016-05-16,"The service is usually pretty good each time we've been there. We usually order some sangria which is delish, as well as the tuna carpacchio which is probably the best thing in their menu. It's something we order everytime were there because it's so damn good. Healthy and delish. You also can't go wrong with the cheesecake options. My only complaint is that they took the mini corn dogs off the menu!",https://www.yelp.com/biz/the-cheesecake-factory-frisco?start=80,3.36,3.29,3.29,2.9280000000000004,3.318
208,Kasey Y.,"Richardson, TX",0,7,,1.0,2016-05-19,"we went for happy hour and to have a few appetizers and were highly disappointed.  we sat outside on the patio because the weather was perfect.  the food was good and the drinks were good but when we got our bill we hadn't received happy hour prices.  We asked the waiter to ask about it and he came back and said that they didn't offer happy hour prices on the patio, that we had to be sitting in the bar area, per the manager.  we were literally sitting with only a wall in between us and the bar.  it was ridiculous.  we weren't  told before we sat down either which i think is something that a customer should be aware of.  not to mention that the waiter had to come back and tell us instead of the manager actually coming by to tell us himself.  seems like they must only have back of the house managers because their customer service blows.",https://www.yelp.com/biz/the-cheesecake-factory-frisco?start=220,3.24,3.27,3.27,2.5640000000000005,3.258
30,Steffy N.,"Dallas, TX",137,177,361.0,5.0,2016-05-20,"I've been here a few times and man is it good! The bread we are served before our entrees are amazing :) I like their Four Cheese Pasta, Fettuccine Alfredo, etc. I always eat pasta from here and it's always rich in flavor, beautifully presented and creamy. I like my pastas super creamy but of course you can ask for lighter sauce. The cheesecakes are HUGE. I've had the Original, Oreo, Godiva, and Chocolate cheesecakes. All of these were so good and rich. If you've got a sweet tooth, you should try these cheesecakes. My favorites are probably the Original and Oreo.  Service has been great here, waiters have always been attentive. The restaurant is doomed light, but decorated beautifully. It's great for groups, they have huge booths.  Great food, great place!! :)",https://www.yelp.com/biz/the-cheesecake-factory-frisco?start=20,3.36,3.31,3.31,3.0920000000000005,3.33
275,Charles H.,"The Colony, TX",23,50,2.0,3.0,2016-05-29,"Great place to eat and service is great. But $7.95 for one piece of cheesecake? Come on, that's a joke.",https://www.yelp.com/biz/the-cheesecake-factory-frisco?start=120,3.32,3.32,3.32,2.8600000000000003,3.3200000000000003
110,Brenden P.,"Dallas, TX",0,2,,3.0,2016-05-29,"Pretty good food, but lackluster service. We hardly ever saw our waitress and kept having to ask for drink refills, our check, etc. The portions were huge though, so we had plenty of to-go boxes when we finished. The cheesecake was also great, as always.",https://www.yelp.com/biz/the-cheesecake-factory-frisco?start=140,3.32,3.33,3.33,2.8600000000000003,3.326
274,Jenny E.,"Houston, TX",162,43,11.0,5.0,2016-05-31,"We ate here on Friday, and this place is always a win. There's something for everyone on their book of a menu. The fried Mac and cheese appetizer is AMAZING!! I ordered a chopped salad off their lighter menu this time and was pleasantly surprised!! Large portion, perfectly dressed and loved everything on it. I will get this again. Our waiter was great. We were very pleased with our service for our party of 5,... Even during a very busy dinner rush!",https://www.yelp.com/biz/the-cheesecake-factory-frisco?start=120,3.36,3.37,3.37,2.9960000000000004,3.366
62,Nataly E.,"McKinney, TX",51,11,37.0,5.0,2016-06-02,"Love this place. The salads are all amazing, you can't go wrong! The staff is also great. The only downside is the wait- usually about 20 minutes, but it's worth it.",https://www.yelp.com/biz/the-cheesecake-factory-frisco?start=100,3.36,3.41,3.41,2.9960000000000004,3.39
137,Sarah L.,"Grapevine, TX",141,42,61.0,5.0,2016-06-08,"I am SO impressed with their customer service.  I placed a large catering order and the manager, Jim, walked me through the best ways to order to get the most for my money.  Super awesome, he didn't have to do that, you can tell he really cares about his customers.  The day of, he and the server (receipt says Marianne), got my order all ready and it was 100% perfect and it was ready right when I walked in.  A lot of times togo orders are missing something...  But this came with all the food, sauces, plasticware, plates, & serving utensils.  It was flawless. They even had 2 gentleman carry the order to my car for me. Everyone was super friendly.  Oh, and the food was awesome. Everything was delicious and was packaged up beautifully.  Note: This location is actually INSIDE the mall.  It's on the second floor and so you can park on the second floor of the parking garage. There is togo parking right up front ( something I didn't know because I didn't go to the 2nd floor)  I highly recommend this place for togo/catering orders.",https://www.yelp.com/biz/the-cheesecake-factory-frisco?start=60,3.36,3.41,3.41,2.9320000000000004,3.39
