,Username,location,friend_count,review_count,photo_count,rating,date,review,Url,roll25,roll100,roll250,special_25,Final_Rating
91,Jenny C.,"Frisco, TX",1,50,14.0,5.0,2016-12-13,"With a menu like a book, everyone can find something they like here! I come here way too much and spend way too much of my money here because the food is so freaking good! It concerns me just a little though that they don't list nutritional facts on their website... how much fat/salt and sugar am I really getting? Well, if I am concerned I guess I can go for the Super Antioxidant Salad with spinach, kale, avocado, broccoli, grapes, pear, blueberries, red onion, sunflower seeds, almonds and a lemon-blueberry vinaigrette. The dressing is paired perfectly with the salad- you have to have something to balance out the bitter taste of kale, and this dressing does the trick! All of the lettuce types in the salad appeared fresh and I did not find any of those nasty brown mushy old pieces I sometimes find in salads. The fruit and vegetables in the salad were also fresh and the salad as a whole tasted great!  My other go-to when I am not trying to be ""healthy"" is the Baja Chicken Taco dish. Mmmmmm, comes with small corn tortillas, chicken, a yummy mildly spicy orange cream sauce, cheese, avocado, cilantro, onions and tomatoes. The dish comes with black beans and a cilantro rice. They give you two corn tortillas per taco, comes with four tacos, because of the yummy sauce that drips everywhere and can make the first tortilla weak. You can get a tad messy when eating the tacos but that is what the napkin is for.  Bang-Bang chicken and shrimp is also delicious! They use a coconut curry sauce that is not spicy at all, with thinly sliced zucchini, peanuts, yellow squash, carrots, peas, shallots, ginger, and shredded coconut on top of the rice. They have brown or white rice, I prefer the brown. The shrimp is always cooked well and has a good grilled flavor.",https://www.yelp.com/biz/the-cheesecake-factory-frisco?start=80,2.96,3.31,3.31,2.9320000000000004,3.17
120,Hammad S.,"Frisco, TX",75,48,22.0,5.0,2016-12-14,"Crushed herb salmon with shrimps scampy are highly recommended! Can tell fish and shrimps were very fresh. If you are a salmon lover , you must try this! Shrimps were pretty good size.",https://www.yelp.com/biz/the-cheesecake-factory-frisco?start=60,3.0,3.32,3.32,2.804,3.1920000000000006
94,Ardas S.,"Coppell, TX",35,17,3.0,1.0,2016-12-17,"You have many choices for a Friday night dinner, but this is not One of them. We went there at 5:15 pm, waited till 6:00 pm. We were seated at a secluded boot for four, even we do not feel we are at the Cheesecake Factory, did not complain. Service was horrible, waited to give order another 15 min, then three rounds of bread refill in another 45 min wait time. After that our dinners were served partially. My wife and I started to eat 20 min before my son's dinner served. No water refill..called manager, he offered free cheesecake for my son. I am sure we were not the first one, manager was so experienced with complains per my observation. 3 hours dinner for one plate food. Promised to ourselves to stay away from this place for life!",https://www.yelp.com/biz/the-cheesecake-factory-frisco?start=80,2.96,3.29,3.29,2.404,3.158
51,LG N.,"Prosper, TX",48,178,104.0,4.0,2017-01-02,"We visited the Cheesecake Factory in Frisco today with friends.  The food and service were great.  This place has something for everyone with so many options, all of which are done nicely.  Additionally, their cheesecake is amazing.  Definitely recommend this place!  Great for two people or large groups!!",https://www.yelp.com/biz/the-cheesecake-factory-frisco?start=40,3.08,3.32,3.32,2.8000000000000003,3.2240000000000006
17,Jona G.,"Frisco, TX",122,199,1062.0,4.0,2017-01-07,"This location is in stonebrier mall.  I hadn't been to Cheesecake Factory in a long time and I really liked it.  My waitress was really great and made my Cajun pasta extra spicy for me.  I was surprised it was actually spicy honestly.  Their menu has tons of options to me almost too many.  It's overwhelming trying to pick something from their menu, but then it's also great they can satisfy nearly anyone.   Of course you have to get Cheesecake if you come here.  There are a few I'd like to try.  It was hard to choose just one!  Will be back for sure.",https://www.yelp.com/biz/the-cheesecake-factory-frisco,3.2,3.33,3.33,2.7359999999999998,3.278
44,T P.,"Allen, TX",65,185,20.0,3.0,2017-01-11,"I hadn't been to CF is years and decided to give it a  go today since the sun was shining, perfect for patio dining.  The wait was about 30 min and there seemed to be a nice crowd inside waiting for tables. Once outside, we noticed that the sun had scorched everything on the tables including silverware that was burning everyone that picked them up. The waitress kindly replaced ours. We ordered spinach dip for apps and the crispy chicken sandwich and big burrito for entrees. The sandwich wasn't spectacular but it wasn't gross. My S.O. stated that their burrito was so-so even though it was drowned in sauce.  I remember coming to Cheesecake factory years ago and it being a popular go-to, but I'm not too sure I would visit again based on the quality of food we were served.",https://www.yelp.com/biz/the-cheesecake-factory-frisco?start=40,3.16,3.32,3.32,2.54,3.2560000000000007
93,James B.,"Plano, TX",0,10,,5.0,2017-01-16,Their food is consistently good.  The menu is huge and I've tried several different items.  The drinks are expensive but they are worth the price.  Probably the only drawback is that wait times can be long.  We will definitely be eating there again.,https://www.yelp.com/biz/the-cheesecake-factory-frisco?start=80,3.16,3.33,3.33,2.804,3.262
92,LaToya A.,"Dallas, TX",0,15,3.0,5.0,2017-01-20,I get to choose once a month a treat for being good on my diet and every month I choose a piece of cheese cake from this location. There is one woman that is always their to help me and I believe her name is Starla (I really hope I got that right)! she is always so professional and sweet. The wait is never long when she is a the cheesecake register and she is always smiling! Great customer service :),https://www.yelp.com/biz/the-cheesecake-factory-frisco?start=80,3.32,3.34,3.34,2.772,3.3320000000000003
52,Amy S.,"Richardson, TX",204,57,91.0,5.0,2017-01-21,"The Korean Fried Cauliflower is the choice you want. It tastes great! Sweet, lightly spicey and big on flavor. Yummy in my tummy",https://www.yelp.com/biz/the-cheesecake-factory-frisco?start=40,3.44,3.35,3.35,2.7399999999999998,3.386
272,Hunter F.,"Plano, TX",0,4,,1.0,2017-01-24,"So I've been here a few times and the service was decent. The past two times I've ordered the same burger... (a smokehouse) and they didn't even bring out that burger... first time I got it there was no bacon or fried onions.. just veggies. So they fixed it, now I ordered takeout the other night, same burger, it was practically thrown in the box and sent out, got home and saw yet again, no fried onions... that's one of the main things on a smokehouse...",https://www.yelp.com/biz/the-cheesecake-factory-frisco?start=120,3.36,3.32,3.32,2.34,3.3360000000000003
90,Nicholas W.,"Lewisville, TX",0,5,1.0,1.0,2017-01-26,I ordered a blt blue cheese burger from their menu online to pick up but apparently they don't have a blue cheese burger. So I requested to have put blue cheese crumbles on it. The price on their menu online said $11.95 but when I picked it up they charge me $13.95. Wow and I said why the difference and they said they haven't updated their online menu in years. Hard to believe for a big franchise to not take of that. However I asked for medium done for my burger and it was all pink inside and called the manager and they said all mediums are all pink. Where do you get a medium burger that is all pink. I was so pissed driving back all the way back dissatisfied and demanding a refund. They gave me a refund but not going for burgers or any of their food anymore.,https://www.yelp.com/biz/the-cheesecake-factory-frisco?start=80,3.36,3.28,3.28,2.436,3.3120000000000003
16,Mika S.,"Dallas, TX",28,103,72.0,5.0,2017-02-02,"Sean is the best bartender, my favorite here. I always receive exceptionally fast and friendly derive from him. He adapts my drinks and recognizes my order.  I pop in even when it's busy because I know he'll take care of my order promptly and thoroughly. Thanks!",https://www.yelp.com/biz/the-cheesecake-factory-frisco,3.48,3.29,3.36,2.9640000000000004,3.366
134,Nancy K.,"Lewisville, TX",22,14,22.0,5.0,2017-02-05,"Love this place! Amazing service! I wanna give a shoutout to our waitress, Sam! She definitely made the night so much fun and super enjoyable! Food is always good, plus the portions are huge!",https://www.yelp.com/biz/the-cheesecake-factory-frisco?start=60,3.48,3.29,3.368,2.836,3.366
59,Ravikumar V.,"Plano, TX",47,7,18.0,1.0,2017-02-05,"I thought spicy means spicy . But here spicy means sweet here. When I ask spicy sauce, they gave some ginger garlic smelled sauce. I don't know the name.",https://www.yelp.com/biz/the-cheesecake-factory-frisco?start=40,3.36,3.29,3.36,2.404,3.318
54,Kasie C.,"Farmersville, TX",0,15,23.0,5.0,2017-02-11,The Cheesecake Factory rocks!!! Absolutely my favorite place to eat!! You won't be disappointed...,https://www.yelp.com/biz/the-cheesecake-factory-frisco?start=40,3.44,3.33,3.364,2.804,3.374
260,Jen S.,"Vista, CA",0,5,,1.0,2017-02-16,Horrible experience! Have food allergies and they were not at all careful with my food.  I was unable to eat half of it.  I will never eat here again!,https://www.yelp.com/biz/the-cheesecake-factory-frisco?start=120,3.44,3.29,3.36,2.404,3.35
82,Danielle F.,"Dallas, TX",173,5,,1.0,2017-02-26,"It's me again. We have Claudia today when we came back for our Sunday night dinner and the service was so bad I wanted to walk out. We have waited for our Jambalaya PASTA dish for almost an hour and a glass of wine for 20 min. I am a server myself and I know it doesn't take that long. I understand that the cooks take out the food in a ticket order, but this was way too long especially since all of the tables next to us got their appetizers, drinks, and entrees before we got our only dish. I wish we had Tara again like last time but oh well.",https://www.yelp.com/biz/the-cheesecake-factory-frisco?start=80,3.28,3.27,3.348,2.436,3.274
21,Carolina E.,"Carrollton, TX",276,100,303.0,3.0,2017-02-27,Cheesecake is always hit or miss for me. This place is anywhere from 3-5 stars depending on what you order and 2-5 stars depending on service. Their brown bread is delicious- the wait times are extremely long if you go on a Friday or Saturday night. Regardless- I still love the sliders and their fries so I go back even if service isn't always incredible.,https://www.yelp.com/biz/the-cheesecake-factory-frisco?start=20,3.28,3.25,3.356,2.636,3.262
98,Mike M.,"Flower Mound, TX",10,77,4.0,1.0,2017-03-01,"How do you complain about wonderful food?  Well, let me try.  First, I met a friend there for a much needed visit.  We live several hours apart and this is our mid-way point.  The food was great! My salad was perfect, his steak was cooked just right and our waitress, Stephanie, was awesome!  So how could I just give them one star?  As I mentioned I met my friend there for a visit, but the music was so loud we could barely hear each other!  We asked them to turn it down twice with little success.  We didn't go there to listen to their background music, we went there to talk!  If a restaurant refuses to accomodate the customer in such a simple thing it ruins the whole experience!  Great food?  Yes.  Great service? Yes,  thank you Stephanie.  A great experience for our meeting?  No, not at all.  This should have been a simple fix, but was completely ignored by the manager.  We will have to find a new place to meet for our next visit.",https://www.yelp.com/biz/the-cheesecake-factory-frisco?start=80,3.12,3.21,3.34,2.436,3.174
263,Pris F.,"Walbridge, OH",22,6,1.0,1.0,2017-03-03,Disappointed is an understatement today! A very late lunch time (2pm) means hardly any customers. I asked for a table for 1 - I love lunching alone sometimes - and twice the hostess insisted there were 2 in my party. Then I ordered what I love and was pretty much scolded by my server cuz they brought me the wrong meal. Sorry  but I know what I ordered! It will be a while before I come back,https://www.yelp.com/biz/the-cheesecake-factory-frisco?start=120,3.12,3.21,3.328,2.468,3.174
85,Scott M.,"Aubrey, TX",16,59,19.0,5.0,2017-03-05,Absolutely love the Cheesecake factory!! It's one of our favorite places. The food is fantastic and of course the cheesecake is phenomenal! Great place for date night.,https://www.yelp.com/biz/the-cheesecake-factory-frisco?start=80,3.12,3.22,3.332,2.9960000000000004,3.1800000000000006
96,Jackie S.,"Hurst, TX",0,18,17.0,1.0,2017-03-06,"Had a really terrible experience at Cheesecake today. Our server, Cedric, greeted us about five minutes after we sat down and didn't write down our order (a dubious sign). The first round of bread he brought was cold and rock-hard. Sawing into the loaves sent crumbs and sharp crust flying. I ordered the lunch chicken piccata and my boyfriend ordered the buffalo chicken strips. While we waited about twenty minutes for our food, we finished the bread and our drinks, but our server did not come back to our table to check on us. When he did come back, he brought my boyfriend chicken wings, instead of the chicken strips he had ordered. After blaming the kitchen and trying to ask my boyfriend to just eat the wings instead, he said he would run back to the kitchen and bring us back the chicken strips in five minutes. He left the table without bringing us more bread or refilling our drinks. It took another twenty minutes to bring my boyfriend his chicken strips, at which point I had already finished my meal (it was either that or let it get cold while we waited--my boyfriend insisted I eat). We had to ask twice for more bread and once for refills. The chicken piccata was good, the chicken strips were ""alright."" In all, what we had planned as a nice lunch date turned into a frustrating experience, and we left without getting any cheesecake because we were so annoyed at that point. Big bummer.",https://www.yelp.com/biz/the-cheesecake-factory-frisco?start=80,3.0,3.22,3.32,2.5000000000000004,3.1320000000000006
138,Syed K.,"Little Elm, TX",0,20,11.0,4.0,2017-03-09,"The food was excellent, one star less because the serving time has dramatically increased and that too on a Thursday night seems oddly slow.",https://www.yelp.com/biz/the-cheesecake-factory-frisco?start=60,3.12,3.23,3.32,2.8000000000000003,3.186
23,Alvin H.,"Frisco, TX",35,205,76.0,2.0,2017-03-15,"Purely personal and does not reflect what my wife or kids think of Cheesecake Factory, but I dislike their food. Think ""Jack of all trades, master of none"" and that is what Cheesecake Factory means to me.  Even when I ask around with friends, there is no single entree that stands out as being ""awesome"".  For most restaurants, they are known for being really really good at something right? It could be the shrimp, or atmosphere, or meats. Cheesecake Factory is known for cheesecake (and usually the only reason I go) but their entrees are generic and undeserving of a ""eating out"" excuse.  Purely my opinion and my wife/kids disagree. Honestly, your calories to deserve to come from a better kitchen.  The notion of ""factory"" is very real here; besides how do you think they can offer 35 versions of pasta??!  Yes I exaggerated. Highly laden in guilty calories (look up how many calories their cheesecake has, or why some pastas have over 2k calories) and you'll see why I love to dislike Cheesecake Factory.  If I want guilty pleasure, I'd go to Estillo Gaucho.  If I wanted deserts, I'd hit up Andy's.  If you want to please a party with very different tastes, have $100 to spend, don't mind a 45 minute wait.....come to Cheesecake Factory.   One word - UGH",https://www.yelp.com/biz/the-cheesecake-factory-frisco?start=20,3.08,3.23,3.312,2.504,3.17
81,Bob V.,"Frisco, TX",0,11,,2.0,2017-03-19,Took 1:45 to eat there today. We had a lunch special of salad and Pizza. Sloooooow  Will be a while before I return,https://www.yelp.com/biz/the-cheesecake-factory-frisco?start=80,3.04,3.24,3.304,2.568,3.1600000000000006
32,Whitney C.,"Frisco, TX",16,73,21.0,1.0,2017-03-24,"We love Cheesecake Factory and go all the time.  My mom was visiting for her birthday and we went for lunch.   We sat down at noon before the lunch rush, quickly ordered since I had 2 of my kids.   It took 50 minutes to get our food, and the kids meal came out 10 minutes after ours.  We were never offered drink refills and they didn't do anything after I told them it was her birthday.   We spoke to the manager about the issues and were told they would do something on the bill for the trouble but our bill didn't have anything taken off.  I'm deeply disappointed with the service especially since it was a special occasion.",https://www.yelp.com/biz/the-cheesecake-factory-frisco?start=20,2.88,3.21,3.296,2.468,3.078
75,Yoni N.,"Carrollton, TX",0,10,,5.0,2017-03-25,"Me and my family went on a Saturday, we tried to make reservations but since it was a weekend they didn't do reservations,we waited for an hour and a half for food, but they give u a buzzer when your table is done, so during that time we went around the mall, when we finally got in the restaurant they took our orders and brought us some bread and butter, we got our orders in less than 30 minutes, the food was great and they offered many vegan options for the part of my family that were vegan, overall an great experience",https://www.yelp.com/biz/the-cheesecake-factory-frisco?start=100,2.88,3.24,3.3,2.9320000000000004,3.0960000000000005
20,Tiffany W.,"Dallas, TX",52,78,148.0,4.0,2017-03-30,"The boyfriend and I decided to stop in one night after a late movie and the AMC in the Stonebriar mall. I was excited to see they stayed open, until midnight on the weekends. It was about 10:30 pm and surprisingly the restaurant was full. I wouldn't call myself healthy but seeing the calories on the menu definitely made me rethink a traditional entree. I ordered the skinny chicken pot pie, I really didn't miss the unhealthy parts of the pot pie. The boyfriend ordered grilled steak medallions he really enjoyed it. Overall very surprised we enjoyed this restaurant.",https://www.yelp.com/biz/the-cheesecake-factory-frisco?start=20,3.0,3.23,3.3,2.8000000000000003,3.138
29,Shelly M.,"Mesquite, TX",108,110,135.0,2.0,2017-03-30,The Cheesecake Factory is never high on my list of places to eat but I had a business lunch so here we go.  I ordered the shrimp with angel hair pasta and it was poorly prepared. The shrimp was so overcooked that it was rock hard (almost) and inedible. The sauce had a whole stewed tomato in it the size of my fist.  Service was slow. Their menu has a ridiculous number of items if you're a fan of the big menu. I find that a restaurant usually doesn't master a menu like that and I'd rather have fewer choices and get something really well prepared. The calorie counts on the menu are insane. 2000 calorie salads anyone?,https://www.yelp.com/biz/the-cheesecake-factory-frisco?start=20,2.92,3.2,3.3,2.504,3.0880000000000005
74,Taylor H.,"Denton, TX",0,4,1.0,1.0,2017-03-31,"Probably the worst restaurant I've been to. Only reason for giving one star is because we got sat quickly. Took ten minutes to greet us, five to actually bring the drinks. Our food was poorly put together. Looked worse than something from a fast food. Service was absolutely awful (coming from another server). Won't ever be back.",https://www.yelp.com/biz/the-cheesecake-factory-frisco?start=100,2.8,3.17,3.288,2.436,3.022
126,Jess K.,"East Brunswick, NJ",212,63,33.0,5.0,2017-03-31,Great service. Tried the skinny garlic shrimp pasta dish. Really great. Also tried the Adams pb Cheesecake! My waitress was friendly and took the time to chat for a minute which was nice and personable considering I was dining alone on a business trip. Speedy service too!,https://www.yelp.com/biz/the-cheesecake-factory-frisco?start=60,2.88,3.17,3.292,2.9640000000000004,3.054
56,Jana B.,"Allen, TX",19,138,40.0,4.0,2017-04-01,"Face it: Cheesecake Factory is known for always nailing it 3 ways--ambience, menu selection and duh, their cheesecakes.  This is usually a splurge for me but I took my niece there for her 15th birthday.  Service was excellent, food was hot and tasty, cheesecake divine, so why only 4 stars?  I had the shrimp spring rolls and got 1 shrimp split in half on each roll.  Come on Cheesecake Factory, your profit margins can surely ""spring"" for 2 shrimp per roll?",https://www.yelp.com/biz/the-cheesecake-factory-frisco?start=40,2.84,3.16,3.292,2.8640000000000003,3.0320000000000005
135,Bhinderjit K.,"Fairfield, CA",88,7,,5.0,2017-04-09,Best service I've ever gotten. Balyne the manager took care of us like no other. Made us feel like family. Best cheesecake experience of my life,https://www.yelp.com/biz/the-cheesecake-factory-frisco?start=60,2.84,3.19,3.296,2.868,3.05
22,Angela C.,"Plano, TX",36,69,236.0,4.0,2017-04-09,You can never go wrong with a slice of cheesecake from The Cheesecake Factory. Service was quick and nice. Our waitress Raquel was very sweet and always made sure our bread and drinks were filled. If you get fries make sure to ask for extra crispy or they come out a little on the soft side. I also love how the calories is listed beside everything on the menu.,https://www.yelp.com/biz/the-cheesecake-factory-frisco?start=20,2.8,3.21,3.308,2.768,3.046
8,Mariam I.,"Carrollton, TX",258,96,121.0,4.0,2017-04-26,Cheesecake is my go to spot! Everything here is always on point. The location is always poppin as well and it isn't too far from my home which is perfect. It's also located in the mall so after eating too much you can just walk it off by strolling the mall.  My number one go to item is the fried Mac and cheese. It is the best appetizer they have and honestly if you aren't starving you can eat all four of the as a meal. But if you come to cheesecake make sure you try this! You won't regret it.  They're food is always very good and they're always adding new items every now and then. The only problem I have is that the menu is so big that I get overwhelmed sometimes. But one of my favorite entrees is the chicken maderia! Especially if you like mushrooms. The service here is also always on point. They definitely work for their money.  Now to the cheesecake. My two favorites are 30th anniversary and red velvet but they have a bunch of other options to try from as well. Honestly you can't go wrong with any of them. So if you still haven't been here make sure you check them out.,https://www.yelp.com/biz/the-cheesecake-factory-frisco,2.92,3.21,3.308,2.7039999999999997,3.094
26,Jose Y.,"Plano, TX",85,21,715.0,5.0,2017-05-03,I love this place Is awesome the waitress are nice she was cute too I would love to go there and chill with everyone there even her so yeah love ya guys,https://www.yelp.com/biz/the-cheesecake-factory-frisco?start=20,3.08,3.21,3.312,2.7399999999999998,3.158
53,Glynis P.,"Baker, LA",58,7,,1.0,2017-05-15,"Don't go on a major holiday or Mother's Day. I had very slow service and our food was cold. I typically like the Cheesecake Factory, but after my experience of waiting a long time for my food I will not be back for a while.",https://www.yelp.com/biz/the-cheesecake-factory-frisco?start=40,2.92,3.21,3.3,2.2760000000000002,3.094
131,Norris C.,"Carrollton, TX",129,30,,4.0,2017-05-20,My wife and i always enjoy their food and service!! Can't go wrong with their pasta or fried catfish. And of course you can't leave the place without a cheesecake! My Lord!!! Even though I wish they never got rid of my brownie sundae cheesecake,https://www.yelp.com/biz/the-cheesecake-factory-frisco?start=60,2.88,3.21,3.3,2.6399999999999997,3.078
129,Michael T.,"The Colony, TX",0,5,,1.0,2017-05-21,"Worst excuse of customer service ive ever experienced. Needed a table for 2. Several tables open, but they tried to seat us in a crowd of people who took up seats with their bags. As we were leaving, passed a table for 2 that was ready to go. Asked the employee what was wrong with that table. She replied ""thats were she (hostess at the door) sent me"".",https://www.yelp.com/biz/the-cheesecake-factory-frisco?start=60,2.88,3.2,3.284,2.34,3.0720000000000005
19,Devon J.,"Frisco, TX",37,165,187.0,5.0,2017-05-29,Elijah was our server and he was new (which he was forthcoming with) however I never would have known if he hadn't said anything.  The service was great from the host to the server to the runners and to every other server walking around. The staff seem to really get along and respect each other. It makes for an enjoyable experience even if the food isn't great...BUT the food was awesome too! Tamale corn cakes! So good!  We will be back for sure,https://www.yelp.com/biz/the-cheesecake-factory-frisco,2.88,3.21,3.284,2.836,3.078
