,Username,location,friend_count,review_count,photo_count,rating,date,review,Url,roll25,roll100,roll250,special_25,Final_Rating
67,Sarah P.,"Monterey Park, CA",180,151,5914.0,5.0,2015-10-23,"Cheesecake Factory makes me happy. I love coming here because it makes me feel like a kid again and I can get anything I desire because they have everything (dessert, salad, steak, finger foods, etc) I want! To start, we ordered the Crab Cake Bites. These are what Mini Crab Cakes are supposed to be like. They are basically a fried lump of crab meat, held together with a filler. Served and paired with Hollandaise Aioli. I like them cause it's better than eating a whole crab. It'll save your fingers and time. Then our Cuban Spring Rolls came to the table. It tasted like a Cuban sandwich rolled up in a crispy tortilla and deep fried for enhanced taste and texture. It's so meaty and so cheeeesy. So good! We also had the tantalizing Ahi Tuna Tartare appetizer made from fresh ahi, tuna, avocado, cucumbers and fried wonton chips. So fresh and so good, and it will impress any seafood lover. Our last appetizer was the Corn Dog. They're a-okay. I don't understand why the dudes love this Corn Dog. I wonder what's the obsession about? Please do tell. Our entree was the Meatloaf with gravy. Not fancy, just comforting and fulfilling. Simply delicious! Main course was the Bacon Bacon Burger. Guilty guilty guilty. We ate like kings today. The food were AWESOME! We were debating which cheesecake is the best so we ordered two to try and yes it was difficult to make a choice... We agreed that the Blueberry was the best... sultry sweet and creamy... until the Godiva Cheesecake came along. Can someone tell me who invented that delicious Godiva Cheesecake? I don't know, and I don't care. All I do know is, it tasted so good! I'm addicted, absolutely, definitely and 100% in love with their cheesecakes. I can sit in the restaurant all day and finish the entire pie in a day. Coming here will always be an enjoyable experience for me!",https://www.yelp.com/biz/the-cheesecake-factory-bridgewater?start=60,3.72,3.47,3.47,2.516,3.5700000000000003
115,Crystal R.,"Raritan, NJ",0,3,,1.0,2015-10-26,"Always have mediocre food. Menu is so large and varied, they are definitely ""jack of all trades, master of none...."" Food tastes like pre made frozen fare. Overpriced Applebee's style food. In general, I would give it 3 stars or so but tonight's meal was especially bad. Not my favorite place, but ended up here this evening because I had a gift card with money still left on it. Gift card was since Christmas 2014, so obviously I'm not a fan of going there or it wouldn't have sat in my wallet for almost a year.  I noticed after the fact that we were never offered bread. Other tables around us received some. By the time I noticed, I was well into the meal. food took forever to come out even though the place was not especially busy tonight. I ordered a factory burger. Figured they couldn't mess a burger up too much. Burger comes out with two small pieces of meat on sourdough bread, cheese isn't even melted on, and it has no caramelized onions on it. By the time our server came back to check on us, I had already eaten about half of it. Was I supposed to sit around staring at it while it got cold? Told her about the onions. She apologized but then the only remedy was I had to wait another 5-10 min for her to come back with a bowl of caramelized onions that I could add to my now-cold half of a burger. Uh, thanks???? was not even offered a free dessert or anything. Took her forever to get the check to us and she didn't even give me a pen for me to sign it with. Had to use my own from my purse. To top off the evening, I've felt sick all night since eating there. Bloated and just unwell.... I feel better after eating a #2 meal at Wendy's, and that's not exactly a good feeling.  This has not been a favorite place of mine, but after this experience I'm definitely not going back.",https://www.yelp.com/biz/the-cheesecake-factory-bridgewater?start=120,3.72,3.44,3.44,1.988,3.5520000000000005
375,Crystal R.,"Raritan, United States",0,3,,1.0,2015-10-26,"Always have mediocre food. Menu is so large and varied, they are definitely ""jack of all trades, master of none...."" Food tastes like pre made frozen fare. Overpriced Applebee's style food. In general, I would give it 3 stars or so but tonight's meal was especially bad. Not my favorite place, but ended up here this evening because I had a gift card with money still left on it. Gift card was since Christmas 2014, so obviously I'm not a fan of going there or it wouldn't have sat in my wallet for almost a year.  I noticed after the fact that we were never offered bread. Other tables around us received some. By the time I noticed, I was well into the meal. food took forever to come out even though the place was not especially busy tonight. I ordered a factory burger. Figured they couldn't mess a burger up too much. Burger comes out with two small pieces of meat on sourdough bread, cheese isn't even melted on, and it has no caramelized onions on it. By the time our server came back to check on us, I had already eaten about half of it. Was I supposed to sit around staring at it while it got cold? Told her about the onions. She apologized but then the only remedy was I had to wait another 5-10 min for her to come back with a bowl of caramelized onions that I could add to my now-cold half of a burger. Uh, thanks???? was not even offered a free dessert or anything. Took her forever to get the check to us and she didn't even give me a pen for me to sign it with. Had to use my own from my purse. To top off the evening, I've felt sick all night since eating there. Bloated and just unwell.... I feel better after eating a #2 meal at Wendy's, and that's not exactly a good feeling.  This has not been a favorite place of mine, but after this experience I'm definitely not going back.",https://nz.yelp.com/biz/the-cheesecake-factory-bridgewater?start=120,3.64,3.41,3.41,1.988,3.5020000000000002
5,Adidev J.,"Bridgewater, NJ",8,2,,1.0,2015-12-06,"Never go to this restaurant. I am a vegetarian. Ordered fettuccini Alfredo without meat, they brought it with chicken. Told them to get without chicken - the kitchen staff, removed the chicken from the original and just brought it back. Good thing they were not very good at removing - they left a piece of chicken - hence able to figure out what they did.  The manager only offered to redo the dish.",https://www.yelp.com/biz/the-cheesecake-factory-bridgewater?start=80,3.48,3.37,3.37,2.116,3.414
307,Eero D.,"Neshanic Station, United States",15,7,,1.0,2015-12-08,The service tonight was terrible. We're leaving to get a cheesecake elsewhere on the way home. 17 minutes in between my dish and my wife's. We had to continually track down waiter who was NOT overwhelmed. We never received any drink refills. Embarrassing and terrible.,https://nz.yelp.com/biz/the-cheesecake-factory-bridgewater?start=100,3.4,3.36,3.36,2.18,3.3760000000000003
273,Bob M.,"Annandale, United States",0,82,5.0,1.0,2016-01-01,"If I could give zero stars, I would.  Went here for dinner with friends.  Spent over $200 for microwaved food.  Friends picked up the tab for their first charge in months on her.  credit card.  Needless to say, fraudulent charge alerts started blowing up her phone overnight.  I called the restaurant to complain adjacent the GM Dan took no responsibility for the problem.  In fact, he told me that he took these matters seriously and that his server L. J. WOULD NEVER STEAL credit card info.  He didn't even offer a comp dinner to make it right. People wait for hours just to get a table, so it didn't matter to him that we'll never go back there.",https://nz.yelp.com/biz/the-cheesecake-factory-bridgewater?start=80,3.32,3.35,3.35,2.212,3.338
3,Bob M.,"Annandale, NJ",0,82,5.0,1.0,2016-01-01,"If I could give zero stars, I would.  Went here for dinner with friends.  Spent over $200 for microwaved food.  Friends picked up the tab for their first charge in months on her.  credit card.  Needless to say, fraudulent charge alerts started blowing up her phone overnight.  I called the restaurant to complain adjacent the GM Dan took no responsibility for the problem.  In fact, he told me that he took these matters seriously and that his server L. J. WOULD NEVER STEAL credit card info.  He didn't even offer a comp dinner to make it right. People wait for hours just to get a table, so it didn't matter to him that we'll never go back there.",https://www.yelp.com/biz/the-cheesecake-factory-bridgewater?start=80,3.28,3.31,3.31,2.244,3.298
101,Scarlet S.,"Flemington, NJ",0,6,,1.0,2016-01-04,Horrible experience. Went here to celebrate my graduation. After the waiter came back for the second time to take our order they didn't have what I tried to order off their everyday menu then after choosing something else they brought out a cold steak. Absolutely horrible. Terrible place. Absolutely will never go back. Ruined my graduation celebration. Horrible horrible restaurant.,https://www.yelp.com/biz/the-cheesecake-factory-bridgewater?start=120,3.24,3.28,3.28,2.308,3.2640000000000007
4,Jen G.,"Piscataway Township, NJ",0,6,,2.0,2016-01-06,"So I just was here tonight with my fiancé, I ordered the vegan salad and she ordered a hamburger. Everything was fine, till I got back home. I had gotten horrible food poisoning from my salad. I don't know why, because it was suposed to be gluten-free, but somehow I got very ill. I am still not feeling well at all from it. Funny thing is that we have been here before and I never really got this ill. I usually would have just gotten a bit of a stomach ache or something small. I order the same thing all the time. Just be careful what you order here, you might get sick like I did.",https://www.yelp.com/biz/the-cheesecake-factory-bridgewater?start=80,3.12,3.25,3.25,2.472,3.198
256,Yvonne D.,"Warren, United States",43,28,22.0,3.0,2016-01-09,"Went with a friend last night. Shared the zucchini sticks. They were good.  Not as good or plentiful as Maggianos across the parking lot, but good.  Then we ordered the chopped salads with chicken. Citrus Honey dressing on the side (I find their house balsamic wayyy to oniony).  My salad was missing the tomatoes, both of our we're missing the avocado and we had to search for signs of chicken.  We also had to ask for more dressing because they brought out so little.   Service was great.  Once we got the salads together, they were great, albeit hardly any tiny chicken pieces, but a lot of greens.  We ordered dessert to go.  The Cheesecake Factory, how can you not? My friend had the Carrot Cake.  Only ate half.  Didn't think it was good.  I had the Fudgy Chocolate Cake w whipped cream on the side.  Fresh whipped cream was great.  The cake was moist, fresh, delicious.  BUT, a thin piece.  Thinnest slice of cake I've ever gotten anywhere.  I ate the whole thing.  LOL Worst response to a review ever.  Said. NOTHING! Wake up Cheesecake.  How's your stock?",https://nz.yelp.com/biz/the-cheesecake-factory-bridgewater?start=60,3.2,3.24,3.24,2.54,3.2240000000000006
42,Steve M.,"Lambertville, NJ",21,41,235.0,3.0,2016-01-09,I am here with my daughter getting some lunch  I ordered the ribeye grass feed medium rare! We were sat right away at lunch time! The ribeye was very grizzly I would not recommend this steak here to anyone since the manager said it is always this way here 1/3 of the steak was grizzle!,https://www.yelp.com/biz/the-cheesecake-factory-bridgewater?start=40,3.16,3.23,3.23,2.476,3.202
15,Lola T.,"Somerville, MA",0,100,1.0,3.0,2016-01-10,"The food is good and just what you'd expect from Cheesecake Factory (fair price, decent food).  However The dessert staff behind the glass showcase on are rude and uncaring. You'll wait in line almost an hour to get served and then they take 13 minutes to get the cheesecake you asked for in a box. Ruins my experience.  Speed it up a little-- jeez Also, the cheesecake has gotten so small and is still expensive. Don't with dessert here.",https://www.yelp.com/biz/the-cheesecake-factory-bridgewater?start=80,3.12,3.22,3.22,2.412,3.1800000000000006
262,Dave F.,"Somerville, United States",0,4,,2.0,2016-01-10,"We visited this establishment this evening in hopes of a nice night out. We knew there would be a wait and we understand that for a Saturday night. We checked in and went to the bar. As I ordered my beer the keg kicked; only getting a half a glass out. No problem. However it took 20 minutes for the keg to be replaced and when it was finally changed, the bar tender continued pouring the beer into my now warm glass with the warm bottom of the keg beer.  We then were told we had to wait another 20 to 30 minutes because the manager opened the outdoor patio. It has been cold, raining and misty all day. As the forecasters predicted, another round of showers came in and all those people had to be placed inside. Why was this patio even open tonight? The forecast haven't changed all week! Rain expected! Still waiting to be seated. Hopefully the meal will make up for it.",https://nz.yelp.com/biz/the-cheesecake-factory-bridgewater?start=60,3.08,3.19,3.19,2.3440000000000003,3.146
56,Jackie G.,"Bridgewater, NJ",199,5,,1.0,2016-02-06,"A terrible experience at Bridgewater location. We love the Cheesecake Factory, but can't seem to get a get a decent meal at this location. We waited about 45 minutes for our grilled chicken sandwiches to come out (which came out wrong). Manager tried to resolve the problem. They brought one our dishes out after about another 30 minutes, while the other dish came out 20 minutes later. The manager then avoided us all night after we were informed he wanted to speak with us. We also noticed that all the tables around us either had orders that came out wrong as well or had to wait a ridiculously long time for their food. This was All around 430 pm.  We will never be returning and would recommend if you want to go to cheesecake, go to a different location.",https://www.yelp.com/biz/the-cheesecake-factory-bridgewater?start=40,3.0,3.16,3.16,2.148,3.0960000000000005
286,Louise S.,"Manhattan, United States",0,24,3.0,1.0,2016-02-06,"Very disappointed. I called to try to make a reservation last night for my sisters birthday but was told that I need to call back the next day at 11am. I set the alarm on my phone to remind myself and called at 11am sharp, but was told that they don't accept reservations on Saturdays. But instead of apologizing for the miscommunication by the lady last night and making an exception for us this time, the manager said that I heard wrong and that its my fault for not understanding her! Really?!",https://nz.yelp.com/biz/the-cheesecake-factory-bridgewater?start=80,2.88,3.12,3.12,2.244,3.0240000000000005
78,Joseph P.,"Morristown, NJ",0,14,,5.0,2016-03-04,"This location does a really good job at living up to the Cheesecake Factory brand image. Always great service and great food. Mike at the bar is a class act! Hard to come by service this good, especially at a chain restaurant. I definitely give them props for this. One of my favorite restaurants in the area. They do it better than any of the other chain restaurants.",https://www.yelp.com/biz/the-cheesecake-factory-bridgewater?start=60,2.92,3.13,3.13,2.772,3.046
247,Rosa G.,"Point Pleasant Beach, United States",266,111,210.0,5.0,2016-03-12,"Met my bff's last  night -- 7 loud ladies exchanging Christmas  gifts  at happy hour did not rattle our server ERICA.. she was amazing. We never had an empty cocktail glass, good was flowing it literally felt like it was just us!! Excellent service & great food &  drinks",https://nz.yelp.com/biz/the-cheesecake-factory-bridgewater?start=20,2.96,3.15,3.15,2.7399999999999998,3.074
114,Charlotte L.,"New York, NY",0,49,,4.0,2016-03-27,Had a delicious Greek salad appetizer along with steak tacos (would've preferred to have the ingredients and put them together myself - do they call that fajitas?) while my friend had almond-crusted salmon salad.  This is my friend's favorite place and she was so excited that I was amenable to going there after our jewelry shopping foray earlier in the day.  I know that the service at CF can be hit-or-miss. Today's was good!,https://www.yelp.com/biz/the-cheesecake-factory-bridgewater?start=120,2.96,3.16,3.16,2.576,3.0800000000000005
113,Andy C.,"Edison, NJ",0,9,,1.0,2016-03-27,Customer service is garbage here. Went in to purchase a few slices of cheesecake with my mother and the guy at the counter treated us like crap. He was insinuating that we couldn't afford to purchase food at the restaurant. Will never go here again!,https://www.yelp.com/biz/the-cheesecake-factory-bridgewater?start=120,2.84,3.16,3.16,2.308,3.0320000000000005
374,Charlotte L.,"New York, United States",0,49,,4.0,2016-03-27,Had a delicious Greek salad appetizer along with steak tacos (would've preferred to have the ingredients and put them together myself - do they call that fajitas?) while my friend had almond-crusted salmon salad.  This is my friend's favorite place and she was so excited that I was amenable to going there after our jewelry shopping foray earlier in the day.  I know that the service at CF can be hit-or-miss. Today's was good!,https://nz.yelp.com/biz/the-cheesecake-factory-bridgewater?start=120,2.84,3.17,3.17,2.7359999999999998,3.038
373,Andy C.,"Edison, United States",0,9,,1.0,2016-03-27,Customer service is garbage here. Went in to purchase a few slices of cheesecake with my mother and the guy at the counter treated us like crap. He was insinuating that we couldn't afford to purchase food at the restaurant. Will never go here again!,https://nz.yelp.com/biz/the-cheesecake-factory-bridgewater?start=120,2.68,3.15,3.15,2.34,2.9619999999999997
19,Jonnie H.,"Bridgewater, NJ",44,8,,5.0,2016-03-29,So glad they made a restaurant closer to my house. Parking is a problem sometimes but that's the entirety of Bridgewater mall. Friendly staff. Never had a problem that wasn't resolved in some way before I went home.,https://www.yelp.com/biz/the-cheesecake-factory-bridgewater?start=80,2.68,3.17,3.17,2.612,2.9739999999999998
289,Jonnie H.,"Bridgewater, United States",44,8,,5.0,2016-03-29,So glad they made a restaurant closer to my house. Parking is a problem sometimes but that's the entirety of Bridgewater mall. Friendly staff. Never had a problem that wasn't resolved in some way before I went home.,https://nz.yelp.com/biz/the-cheesecake-factory-bridgewater?start=80,2.68,3.18,3.18,2.7399999999999998,2.9800000000000004
361,Scarlet S.,"Flemington, United States",0,6,,1.0,2016-04-01,Horrible experience. Went here to celebrate my graduation. After the waiter came back for the second time to take our order they didn't have what I tried to order off their everyday menu then after choosing something else they brought out a cold steak. Absolutely horrible. Terrible place. Absolutely will never go back. Ruined my graduation celebration. Horrible horrible restaurant.,https://nz.yelp.com/biz/the-cheesecake-factory-bridgewater?start=120,2.52,3.16,3.16,2.084,2.9040000000000004
268,Joseph P.,"Morristown, United States",0,14,,5.0,2016-04-03,"This location does a really good job at living up to the Cheesecake Factory brand image. Always great service and great food. Mike at the bar is a class act! Hard to come by service this good, especially at a chain restaurant. I definitely give them props for this. One of my favorite restaurants in the area. They do it better than any of the other chain restaurants.",https://nz.yelp.com/biz/the-cheesecake-factory-bridgewater?start=60,2.52,3.18,3.18,2.58,2.9160000000000004
277,Erin C.,"Bridgewater, United States",0,1,,1.0,2016-04-08,"Never have I had such a horrible experience with a take out order. I know that things happen and you really shouldn't judge a restruant based on this but it was plain ridiculous. Called and had them repeat the order 3 times, go there and it was competly wrong. So we waited on them to make the order again and we get it home and it was competly wrong AGAIN. There is no excuse for this and we had to eat what they gave us cause this whole ordeal was 2 hours long and we were not about to go back. I never had a bad experience in the restaurant it's self but this gave me such a sour taste not sure I'll be going back.",https://nz.yelp.com/biz/the-cheesecake-factory-bridgewater?start=80,2.36,3.18,3.18,2.18,2.8520000000000003
83,Corie L.,"Neshanic Sta, NJ",0,2,,1.0,2016-05-08,"I wouldn't even give the single star if the option allowed me to post without a rating. Ineffective, rude, unprofessional hostess staff. We made reservations a week in advance for Mother's Day. The hostess knew nothing of the reservation when we checked in. After a 45 minute wait, we left. Ridiculous. Stay away.",https://www.yelp.com/biz/the-cheesecake-factory-bridgewater?start=100,2.36,3.18,3.18,2.2760000000000002,2.8520000000000003
214,Roger Z.,"Somerville, United States",28,7,5.0,5.0,2016-05-11,"Amazing food and great service. There is a large variety on what to get as a meal, from fish tacos, chicken sandwiches to pastas and salads. The food has a great flavor. The service is ok, the only good thing is that they are not on top of you all the time. The dessert is good, obviously because the place is called cheese cake factory , but they have other things too.",https://nz.yelp.com/biz/the-cheesecake-factory-bridgewater?start=40,2.52,3.19,3.19,2.676,2.9219999999999997
225,Reese T.,"North Brunswick Township, United States",5,48,1.0,3.0,2016-05-11,"If you have allergies PLEASE be careful eating here!  This is absolutely terrifying. I don't know if this is specific to this branch but this is the SECOND time I have found a menu error in regards to a nut ingredient at this place. As someone with nut allergies I'll reiterate that is extremely scary and as a chain restaurant I don't understand how they leave themselves so liable for a lawsuit. I don't know if it's the chef's not following the menu or if it's a chain-wide error.  Recently went here with my bf after having a sadly disappointing dinner at Shake Shack for some post-dinner drinks and dessert. We sat at the bar, ordered drinks and decided to split a slice of the blackout cake a la mode. The menu states that this finished with almonds. Our cake definitely came with walnuts. Not okay. The slice was huge we couldn't finish it between the two of us and our drinks were good but that nut thing is crazy. Once is barely forgiveable, twice is...I have no words.",https://nz.yelp.com/biz/the-cheesecake-factory-bridgewater?start=40,2.6,3.18,3.18,2.348,2.9480000000000004
260,Andre H.,"Bethlehem, United States",0,7,,2.0,2016-05-14,"I been to a bunch of different Cheesecake Factories in Pennsylvania and New Jersey and this one in Bridgewater consistently is horrible. Customer service is terrible and they don't care about their customers at all. Also, the food at this location seems to be so different from all of the other Cheesecake Factories. Save yourself the bad experience and go eat somewhere else.",https://nz.yelp.com/biz/the-cheesecake-factory-bridgewater?start=60,2.64,3.17,3.17,2.248,2.9579999999999997
70,Andre H.,"Bethlehem, PA",0,7,,2.0,2016-05-14,"I been to a bunch of different Cheesecake Factories in Pennsylvania and New Jersey and this one in Bridgewater consistently is horrible. Customer service is terrible and they don't care about their customers at all. Also, the food at this location seems to be so different from all of the other Cheesecake Factories. Save yourself the bad experience and go eat somewhere else.",https://www.yelp.com/biz/the-cheesecake-factory-bridgewater?start=60,2.68,3.16,3.16,2.2800000000000002,2.9680000000000004
270,Sharon H.,"Sun City West, United States",2,62,21.0,3.0,2016-05-20,"Lunch outside is always fantastic this time of year.  Chicken fingers for kids were crispy and hot and grilled cheese sandwich was delicious.  Adults had small plates of lettuce wrapped chicken tacos ( one went Asian with sprouts, peanut sauce and tomatoes and the other Mexican with corn salsa, avocado and cheese) and a chicken Caesar salad.  All were delicious but in general, way to much food was served.  It is a shame to have so much food left.  The grilled cheese sandwiches were actually two each and the Caesar salad although described as small could serve four people.  Service was good but tables way to close together.",https://nz.yelp.com/biz/the-cheesecake-factory-bridgewater?start=80,2.76,3.17,3.17,2.476,3.006
0,Sharon H.,"Sun City West, AZ",2,62,21.0,3.0,2016-05-20,"Lunch outside is always fantastic this time of year.  Chicken fingers for kids were crispy and hot and grilled cheese sandwich was delicious.  Adults had small plates of lettuce wrapped chicken tacos ( one went Asian with sprouts, peanut sauce and tomatoes and the other Mexican with corn salsa, avocado and cheese) and a chicken Caesar salad.  All were delicious but in general, way to much food was served.  It is a shame to have so much food left.  The grilled cheese sandwiches were actually two each and the Caesar salad although described as small could serve four people.  Service was good but tables way to close together.",https://www.yelp.com/biz/the-cheesecake-factory-bridgewater?start=80,2.84,3.16,3.16,2.54,3.0320000000000005
