,Username,location,friend_count,review_count,photo_count,rating,date,review,Url,roll25,roll100,roll250,special_25,Final_Rating
308,Hannah Jayne H.,"Springfield, United States",87,20,4.0,2.0,2014-01-24,"Let's just start out calling it like it is: service nightmare, but same good food I've come to expect at one of these restaurants.  I thought this trip to this Cheesecake Factory was going to be awesome! We  walked right in the door and were seated immediately. That NEVER happens at any Cheesecake Factory, so I had super high hopes for the rest of my visit.  But it was pretty much all downhill from there. We waited 35 minutes before someone even came to talk to us. I would've been more understanding, but besides a few people at the bar, we were in an otherwise empty restaurant.  We waited extraordinarily long periods of time between getting water, ordering drinks and then having our order taken. We tried to do it all at once after our server's long disappearance but she kept telling us she'd come back and take our order later. We also never got that super wonderful basket of bread that you usually get (we asked for it after we realized that it wasn't coming)... People should know better than to deprive a girl of her sweet, sweet carbohydrates!!! After our food came out we never saw our original server again. We had to flag someone down and ask for our check. Someone else finally came over and he was pretty awesome! He apologized profusely after we explained our situation to him and he was super quick in getting us boxes for our food, a slice of cheesecake to go and our check.  Long story short: the food gets the first star and our second server gets the second. As far as Cheesecake Factory goes this definitely was not my best experience.",https://nz.yelp.com/biz/the-cheesecake-factory-bridgewater?start=100,3.28,3.28,3.28,3.1440000000000006,3.2800000000000002
143,Joy B.,"Bridgewater, NJ",0,6,,4.0,2014-01-29,One of the best places for happy hour if you come early enough. Bar area fills up quickly. Margaritas are good. Amazing avocado egg rolls. Service is slow at times.,https://www.yelp.com/biz/the-cheesecake-factory-bridgewater?start=160,3.32,3.32,3.32,3.408,3.3200000000000003
333,Joy B.,"Bridgewater, United States",0,6,,4.0,2014-01-29,One of the best places for happy hour if you come early enough. Bar area fills up quickly. Margaritas are good. Amazing avocado egg rolls. Service is slow at times.,https://nz.yelp.com/biz/the-cheesecake-factory-bridgewater?start=160,3.4,3.4,3.4,3.3760000000000003,3.4000000000000004
349,Cindi J.,"Bethlehem, United States",0,7,7.0,5.0,2014-02-03,"I took my daughter, who is a total foodie, and her BF, who has a fairly limited diet.  No one was disappointed.  The menu is extensive and takes some time to go over.  The waitress was very helpful with suggestions when asked, which I appreciate.  We started with the nachos which were more than the 3 of us, very hungry, could finish.  The chips tasted homemade and the toppings were perfect in quantity and flavors.  We went on to try the chicken piccata (seemed like homemade angel hair or at least fresh along with), 4 cheese pasta and Caesar salad with individual margharitta  pizza.  We couldn't possibly eat all.  The salad was perfection as far as cold crisp fresh lettuce with just the right dressing & a few yummy croutons.  The chicken was tender and sauce delicious!  The pasta was so tasty but we only found 3 small pieces of chicken in the 'add chicken' option.  As my daughter said '$3 each piece' lol.  We brought home 2 slices of cheese cake but we all know that will be awesome.  The food was worth the trip alone!",https://nz.yelp.com/biz/the-cheesecake-factory-bridgewater?start=160,3.48,3.48,3.48,3.4440000000000004,3.4800000000000004
326,Dana M.,"New York, United States",102,276,96.0,4.0,2014-02-28,This place ALWAYS has a wait - but it is worth it if you do wait. Nicely decorated (as is every other Cheese cake factory). The food portions are really big and the food is really creamy. The people are friendly and pleasant.,https://nz.yelp.com/biz/the-cheesecake-factory-bridgewater?start=140,3.52,3.52,3.52,3.3120000000000003,3.5200000000000005
136,Dana M.,"New York, NY",101,274,96.0,4.0,2014-02-28,This place ALWAYS has a wait - but it is worth it if you do wait. Nicely decorated (as is every other Cheese cake factory). The food portions are really big and the food is really creamy. The people are friendly and pleasant.,https://www.yelp.com/biz/the-cheesecake-factory-bridgewater?start=140,3.64,3.64,3.64,3.3120000000000003,3.6400000000000006
159,Cindi J.,"Bethlehem, NJ",0,7,7.0,5.0,2014-03-02,"I took my daughter, who is a total foodie, and her BF, who has a fairly limited diet.  No one was disappointed.  The menu is extensive and takes some time to go over.  The waitress was very helpful with suggestions when asked, which I appreciate.  We started with the nachos which were more than the 3 of us, very hungry, could finish.  The chips tasted homemade and the toppings were perfect in quantity and flavors.  We went on to try the chicken piccata (seemed like homemade angel hair or at least fresh along with), 4 cheese pasta and Caesar salad with individual margharitta  pizza.  We couldn't possibly eat all.  The salad was perfection as far as cold crisp fresh lettuce with just the right dressing & a few yummy croutons.  The chicken was tender and sauce delicious!  The pasta was so tasty but we only found 3 small pieces of chicken in the 'add chicken' option.  As my daughter said '$3 each piece' lol.  We brought home 2 slices of cheese cake but we all know that will be awesome.  The food was worth the trip alone!",https://www.yelp.com/biz/the-cheesecake-factory-bridgewater?start=160,3.64,3.64,3.64,3.3160000000000003,3.6400000000000006
306,Tyler A.,"Green Brook, United States",63,185,395.0,2.0,2014-04-13,"I do not ever leave here thinking, ""I'm happy I came here!"" I have a very negative opinion about the place, it's due to the oversized menu and the way the food comes out of the kitchen. Also, what self respecting restaurant serves drinks and condiments in plastic? I will never understand why CCF is so popular.",https://nz.yelp.com/biz/the-cheesecake-factory-bridgewater?start=100,3.52,3.38,3.38,2.8880000000000003,3.4360000000000004
96,Tyler A.,"Green Brook, NJ",63,185,395.0,2.0,2014-04-13,"I do not ever leave here thinking, ""I'm happy I came here!"" I have a very negative opinion about the place, it's due to the oversized menu and the way the food comes out of the kitchen. Also, what self respecting restaurant serves drinks and condiments in plastic? I will never understand why CCF is so popular.",https://www.yelp.com/biz/the-cheesecake-factory-bridgewater?start=100,3.48,3.39,3.39,2.9200000000000004,3.426
103,Rabbit S.,"Readington Township, NJ",21,6,1.0,5.0,2014-04-21,"God, the selection...the cheesecake? Chain restaurant? You'd never know it going here! Staff, selection, GF menu... It's a personal favorite. ;)",https://www.yelp.com/biz/the-cheesecake-factory-bridgewater?start=120,3.6,3.45,3.45,3.156,3.5100000000000002
325,Mark H.,"Secaucus, United States",55,50,18.0,4.0,2014-04-21,"I never understood why people always raved about CCF, the previous two times I had dined there, the food was nothing special but always accompanied with a long wait. When my wife and mother-in-law wanted to go there for Easter dinner I was reluctant.   I had never been to this specific CCF before, so I decided to ""go with the flow"" and agreed. We waited for a table about 1/2 hour but considering it was Easter, I guess that's not all that bad. We were greeted by our waiter almost immediately upon being seated. He was such a nice, extremely personal guy and had a really great attitude especially considering that he was working on Easter Sunday. We ordered our drinks and he offed to bring some bread to our table. I had a Margarita on the rocks w/ salt. It was so so...a bit sour for my taste. Since it WAS Easter I decided to treat myself and I ordered the fillet Mignon. Wow, what a difference from my other visits. I guess that was the right thing to order because it was probably top 10 pieces of meat I've ever ordered. It was cooked perfectly and really had a great taste to it. It was salty which I like. Right up there with some of the better steakhouses I've ate at. I'm not a big dessert person so i didn't have any cake but my wife did and I guess she liked it because it was gone in less than 5. Coffee was alright...like the clear mugs. I'd like to bring up our server again because he really was good at what he does...I wish I remembered his name so I could give him credit. But he had dark curly hair and dark rimmed glasses and a soft voice. Not only was he friendly, but he also knew the menu very well and effectively described the items in question. He also made suggestions and went out of the way to make sure we were taken care of. A server of this caliber you usually don't see at a chain restaurant. The business should consider themselves luck to have such a great employee.  $125 for the 3 of us with 2 drinks each and fillet...not bad for Easter Sunday. Did I mention that it was Easter Sunday enough times in this review?",https://nz.yelp.com/biz/the-cheesecake-factory-bridgewater?start=140,3.64,3.48,3.48,3.152,3.5440000000000005
363,Rabbit S.,"Readington Township, United States",21,6,1.0,5.0,2014-04-21,"God, the selection...the cheesecake? Chain restaurant? You'd never know it going here! Staff, selection, GF menu... It's a personal favorite. ;)",https://nz.yelp.com/biz/the-cheesecake-factory-bridgewater?start=120,3.52,3.42,3.42,3.188,3.4600000000000004
135,Mark H.,"Secaucus, NJ",55,50,18.0,4.0,2014-04-21,"I never understood why people always raved about CCF, the previous two times I had dined there, the food was nothing special but always accompanied with a long wait. When my wife and mother-in-law wanted to go there for Easter dinner I was reluctant.   I had never been to this specific CCF before, so I decided to ""go with the flow"" and agreed. We waited for a table about 1/2 hour but considering it was Easter, I guess that's not all that bad. We were greeted by our waiter almost immediately upon being seated. He was such a nice, extremely personal guy and had a really great attitude especially considering that he was working on Easter Sunday. We ordered our drinks and he offed to bring some bread to our table. I had a Margarita on the rocks w/ salt. It was so so...a bit sour for my taste. Since it WAS Easter I decided to treat myself and I ordered the fillet Mignon. Wow, what a difference from my other visits. I guess that was the right thing to order because it was probably top 10 pieces of meat I've ever ordered. It was cooked perfectly and really had a great taste to it. It was salty which I like. Right up there with some of the better steakhouses I've ate at. I'm not a big dessert person so i didn't have any cake but my wife did and I guess she liked it because it was gone in less than 5. Coffee was alright...like the clear mugs. I'd like to bring up our server again because he really was good at what he does...I wish I remembered his name so I could give him credit. But he had dark curly hair and dark rimmed glasses and a soft voice. Not only was he friendly, but he also knew the menu very well and effectively described the items in question. He also made suggestions and went out of the way to make sure we were taken care of. A server of this caliber you usually don't see at a chain restaurant. The business should consider themselves luck to have such a great employee.  $125 for the 3 of us with 2 drinks each and fillet...not bad for Easter Sunday. Did I mention that it was Easter Sunday enough times in this review?",https://www.yelp.com/biz/the-cheesecake-factory-bridgewater?start=140,3.52,3.43,3.43,3.056,3.466
95,Denny S.,"Rochester, NY",211,354,1012.0,4.0,2014-05-11,"What I love about cheesecake factory: 1. Happy hour w/decent food 4-6pm 2. Great service. 3. Good menu selection for happy hour. 4. Outdoor seating to hang out What I don't really love about cheesecake factory: 1. Although its called cheesecake factory, i am not a big fan of their cheesecake. I personally think it's just okay. 2. The regular menu is too much selection and it can be very confusing. 3. In my opinion, if they revamp their menu and have something more interesting. It would be really cool. Don't get me wrong for someone who lives in central/north jersey, I am grateful having a cheesecake factory around.",https://www.yelp.com/biz/the-cheesecake-factory-bridgewater?start=100,3.64,3.5,3.5,2.9920000000000004,3.5560000000000005
82,Vicki R.,"RICHMOND HILL, NY",280,31,,4.0,2014-05-21,"Believe it or not The Cheesecake factory might be my favorite restaurant. It is not fancy, but is always good and has a giant menu. Def my go to place,",https://www.yelp.com/biz/the-cheesecake-factory-bridgewater?start=100,3.64,3.51,3.51,2.9600000000000004,3.5620000000000003
324,Chris C.,"Warren, United States",27,17,2.0,5.0,2014-05-21,"The menu's huge (great selection), the service is great, & the Cheesecake is as good as you would expect from a place that bears the word in it's name.",https://nz.yelp.com/biz/the-cheesecake-factory-bridgewater?start=140,3.72,3.53,3.53,3.0280000000000005,3.6060000000000003
292,Vicki R.,"RICHMOND HILL, United States",280,31,,4.0,2014-05-21,"Believe it or not The Cheesecake factory might be my favorite restaurant. It is not fancy, but is always good and has a giant menu. Def my go to place,",https://nz.yelp.com/biz/the-cheesecake-factory-bridgewater?start=100,3.8,3.53,3.53,2.8640000000000003,3.638
134,Chris C.,"Warren, NJ",27,17,2.0,5.0,2014-05-21,"The menu's huge (great selection), the service is great, & the Cheesecake is as good as you would expect from a place that bears the word in it's name.",https://www.yelp.com/biz/the-cheesecake-factory-bridgewater?start=140,3.8,3.54,3.54,2.9320000000000004,3.644
299,Cat L.,"Montgomery, United States",10,29,25.0,4.0,2014-06-10,i placed an order over the phone for fish tacos and fried mac & cheese I got there with in 20 minutes and the food was already ready. The mac & cheese was good but I wish it was lobster mac & cheese that would be extra delicious. The fish tacos are subpar the tortilla wrap was fried and it was kind of soggy. The fish I got fried not grilled and it tasted just like fried fish  you couldn't taste any seasonings other than lime juice. The black beans and the rice was phenomenal it was so yummy but it was like on the side. they gave you four fish tacos and those tacos were literally the size of my hand. over all I would recommended it for people who like large portions of food. it's definitely not something  for food adventurists. The service was excellent though very quick very fast and they friendly. I didn't tip because I did takeout and it turned out to be around $25,https://nz.yelp.com/biz/the-cheesecake-factory-bridgewater?start=100,3.84,3.53,3.53,2.8000000000000003,3.654
378,M B.,"Chatham, United States",4,19,8.0,3.0,2014-06-15,"For a chain, three stars is high praise!  The selection is vast and the service was attentive (we were eating in the middle of a shift change and the new waiter came over to introduce himself and ask if we needed anything). My favorite dish was the Santorini Salad - a faro based salad that was sublime.  The rest of the food was well prepared and special requests were honored.  My waiter forgot if I wanted to omit the feta cheese or the beets so both were left off the salad and brought to me in side dishes so I could add the one I wanted, and leave off the one I did not.  The only thing that really bothers me about this place is the cavernous sites they all occupy - so noisy!!!  It's hard to take after a while.  I recommend going on off hours if you hate cacophony.",https://nz.yelp.com/biz/the-cheesecake-factory-bridgewater?start=120,3.84,3.51,3.51,2.668,3.642
118,M B.,"Chatham, NJ",4,19,8.0,3.0,2014-06-15,"For a chain, three stars is high praise!  The selection is vast and the service was attentive (we were eating in the middle of a shift change and the new waiter came over to introduce himself and ask if we needed anything). My favorite dish was the Santorini Salad - a faro based salad that was sublime.  The rest of the food was well prepared and special requests were honored.  My waiter forgot if I wanted to omit the feta cheese or the beets so both were left off the salad and brought to me in side dishes so I could add the one I wanted, and leave off the one I did not.  The only thing that really bothers me about this place is the cavernous sites they all occupy - so noisy!!!  It's hard to take after a while.  I recommend going on off hours if you hate cacophony.",https://www.yelp.com/biz/the-cheesecake-factory-bridgewater?start=120,3.76,3.5,3.5,2.604,3.604
311,Richard R.,"Somerville, United States",7,100,7.0,1.0,2014-08-11,"Just another chain cranking out crappy food if u ask me, I will go to McCormick's over cheesecake any day of the week.",https://nz.yelp.com/biz/the-cheesecake-factory-bridgewater?start=140,3.72,3.47,3.47,2.5320000000000005,3.5700000000000003
127,Bruce L.,"Pebble Beach, CA",43,20,1.0,3.0,2014-08-26,"Love the place, but are you kidding me ... out of wings at 7pm on a Tuesday night?  Advised 20 minutes after ordering. Handled nicely by the manager, but really?",https://www.yelp.com/biz/the-cheesecake-factory-bridgewater?start=140,3.68,3.47,3.47,2.8600000000000003,3.5540000000000003
317,Bruce L.,"Pebble Beach, United States",43,20,1.0,3.0,2014-08-26,"Love the place, but are you kidding me ... out of wings at 7pm on a Tuesday night?  Advised 20 minutes after ordering. Handled nicely by the manager, but really?",https://nz.yelp.com/biz/the-cheesecake-factory-bridgewater?start=140,3.64,3.47,3.47,2.8920000000000003,3.5380000000000003
265,Aaron T.,"Easton, United States",359,503,120.0,3.0,2014-09-10,"I've been here a few times for business lunches. Cheesecake Factory is great for its large menu with broad appeal for whatever a person is in the mood for. In my case, their menu clearly marks items that can be made gluten free by request. This makes the dining experience much easier for me. For lunch, I've had their burgers with the gluten free buns and they weren't bad. For dessert, they have a gluten free cheesecake that is made with Godiva chocolate. With my dietary restrictions dessert opportunities are far and few between, so I typically have one when the option is available ""because I can."" The seating is comfortable, but the service was very slow - especially when I was hoping for a business lunch that was reasonably modest in time. No doubt, Cheesecake Factory is a good restaurant with a lot of options, not to forget the cheesecake. I'd never go out of my way to dine at one, but I'd never turn down an offer to go either.",https://nz.yelp.com/biz/the-cheesecake-factory-bridgewater?start=60,3.68,3.47,3.47,2.9240000000000004,3.5540000000000003
291,Sam D.,"Charlotte, United States",23,192,123.0,4.0,2014-09-10,"Always a fan of Cheesecake Factory for dinner but lunch I'll reconsider next time. Food was great as always but the service was a bit slow for lunch. I arrived around 11:30am and only 2 other customers were seated but lunch still snailed out. Regardless, the food was great. I had the lunch Shepard's Pie which was delicious.",https://nz.yelp.com/biz/the-cheesecake-factory-bridgewater?start=100,3.76,3.47,3.47,3.024,3.5860000000000003
102,Dylan D.,"Skillman, NJ",25,48,12.0,3.0,2014-09-17,"Just getting back from a night out with my parents. The food was ok but some of our favorites were taken off the menu. Our waitress was very personable when she was around. She also found a way for the kitchen chefs to make my moms favorite salad. Despite being accommodating, she wasn't around to check on our table enough. Our dinner and bread plates weren't taken away at all. We left and the bread appetizer plates were still on out table along with the dinner plates. I don't get to treat my parents out to dinner often because of my busy schedule with work and my pet sitting business so I was hoping this night would be special. I don't know if I would go here for another special occasion again. I would go back for a regular lunch but not for anything special.",https://www.yelp.com/biz/the-cheesecake-factory-bridgewater?start=120,3.72,3.46,3.46,2.8920000000000003,3.5640000000000005
362,Dylan D.,"Skillman, United States",25,48,12.0,3.0,2014-09-17,"Just getting back from a night out with my parents. The food was ok but some of our favorites were taken off the menu. Our waitress was very personable when she was around. She also found a way for the kitchen chefs to make my moms favorite salad. Despite being accommodating, she wasn't around to check on our table enough. Our dinner and bread plates weren't taken away at all. We left and the bread appetizer plates were still on out table along with the dinner plates. I don't get to treat my parents out to dinner often because of my busy schedule with work and my pet sitting business so I was hoping this night would be special. I don't know if I would go here for another special occasion again. I would go back for a regular lunch but not for anything special.",https://nz.yelp.com/biz/the-cheesecake-factory-bridgewater?start=120,3.68,3.46,3.46,2.9240000000000004,3.5480000000000005
329,Jessica F.,"Phillipsburg, United States",29,21,9.0,1.0,2014-09-19,"Today just reassured me the reason I have always thought this is the most overrated chain. I don't know what people see in this place! They are the slowest place ever. Today as soon as I sat down I told the waitress I was in a hurry and placed my drink and food order without even looking at the menu. She said ok..25 minutes later my friends get their drinks...5 minutes later they get there food. And I don't even have my drink after a half hour when I was the one that said I was in a hurry. As my drink came out after 35 minutes I told the waitress to cancel my food as I didn't have time (on lunch break). The remark I got from her was ""I put it in even before their's"" not an I'm sorry, it's on the house or anything. The manager came over without me asking and he was very nice and sympathetic, apologized,  and offer to wrap it up to go on the house. The only reason I would ever go back here is because this was the place I went on my first date with the man I love. If it wasn't for that I wouldn't return. If you are at the bridgewater mall go eat at the food court. Better food, cheap, fast, and better service actually haha",https://nz.yelp.com/biz/the-cheesecake-factory-bridgewater?start=140,3.4,3.4,3.4,2.7880000000000003,3.4000000000000004
139,Jessica F.,"Phillipsburg, NJ",29,21,9.0,1.0,2014-09-19,"Today just reassured me the reason I have always thought this is the most overrated chain. I don't know what people see in this place! They are the slowest place ever. Today as soon as I sat down I told the waitress I was in a hurry and placed my drink and food order without even looking at the menu. She said ok..25 minutes later my friends get their drinks...5 minutes later they get there food. And I don't even have my drink after a half hour when I was the one that said I was in a hurry. As my drink came out after 35 minutes I told the waitress to cancel my food as I didn't have time (on lunch break). The remark I got from her was ""I put it in even before their's"" not an I'm sorry, it's on the house or anything. The manager came over without me asking and he was very nice and sympathetic, apologized,  and offer to wrap it up to go on the house. The only reason I would ever go back here is because this was the place I went on my first date with the man I love. If it wasn't for that I wouldn't return. If you are at the bridgewater mall go eat at the food court. Better food, cheap, fast, and better service actually haha",https://www.yelp.com/biz/the-cheesecake-factory-bridgewater?start=140,3.52,3.43,3.43,2.7560000000000002,3.466
297,Sudhir M.,"Rahway, United States",44,52,223.0,4.0,2014-09-19,"A restaurant chain, some people like it and some don't, but from the many times I have been to the Cheesecake Factory, I find all their dishes on the menu to be quite good. Also haven't really heard anyone with a real bad comment about its food. Apart from the food, they also have a bar and a great ambience/interior decoration which is consistent throughout all their restaurants. While their dessert (Cheesecake) is what they are known for, their appetizers and entrees are also a delight. My favorite at the restaurant is the Chicken and Shrimp Gumbo (Shrimp, Chicken, Andouille Sausage, Tomatoes, Peppers, Onions and Garlic Simmered in a Spicy Cajun Style Broth with Cream. Topped with Steamed White Rice). An appetizer I tried this time was the Tex Mex Eggrolls (Spicy Chicken, Corn, Black Beans, Peppers, Onions and Melted Cheese served with Sour Cream and Salsa). Tip: Relish the freshly baked wheat bread with butter that is complimentary.",https://nz.yelp.com/biz/the-cheesecake-factory-bridgewater?start=100,3.36,3.38,3.38,3.056,3.3720000000000003
