Username,location,friend_count,review_count,photo_count,rating,date,review,Url
Kevin M.,"Waipahu, HI",1,11,1,1.0,10/28/2017,"15-20 minutes wait for inside and outside.  We have a party of three, it's not raining, it's not cold. They must be short staffed or something but it's like they hate money. 5 parties waiting while the entire section (pictured) is empty.  I'm not a restaurant manager but I'd figure you'd want to sit parties and get some money flowing instead of having it wait at your doorstep.",https://www.yelp.com/biz/california-pizza-kitchen-mililani-3?start=40
Scot U.,"Mililani, HI",22,71,85,3.0,9/10/2017,"California Pizza Kitchen has arrived in Mililani !  For a while I was hoping that it would come closer to Mililani (instead of having to go to Pearlridge) and it finally did.  We waited until the novelty died down a bit and the wait was more manageable, and  decided to go early for one of the first seating the other day.   I have to say the waiter was really attentive and personable.  I think since we were early and it wasn't a full house yet, he could spend more time with the existing people already seated and that was nice. The decor is the typical CPK, and everything is new and clean. You can sit outside (what used to be the sidewalk area), or inside. But depending on the time of day, if you choose to sit outside, you could be in the sun.  So maybe check it out as you're going in as it could affect where you choose to sit. Food can pretty quickly and yup, tasted like how I expected. Consistent CPK fare and presentation. So this place is A-OK, classic CPK presentation and taste, and everything that you would expect.  So yay! Another place to eat in Mililani!",https://www.yelp.com/biz/california-pizza-kitchen-mililani-3?start=40
Chelsie H.,"Mililani, HI",239,52,4,3.0,11/28/2017,"My family and I love coming here. The kids love to play with the dough and the food and drinks are good. The only problem, EVERY SINGLE, not even exaggerating, time we come they forget something. my drink, to take someone in our parties order, food item, our rewards... it is so frustrating. we might have to start doing take out or try new places.",https://www.yelp.com/biz/california-pizza-kitchen-mililani-3?start=40
Lika G.,"Wahiawā, HI",24,151,190,3.0,5/22/2017,The service was excellent. The  food  was fresh and hot. Place was clean. The wait very short. Overall a great experience  potato soup ans BBQ chicken salad was great along with the spicy cauliflower sure was spicy and good,https://www.yelp.com/biz/california-pizza-kitchen-mililani-3?start=40
Lauren Y.,"Honolulu, HI",59,17,1,2.0,9/19/2017,"I'm a frequent flyer at CPK, however after my first experience at CPK Mililani, I'm afraid it will be my last. The only thing that substantiates the one extra star from the minimum would be the bartender who was working that night, who was really pleasant and professional.  After expecting this visit to go like any other CPK visit I've ever had, I ordered the usual (pesto cream penne, add chicken - YUM) and although the restaurant was not packed full, I did expect a wait as there was a decent amount of people in there. As we sat at the bar, my two friends and I received and finished our first round of drinks before bread came out. After ordering and finishing another round, we grew a little concerned. We looked around, and saw everyone who had ordered after us, already enjoying their meals.  We then checked in the the bartender, who said our food would be out any minute. Guess there was a mix up in the kitchen. Eh, it happens. Another round of drinks go by... still nothing. We ask the bartender again if she knows anything about our food. She says she will send someone to check on it again. The woman returns and apologizes, and lets us know our food will be out any minute now... heard that already. About 5 minutes later, we get our food - AND IT'S NOT EVEN HOT. Mind you, it's not ice cold, but it's definitely been sitting out for quite some time. I wouldn't even say it was still warm. At this point, I'm thoroughly annoyed. Then as I'm eating, I notice that there are about a total of 6 small chunks of chicken in my pasta. 6 small bites of chicken for an upcharge of $3 and change? Not right. I've ordered this at Kahala, Ala Moana, Kailua and Pearlridge, and I've never had this little chicken.  I keep my mouth shut per my friends' requests, although I'm fuming on the inside wanting to send all our dishes back to get refired.  On top of that... after waiting over an hour and fifteen minutes for our food to come out... and having the staff be well aware of this and our frustration.... No word from the manager. No discount. No big apology for the bad experience. Just a ""sorry about that"" when the food actually comes out.  Kind of disappointing that you have to make a big scene these days in order to get some kind of gesture from the business to apologize for having you wait, then serving you old food. I was expecting a 10% off or a free dessert or at the very least, the manager coming out and apologizing for the confusion. But sadly, nothing. For that reason, 2 stars. Really the most disappointing CPK experience I've ever had.",https://www.yelp.com/biz/california-pizza-kitchen-mililani-3?start=40
Marshall L.,"Honolulu, HI",212,7,44,5.0,10/11/2017,Come out and support our kids soccer club teams that are traveling to Washington this coming summer Just show this on your smart phone at CPK Mililani today. 20% of the total bill will be donated to the club!,https://www.yelp.com/biz/california-pizza-kitchen-mililani-3?start=40
Charmaine C.,"Waianae, HI",41,112,65,5.0,6/18/2017,"Sad to say this Kapolei is lacking. It's either a hit or miss & the last time we were there it was a major miss, enough for both of us to not go back! The service was always late, enough for our server to not pay attention to us so we had to get the manager! The food was lacking, the only thing that was good was the drink! Will not be returning to this location but the other locations are good!! UPDATED!!!! I was invited back to Kapolei California pizza kitchen for an Entree as well as a better service experience. Thank you Alfred for inviting us back after a previous disastrous visits!! That was going the extra mile and I really appreciated it! We loved our visit and will be make it a point to visit again!! Love our server Brit, she was helpful and wonderful!",https://www.yelp.com/biz/california-pizza-kitchen-mililani-3?start=40
Nicole Y.,"Mililani, HI",416,233,702,5.0,3/30/2017,"After two CPK fails at the Kapolei location, I was a bit apprehensive about dining here. But, I decided to chance it and brought my dad here for lunch.  The restaurant itself isn't very big as most of the restaurant is comprised of their large patio. We were greeted by the host who said the wait was 20 minutes. Relived it was only 20 minutes, we decided to wait. While we waited, we checked out the inside of the restaurant and noticed all of the staff that were on duty. We observed the managers checking in on patrons and efficient staff promptly clearing tables. Needless to say, we were impressed.  Before we knew it, it was time to be seated and we were quickly greeted by our server. Since we had time to figure out what we want to eat, we immediately ordered our food. Despite the restaurant being busy, our food arrived rather quickly. While we enjoyed our meal, we were frequently asked how we were doing or if we needed anything. It was really nice to have such friendly and attentive servers.  My experience here today changed my opinion on CPK. I had vowed to not dine at CPK after the bad experiences I had at the Kapolei location. But, not all locations are the same. We had an awesome meal with excellent service here at the Mililani location. Despite just opening four days ago, things seem to be running pretty smoothly. The staff are well trained and efficient.  Mahalo to the staff at CPK Mililani, we'll be back for more great meals here!  Tip: check out the new menu items ..",https://www.yelp.com/biz/california-pizza-kitchen-mililani-3?start=40
Tina L.,"Mililani, HI",96,73,96,2.0,11/19/2017,"We came in for lunch on a Sunday, didn't seem to be too busy. We waited only a few minutes to be seated. I ordered the meat sauce pasta for my son and asked for the fruit plate asap to start for him. If u have young kids u know they don't like to wait for the food so I wanted something quick for him to snack on while we waited for our mains. After waiting for a while his fruits came WITH his pasta, and his pasta was cold. I ordered the garlic cream fettuccini with shrimp and mushrooms, I've ordered this many times before and today it just tasted off. Overall not a good visit. We originally stayed away from the mililani restaurant because on our first visit the server delivered our HOT food OVER my 1 year old sons head. You may not think it's a big deal but if something had happened to fall on him you better believe it would've been a big deal. However since we live in mililani we decided to give them another chance but I think We'll stick to the pearlridge location.",https://www.yelp.com/biz/california-pizza-kitchen-mililani-3?start=40
Michael M.,"Honolulu, HI",123,38,88,3.0,4/2/2017,"4/1/2017 It's a Saturday night and yes, they're just in their first week of opening.   We checked in with the front table, was told it'll be an hour wait and they will send us a text message when it's ready.   Which is fine, but remind you that there is a few tables that's been open for awhile.  4 tables which could seat 4 people each is open right at this moment.   So we walk around for about 45 mins, and finally come back to see that those 4 tables are still unseated.  We wait a bit more longer and finally decided to check back in with the front table, was told that it would be another 20 mins wait.  What the.....?!?? Are you serious?   As we wait a bit longer, I take a peek inside and there is 3 booths that's open, the same 4 tables that is open. And 2, 6 person tables open. We heard some other people near us also complaining, how come they are taking so long to seat people?   So we finally got a seat. Which took about an hour an a half. As we waited, they brought us the usual bread with oil. We start handing out the plates and from the looks of it, most of it seemed dirty as they had some black and brown spots.   The waitress takes our order. Not gonna mention the whole order. Anyways, we got the appetizers and we got most of our drinks. Well just the waters.  About 20 mins later, were still wondering where is our other soft drinks. I guess the waitress forgot what we ordered and asked us what we ordered.  We get our order, which the food is great. After we're almost done eating.  The waitress asks us if we need to box our leftovers, which we said yes.  A few of our cups of drinks is all empty. I mention to the waitress we need more drinks. She nods her head and walks away going to pack our leftovers. After she packs all of it. She asks us if we need a desert menu. I said no, but could we get more refills please. She then reacts and was like ""oh I'm sorry I forgot. What did you order again?"" Overall, customer service wasn't up to par as the other CPK. Food on the other hand was excellent.  If customer service was better (hoping they will get better) I would of gave 5 stars but knocked off two stars cause of it.",https://www.yelp.com/biz/california-pizza-kitchen-mililani-3?start=40
Hyn G.,"Mililani, HI",67,88,24,5.0,5/4/2017,This place is super nice! The service is GREAT! My favorite is the Fire Grilled Ribeye and Fettuccine Alfredo with shrimp Alika was our severer !  Thank you for the awesome services,https://www.yelp.com/biz/california-pizza-kitchen-mililani-3?start=40
Randall S.,"Kaneohe, HI",19,200,63,5.0,4/9/2017,"This is another fine addition to the collection of CPK's already here.  Folks fortunate enough to live in Mililani and surrounding areas are in for a real treat.  One of the big secrets of CPK is their wide selection of items from burgers to pizza to salad.  They are more than just the usual pizza joint!  I loved the barbeque chicken salad with generous portions of barbecue chicken, jicama, lettuce, cheese, black beans, etc all covered with their own unique salad dressing.  Be sure to save space for dessert because their buttercake is out of this world!  My friend who lives in Miliani, said he's coming back just to eat the buttercake.  Wonderful service, wonderful food and reasonable prices, at least 3 reasons for stopping by!",https://www.yelp.com/biz/california-pizza-kitchen-mililani-3?start=40
Germaine A.,"Pāpa‘aloa, HI",44,14,10,5.0,5/3/2017,"Nice atmosphere, friendly staff, and as we are all familiar with the food. Consistency is the key. Food is as good when I visit Pearlridge or Kahala locations.  Came in with a group of 5 teens. They were seated as I parked the car. From the hostess to the server made the ladies comfortable and the experience enjoyable. The ladies found that fascinating.  Thank you to the staff at CPK-Mililani.  They had a great lunch and enjoyed the opportunity to expand their experiences.",https://www.yelp.com/biz/california-pizza-kitchen-mililani-3?start=40
Khrystal P.,"Near East Side, San Antonio, TX",20,8,8,5.0,10/13/2017,I went to California pizza with some of my co-works. We had French bread w/olive oil herbs and buffalo cauliflower. Which was delicious. Then I order the Thai chicken pizza for my entrée and omg is was the bomb. The server was excellent. I will definitely come back.,https://www.yelp.com/biz/california-pizza-kitchen-mililani-3?start=40
Julie H.,"Pearl City, HI",109,8,13,4.0,10/28/2017,"New, nice, and clean place.  Much more relaxed than Ala Moana, Pearlridge, and Kahala Mall.  Sat at the bar to watch the world series, Danny the bartender was very nice, and courteous.  The food is good, the drinks were cold, the place was clean, and the staff was nice.",https://www.yelp.com/biz/california-pizza-kitchen-mililani-3?start=40
Kristen Z.,"Newport News, VA",0,4,,1.0,12/10/2017,We were seated....15 mins later I went and reminded them that we were at the table. Our waitress after that was really nice and checked on us to apologize for the delay of drinks and food.  Got our food....Blaaahhhhh.  My pasta was undercooked and the shrimp in it was way over cooked.  Our appetizer came out after we started eating our entrees and was rushed so was sitting in a pool of oil. About $70 down that I could've spent in a better way. Disgusting food....with horrible staff in the bar and kitchen.  Never going back!!!!!!!!!!!!!!!!!!!,https://www.yelp.com/biz/california-pizza-kitchen-mililani-3?start=40
Asher G.,"Waianae, HI",0,9,,1.0,11/7/2017,"Eh Ah oops jus noticed that I never finished this review up... this happened like way back in April of this year....   When I go to a bar to get away from drama, I don't like to COME to the bar to hear drama.... I don't know if some of these bartenders REALIZE that WE COULD HEAR YOUR CONVERSATIONS!!!! when you talk bad about other employees, NO ONE WANTS TO HEAR THAT!!!! Me and my girlfriend were there last Saturday night... we was actually there to see an old bartender from Eight50 because we heard that she works at CPK now, she was out sick... anyways, we ordered The Works pizza, and Caesar salad, same same as the other locations, food was so-so getting out quick, I tried order a draft beer, changed my mind to a NewCastle, bartender go give me attitude over it!!! So, rather go Pearlridge CPK than this location, Pearlridge more quieter, I know the bartenders there, I don't mind tipping them well...cos well, they KNOW ME!!!",https://www.yelp.com/biz/california-pizza-kitchen-mililani-3?start=40
Rain C.,"Waipahu, HI",26,27,144,5.0,5/20/2017,It was a post birthday celebration one of my girlfriends. It was a blast. CPK just opened a branch at Mililani..We decided that each one of us will order different kind of food so that we will know which one  was the best and we just which shared. Our top 1 favorite among we ordered was the chicken BBQ salad..Although all of them was really mouthwatering . The Lemongrass Chicken  was  awesome :)  Ambience inside is so calm. We had our table outside. Everytime I went  CPK I always ordered different kind food :) it never fail me..,https://www.yelp.com/biz/california-pizza-kitchen-mililani-3?start=40
Teresa K.,"Aiea, HI",204,18,1,1.0,10/30/2017,"On 10/25/17 my ohana decided to take my daughter out for her 9th birthday. As soon as we got seated.. I felt the vibe. It took about 10 minutes for the bread to be served- no water no sign of waitress no utensils/ settings. So we start eating the bread. Waitress (Lisa) shows up And takes our drink orders quickly. drinks showed up a few minutes later. POOF! She is gone for a bit ( but still servicing tables around us)  we place my daughters order and an app since I'm waiting for my BF to join us. About 5 mins later he arrives. Again.. waitress is servicing tables around us... no eye contact with either my BF or myself. We FLAG her down after 10-15 mins and he orders a drink. The Stella took about another 10 mins to arrive to the table. Our food comes out in a decent time- but no offer to refill our waters, or ask my girls for a refill. She finally clears my girls plates- and we order another Stella.  2nd Stella came out in about 10 mins. She said doesn't ask my girls if they wanted dessert. 30 Mins pass and we flag her for my girls dessert order. At this moment- I'm not even mentioning it's my daughters birthday.  Lisa hears us talking about it and not once did she acknowledge. I'm not here for freebies.. but it's a child's 9th bday- you already missed the boat on the candles and song.. a bday wish would've been nice. After asking for the check, she forgot to bring back my gift card and left in an instant. Food was ok... but this is he last time we will Be back to the Milz Cpk.",https://www.yelp.com/biz/california-pizza-kitchen-mililani-3?start=40
Shania D.,"Mililani, HI",17,14,1,3.0,12/26/2017,"Visited a couple of days ago during their opening time; wait wasn't bad at all, but at the end of the meal, I feel as if the food did not live up to my expectations. The waitress we had was polite, and had gotten refills on our drinks in a really fast manner which was great and answered whatever questions we had. I ordered the Wild Mushroom Strozapretti and hey it sounds pretty fancy, I love mushrooms and pasta so I mean this has to be the perfect dish. The food came out and I was really excited. I liked it the only things about it were the fact that the pasta was undercooked in a chewy tough way, and this may be me being picky but inside the pasta there is fresh thyme and looking at it it's basically stick figures in there that just have a tough texture that you're trying to swallow. Overall, experience was nice the staff was polite and welcoming just the food may need a little improvement here and there, especially making sure the food is cooked properly. I might go back to give it another try, maybe something else off the menu.",https://www.yelp.com/biz/california-pizza-kitchen-mililani-3?start=40
Shuao Li L.,"Wahiawa, HI",161,146,226,4.0,8/6/2017,Felt like visiting one of my favorite eateries. So hsppy they are in Mililani!,https://www.yelp.com/biz/california-pizza-kitchen-mililani-3?start=60
L M.,"Honolulu, HI",0,8,33,1.0,9/2/2017,"I will start by saying that I have always been a fan of CPK until fairly recently. Salads at CPK were my favorite but I feel that they have changed the recipes. The salads don't taste the same, not to mention that the knife skills on the salad are very sloppy. In our BBQ chopped salad we had huge pieces of jicama that were the size of quarters.  I recently went to get takeout from the Mililani location and there was a new menu item. It was a white fish dish. This was over $25 and it was insanely small. I expect far more for something of this price and the quality was not great. In all honestly, I am doing the best I can to avoid going here.",https://www.yelp.com/biz/california-pizza-kitchen-mililani-3?start=60
Tricia M.,"Wahiawa, HI",216,11,87,3.0,7/2/2017,Don't use the online ordering at this location! It's been 30 minutes after the confirmation time & still no food! I've watched people sitting order their food & get it while I wait for the food I order online over 1.5 hours ago! Horrible! Revision - manager just came to apologize & refunded my money & substitute what I ordered with something else that'll come out quicker. Appreciative they're trying to make a bad experience better. Will be back but will call in my order next time.,https://www.yelp.com/biz/california-pizza-kitchen-mililani-3?start=60
Lei I.,"Mililani, HI",1,3,,2.0,11/18/2017,"My family and I have visited this location several times.  Tonight was unacceptable.  We arrived there shortly after 6:30p.m. we were immediately seated.  Our server took our drink order and we ordered our kids meals.  She gave us a few minutes and came back to take our order.  We placed our order which was 4 pasta dishes.  About 10 minutes later, our server brought the  kids meals.  Sounds good so far, right?  Well, we waited and our sever came to our table several times to inform us our order would be out shortly.  We waited and watched as those that were seated after us had already received their orders.  About 30 minutes later, a manager approached us and asked how our meal was.  I informed her that we only received the kids meals and we were waiting for the 4 adults meals.  A few minutes later, our server came to our table and tried to explain that she placed our order after she took it and the kids order was taken first so that is the reason their food came first.  I informed her that those seated after we the kids got their orders had already received their orders.  She went back to check.  We finally got our order after waiting 45 minutes.   I'm sorry, but waiting 45 minutes for 4 orders of pasta is unacceptable.   CPK, please fix this.",https://www.yelp.com/biz/california-pizza-kitchen-mililani-3?start=60
Paul L.,"Mililani, HI",79,39,112,4.0,7/11/2017,"5th time here, Mililani. I always try to avoid peak times; you should do the same. We get right in, food comes out quick, & service is great. Food is good, its why there's a long wait during dinner time (free bread & olive oil). I did notice how their portions have deminished slightly over the years, I use to frequent the Pearlridge location. Its still a fair deal for the price. Recommended.",https://www.yelp.com/biz/california-pizza-kitchen-mililani-3?start=60
M B.,"Honolulu, HI",0,14,,5.0,11/20/2017,"I come to CPK all the time. I'm so extremely happy that CPK is open near my place of residence. They have such customer service! All the times I came we have the best waitresses. I almost always order something that isn't exactly on the menu and they always accommodate me. My husband and I have chosen to spend our date nights here due to the fact that the have excellent customer service, amazing and tasty food, and we love the location and atmosphere!  P.S. Michelle the bartender is awesome!",https://www.yelp.com/biz/california-pizza-kitchen-mililani-3?start=60
Laurena A.,"Mililani, HI",258,2,,5.0,8/12/2017,"Cami is AMAZING!  The first two experiences at this new Town Center of Mililani location was extremely disappointing. But this evening, our server, Cami, completely made up for the previous two experiences.  She gave friendly, enthusiastic, and quick service! The food is amazing at CPK, but Cami's service made us want to go back again soon. We'll always be requesting to sit in her section from now on!",https://www.yelp.com/biz/california-pizza-kitchen-mililani-3?start=60
Leigh A.,"Waipahu, HI",0,9,,4.0,11/7/2017,"PRICE:  $$ AMBIANCE:  casual, noisy LOCATION:  Mililani Town Center MEALS:  good  (Avocado Egg Rolls, Chicken Piccata, Spinach Artichoke with Chicken Pizza) SERVICE:  friendly, fast",https://www.yelp.com/biz/california-pizza-kitchen-mililani-3?start=60
Lauren P.,"Aiea, HI",0,2,,3.0,11/16/2017,Friendly staff. Amazing spinach dip. We ordered a pizza and steak as our meals. So delightful,https://www.yelp.com/biz/california-pizza-kitchen-mililani-3?start=60
Nani C.,"Wahiawa, HI",91,13,10,5.0,9/3/2017,"One of my favorite places to eat. The food is great, prices are reasonable, and the service is awesome! My favorites are the Creamy Pesto Penne Pasta or the California Cobb Salad. For dessert, the Salted Caramel Pudding is my all time favorite.",https://www.yelp.com/biz/california-pizza-kitchen-mililani-3?start=60
Sean L.,"Mililani, HI",17,28,50,3.0,8/9/2017,Honestly Ala Moana and pearl ridge is better. We come to the Mililani location because it's right down the street. I hope they can get better with the food.  Staff please work on the quality of the food. I had more sauce in the dish I had and the pasta the noodles was hard,https://www.yelp.com/biz/california-pizza-kitchen-mililani-3?start=60
Aundrea M.,"Hercules, CA",1,7,,1.0,7/27/2017,"Great food, awful staff.  Sat for 45 waiting on basic stuff like water. Finally we had to go up to someone and ask them to help us. Literally the worst service ever. I love CPK but definitely need to retrain your staff on the basics of customer service",https://www.yelp.com/biz/california-pizza-kitchen-mililani-3?start=60
Zoë R.,"Schofield Barracks, HI",102,6,2,5.0,11/29/2017,the thai crunch salad is the only thing i ever order and it's my absolute favorite salad from any restaurant! always my go to!!,https://www.yelp.com/biz/california-pizza-kitchen-mililani-3?start=60
