Username,location,friend_count,review_count,photo_count,rating,date,review,Url
Morgan D.,"Scottsdale, AZ",0,1,,2.0,10/14/2013,"Our waiter, Chris, was fantastic. But the so-called manager, April, is condescending and rude. I don't understand how someone like this can represent a place we usually love. We go to this location about twice a month. My wife usually orders the same thing, but decided to try something new. My wife made a poor decision about what she wanted to eat. She ended up not liking it and we were apologetic to our waiter. My wife had no more than two bites of the dish she didn't enjoy. The waiter was great, and offered my wife something else on the menu. After the waiter walked away, this ""manager"", April, came over and started telling us about how that's one of the most popular items on the menu and why everyone likes it. We apologized for not liking it (doesn't that seem ridiculous in itself?), and admitted it was a poor choice on our behalf. She continued to almost lecture us as to why that dish was good. She even pointed out other people in the restaurant who were eating it. Who cares? We already said it was our fault. Why are you hassling us? By the time April left our table, my wife got her new pasta. It was cold. And I mean, the sauce had hardened and the bottom of the bowl was barely warm. Again, being extremely polite with our waiter, we apologized and asked him to reheat it. The server was beyond apologetic and said that it was completely unacceptable to receive a dish in that state (note that our sever did not bring the food over, someone else did). I can not enthuse any more how great our waiter was. He left to get the dish remade or reheated. Back comes ""manager"" April and says ""didn't like THAT one either?"" Like we were trying to get something out of this. We explained that the dish was cold. All she said was ""ok"" and walked away. No apology or anything. In fact, still in an accusing matter. We stopped another server, her name I don't recall, to ask if April was the general manager. It turns out this girl is just a glorified server. A shift manager. Why would the managers here allow such a person to represent them, their restaurant and their staff? When we got our check, it had the first dish on there, and we made no comment to take it off the bill as it was our mistake. Our waiter, Chris, came back over and said he had asked his ""manager"" to take it off the check but she had probably just 'forgotten'. Based on her attitude, highly unlikely. Not that we wouldn't have happily paid for it. It took about 10 minutes for our new check to come back to us as we watched our waiter, seemingly, having to argue with the girl to get the dish removed. As we left, April was at the door and said ""at least you know what you won't get next time"". Yes, thank you for that very obvious and unnecessary comment. Our waiter was wonderful. We highly recommend Chris. On the other hand, if we walk into that restaurant again and see April ""managing"", we will walk across the road to Macaroni Grill instead. Such a shame that ONE girl had to ruin a place we usually enjoy. Tip to the actual managers- get that girl OUT of her power position. She is incapable.",https://www.yelp.com/biz/california-pizza-kitchen-scottsdale?start=40
Lauren D.,"Paradise Valley Village, Phoenix, AZ",1,85,13,4.0,12/9/2017,"I love their lunch special. 7"" pizza and soup or a salad for around 11 bucks. Sure, pricier than other lunchtime pizza joints but I also feel the pizza is better. Maybe that's just me though.  I've come here many times with groups for work related lunch outings and they have always been super accommodating and fast.. I've never been looking at my watch stressing out about making it back to the office.  Their pizzas are obviously the highlight here but salads and appetizers are also up to par. I feel this location has better service than other locations in the valley. Definitely a highlight when I get to come here.",https://www.yelp.com/biz/california-pizza-kitchen-scottsdale
Mimi A.,"Desert View Village, Cave Creek, AZ",1,27,2,5.0,1/7/2018,I don't really know why this place doesn't get packed to the point where there's a waiting list. The food is phenomenal! My favorite thing to eat are the salads especially the warm grilled vegetable salad with carne assada pizza or chicken tequila fettuccine hmmm amazingly delicious! The service is fast efficient super friendly staff waiters know their menus well. I think CPK need to step up their looks they need to make it sunny like California warm & inviting at the same time rich in decor add color & style for God's sake if  these guys made their place look like a million bucks they could be best everybody else.,https://www.yelp.com/biz/california-pizza-kitchen-scottsdale
Steve P.,"Scottsdale, AZ",0,2,1,5.0,1/3/2018,"First time here and it was great. We ordered 4 different pizzas and they were excellent. Our server, Rodney, did a wonderful job and brought us a complimentary appetizer since this was our first visit. We will definitely be going back!",https://www.yelp.com/biz/california-pizza-kitchen-scottsdale
Amie G.,"Scottsdale, AZ",27,65,89,3.0,9/15/2017,"I have tried this place twice and always walked away saying ""it was ok"" that's the nice way I say I'm not impressed and not planning on going back. I have had buffalo cauliflower at other restaurants so I recommend we order it, Disappointing. The food is average as well as the service. Lots of better restaurants around.",https://www.yelp.com/biz/california-pizza-kitchen-scottsdale
David Y.,"Hayward, CA",0,5,,2.0,1/3/2018,If you're going to offer curbside service then actually carry it out. I called to let the restaurant know I had arrived and 10 minutes later (15 min since my order should have been ready) walked in to check what was taking so long and they grabbed all my food out of warmers and handed my order to me.,https://www.yelp.com/biz/california-pizza-kitchen-scottsdale
David W.,"Corona, CA",104,2,1,1.0,7/9/2017,"Worst service ever!!! Sitting here now for an hour and still waiting for my food. It's 1:30. It's not crowded. Absolutely HORRIBLE experience! And the manager here is clueless.... oblivious to all of the tables left wondering where their food is and when their drinks will be refilled! Oh... And almost forgot to mention. Only ordered 2 cokes, a salad and a 5 cheese pizza.",https://www.yelp.com/biz/california-pizza-kitchen-scottsdale
Cheyenne H.,"Phoenix, AZ",0,14,3,4.0,10/12/2017,First time at California Pizza and the customer service was phenomenal. The server was very prompt and funny. He recommended a few good drinks and pizza. The food was excellent and the facility was very clean. I would definitely come back again.,https://www.yelp.com/biz/california-pizza-kitchen-scottsdale
Diana M.,"Irrigon, OR",81,28,162,5.0,10/9/2016,"In town for work and this was right by the hotel... open, busy and friendly. Very clean and employees were busu working which is always nice to see.  I think our waiter was named Mike and he was awesome. Really nice, quick and patient.  Very happy with the sevice, food, drinks and atmosphere.",https://www.yelp.com/biz/california-pizza-kitchen-scottsdale
Tricia S.,"Scottsdale, AZ",163,2,,3.0,12/15/2016,"We went in on 12/15 for lunch at 11:30, there was nothing wrong with the food, my issue is with the service and how the bill was rung up.  When we ordered we had the lunch menu and we ordered a pizza and soup/salad combination. Which runs about 11 dollars each.  When they brought out the pizza, they were full sized, which I thought was weird since it was lunch time.  When we got the bill we were charged for a full pizza and a side. Bringing our total bill up by about 20 dollars.  I'd suggest making sure your server knows exactly what you are ordering or else you might end up paying nice that you thought you would.",https://www.yelp.com/biz/california-pizza-kitchen-scottsdale
Esmeralda M.,"Scottsdale, AZ",70,4,2,5.0,8/5/2017,"My son and I always come here at least once a month. The food is a little over priced, but so delicious.",https://www.yelp.com/biz/california-pizza-kitchen-scottsdale
Stacey S.,"Scottsdale, AZ",110,108,113,3.0,10/10/2016,"Decided to come to CPK with my boyfriend for a casual dinner Saturday night before heading to Topgolf. I love the look of this place- trendy décor and a pretty sleek design concept. They have a fairly large menu and a lot of food choices ranging from salads, to pasta, to pizza and a few Asian inspired dishes as well, surprisingly. One thing I really appreciate is the complimentary bread & olive oil. Restaurants seem to be quickly moving away from the ""free bread"" model much to my chagrin! But luckily, CPK hasn't. They served us a small loaf of yummy, crusty Italian bread that was warm & very soft in the middle. For the entrees my boyfriend went with the shrimp scampi zucchini- it had some tasty looking zucchini ribbons and fettucine pasta with scampi sauce and shrimp. He was pleased with the serving size and taste. I ordered the pesto cream penne and was much less enthusiastic. I think I expected it to be more ""pesto-ey""? Any other time I've ordered a pesto based pasta dish somewhere, the sauce is actually green and I can taste some pesto. Well...can't say that's the case here. It looked like they served me regular penne with a trace of cream sauce, a few shrimp, and a TON of sun-dried tomatoes. Waaaay too many sun dried tomatoes and not enough shrimp or pesto.  Would not recommend or order again, but I am willing to come back again and try other dishes.  The service was good and the Moscow mule was tasty!",https://www.yelp.com/biz/california-pizza-kitchen-scottsdale
Forrest N.,"San Carlos, CA",64,3,,1.0,4/14/2017,Mean Spirited manager.  We take our dog to Restaraunts weekly. We always tie her up outside and it's never been a problem. This CPK has ample space outside including grass and 4 benches. We were told we couldn't have the dog on the property after we had ordered. Lame.,https://www.yelp.com/biz/california-pizza-kitchen-scottsdale
David M.,"Scottsdale, AZ",0,16,,3.0,7/21/2017,"The food was good as usual. Service was a little slow. had to wait a while for refills, bread, the check. But everyone was nice and meal was good overall",https://www.yelp.com/biz/california-pizza-kitchen-scottsdale
Teresa M.,"Plano, TX",4,104,24,1.0,3/4/2017,"This review is based solely on our attempt to book an event with this CPK which is the closest CPK to our home. We wanted to book a birthday party, and after one submitted request on line and an email, I got a response from a manager Tammie, mentioning I had to call the restaurant directly and speak to someone there to arrange planning the event. I called the following day, only to be told by the person on the phone that I had to speak to Tammie to plan the event, and was told to call her the following day since she was not in that day. I called the following day, and was unable to get a hold of her and left my phone and message again for Tammie, to which I got no response. After getting the runaround for the week, I realize it was best to let it go, and plan our event at another California Pizza Kitchen farther away, which was actually more accommodating, with the other location having returned our phone call in less than 24 hours. Though I'm sure the food might be good here, the lack of customer service, communication, and organization is the main reason I will never choose to dine here.",https://www.yelp.com/biz/california-pizza-kitchen-scottsdale
Cheri H.,"Lancaster, CA",0,66,4,1.0,2/21/2017,DRIVE BY!!!!  Horrid service ..  Sat there for 20 before we even got a menu ..  Had to get up and ask for waitress ..  Waited over 40 min for food and drinks !!  Sooo I get up to find the manager she tells us she'll discount our lunch..  Check finally comes after waiting another 20 min after lunch and no discount!!!  Paid and left...  Sooo if you have 2 hours for lunch this might work!!!!  Not worth it!!!!!,https://www.yelp.com/biz/california-pizza-kitchen-scottsdale
A P.,"Phoenix, AZ",0,7,,2.0,3/31/2017,VERY average food and poor service. I will not ever visit again. I had a mishap with my order and the manager was condescending and didn't really care about the issue. We will not be coming back.,https://www.yelp.com/biz/california-pizza-kitchen-scottsdale
Matthew R.,"Glendale, AZ",218,5,14,1.0,2/26/2017,"So I went to this establishment on Presidents' Day. My friends and I go to Fogo De Chao for lunch then we go here for the Butter Cake. The waiter came and took our butter cake orders( whip cream, Carmel and ice cream). He brought my butter cake out and it was horrible had no whip cream or Carmel and stuck my ice cream on the side in some plastic crap bowl smh. I guess he said they ran out of whip cream so they dabbed some on mine smh it was horrible!!!! I will just go to the one at the Biltmore they know how to get it right. It's lunch time and you run out of whip cream and think I would accept that as a reasonable answer that my cake presentation sucks!!",https://www.yelp.com/biz/california-pizza-kitchen-scottsdale
Haneen O.,"Scottsdale, AZ",165,379,610,4.0,3/17/2015,"A good choice for a birthday dinner. I love the setup of the patio and how open it is. The lights above us were out so we moved tables, and they fixed it pretty quickly. Their menu seems to change often, or maybe it just appears that way to me. I ordered the Grilled Veggie sandwich and the Sedona Tortilla soup. BOTH were delicious and the sandwich was just as good the next day. My brother ordered the tortilla rolls appetizer, I liked the Mediterranean veggie one with peanut sauce. I tried the kung pao spaghetti with shrimp from my mom, I will have to order that next time. Good service and affordable prices.",https://www.yelp.com/biz/california-pizza-kitchen-scottsdale
Jen T.,"Renton, WA",165,277,134,5.0,2/3/2015,"CPK is a great go to restaurant for some good, quality food. Very friendly and chatty staff, the host was pretty funny.  I know, I know, you come here you should order pizza. But we weren't that hungry. Just a couple salads for us. Our server was very pleasant and attentive, very interactive with us. Always a genuine smile on her face. Wish I got her name so I could give her extra kudos. We never had to ask for a thing. Large, open, restaurant. Very clean. I like that you can see into the kitchen, it's fun to watch them cooking.",https://www.yelp.com/biz/california-pizza-kitchen-scottsdale
David G.,"Scottsdale, AZ",103,513,10,3.0,3/23/2016,"It looks like CPK has tried to update their menu.  The only problem is that they did it by adding a bunch of non-pizza dishes.  Am I really expected to go to California Pizza Kitchen to order halibut, or a steak?  I don't think so.  Improve your PIZZAs, guys.  Let us create our own set of toppings.  Try an innovative crust, like maybe a flaky one.  Use fresh mozzarella.  Come on CPK, you can do it.  But you haven't ... yet.",https://www.yelp.com/biz/california-pizza-kitchen-scottsdale
H. R.,"Scottsdale, AZ",0,41,,3.0,6/28/2014,"Went to CPK tonight after a long absence.  Glad to say that it is still a fresh, clean and attractive place.  The staff are very friendly and accommodating.  But enough with the small stuff, what about the food? Let's begin with the pear gorgonzola pizza.  It was outstanding.  Really delicious.  We will go back for that, for sure.  We also split the Moroccan chicken salad.  It was fine.  A little light on the salad dressing for my personal taste, but a request for additional dressing brought some more in a flash. One thing puzzled me a little, though.  Everything on the food menu and on the drinks menu had a price except the cocktails.  Why??? Who knows.  Maybe they're free (no, not really).  Anyway, except for the fact that they hide the prices of the cocktails, we had an enjoyable time and a really terrific pizza.",https://www.yelp.com/biz/california-pizza-kitchen-scottsdale?start=60
Jan B.,"Orland Park, IL",0,6,,3.0,3/16/2015,"California pizza kitchen... You can always depend on the restaurant to deliver with courteous good service, great salads, sandwiches, pizza and a good wine list.     Always a good choice. Great place to take the children.  Super children's choices.",https://www.yelp.com/biz/california-pizza-kitchen-scottsdale?start=60
Terry B.,"Scottsdale, AZ",11,55,21,1.0,3/3/2013,"We have eaten at this restaurant in the past, but today was a miss. My husbands glass had a crack that went all the way around. The Chicken Piccata was cold, the Meat Lovers Pizza was chewy and non inspiring. The silverware was wrapped in paper napkins that had food stains and food particles on them.Service was intermittent and the whole experience flat. I do not think we will be visiting this restaurant again anytime soon. There are too many restaurant choices in Scottsdale for a restaurant to offer this low level of service and poor quality food for me to have to choose to eat there again.",https://www.yelp.com/biz/california-pizza-kitchen-scottsdale?start=60
Grigour S.,"Scottsdale, AZ",84,124,6,5.0,6/8/2013,Their pizza is consistently unique and very good.  Their staff is rarely ever anything but attentive and nice.  Big props to Nicole who was awesome as a server today!,https://www.yelp.com/biz/california-pizza-kitchen-scottsdale?start=60
Caroline D.,"Surprise, AZ",20,78,38,5.0,5/1/2013,My boyfriend has the BBQ Chicken pizza and I had the macn cheese bites. Since it was our first time here the manager personally came over to greet us and offered to pay for my mac n cheese bites. Super nice place and the waitress was on top of everything.,https://www.yelp.com/biz/california-pizza-kitchen-scottsdale?start=60
Randy S.,"Chandler, AZ",0,13,,1.0,5/10/2014,"11pm is closing time.  My wife and I walked in last night at 1030pm to find everyone more focused on closing up for the night than greeting a customer.  Cooks were standing on counters cleaning the air filters above the stove it looked like.  Not a very sanitary vision.  No manager, no hostess, no servers in sight...  someone saw us from across the dining room (had a tie on) and completely ignored us.  Probably was thankful that we turned around and walked out the door.  Well that's worth 1 star in my opinion.",https://www.yelp.com/biz/california-pizza-kitchen-scottsdale?start=60
Will B.,"Scottsdale, AZ",26,70,123,5.0,10/2/2010,"I love the wide menu selections and the non-traditional, Cali-inspired pizzas. I've had several dishes at CPK and they've all been good. My fave dish has to be this roasted garlic pasta dish. I can't remember what it's called exactly as it's been a while. It's basically a white, creamy pasta dish with roasted garlic, mushrooms, cheese, optional shrimp and another optional ingredient.  I always requested the shrimp.  I'm not sure CPK still serves this dish as I don't see it on their online menu anymore, but it tasted amazing. A shame if they don't have it anymore. It was so good that I attempted to make it at home. My home version was really good, but roasting the garlic takes a lot of time and effort. I wouldn't want to attempt to make it again because of all of the work involved. My other fave, which CPK does still serve, is the Maui Punch. It is a combination of orange, pineapple, and a touch of grenadine. Again, I attempted to make a version of this at home. A restaurant receives the highest compliment from me whenever they can inspire me to imitate their dishes at home. My review so far really applies to any CPK that I've visited, but the one thing that this particular CPK has that sets it apart from the others in The Valley of the Sun is the patio area. It's a great area to hang out in during the cool weather months because that's the time they open up their french doors to let our fabulous winter weather in. This is a feature not common here in the desert, but you may run across in cities located on the coasts. It really makes your surroundings feel really fresh and invigorating.",https://www.yelp.com/biz/california-pizza-kitchen-scottsdale?start=60
Herkemer F.,"Prescott Valley, AZ",2,37,3,4.0,9/20/2012,"My wife and I love CPK. The only downside to the place is that there is no location in Prescott, AZ metro. Our favorites are the Kung Pao Spaghetti and the Jumbalaya Fettuccine. Service at the North Scottsdale location was slow and lackluster. We much prefer the Biltmore Fashion Park and Tucson locations.",https://www.yelp.com/biz/california-pizza-kitchen-scottsdale?start=60
Steve B.,"Thompson-Nicola Regional District, Canada",0,41,,4.0,2/7/2013,My wife and kids like CPK so it is a frequent stop for us. The service and food are always consistent making it nice.,https://www.yelp.com/biz/california-pizza-kitchen-scottsdale?start=60
M S.,"Jersey City, NJ",36,28,3,4.0,8/24/2012,Food was good but I think our server forgot about it since it was barely luke warm and we watched people who had been seated after us get their food first.,https://www.yelp.com/biz/california-pizza-kitchen-scottsdale?start=60
Kendal W.,"Scottsdale, AZ",1,7,,5.0,8/24/2013,"We had a group of 30 loud, obnoxious, and hungry girls who had just finished a dance audition. We needed some carbs ASAP! As soon as we came in we were greeted with a smile and accommodated immediately! Service was awesome, especially considering we had such a large group. Every order came out as ordered and tasted amazing.  Brittany was a great server and so sweet! At the end of our meal management even went so far as to serve up complimentary red velvet cake as a congratulations!  All in all, we had a perfect lunch at CPK and were completely blown away! Thank you!!!",https://www.yelp.com/biz/california-pizza-kitchen-scottsdale?start=60
Dave B.,"Scottsdale, AZ",0,5,,2.0,7/27/2012,"I've never been to a Ca. Pizza Kitchen so wasn't sure what to expect.  Not much, as it turns out.  The prices, particularly the wine prices, are unreasonably high, even when compared to other fine restaurants in Scottsdale.  The waiter brought us some bread before our meal which was cold with little pre-wrapped packets of butter.  Our appetizer, California rolls, tasted like it came out of a frozen food box.  My pizza smelled good, looked good but was bland.  My wife's salad was delivered without any dressing and the waiter disappeared and didn't reappear until several minutes later.  Overall, a pretty forgettable and unreasonably expensive experience.",https://www.yelp.com/biz/california-pizza-kitchen-scottsdale?start=60
Tony D.,"Thousand Oaks, CA",35,396,147,4.0,7/13/2011,The service was fast and friendly. The new menu items were pretty good. I enjoy the Baja Fish tacos and was happy to find that the new Carnitas tacos were just as good.,https://www.yelp.com/biz/california-pizza-kitchen-scottsdale?start=60
Debbie S.,"Phoenix, AZ",134,206,96,4.0,8/31/2010,"I feel deprived if I go and don't get the Thai chicken pizza but lately I have been brave and tried some new dishes. (then I get my pizza to take home) The Ginger salmon is excellent. The miso salad is also yummy. Tonight I'm having the Greek pizza. My husband always enjoys the meat cravers pizza and my son gets the other salmon dish they have. He loves the little lemon ""bra"" they put on the plate so you don't squeeze seeds all over your meal. Plus the sourdough bread is great too.",https://www.yelp.com/biz/california-pizza-kitchen-scottsdale?start=60
Gabrielle P.,"Ridgecrest, CA",3,179,13,5.0,2/23/2009,"THAI CRUNCH SALAD! I have a serious obsession with their Thai Crunch Salad and for that- this place gets all the points in the world.  I've tried their pizzas and always enjoyed them as well.   I enjoy their beer selection- they have great, large frosted glasses.  The staff is always quick and fun and the price is right for what you get.  This is a perfect place for lunch.  A lot of school groups and families with little kids come here, but as long as you don't sit near them, you'll have a great time.  Ah!  I love the Thai Crunch Salad!  Go today and try it!",https://www.yelp.com/biz/california-pizza-kitchen-scottsdale?start=60
Ann C.,"Scottsdale, AZ",9,4,1,2.0,3/30/2011,"Wednesday night and we had about a 10 minute wait which wasn't too bad. For our family of six, a restaurant must provide good value for the money. The food was fine enough but over $40 for pizza (only 4 of us ate) is a lot. I had not been to a CPK in over 15 years and now I remember why. We have had way better pizza around Phoenix and I think independently owned restaurants are better than chains. I like to cook a lot and don't like to go out and pay a lot for food that's easily replicated at home.   I gave 3 stars because the pizza was decent and the atmosphere is neat, with the windows thrown open. The crust is missing that yeasty, homemade smell and taste I love. If I go back I might try the Thai salad or something different. This is simply not a good place to feed a hungry family.",https://www.yelp.com/biz/california-pizza-kitchen-scottsdale?start=60
