Username,location,friend_count,review_count,photo_count,rating,date,review,Url
Karen H.,"Kalihi, Honolulu, United States",52,17,27,4.0,7/5/2017,"I am really excited that CPK is now in mililani town center! The location is great and this place is always popular. Yes there is a wait, which I already assume when I come here. I went here for dinner. I requested to sit inside (because I have come here in the past and we sat outside). The service was AMAZING! So we ordered  our appetizer, one pizza, and a pasta. About 15 minutes after ordering, one of the managers (female) came out to our table to tell us they ran out of the sauce for that specific pasta. She offered to make us another type of pasta and she gave a recommendation of the pesto pasta with a certain type of noodle and etc. We ask how much that would cost and she said she will take care of it .... long story short... she delivered the pesto pasta to our table, she apologized for the wait, and DIDN'T CHARGE us for the pasta in the end! When we asked another manager (male) how we would reheat the California club pizza we ordered, he gave us great suggestion on how people order the topping on the side and etc. He was very kind and service here overall was amazing!  I would suggest people that come here to request sitting inside for amazing service :)",https://nz.yelp.com/biz/california-pizza-kitchen-mililani-3?start=80
Secret C.,"Aiea, United States",0,27,1,4.0,31/5/2017,"Came here about 5 times since they opened. Each time the food was good and the staff friendly.  The staff always seem to be concerned that we were happy and apologized for things that weren't a big deal. For example, today the waitress said sorry that your pizza came a few minutes before your salad did.  What impressesed me about our waitress was that she gave my 3 year old daughter a small piece of pizza dough to play with. She was so happy!  And it kept her occupied for a long time. I wonder if this is a new thing or just her brilliant idea. I hope I can get pizza dough again the next time I go.   The reason I didn't give 5 stars is because their pizza dough rewards app is still not working. I think if you are going to have your customers sign up for a rewards program, it should work.",https://nz.yelp.com/biz/california-pizza-kitchen-mililani-3?start=80
Chris L.,"Mililani, United States",5,40,3,2.0,29/5/2017,"Standard CPK food but we waited over 45 minutes for our order of a salad, wild mushroom pizza, a kids pepperoni pizza and chicken nuggets. Two other tables with one table next to us order and received their salad and pasta in 5 minutes. Additionally, my wife asked for dressing on the side and dressing was placed on top. I expect some issues with a newly opened restaurant but CPK has been in business for awhile and this location has been open a few months. If we didn't have kids that were hungry I'd have walked out. Guess service can be subpar if your the nearest game in town. UPDATE: Talked to the server and manager and salad was comped but time wasted can't be comped.",https://nz.yelp.com/biz/california-pizza-kitchen-mililani-3?start=80
Ashley D.,"Schofield Barracks, United States",142,13,14,3.0,8/7/2017,"The food here was good. Service seemed to lag. Maybe because we came in pretty late, I really don't know. We had to wait awhile just to my husbands beer. Which took about 20 minutes. The waiter kept saying ""It will be right out, they are just backed up on drink orders."" Instead of workers standing around, they should've been helping out one another. I even had to ask if they could wipe my seat since it was filled with crumbs and some bits of food. Our waiter was really friendly and the food was good. They just need to work on some simple things.",https://nz.yelp.com/biz/california-pizza-kitchen-mililani-3?start=80
Amanda K.,"Kailua-Kona, United States",164,26,14,3.0,27/9/2017,"We had incredible service (Travis) and a decent meal. However, based on their use of items that are not environmentally friendly (straws and to-go containers), I have rated them with 3 stars. This place is okay to go in a pinch, but if you're looking for an environmentally friendly restaurant, this isn't the chain for you.",https://nz.yelp.com/biz/california-pizza-kitchen-mililani-3?start=80
V K.,"Waipahu, United States",0,33,,3.0,21/10/2017,"Ordered the following: Avocado egg roll-  avocado did not go well with the rest of ingredients Steak Pizza - overrated,  not to much meat, dry Thai Salad - awesome pick Margarita - blended....weak, too watery I wasn't impressed with the food... Really not a fan of this restaurant Friend wanted to eat here Overall customer service was good.",https://nz.yelp.com/biz/california-pizza-kitchen-mililani-3?start=80
M N.,"Pearl City, United States",1,4,,5.0,4/6/2017,"Saturday evening dinner was so delicious.  Always great food at CPK.  The Mililani location has a much more comfortable waiting experience than Pearlridge.  There are lots of places to sit and wait if needed. They seated us outside, which was great because we have three young kids and they had lots of room to wiggle. After ordering and waiting for the food, I got to relax a bit while hubby took the kids to play in the play area.  Called him when the food came.  Loved it!",https://nz.yelp.com/biz/california-pizza-kitchen-mililani-3?start=80
Jessica S.,"Poughkeepsie, United States",31,13,3,4.0,19/10/2017,"We've been here a few times in the past few months. I definitely don't like their pizzas at all, they are too overcooked and so overpriced. But their pasta dishes are well worth it and probably what I will order in the future! The wait has been very long each time we came but the service was good once we get a table and we love sitting outside.",https://nz.yelp.com/biz/california-pizza-kitchen-mililani-3?start=80
Janson H.,"Elizabeth City, United States",54,6,,2.0,19/7/2017,40 minutes past due on online order pickup time and still no food.  Love cpk but not ordering online again... Update:  55 minutes late.  Cold pizza and artichoke dip and warm salad .  Even my kids drinks were warm and watered down.  Had nothing but great experiences from pearl ridge.  I think it's worth the drive to go there.,https://nz.yelp.com/biz/california-pizza-kitchen-mililani-3?start=80
Ben B.,"Mililani, United States",0,2,,3.0,9/4/2017,"This is our second visit to this place. Out first visit was the opening day. It was ok, place was busy... typical opening rush. Staff are still learning the system as well, so we expected some delays with service. Today our second visit... not a great experience, place was not as busy. We decided just to cancel our order since it's been almost 20mins and our ""appetizer"" still didn't make it to our table.  NOTE: You or your group will have to wait at least 10-15mins. before you get a table... even when there are available/open table.",https://nz.yelp.com/biz/california-pizza-kitchen-mililani-3?start=80
Lauren T.,"Waipahu, United States",0,4,,1.0,19/9/2017,"First off, I want to say that I LOVE CPK...we've never had an issue at any other one but this one.  We order take out at least once a week since it's an easy weeknight dinner.  Since they opened how many months ago, they've MAYBE gotten our order right 1 or 2 times. That's it. I don't know how many comp'd meals we've received or a discount on the food, because it's been that many times.  The management staff, except for the restaurant manager (I can't remember his name), don't seem very customer service oriented. One even told me that maybe we shouldn't use their online ordering system. Really?  Another questioned my order, that was clearly printed on the food receipt. We've started to physically go through each and every dish we get before we leave, and surprise surprise...it is almost always wrong.  Tonight there was no mozzarella on one salad, the other salad did not have the beets or the dressing.   Again, we love CPK, and it's one of the few restaurants in Mililani that serves fairly healthy food.  I hope the Management does something about their quality control and customer service, as they are severely lacking.",https://nz.yelp.com/biz/california-pizza-kitchen-mililani-3?start=80
Ryan O.,"Mililani, United States",103,45,53,5.0,4/4/2017,Wow the new CPK in mililani is super nice totally different themes from the rest the bar is super impressive and they got the same ole good food nice pictures cover the walls along with couple tanker surfboards good job CPK,https://nz.yelp.com/biz/california-pizza-kitchen-mililani-3?start=80
Cassandra E.,"Wasilla, United States",45,15,5,5.0,17/4/2017,"I've been here twice so far. First time was opening day, second time was a few days after. Both times were an hour wait, which was understandable. When we sat down, our waitress was on it. Very attentive, food came out great, plates were taken shortly after we were done eating. I will definitely keep coming back. Love the food, the service, and the drinks.",https://nz.yelp.com/biz/california-pizza-kitchen-mililani-3?start=80
Crysta J.,"Clarksville, United States",2,17,58,5.0,5/4/2017,"Really wasn't expecting much seeing as this is a new restaurant and all, but service was amazing! We were always asked by many servers(as well as our own, Kristin) if we needed anything, refilled waters, and they even came and entertained our daughter for a while lol. Food was just as good too. Def our new to go spot!",https://nz.yelp.com/biz/california-pizza-kitchen-mililani-3?start=80
Joseph A.,"Haleiwa, United States",19,8,46,4.0,23/6/2017,"Food is fresh, colorful, good presentation, plenty portions. Price is medium. Service is good. Thanks Tianna!",https://nz.yelp.com/biz/california-pizza-kitchen-mililani-3?start=80
Kenneth J.,"Miami, United States",98,36,56,5.0,25/4/2017,I love coming to this CPK!! Everyone is always so helpful and friendly and that's just an added bonus!! The food is always delicious and fresh too!! Another lunch spot to add to the list.,https://nz.yelp.com/biz/california-pizza-kitchen-mililani-3?start=100
Mari M.,"Kaneohe, United States",33,21,42,5.0,30/3/2017,"Came on the second day after opening, we were seated fairly quickly! The staff was very attentive and friendly! Always making sure we had bread and drinks. There was a mistake on our order and they offered to remake our pizza and even comped us a dessert. Will definitely return!",https://nz.yelp.com/biz/california-pizza-kitchen-mililani-3?start=100
Derrick B.,"Aiea, United States",1,23,9,1.0,10/10/2017,"The food is good.  Service is awesome.  However we went to do a takeout because we were in a rush. Previously I would tip them even at the takeout counter because of the great service.  However this past time I went for a takeout there is no option to not tip.  It just says ""how much tip would you like to leave"".  Really? I'm doing a take out.  The cashier is doing nothing else special than to bring your order to you.  I don't mind tipping like I said but when they demand it then that is just not right.  I would avoid taking out here.  They make you feel obligated to tip since their iPad is right in front of us.  Just because of this we will not be eating here ever again. I'm not a CPK hater.  I love CPK. go to the pearl ridge one.  I give that location 5 stars.",https://nz.yelp.com/biz/california-pizza-kitchen-mililani-3?start=100
Elli K.,"Honolulu, United States",0,9,5,5.0,30/3/2017,"I have to say, for having been open for only 4 days, this location is fabulous. The people working here are so energetic and friendly...like they actually are happy to be working here. They all seem to be trained really well, in that they were constantly checking in on or helping customers (regardless if it was their table or not) and the system overall ran smoothly. We didn't have any wait to be seated (but we did get there before 5 pm), everyone seemed to know what they were doing, and service was quick and very responsive. My only recommendation is to the person doing salad: keep practicing....not quite enough dressing nor consistently cut pieces, but it was still good enough! :) I think this location will do well, though I think it may  not be big enough to meet the demands of the neighborhood.",https://nz.yelp.com/biz/california-pizza-kitchen-mililani-3?start=100
Michelle M.,"Mililani, United States",140,1,,5.0,3/6/2017,"Excellent service!!! Food is good too, standard CPK fair. The restaurant is stylish and has good atmosphere.  Most of all though, the manager and servers are very kind, helpful, and timely.",https://nz.yelp.com/biz/california-pizza-kitchen-mililani-3?start=100
Sarah P.,"Wahiawa, United States",131,2,,4.0,18/9/2017,I was just recently diagnosed with Celiacs Disease and a nurse recommended this location to try because they are certified gluten free. Our waitress brought our menus and waters and shortly after the manager came over to talk with us since it was our first visit. He brought a small complimentary appetizer to us. He answered all my questions about the gluten free pizzas and cross contamination. I was surprised to hear everything they do in order to prevent cross contamination. This would be a 5 star review but they were really slow. The service and food was great just slow. We will be going back for sure :),https://nz.yelp.com/biz/california-pizza-kitchen-mililani-3?start=100
Robert B.,"Mililani, United States",0,3,,2.0,1/9/2017,"We love the pizza but the service and manages here is horrible. We ordered our pizzas for take out and was told they would be ready in 19 minutes, 40 minutes later I'm still sitting outside waiting on my pizzas.... No sorry I was told I'm waiting on the salad, so the pizzas take 19 minutes and apparently a salad takes 40+ minutes. It was like this the last time I came and I thought maybe it was just that night, apparently not. Ridiculous. Update. So when the Pizzas can out they were cold so now they are remaking them.  Update. They remade the pizzas, refunded some of the money and gave me a coupon",https://nz.yelp.com/biz/california-pizza-kitchen-mililani-3?start=100
Jody V.,"Wahiawa, United States",14,10,2,5.0,1/9/2017,Food was great. A little pricey but to be expected. Our server Darielyn was great. Very attentive and friendly.,https://nz.yelp.com/biz/california-pizza-kitchen-mililani-3?start=100
Kristine L.,"Honolulu, United States",33,77,57,4.0,21/7/2017,"Came here around 4:30pm-5:00pm. I expected it to be busy because it opened recently and most people are getting off of work during this time, but it wasn't busy at all. We had a party of 2 and we were seated right away. Once we were seated we were greeted by a very polite gentleman. I wasn't able to catch his name, but he wasn't our server which we explained  but he took our appetizer and drink order. We were then helped later on by our server. We have been to CPK many times before so we know what's good.. the service was great, but I will check back in when we come during a busier time.",https://nz.yelp.com/biz/california-pizza-kitchen-mililani-3?start=100
Kristen P.,"Mililani, United States",1,7,5,4.0,15/4/2017,"1st time trying CPK Mililani since they opened.  We figure wait a little while so they can work out their kinks. Did a take our order.  I think it's like some kind of answering service... she couldn't even pronounce ""Mililani"".  I was quoted about 20 mins.. not bad!  Oh! And the menu is a tad different at this location than it is the others... either that or they got rid of the Asparagus & Spinach pasta. I arrive at CPK and went through the take out door.. there were 2 others waiting on their take out.  They seemed to have been waiting a while because they were offered a seat at the bar and bread to snack on and a drink while they waited... I went to the register and the gal asked for my name and got my order together.  She wasn't mean, but she rarely smiled either... kinda just went with the flow. She asked another girl to pack my food and mid way she got distracted with another conversation.  I just watched as my food was slowly being packed.  Manager approached me and asked if I been helped and I politely said ""yes, they're packing my food now"" and then there was some hustle.  Got my food, checked my order and went on my way. Food was great!  Thai Crunch Salad was delicious! First time trying that. All in all it was pretty good... And the only tip I would have for the take out gal is to smile :) Next time we'll dine in!",https://nz.yelp.com/biz/california-pizza-kitchen-mililani-3?start=100
J J.,"Honolulu, United States",2,74,67,3.0,6/8/2017,Food is good.. service is a hit or miss. It really depends on what waiter you have and what hostess greets you. Our hostess was very moody and ignored our waiter when he asked if we could be moved to a booth. Like she completely gave him a stink face in front of us and walked away. Very unprofessional. Our server was awesome. He was very polite and attentive.,https://nz.yelp.com/biz/california-pizza-kitchen-mililani-3?start=100
Jeff G.,"Mililani, United States",17,2,,2.0,26/4/2017,"Went to this location per my wife's suggestion with my family of 4 on a Tuesday at 630. Was told there would be a 30 minute wait despite no other customers waiting and there being multiple 4 and 6 person tables open. Against my better judgment, I decided to wait the 30 minutes and get a text.  30 minutes go by and I still haven't got a text about a table opening up, so we go to ask the hostess what's going on. She seems suprised by our presence and says we will be the next available table... how convenient...  I look around and notice there are still plenty of tables open and not many customers waiting. On top of that, there seems to be a lack of wait staff for current customers. I trusted my gut this time, as I knew it would take forever to get waited on and have our food delivered, so I opted to cut our losses and go somewhere else.  I get that it's a Tuesday and they don't want a full wait staff, but would it really kill them to have an extra member or two working week nights so that the open tables can be sat? It seems silly to lose a family of 4+ because CPK has poor business planning and can't staff their restaurant to support the demand within the first month of opening!  A similar experience happened to me 10 years ago at a CPK in Boulder, CO, where we waited forever to be seated and it took over an hour to get our expensive, barely topped pizza. I vowed from that day to never eat at a CPK again, but here I am to show the wife what a joke this chain is. Their service is mind boggling slow. I have no clue why people enjoy this chain.  While on my soap box, the menu outside is completely devoid of pricing. Does CPK think it is a Michelin restaurant? Is their food so expensive that if I have to ask the prices, then I can't afford it? Really pointless to have a menu without prices. Good way at luring people in and sticking them with expensive food when they realize they waited forever and don't want to lose all that time waiting (sunken cost fallacy).  I will continue to avoid this chain as overpriced food with terrible service is not my cup of tea. Only giving 2 stars as we weren't able to eat the food to give it a fair assessment.",https://nz.yelp.com/biz/california-pizza-kitchen-mililani-3?start=100
Wiba n jade V.,"Mililani, United States",13,9,3,5.0,9/8/2017,"Because of several bad yelp reviews, I was hesitant to place an online take out order for my husband's birthday dinner.  I am so glad I decided to try it for myself.  The takeout service I received last night was excellent.  My order was on time.  Lei and Noho put my order together and did a wonderful job.  We had an order of 9 items with nothing missing.  We had all the comp bread/oil, utensils, napkins, parmesan cheese we needed.  They made it so easy by labeling each item with the person's name that I entered online.  Everyone's dish was fresh, presented nicely, and tasted delicious.  Thanks again Lei, Noho and Tracie (manager) on duty.  We will be back!",https://nz.yelp.com/biz/california-pizza-kitchen-mililani-3?start=100
Ashlee O.,"Mililani, United States",240,18,29,4.0,25/7/2017,"So we did take out this time, 07/23/17 called in the order, and I must say the woman who answered the phone was super polite and asked about extra sauces with out me having to ask!  I was pleased at her demeanor and attitude towards taking my phone order.  I parked in the convenient to go stalls out side their establishment, my order was ready. The manager Tracie did come out to authorize the comps, which I really did appreciate. We went home....I really hoped it was perfect....and it was. Chives on the pasta, extra sauces for salads, all add ins accounted for. Even the butter cake and vanilla ice cream.  I really enjoyed this meal, and will be back but will probably stick to take out for a while. Had a really easy time getting food, food was correct and tasty!  Thank you again to Tracie and her team for the take out side that night!  JUNE 2017 This is my second time at this location and probably the worst of my entire life. I love the Pearlridge and alamoana location, so I was super excited to have a location closer to home.  Unfortunately both times eating in, AND the one time we ordered take out was so underwhelming.  For THIS EXPERIENCE in particular, we knew we would probably have to wait, even though there were like 1/2 the tables open. (Must be they can't find employees to work there)  We did get greeted within 30 seconds upon walking up to the podium, and told the wait time. So we waited only about 10 minutes which was surprising! So far so good right? So we got seated, our server took about 5-7 minutes to even come over to us. ALIKA? ALEKA? Something along those lines. That was HER name.  At first impression seemed like everything would be great, took our drink order, and left. The first drinks came in a pretty timely manner, then we ordered an appetizer, the avocado chicken spring roll or something. And LET ME TELL YOU HOW FLIPPING FAST THAT SHIT CAME OUT I kid you not, it came in about 3-5 minutes....which would be great, if they actually made it for us! It was COLD!!!!!! We did eat it any way and didn't complain at the restaurant because we were all starving already haha.  So we were like ""whatever"", and ate it. So we order,  Then I have no idea what her problem was, but ALIKA ALEKA what have you her name be idk, but she literally walked past our table for 15-20 minutes without checking once, for drink refills or ANYTHING. So now I'm upset because I am in the customer service industry, and have very high standards for establishments I frequent. Food was OK, but honestly ALIKA ALEKA (an African American women with glasses) was the worst waitress I've encountered in a very long time. So airheady slow moving and seemed just lost. She was folding napkins for us instead of refilling waters, running back and forth doing who knows what when other tables were looking around for her because she was NO WHERE TO BE FOUND.  I did manage to flag her down once for a drink refill before dinner got there. But by that time this chick just rubbed is all the wrong way. Either she needs better training, personal motivation to succeed at her career/job whatever CPK is for her. Because I've never had such bad service at any CPK. It's sad. Idk if she had too many tables to watch, or what. I'm just stating our experience and how it left us feeling that night, spending our hard earned money AND tipping some one who honestly didn't deserve even a 5% tip. I had so ask another waitress for water, because ALIKA ALEKA was again no where to be found. So now as another waitress comes to fill my water, ALIKA, decides to make an appearance to finally deliver my bf's beer, and as I'm telling the OTHER waitress thank you for my water, ALIKA goes in and says YOURE WELCOME with a smile like she is doing such an awesome job....like no.  I was saying thank you to the girl that was REFILLING MY WATER. So I did make it a point to thank her after my meal when we were leaving, since ALIKA took that thank you from her. All in all, I will probably eat here again, but if we get alika I'm walking out.  Just not worth the stress and annoyance to have a meal with her as our waitress again.",https://nz.yelp.com/biz/california-pizza-kitchen-mililani-3?start=100
Mike C.,"Montgomery, United States",80,36,,5.0,3/9/2017,"The service here was great, almost too great, but why complain. For example, we ordered our drinks, some bread, an appetizer, and entree. Literally, it all came out almost at the same time. Within seconds from another. So the food came out fast. Also, the hostess and waiter we had were very friendly and accommodating. We will definitely be back.",https://nz.yelp.com/biz/california-pizza-kitchen-mililani-3?start=100
Carina N.,"Honolulu, United States",0,2,,1.0,19/8/2017,"Once they served us raw chicken.  Another time they made me wait an hour for my takeout order because one of the dishes was taking an extraordinarily long time although it didn't make sense to me why it would take that much extra time when If I dined in and ordered it, it wouldn't have taken that long to reach my table. Then they gave me my order without that dish I waited so long for even in it. So my other food wasn't hot anymore.  I also didn't feel like the manager did enough to make up for their multiple mistakes. Nothing was offered to make up for any of it.",https://nz.yelp.com/biz/california-pizza-kitchen-mililani-3?start=100
Herlon D.,"Ewa Beach, United States",38,8,43,3.0,9/9/2017,I have been waiting for 30 minutes to be seated. Many tables open and everybody waiting outside. It seems the hostess does not no what is going on. But the food still good.,https://nz.yelp.com/biz/california-pizza-kitchen-mililani-3?start=100
