Username,location,friend_count,review_count,photo_count,rating,date,review,Url
Mary N.,"Jonesboro, AR",13,7,,4.0,6/4/2016,"We stayed at a hotel near here so we decided to walk and get dinner at CPK, having never been to one. The wait for a table was about 20 min, which was right with what they'd warned. We were seated outside, which would have been great had there been more lighting. I enjoy a darker, outdoor dining experience but I do like enough light to read my menu. A real candle, an ample amount of string lighting, anything that wouldn't have made it necessary for my family to all use their phones as lights, would have been preferable. Not sure if the lighting was hidden and just not turned on, or if it was actually meant to be that dark, but when the food arrived, we could barely make out what we were eating. The place stayed busy, almost too busy for the servers they have. Once we were seated, it was about ten minutes before anyone asked us our drink order. To be honest, we were contemplating heading to the steakhouse next door. All in all, I'm glad we didn't. Once they took our drink order, the ball got rolling. Our server Jamie (I think that was her name-she was from NYC)-was awesome. Very friendly, and even though she was busy, she kept refills and everything going. There was also a male server that looked as though he was staying running; he had originally taken our drink order and also helped serve the food. Very friendly and upbeat. Another lady brought us napkins and silverware and for a first time visit, a free appetizer! Some kind of cheesy flatbread that my husband and kids thoroughly enjoyed, if the fact that they wolfed it down says anything. I was concentrating on the avocado club egg rolls we had ordered. If you like bacon, these are for you! Very tasty, with just enough tomatoes and avocado and the dipping sauces go well with them. Let's see, around the table reviews, my husband liked the ribeye a lot but wished there was a mashed potato option (were southern) :). But it was cooked medium, just the way he liked it. My oldest enjoyed his garlic chicken and veggies and the avocado ranch sauce & my youngest liked his pepperoni pizza, although he didn't care for the amount of basil. There is quite a bit. I got a works pizza and it was good, it could have used a little more sauce and cheese, but there were ample veggies and the meats were huge. Overall, we would go back. It had an above average chain food taste (reminded me of Cheesecake Factory somewhat), but the people made it a great experience. Thanks, Pasadena CPK!",https://www.yelp.com/biz/california-pizza-kitchen-pasadena?start=140
Jim F.,"Annapolis, MD",0,21,,5.0,9/21/2015,The Food and Service in this CPK is Far Superior to any other CPK I have been in. The Staff always goes the extra mile to exceed the needs of their customers. I would recommend this CPK to anyone who is looking for a Great CPK Experience.,https://www.yelp.com/biz/california-pizza-kitchen-pasadena?start=140
Sarah S.,"Pasadena, CA",213,61,14,5.0,4/23/2014,"I have nothing bad to say about CPK. Free (validated) 90 minute parking in the underground garage, I've never had to wait for a table, always friendly service. There is indoor and outdoor seating.  Clean.   I love their pizza (my son is a pizza fiend) and I am so happy with their healthier options. I typically opt for the quinoa and arugula salad without the cheese. It never disappoints! So basic, so yummy. It is reasonably  priced - not cheap, but about average. It was $43 for four of us to eat earlier, including an appetizer. Oh and we had a good looking waiter which was the cherry on top, haha. It took about an average amount of time to get our food even though they were busy. Haven't ever had an issue with my order being incorrect or anything like that.  Personally, I'm a fan of CPK. This is the location I frequent most since it's so close to home.",https://www.yelp.com/biz/california-pizza-kitchen-pasadena?start=140
Annie M.,"Pasadena, CA",0,8,,5.0,4/1/2016,"I am extremely impressed with this place, my mother has always been a fan and I myself had not been to a California Pizza Kitchen in years. We had a family night and were seated immediately no reservation. They took our order and food came in a great pace, I did not feel they were taking long nor did any of my family but a manager came to the table to explain their ""delay"" and only 2 or 3 minutes later received the food. Everything was kind and warm welcoming. Extremely enjoyable, food was delicious and staff was amazing. Would recommend and cant wait to come back.",https://www.yelp.com/biz/california-pizza-kitchen-pasadena?start=120
Jim L.,"Orange County, CA",2,32,3,1.0,9/14/2016,"CPK used to be a dependable place - tasty food with decently sized portions and only moderately inflated prices. Now, however, the food is mediocre due to skimping on the key ingredients (aka, the ones highlighted in the menu) and with the portions drastically smaller the prices are effectively skyrocketing. With so many lunch options within walking distance, it's time to move on.",https://www.yelp.com/biz/california-pizza-kitchen-pasadena?start=120
Arpine K.,"Pasadena, CA",0,12,,2.0,10/30/2016,"This is a beautiful location. We usually love the food at CPK. However ,this sever wasn't having a good day at work and it effected our dinning experience.We had to ask for extra napkins, a spoon for the salad, and fresh black pepper.   I feel bad that she was not in her best spirits,but when you are in a  customer service, you still smile and make sure that your customers are having a good experience.",https://www.yelp.com/biz/california-pizza-kitchen-pasadena?start=120
Elaine L.,"Alhambra, CA",556,156,136,3.0,12/22/2013,"Can you believe that I've only been here once in my life? I've always been surrounded by CPK restaurants wherever I go, but I just never found the time to actually eat at one until my sister's bday came along.  My sister made reservations for a party of 12 and they were really good about their reservations.  What do most people order? Pizza of course! It'd be dumb to come here and not try out their pizza if you haven't before. I decided to share an appetizer and a pizza with my friend and we ended up ordering a Chipotle Chicken Pizza along with their Macaroni and Cheese starters.  Also, like any Italian restaurant, they always serve you bread and olive oil as an starter. Chipotle Chicken Pizza really reminded us of well... Chipotle! except in pizza form. I enjoyed every slice of it, from the chicken to the onions to their sauce.  I'd definitely be coming back here for some more of this. On the other hand, their mac 'n cheese was not up to my par.  The cheese wasn't cheesy enough nor was it hot enough.  We like it hot 'n cheesy next time please! Also, for the birthday girl, they gave her an ice cream sundae and sang to her which is cool.  :).",https://www.yelp.com/biz/california-pizza-kitchen-pasadena?start=120
Kim S.,"Pasadena, CA",7,98,,5.0,3/16/2016,"After more than 15 years in Pasadena, I finally went to CPK.  I was given a really friendly greeting by the guy at the door and while waiting for a friend, the chef came over with a complimentary flatbread appetizer as a welcome.  Wow, how nice.  My food was really tasty and the service was excellent.  Right before leaving, i was given a cookie and coupon for my next visit.  Seriuosly, how many restaurants give people the first class treatment?  You guys rock!",https://www.yelp.com/biz/california-pizza-kitchen-pasadena?start=120
Nelson A.,"Pasadena, CA",0,1,,1.0,12/22/2016,"Had a horrible experience today at the CPK Pasadena. All courses ordered --soup, salads, pastas & pizza-- arrived at the same time. The entrees were getting cold while we ate our soup & salads. We complained. The waiter was apologetic. Despite Caroline, the manager, acknowledging the mistake, she was offended at the frustration & annoyance expressed. Rather than apologizing, she asked us to leave & told us never to come back. (Surprisingly, she also comped the entire meal for our party of 6.) She left our table without providing an explanation & refused to come out from her office when we asked to see her to discuss. Next thing, security was at our table to escort us out of the restaurant. This is unbelievable! Unfortunately, no appreciation for our 30+ years of patronage. Guess you can't complain at CPK. Many other pizza places in Pasadena to go to that  care about the customer's experience.",https://www.yelp.com/biz/california-pizza-kitchen-pasadena?start=120
Sassy C.,"Los Angeles, CA",39,60,14,5.0,9/17/2014,"Walked in and this nice gentlemen opened our door that was a very nice gesture . Sat down and we were quickly greeted by our waiter will"" he was very happy and amazinly prompt in our service . Delish food , good service . Will return",https://www.yelp.com/biz/california-pizza-kitchen-pasadena?start=120
Michaela H.,"South Pasadena, CA",1,22,8,2.0,4/4/2014,"Long wait for our entrees,   only 3 of the 4 meals arrived while the 4th was another 10 minutes. One pizza was stone cold, the other was heaped in mushrooms and in edible and the gluten free crust was the worst gf I've ever tasted. Very doughy and bland and undercooked.  To be fair the manager was very apologetic and offered us a discount. On the plus side, beautiful location, nice for an evening stroll afterwards.",https://www.yelp.com/biz/california-pizza-kitchen-pasadena?start=120
Mylene R.,"Pasadena, CA",34,4,2,4.0,4/2/2016,It's our first time to eat at California Pizza. Me and my husband enjoyed the Jamaican Chicken Pizza and fresh lemonade strawberry plus they gave us a nice pizza bread which is on the house. The staff were very accommodating and friendly.,https://www.yelp.com/biz/california-pizza-kitchen-pasadena?start=120
Erika S.,"Pasadena, CA",58,5,2,5.0,3/28/2016,"I just want to say Thank You to everyone who works at this location specially managed by someone with such a big heart Alex greeted my daughter and her friends who had just finished volunteering all day for the eggbowl which is an event held at the rose bowl for Easter for the children to partake in,  anyways he was real friendly and generous and payed for all their meals. Acts like this restore my faith in humanity.",https://www.yelp.com/biz/california-pizza-kitchen-pasadena?start=120
Mae Louise L.,"Hacienda Heights, CA",280,88,34,4.0,12/30/2015,"loved our bartender erick! get the blueberry ginger smash cocktail. cpk is just cpk. nothing phenomenal, but hits the spot when it's what you want.",https://www.yelp.com/biz/california-pizza-kitchen-pasadena?start=120
Marta I.,"Sycamore, IL",338,81,142,5.0,9/10/2014,"Tasty white corn guacamole! If you haven't tried it you totally should. Just wish it came with a little more but that's bc I'm a mega guacamole fan. :) I haven't had enough veggies lately so I went for the BBQ chicken salad. It was amazing. It's prob the first time I've tasted a hunt of basil in my salad. Not sure if that's normal or if some fell in there by accident. Either way - every bite seemed a little different but in. Good way. It went from BBQ chicken to Italian style with that basil over to a simple ranch salad at random moments.of you like flavor explosion and you've neglected your hot bod from veggies, just get it!",https://www.yelp.com/biz/california-pizza-kitchen-pasadena?start=120
Joyee C.,"Monterey Park, CA",62,264,616,3.0,1/29/2015,"This is a better located CPK right at the business centre of Pasadena.  I like the view right at the door, a big fountain!  The menu has more food choices, but yea again I only ordered a drink ... If I get a chance next time I would like to try their appetizers, more variety & choices! Pricey place, but this location makes it more worth it.",https://www.yelp.com/biz/california-pizza-kitchen-pasadena?start=120
Natalie B.,"La Crescenta-Montrose, CA",0,54,,2.0,8/5/2016,"Disappointing!  It was nice to have curb side pick-up.  Easy!  However, pizza was super disappointing.  We ordered BBQ chicken pizza.  VERY few toppings.  Lots of crust with not toppings.  Blah.  Tasted like it could have been a frozen pizza.  The only reason why it earned 2 stars is because of the ease of the curb side pick-up.",https://www.yelp.com/biz/california-pizza-kitchen-pasadena?start=120
Barclay W.,"Saint Paul, MN",355,901,4,4.0,5/29/2013,"As a reward for such a great month my boss took me and my coworker (we are a small office) out to lunch. When he chose CPK I was a little surprised. I feel like in Pasadena you can get really good food for much less the price. I quickly ate my words though because CPK has grown up quite a bit.  I have always loved CPK (a guilty pleasure I know), but it gets expensive and repetitive quickly. I haven't been in a long time, so I was very pleased with the ""upgrades"" they have done to their menu. The new flavors are more bold and exciting, and there is a bigger diversity. I got the Korean BBQ pizza. Was it the best pizza I have ever had, not by a long shot, but it was still very flavorful and good.  CPK is what it is and must be judged on that. This is not a gourmet pizza place. You come here for food you know what to expect at a price you know. Part of me will always love CPK for what it is, but it will never be a standout for me.",https://www.yelp.com/biz/california-pizza-kitchen-pasadena?start=120
Derek S.,"Pasadena, CA",4,64,,5.0,6/18/2015,"We had a wonderful first-time experience here. They bring you a delicious flatbread appetizer if it is your first-time. They also bring a few pieces of bread with a oil based dipping sauce with spices. The pizza was fantastic (California Club - almost like a salad on a pizza) and was quickly prepared. Ask for Nicole, she's newer here but she is an absolutely superb waitress. She is outgoing, kind, conversational and puts great effort into her job. Couldn't praise her or our experience here more!",https://www.yelp.com/biz/california-pizza-kitchen-pasadena?start=120
Miss N.,"Sherman Oaks, CA",14,16,3,5.0,8/27/2015,The ambience is wonderful. A very spacious CPK. The nicest one I've ever been in! And our server Sandy is super sweet and on point!,https://www.yelp.com/biz/california-pizza-kitchen-pasadena?start=120
Allison N.,"Pasadena, CA",8,78,58,3.0,10/13/2014,"Maybe I just remember it being awesome when I was younger, or it was an off night, but the food was just okay and the service too.  Our food took forever to come out, and when it did, we didn't have utensils. Our server, who was very sweet all things considered, told us they were rolling them up in the napkins and we'd get them soon. This was about 5 minutes before our food came. I would just like to eat my food when it gets to the table so it's still hot please, the forks and knives don't have to be rolled into a napkin! I know it's all about presentation. Anyway my pasta got to the table and it was warm, but not hot. Like it had been sitting out under the heat lamps waiting to be picked up for a little while... plus I was still waiting for utensils. I was finally able to stop another server who brought us our rolled up utensils a few minutes later. I love CPK tho, and I definitely will be back. Just maybe not to this location.",https://www.yelp.com/biz/california-pizza-kitchen-pasadena?start=120
Laura S.,"Pasadena, CA",948,1507,6131,4.0,5/10/2011,This is a typical CPK... but I came here for lunch (for me and another colleague's birthday!)... so awesome free sundae! :D LOCATION:  Walking distance to work. Pretty big and there is parking available.  AMBIANCE: Typical CPK. SERVICE:  Good. They were attentive. I liked the host. He was really funny. FOOD: Got Garlic Chicken Pizza and Caesar salad... they were ok. I think the food brought the rating down.  Overall... this is a standard CPK. But got a free birthday sundae for my birthday!,https://www.yelp.com/biz/california-pizza-kitchen-pasadena?start=120
Waynetta K.,"Fairfield, CA",2,12,4,2.0,12/1/2015,"I eat here when visiting for work - sadly the quality and service has declined. I placed a to go order and still had to wait 20 minutes when I arrived and they were not busy. The food, particularly anything with bread, was not fresh. I won't t return.",https://www.yelp.com/biz/california-pizza-kitchen-pasadena?start=120
Eli S.,"Monterey Park, CA",49,100,127,5.0,11/15/2012,"Great Service!  Also supporting our vets with two free meals was above!  Great service, we've been here plenty of times, always good food and good service! These guys know how to treat their customers and how to make a nice BBQ pie!",https://www.yelp.com/biz/california-pizza-kitchen-pasadena?start=160
Dennise S.,"Los Angeles, CA",487,281,1159,4.0,12/12/2013,My Favorite is the Chicken Milanese without the cheese. But something everyone should try is the Tequila fettuccine and avocado rolls.,https://www.yelp.com/biz/california-pizza-kitchen-pasadena?start=160
Imran K.,"Walnut, CA",3711,725,48,4.0,7/18/2013,"This is not the usual CPK, no parking here its next to the Westin Hotel and the city Hall. The inside decor is old.  During lunch hour the place was overwhelmed for take out orders. The manager had to step in and help push my order out the door and rang up my bill. I had luckily found a 2 hour parking across the street.",https://www.yelp.com/biz/california-pizza-kitchen-pasadena?start=160
Spongebob S.,"San Mateo, CA",0,3,,5.0,8/14/2014,"Wednesday Night Dinner. Vegetable Pizza with Goat Cheese - Great love the pizza. Mango Lemon Strawberry Cocktail - Great, nice tangy flavor. Mushroom Flat bread - OK The best part was the dessert suggested by the waiter, I do not remember her name.  She suggested the Butter Cake with Ice cream - OMG, this was the best dessert I ever tried. Thank You for the great meal and the dessert.",https://www.yelp.com/biz/california-pizza-kitchen-pasadena?start=160
Macy H.,"Irvine, CA",630,293,142,4.0,1/13/2012,"I love the CPK here, I always come late at night (like 10pm) so we never have to wait. They have a bar, if you want to sit there instead of a table. I prefer this one over, say, the one in at the Santa Anita mall, just because it's so faaawncy here ;) Good date spot, hahaa. The servers are always friendly, and the food is yummy! I definitely recommend the Chicken Tequila Fettucine. I order it. Every. Single. Time. Still not tired of it yet, and it's been about 3 years. Also, free parking - just be sure to get your ticket validated before you leave.",https://www.yelp.com/biz/california-pizza-kitchen-pasadena?start=160
Duncan M.,"Palm Desert, CA",6,189,174,2.0,4/10/2015,"Always have a great customer service experience along with very tasty food at CPKs.  The experience at this restaurant was not the same. The food was very good, however, the service was less than desired. Jonathan was our server. At the end of our order I asked for fresh garlic and extra lemons for my water. We had to ask twice for the garlic and he brought the lemon slices near the end of our meal. We had to ask for refills. We asked for additional bread that never came. Again, this is not the normal great service we experience.",https://www.yelp.com/biz/california-pizza-kitchen-pasadena?start=160
Diane M.,"Los Angeles, CA",0,3,,1.0,4/25/2016,We had the worst experience on Friday 4/22..We just wanted to eat dinner however our server didn't think we deserved to eat at this location.. After waiting for more than 15 minutes for her we decided  to leave but not before speaking to the manager. We told her the waitress did not even acknowledge us at all after we were seated. However she acknowledged all the new people being seated..And to top it off as we were speaking to the manager they sat someone  at our table and the waitress  acknowledged them right away. She must be a Trump supporter...It's a shame that people like that still exist. We will never return to this location...,https://www.yelp.com/biz/california-pizza-kitchen-pasadena?start=160
Patricia Y.,"Lynwood, CA",2,11,2,5.0,7/3/2015,"Seriously one of the best customer service places I've been to in such a long time. I felt like I was a celebrity, From walking into the door to leaving it was all so great. My friend and I were very pleased with the service. Our food got out really quick as well and the manager even came over to our table to greet us and welcome us for being our first time. That's what I call exceptional customer service and I would make the drive all over again just to go to that specific location even tho there is one less than 5 miles from me. Great job CPK! You have my business from now on!",https://www.yelp.com/biz/california-pizza-kitchen-pasadena?start=160
Alyssa M.,"Altadena, CA",0,3,,5.0,7/9/2015,I always come to the one on Los Robles in Pasadena. Their customer service is excellent there aren't too many places exercising customer service anymore. The staff was amazing. Food is always great..I was bummed when the waitress told me their Caramelized Peach Salad was no longer on the menu but she recommended the California Fresh Salad and promised it is definitely a pleaser. She was absolutely correct. This place is great!,https://www.yelp.com/biz/california-pizza-kitchen-pasadena?start=160
S W.,"Pasadena, CA",4,53,10,2.0,4/4/2015,"Gave up on this place last year and tried again tonight. Once again, disappointment. Food is chintzy portion when ordered to go. Paid for avocado and got one tiny sliver cut into 12 itty-bitty pieces for $2.59. Cheap! My dinner salad was $17 and puny. The pizza crust used to be so good and now it is chewy and gross. Quality is just downhill. Even my kids said, ""we don't want CPK anymore"". Too bad. In the old days food was so good. Now it tastes like a fast food chain.",https://www.yelp.com/biz/california-pizza-kitchen-pasadena?start=160
Jackson L.,"San Jose, CA",103,653,1478,5.0,3/31/2013,"I'm generally a fan of CPK (I love their unique, diverse, healthy, and tasty menu items) and this location is no exception. I visited while traveling, and I'm glad I stopped here for some familiar tasty food.  The service at the Pasadena location was awesome! All the employees were attentive, welcoming, and professional. Our server was excellent, and he even recommended the Chicken Wontons when I was still hungry. We had the following: -Caramelized Peach Salad -BBQ Chicken Pizza -Chicken Wontons I love most of CPK's salads, and the Caramelized Peach Salad is one of my favorites! Overall, this location is great! Relaxing atmosphere (large dinning room compared to other cramped locations) and the food comes our quickly!",https://www.yelp.com/biz/california-pizza-kitchen-pasadena?start=160
Irena W.,"Cerritos, CA",396,143,816,3.0,4/16/2012,"The food was good. Decent. Your normal CPK pies. The wait was alright. You have to understand, my group was tired and grumpy about the 626 night market fiasco... but CPK was pretty honest with us, they said the wait would take about 1 hour, and they were true to their word. Thank goodness for heaters outside, and seats! We were much more willing to wait around for a table for the 8 of us thanks to the heaters and outdoor seating. Also, we were STARVING! CPK will not give you bread as an appetizer unless you request it, so if you're super hungry like we were, ASK! We ordered a lot of food. Good flavoring, oh, and I loved my honey wheat crust on my pizza. You can request it on yours as well if you would like. Yum! Loved our server, she was sweet, on top of her ish, game face on! They actually had to put two tables together to accommodate our party of 8 which randomly bloomed to 9, so it was a bit of a tight fit, but it was still alright. The bathroom was a little tiny, but I think that was because there were oh maybe 5 bazillion hungry Asians scattering out to the nearby streets scavenging for food due to the over flooding of the 626 night market event that happened. We dealed with it. It ended up being alright. Overall though, your average CPK. Nothing super memorable in either a positive or negative way. However, you will have our eternal thanks for feeding all our hungry asses since the 626 night market fiasco was a lot huger than expected.",https://www.yelp.com/biz/california-pizza-kitchen-pasadena?start=160
Jossie Y.,"Los Angeles, CA",0,41,5,3.0,5/24/2015,"I enjoy going to CPK with friends and family. This location is one of the nicest one. It is big and newly updated, and it is located near the beautiful Pasadena City Hall. Parking is validated and free for the first 90 minutes.  Pizza is always good, but not extraordinary. Prices are a little high - pizza starts from 12.99, desserts are $8.49 (more expensive than the Cheesecake Factory?). The bill can easily reach $80+ for pizza and desserts only. I will probably stick to buying the frozen CPK pizza from Ralphs or Vons for pepperoni or BBQ Chicken pizza. There are also plenty of great and cheaper alternatives in the area.",https://www.yelp.com/biz/california-pizza-kitchen-pasadena?start=160
Tyrone A.,"La Puente, CA",248,156,100,4.0,8/4/2011,"Clean and professional!  Walking into this location, and fist thing you notice is how large this place feels. I think this location can sit about 150-200 people at any one time. The staff was very welcoming and accommodating. I came here with my class of about 20 people. The hostess got us the back area so that our class could have some place to talk and discuss things.  We sat at the bar waiting for our class to get here the bartender Jason helped us out and was very knowledgeable about his alcohol and the food. I wasn't that hungry so I just got myself a lemonade and crispy mac n' cheese. It was a small perfect portion.  I think that this place I would come back for sure.",https://www.yelp.com/biz/california-pizza-kitchen-pasadena?start=160
