Username,location,friend_count,review_count,photo_count,rating,date,review,Url
Ashlee O.,"Mililani, HI",240,18,29,4.0,7/25/2017,"So we did take out this time, 07/23/17 called in the order, and I must say the woman who answered the phone was super polite and asked about extra sauces with out me having to ask!  I was pleased at her demeanor and attitude towards taking my phone order.  I parked in the convenient to go stalls out side their establishment, my order was ready. The manager Tracie did come out to authorize the comps, which I really did appreciate. We went home....I really hoped it was perfect....and it was. Chives on the pasta, extra sauces for salads, all add ins accounted for. Even the butter cake and vanilla ice cream.  I really enjoyed this meal, and will be back but will probably stick to take out for a while. Had a really easy time getting food, food was correct and tasty!  Thank you again to Tracie and her team for the take out side that night!  JUNE 2017 This is my second time at this location and probably the worst of my entire life. I love the Pearlridge and alamoana location, so I was super excited to have a location closer to home.  Unfortunately both times eating in, AND the one time we ordered take out was so underwhelming.  For THIS EXPERIENCE in particular, we knew we would probably have to wait, even though there were like 1/2 the tables open. (Must be they can't find employees to work there)  We did get greeted within 30 seconds upon walking up to the podium, and told the wait time. So we waited only about 10 minutes which was surprising! So far so good right? So we got seated, our server took about 5-7 minutes to even come over to us. ALIKA? ALEKA? Something along those lines. That was HER name.  At first impression seemed like everything would be great, took our drink order, and left. The first drinks came in a pretty timely manner, then we ordered an appetizer, the avocado chicken spring roll or something. And LET ME TELL YOU HOW FLIPPING FAST THAT SHIT CAME OUT I kid you not, it came in about 3-5 minutes....which would be great, if they actually made it for us! It was COLD!!!!!! We did eat it any way and didn't complain at the restaurant because we were all starving already haha.  So we were like ""whatever"", and ate it. So we order,  Then I have no idea what her problem was, but ALIKA ALEKA what have you her name be idk, but she literally walked past our table for 15-20 minutes without checking once, for drink refills or ANYTHING. So now I'm upset because I am in the customer service industry, and have very high standards for establishments I frequent. Food was OK, but honestly ALIKA ALEKA (an African American women with glasses) was the worst waitress I've encountered in a very long time. So airheady slow moving and seemed just lost. She was folding napkins for us instead of refilling waters, running back and forth doing who knows what when other tables were looking around for her because she was NO WHERE TO BE FOUND.  I did manage to flag her down once for a drink refill before dinner got there. But by that time this chick just rubbed is all the wrong way. Either she needs better training, personal motivation to succeed at her career/job whatever CPK is for her. Because I've never had such bad service at any CPK. It's sad. Idk if she had too many tables to watch, or what. I'm just stating our experience and how it left us feeling that night, spending our hard earned money AND tipping some one who honestly didn't deserve even a 5% tip. I had so ask another waitress for water, because ALIKA ALEKA was again no where to be found. So now as another waitress comes to fill my water, ALIKA, decides to make an appearance to finally deliver my bf's beer, and as I'm telling the OTHER waitress thank you for my water, ALIKA goes in and says YOURE WELCOME with a smile like she is doing such an awesome job....like no.  I was saying thank you to the girl that was REFILLING MY WATER. So I did make it a point to thank her after my meal when we were leaving, since ALIKA took that thank you from her. All in all, I will probably eat here again, but if we get alika I'm walking out.  Just not worth the stress and annoyance to have a meal with her as our waitress again.",https://www.yelp.com/biz/california-pizza-kitchen-mililani-3?start=100
Mike C.,"Montgomery, AL",80,36,,5.0,9/3/2017,"The service here was great, almost too great, but why complain. For example, we ordered our drinks, some bread, an appetizer, and entree. Literally, it all came out almost at the same time. Within seconds from another. So the food came out fast. Also, the hostess and waiter we had were very friendly and accommodating. We will definitely be back.",https://www.yelp.com/biz/california-pizza-kitchen-mililani-3?start=100
Carina N.,"Honolulu, HI",0,2,,1.0,8/19/2017,"Once they served us raw chicken.  Another time they made me wait an hour for my takeout order because one of the dishes was taking an extraordinarily long time although it didn't make sense to me why it would take that much extra time when If I dined in and ordered it, it wouldn't have taken that long to reach my table. Then they gave me my order without that dish I waited so long for even in it. So my other food wasn't hot anymore.  I also didn't feel like the manager did enough to make up for their multiple mistakes. Nothing was offered to make up for any of it.",https://www.yelp.com/biz/california-pizza-kitchen-mililani-3?start=100
Herlon D.,"Ewa Beach, HI",38,8,43,3.0,9/9/2017,I have been waiting for 30 minutes to be seated. Many tables open and everybody waiting outside. It seems the hostess does not no what is going on. But the food still good.,https://www.yelp.com/biz/california-pizza-kitchen-mililani-3?start=100
MaliaAdrian M.,"Waipahu, HI",27,18,66,5.0,7/24/2017,"I was hesitant to eat at the mililani restaurant after reading some reviews and the fact it being still kinda new.. BUT I was hungry for pasta and didnt feel like driving to pearlrigde or Kapolei. Let me start off with saying customer service was 5 stars!! We were seated right away, our server Brooke, came a few minutes after to take our drink order, super nice and professional. Once she brought our drinks, We ordered the avocado egg rolls for appz. And it came out less then 10min after ordering and it was hot, yummy and the wonton roll was crispy and fried to perfection. Its favorite thing to get here and i'd have to say that this one was the best one I had everrr!!  My hubby ordered the lemongrass chicken and it was delicious!! After each of our orders came out we were checked on to make sure everything was tasting good and if we needed anything else :) noticed our servers Attentiveness to our table, on her way to/from a table near us she came by to check on us again. She was on it. Drinks filled, food came out fast and everything was tasting very delicious. We didnt have to wait so long for anything. She even asked us if we wanted our drinks to go.  After a not so good experience this morning for breakfast, coming here for dinner made my day and my tummy was happy too.",https://www.yelp.com/biz/california-pizza-kitchen-mililani-3?start=100
Shawna O.,"Mililani, HI",0,7,2,2.0,11/2/2017,Not impressed with the service! Didn't get utensils until our second appetizer came-asked for napkins twice and got three napkins for 4 people. Bartender cannot make a dirty martini! The tostada pizza was flavorless-talk about bland. The Caesar salad had hardly any dressing. On the upside the bathrooms were clean and the buffalo cauliflower appetizer was tasty.,https://www.yelp.com/biz/california-pizza-kitchen-mililani-3?start=100
POOH L.,"Honolulu, HI",29,68,95,4.0,6/17/2017,Last night was my first visit to CPK Mililani.  I was way outside of my usual regular cpk's i normally visit.   When i first hot there the restaurant didn't look that busy from the outside then i stood in line to be checked in...how many? 3 the wait is 30-40 minutes. Ok can i get a last and a phone number? Sure.  Outside or insideor first available? First available. The wait was sooner only about 20 minutes! Perfect.  Walked in and the hostess sat us on an outside table.  I think if it was in the day i would not want outside.  The mall was pretty crowded and there was live music in the center too. The server was excellent! She was very attentive and always coming back to check on our table.  The food was great as usual. What i thought was the icing to the cake was that the manager or head kitchen guy made his way to all the tables to ask how was the food.  I personally thought that was personable.  Miliani CPK i will visit again!,https://www.yelp.com/biz/california-pizza-kitchen-mililani-3?start=100
Irene G.,"Mililani, HI",1,7,,3.0,9/29/2017,"We've come to this location enough to submit a fair review that's not influenced by emotions related to the visit. While the servers are nice, their service is slow. The food has also been slow to come out, including bread. Taste of food pretty consistent with other locations. This location is convenient because of where I live, but if I had a choice, I'd prefer to go to Pearlridge.",https://www.yelp.com/biz/california-pizza-kitchen-mililani-3?start=140
CHERYL M.,"Waialua, HI",0,2,,3.0,7/8/2017,"Got seating then forgotten, had to wave a passerby server to ask who was waiting on our table.  Then they ask the girl behind the bar to assist.  Got served bread with oil but not individual plates to eat on.  Bar gets busy then we need to flag the girl down for more bread, more drinks, dessert???  Employees in no rush to serve.  I love the Pearlridge location better, way better service and much quicker...",https://www.yelp.com/biz/california-pizza-kitchen-mililani-3?start=140
Ike S.,"Waianae, HI",254,6,1,5.0,5/31/2017,"First time I been to CPK MILILANI, was this past Saturday, I enjoy the food, the atmosphere is not as crowded or congested as other locations.  My waitress was Chan she was a very polite, and friendly waitress, I was impressed she was always trying to say sorry, because she had many tables, and the other occupants didn't know what exactly they wanted to eat, so it took her time to get to us.  She always checked on me and my party, always made sure if we were comfortable if the food was ok.  Everyone that is staff at CPK Mililani was very courteous, always smiling and saying hi, I really like the people and the food, and i'll be back again for sure.",https://www.yelp.com/biz/california-pizza-kitchen-mililani-3?start=140
A P.,"Mililani, HI",1,9,8,4.0,7/19/2017,"I do take out orders from here regularly since I work in the area.  I initially had problems with the online ordering with long wait times, but am happy to say that it has greatly improved. The staff is always friendly when I come in to pick up my order and the restaurant usually looks clean and tidy even during the busy hours. I'm not very adventurous when it comes to food so I have only tried the spinach/artichoke dip and one of the pizzas, but I have no complaints! Glad they finally opened up in Mililani so I could use my gift card that I've had for a few years because I'm just too lazy to drive!",https://www.yelp.com/biz/california-pizza-kitchen-mililani-3?start=140
Rae R.,"Pearl City, HI",104,8,1,2.0,4/5/2017,"Food choices are good & tasty. Although they are small child like portions. Staff is friendly, although, we were interrupted at least 20+ times asking if the food was ok. Excessive in that area.  We had to ask for bread, as we were not offered from the beginning. They might need more dishes, as they kept asking to take our plates.",https://www.yelp.com/biz/california-pizza-kitchen-mililani-3?start=140
Yoonie L.,"Honolulu, HI",152,18,138,4.0,5/24/2017,"A group of my friends and I decided to eat at CPK at  the Mililani location before catching a movie for convenience since it's next to the movie theatre. I personally wanted to check it out too since it just opened there. We were greeted by friendly staff. It was a Tues night and we had no reservations and were seated immediately. Loved the Hawaiian decor inside with painted surfboards and LOVED the canvases of pictures on the walls. The place was quite large and had a great  outside terrace. Our waitress, Cami was really friendly and sweet. I had the Wild Mushroom Pizza and it was super tasty. The crust was nice and chewy with the right amount of crispy. Everything was fine until 2 of my friends decided to order the Salted Caramel Pudding to go since we needed to leave to catch the movie. When they each got their individual brown paper bags, when they pulled it out, one was full and the other was half the size. I called Cami over and she was very apologetic and ordered my short changed friend a new one and sent the Manager over to our table. He was very nice and also very apologetic and gave all 5 of us a free dessert voucher for the next visit! Hey, stuff happens but if they make it right, that's what counts! Will be back soon to try the Hawaii specific items and my dessert!",https://www.yelp.com/biz/california-pizza-kitchen-mililani-3?start=140
Tiffany R.,"Honolulu, HI",75,7,10,1.0,9/11/2017,"I would give this place zero stars if it allowed me to. Despite all the bad reviews I've read and heard from friends and family, I decided I wanted to be fair and give them the benefit of the doubt! Well, let's just say it was a horrible experience!!! We got seated right away, BUT we sat and for 20-25 minutes, no one came to greet us or take our drink order!!!! This is when I decided that I wasn't waiting any longer! As we waited though, I noticed another table was still waiting to be greeted as well....and another table complaining that her kids didn't receive their desserts yet! Wth?! I told my hubby and son that we're leaving, but before we do...I'm making a complaint! Found the manager and asked if they were short staffed because no one came to our table after waiting for so long!!! She asked where we were sitting...told her where but at this point I'm so irritated that I told her we are leaving and that they should read their Yelp reviews because I'm not the only one who thinks their service sucks!!! Never again! How long have they been open? Luckily there's many other restaurants around here!!! Thank you CPK Mililani for ruining our Anniversary! I'm glad this wasn't our actual anniversary dinner! We were only here cause we had to kill time before Parent Night at our kids school!",https://www.yelp.com/biz/california-pizza-kitchen-mililani-3?start=140
Travis S.,"Kapolei, HI",13,2,,3.0,8/4/2017,"I can't believe I'm actually writing this, I've been in the industry for a long time and I know how servers think, but as a bartender you have to set an example for the service that the establishment has. So I recognize bad, good, and great service when I see it.  Yesterday afternoon I came in and with my two nieces to have a nice lunch, we were greeted by our hostess who was very welcoming and right off the back offered if we wanted to dine in or outside, we chose to sit inside. We get to our table and the hostess explained to me about the DOUGH membership, she was a little inaccurate about what she said but she hit the main points lol. A few minutes later our waitress Cheyenne(I had to ask her her name she didn't give us a spiel) she started us off with drinks and didn't explain the menu or the kids menu. But being industry I knew what I was doing. For some reason I could tell she was judging me by my appearance or maybe my age , some ignorant service workers do that, but I believe in serving people as if I were serving myself. She then comes back and mumbles something about appetizers and before I could even order an appetizer she walks away. Comes back a few minutes later and asks if we're ready, so by this time I just need to get my nieces fed. I ordered a cheese pizza and a Thai salad (so yummy) I'm never disappointed with the food when I dine at cpk and for the most part I get amazing service. But to feel judged in a place I come to all the time and being in the industry isn't acceptable to me. I am a very generous tipper but I definitely consider the service that I get. Back to my experience, food comes out I order a glass of wine took about 15 minutes to get there by then my craft is warm, doesn't check on us the whole entire meal , nor does she refill my water or nieces fruit punches, but in watching her service all her other tables and treating hen like royalty lol. I also ordered a ""potato wedge"" for my girls to share but they were just roasted potatoes so I'm guessing she didn't know the difference, I wanted to immediately send them back because they had no flavor so we weren't gonna eat it; normally I don't send things back I'll just pay it because I know that's annoying on the servers end, but at this point I could care less. So finally when we're ready to box up she comes and asks for a box(rushing us) and told her we didn't like the wedges, she smiled and took them to her manager 10 ft away from us and snobbishly said ""they didn't like them"". Our bill was $42 had my service been on point I would love left a generous amount but she got 20% and that's me being nice!  Moral of this experience, don't judge your customers! We all come out to eat for a reason to eat good food, and have good service!",https://www.yelp.com/biz/california-pizza-kitchen-mililani-3?start=140
Noways T.,"Mililani, HI",1,4,,1.0,7/9/2017,"Went to the Mililani one maybe 10 times so far, and service is getting crapper by the week. I don't think the care. If you really need Cpk, go somewhere else.  Last night we waited about 20 minutes to get in and the place was half empty. Seems like we arrived before the evening staff or they were understaffed. The person who seated us didn't smile, say hi, or anything but give us a sitting bitch face. She just walked us to a table. The next person who came by introduced herself, told us she wasn't our server, took our drink orders (beer and soft drink), then walked away. She returned with a drink for my young son and no straw. I didn't realize it so had to flag someone else down for a straw. 15 minutes later a girl stopped and asked if we had any questions. Who was this person? I guess she was our real server buy she never introduced herself or anything. 10 minutes later she stopped by again and I asked ""where's my beer?"" I finally got it after being there for 25 minutes. The place was still pretty empty.  We put in our food order and it came in reasonable time. I noticed that our particular server seemed really stressed. She had a few high maintenance tables. You know the type of people who think they're the most important people in the place and they own the wait staff? Yea, those types of idiots. Anyway, here's the worst part. There was a manager on duty, who just waltzed around with no concern or worried look on her face that some of her staff was dying. She actually walked past us about 10 times and I made eye contact with her on many occasions. I was going to ask for straw, napkins, another drink, etc. because the rest of the staff was sure to walk by as quickly as possible and avoid eye contact. Nah, this manager doesn't appear to care.  Save yourself from having to wait long for a forgettable experience. The other Cpk's are far superior to Mililani. This place can't use ""we're new"" as an excuse at this point.",https://www.yelp.com/biz/california-pizza-kitchen-mililani-3?start=140
Halia H.,"Wahiawā, HI",63,8,,1.0,9/24/2017,"I've gone to this place countless times, but the time I went last time was by far one of the worst dining experiences I've had.  The night seemed to go off well, other than the fact we had to wait 50 minutes for our seats at 8 pm at night. When we got seated, we got greeted by our nice waitress. She was sweet and gave us our drinks after we ordered our food right away after waiting the 50 minutes. It ended up taking about 30 minutes just for the food to come out. Not only that, but our bread and spinach artichoke dip appetizer took forever because they had to make more bread. So, after waiting 30 minutes for my mother, my friend, and I's three orders of Shrimp Scampi, Chicken Tequila Pasta, and Mac and Cheese pasta withe extra sauce, we were not satisfied at all. We were already irritated at the fact we had to wait 30 minutes just for our food and constantly getting apologies from our waitress about first the 20 minute wait for our appetizer, and then another 30 minute wait for our food. It was also my mom's birthday dinner, so we weren't so pleased. On top of that, the food was not delish at all... my mom ordered a shrimp scampi (which we get is supposed to be super healthy with all the zucchini and such), but my mom said it was way too sour. She made my friend and I try it ourselves... and both my friend and I did not taste the ""butter"" or ""shrimp"" at all. All we tasted was lemon. It was not enjoyable for my mom. Now, on to my mac and cheese.... I usually order this, and I honestly love it. But, this time, it tasted different. I had ordered extra sauce, and usually the extra sauce comes in a bowl on the side, but this time it did not. It was strange at first. And, even after a minute I got my mac and cheese, another waiter came to deliver the extra sauce in the tiny bowl, only to see that my plate was already drowned in the cheese sauce. The cheese sauce didn't taste like cheese at all. It tasted like milk. It didn't taste like the mac and cheese I always order from CPK. Maybe there was a different cook or something, but the service my mom, my friend, and I got last night was not impressive.  Aside from that, as I mentioned before, it was my mom's birthday... a nice employee who was off shift and sitting on the table behind us ended up buying us a brownie with ice cream. We didn't know he bought it for us, but we at least expected a free ice cream that they usually serve on birthdays (I've even had my birthdays at CPK before)... but we didn't... I had to remind the waitress once more it was my mom's birthday, in which she said ""They didn't give you the brownie and ice cream that the employee behind you bought for you guys?"". We had no clue the nice waiter who was off duty had bought it for us. We could have walked out without it or without any ice cream dessert for my mother's birthday at all.  Thankfully, the manager ended up coming to our table to ask what was wrong, in which we told him... and he ended up paying for the shrimp scampi and remaking our 2 dishes for us. But, honestly, I am very disappointed in CPK Mililani... I was expecting way better like the times I've gone before. CPK is one of my favorite restaurants, but this experience was just horrible. We ended up being late to our 9:50 PM movie because we had to wait for the check and remakes. We got seated at 8:30, and were expecting to have a good birthday dinner and then a quick dessert but it turned out not so good... The waitress was nice and we appreciate the effort of remaking our orders even if the pasta for the shrimp scampi remake with no zucchini was undercooked. We will definitely be coming back in the future, but we just hope that they will improve their service.",https://www.yelp.com/biz/california-pizza-kitchen-mililani-3?start=140
Jaselyn G.,"Ewa Beach, HI",0,5,5,5.0,6/16/2017,This is my first visit to this CPK. I usually go to the one in Kapolei but wanted to check out the new and hot location. We were seated in 30 mins which wasn't too bad. I really liked how they texted you when you're table was ready. It allowed us to walk around the shopping center to stall time. I was seated outside which I didn't mind at all. The weather was perfect for enjoying a meal. Our server Marty was an amazing server. He constantly came by our table to check on us and made sure everything was going good. Marty had such an easy going vibe to him it made me feel really comfortable while talking to him. He has great customer service skills and really made my first experience at this CPK location a great one. 10/10 would recommend Marty as your server.,https://www.yelp.com/biz/california-pizza-kitchen-mililani-3?start=140
Z Akiamanō A.,"Mililani, HI",0,4,,4.0,5/17/2017,Updating my review and adding stars because CPK reached out to me and really showed that their customers are really important to them.  Just got off the phone with Sean (or Shawn) at Mililani CPK and he was both concerned and very gracious.  Classy bunch of folks.  ++ stars.  Mahalo!,https://www.yelp.com/biz/california-pizza-kitchen-mililani-3?start=140
Wil A.,"Mililani, HI",2,7,3,5.0,4/21/2017,"Food, awesome as usual. Service, beyond any word in a thesaurus cause we could not ask for any better service from Janica. True island feeling! Mahalo nui loa!",https://www.yelp.com/biz/california-pizza-kitchen-mililani-3?start=140
Kehaunani R.,"Mililani, HI",6,2,3,5.0,4/20/2017,Got there around 1245 ...quick seating. Server took a little bit but someone came and helped the server out. Amazing drinks. I had the mojito.  Tried the mac and cheese bites...so good. Food was amazing. Everything hot and fast. Really enjoyed myself.,https://www.yelp.com/biz/california-pizza-kitchen-mililani-3?start=140
A A.,"Wahiawa, HI",0,4,1,5.0,6/12/2017,"frickin fantastik!!! one of the best tasting places i've been too...food was awesome, awesome customer service, beautiful on the inside, gorgeous on the outside.....brought my daughter out here for her 16th bday today, what i also love is this place is filled with local people... awwwrrriigght cpk!!! we'll defenitly  be back again!",https://www.yelp.com/biz/california-pizza-kitchen-mililani-3?start=140
