Username,location,friend_count,review_count,photo_count,rating,date,review,Url
Stacie M.,"Scottsdale, AZ",69,27,1,1.0,8/11/2016,"I use to love this place. But the last time I ordered they messed it up, even after repeating it 3 times. Then when I got home there was a black hair in my food. I have long blond hair, I discovered it in my mouth! Yuck! I called the manager to let him know about my bad experience. He was very apologetic and offered to give me my money back. Also he said he would send me a gift certificate for the value of my meal. Well guess what, nothing happened. No refund on my card or certificate in the mail. It's been close to 3 weeks. I  called the restaurant last Saturday to find out what happened, he sounded so sincere.  The manager who was on said it was a different manager who will be working Sunday. He took my info and said he will have him call me. Did I get a call, nope... I'm done with this place, ridiculous.",https://www.yelp.com/biz/california-pizza-kitchen-scottsdale?start=20
Laura B.,"El Paso, TX",79,109,9,4.0,7/11/2016,I ordered my favorite BBQ Chicken Chopped Salad.  It tasted fresh and the half size is the perfect portion for lunch.  The waiter was prompt and the restaurant was clean.,https://www.yelp.com/biz/california-pizza-kitchen-scottsdale?start=20
Victor C.,"Phoenix, AZ",86,6,,5.0,5/26/2016,"I had the pleasure of eating at the California Pizza Kitchen on the corner of Scottsdale & Gold Dust. As I was walking in from the parking lot a I noticed almost an absurd amount of curbside pick up spaces it was almost comical! My children and I walked in the front door and were welcomed immediately with a pleasant smile from the host stand! We were shown directly to a seat! Temperature inside the restraint was cool and comfortable, a nice contrast to outside! My daughters and I were greeted promptly by our server Courtney! My youngest daughter has a dietary restrictionthat prevents her from eating wheat. Courtney was diligent in making sure my girls had the best experience possible while being mindful of my daughters allergy.  While we always expect the food and service to be good, Courtney's performance level of service and professionalism put our experience over the top today!",https://www.yelp.com/biz/california-pizza-kitchen-scottsdale?start=20
Food L.,"Phoenix, AZ",0,9,,1.0,8/2/2016,Visited again and it has gotten worse here. The employees bark at everyone they talk to and use condescending tones.  They freeze up when faced with a task and take it out on their computer workers and delivery drivers with severe aggression right in front of customers. I watched as 3 different delivery drivers were berated by an employee for whatever reason. Do not go to this place. The food is mediocre and the employees are disrespectful jerks.,https://www.yelp.com/biz/california-pizza-kitchen-scottsdale?start=20
Scot W.,"Islamorada, FL",10,6,,3.0,4/30/2017,"Rather average experience, I had the salmon and thought the salmon was a bit ovecooked as it was rather dry . The remainder of me meal was good. Service was okay to good, I will try Adin but can't recommend yet",https://www.yelp.com/biz/california-pizza-kitchen-scottsdale?start=20
Kailee V.,"Phoenix, AZ",0,14,,1.0,4/27/2017,"Worst service ever. Hours are wrong on all websites. Takeout girl took 15 minutes to take my order and by the time she was done, she informed me I couldn't order because the restaurant had closed. Will not be returning to this location.",https://www.yelp.com/biz/california-pizza-kitchen-scottsdale?start=20
Lorenzo P.,"Scottsdale, AZ",0,5,,2.0,3/1/2017,"This was terrible. I had the original barbeque chicken pizza and two margaritas. A strawberry margarita and an agave margarita. The problem was not the margaritas, it was the pizza. I felt a sharp pain in my stomach and had to take a tums for it to go away. Come on, the pizza used to be so good before.",https://www.yelp.com/biz/california-pizza-kitchen-scottsdale?start=20
Lorraine L.,"El Paso, TX",70,1,,5.0,8/14/2016,"We asked our waiter ""Zack"" what he recommended and the food was amazing.  The service was outstanding, friendly and welcoming we will definitely be back. Ever time we visit Scottsdale.",https://www.yelp.com/biz/california-pizza-kitchen-scottsdale?start=20
Carter A.,"Scottsdale, AZ",111,36,2,2.0,9/11/2015,"I have been here 3 times now and had a fairly average experience, but today was really a disappointment. Service was slow and I felt like an inconvenience. The chef who appeared to also be the manager on duty didn't seem concerned about the quality of food even though he ran it to me at the bar. My pizza looked more like some salad and you can see all of the left over greens in the attached picture. I ate about half of the greens on the California club and this was all left over. Really disappointed the chef should be ashamed he doesn't care about service or quality of food.",https://www.yelp.com/biz/california-pizza-kitchen-scottsdale?start=20
Tess G.,"Scottsdale, AZ",0,4,,1.0,1/25/2017,"I called 3x to order catering . I was given the run around. First time I called at  11am Jan 19 the  person that answered said that manager is not in yet and he is not authorized to get catering order. Odd that he didn't even ask for my name and number so manager can call me back to take order. I called again after one hour and I was put on hold for 15 mins to get the person that takes the order! I hung up and called again and I asked for the manager . I just wanted to order catering  and I don't know why it's so hard to do place the order! Again, the person that answered for the third time said that the manager was "" too busy"" !! Really??? Too busy to talk to customer who wants to order catering???  Even if manager is busy, why can't anyone take my name and number and they should call me back to get the order. So frustrated with customer service!!! So poor! And it's starts from management . I hung up and called Maggianos. Maggianos is so efficient and took my catering order in 5 mins and ready to be picked up as promised.",https://www.yelp.com/biz/california-pizza-kitchen-scottsdale?start=20
Georgie M.,"Scottsdale, AZ",2925,1215,6434,4.0,7/19/2011,"We have come to this CPK for several years and the food has been generally good.  The only negative for us is that it sometimes feels and looks like they're understaffed, not that you could tell by the wait staff running around. The service is fast and efficient.  We have ordered most items on the menu, but we come here mainly when we have the taste for a Chopped Chicken salad or the Sante Fe pizza -- which are both great! Enjoy!",https://www.yelp.com/biz/california-pizza-kitchen-scottsdale?start=20
Arthur R.,"Scottsdale, AZ",0,72,,1.0,12/13/2015,Used to love the tai chicken pizza. Ordered one to go today and my wife picked it up. It wasn't even cooked and all the veggies were in a separate container. Called the manager Jason and he credited my account. It went straight to the trash can. So disappointed. Won't be back.,https://www.yelp.com/biz/california-pizza-kitchen-scottsdale?start=20
Queen Happy Face X.,"Paradise Valley, AZ",193,136,14,4.0,10/2/2014,"Who doesn't love CPK? Their craft is a good and reliable as any other family chain.  My review is mainly in regards to my interaction with Tony the manager. He was a dream, helpful, friendly, and outgoing.   I walked to this CPK near my house and I sat at the bar by myself after a long Friday at work, I was hungry and needing a cocktail. Tony suggested a cocktail consisting of tequila and fresh strawberries..... yum! We had good banter for a while, I had a shot of tequila before my walk home and happily took my dinner home to enjoy.",https://www.yelp.com/biz/california-pizza-kitchen-scottsdale?start=20
Jeff B.,"Phoenix, AZ",39,328,174,3.0,12/29/2013,"First time at CPK tonight. Ordered drinks and got menus. Server was a bit hazy on specialty beers available but was speedy at this point. I ordered a pizza but had a change to make on it: I wanted thin crust toppings on a regular crust. He said no prob. My daughter ordered the spinach and artichoke thin crust pie while her boyfriend got the spaghetti bolognese.  Spaghetti was fairly bland, pretty much due to a non-aggressive chef choices.  The spinach and artichoke pizza was very good with a crisp crust and ample toppings. The meat lovers had really good toppings but the crust?  It looked like they tacked a ring of dough onto a thin crust pizza. Some of you like thin crust but not me. Don't want my toppings on a saline cracker.  Service, while very pleasant, was sporadic. When he arrived, he was good. When he wasn't there, he was gone a long time. At one point I even asked if he had left for the night.  I'll try CPK again but not the pizza. I really dislike thin crust pizza. For you fans of that: go!",https://www.yelp.com/biz/california-pizza-kitchen-scottsdale?start=20
J D.,"Anaheim Hills, CA",4958,1982,28925,3.0,3/16/2013,"Mom bought us gift cards to CPK for Christmas, so we were able to visit this location a few times over the past couple of months.  It's been a while since I've had CPK and they had some new appetizers on the menu.  We decided to give them a try in addition to our fav Pizzas.  Here's what we ordered during our visits: White Corn Guacamole & Chips (Diced Avocado, Wweet White Corn, Black Beans, Jicama, Bell Pepper, Cilantro and Serrano Peppers), $3.75 Crispy Fried Mac n Cheese, $3.75 Mediterranean Foccacia, $2.50 Tuscan Hummus, $6.50 Sicilian Pizza (Spicy Marinara, Italian Sausage, spicy Capicola Ham, Salami, Mozzarella, Parmesan, Basil, Oregano), $14.00 Pepperoni Pizza, $12.00 Belgian Chocolate Soufflé Cake The White Corn Guacamole tastes awesome, but the Chips suck.  The Chips tasted stale.  However, kudos to the CPK team on creating a yummy variation of Guacamole.  The Fried Mac n Cheese was awesome too.  The Mediterranean Foccacia was too hard for our tastes....we won't order it again. The Sicilian Pizza is my fav...I always get it.  This location does a good job at delivering a tasty old favorite.  Of course, the Pepperoni is a classic and they do it well. For dessert, the Belgian Chocolate Souffle is awesome...very rich.  I split it with The Better Half. Service here is so/so....they have some young kids who you can tell it's their first serving job.  They're nice though, but need to learn the more refined aspects of customer service.....like making sure your Wine glass is never empty and offering dessert....we had to ask. Return Factor - 70%",https://www.yelp.com/biz/california-pizza-kitchen-scottsdale?start=20
Stephanie B.,"Scottsdale, AZ",61,81,23,5.0,7/3/2014,I love this place! I usually get their taco pizza because it is so unique and is thin crust and light enough to not make you feel stuffed. I usually try a different salad each time too.  Their food is always consistent and I love it! It is not like a typical NY pizza though. It is more Americanized so not much sauce on it.  I really like their food. It is always fresh.,https://www.yelp.com/biz/california-pizza-kitchen-scottsdale?start=20
Scrub J.,"San Diego, CA",5,28,60,4.0,2/6/2015,My server was engaging and well versed of the menu.  The quality of my food met my expectations having eaten at other CPKs. The overall facility was clean and the staff were friendly.  I will eat here the next time I am in town.,https://www.yelp.com/biz/california-pizza-kitchen-scottsdale?start=20
Sandy P.,"Santa Clara, CA",0,7,1,5.0,4/13/2016,"We just finished the 3rd meal at California Pizza Kitchen in a month.  The grilled vegetable salad is one of the best salads in the valley.  I had to go back for this salad! We also had a spinach and artichoke thin crust pizza which was crisp and delicious.  The food is always fresh and well prepared and comes out very quickly.  Everyone in our party was happy with their meals.  The waiter, Hugo, whom we've had several times, was extremely pleasant, helpful  and appropriately attentive.  This is our neighborhood go-to restaurant and we're always happy with the experience.",https://www.yelp.com/biz/california-pizza-kitchen-scottsdale?start=20
Rich P.,"Scottsdale, AZ",0,1,,1.0,3/17/2015,"I used to be a big CPK fan.  However, the other day I stopped in and order takeout - 2 bowls of potato soup.  I got home to find 2 bowls of pea and barley soup. Called and talked to the manager Tony, who apologized,  saying he'd send a $15 gift card and if I stopped by I could get the correct soup. Went there today and the take out girl said Tony told her I had ordered one cup each of potato and pea sou.  He told her to give me one cup of potato soup.  I corrected her, she called Tony, and he grudgingly agreed to give me the 2 bowls of potato soup, but that he wasn't going to send the gift card. My wife and I pride ourselves on being honest, and I couldn't believe he was suggesting that we were trying to cheat them out of a bowl of soup!  I'll never go there again.",https://www.yelp.com/biz/california-pizza-kitchen-scottsdale?start=20
A T.,"Paradise Valley, AZ",2,48,5,1.0,1/12/2014,"Disgusting.  I thought I liked this place but I haven't been in years and boy was I wrong.  The service was terrible, my food was luke warm and I had to send my pizza back.  Jamaican Jerk was what I ordered and it was really sweet and odd tasting.  When I finally got my new pizza, which still was not great, the server didn't come to check on us and brought the check charging us for BOTH pizzas!  He was rude and very unfriendly the entire time so asked to speak to the manager.  We didn't say anything about the service we just asked them to remove one of the pizzas as we sent back one.  Two hours of my life I can never get back. What a waste.  Bad food bad service.",https://www.yelp.com/biz/california-pizza-kitchen-scottsdale?start=20
Emma H.,"Scottsdale, AZ",0,21,,5.0,10/22/2015,My family and I love CPK. We go there often and enjoy our meals every time. My mom and I get the oear gorgonzola because it is to die for! The service is always nice and everything is always fast and clean. We've never been diaappointed with our food.,https://www.yelp.com/biz/california-pizza-kitchen-scottsdale?start=40
Charlie L.,"Phoenix, AZ",0,3,,2.0,7/24/2015,"I've been to this location several times, but today's lunch was not good. The server was attentive which was nice. The food, however, was not up to usual CPK standards. The BBQ chopped chicken salad was essentially flavorless aside from the cloying BBQ sauce. The bianco flatbread had hardly any toppings on it. The asparagus and arugala salad was insipid. I can't foresee returning to this location any time soon. It's a shame too because I've been going to this location off and on for over a decade.",https://www.yelp.com/biz/california-pizza-kitchen-scottsdale?start=40
Alex B.,"Phoenix, AZ",129,2,,2.0,10/11/2015,Good food but bad service they all stand around talking and laughing the food takes a while and they short you on bread and avocado so I wouldn't recommend,https://www.yelp.com/biz/california-pizza-kitchen-scottsdale?start=40
Jade W.,"Goodyear, AZ",18,321,20,4.0,1/11/2015,"I really enjoy California Pizza Kitchen and wish they had a location in the west valley! I like that their pizza crust is thin, yet soft. That's not an easy combination to find. Ate here for dinner last night and it wasn't very busy, but it was a little early so that may be why. I ordered the pepperoni pizza and my friend ordered the BBQ chicken pizza without onions and added bacon. We shared for a little variety. They were very tasty! The crust on the BBQ chicken was a little darker and not as soft so they must have cooked it a little long, but the sauce was smoky and delicious and I enjoyed it. The pepperoni was yummy. Service was good but he forgot about our drinks for a little while, although he tried to make up for it towards the end. I was happy overall. Please open a restaurant in Avondale/Goodyear!",https://www.yelp.com/biz/california-pizza-kitchen-scottsdale?start=40
Phoenix A.,"Paradise Valley, AZ",0,23,,3.0,6/9/2015,"This place used to be great.  It had good food and excellent service. Now, it feels dirty and has bad service. You have to ask for bread (most times you have to ask twice).  What happened to this place?  There is no reason for me to go back.",https://www.yelp.com/biz/california-pizza-kitchen-scottsdale?start=40
Leanne K.,"Scottsdale, AZ",69,39,50,4.0,10/25/2013,"Early dinner before the Chaparral High School football game.  Got right in with no problems, well I guess so, it was 5:30.  Our server was very sweet, she asked if we wanted a sample of Pinot Noir. We didn't.  She gave me a good recommendation for wine and she was very personable and seemed to enjoy her job.  So nice to see happy employees!   My dad knew what he wanted, he orders it everytime, the chicken tequila fettichini with extra limes.  I usually do a pizza but splurged and went for the pesto cream penne.  I enjoyed it but I was confused with them calling it pesto. I didn't see much if any pesto. And the cream sauce was hardly there the penne was dry on the top. It looked like the sauce was not mixed in with the pasta.  Some of the penne tasted undercooked.  Overall, the dish was ok. Probably won't order it again.  Might just stick with the pizza next time.",https://www.yelp.com/biz/california-pizza-kitchen-scottsdale?start=40
K M.,"Malibu, CA",4,78,1,2.0,5/1/2014,"Pizza should be eaten with hands. When one bites into a slice, the cheese should stretch and form strings until one puts the remainder of the slice back on to the plate.  Nah, CKP may be trendy, modernized, but genuine pizza it's not. Service was above average although I had to flag down our server. Would I visit there again? Yes, if I wanted to fuse Italian pizza with Chinese chicken salad and Mexican tortilla soup!",https://www.yelp.com/biz/california-pizza-kitchen-scottsdale?start=40
Nicholas B.,"Atascadero, CA",28,8,,5.0,10/19/2013,"I sat at the bar over two hours eating their new hand-tossed pizza (which was quite good) and drinking beers. The two extremely attractive ""barkeeps"" (Lisa and Michelle) provided sufficient level of cheerful and polite company while I tried my damnest to keep the creeper factor low. While I couldn't squeeze out the finer details of their dough recipe, I did manage to develop a fondness for all things at that location. The level of professionalism was refreshingly elite from all staff members.",https://www.yelp.com/biz/california-pizza-kitchen-scottsdale?start=40
Morgan T.,"Scottsdale, AZ",208,42,2,5.0,2/6/2015,"Excellent service and great food, salads are a healthy addition with the regular pizza. The price is affordable for a place,groups are welcome.",https://www.yelp.com/biz/california-pizza-kitchen-scottsdale?start=40
Bryant E.,"Phoenix, AZ",3,6,,5.0,7/1/2015,My first time trying cpk and it was amazing. Their draft system was down so the beer was hot but our bartender made our visit great still. The food was tasty and she went above and beyond to make sure we got cold beer. We will definitely be coming back!,https://www.yelp.com/biz/california-pizza-kitchen-scottsdale?start=40
Sukh J.,"Scottsdale, AZ",0,8,1,4.0,3/27/2015,"I do love their pizza! Always perfectly made and the kids menu is just right for the little ones. Only complaint here, please update your silverware! Knives were near impossible to use!",https://www.yelp.com/biz/california-pizza-kitchen-scottsdale?start=40
Ed W.,"Pasadena, CA",0,33,,2.0,8/2/2013,"Second night in Scottsdale.  Walked across the street from the Hampton Inn.  Convenient but won't go back. I had a pizza with the Gluten Free dough.  I guess that was my fault.  It was doughy and undercooked with no flavor.  If I go to any CPK again I won't order that.  My biggest complaint was the bar service.  I sat right across from the bar service.  I ordered a full glass of Cabernet.  The waitress (who was very polite and sweet) delivered it with a smile.  I stopped her and explained that I had ordered a full glass, not a half glass.  She apologized and said it was a full glass but it would show up as two 1/2 glasses on my bill.  (my suspicious mind begins).  I'm watching the bartender.  he's making two strawberry Martguerita's or daiquiris.  He pours them out and one comes up very short.  So, instead of adding a little more alcohot and giving it another shake, he holds the glass under the sink and tops it off with tap water.  I stared at him and shook my head and he ignored me. The food is mediocre and you should not order any drinks from here.",https://www.yelp.com/biz/california-pizza-kitchen-scottsdale?start=40
Kristin L.,"Paradise Valley, AZ",47,17,9,5.0,11/2/2014,"Atmosphere is awesome, service is excellent.  The thai salad is my favorite,  I order it almost daily on my way home! The peanut dressing is so good, I could drink it. I also love the drive up take out service,  makes it so much easier!",https://www.yelp.com/biz/california-pizza-kitchen-scottsdale?start=40
Jack F.,"Scottsdale, AZ",1,25,18,5.0,6/30/2013,Big fan of the Hawaiian BBQ Chicken Pizza (I order with no onion and no cilantro but I add Bacon) .   Some times I get the baja chicken spring rolls and today i ordered the Mac n cheese!,https://www.yelp.com/biz/california-pizza-kitchen-scottsdale?start=40
Arielle S.,"Manhattan, NY",385,336,,4.0,3/29/2012,"First off, I would like to thank our waitress for dealing with my pain in the ass family. My family insists on switching tables, placing soup orders when asked what drinks we want, tasting each others drinks/soup and then bugging the waitress to add another to the order. The waitress very calmly put up with all these shaninigans. We tried a soup to start off with. I believe it was called sedona. If you have ever tasted the smart ones frozen meal ""sante fe style rice and beans"", it actually tasted like that but in soup format. sounds weird---but was very tasty.  We split 3 different pizzas. All were good but I will list them in order of how good: 1. Roasted Garlic Chicken Pizza 2. Thai Chicken Pizza 3. Margarita Pizza Would definitely recommend this restaurant to fellow yelpers and friends!",https://www.yelp.com/biz/california-pizza-kitchen-scottsdale?start=40
Michael G.,"Westown, Milwaukee, WI",2,11,,2.0,12/6/2014,Less than ideal. We came here before a movie and were seated on the outside patio. Guess they are conserving electricity because it is so dark that I can't even see my food!! I will have to think twice about coming back here.,https://www.yelp.com/biz/california-pizza-kitchen-scottsdale?start=40
Ken D.,"Scottsdale, AZ",6,74,1,4.0,9/1/2014,Thai crunch salad is pretty good and the artichoke dip is pretty good as well. Give them a try if your in the neighborhood.,https://www.yelp.com/biz/california-pizza-kitchen-scottsdale?start=40
Robert H.,"Milpitas, CA",11,63,14,1.0,2/21/2015,"Had dinner here last night. Someone in the kitchen didn't wash hands and I won't be back to this establishment. Don't appreciate the gastric distress. Keep it classy, CPK.",https://www.yelp.com/biz/california-pizza-kitchen-scottsdale?start=40
Rick M.,"Goodyear, AZ",0,6,1,1.0,3/20/2015,"We were there yesterday and frankly I have to say it was not great. The four of us ordered pizzas. One of them came completely cold. Asked them to reheat it and add sauce as it was very dry, it came back like it was heated from the microwave. Needless to say she didn't eat it. We were polite in our complaint. The bill came and it was added to it even after the waiter said it would be taken off. Not impressed. Won't go back",https://www.yelp.com/biz/california-pizza-kitchen-scottsdale?start=40
