Username,location,friend_count,review_count,photo_count,rating,date,review,Url
Kokoa T.,"Pasadena, CA",118,49,83,4.0,8/18/2017,"Let me start this by saying, I LOVE LOVE LOVE their chicken piccata. OMG! It's heaven on a plate. While on disability in August 2016, I ordered this through  . YESSSSSSSSSSSS!!! I think I posted it to Instagram about 4 different times in a two month period.  Fast forward to August 2017. While on staycation, a friend invited me to lunch so we could catch up. I chose CPK since I hadn't been inside the restaurant in a few years. We were greeted well and seated quick. Our waitress Kitty was such a sweetie. My friend brought her nine-year-old daughter and Kitty treated this child as if she knew her. It was too cute to watch their interaction.  My friend and her daughter both ordered pizza and salad. I went straight for my chicken piccata. OMG, it was just as good as when I have it delivered because I do still order it at least once a month. YESSS!! My friend couldn't finish her pizza due to the wonderful bread CPK gives every table. It filled her up quicker than expected. My friend's daughter, well Kitty brought her, her own bread basket and she ate it all by herself. She's a big bread-eater for some odd reason, lol.  When ordering the chicken piccata, I suggest extra cream sauce. There's a charge but it's worth it. The chicken piccata comes with three pieces of breast meat and sometimes the chicken can be a little dry, so the extra cream sauce helps. In this case, during this visit, such was NOT the case. The three pieces were moist and the extra cream sauce was perfect for the pasta. I like a wet pasta and the sauce has lemon in it. SCORE! Because I was on staycation, I ordered an alcoholic beverage. WOO HOO! I'm a Beyonce fan so to see a drink on the menu called ""Beehive,"" well, of COURSE, I had to try it. It's a sangria of sorts and while I like some sangrias, I'm more of a Moscato type of wine drinker. The beehive reminded me of a red wine so boohoo. The strawberries inside, once infused, were great! I should have stuck with their traditional sangria.  All in all, good visit. It was a little warm inside the restaurant but that could have been due to the alcohol. It does raise the blood pressure lol.",https://www.yelp.com/biz/california-pizza-kitchen-pasadena
Deanne R.,"Cypress, CA",22,90,73,5.0,8/13/2017,First time here at this location looks really cute. Excellent customer service especially the manager I regret I did not get her name. But my son with special needs ordered him self. The waiter brought what he had ordered but I guess in his mind it looked different...... right away the manager new he was not happy and asked what was the matter. My son described as best as he could the situation. She right way placed another other if pasta for him.  As soon as it came still my son was not content. I said it was ok. He would eat it after all the trouble I thought.... well the manager still was not happy she placed another order leaving the wrong one behind so my son could eat something while we where all eating. I was just amazed with the customer service.  I wished I lived close by to always come here!!! Thank u also much for everything.,https://www.yelp.com/biz/california-pizza-kitchen-pasadena
Maria R.,"Pasadena, CA",18,269,,2.0,8/12/2017,"2 visits: one good and one bad (July/Aug 2017) Even the good visit started badly, with two rude little hostess chicks pretending they couldn't understand carefully enunciated English. Guess the speaker was too ""proper"" and not trashy-slang speaking enough for them. Once the manager took over and got us seated, dinner was fine. The bad visit never really happened. With a call-ahead (calling one hour in advance to get on the list is their version of a reservation), I still couldn't get seated. The host and hostess were bumbling and rude, respectively. I just walked. Don't waste your time calling ahead; it's a front. CPK corporate, if you're reading this, you have a serious problem with your host station in Pasadena. You have WAY too much competition in this city for your ""hosts"" to run business out of the door. And, make no mistake, that's exactly what these amateurs are doing.",https://www.yelp.com/biz/california-pizza-kitchen-pasadena
Aura C.,"Monterey Park, CA",509,463,11,4.0,11/29/2017,"Can't really complain. We each ordered a pizza and shared. We had the Thai Chicken, Garlic Pizza and BBQ. Nothing fancy, but good. Nice location.",https://www.yelp.com/biz/california-pizza-kitchen-pasadena
Zoe K.,"Claremont, CA",59,229,866,5.0,7/3/2017,"We always get the same exact thing  The tequila hicken fettuccine and the grilled veggie salad with salmon.  It's always delicious consistently good service and there's parking under ground, which is validated in the restaurant. It's a nice location too",https://www.yelp.com/biz/california-pizza-kitchen-pasadena
Sarah R.,"Tujunga, CA",0,10,2,3.0,1/5/2018,I've been to a few other California Pizza Kitchens before. I've never ordered anything other than pizza. This afternoon I decided to try their Kung Pao Spaghetti which was alright. I guess this is not a direct reflection of this specific CPK but their Kung Pao Spaghetti is definitely not worth the $17.51 that was paid. I would've been more satisfied going to Panda Express and getting a plate for under $8.,https://www.yelp.com/biz/california-pizza-kitchen-pasadena
Jeff L.,"San Marino, CA",131,337,836,5.0,6/9/2017,"It was a great dining experience when I visited CPK.  We were warmly greeted once we entered and we were quickly asked if we parked underground and that they would take care of the validation so we could get that out of the way. The restaurant is bigger than it looks.  With the high ceilings and open floor plan, it's very bright and inviting inside.  There's also patio seating outside, and there's also an extra dining area to the right of the main area and that is where we were seated. Fred was our waiter and he was very on top of things.  He was refilling drinks once we were running low.  He brought us house bread which is still a classic after all these years.   I ordered the Thai chicken pizza.  It still tasted like how I remembered it.  I couldn't decide between that or the BBQ chicken pizza, both are great choices. CPK does have an app where you can earn points by how much you've spent, and I believe you can also pay for your bill through the app. Parking:  there's parking underground.  90 minutes free with validation.",https://www.yelp.com/biz/california-pizza-kitchen-pasadena
Beatriz A.,"Pasadena, CA",330,28,54,2.0,7/21/2017,"Luckily they have really good free bread here and I filled up on half a baguette, because the food was otherwise subpar.  I usually get the California Veggie pizza with no cheese. In the past, I've been told many times that this was vegan. Only recently, I saw an old Yelp review that said that the pizza crust at California Pizza Kitchen has eggs. Unfortunately, it's true. I confirmed it with the waitress. Seriously disappointed that I've been eating eggs this whole time, and none of the employees here were knowledgeable enough to tell me. What if this was a serious allergy? They really need to know their ingredients better.  I had to settle for the Dakota Smashed Pea + Barley soup and Super Spinach + Quinoa salad, which are both vegan. But be careful if you're allergic to dairy (or the ingredients in any of their other soups), because they warned me that all the soups are close together and can splash into one another. The price was pretty reasonable since it was from their lunch menu ($8.95 for a soup and salad lunch duo, valid Monday - Friday from 11 am - 4 pm). I was really hoping for something more substantial... The salad was very bland, and some pieces of the greens were just so bitter that I had to spit them out. The soup was just okay.  My boyfriend got the Shrimp Zucchini Scampi, which was also not great. It was mostly zucchini, with not much pasta or shrimp. And for a price of $15.99, the portion was just too small. My boyfriend eats an average amount, and he was still so hungry afterwards. He literally had to scavenge for the last bits of shrimp meat in the tails. And he even ate some of my leftover salad, which is saying a lot because he hates salad haha.  The added star is from the great service. Our waitress was so patient with my many questions and made sure to double check all the ingredients in their dishes. The validated parking was also convenient, since street parking is hard to find in this area.",https://www.yelp.com/biz/california-pizza-kitchen-pasadena
Jen R.,"Pasadena, CA",0,17,,1.0,12/29/2017,I don't even know where to begin with this meal.  We ordered dinner from here and this is what we ordered: 1. Kid's Mac and Cheese 2. BBQ Chicken Pizza on Crispy Thin Crust ($1.50 more for that) 3. Hawaiian Pizza on Crispy Thin Crust ($1.50 more for that) 4. Chicken Dumplings There was not a single thing here that we could eat.  The Mac and Cheese did not have ANY cheese sauce on it.  It was plain pasta with a tiny bit of broken sauce.  Both pizzas had SOGGY crust that was flimsy and not the slightest bit crispy at all. And don't forget that the pineapple on the Hawaiian pizza was not even cooked! The chicken dumplings were ICE COLD in the center like they had just been taken out of the refrigerator.  I understand that this is a chain restaurant and my expectations should not be that high but this is absurd and just completely unacceptable.,https://www.yelp.com/biz/california-pizza-kitchen-pasadena
Belen S.,"Pasadena, CA",0,2,,4.0,12/31/2017,The food was pretty good and my drink was really tasty but we ended up being a forgotten table. The outside seating is very nice.,https://www.yelp.com/biz/california-pizza-kitchen-pasadena
Gracelyn C.,"Pasadena, CA",1,3,,4.0,12/30/2017,Started out great with a friendly server and got our order in pretty quick. The food was delicious and my drink was really yummy but we ended up being a forgotten table. Our server turned into the bartender.,https://www.yelp.com/biz/california-pizza-kitchen-pasadena
Irene S.,"Hayward, CA",42,172,551,3.0,10/23/2017,"Came by here while staying next door at the Westin. Came by a lil less than hour before they closed. It was pretty quiet, maybe 2-3 tables had customers. Upon entering nobody really acknowledged us. They kept going about their business and then came to the door after. Kinda weird feeling. However, once we were seated we were greeted by our server (forgot her name). She was really nice and super helpful in helping us choose some options for meals. I ordered the mac and cheese and a side salad and my bf a cobb salad with chicken. Our food came by pretty fast. I was very underwhelmed with the salad. It lacked flavor and freshness. I can barely finish it. My mac and cheese was good until I noticed a whole bunch of black stringy things which at first looked like hairs in it. However, upon reporting it to our waitress she said the cooks told her it was residue from a sponge ....weird... but anyways she took it back and didnt charge us but at this point I couldnt even eat anything anymore. Kind of put a damper on my experience. However, my bf enjoyed his salad and I really did like the Cucumber Lime Cooler I had. So theres that lol",https://www.yelp.com/biz/california-pizza-kitchen-pasadena
Francisco S.,"South Gate, CA",14,19,12,5.0,12/19/2017,my friend and i had a great time food was good she enjoyed her drink and best of all she had a smile on her face the bbq pizza was delicious and hers was also good,https://www.yelp.com/biz/california-pizza-kitchen-pasadena
Aura M.,"Pasadena, Los Angeles, CA",1026,321,2120,3.0,9/29/2017,"09/26/2017 UPDATE REVIEW:                                               What's wrong with your hosts?? No matter how good is your food, the first person to welcome you in the restaurant is the key to give your customers a good or bad impression. I went there on Tuesday night with a group of friends. Because i was the first one to arrive I requested a table for 6. The 2 hosts instead of welcoming to the restaurant WHICH IS A NORMAL THING YOU EXPECT FROM THE HOSTS they asked me to wait for them to finish their conversation. Are you kidding me???? I waited 5 minutes until they finally decided to give me a table. Maybe they don't need our business?? although the place was pretty empty. CPK should hire better workers otherwise they're going to lose business especially when there's a lot of places to go.                                        Then we had to look for our waitress to take our order, after 20 minutes since we sat down. Yeah, pathetic. PREVIOUS REVIEW: We were called the ""old peeps"" lol. And it's true since our last visit was 2 years ago. The menu has definitely have changed-for better. There are more food selection for those who are not that crazy about their pizza. Our waitress, Milo, was so nice. The GM came over to our table and introduced himself after placing on our table a cheesy flat bread as a complementary to our dinner which i think that was pretty cool-unexpected. Then he told us about all the latest changes in the menu like no more tiramisu :( etc. I don't know about you but that personal attention is always nice and really appreciated which makes me feel like coming back more frequently......also, the drink menu is also new. They added more cocktails and other refreshing drinks. The restaurant was cleaned. We got our ticket validated as soon as we stepped inside the restaurant. The food was good. The dessert was yummy too. It was a nice experience.....glad we went back!!!",https://www.yelp.com/biz/california-pizza-kitchen-pasadena
Jennifer C.,"San Gabriel, CA",28,184,272,1.0,4/1/2017,"This review is for service only. I called in my order and decided to use the curb side service for the first time. The person taking my order was short with me from the start of my phone call and overall lacked finesse when answering some of my questions. And to bluntly state, I would not have needed to ask these questions if she was more informative to begin with.  Given this is my first time ordering curb side, I asked questions such as  where  I should park (park in parking structure or on the street?) I feel this is a valid question given it is Pasadena and there may be parking in the front for pick ups.  She responded with a tone that was short and really made me feel like this was an obvious fact that I should know. And to make matters worse, her response was vague and lacked detail.  When ordering with her, she misheard my meal and was snappy when I corrected her. What happened to good ol customer service?  Or in this case, common courtesy. Someone working in this position  (especially on the phone ) should have good social skills and communication skills - both are lacking.  I made a large order that day and was thankful it was takeout...I would not have been  able to bare spending an evening with her as my server.  *Although my rating does not reflect the food - just want to share that food was tasty, came out hot and the overall takeout process is great. Came with all necessary utensils and plates as well - just make sure you give them the correct number of people dining so they give you the appropriate amount.",https://www.yelp.com/biz/california-pizza-kitchen-pasadena
Summer S.,"Los Angeles, CA",54,681,3,4.0,12/2/2017,This is one of my favorite CPK's in the area. They are very professional here in terms of service and food. They are also very clean. Good job!,https://www.yelp.com/biz/california-pizza-kitchen-pasadena
Lil A.,"Los Angeles, CA",55,146,24,5.0,11/22/2017,"Love, love, love their Chicken Piccatta. It's my husband's favorite also. We like their outside patio seating. It's nice on a sunny hot day. Service is great and management is super nice. Great place to have lunch.",https://www.yelp.com/biz/california-pizza-kitchen-pasadena
Daniel L.,"Alhambra, CA",0,34,249,4.0,9/27/2017,"CPK serves good food specially crispy thin crust pizza. We ordered Bolognese spaghetti and Banh Mi Bowl tonight. The meat sauce in the Bolognese spaghetti is not salty and that makes it more healthy. The nutritious Banh Mi Bowl is one of the new CPK power bowls that have good portion of fresh avocados, cucumbers, carrots, sesame seeds, and grilled chicken. The chili-lime vinaigrette and serrano peppers make the bowl mouth watering. The waitress was very friendly and helpful. We enjoyed our dinner.",https://www.yelp.com/biz/california-pizza-kitchen-pasadena
Grace E.,"San Gabriel, CA",663,326,393,3.0,7/27/2017,"We ordered a Business lunch for delivery from this location and they were on time and bought the food all packaged in boxes. Everything was great and organized, the deliverer was nice and there were names on the boxes to differentiate the difference. I have not eaten at this location yet but so far, the delivery service is amazing!",https://www.yelp.com/biz/california-pizza-kitchen-pasadena
Gerry M.,"Woodland Hills, CA",4,19,,4.0,11/9/2017,"Server was beyond excellent...  Food was good...  Late night snack was enjoyed with ""better half""...",https://www.yelp.com/biz/california-pizza-kitchen-pasadena
No S.,"Beverly Hills, CA",0,62,172,4.0,2/18/2017,Customer service is excellent.  I found a hair in my food and the manager comped my meal. The server was still just as polite as she was when she took our order.  There were no questions asked and it was an immediate decision on their end.,https://www.yelp.com/biz/california-pizza-kitchen-pasadena?start=20
Michelle L.,"Los Angeles, CA",244,120,152,2.0,11/24/2016,"I made the mistake of assuming CPK's revamped menu and modernized interior would translate to delicious food. Boy was I wrong. Well, at least I used a gift card! -Baked Potato Soup: Tasted as bad as it sounds (although my boyfriend thought it sounded appetizing). The soup was extremely thick, overly creamy, and had a strong cheese flavor. -Farmers Market Soup: The squash flavor of this soup was more appealing, but the layer of oil on top was not. Also, I found it to be more sweet than savory. -Roasted Veggie Salad: The vegetables had a good roast on them and the salad was perfectly dressed. Sadly, this was probably my favorite dish of the night. -Sicilian Thin Crust Pizza: The pizza was dry and needed more sauce while the cheese had an odd spongey consistency. The crust wasn't crispy enough. I could have built a much tastier pizza at Blaze for half the price! -Fresh Strawberry Mango Cooler: This drink tasted rather diet-y, as if artificial sweetener was used instead of the ""natural flavors of mango, guava, and ginger"" as described on the menu. Should have gone for the flavored lemonade! Tip to the business: Instead of updating your look, you need to update your recipes! I hadn't been to CPK in several years and I won't be returning for several more based on this disappointing experience.",https://www.yelp.com/biz/california-pizza-kitchen-pasadena?start=20
Peter S.,"San Pedro, Los Angeles, CA",0,12,,3.0,11/5/2017,"We used to come to this CPK, maybe once every 2 weeks. It was consistently good. My wife ordered the Salmon Plank. It was always equally good as the previous time. Unfortunately, the last two times we were there, we were quite disappointed. The pasta was not done the last time either. I'm guessing there has been a change in management as well.  Need to get Robert back.",https://www.yelp.com/biz/california-pizza-kitchen-pasadena?start=20
V E.,"Pasadena, CA",13,273,9,4.0,10/2/2017,"I have a love/hate relationship with this place. The menu good and is constantly evolving. They've added several pastas, a steak, and a Banh Mi bowl, and still have the classics like the avocado egg rolls and BBQ chicken pizza. However, the service is spotty. Everything from seating, to ordering, getting food, getting service, getting the check, and validating parking takes a long time. Set aside at least 1.5 hours to eat here.",https://www.yelp.com/biz/california-pizza-kitchen-pasadena?start=20
Samuel H.,"Glendale, CA",17,11,,4.0,9/30/2017,"The food at all CPKs are about the same but what sets this CPK apart from the others is the location. This CPK is in a nice location and has outdoor seating. We parked in the street which is free after 5PM. They do a 90 minute parking validation as well but we couldn't really find where the parking lot was. With the location, you can take a stroll right in the heart of Pasadena. City hall is nearby and it looks great at night. Perfect for a stroll after dinner!",https://www.yelp.com/biz/california-pizza-kitchen-pasadena?start=20
Kevin T.,"Temple City, CA",87,37,16,2.0,2/4/2017,"We arrived at 930pm on Saturday (they close at 11pm) however service was bad and really slow, to top it off they were not busy at all. Waitress walked by at least 4 times before taking our entree orders. Never were we offered any refills. Manager was focused on Television Basketball game rather than checking on tables or helping expo the food. Parties near us seemed unsatisfied as well. Pacing was horrible, food came out different times. My dish came out  a solid 5 minutes after my gfs. Our waitress seemed like she wanted to end her shift already, at some point she disappeared. I would not recommend this location. Validated parking was nice though. For the service, food quality, and price.. i'd rather go to cheesecake factory.",https://www.yelp.com/biz/california-pizza-kitchen-pasadena?start=20
Kristin A.,"San Francisco, CA",0,21,32,2.0,6/22/2017,"I last visited this CPK on 5/20/2016 around 9 pm. Around 20 minutes after we got there, this large SPIDER (about 1.5 inches across) dropped from metal bars on the east side of the building ONTO my boyfriend. We promptly killed it, but since we don't like spiders, we were relatively traumatized. Our waitress, Jasmine (?), was very nice about it, and told us her manager was going to come over to talk to us.   After about 15 minutes of paranoia that another spider would again drop on us, the manager came over and asked in a relatively sarcastic way for us to explain what happened. We told her what happened, and she kept insisting that she had never seen a spider in the building - implying that because she had never seen one, we must have brought it ourselves. She then asked us if we had been in any ""dense forests"" that day. She was very rude given the circumstances and highly implied that we had brought in this spider as some sort of scheme.   Although our waitress was very nice and the restaurant ended up giving us a free dessert, the behavior of the manager was completely offensive. Seriously, spiders are icky, so WHY WOULD WE BRING IN A GIANT SPIDER TO THE RESTAURANT?    Other than the incident, the food was alright.    TL;DR The manager was rude to us, and as a result, I don't plan on returning to this restaurant ever.",https://www.yelp.com/biz/california-pizza-kitchen-pasadena?start=20
F. W.,"N HOLLYWOOD, CA",1,103,,2.0,9/28/2017,I am a fan of CPK but I would recommend the Studio City location or the Glendale location over the Pasadena location. I ordered Chicken Fettuccine. The chicken in the dish was chopped up in tiny pieces almost like carnitas and there wasn't much of it. Everything else was fine about the dish. The issue was with the service. I sat outside in the lovely patio on 9/24 and had to ask several times for water and the bread that was offered to me. It wasn't packed with people because I went off hour so I'm not sure what the issue was. The server would walk right past me to take drink orders and food orders from other tables after he said he would be right back with water and/or bread for me. He was very friendly though.,https://www.yelp.com/biz/california-pizza-kitchen-pasadena?start=20
G R.,"San Gabriel, CA",0,32,68,3.0,9/20/2017,So they have Remolded this location and given it a more extensive and open feel.   The wait staff are extremely friendly and the food has always been fresh and well prepared.  Not a fans of the Fresca flavored drinks but the Pasta dishes as well as the salmon were good.  In Pasadena a very nice alternative to The Cheesecake Factory. If you are deciding between the two choose CPK by a mile,https://www.yelp.com/biz/california-pizza-kitchen-pasadena?start=20
Lauren P.,"Pasadena, CA",173,737,663,3.0,7/26/2016,"CPK, ummmm. . .  it is a chain and it is pretty obvious. This location has both valet for $8 and underground garage parking which is free for the first 90 minutes with validation.  The service was great. The serves were on top of their things and made the experience pleasant. The food is a -ok which is why I gave it a 3-star review. I feel like there is just nothing special about it, nothing that really calls to me that is. For instance, the cheesy Alfredo is just cheesy not lush or flavorful.  They do have a good drink selection which is nice but not the main point of going to a restaurant in my option. Good thing to note, it is fairly easy to have big group parties here if you're looking for a spot to host something of the sorts. For instance, my cousin had her 30th birthday party here which consisted of 30 or so people. We got the option of soft drinks, a salad, a pasta, and shared pizza around the table for $20 a person.",https://www.yelp.com/biz/california-pizza-kitchen-pasadena?start=20
