Username,location,friend_count,review_count,photo_count,rating,date,review,Url
Joy S.,"Honolulu, HI",87,53,101,2.0,11/11/2017,"Should I start with the good news, or the bad? I've always been a fan of CPK. They do a good job of meeting the tastes of a variety of needs. I appreciate that they add and change items on the menu, rather than relying on reputation alone. That being said, I've never had a phenomenal server there, but I've also never had terrible service. Today was a much different experience.  I believe the restaurant was short staffed. It appeared they were specifically short busboys. There were several tables sitting with empty plates, waiting to be cleaned. We were told our wait for a table would be 10-15 minutes. We waited closer to 25 minutes, and my guess is because the tables weren't being cleared.  This was at 2:30 in the afternoon, which in my opinion, isn't necessarily a peak time.  Upon sitting, we never got utensils, and it took 10 minutes for our server to come and take our order. I can't tell you how long we waited for our food, but our entire experience, from waiting in line to paying our chit took 2.5 hours! We weren't lallygagging and taking up time talking...we spent much of our time waiting.  When our food came, still no utensils. I had to walk to the bar and ask for place settings and a pitcher of water, since our waters weren't being refilled. I have no problem if you're short staffed. But it's unprofessional if a server doesn't inform you of that.  I was very disappointed with my experience at the Mililani CPK. They aren't nearly as busy as the Ala Moana, Pearlridge, or Kahala locations, and still had trouble keeping up.",https://www.yelp.com/biz/california-pizza-kitchen-mililani-3
Leslie D.,"Cardiff-by-the-Sea, CA",3,3,3,1.0,1/10/2018,"Terrible service! Ordered by phone with Monica (person who took my order) at 6:43 pm, call took 4 minutes, I was told to pick up the food in 20 minutes. My boys went to pick up the food around 7:15 pm because I just had surgery and could not go out to get it myself. They were told the order was not put in so they would have to wait longer and ended up waiting till 8:04 pm to get our food! The staff was rude and nothing discounted for the super long wait and their error!!! CPK is lucky I can't go anywhere so couldn't go to pick up the food because if I was there, I would not have put up with this and went elsewhere! To top it all off, all the food was COLD!!! Which means the Pizza and Pasta was sitting a long time before they gave my boys the food!!! RIDICULOUS!!! We will not be going back to CPK again because the SERVICE is TERRIBLE!!!",https://www.yelp.com/biz/california-pizza-kitchen-mililani-3
Kiana H.,"Wahiawā, HI",246,126,634,5.0,9/18/2017,"I don't think I've ever regretted a visit to CPK. It's convenient to have another location with much better parking than Pearlridge. It's nice that they have the option of sitting outside and since it was such a nice day we decided to enjoy our meal outdoors.  The food is never disappointing and like everyone else we definitely have our favorites. Today we went with a couple pizzas, the chicken piccata pasta, wild seared ahi, ahi spring rolls, Cobb salad and lettuce wraps. As usual everything was as delicious as we remembered. Our server was pleasant and kept our waters full throughout the entire meal. I'm a true believer of CPK and always look forward to eating here. The prices are reasonable, the portions are big, service is friendly but mostly, the food is yummy!",https://www.yelp.com/biz/california-pizza-kitchen-mililani-3
Mina C.,"Wahiawā, HI",2,86,35,1.0,1/4/2018,"Food is average, decent variety and for Mililani it's a great addition. Those are the positives. Now, the food would be a lot more enjoyable if the service was better. But we've been to this location several times and have experienced terrible service EVERY time. Today, we waited 25 minutes for a table (while many tables were empty), 10 minutes to be greeted by our server which by then we were ready to order our drinks, appetizers, and meals.  Appetizer comes out with one pair of chopsticks. For our family of four.  Oh and the hostess sat us down with NO SILVERWARE and guess what?! No one noticed throughout our whole meal and forget asking the server bc we rarely caught a glimpse of her. Which means during our wait we were hangrily munching on the bread but had to save some of the soft pieces to wipe my daughter's mouth!!!  Seriously?!  So my kids' pizzas finally come out, then my husband's banh mi bowl comes out so we're waiting for my food. Waiting..waiting...waiting.  You would think I ordered the most complicated dish but finally my half order of a cobb salad comes out. And i tried my best to enjoy it.  Using the chopsticks from our appetizer.  My husband took over.  He grabbed our napkins, silverware, boxes and handed the check over to a possible manager that came by. TERRIBLE. Not giving them any more chances.",https://www.yelp.com/biz/california-pizza-kitchen-mililani-3
Dayneen M.,"Honolulu, HI",203,91,474,3.0,11/23/2017,"I forget the servers name, but she was very very rushed.  our celebration for my youngers sisters bday did not feel relaxed at all.  she seemed like she wanted to hurry up and get everything done so she could get out of there or something. I HATE THAT. taking our orders, she cut us off when we're talking. when she's putting down our waters, she just pushes things out of the way to make room.  i almost felt like the water was going to fall. when checking on us, she would give us .5 second to answer. when we were going to put in our order, i had to take a second so she just goes ""i can come back"". but its like NO i said i neeeded a second....not for you to leave and come back.",https://www.yelp.com/biz/california-pizza-kitchen-mililani-3
Jenel O.,"Waipahu, HI",209,359,475,4.0,9/29/2017,"So excited that CPK opened in Mililani! I love coming here. Although is it just me or did prices overall increase all CPKs?  I've done take out now a few times. I love that they have stalls in front for quick pick up. Downfall is that not everyone adheres to the signs and parks there anyway. I feel like quality is sometimes hit or not as good. I don't want to say miss because it's not a total blunder. For example, I've ordered a salad. Ordered it again a different time and it tasted different.  Also, ordered a power bowl once and it didn't taste dressed at all. I asked the server who said it was dressed. She said she could get more dressing then came back to say they ran out of dressing (??). She did offer to bring another type but it's weird that she thought it was dressed in the first place and then they didn't even have any period? Some fun drinks running about $8-10 each - yum! I'll definitely be back though. Can't go wrong with their pizzas, pastas and salads.",https://www.yelp.com/biz/california-pizza-kitchen-mililani-3
Nette B.,"San Diego, CA",1627,1011,2000,4.0,8/22/2017,"I visited here twice when I was on vacation because my family just HAD to come here.  CPK is a chain so to me everything is the same. Had the BBQ Chicken Salad, Chicken and Shrimp Alfredo and Pizzas. The pasta was al dente (which i love) and the flavors were all there.  Pizza was delicious as usual.  My family ordered a few other dishes that i tasted that was yummy too.  The server we had was all wrong. Meaning, from the time we sat he rubbed me and my family the wrong way. Now let me tell you, I've been a Yelp Elite going on 9 years, I dine out every night and I try to be very fair. Being from Hawaii,  I always love the Aloha spirit from servers.  WRONG! I might be wrong with our servers name but I think it was Sean. He had an accent from the mid west or something.  You can tell he was not from Hawaii. When he got to our table he did not smile and looked at my family as if we were bothering him. It was like ""dude, go home. It's been a long day for you.""  We were a table of 14 including kids. When he took our order he did not walk around the table to every adult but stood at the end and yelling from afar. WTF! He even rolled his eyes. There were more body language of being annoyed that he did but I'll leave it at that.  The saving grace of the night was Alana and Kellie. These managers are awesome. Thank you for redeeming the customer service. You two are assets to CPK. If it wasn't for you two,  CPK would've received a 2 1/2 stars because of how our server treated us.  On another night we had a server who was nice and pleasant. Forgot her name but she was from San Diego so we bonded with her. She made a mistake with our order but she owned up to it instead of blaming anyone and I appreciated that. She got a better tip from me. She also offered pizza dough to the kids on our table. See, that was already better customer service.  Great job young lady. Overall, I'd return despite of my negative experience with 1 server.",https://www.yelp.com/biz/california-pizza-kitchen-mililani-3
Wendy I.,"Mililani, HI",0,4,,1.0,12/26/2017,"Pretty upsetting that they can't even double check the pick up orders before handing them out to customers.  Had to go back just to get our full order, and was barely offered a verbal apology.  Wasn't given a spoon for an order of soup.  Also it wasn't even peak hours or busy at the time.",https://www.yelp.com/biz/california-pizza-kitchen-mililani-3
Gail U.,"Mililani, HI",36,142,1143,4.0,8/26/2017,Amazingly tonight I ordered take out and it was the exact selections we ordered dining in previously. The only  thing was I specified chicken on the side ( like I always do) and the person who prepared it placed it smack in the middle and covered with green onions.   Perhaps it was a busy mad rush in the kitchen or that person didn't look at the printed out order with three exclamations on it...  Had to change it frim 5 stars to 4 but the pizza and the pasta was true to excellent style.,https://www.yelp.com/biz/california-pizza-kitchen-mililani-3
Toni P.,"Waialua, HI",182,56,92,1.0,7/30/2017,"Hmmmmm.... what to say? First off, I visited this location a month back with a friend for dinner and was not impressed, but it was dinner time and they were a little busy. So I decided to give it another try for a late lunch this time. We came on Sunday afternoon and it wasn't busy at all. We waited at the front hostess stand for a few minutes before someone came out to seat us.  We were greeted by our server and she brought our waters and took our appetizer order. When she came back with our appetizer we ordered a pizza to share. Fast forward 40 minutes and after finishing our spinach and artichoke dip our pizza was still not at our table. We also needed to ask for refills on water because no one checked in on our table. We were seated right behind the bar so there were lots of servers walking pass and a manager walking the floor as well. Our server only came to our table 2 times and one of those time we had to call her over.  We noticed that others around us got their food before us, but we thought maybe the pizza was taking a little longer.  Well, to our surprise our server comes back to our table and says ""I'm sorry could I take your order again, we closed out your check."" WTH!? How do you close out someone's check who didn't even get their food? Already annoyed and not wanting to wait we asked to actually close out the check this time and we were going to pay for our dip. The server said that they would take care of it and apologized for the issue.  CPK- get it together. You weren't even busy.",https://www.yelp.com/biz/california-pizza-kitchen-mililani-3
Don T.,"O‘ahu, HI",3,47,12,3.0,10/15/2017,"After being contacted by the manager and receiving credit for 2 free pizzas, I thought I owed them an update. Yesterday, I decided that they'd had enough time to train their staff, so I ordered 2 pizzas online with only a 15 minute wait. I went to pick up the pizzas and showed them the email from the manager. The take-out counter called the on-duty manager, who checked my email and credited the two pizzas on the spot. I'm pleased to say that they now represent CPK well. The thin-crust Jerk Chicken had a great hot & sweet flavor, while the traditional crust The Works was very good as well. Both were baked just right.  Had this been my first visit, I would give them 4 stars, but we'll call it 3.5 for now. This place is definitely back on the food radar. Well done Mililani CPK!",https://www.yelp.com/biz/california-pizza-kitchen-mililani-3
Ann Y.,"Mililani, HI",30,62,130,4.0,5/21/2017,"So excited that a new CPK opened in Miliani!  Never had a problem with the food with any of the CPKs we have visited.  Their newest location in Mililani was no different.  We usually order their Lettuce Wraps but decided to skip that due to the rat lung worm problem.  The two appetizers that we ordered, Szechwan Chicken Dumplings and Avocado Club Eggrolls, were delicious and flavorful.  We were also happy with our main courses, pizza and their seasonal lemon grass chicken. Why only 4 stars?  Waitress couldn't name all the beers they had.  We had to specifically asked if they carried Firestone or New Belgium.  And yes, we did order Firestone's 805.  Also, our appetizers arrived at our table the same time as our main course.  That should have hinted to what was going to come up next. We had barely started on our main course when one worker asked if we wanted boxes to take home left overs.  Replied that we were still working on our meals.  A short time later another worker came by and asked us again.  Yes, we were still eating but let her box up a few of our meals.  I can understand that they want to serve new customers as soon as possible for greater revenue but when we paid and was leaving there was no one waiting. On the positive note, we received our second order of complimentary bread and my 2nd glass of Strawberry Lemonade was served before I completed my first.  We enjoy eating at CPK and will be back....hopefully we will feel ""welcomed"" and ""not rushed"" the next time.",https://www.yelp.com/biz/california-pizza-kitchen-mililani-3
Ryan Y.,"Honolulu, HI",80,38,147,4.0,5/6/2017,"I had to try this place since I love going to the California pizza kitchen in pearl ridge shopping center. I expected to wait because this place is so new, however to my surprise they had seating on the lanai. It wasn't that bad because the sun was going down and I was seated away from the sun where it was shaded.  Tip: if the wait is long you can put your name and number down, leave and they will contact you when your table is ready.  The server I had was Ashley and she was awesome. She was very friendly and consistently came back to check on me and made sure my water was always filled and I had everything I needed. She also made a great recommendation on the dessert (butter cake w/ ice cream). It was delicious!!  As expected the food was excellent! I ordered the spinach artichoke dip to start and the shrimp, chicken fettuccine, followed by the butter cake for dessert.  Overall my experience was great and I'm sure to be back.",https://www.yelp.com/biz/california-pizza-kitchen-mililani-3
Chevelle D.,"Ewa Beach, HI",13,45,150,5.0,3/28/2017,"Today was the second day of the new California Pizza Kitchen in Mililani being open and it was great! We went for lunch so we were seated within 5-10 minutes. The hostess Dakota was awesome and very helpful in getting us checked in.  Once inside, the decor was great; much like the new CPK in Kapolei. It's so great to no longer see only black, white and yellow tile everywhere. They also had beautiful pictures of Hawaii all over the walls and surfboards mounted near the bar. The booth seating, which we got, was extremely comfortable and there was a TV in the area we were sitting as well. The bar looked like a well stocked bar and had a decent amount of seating which is always great! They also have two TV's mounted for all you avid sports fans! The staff was extremely friendly and everyone took the time to stop and check on us, including the managers. While I appreciate attentive service, getting checked on every two minutes can be a little much, especially when you're trying to have a conversation. Overall, awesome service though! Everyone is really nice and willing to get you what you need even if they're not your server.  We ordered some La Marca Prosecco to start (be advised there is a small portion that you can order listed in the menu; the general manager tried to say that we could only order it by the full size bottle, but there is a 6 oz. available!). We then ordered the white corn guacamole and bianco flatbread for appetizers, which was delicious! The guacamole did need more salt, but it's available at the table for you.  For the main course we ordered the BBQ Chicken Pizza and the Santa Fe salad which is on the seasonal portion of the menu and currently only available at the Mililani location because the other CPK's have not gotten it yet! The Santa Fe salad was delicious! It has spinach, farro, red cabbage, avocado, beans, corn, shaved peppers and grilled chicken with a jalapeño ranch dressing. The BBQ pizza was delicious as always and all of our food came out fairly quickly! For dessert we ordered the salted caramel pudding which was delicious as always. It seemed like the pudding didn't get enough time to set, as the pudding was slightly runny and not quite pudding yet. Nonetheless, it was still good.  Overall, great experience, great vibe and great energy from the staff! I highly recommend stopping by!",https://www.yelp.com/biz/california-pizza-kitchen-mililani-3
Ruby S.,"Mililani, HI",57,130,302,4.0,11/11/2017,"I was preparing for the worst and did not have an expectation.  Third attempt to dine at Mililani location on a whim.  Lo and behold...we finally arrived when there is not a line.  Within five minutes of arrival, our gracious hostess showed us to our assigned seating.  We scored seats in a quieter area facing stunning photos of O'ahu and California. I'm thinking, ""Wow!  This is the fastest service we received.""  Our server moved swiftly.  We placed our orders from beverages, salad and entree at once.  We couldn't believe our eyes when all beverages and complimentary bread with olive oil came in a jiffy.  Fusilli pasta reached the table within five minutes.  Next, BBQ chicken chopped salad and to our surprise, The Works Pizza was ready.  Bim!  Bam!  Boom!  We kindly asked another Server that brought salad and pizza out together if she will be able to keep our pizza warm, then bring it to us five minutes later so we can enjoy our salad.  Other server seemed hesitant and didn't provide a direct response.  My husband said, ""That's alright.""  We consumed all of the salad.  Sad thing is by the time we were ready to eat The Works, it was partially warm and almost cold.  I only ate one slice of pizza. We decided to take the rest of the pizza home.  Next time, we will place our entire order in increments hoping that we will have piping, hot pizza.",https://www.yelp.com/biz/california-pizza-kitchen-mililani-3
Kristy N.,"Mililani, United States",104,79,388,4.0,11/1/2018,"Choose CPK for a last minute dinner. 4 stars because I really like CPK but today was mediocre. Service was slightly slower than usual and there was hardly any beer available. They 86'd a lot of it. Idk why. The pizza was good. Ordered the basic pizzas; pepporoni and bbq chicken. The lettuce wrap wasn't as good as I thought. I asked about their Halibut and my server said she didn't care for it but I wanted to try it anyway. Definitely should've listened to her!! The best thing on the plate was the asparagus and even the stringy part was still left on! The best part of the meal was the butter cake! And I'm not much of a sweets eater.  Overall, I will be coming back to CPK. Hopefully it makes up for today.",https://nz.yelp.com/biz/california-pizza-kitchen-mililani-3
Tina F.,"Mililani, United States",96,6,,2.0,13/1/2018,"This place is great. Little trouble getting all our drinks from the bar, but the food was great. Ashley is such a great waitress. Definitely gonna ask for her when we come back. Great personality and fast. The food tastes like the normal CPK food. Got here right before the dinner rush so there was no wait.  Update*** Came here the other day with my mom and daughter. Had a bit of a wait for a weekday because they had a lot of parties. Not a big deal. Totally understand. This time around was a huge 180 from the other times we've eaten here. Saw our server twice. Once to take our order and then to drop the check. We had to ask for utensils after our food came because we didn't get any. Our food was cold. Mom got a two soup bowl, I got the halibut, and my kid has a pizza. My halibut was such a small order from what we normally get. The risotto wasn't even a cup size. No one to complain to since our waitress was MIA. Thought she might have one of the parties, but nope. She was just chillin in the pack. We ordered the butter cake from a different server. Came out cold and mushy. The ice cream was melted and had a weird crunchy taste to it. Think we'll stick with the Pearl Ridge location.",https://nz.yelp.com/biz/california-pizza-kitchen-mililani-3
Monica S.,"Honolulu, United States",109,114,57,2.0,12/1/2018,"I came here for lunch with a colleague on Tuesday to do some work on 1/9/18 from 1-2:30. We were seated at the tables near the bar. The place was not too busy so our server, a thin woman with dark long pretty hair in a pony tail came to see us right away.  Our order was simple two waters,  one glass of wine,  one plain cheese and tomato pizza with a take out box for the other half, and a mushroom pasta.  Our food came out pretty quick with some stake bread and our server never came to see us again! My pizza was ice cold, I had to wave down a passerby server to ask if it could be warmed up.  Then I had to wave down another to ask for the utensils to eat with,  by this time the warmed up pizza wasn't that hot anymore. Then, I had to wave down another server  for my take out box.  Our Empty plates were never cleared we never received water refills  Then I was charged for the wine I never got! I had to wave down another server to ask for my server.    Low and behold our waitress finally appears and asks if I want the wine now so she can leave the charge on my bill.  I said no thank you I'm done eating my meal now.   I left her 15% tip only because I was raised with manners.  If this place were busy I might excuse the horrible  service,  but  I think she had two tables total.  Then I thought,  well maybe she is new? But the service issues I had were common sense.  The food also was not typical CPK.  It tasted like my pizza was microwaved not made to order and it was super greasy! I barely ate it.  I wish we would've  gone elsewhere for lunch.  I won't be coming back.  I don't think the management  at this location is that good.  The service and food here need some serious help.",https://nz.yelp.com/biz/california-pizza-kitchen-mililani-3
Angel D.,"Honolulu, United States",253,335,1376,2.0,3/1/2018,"My boss always takes me and my coworker here for lunch every now and then. Everytime we come here, we're always seated at the very same booth right next to the restroom. Honestly, we didn't care but the last time we went; service was so bad. It was one of my coworker's last day with our company, and her food took forever and it came out last. Their food is always on point, dont get me wrong. But if you're seated kind of far away from everything, you start to feel like service isn't going to be as good; unless your table is closer to everything. I had their Spicy Kung Pao Spaghetti with Shrimp. It was super good. Usually, a server would offer me grated cheese; but this time I wasn't. I had to flag down another server(which I hate doing because I'm in the service industry) to grate cheese for my Spaghetti. My boss had the Arugala Salad, my other coworkers had the warm Veggies, Pepporoni Pizza & a Caeser salad. The Arugala salad & warm Veggies came out last. Our waters were not refilled, nor was our table properly bussed. I had to stack our plates for our waitress. I loved coming here, hoping to receive better service next time. Everything took so long that day.... the food, the check, everything. Definitely will give this place another try, maybe in a year.",https://nz.yelp.com/biz/california-pizza-kitchen-mililani-3
Jon S.,"Cleveland, United States",2,51,84,2.0,7/1/2018,"Food: Typical CPK so 2.5 stars... fairly good pizza but I was disappointed in the piadina. The description is ""a folded pizza-style sandwich"". It was literally a cooked pizza they folded in half. WHAT?! Ugh. They also didn't tell me the side soup or salad was included and it wasn't called out on the menu. Service: Very slow - 1 star. They also forgot one of the starter spinach artichoke dips and one of our groups sandwiches. They comped the sandwich.",https://nz.yelp.com/biz/california-pizza-kitchen-mililani-3
