Username,location,friend_count,review_count,photo_count,rating,date,review,Url
Isamala G.,"Miami, FL",332,91,6,1.0,5/3/2017,"i don't get it when you tell your server you have an allergy to shrimp why they fuck do you touch a shrimp plate to then touch mine and guess what i got an allergic reaction  where i almost couldn't breath and you tell me to not to tell your manager  are you a dimwit? also why would you put in a shrimp and chicken skillet when i ask you for a chicken only !! am allergic hello!!!! then for them to take off the shrimp and send me back the same plate it blows my mind worse services, management ever you could have killed me",https://www.yelp.com/biz/tgi-fridays-coral-gables
Grissel C.,"Miami, FL",8,38,3,1.0,6/17/2017,"Walked in at 1am. Hours say open til 2am. There was no Hostess and the place was dead. Before we were even greeted or given a menu the first employee to see us shouted ""Sorry were closed!"". Really?....",https://www.yelp.com/biz/tgi-fridays-coral-gables
Jordi M.,"Galena, OH",0,17,8,4.0,6/12/2017,"In looking for a place to eat around U of Miami, my fam and I came across the TGI Fridays and we were not disappointed! The salads were very light and refreshing along with the tasty and filling bar apps. The service was also great. Our server, Tracy, was very helpful in explaining the menu. Great experience!!",https://www.yelp.com/biz/tgi-fridays-coral-gables
Wil F.,"Olympia Heights, FL",0,1,,3.0,6/6/2017,Had good time the margaritas very good every thing was good the server was great excellent,https://www.yelp.com/biz/tgi-fridays-coral-gables
Josephine P.,"Miami, FL",0,5,,1.0,10/2/2017,"Horrible experience at this TGI fridays. We got there at 11:50pm knowing that they close at 2am. We were 6 people trying to seat down and eat. The server seemed like she didn't want to work. She was making all kinds of excuses to not seat us.First, she said that the ""only big tables"" were taken by people. We suggested that they can put two tables together. She said she couldn't do that because it could be a hazard to everyone. Then she said she couldn't really seat us because the kitchen is closing. What kind of business are they running here? When you close the kitchen 2 hours before they say they close. First time and last time we come here. They don't want to work and the owners are seriously losing money. When it's a big party they usually try to arrange everyone. Owners should definitely reconsider their employees.",https://www.yelp.com/biz/tgi-fridays-coral-gables?start=20
Valerie M.,"Miami, FL",0,7,,2.0,6/12/2017,"The waitress was very friendly. However, the wait to be seated was two hours. We were told that it was very full. Finally once the waiting area was cleared, and I was sat down, and there were many empty tables.  The food was served cold, and I waited approximately an hour to order from when I was seated. Definitely will not be one of my favorite places to frequent for dinner.",https://www.yelp.com/biz/tgi-fridays-coral-gables?start=20
Joe F.,"Miami, FL",13,1,,1.0,2/19/2017,"Wayyyy too long to get food. Avoid this location at all costs. Took 15 minutes just to get drink, half an hour to get appetizers",https://www.yelp.com/biz/tgi-fridays-coral-gables?start=20
Danica S.,"Atlanta, GA",67,36,37,5.0,4/3/2017,"Great location, convenient to UMiami, great healthy menu with plenty of choices for everyone",https://www.yelp.com/biz/tgi-fridays-coral-gables?start=20
May A.,"Miami, FL",112,109,142,3.0,10/20/2015,"They currently have great drink specials for the football season. They have certain beers, margaritas, and mojitos for $3. They also have $5 appetizers. This sounds great, so my friends and I took advantage of these deals.  We came here on a Thursday night, the restaurant was not busy. There were plenty of seats available everywhere, but they still had us wait for a table. We waited about 5 minutes, which I felt was unnecessary, but oh well.  I ordered a mojito, and once I received it I found a curly hair in my drink. I do not have curly hair, so that wasn't mine. I immediately called the server to inform him, he apologized and I asked to get a beer instead.  The food is typical bar foods. We ordered cheese sticks, pot stickers, and buffalo wings. It was good. The pot stickers were the best part.  Our server was very attentive, funny and in a good mood.  If I'm in the area and looking for a place to get a beer, this would be an option.",https://www.yelp.com/biz/tgi-fridays-coral-gables?start=20
Evan B.,"Springfield, MO",2,5,,1.0,4/10/2017,"Sure, late nights mean smaller staff, but damn, this place is so slow. Unlimited apps when you would rather order a full portion to not have to deal with anyone....",https://www.yelp.com/biz/tgi-fridays-coral-gables?start=20
Stephen O.,"Oxford, MI",1,17,6,2.0,3/23/2017,"Wow, 2 1/2 stars is generous. The servers are NOT attentive. We basically had to go find.oir server to get anything. TGI Friday's corporate needs to get in here and fix this fast!",https://www.yelp.com/biz/tgi-fridays-coral-gables?start=20
Johnny H.,"Miami, FL",43,10,,1.0,3/18/2017,"The service is piss poor. Understaffed, very long wait for a half empty restaurant. I honestly will never return to eat in, only good for online order and pick up",https://www.yelp.com/biz/tgi-fridays-coral-gables?start=20
Jim S.,"Franklin, OH",22,11,,1.0,2/27/2017,"Very bad experience here. We stopped by after college basketball game. We called ahead and told them we had a party of 10. Actually had 12. I must say service was terrible. Drink orders were messed up or non existent,  some folks never received there drinks. Food orders were even slower, after 70 minutes 2 orders of chips and salsa came with an apology for poor service. After 90 minutes we complained to the manager. Food eventually started showing up however only those folks who complained to the manager. My burger was cold however it was cooked as ordered and tasty. I never did get my water. I again saw the manager because our checks were not arriving. He offered a 10% reduction as his way of making things better. I told him if the check was not in my hand in 10 minutes I was leaving and he could keep his discount. I will never set foot in another TGIF Fridays. This was almost an unbelievable experience,  cannot put into words everything. I would give this place a minus 5 on a scale of 1 to 10. Horrible experience and poorly managed.",https://www.yelp.com/biz/tgi-fridays-coral-gables?start=20
Abisai H.,"Miami, FL",670,166,692,1.0,8/8/2014,"This used to be one of our favorite places to go and just enjoy good food and drinks.  It's sad to say that after our visit today it has changed. To begin the service was not anywhere near what it used to be. The place has gone from friendly and helpful waiters to careless unprofessionals.  We sat and asked for drinks. The waiter recommended one of the new margaritas on the menu and my wife got a berry mojito shaker. When the drinks came, they had all the ingredients but the alcohol. The margaritas were pure sweet and sour mix with a bag of sugar added to them. The mojito tasted like water with a drop of raspberry juice. We sent the drinks back and when we received them again our waiter said that the recipe was done correctly. Apparently there is a new bartender in the house.  I ended up asking for another berry mojito with an extra shot. It came separate because the bartender refused to mix it.  Time for the food. Our waiter explained the new 10 dollar unlimited appetizer deal. When we decided to do it, he began to explain we couldn't order ten appetizers and that he was going to do an exception for us by letting us order up to four times. Seriously who orders more that 4 of the same appetizer at Fridays! I have to say we felt very uncomfortable with his recommendation and almost canceled the order.  The food arrived for everyone but myself. I had ordered the shrimp and chicken sizzler and it arrived after the rest of the table was finished. By this time I had lost my interest in my order and was even more disappointed when the plate was placed in front of me. Two very minuscule pieces of chicken breast and 4 small shrimp, over yellow cheese and a spoonful of mash potato.  What a disaster and horrific experience. What once used to be the place to enjoy in a Friday night has become anything but that. Definitely won't be stopping by for a long time.",https://www.yelp.com/biz/tgi-fridays-coral-gables?start=20
Jordyn M.,"Coral Gables, FL",109,1,,1.0,10/24/2017,"So I order my meal and I asked for my meal with no cheese. I was waiting for takeout for a while and by the time i received the food, it was still kinda cold. I walked all the way home to look and see that the mashed potatoes was not in the bag. I had to go all the way back, and as I walk in the employee turned around and handed me the bag of it claiming the man forgot to pack it. At this point, I am quite upset. Then I get home AGAIN to see the mashed potatoes had cheese in it. Ok so at this point I'm sure they don't know what the fuck they're doing. I'm not even considering walking back now, so I call them. I get on the phone with the manager and all she can do is tell me ""well it comes with cheese there's nothing we can do about that"". Now, why the fuck the employee didn't mention that before i don't know!!! The manager than proceeded to tell me I can return to receive another option. This tomfoolery of an establishment has sealed it's fate and those 2 1/2 stars on yelp ain't going up anytime soon. TGI FRIDAYS y'all can kiss my ass.",https://www.yelp.com/biz/tgi-fridays-coral-gables?start=20
Kearstin E.,"Denver, CO",599,442,368,1.0,5/18/2014,"Menus recently have been changed to mock a fancy restaurants- with high prices for the same food they had before and somehow also, the service quality has also plunged very low. *This part may be specific to this location* It all really happened!... -Our server waited 10 minutes to ask us for our beverage choices (before food) -He took it upon himself to decide what comes out- when; he brought out my  salad 10 minutes after serving my boyfriend what he ordered for his entree. -When I ordered my food, I read it off the menu and our waiter said ""Which one is that?"". I literally had to tell him the price of it because he had no idea what was on the menu.  -My ceasar salad came out dry so I had to ask for dressing. He came back and gave me Italian dressing- for my Ceasar salad O_o  -My chicken and fries came out COLD and STALE, I had to have it sent back. -I asked for a side of sauce THREE times. It came to the point my boyfriend had to get up and go to the kitchen himself. The waiter came and asked how the food was that I hadn't touched yet- and I had to remind him for the 4th time, I'm still waiting on my sauce.  -The waiter was saying sorry left and right to each table around us, and even asked someone at another table- ""Wait, what did you order again?"" -He decided he would give us 20% off (wonder why?)... when he brought us back our bill that totaled a little over $11.00, he deducted .60 cents- saying that this was the 20% off he so kindly granted us. See attached receipt.  In conclusion, prices have gone up, food quality has gone down, and service has completely deteriorated.  The server's name (for future reference) is 'Anfal'. We wont be back.",https://www.yelp.com/biz/tgi-fridays-coral-gables?start=20
Jerry L.,"Miami, FL",1,17,,4.0,11/10/2016,My previous review of this Friday's location was anything but complimentary. Since that time my family and I have decided to give them the opportunity to show that improvements have been made. I am happy to report that my neighborhood Friday's restaurant has made immense improvement in both the food and service. I have now visited this store three times since my last review and I can say that the changes are like night and day. I would now recommend this store to anyone who would like a well cooked meal served with a smile. They turned my frown upside down.,https://www.yelp.com/biz/tgi-fridays-coral-gables?start=20
Alexandre H.,"Miami, FL",257,253,121,3.0,5/22/2015,"I have been to several different TGIFs in the U.S., and usually the experience is about the same (except NY, where prices are absurdly high and service is..well.. it is NY after all). But unfortunately things are changing at TGIF, I clearly feel that the quality of the food and the service is going downhill. Last night we ordered ribs and the grilled chicken and shrimp. When the food came we all giggled.. the picture of the chicken and shrimp plate on the menu shows very different sizes (of both the chicken and the shrimp), but anyway, what else is new in this business? But the taste was good, everything was hot, in my opinion a 4* for a chain restaurant. What blew 1* off my rating is service. Although our waiter was nice and friendly, he was missing in action most of the time. Our drinks took forever (drinks = two glasses of draft beer, complicated?), arriving almost at the same time as the food, which by the way took very long too. Ordering the bill was another challenge in time travel, and then waiting for him to get my credit card to close it definitively signified a singularity in the time continuum black hole phenomena. One thing that really bothers me is the WATS (""waiters avoiding table service""), since the only job of a waiter is to ... wait tables! If he is always missing in action then he needs to change careers. Sorry. I'm paying... and tipping... I expect and deserve service, and I WILL knock off stars (and add stars too) for the quality of service I get. I hope TGIF fixes these issues, I like the concept and the food, but if I'm not 100% happy after spending my money I will start to look for other alternatives. Cheers!",https://www.yelp.com/biz/tgi-fridays-coral-gables?start=20
Lauren M.,"Denver, CO",120,401,592,3.0,9/2/2014,"I'm writing another review for a chain restaurant, and as usual, I'll rate it a 3. Nothing really stood out to me, but nothing was oh my god awful.  I definitely like having the TGIF Stripes rewards (very easy to sign up for this) because you get free chips and salsa as a starter. And studies have shown that it's in human nature to enjoy free appetizers. I think it might even be stated in the Bible, but in one of those lost books no one really knows about. Unfortunately, the drinks at this location were extremely weak, but I think this is true of most Friday's locations. The Blackberry Long Island Tea Shaker didn't even make my cheeks rosy, but it was still tasty and refreshing. I thought those drinks were supposed to be notoriously strong. And the strawberry daiquiri my family friend ordered was bubblegum pink, not the true reddish pink of a legit daiquiri - and it apparently tasted more like ice than strawberry. When we asked the server if they accidentally put in a virgin daiquiri order, she was very accommodating and said she'd ask the bartender to add more mix. When she came back, they definitely bumped up the alcohol level. So if you go to this location and your adult beverage tastes like it has zero alcohol, don't suffer in silence. They were very nice about fixing it. As for the food, it was fine. Burgers are always a safe bet. And the server let us try a side of the Jack Daniels sauce - I wasn't crazy about it, but I ordered the black bean burger. Not the best combination. All in all, TGI Friday's offers good discounts, good burgers, and the friendly staff clearly wants you to enjoy your experience there and come back again.",https://www.yelp.com/biz/tgi-fridays-coral-gables?start=20
Saily L.,"Miami, FL",227,138,565,2.0,8/11/2014,"Coming to Fridays was one of the best parts of my teenage years! Sad to say, but things have changed and not for the good! Miami has become quite the foodie city, so the competition is huge! The Larger chained restaurants are competing with smaller businesses which offer better service and food.  Fridays totally stayed behind. To start off theybremodeled their location not so long ago and it's horrible! Extremely plain. I loved all the items they had hanging from the ceiling and on the walls! A very edgy and lively place to dine at. Not anymore :(  I know the crowd is young most of the time but that doesn't mean you can talk to your guests like they're family. There's got to be some sort of professionalism. Our waiter recommended us some drinks that when they came tasted more like sour mix than alcohol. I opted out and got a berry mojito, let's just say all I tasted were the berries. Extremely watered down berry juice.  Now, the only reason I gave them 2 stars is because I absolutely LOVE the fried green beans. They now have a deal that you pay $10 and get unlimited orders of it. It's a pretty good deal but I feel like they have to constantly do stuff like that to lure guests in.  But apparently unlimited was limited! He explained that we couldn't get 9 or 10 of them. I mean who gets 9 of the same appetizer, but if it's unlimited what IF I do want 10?   I usually get the Fridays shrimp for dinner, with regular fries. A dozen Fried shrimp. My husband got a sizzler which consisted of tiny chicken breasts and a few shrimp. Honestly, with what I paid here, we could've gone to any smaller restaurant and gotten better and bigger amounts of food. I'm sondisappointed with Fridays! It's just turned into a tragedy!",https://www.yelp.com/biz/tgi-fridays-coral-gables?start=20
Tsuwamono H.,"Los Angeles, CA",124,90,20,5.0,7/21/2016,I won't let this day past without commending this great place. I am very impressed with the quality of their accommodations. Great costumer service. Recommended!,https://www.yelp.com/biz/tgi-fridays-coral-gables?start=20
George T.,"Milwaukee, WI",1041,852,4913,4.0,7/25/2013,From the draft pile.  I know I know its getting drafty in here! Visit 3-17-13 around 7:30pm  We had came here since we just picked up tourist visiting  They didn't want to eat at any of the Cuban or Caribbean styled foods so American food was what they wanted.  after a short wait about 20 minutes we were seated this place is very busy. Our server took great care of our table and explained the specials. Our meals were delivered fast and hot just like I like it.  I did not expect this considering the low ratings    Food 4 Service 5 (great server made all the difference.) Ambiance 4  Location  3 Value 3,https://www.yelp.com/biz/tgi-fridays-coral-gables?start=20
Jaime J.,"Miami, FL",50,53,1,4.0,7/21/2016,"Nothing special in this TGIFridays except their exemplary service. They'll make you feel at home. Accommodation is top notched. You'll be greeted as you enter the vicinity, ushered to your table and served like a boss. Baby back pork ribs is good. My meal ended up with a refreshing Triple Berry Smoothie. I will recommend this place.",https://www.yelp.com/biz/tgi-fridays-coral-gables?start=20
Alyssa B.,"Miami, FL",0,20,,2.0,10/13/2016,"Ok, so I don't expect too much from a huge chain restaurant where you can buy half the items on the menu in the freezer section at your grocery store (nice to know every meal is probably frozen from Friday's....*cough*) I've been wrestling between 1 and 2 stars but decided to be nice. Those two go to: The waitress (not service), we happened to have a nice waitress who seemed like she may enjoy her job, and then the food which is always decent.  The atmosphere here is AWFUL. They sat us in the farthest booth, next to the bathrooms/ kitchen (gross) and no TVs were visible. The music was extremely weak and barely audible, and the yelling and dish noises overpowered it coming from the kitchen. We order drinks, then appetizers, and the appetizer comes out first. We give it a good 5-10 minutes and no drinks. I get up and go to the bar where I see our drinks sitting, and I have to ask a food runner to bring them over to us. NOT GOOD when a customer needs to ask where their are drinks at the bar. Trust me I'm a laid back person too. More yelling in Spanish coming from the kitchen throughout dinner. I ask my BF what they are saying (I don't speak Spanish ) and he says you don't want to know. Some guy with long, purple and pink hair that's shaved on the sides hanging out in the kitchen (view from my booth I can see everyone working back there) Where is the hair net?!!!! It was not impressive for dropping $90 at this place. Do yourself a favor and just sit at the bar if you go.",https://www.yelp.com/biz/tgi-fridays-coral-gables?start=20
Rodney W.,"Miami, FL",397,97,1085,2.0,9/1/2012,"Queso Dip was luke warm.  The boys liked the Pot Sticker and  Mozzarella Sticks. Steak Tacos had a lot of everything but STEAK, shrimp were average, kids burger looks manufactured. Desserts on the combos are nice to look at, but portion size are small.  Service was just ok.",https://www.yelp.com/biz/tgi-fridays-coral-gables?start=80
Keith S.,"Westfield, IN",69,380,117,3.0,8/10/2012,"Good place to have a quick lunch, but it's typical Friday's.  Everything here is good and abundant.  Can get expensive for lunch though, be careful.  Has a punch card for lunches.",https://www.yelp.com/biz/tgi-fridays-coral-gables?start=80
Ruben T.,"Miami, FL",0,2,,2.0,9/30/2015,"I usually like this place for a lighthearted snack beverage, but the experience was terrible on September 29. We ordered some appetizers  (sliders, mozzarella sticks, Flatbread ) the food was good, no issues at all with that. I personally think the sliders are pretty good compared to similar chains  (chilis etc). However, the service was mediocre,  as the server did not come by often to ask if we needed refills or further appetizers. By the time she came by and asked if we wanted a refill, we were pretty much done with the meal and ready to pay check. However the food was good and past experiences at this location were good, so will return.",https://www.yelp.com/biz/tgi-fridays-coral-gables?start=80
Alex G.,"Miami, FL",39,61,,2.0,5/17/2014,"Is it me or has Fridays changed their food supplier?  Appetizers were nothing like they used to be.  Mozzarella sticks were not the same, marinara sauce was ice cold and the potato skins were some weird texture that did not even taste like potato.  Broccoli cheese soup was very salty and not what it used to be.  I used to love this place and now I'm not too sure it's worth it for the $$.",https://www.yelp.com/biz/tgi-fridays-coral-gables?start=80
Christian P.,"Hialeah, FL",323,36,12,1.0,11/11/2013,"Don't even bother coming to this location. The staff is really unprofessional. We had to flag down the host waiving like ""here we are please notice us"" :: waives hands frantically:: We had random waiters because three different people came to the table, and I had to beg for mayo like if they were doing me a favor. The food was ok' wayyyy to much seasoning on the sweet potato fries. Save your money don't come to this location!!!",https://www.yelp.com/biz/tgi-fridays-coral-gables?start=80
Steven K.,"Miami, FL",4,15,1,2.0,11/11/2013,Friday's on a Monday. I was thirsty and tired of sitting in traffic.  Beer was cold!  Fries to salty and had to send burger back it was burnt.  Don't think I will be back for a while.  Maybe Friday's is better on a Friday.,https://www.yelp.com/biz/tgi-fridays-coral-gables?start=80
Ivette R.,"Miami, FL",268,1047,251,5.0,8/31/2014,Why does this TGI FRIDAYS of Coral Gables have 2 in a half stars there is nothing wrong with it and what is wrong nothing.I walked in the place was packed and I only waited like 5 minutes and I ordered a Cheeseburger with Chicken Fingers and fries and loved it.I absolutely love TGI FRIDAYS,https://www.yelp.com/biz/tgi-fridays-coral-gables?start=80
Ashlyn S.,"Miami, FL",0,50,17,1.0,8/11/2013,"Horrible experience here. I had not been to this Friday's for 6 years. The first time I went back was during the Heat Finals last game. The waiter was absolutely a joke. He didn't even bring us water until 30 minutes into the meal. He also didn't give my friends the Happy Hour special that was going on unless we sat on the other side of the wall that separated the bar from the dining room. It did not specify that anywhere! Also, my friends got their beers when I got my water. I was so disappointed sitting there because I used to go to that Fridays so many times when I was in high school. It was such a joke. I have never had such horrible service in my life. I do not recommend this Fridays at all! Oh and not to mention when they brought the manager over, he did nothing to fix the situation. You could tell how much he didn't want to help out. He didn't comp anything or offer a free drink to my friends. We work in customer service and the customer always comes first. You should try your best to fix the situation. Go above and beyond. I don't care if it's the apocalypse. You go out of your way. It's sad to see that Fridays has lost its touch. I was so excited to get the Oereo Madness when I first arrived, but then I didn't want to give the waiter any  more of my time, so we decided to go to the TCBY next door..which was totally awesome!! It made up for the crap service we received.  Plus, the food wasn't even that good. The bbq chicken pizza I got was lukewarm. The cheese wasn't even fully melted.  NEVER GOING BACK. will try the Fridays at the falls mall instead.",https://www.yelp.com/biz/tgi-fridays-coral-gables?start=80
