Username,location,friend_count,review_count,photo_count,rating,date,review,Url
Shannon H.,"East Meadow, NY",13,73,7,1.0,10/23/2014,Okay went to eat here as thinking it wouldn't take long since we had my boyfriends kids with us and it was pretty late on a Sunday. I would say we arrived around 7. Now I have never seen a place so unorganized. We get to the host & hostess which the gentleman told us there is no wait. Then about 5 min later tells us he will sit us after the waitress is done taking her order from her current table which had about 14 people at. Well that 5 minutes turned into about 15. He also stayed that he wanted to sit us with her because she complains she needs money. ( for the future that is not something a patron needs to know or wants to know). When i asked the other hostess how much longer till we were seated she got very nasty and was playing on her cell phone as well. (Sorry to interrupt your text messaging)  So we get seated and takes her about 10 minutes to come over. Then she takes our drink order and never even brought silverware or napkins for about 30 minutes. The soda was flat and the food took forever to come out. They had about 7 different people helping this one table of 14 people and everyone else was being ignored. Thank god we only ordered on trays and no appetizers because that took more than enough time to get to us. The kids were falling asleep by the time we left!! Worst customer service ever at this Fridays!!!! Never again!,https://www.yelp.com/biz/tgi-fridays-farmingville?start=40
Kojack ..,"Manhattan, NY",23,128,3,1.0,10/21/2011,"This particular Friday's has recently undergone an interior renovation and unfortunately it doesn't look very attractive.  The music blaring out of the sound system is very, very loud and distracting where you have to shout across the table to be heard.  This may explain why the average age of their customers is only 21 years old.     They seem to have plenty of servers on staff so getting good service was not a problem.   However, the food leaves a lot to be desired.  My sirloin steak must have been the toughest steak I've ever eaten.  The manger did apologize and offered another selection.  Their appetizers and desserts however are good.  I probably will not eat at this location again.",https://www.yelp.com/biz/tgi-fridays-farmingville?start=40
LadySin D.,"Centereach, NY",0,3,,2.0,7/8/2014,Ok so to start with it took 10mins to get seated mind you it was pretty much empty. Appetizers took forever to come out as well as the food. The drinks omg were disgusting I mean how do you mess up a LI ice tea super sour. Never coming back!,https://www.yelp.com/biz/tgi-fridays-farmingville?start=40
Ed S.,"Oakdale, NY",0,1,,1.0,6/7/2015,"EVERY drink is watered down. I have been here many times, and atleast 3 out of 4 times the drinks are weak and watered down. A shot of baccaridi tasted like half of it was water. A long island ice tea i ordered was about as strong as a regular ice tea. TGI: QUIT WATERING DOWN YOUR LIQUOR! IT'S VERY EVIDENT AND I WILL BE CALLING THE APPROPRIATE AUTHORITIES ABOUT THIS ISSUE.",https://www.yelp.com/biz/tgi-fridays-farmingville?start=40
Alison G.,"Farmingville, NY",3,29,,3.0,1/7/2017,"I like this location, I live locally so we come here whenever we want a quick out to dinner meal. Jack Daniels steak never disappoints. I've had some really good servers and some not so good servers. The service depends on the night I guess. I also usually get an LI tea but always tastes very watered down.",https://www.yelp.com/biz/tgi-fridays-farmingville?start=20
Alissa R.,"Centereach, NY",89,16,,5.0,11/2/2016,"I come here often.   Never had a bad experience.    The staff gets to know you and treats you like fam.   I love it here.   Even when I come alone, I feel like I'm not.",https://www.yelp.com/biz/tgi-fridays-farmingville?start=20
Sha D.,"Patchogue, NY",1,11,5,1.0,1/29/2017,Probably the most disgusting and unorganized Fridays I've ever been to. We walk in are told to choose our seat. As we're choosing a booth facing a tv to watch the Pro Bowl and waitress that appears to have lost her soap and shampoo says oh please don't sit there somewhere got cut there earlier. Umm it goes on. Long story kept short ...we went over to Chilis,https://www.yelp.com/biz/tgi-fridays-farmingville?start=20
Dawn M.,"Medford, NY",0,3,,1.0,7/28/2017,"We went to celebrate an occasion and though the waitress was very friendly and personable...the rest of my experience was horrible. It was four of us...We spent $120 for endless apps and drinks. the apps look nothing like the ones on TV, the marinara is watered down, the boneless wings were tough and overcooked, the quesadillas were soggy. the portions were miniscule.. I know it's endless but who wants to wait 15 minutes only to receive a child's portion. My husband's drink was sugary and watered down as well. Never Again.",https://www.yelp.com/biz/tgi-fridays-farmingville?start=20
Brian G.,"Astoria, Queens, NY",136,332,30,2.0,5/26/2015,"Came here for a quick bite when the two other restaurants we went to were closed down. Seems this whole area is not doing very well. The service was okay. Our waitress apologized several times for the long waits. Our food was good, though. T.G.I. Friday's does make good burgers with a variety of topping combinations. The bun on mine was kinda squashed, but wasn't noticably stale. Our appetizer, the potstickers, was okay. Was not my choice. I always say don't get Italian at a diner and only get Asian-inspired food at Asian-inspired restaurants.",https://www.yelp.com/biz/tgi-fridays-farmingville?start=20
K J.,"St. Albans, NY",1,12,2,5.0,12/3/2016,"The vibe was completely on a different level, the waiting/lounge area was great, the holiday lights were so inviting and the piano player set the tone. The waitress, Kayla was awesome. Drinks were on point. Found a new spot for my cousins since she just moved to the area. Very happy with the service.",https://www.yelp.com/biz/tgi-fridays-farmingville?start=20
Gregg A.,"East Northport, NY",34,108,55,5.0,2/27/2016,"Totally recommend this place. It's the new FRIDAYS going forward and it's awesome!  Classy, comfy and trendy.  Live music, tasteful. Great service...  Now they just have to work on the food",https://www.yelp.com/biz/tgi-fridays-farmingville?start=20
Gabby S.,"Patchogue, NY",0,1,,5.0,3/4/2017,"AMAZING! Your a crazy person if u don't go to Fridays! Amazing deals + Amazing food andd excellent service! They also do lip sync and blast music through out the restaurant. The people are great and so is the vibe. My experiences with Fridays are always great, if I could I would give them a 10 star review. LOVE IT!",https://www.yelp.com/biz/tgi-fridays-farmingville?start=20
Stefan W.,"Coram, NY",39,144,15,1.0,6/8/2016,"What a DUMP.   Crappy service,  poorly prepared food... just disgusting.   Hamburgers are dry hockey pucks.  Drinks are watered...  Just say no.  Choose the Burger King next door or the McDonald's across the street.   Both of those are cleaner,  have better service,  and unlike Friday's,  edible food.",https://www.yelp.com/biz/tgi-fridays-farmingville?start=20
Franco C.,"Oyster Bay, NY",828,2232,20,3.0,9/21/2014,"Casual chain. I am somewhat confused by the bad reviews on here as I thought the place was fine with a particularly good set of bartenders on Friday night - but maybe it was just the time and day I go there? It is a chain so I will not go into the food:  it is middle of the road and geared mainly towards uniformity  You are not going there for a mind blowing meal and they are not offering anything of that ilk anyway, so go for apps, burgers and drinks; in this, you will not be disappointed.   The decor is very nice - apparently it was renovated not too long ago and it is funky and cool - I liked it.   Aforementioned bartenders were very good with both making drinks, and being there enough when they were needed and not lingering when they were not. Give it a shot! Parking all around",https://www.yelp.com/biz/tgi-fridays-farmingville?start=20
Dan K.,"Southlake, TX",399,90,73,1.0,7/9/2014,"I am writing this scathing review while sitting on a hotel toilet and violently expelling whatever bacteria I just ate from my $30 ""steak and lobster"" meal from this Fridays. I feel sicker than the normal type of sickness one should feel from food poisoning, probably because the lobster I first bit into was not only raw, but at a room temperature that gave it a disgustingly fishy taste (the one everyone dreads), as if they forgot to cook it after thawing. And the steak (which looked worse than a Lean Cuisine) was served completely raw and uncooked on the inside. I cannot believe that a restaurant would be capable of this type of inexcusable culinary debauchery. Trust the other low star reviews here and do yourself a favor by going instead to the Taco Bell across the street. And yes I'm still on the toilet feeling like I just drank polluted septic water.   I'll post pics of the poison I just ate.",https://www.yelp.com/biz/tgi-fridays-farmingville?start=20
Ellyn K.,"Medford, NY",0,17,,2.0,8/27/2016,"There's less to be desired here. We don't come here often, but when we do, service is hit & miss. Seating in dinning area seems too crowded and crunched together in new set up. I get that people take advantage of their endless apps for $10, but the waitress we had recently didn't have to be downright rude when explaining we couldn't share one app plate... we understood, but didn't need the attitude.",https://www.yelp.com/biz/tgi-fridays-farmingville?start=20
Jamie I.,"Holtsville, NY",0,6,,3.0,1/6/2017,Food is always okay. Nothing super special. Last time I visited the service was terrible. It was not busy at all and our waitress spent most of her time chatting with friends.,https://www.yelp.com/biz/tgi-fridays-farmingville?start=20
Britney S.,"Medford, NY",0,3,,4.0,1/31/2017,"I come here all the time all the bartenders are great at this location. Only negative thing is they advertise they are open till 2am every day and recently they have been closing way earlier, sometimes 12 am.",https://www.yelp.com/biz/tgi-fridays-farmingville?start=20
Rachel A.,"Charlotte, NC",0,4,,1.0,12/11/2016,"Service wasn't bad. Food was dry and tasteless and to make things worse I found a hair in my drink, that WAS NOT mine, all the manager did was give me free appetizers for next time. Thanks but no thanks.",https://www.yelp.com/biz/tgi-fridays-farmingville?start=20
Michelle W.,"Farmingville, NY",1,34,4,3.0,2/18/2016,Very nice decor and vibe. Last time we went in January 2016 they food was great but the service was lacking. We didn't get drinks or silverware until asking numerous times. All the entrees came out at different times and it just kinda ruined the flow of our night. The manager was very nice and refunded the one dish that came out extremely late but in general they need to step up the service in the future to keep my business.,https://www.yelp.com/biz/tgi-fridays-farmingville?start=20
Rohan B.,"Ronkonkoma, NY",7,105,131,1.0,3/17/2016,"What a horrible experience. It took 40 minutes for my food to come out (I was one of two tables). The waitress was rood, got mad when my friends and I shared food we paid for. She then got mad and said that she would charge us for the free refills on our soda. Horrible person, horrible service. Hope she enjoyed the 35 cent tip",https://www.yelp.com/biz/tgi-fridays-farmingville?start=20
S V.,"Mount Sinai, NY",50,63,2,5.0,2/29/2016,This place is amazing. Yes a little pricey but well worth it. What staff is amazing and professional. I just wish they had half price apps after 10. Otherwise I definitely recommend.,https://www.yelp.com/biz/tgi-fridays-farmingville?start=20
Jessica J.,"Newport News, VA",0,8,,5.0,9/11/2016,I personally really like the feel of this new Friday's. It's a very classy feel and doesn't feel like you are in a chain restaurant. I sat at the bar and the service was really good for a Friday night. A lot of people that write the bad reviews don't like change but I personally think change is s good thing and an improvement.,https://www.yelp.com/biz/tgi-fridays-farmingville?start=20
Ken W.,"Point Pleasant Beach, NJ",0,27,1,2.0,9/3/2015,"I know TGI Fridays is not fine dining by any stretch but you typically get good service and a decent meal at reasonable price.   Walked in sat at the bar, the bar top looked like someone had dumped a trash bag on it, I sat in front of this mess for about 10 minutes until one of the four bartenders finished their conversation and came over to ask me what I wanted.  I ordered a beer and had to ask him to wipe down the bar. Got my beer and menu and then sat for another 15/20 minutes while the bartenders chatted with each other. Finally ordered my meal, a 10oz fillet with broccoli and fries, my food arrived pretty quickly, the meat was OK but the fries were cold an soggy, the broccoli was ok. Just piss poor service and quality, take your business elsewhere.",https://www.yelp.com/biz/tgi-fridays-farmingville?start=20
Brett B.,"Ridge, NY",9,75,11,1.0,9/10/2012,Can you give 0 stars? Just stopped on my way home for wings and a drink. Sat at the bar...there were 3 bartenders...I noticed one spending a lot of time talking with a friend. Didn't think a lot of it because it wasn't so busy.  Well it did get a lot busier as I sat there. I had my wings and drink and waited for the bill...and waited and waited and waited. Then I got it about 15 minutes after I was well done with dinner. Then I just wanted to pay. It was 20 more minutes and I went to the host stand and asked to pay...they got my bill back to the bartenders. I am not sure of the guy that took my bill and processed it...but when he handed it to me he let me know I wasn't the only customer....really? And TGIF isn't the only place to eat. I go to a TGIF about 3-4 times a month....I will avoid this one for sure. No class - no customer service.,https://www.yelp.com/biz/tgi-fridays-farmingville?start=60
Angela H.,"Lisle, NY",3,10,2,2.0,8/7/2013,"Food was mediocre at best. Our waiter took forever coming back after our drink order. When we asked for a to go box he disappeared, then we found him and he said he had forgot. Floor was sticky everywhere.",https://www.yelp.com/biz/tgi-fridays-farmingville?start=60
Thomas T.,"Manorville, NY",1,15,27,5.0,11/5/2013,I like fridays and I don't see why there are a lot of bad reviews I like it there the pole are nice and it's clean so that's good and the food is also good !,https://www.yelp.com/biz/tgi-fridays-farmingville?start=60
Tricia C.,"Patchogue, NY",0,49,,1.0,1/12/2013,"i will never go to tgif's again. they took away everything that was good about it. now they are just greedy. no food specials, drink specials are 3 diff crappy light beers, and their appetizer specials vary on the day you go in?? what is that?? completely disgusted!! bring back the 2 for $20. or really offer 1/2 off apps on all apps! not just a few. and only on certain days! applebees gives 2fers on drinks & 1/2 off apps on allll their apps!! (except the combo of course). boooo tgif!!",https://www.yelp.com/biz/tgi-fridays-farmingville?start=60
