Username,location,friend_count,review_count,photo_count,rating,date,review,Url
Vlad V.,"The Heights, Houston, TX",189,679,188,3.0,12/26/2017,"I put TGI Fridays in the same boat as I do their main competitors in Chili's and Applebee's: it's alright but it's not real. Out of the three, I put Fridays in second place behind Chili's. There were several things I liked. They have drink specials every day of the week. Monday's specials included $3 mojitos, this I like very much. They also had $5 apps if you sat in the bar area. I did indeed sit in the bar area so I could watch some football and went with their appetizer platter. The platter came with four potato skins, sour cream, four mozzarella sticks, marinara sauce, and a good amount of BBQ boneless wings. None of the apps were great but they were all alright. Like I said, Fridays is alright but it's not real. Service was friendly. Like an idiot, I forgot my to-go box at the restaurant. Hooray.",https://www.yelp.com/biz/tgi-fridays-pearland
Chris H.,"Pearland, TX",162,136,389,4.0,8/8/2017,I haven't been to a TGI Fridays in forever. This one is really quite nice. The main reason I am posting is I wanted to give props to Adam. He was our server today and that guy is amazing. One of the best servers you'll ever have. He works in the bar area. Be sure to ask for him.,https://www.yelp.com/biz/tgi-fridays-pearland
Keya H.,"North Little Rock, AR",0,25,168,1.0,4/8/2017,Poor quality. Thin piece of mahi for $17 and spinach still partially raw. Definitely not with the price. Broccoli was good.,https://www.yelp.com/biz/tgi-fridays-pearland
Crystal H.,"Houston, TX",228,63,111,4.0,10/10/2016,"I love TGI Fridays!  We usually sit at the bar, and receive great service, especially when Zach is there!  I am a fan of the green bean fries and the Truffle Stacked Burger...they make my internal fat girl SO SO happy.  I also get the long island, without vodka...a few of them :-) and they always make them perfectly.    I will be back soon, and I look forward to trying something different!",https://www.yelp.com/biz/tgi-fridays-pearland
Alyssa H.,"Pearland, TX",53,3,1,1.0,8/7/2017,Wish I could leave zero stars. We waited at the door for 15 minutes and no one helped us so we just had a seat. It took over 30 minutes to get our drinks and order taken. We ordered lunch specials... salads and sliders. They took an hour and came out wrong. The manager said it was bc they were busy but there was barely anyone there!  won't be coming back to this location!,https://www.yelp.com/biz/tgi-fridays-pearland
Richard W.,"Manvel, TX",0,3,4,1.0,7/22/2017,"The service here has gone down a ton. It used to be good, I had to ask for water 5 times. Got my order wrong 2 times. The bar here sucks. Phillip was my server and he never asked if I needed anything. I asked too talk to a manger and she never came. I would not goo to this place. When Ryan d and Richard where is it had great service now it is slow and food tastes like it has been in a warmer.",https://www.yelp.com/biz/tgi-fridays-pearland
Eric D.,"Houston, TX",78,11,32,1.0,6/14/2017,"If you like cooked frozen food, come here. You can cook this type of  food better at home. I had the chicken sandwich and shrimp, both tasted frozen; I'll never come back here again.",https://www.yelp.com/biz/tgi-fridays-pearland
Rene'e N.,"Houston, TX",24,2,,1.0,5/20/2017,"The worst service.  It was 20 minutes before we were acknowledged.  Glasses were dirty.  NEVER RECEIVED THE CLEAN GLASS AND NEVER RECEIVED OUR ENTREES.  TGIF SUCKS. By the way, we were there for an hour.  NEVER AGAIN!!!!  Went to BJ Brewhouse, excellent service - this was the same night.  If you have time to waste, by all means, go to TGIFriday's otherwise find another restaurant with excellent service in Pearland, TX....if I could give TGIF a NEGATIVE; believe me I would because that's what this location deserves....",https://www.yelp.com/biz/tgi-fridays-pearland
Daphne W.,"Pearland, TX",47,10,9,2.0,8/18/2017,"This TGI FRIDAYS is not very good. The costumer service is awful. The restaurant is small and it seems that the service should be better but it's not. We waiting for 30 mins and there were empty tables everywhere. The staff were walking around and socializing. My hubby had an eyelash on his plate when he received it. However, my food was hot!",https://www.yelp.com/biz/tgi-fridays-pearland
Imman E.,"Katy, TX",140,182,296,3.0,8/21/2015,I came here for a late drink and endless apps. I say at the bar and the two bartender guys are usually friendly   and goofy. I have became a slight fan of TGIF. Idk if it's the endless apps or the fact they are open till 2 am or the every hour is happy hour. I will say  not on this visit but my previous 2 visits I was not so happy. 1 time was double charged for my meal and the other time shitty service from the Bartender. I had to hunt him down to pay for my meal. Should have dinned and dashed  because he was busy playing around in the back of the bar.  This visit wasn't as bad as the last two.,https://www.yelp.com/biz/tgi-fridays-pearland
Stacy M.,"Fresno, TX",2,7,4,1.0,5/13/2017,"The worst service! Writing this review as we are still sitting here. Party of 6 came in at 2:00 in the afternoon. After being seated we waited 15 minutes, without being acknowledged, before we were able to flag someone down. When they told the server we were her table she made a face like she could care less. Ordered drinks and 2 appetizers. Appetizers show up before our drinks. They get dropped off in the middle of the table. No plates were given to us. Kids are starving and plates are not showing up so we finally just dig in. Nearly an hour after arrival and we still have not received food. All of our drink cups are empty and server is nowhere to be seen. Then, to top it off, they have an automatic 18% gratuity for parties of 6 or more. Will not be back to this location. Ever!",https://www.yelp.com/biz/tgi-fridays-pearland
Michelle D.,"Deer Park, TX",20,9,,1.0,2/3/2017,"I went there, haven't been there in quite a while. Sat down and ordered the double lunch, was excited, the chicken pasta and mozz sticks. .  Got the food, looked okay, began eating the pasta, and my mouth started burning and it tasted bad, found red bell peppers in it. I'm allergic to bell peppers and so my mouth is on fire, my face is going numb and my throat is burning.  I tell the guy I don't want it, instead of asking what was wrong, did I want a replacement of something else, did I want to speak to the manager, he said okay and took it away. I ate the cheese sticks and waited for him to come back and he didn't, so I had to chase him down to pay the bill.  Instead of discounting the portion of pasta, he said I had to pay it all whether or not I ate it. $13.00 dollars for four cheese sticks and a tea. .  He didn't ask if he could get a manager and see if it could be discounted, nothing. Sad, sad, poor customer service. Never going back.",https://www.yelp.com/biz/tgi-fridays-pearland
Joe C.,"Houston, TX",238,134,12,2.0,5/24/2017,"Service is mediocre. Food is well below average, while prices are just above average for this type of venue. Haven't been to a Fridays in 4 years. Likely 4+ more. Recommend Chili's if you need this type of fix. Spend a little more and go to BJ's, better all around. I'm not sure how Fridays has remained open. Alcohol maybe?",https://www.yelp.com/biz/tgi-fridays-pearland
Danni V.,"Pearland, TX",0,3,,1.0,5/25/2017,"FYI, my parents went to lunch there & my mother asked if they had senior/veteran discounts as my Father is a disabled vet. They don't have any discounts for Veterans. In case, you are a vet yourself or can appreciate their service for this country here's a quick reference of establishments who provide discounts to those men and women: These restaurants are glad to support veterans by providing discounted dining. Applebee's, IHOP, Longhorn Steakhouse, Outback, Texas Roadhouse, Golden Corral. Fast food chains as well Subway, Dairy Queen, Chick-fil-A, Quiznos. These are just a few in the Pearland area.",https://www.yelp.com/biz/tgi-fridays-pearland
DeAun A.,"Houston, TX",0,2,,1.0,11/20/2017,"This used to me and my sister's favorite place to eat! We'd go every Wednesday when they used to have trivia and a DJ. Ever since they renovated the place the quality of the food has gone waaaay down. Everything tastes like it was frozen. The last few times i went there my drinks were good but the service could've been better, But what sealed the deal for me was when i went on a Saturday a few months ago to meet my sister. She had already ordered a beer which is why i guess they decided not to take my drink for a good 10 minutes. I was finally asked if i wanted a menu. The bartender never acknowledged us again after he gave me the menu. Then one of the managers came to cash out a table looked at me and my sister, who had been finished her beer by now and we were just sitting there, she never acknowledged us either. We sat for a good 20 minutes without any help, and the place was virtually empty. My sister was FINALLY able to flag the manager down again so she could pay for her 1 beer and we left and went next door to Lupe Tortilla. Lupe Tortilla was extremely crowded that night, we managed to snag two seat at the bar when someone got up to leave and were served immediately! We have not been to Fridays since then.",https://www.yelp.com/biz/tgi-fridays-pearland
Justin T.,"Pearland, TX",1441,254,894,2.0,10/23/2015,"There you used to be a time when I loved this chain.  I am kind of confused on how to rate this place now though. It isn't just this location, but all the TGI FRIDAYS in general.   The food is hit and miss. I took it back to my childhood tonight and ordered chicken fingers. My daughter ordered the chicken fingers, but from the children's menu.  The only difference in the two was the price and the plates they were served on.  There were barely any fries on the adult sized dish. There were more on the children's size basket.  My wife kind of mentioned it to the waiter, not to get more, but just to point out that maybe they should charge for 2 kids meals. The waiter basically just shrugged it off. My son ordered a burger medium, and it was almost well done.  My wife's sizzling chicken and shrimp skillet was definitely sizzling, but the dish was very bland. The mashed potatoes were watery.  Aside from the food, the service was subpar also.  The waiter was friendly, but didn't seem to pay attention to our orders. One of the drinks we ordered from the bar came only after we reminded the waiter about 15 minutes after ordering it.  As much as I used to love this place growing up, it's time to find another place to relive my childhood. Unless of course they bring back the endless appetizers, I just may make an exception!",https://www.yelp.com/biz/tgi-fridays-pearland
K F.,"Houston, TX",1,10,,2.0,5/26/2017,Management has to be non existent!   Walked in and sat ourselves.  The bartender was having a melt down and literally sweating.  Sat at the table for min 10 min without drinks.  Plenty employees working. Just not as a unit.  I know it wasn't just me as I looked up and another customer was complaining that she shouldn't have to go from her table to the bar 4x to order a drink. Watched the manager just observe from the back. Gave no assistance or instruction.,https://www.yelp.com/biz/tgi-fridays-pearland
Mitch J.,"Fresno, TX",9,17,16,3.0,4/9/2016,The foods ok but you have plenty items to choose from.  The endless apps will be the way to.  The drinks are what brought us here to kick off the night cap.  Customer service was good even on a busy night.,https://www.yelp.com/biz/tgi-fridays-pearland
Heather D.,"Houston, TX",0,21,7,5.0,1/16/2017,"I came to this restaurant with a group of about 10 people. Our server Ryan was so attentive. He made sure we had drinks, food, and everything in between. No one in my party was unhappy. The food was great, especially with homemade mozzarella sticks! The drink specials were great, including happy hour all day and $3 margarita/martini Mondays! I would definitely recommend this location and if I am in the area, I will come back to eat!!",https://www.yelp.com/biz/tgi-fridays-pearland
Bannana T.,"Manvel, TX",0,2,,1.0,3/19/2017,"Table is damp when we got seated. Waited too long for a service. No one even came to ask us for drinks until we had to call their attention. Not a place to go when you're in a rush. Finally, starter arrived but no cutlery to use nor napkins whatsoever.... would not come back to this particular branch & would tell friends to stay clear.",https://www.yelp.com/biz/tgi-fridays-pearland
Junior O.,"Edgebrook, Houston, TX",3,13,9,2.0,11/5/2016,Got in to restaurant around 105am and last call was 110. It felt like they wanted us gone before 2. The 2 stars is for the food. Food was decent. Check was given to me before I finished my food and was asked to pay while I was still eating. Just felt so rushed. The restaurant was empty except for our table at 140. I guess everybody else knows the rules to this TGIF. Everybody just wanted out of there by 2. Never experienced this at any other place. I will never be back and won't recommend this place to anyone.,https://www.yelp.com/biz/tgi-fridays-pearland?start=20
Beverley G.,"Missouri City, TX",0,1,,1.0,2/26/2017,"THIS SERVICE WAS HORRRRRRIBLE!!!!! and when i say horrible i mean so many times i thought about getting up and just leaving, the waitress whatever her name is sucked, very rude and verrrrry very slow. took 30 long ass minutes to just get a drink (which she NEVER came back to even refill a few of the drinks at the table) took another hour just for food, and then she forgot to bring one of the entrees to the table and tried to have an attitude once asked about it. also note to self guys it was not a busy night, so i don't understand why the service was so sorry. don't know if i would return because THEY SUCK!",https://www.yelp.com/biz/tgi-fridays-pearland?start=20
Karen L.,"Manvel, TX",1,37,1,4.0,4/24/2016,"This is the one and only TGIF I have ever liked... I recently had given up going to all TGIFs (California ones included) after many bad expiriences...(and the only reason I even kept going back was because my husband likes the TGIF franchise) However our last expirience in the pasadena location was so bad we both decided never to return to another TGIF.... Now long story short, I was really bummed when I found out my job was gonna throw a company party at this location...once I arrived with low expectations they were immediately shattered...the food is actually really good HERE..the servers were all very attentive..all their apetizers were so delicious..every single one...the servers kept them coming and all servers seemed to be in such a good mood..they attended to everyone needs and there was a guy whom appeared to be a manager because he was extra attentive and was completely catering to our occassion..This night was such a great expirience i had to return with my husband to show him that there was finally a TGIF i liked...We both returned to this location and he liked it as well. NOW this location will be the only TGIF we will ever return to....",https://www.yelp.com/biz/tgi-fridays-pearland?start=20
Rosie S.,"Old Town, FL",33,26,8,5.0,4/21/2016,"Hadn't been here in years. My son recommended the JD chicken--2 breasts with two sides. It was delicious! The sauce made all the difference (Jack Daniels special sauce). Chicken was tender and juicy, not dry. I had broccoli, steamed perfectly, not squishy but not hard. Mashed potatoes were ok-good taste, nothing out of the ordinary.  Next time I'm here, I'm probably having the same thing!",https://www.yelp.com/biz/tgi-fridays-pearland?start=20
Teneha B.,"New Orleans, LA",1333,891,5363,5.0,10/12/2013,"Always a great time at TGIF's... Always fun times in this place. Always busy & bustling.  For a late night dinner with family, I stopped in & I was pleased as always.  Great bar. I mean a restaurant with a full bar like you're at the club.  Great place. Great food. Great prices.",https://www.yelp.com/biz/tgi-fridays-pearland?start=20
Fran E. R.,"Mobile, AL",284,91,836,1.0,12/15/2015,"Worst experience of my dining life.  I had no issue with our server being new but to not know what Sesame Jack Strips are is reprehensible.  Those are not only a Friday's FAV item, but a staple dish for the franchise.  As a previous server in the industry, the first rule of business is to try the dishes so you can know what to offer.  Our server Brandy was new but shouldn't have been on the main floor.  She had NO clue what Sesame Jack Strips were and instead of asking, brought us chicken strips w/ fries as an appetizer.  We had to send them back but only after the manager came to make that's what we wanted.  Did I mention at this time we still hadn't gotten our beers?  The meal was down hill after this.  There was a miscommunication/mess up with my order which is too complicated to get into.  Long story short --- she got the order wrong, manager was not apologetic nor did he offer to comp my meal.  I pretty much had to plead with him to do so.  A normal 1 hour meal is now lasting over 2 hours.  I would like and prefer a FULL refund.  I have never had such horrible service, especially with a manager involved.",https://www.yelp.com/biz/tgi-fridays-pearland?start=20
Marlo M.,"Palmdale, CA",17,519,1507,5.0,2/25/2016,Wondering why some of the reviews on here are low maybe they skimped out and got burger or salad not sure all j know is my jack dangles steak and ribs were off the chain. It made up for last night I was so disappointed with Texas Longhorn when I'm in Pearland it's either Friday's or Texas Roundhouse that's it.,https://www.yelp.com/biz/tgi-fridays-pearland?start=20
Francisco B.,"Houston, TX",210,32,1,5.0,9/27/2016,"It was my first time coming to this establishment,   was not so sure about the idea but once i sat down and i was inpressed with the service... our waiter was attentive and nice... then the food was delicious, them jack daniels ribs are on point. Will return next time im on Pearland",https://www.yelp.com/biz/tgi-fridays-pearland?start=20
Dustin L.,"Overland Park, KS",27,7,,5.0,8/8/2016,Great deals and good food! Wish they were in kansas city!,https://www.yelp.com/biz/tgi-fridays-pearland?start=20
Shavonda S.,"Houston, TX",89,166,133,3.0,7/29/2015,Well what do ya know - they stopped allowing smoking and the place got a face uplift! It looks alot fancier these days and they seem to be really trying to bring back the good ol' customer service that made me love this TGIFridays in the first place. I bumped it back up to 3 stars for the upgrades and think I'll head back there from time to time. Kudos on listening to your customers!,https://www.yelp.com/biz/tgi-fridays-pearland?start=20
charles h.,"Houston, TX",39,5,5,4.0,7/2/2016,"I've been coming here for quite some time now. I definitely recommend this location. Great food, prompt service, and great drink specials! A great time for date night, family time, or night out with the fellas. I just wish they were open until 2! Keep it up.",https://www.yelp.com/biz/tgi-fridays-pearland?start=20
Geovana Z.,"Houston, TX",0,36,57,1.0,2/26/2016,We came in @3:30 and got seated in the dirtiest table ever. How is it possible that at the peak of down time the table is not clean will not be back to this filthy location,https://www.yelp.com/biz/tgi-fridays-pearland?start=20
Jerry A.,"Houston, TX",1002,265,318,3.0,5/8/2015,"As far as chains go, this is a nice place for happy hour. Menu updates have complimented some of the old standard options. The drinks are... ok. The staff is friendly.",https://www.yelp.com/biz/tgi-fridays-pearland?start=20
Meredith F.,"Houston, TX",104,197,37,5.0,5/4/2015,"I love coming here, the food is great, the servers are very nice and accommodating and they are quick! I've never been particularly drawn to Friday's one way or the other but I really like this location! Luckily we live close and can visit often!",https://www.yelp.com/biz/tgi-fridays-pearland?start=20
James M.,"Houston, TX",86,43,2,5.0,7/22/2015,"Great Place to Wind down after a work day with great staff, remodeled, great prices ($10 unlimited Apps)! I love this place! I will be back to TGI FRIDAYS",https://www.yelp.com/biz/tgi-fridays-pearland?start=20
Tamara B.,"Texas City, TX",24,13,3,4.0,10/23/2015,Great service!! Definitely an improvement from before they remodeled!!! Open concept and the bartenders and waitstaff were very personable and helpful! The unlimited 10 dollar boneless wings were awesome as well!!!,https://www.yelp.com/biz/tgi-fridays-pearland?start=20
Shanee T.,"Richmond, TX",1,2,,1.0,12/10/2015,CUSTOMER SERVICE IS HORRIBLE. There were no clean tables and it wasn't bc they were busy. The waiters were sitting doing nothing. I sat for 20 minutes and wasn't even offered water. Sad part is the waiters seen me sitting there and didn't even try to do their job. It was my first time coming to this location and I will never come back. You only got one star bc I didn't have a choice.,https://www.yelp.com/biz/tgi-fridays-pearland?start=20
John S.,"Pearland, TX",57,135,275,3.0,12/11/2014,"This was our first visit to this location. We ordered an appetizer, one that didn't come out until we were literally finished with our meal. Our server was not very attentive either. Without many patrons in the restaurant their really wasn't any excuse for this. The food in general though, was very good. I had a sizzling steak and spinach dish. It came out hot a sizzling. The steak was cooked just as ordered (medium rare) and was very tender and flavorful. The spinach on the side tasted good when mixed with the glaze that was on the steak. It also came with a tomato and mozzarella salad. This was a nice compliment to the meal. My wife also enjoyed her food as well. It's a shame that the service did not match up. Three stars only because of the food, will raise my rating if service improves and food stays consistently good on other visits",https://www.yelp.com/biz/tgi-fridays-pearland?start=20
Eric P.,"Missouri City, TX",8,5,6,3.0,1/15/2016,"The bartenders are really good, especially Ryan super quick with the drinks, but if your looking for a spot to watch the game at the bar this is not a good spot to go to. The music selection is poor and management needs to change it up a bit to bring in a younger crowd mid 20's- early 30's vibe. Too many kids around the bar area should not be allowed.",https://www.yelp.com/biz/tgi-fridays-pearland?start=20
Chana J.,"Pearland, TX",117,62,349,3.0,12/27/2015,"I am NOT a franchise fan, but living in the 'burbs reduces your choice particularly if you are trying to orchestrate a quick escape from the kids during Xmas break, without drawing too much attention for being gone from you two teenagers, tween and hubby while you are craving an escape for an adult beverage and a much needed change from the Christmas leftovers.... So who knew TGI would provide me with an enjoyable food experience? The last time I was here the twins were 9 and I swore Never to return.... But as I drove around looking for a ""quick fix"" I.e. No Tex Mex, Vietnamese or BBQ (no full bar) or Italian, I opted against all my normal stops (since it is raining with tornado weather conditions) to give TGI a go.  Well I went in with no expectations, but was quickly enticed by the Ahi Tuna on a tortilla, topped with guacamole, sirrachi and wasabi ranch drizzle(it was Devine). The pretzels in its beer batter cheese Sauce complimented the strawberry Moscow mule perfectly....  Well if you go against your usual bar food menu option and explore a foodie maybe able to find solace and pleasure in the 'burbs at a local franchise...: (maybe), or was I just too excited for a stolen moment away from Mommy Reality? (....to be continued)",https://www.yelp.com/biz/tgi-fridays-pearland?start=20
Desiree A.,"Pearland, TX",35,5,4,5.0,1/6/2016,"It's sad to see sooo many poor reviews. I have a great experience while going for the first time. They have a great new special the $4, $7,$4 , and its smoke free! I was impressed the most by how clean the place was.. My server was very friendly. and the ambiance was fun and sporty.",https://www.yelp.com/biz/tgi-fridays-pearland?start=40
Melanie L.,"Houston, TX",19,10,2,5.0,10/11/2015,"Great, friendly service! Our food came out quickly and it was delicious. They have great deals here- so you'll fill up if you're on a budget. We enjoyed our experience at this location",https://www.yelp.com/biz/tgi-fridays-pearland?start=40
Randi T.,"Manvel, TX",19,23,51,4.0,7/28/2015,We stopped at Friday's this week because I had a great buy one get one coupon and the Pearland location is newly renovated and smoke-free!!!! We will definitely frequent here more often as they are always sending out great discounts and freebies.,https://www.yelp.com/biz/tgi-fridays-pearland?start=40
C. P.,"Manvel, TX",0,14,2,5.0,11/13/2015,We love going there and the food is always good! The service is great if you have a young woman to serve you and I believe her name is Justice. She's not just a good server she's always positive and also offers good suggestions on food or drink choices. We love the various food and drink choices and specials.,https://www.yelp.com/biz/tgi-fridays-pearland?start=40
Jesus P.,"Missouri City, TX",2,15,,4.0,9/6/2015,"Came here for breakfast at 7:30pm after a long day of bumming out. I got the chicken and shrimp pasta and it was delicious 8/10. As a ""bum"" not really, I appreciate the good things in life, a night out with the squad, decided to try something new and ended up here. Clean, friendly, and a good atmosphere. Didn't 5 star cause I feel they can improve in certain areas but I will definitely come again.",https://www.yelp.com/biz/tgi-fridays-pearland?start=40
