Username,location,friend_count,review_count,photo_count,rating,date,review,Url
Melissa M.,"Houston, TX",175,1391,4254,3.0,5/26/2010,"Ended up here for lunch with coworkers. Service was good. The restaurant is chilly. What is it about Texas and the summer? We go from scolding hot to freezing cold constantly. Many of the surrounding restaurants aren't open for lunch. Texas Roadhouse is next door and is only open for lunch on weekends. On the Border is on the other side and closed down. So, you've basically got Olive Garden and TGI Friday's in this lot. We opted for Friday's.  My Jack Daniel's chicken sandwich was actually quite good. It came with some little fried onions on it. It was messy but good. The sweet potato fries were salty! My friends enjoyed their burgers, soup and sandwich, and chicken dish. Everyone seemed pleased with their food.  I think the food was good but nothing special overall. I actually think there food is ok, but there are plenty of places around the Pearland area that are comparable or just a little bit better for a slightly cheaper price.  But, try them out at least once.",https://www.yelp.com/biz/tgi-fridays-pearland?start=40
Jilliann G.,"Pearland, TX",5,24,2,1.0,11/13/2013,"This place is flat gross. Don't bother even trying this place out!  We went there when we first moved here 2 years ago and it was awful- service and food. I went with a group a few months ago and it was still gross. I had hopes it would get better, yet it just hasn't. This is the only TGIFridays that I have not liked, the rest have been awesome!   They still allow smoking in the bar which isn't closed off so you can smell it and see it through out the whole place. Yuk!",https://www.yelp.com/biz/tgi-fridays-pearland?start=40
Diego L.,"Fourth Ward, Houston, TX",4,34,1,1.0,1/18/2015,"This restaurant allows smoking. It's so gross! The food is fine, servers too, but you have to sit through everything in this acrid terrible room! In an effort to be too much like a bar and ""fun"" it turns away families. Last time I'll be here until they get rid of this smoking policy.",https://www.yelp.com/biz/tgi-fridays-pearland?start=40
Nathan P.,"Pearland, TX",11,39,5,2.0,7/28/2014,"The food was okay but the service and waiters were horrid! They took a long time to ask us for what we want (10 minutes), then it took 23 minutes for 2 dishes that we had ordered! In addition, this tgi staff was in the corner and just sitting down chatting with other staffs about a concert and social life. Very unprofessional! Finally, when we asked for the check it took her 5 minutes then when we put the money in, it took 10! Good food bad service",https://www.yelp.com/biz/tgi-fridays-pearland?start=40
Meryl O.,"Houston, TX",80,75,1,4.0,3/1/2012,"Note: This is a review for the bar and bartenders. Also, keep in mind this is Pearland, and there are limited choices as far as bars or restaurants open past 10 pm go.  I go here relatively often because it is close to where I live and because of the few comparable choices in Pearland. If smoke bothers you, I would avoid this place because patrons can smoke in the bar. They have a pretty good happy hour (I think it is half off of select appetizers), and later at night, the burgers are discounted. Considering it is a large chain restaurant, the potstickers and the wings are good (the inferno wings are pretty spicy). If you are leaning towards a lighter option, the flatbread is also good (they also have more ""skinny"" drink options than most places).  The main reason I like this place is due to the bartenders. They are very friendly and take time to entertain and talk to the customers (also, they tend to pour a good drink). Also, they remember people's names and faces when you come back. On different nights of the week they also have poker and a d.j.  While this isn't a high end martini bar, it's a good place to hang out and have a drink with friends.",https://www.yelp.com/biz/tgi-fridays-pearland?start=40
Ann R.,"Pearland, TX",65,25,17,4.0,9/17/2014,We usually order off the Jack Daniels menu. Steak  & ribs is really good. We have yet to be disappointed. We are pretty happy coming here for a dinner.,https://www.yelp.com/biz/tgi-fridays-pearland?start=40
Steven S.,"Dickinson, TX",148,4,6,2.0,3/20/2014,"The service is good enough, but they allow SMOKING.  Needless to say, I won't be going back. It seems so archaic to allow smoking inside of a restaurant, but hey, if that's who you want to cater to, be my guest.",https://www.yelp.com/biz/tgi-fridays-pearland?start=40
Jarrod A.,"Manvel, TX",0,20,,3.0,8/8/2014,"Food was good.   We had steak and ribs. Good steak and well cooked  a little light on seasoning. I think the bartender was playing games. Waited forever for my beer. I was served Sam Adams instead of fat tire. My son ordered diet coke. Both times they brought the glass, they were something else or mix was way way off.  Server was not the greatest but tried to make us happy",https://www.yelp.com/biz/tgi-fridays-pearland?start=40
Whitnie T.,"Westchase, Houston, TX",160,9,10,4.0,8/18/2013,"Never a dull time when I come here! Whether I'm at the bar or seated at a table, with my rambunctious friends or just having dinner with family, I've never been disappointed here.  It's not a gourmet restaurant but the food is pretty decent for what it is and service is impeccable.   The only complaint I have is that whenever I order the spinach dip, it never seems to be hot all the way through but along with chugging some beer, it doesn't bother me after a while.",https://www.yelp.com/biz/tgi-fridays-pearland?start=40
Rosy B.,"Pearland, TX",37,3,,5.0,9/17/2015,"I like this place! TGIFs are pretty standard across the board, but whenever I go I am lucky enough to be served by Zach. He's a super friendly and always remembers me. Simple good service makes me happy, and keeps me coming back.",https://www.yelp.com/biz/tgi-fridays-pearland?start=40
G F.,"Pearland, TX",20,146,1,2.0,6/24/2012,"Meh. The slushies are tasty but they aren't real slushies, just a juice drink over packed crushed ice. I thought TGIF was supposed to have good potato skins, but they were pretty bad. Dry potatoes, way too salty, and no green onions (garnishing the sour cream bowl with a few green onion slices doesn't count). The child's mac & cheese made my kid sick that night. Saw another review that they allow smoking in the restaurant. We won't be back.",https://www.yelp.com/biz/tgi-fridays-pearland?start=40
Shamira D.,"Houston, TX",26,19,13,4.0,4/23/2014,"Been here a few times. Don't really care for the food menu but the drink specials are great. $3 martini Wednesdays is when I'm usually here. I tried a new food entree Sizzling Chicken and Spinach and it was actually pretty good! One downfall, it's located outside of Houston so smoking is allowed at the bar. I don't smoke, so I have to step outside for fresh air on occasion. This location is on my way home from work so it's convenient for me. Plus, they like to give away free food if u sign up for their Stripes program.",https://www.yelp.com/biz/tgi-fridays-pearland?start=40
Stephanie M.,"Pearland, TX",111,10,1,1.0,6/20/2013,Horrible service. Took forever to get our drinks. Food was gross. Nobody I sat with enjoyed the experience. I will not return to this place again.,https://www.yelp.com/biz/tgi-fridays-pearland?start=40
Elizabeth L.,"Pearland, TX",0,7,1,1.0,2/17/2015,Just like chili's their service sucks. I went the night of the super bowl and ordered a few appetizers the pretzel dough was still somewhat raw the pot stickers tasted soggy and expired the wings were not bad and the potato skins had a strange toxic taste to them. Somewhere past midnight I woke up and threw all of it up will not be going back.,https://www.yelp.com/biz/tgi-fridays-pearland?start=40
Deepak I.,"Pearland, TX",0,1,,1.0,11/28/2012,"This place is going from sorry to worse by the day. Horrible service. micro oven food that is stale and sitting some where for several hours. Please save your time, health, money and go some where else to have a good meal. People go out to eat to have some good time and enjoy the food, if we have to eat micro oven food, might as well get from Sam club and heat it up at home for the fraction of the price. I have given then fair chance and that is my mistake. Sorry guys you are a disgrace to the pride of Pearland.",https://www.yelp.com/biz/tgi-fridays-pearland?start=40
David N.,"Houston, TX",4194,3756,2208,3.0,2/7/2010,"With the recent commercials of the 3 course meal I had to check it out, I mean for 12.99 you get a 3 course meal, OUT? Eh...Something that sounds too good usually is. I haven't been to a fridays in years, literally.  But I had a group of friends that didn't know what they wanted to have for dinner so it was one of those times Friday's/Chili's comes to mind even if I hate these mega chains. It also didn't hurt that we had a 10 dollar off coupon.   I had the fried green beans, sizzling parmesan crusted chicken, and the vanilla bean cheesecake.  My friend had the fried cheese, chicken tenders, and the brownie.   The meal started off decent with the appetizers, nothing wrong there fast and simple.  When the entrees came out they were barely warm, my ""sizzling"" tray was no longer sizzling and my friend's tenders and fries were cold.  At this point we were kind of sad. The redeeming factor was the dessert.  The cheesecake was amazing! It was actually plated well.  Yeah tell me about it, when did Fridays get into the market of presentation?  The brownie was amazing.  It was so soft and warm and topped off with a scoop of vanilla ice cream. So basically, you pay for what you get.  3 courses for 12.99 is a steal, just don't expect the world and you won't be let down.",https://www.yelp.com/biz/tgi-fridays-pearland?start=60
Neff H.,"Houston, TX",1,13,,2.0,7/28/2014,Definitely agree with many of the previous post about the bar. Way too smokey at the bar for anyone to breathe and have a drink. Walked too the bar and walked right out. Not too bad if your going for the food alone.,https://www.yelp.com/biz/tgi-fridays-pearland?start=60
Courtney A.,"Jacksonville, FL",17,56,70,1.0,6/11/2013,"So I came here the other day and ordered a turkey burger. After three or four bites, the texture just seemed off, as was the color. So I cut it in half, which normally I do to begin with, but I was starving, so I dug in. anyway, the thing is bleeding in the middle. Which, fine if it's beef, but so not fine if it's turkey! So when the waiter comes back, I ask him if it's turkey or beef, he says it should be turkey, so then I show him how it's not fully cooked. He takes it, and a few minutes later brings it back, during, yes the kitchen said its turkey. He says ""do you want another one?"" By this time the kids are ready to go, and quite frankly I'm grossed out!! I politely decline, and he, instead of offering me something else, he just says ""fine, I'll get your bill"". Ok whatever. So come 10 pm that night, I'm laying in bed, and start having horrible stomach cramps. They continue all night, and all day the next day, for over 24 hours. I felt like I was going to vomit, but never did, & I think it's cause I only took a few bites, thankfully, or I would have really been sick.",https://www.yelp.com/biz/tgi-fridays-pearland?start=60
Simon L.,"Houston, TX",21,96,36,5.0,3/26/2013,"I""m not giving it 5 stars because it's some super awesome wonderful food.. we know it's TGI Friday's and it's the typical applebees/chili's type food. I'm giving it 5 stars because I came here on Veteran's day and they treated us really well.  Both my girlfriend and I are veterans and we had the list of all the offers that restaurants were holding for the weekend. TGI Friday did not have anything spectacular. It was like a free appetizer or something at a certain time , but we came here anyway for dinner. We ordered a couple of steak dishes, a couple of beers and an appetizer. Only after we ordered did we ask if there was any veteran day deals. Our waitress didn't know so she went to ask the manager. We expected none, but she came back and asked to see our VA IDs. After we showed it to her, she said the manager wanted to comp our entire meal and thank us for our service. The manager never came over to thank us personally, but the gesture was pretty awesome. We enjoyed our meal, left a $20 tip and it made our night. Thank you manger of this TGI Friday's.",https://www.yelp.com/biz/tgi-fridays-pearland?start=60
Veronica T.,"Houston, TX",0,32,,1.0,5/6/2014,Smoking still permitted. Will never patronize an establishment that continues to support such disgusting habit.  Awful for families or kids.,https://www.yelp.com/biz/tgi-fridays-pearland?start=60
Annamarie K.,"Houston, TX",63,110,17,2.0,7/12/2010,The service is good here however the food is always disappointing. I haven't been back here in a while simply because of that. The last tine I was here my shrimp wasn't cooked all the way and I had to send it back. If you do end up here just stick to the drinks. Those will never disappoint.,https://www.yelp.com/biz/tgi-fridays-pearland?start=60
