Username,location,friend_count,review_count,photo_count,rating,date,review,Url
Samantha K.,"East Northport, NY",366,95,184,4.0,7/30/2017,"Went here with my family to celebrate birthdays- we're a 13-17 person group these days with kids, picky eaters, etc. My dad made reservations 24 hours before for 7pm and we all arrived at that time. We didn't end up getting to our table until 7:45, due to another large group that got there at 5pm that didn't want to leave. Whatever, I'm with my fam, so we're ok. As we got seated and took a glance at their drink/food menus, then manager brought over 4 chips and salsa platters on the house. Pretty sweet gesture for making us wait. I ordered the avocado black bean burger for my meal, which was super salty but still good. The bun was delicious, but I ended up throwing it to the side of my plate because it started to get mushy from the avocado/spicy mayo/black bean burger mess. Got a side of fries, which were warm and delicious. We got the Oreo madness dessert, which was so messy! Cookie crumbles went everywhere on the table as we were trying to cut the Oreo sandwich. The madness! Overall, the place was clean- they redid this place a few years ago and the place is now constantly packed. I knocked one star off for service. Our waitress was super sweet, but we ended up being there until almost 10pm, and we sat for 20 minutes waiting for the check after dessert. It was so crowded though, and there were people waiting to get into the restaurant when we were leaving!",https://www.yelp.com/biz/tgi-fridays-farmingville
Angelo P.,"Patchogue, NY",45,17,6,2.0,11/25/2017,I went there against my better judgement and regret the visit. My wife wanted to go so I appeased her. The appetizers were fair at best! I ordered a beer and that was warm. The bartender did offer to put some on ice for me and he was very accommodating.  The best was that an employee that just finished her shift sat next to me and was telling her friends how bad the tap beer was there. I'm not one to make a stink so we finished up and left. I will never visit this place again. I would go to Applebee's if I was in the mood for apps before going to a Friday's establishment.,https://www.yelp.com/biz/tgi-fridays-farmingville
Karena A.,"Selden, NY",0,3,,5.0,1/6/2018,We go for dinner at the bar. Julian the bartender is awesome! All the bartenders are welcoming. We haven't had a bad meal yet!!,https://www.yelp.com/biz/tgi-fridays-farmingville
Kendra H.,"Bellport, NY",101,219,499,2.0,7/17/2017,"Mediocre food. Suggested to my boyfriend that we come here because we always frequent the same chain restaurants. I have never been a huge fan of Fridays in the past so mistake on my part. I ordered a turkey burger with fries and so did my boyfriend. The turkey burger was juicy, seasoned well and overall good but nothing out of this world.  The fries were soggy and lukewarm! Also when the waitress sat our food down there was no ketchup. We asked for it and it took her a good 5 minutes to bring a bottle back to the table. We also shared a mixed drink. Can't remember the name but it was like a pina colada mixed with cherry that was delicious! I think overall where Friday's lacks for me is a substantial menu with good items and customer service. Our waitress was very blah. I will not return!",https://www.yelp.com/biz/tgi-fridays-farmingville
Tina P.,"Selden, NY",0,1,,2.0,1/1/2018,"I love Friday's food, however on New Year's eve i went into this Friday's to pick up food, It was Busy and I was expecting it to be a bit slow. It took 45 minutes in order for me to get my food & then once I arrived to my destination, I received the wrong order of wings ( I ordered Jack Daniels and received buffalo) and my Cajun chicken pasta had Hair in it. I also asked for no shrimp in the pasta due to an allergy to the shrimp but they put the shrimp in anyway. I called to let the manager know because I couldn't make it back to the restaurant due to the fact I drove a half an hour away to my location. I called 2x and there was no answer and when I called back the next day (today) the manager hung up on me. Worst experience at this location, however the to-go girl was great and extremely sweet.",https://www.yelp.com/biz/tgi-fridays-farmingville
R R.,"Mount Sinai, NY",0,26,,2.0,11/20/2017,"Party of 4 sat at the bar for drinks and apps.i usually shy away from tap beer because these chain restaurants sometimes don't clean the lines as often as they should.Their bottle beer selection is lacking so I ordered a Stella on tap.I got a whiff of rotten egg on every sip.When I told the bartender she knew exactly  which beer I had before I told her(she didn't serve it to me).We had wings,mozz.stks,wonton and Brussels sprouts.3 out of 4 were ehh.",https://www.yelp.com/biz/tgi-fridays-farmingville
Tara M.,"Setauket- East Setauket, NY",262,232,239,3.0,1/11/2017,3 stars for inconsistency  I come here from time to time for late night food with friends.  Sometimes the service good other nights it's absolutely horrible. I was sparked to write this review after a friend and I visited last night for late night endless apps.  The dining room was closed so we sat in the bar area and it seemed as if there was just one server for the entire area (plus the bartender.) It took us 30 minutes just to get our first beer and the apps were another 30 minutes.    We ended up staying there for almost 2 hours! Completely insane.  Like I stated though there have been other times where the service is great and my food (by fridays fast food chain restaurant style) has always been good and never messed up. They also have reasonably priced fun mixed drinks.  Probably won't be back though after the disaster last night. I'm kinda just over it.,https://www.yelp.com/biz/tgi-fridays-farmingville
Erin M.,"Medford, NY",0,3,1,5.0,12/1/2017,"This is the best TGIF I've ever come to (come here all the time)! The food is so good (everything we have ever tried from the wings, burgers to the dinners)! This particular location has been beautifully updated and has such an inviting atmosphere! The staff is awesome too ...including our fun day time bartender we love ...and best of all, their rewards program is SO worth it! You have no idea how many meals or apps you get free just for coming after singing up!!! You always get chips n salsa as a start just for being a rewards member! And they are delicious! Definitely home made chips! They also have delicious Cab Sav and for only 8.99 for a 9 oz glass! SCORE! That's why I'm a regular at this location !! I give it an A+++++!!!",https://www.yelp.com/biz/tgi-fridays-farmingville
Genie M.,"Brooklyn, NY",67,291,901,4.0,1/9/2017,"Much respect to our waiter Juan. We had a party of 23. Juan took orders, Brought drinks and sides, made suggestions and took family photos. Great job. The food was good. Tomato basil soup exceptional. The salad was too goopy. I wish they would have asked if I wanted dressing on the side. We had just come from a funeral, so I totally forgot. Bathroom was very clean.",https://www.yelp.com/biz/tgi-fridays-farmingville
Kimmy A.,"Selden, NY",84,35,206,5.0,4/7/2017,Love the decor they redecorated the place and it looks awesome from their last Reno. It's very trendy now they offer live music on fridays and lip synch battles on Saturday's I love the jack daniels chicken appetizer. I always get it as a meal with mashed potatoes because it's enough to fill me up. My waiter was super friendly and attentive.,https://www.yelp.com/biz/tgi-fridays-farmingville
Judy E.,"West Babylon, NY",6,58,30,4.0,5/6/2017,"Food was very good, but the noise level was sooo loud.   So happy we had some decent conversation before the crowds came    I wanted a margarita, and I fund it annoying to have no prices (except the happy hour ones ) in the menu for drinks.  The helpful waitress found out the price for me.  Why no prices??   Drink was big and strong enough.  I ordered the new BBQ chicken salad and it was delicious.  Full of so many things and big serving   Hubby's burger was good and I heard no complaints from the other couple with salad and shrimp wrap.   Service was good and we were there a few hours and were not rushed out.",https://www.yelp.com/biz/tgi-fridays-farmingville
Michelle B.,"East Patchogue, NY",56,3,,2.0,12/8/2017,"Basic boring and nothing special, but i my steak was okay so i guess i enjoyed it my waitress Amy did a great job very personable",https://www.yelp.com/biz/tgi-fridays-farmingville
Zain S.,"Mastic, NY",2,29,5,5.0,5/24/2017,"I go to this TGIF location often and I haven't been disappointed with the fantastic customer service they give. There's a waiter named Brandon (sorry if I spell it wrong) but he's great! I was there last night and I got him as my waiter and he took care of us very very well! I also came a few nights ago and received him as well and recognized him and he's awesome. I requested if he was able to put on the basketball game and 10 minutes later the game was up. I truly enjoyed not only the food, but the environment as well! Good job guys, keep it up!  - Happy Camper",https://www.yelp.com/biz/tgi-fridays-farmingville
Sa R.,"Medford, NY",50,2,,1.0,8/6/2017,Waiter Rob is great. The bartender on the other hand horrible can't even pour the right beer for us twice. Asked him what he was pouring and got defensive and nasty. Not good customer service at all!,https://www.yelp.com/biz/tgi-fridays-farmingville
Erik D.,"Medford, NY",229,131,20,2.0,3/25/2016,"I can tell you now. This ""new"" Fridays? they tried wayyyy to hard to be ""trendy"". That useless lounge... took away a great eating area. The mirrors everywhere? I sat down, instantly was like :whoa: ""who's that ugly chap?"" ended up just being me. This is Fridays... not The Brookhaven Fair Fun House.   Sort of disappointed on the whole service there too. Again.. These new iPads? I guess the good ole pen and paper is ""so yesterday"" ? In fact I felt like the waiter stared at it.. didn't make the ordering process pleasurable. Kinda felt like I was talking to someone sitting on their cellphone. I felt like I was suppose to sit on my phone and just SnapChat him my order. The wait for food was borderline tragic. YES the food was hot upon delivery... however I shouldn't be waiting 35mins for a few Pretzel sticks with Dipping Cheese. Rest of my party got boneless wings and the other got a burger. Shouldn't be that long I feel. It wasn't like we were ordering well done steaks or anything of the sort.  My friends and I were all disappointed actually. We like the place this used to be. We would have tho's meet up's here all the time before the renovation happened. This new ""Hipster, iPad'd, trendy 'hey hang out in my rad new lounge' eatery"" has to stop...",https://www.yelp.com/biz/tgi-fridays-farmingville
rich m.,"Riverhead, NY",1,4,,2.0,11/28/2017,"Fridays is usually a good bet for fast food in a sit down setting. But this location has gone way downhill.  Service is generally good, but the new manager is not with it. My biggest complaint involves the coupons they send to my house every few months, which entitle me to half off a second entree, or 20% off my entire check. Normally the staff would take the coupon and apply it, no questions asked. But this last visit, the waitress was new, so she brought the coupon to the manager. She came back and told me her manager said I couldn't use the coupon because I ordered from the lunch menu. Duh. It was 1:00 pm! I told her the manager was wrong. The manger did not come to the table. The meal came and I again told the waitress that the manager was in error. She took the coupon a second time, and came back saying the manager agreed to take off a dollar and change. This, after we had ordered two lunches and beverages for over twenty dollars. 20% would have been over $4.00; and half off an entree, even more. I complained once more. At no point did the manager come to the table. I was so miffed that I wrote to Fridays via their website. And you know what happened?Nothing. Not even a reply. Bad for Fridays in general. But this location is off my list from now on.",https://www.yelp.com/biz/tgi-fridays-farmingville
Sara O.,"Patchogue, NY",0,1,,1.0,1/2/2017,"Just stopped by to say that I will no longer be eating here. If I decide to explain further, I will revisit this review. Otherwise, I'd rather not talk about this horrific service. Update: Coming here actually ruined everyones night and now my whole family is fighting.",https://www.yelp.com/biz/tgi-fridays-farmingville
Brittany H.,"Lake Grove, NY",0,7,,5.0,3/29/2017,"Awesome staff and awesome food. The bartenders are awesome as well, funny outgoing and make great drinks. And the desserts are to die for. Can't wait to make it back for brunch",https://www.yelp.com/biz/tgi-fridays-farmingville
Doug W.,"Patchogue, NY",369,809,3184,2.0,10/16/2015,"Not bad. The saga that is Fridays... I'm not into these chain restaurants, that being said, years ago a Fridays was my home sweet home; the introduction of their Jack Daniels menu was like getting a lazy boy and a flat TV... some time passed and that chair no longer reclined... I eventually gave it another shot recently due to their awesome ""give me stripes"" member coupons, getting a dinner for two with app and drink for under 25 bucks.  Choose Fridays as your stimulus... just choose the right dishes :/",https://www.yelp.com/biz/tgi-fridays-farmingville
Rob R.,"Orlando, FL",50,15,4,1.0,4/29/2016,This place has become the biggest joke not only can get order right but now charges 49 cents for Extra sauce or dressing it's just get worst and worst service is horrible,https://www.yelp.com/biz/tgi-fridays-farmingville
Jay O.,"Danbury, CT",58,9,,5.0,1/5/2016,"I'm staying in the area for business and decided to come here for dinner and drinks. The restaurant is clean and employees seem to perform tidies whenever not helping customers. I was attended immediately and served pretty quickly too. My server, Sammie, was professional and always checking in on me during my dinner/drinks. They have a nice set up with the tables, booth and bar. The lighting is perfect, not too light and not too dim. I definitely recommend this location for anyone looking for a quick bite for a great price with great staff.",https://www.yelp.com/biz/tgi-fridays-farmingville?start=40
Danalynn D.,"Carmel, NY",24,19,7,5.0,10/17/2015,"On a Friday night waited 20 minutes and it was exactly the time we were told. Very pleased knowing. Our Server Kaila was fantastic! Checked in for our drinks often, made sure our food was ok, and she had a great pleasant demeanor! On a Saturday night what more can you ask for!!!",https://www.yelp.com/biz/tgi-fridays-farmingville?start=40
YelpBoy Y.,"Long Island, NY",3,24,1,2.0,8/10/2015,"When you order food from a TGI Fridays, you pretty much know what you're getting and that's fine. It shouldn't be terrible and it shouldn't amaze you. Where things go wrong here, is when you order ANY draft beer. After multiple times at this location, and trying different beers nearly each time, I've given up. You will not get a good draft beer here. Every draft beer is semi-flat with a skunky aroma and sour taste...and after all this time there is only one real explanation why: the draft lines in this place most likely haven't been cleaned and properly maintained in years. Doing so now would be pointless and one can only hope they replace them entirely and then maintain them correctly going forward. Go across the street to Applebee's and order a draft beer from there and you'll experience a night-and-day difference in quality: all drafts there are crisp and fresh.",https://www.yelp.com/biz/tgi-fridays-farmingville?start=40
Stephen B.,"Flushing, NY",166,299,264,3.0,8/29/2014,"They my 9 and 10 year old crayons and a kids place mat. My sons enjoyed the word search. I had the Sedona black bean burger. I enjoyed it. My youngest so always gets the chicken fingers. My 10 year old liked the wings even though they were hot, and he liked the sour lemonade. I had a Sam Adams Rebel IPA. Not my favorite IPA. The decor is formulaic. The TV had the US Open on. The service was good.",https://www.yelp.com/biz/tgi-fridays-farmingville?start=40
Rashid M.,"New York, NY",1098,933,574,2.0,7/6/2012,"Normally I like Friday's because of their cheap food. I'm not a huge fan of them, but there are a couple of dishes on their menu that I enjoy. This location is very, very slow. I've been here a couple of times, and both times the wait to be seated was very long. The food is not the same quality as their other location. I've tried their Cajun Chicken and Shrimp pasta many times, and it just didn't taste good here.  The new decor is nice, that's why I'm giving it 2 stars.",https://www.yelp.com/biz/tgi-fridays-farmingville?start=40
Brandi P.,"Coram, NY",48,4,2,1.0,10/10/2015,"This was the 2nd most ridiculous dining experience I've had. I came here to enjoy endless appetizer with my boyfriend and an entree. I sat down and the first server that came to my table wasn't my server and took my drink order. The 2ND person who came to my table wasn't my server either but he informed me he took my actual server's card for their order tablet to make it seem like she was working all her tables. As we ordered the appetizer and told the server we were going to share we were informed we would be charged a total of $24 for them if we even dared to share them. The reason for this is because corporate has gotten very upset that people coming to their restaurant dare to share appetizers which last time I checked are something normally shared. So we just ordered the entrees because it's crazy that the appetizers add up to the cost of our entrees combined. My server finally came over and apologized for us not seeing her until then. We only so her twice after that, to give us the food and to then give us the check. To end our night my boyfriend went to the bathroom before we left and they don't even have a sink. This was a terrible experience with a disgusting end.",https://www.yelp.com/biz/tgi-fridays-farmingville?start=40
Robin G.,"Yonkers, NY",0,13,10,4.0,1/18/2015,Wonderful service by Matt! Our son (autistic) felt comfortable - ate salad and his fries!! Makes us want to go home (Westchester County) and patronize TGIs!,https://www.yelp.com/biz/tgi-fridays-farmingville?start=40
Bee B.,"Holtsville, NY",6,31,12,3.0,12/28/2014,"Understaffed for this time of evening. Bartender, Lindsey, running the show. Everyone else is in slow motion.",https://www.yelp.com/biz/tgi-fridays-farmingville?start=40
Ralph R.,"Town of Brookhaven, Long Island, NY",76,43,4,1.0,7/23/2014,Good lord this place is nauseating!!! I went with my girlfriend and the both of us could not be more disgusted with the food. I ordered a simple cheese burger with a side of Mac n cheese and what I got in return was a unidentifiable piece of meat sandwiched between two round stale pieces of bread! The Mac n cheese came in this fancy dish that gave the impression that it was going to be the item that saves the day but once again TGIF does it again. The Mac n cheese was so burnt I had to use my knife to cut through it..And for my girlfriends she ordered a turkey burger that was so revolting it made eating a piece of dirt better... The only thing that was good was the service,https://www.yelp.com/biz/tgi-fridays-farmingville?start=40
David O.,"Farmingville, NY",27,25,3,1.0,11/25/2013,"Friday's has half price apps on Sundays so we figured - what could go wrong? Well we ordered the Tuscan flat bread, which was cold when it arrived at our table but we didn't complain about it. My son ordered  buffalo wings, they were so shriveled and dry that we sent them back. The new order came out and it was fine. When the check came, we were charged full price for the apps (You'd think that a restaurant the size of Friday's would have the half price deal in their system already). Anyway, we pointed it out to the server who apologized and took the check back. We then waited for another ten minutes before we finally got the corrected check. Not sure if we'll be going back there anytime soon.",https://www.yelp.com/biz/tgi-fridays-farmingville?start=40
Lori M.,"Medford, NY",37,53,28,3.0,8/2/2015,"chewy steak, burgers are good, appetizers are ok. all in all id say go for the burgers stay away from the steaks",https://www.yelp.com/biz/tgi-fridays-farmingville?start=40
Stevie G.,"Coram, NY",23,28,11,4.0,1/26/2013,"Not sure why everyone is leaving poor reviews, I have read them but don't see the issues discussed.  From the hostess greeting you at the door to the door being opened as you leave you are sure to have a great experience. The revamped menu is a nice change of pace, these type of places can be slow but if you have a time limit no matter where I have gone I always found it beneficial to let your server know that you are in a rush thus setting the expectation and more importantly giving the server the chance to suggest what you might order or not order along with the possible -everyone is out and it is going to be a long time- (like they ever say that).  Also if you are in that quick of a rush sit in or at the bar you will get served faster or so it always seems, plus you can watch something on the 8 or so TV's. The selection of beers on tap in my observations seems to satisfy the beer drinkers.  The bartenders know how to make all the latest drinks and old standards never witnessed them stumped. They have during happy hour, drink specials and 1/2 price appetizers.  The NEW BBQ Chicken Flatbread appetizer is awesome and almost a meal onto itself. The staff all appear to really like what they are doing and have a true desire to want to help you have a good time.  Management is very active on the floor and watching to make sure guests are being taken care of.  The bartenders are a great mix of people, friendly, fast and quick with conversation. As with these types of chains you get as my Yelper friend ""Beth L"" would say; YAMBAGS - that come in with expired coupons, asking for hot water to wash the utensils, taking forever and ever and ever to figure out what they want only to change it and on top of everything else complaining about some fictions issue just because they know these companies will ""satisfy"" the guest. Be assured go in, order up a drink and some food and you will find its not the ""horrible"" place its made out to be.  Oh and if you see Craig or Kensie the managers or you sit at the bar with Tom or Angela tell them that Stevie G said HI.",https://www.yelp.com/biz/tgi-fridays-farmingville?start=40
Nicole M.,"Coram, NY",0,23,6,4.0,9/27/2014,"The servers are friendly and service is good, but they could stand to be a little quicker! The burgers and wings are really good. And without question the appetizers & drinks are a hit! I'll be back and hopefully they'll be a little faster with the service!!",https://www.yelp.com/biz/tgi-fridays-farmingville?start=40
Courtney V.,"Southampton, NY",0,38,,3.0,1/30/2016,"I usually come in for take out order on fridays or saturdays.  The food is really good and consistent.  But consistenly wrong when picking up order.  You say no onions you get onions you ask for mayo you get you no mayo.  So I will go again and hope that they get it right.  I am way to polite to check order at the bar when clearly they are busy, but would like it correct next time.",https://www.yelp.com/biz/tgi-fridays-farmingville?start=40
Mike M.,"Miller Place, NY",50,7,3,5.0,7/23/2014,I must recommend come here all though Google has the wrong hours posted its all good they do close at 1am on week day nigjts (mon-thurs) but i did go in after a tough day and eving and night of work (fml) and sat at the bar thinkn that they were open till 1:30am and low n behold they close at 1am but that didnt stop the two bartenders from being extremely acomidaten. I was very suprised n i did order even though i was against it the food was great n the srtvice was better,https://www.yelp.com/biz/tgi-fridays-farmingville?start=40
Brittany D.,"Syosset, NY",0,17,1,4.0,8/15/2014,My waitress was very accommodating with my gluten allergy. I don't remember her name but she was really nice and patient with my questions about the menu.  It was relief for once to have a waitress who was confident about the food items on the menu and knew which items were completely gluten free.,https://www.yelp.com/biz/tgi-fridays-farmingville?start=40
