Username,location,friend_count,review_count,photo_count,rating,date,review,Url
T B.,"Portland, OR",0,7,17,1.0,9/11/2016,"Who is the Bone Head that ruined the Patio?!  We like the Red Robin Chain. Each member of our family has their favorite burger. We're addicted to the fry sauce. Our server today Jeffery was fantabulous. Very attentive and took good care of us. Our drinks were not allowed to run dry nor were our bottomless fries. Red Robin Restaurants however; are loud. Because of the decor, the din of other diners makes it hard to hear your dining companions talk. We found the perfect solution with the Mall 205 location's secluded patio. The patio sits right off the bar and was a true hidden gem. It HAD full grown shrubbery that let the breeze through yet gave ample shade for the hottest day. The shrubbery provided privacy from the traffic on Washington street and the Mall 205 parking lot. Imagine our horror today to find the patio devoid of any shade or privacy. Yeah, that's exactly what we want, to see and hear all the utility trailers from Home Depot clanking past us while we eat. This is a good example if ""If it ain't broke don't fix it"". Had the idiot who came up with this idea asked staff who had been there awhile, I bet they would have advised not to mess with it. But, as with most organizations, management rarely consults with the front line workers who actually do the work. Not having a secluded, shaded, summer time patio is A DEAL BREAKER Red Robin. We won't be back any time soon. You'll get us back when some privacy screening and shade are back in place. You'll get more stars too.",https://www.yelp.com/biz/red-robin-gourmet-burgers-portland-3
Sharon P.,"Lents, Portland, OR",30,22,,1.0,11/10/2017,"Waited 15 min to get seated.  Seated and no one came to take our orders.   Waited like 10 min and finally asked someone to help us.  Ordered a turkey burger, terrible.  Tasted like a hot dog.   Food here s so expensive and bland.  No taste.  Disappointed at $60 later.",https://www.yelp.com/biz/red-robin-gourmet-burgers-portland-3
Steve B.,"Portland, OR",0,2,,1.0,11/19/2017,"If I could give this place negative five stars, I would.  What should of been a simple online to-go order turned into one of the most frustrating experiences I've ever had at a restaurant. In the past, there was a sign near the bar for To Go orders at this Red Robin. Now there is a separate table out front. The problem is nobody seems to be staffing this table. Eventually the hostess came over and asked if I'd been helped, and I said no. She went to get someone from the back who then came out and asked for my name on the order. She went and looked and said that no order came in. This was the start of what would be a very long back and forth I had with multiple employees. I was asked if I could of sent it somewhere else and I said no, I made the online order for this location, with a set pickup time, 100% sure of that. At that point the employee asked what I had ordered and I told her, and she wrote it down, saying they would have to place it manually. After doing this, however, she asked me if I was SURE that I sent the order to the Red Robin on Washington Street. I replied that I'm looking at the order on my phone, and it specifically says the Mall 205 Red Robin. At this point I was getting annoyed and I said I can show you the email on my phone or give you the order number, and she barked no at me and went to go pawn me off on another employee Another woman came out this time who was a little nicer, but once again I was asked if I submitted the order to another location, and I gave the same response.  At this point I asked to speak to whoever the manager is, because apparently I'm not doing a good enough job communicating. Finally, a guy in a suit came out who introduced himself as an assistant manager.  Once again I was asked if I was sure if I submitted the order here, and by this time I was pissed. I came here with a small 2 year old child in tow to quickly pick up a caesar wrap and a kids chicken sticks, and here I am being bombarded with questions on am I sure I placed the order correctly, all the while trying to be a decent parent and entertain a 2 year old. I once again offered to show the email with my order information. The assistant manager went into the back and apparently produced an email they received showing there was an error with my order.  He said the issue was that the error email came in 15 minutes before the pick up time, that they aren't in the back sitting around monitoring emails all the time. I replied neither am I, and I'd already left my house by the time any email would of arrived to me. I was told its a ""technical error"" that happens about once a month, that its not really their fault, and it just sucks that it happened to me. I was asked if I still wanted to order my food. At this point my jaw dropped because an employee had come out and written down the order manually, and I assumed my order would already be going. I mentioned that and he made a comment about not knowing if I really wanted the food, so it hadn't been started. I'm chasing around a fussy two year old and have been here a half hour now, so yeah, I probably do want it. I told him that was ridiculous and I want the name of his manager. I was given a card with a name on it that said assistant general manager but that they aren't in until tomorrow, told me he would take 15% off my order, then slipped away to the back before I could even respond.  I don't know if this person is actually his manager, but it wouldn't surprise me if he tried to dump me on his weekday equivalent. This has very little to do with money to me, as it was just a simple $15 order. The staff could of apologized for the error, offer to take half off the total, make it a priority and whip the order out in 10 minutes. In the end, it took well over an hour to get what should of been a very simple order. I had a two year old child that was running around with poopy pants because it took so long, that wanted no part of waiting around. There was no apology, no taking responsibility by the staff, even worse having multiple employees trying to blame me for the mistake. Most of the employees I interacted with showed little to no professionalism what-so-ever, and its clear this place has gone downhill even faster than I thought. I've never had staff attack me like this and try to blame me for something that was clearly an error on the Red Robin end. I've dined in here before at this location and seen mistakes happen, but the staff at least made an effort to make it right in the past. This time, however, that didn't occur. After all was said and done, I got a pathetic looking caesar wrap that barely had any meat in it, and two of the smallest orders of fries I've ever seen from here which were already cold by the time I even got in the car. I'll be escalating this up as far as I can up the ladder until I reach someone who actually understands customer service, and that this location has some serious problems that need to be looked at and dealt with.",https://www.yelp.com/biz/red-robin-gourmet-burgers-portland-3
Jesse D.,"Portland, OR",3,14,,5.0,8/18/2017,"Came here and got the big siracha burger. Our server whitney was the best. She was on top of her game. Checked up on us every couple minutes, she even made sure our water and fries were never empty. Her service gave this place a 5/5 for me",https://www.yelp.com/biz/red-robin-gourmet-burgers-portland-3
Jennifer W.,"Portland, OR",13,4,,2.0,8/26/2017,"I really like the food so we seem to go back even though we never get good service. This last time was it for us, the service is so bad its almost laughable. We will probably still go to Red Robin just stick to the Clackamas location.",https://www.yelp.com/biz/red-robin-gourmet-burgers-portland-3
Rachel D.,"Portland, OR",17,120,116,3.0,10/21/2015,"I'm not a huge fan of Red Robin trying to be a 'fancy' burger place. I liked their whole, basket/burger/fries ambience. Their prices have gone up, quality and quantity has gone down, and everytime I go there their service is less than great. Now they give you a small tin O of fries (which are still bottomless) but try getting extra fries takes about the time it takes to finish your whole meal.  My horrible experiences are greater than the positive ones, but I still love the taste of their food so ill definitely keep going back. This last time our waiter (Cam) was very nice and helpful. My friend ordered the wrong thing (pointed but said 2 different thing) and he offered to take it back and fix it, then came back and APOLOGIZED for OUR mistake! Which was really cool of him to do since it wasn't his fault at all #hegetsatip",https://www.yelp.com/biz/red-robin-gourmet-burgers-portland-3
James D. H.,"Portland, OR",273,416,688,2.0,5/18/2014,"My friend took me here. I never eat here on my own but they have a certain charm. Not a big fan of their burger but I am a fan of Blue Cheese. So I had the Blue Ribbon Burger with Extra Cheese. Not bad. But I also wont be going out of my way to eat here. The place gets busy and is a little loud.  Be careful when an employee is near as they don't really look where they are going.  Lucky for me, I work in a restaurant and know how to dodge, duck, dive and dodge.",https://www.yelp.com/biz/red-robin-gourmet-burgers-portland-3?start=40
Viktor K.,"Portland, OR",9,70,23,2.0,4/25/2014,Burger was greasy and they forgot onions. The patty was bland without taste. Server Connor ran off before I finished my sentence. Stingy on napkins. Slow to refill the decent fries.   I ordered a premium burger and got a McDonalds taste. I've had much better for half the price.  Parking is backwards.  Want a good burger? Go to Five Guys.,https://www.yelp.com/biz/red-robin-gourmet-burgers-portland-3?start=40
Jay S.,"Portland, OR",10,23,,5.0,8/11/2015,I went to red robin on July 17th with a friend of mine we had the best meal And great service on a busy Friday night,https://www.yelp.com/biz/red-robin-gourmet-burgers-portland-3?start=40
Ian C.,"Portland, OR",52,24,27,2.0,10/12/2014,Order fish n chips and a bloody margarita Margarita was not made properly to spicy and not good tasting. Took 45 mins for food to come and my fries and shrimp was cold and moist. Never again.,https://www.yelp.com/biz/red-robin-gourmet-burgers-portland-3?start=40
Stefanie W.,"Portland, OR",18,3,,5.0,9/14/2016,"I generally order for the whole office, usually only takes 15 minutes for the whole order which is awesome! Parking is very convenient. When I get there, they always remember my name. Great place to eat! Thanks for the good service.",https://www.yelp.com/biz/red-robin-gourmet-burgers-portland-3?start=40
Jim A.,"Portland, OR",0,13,10,3.0,1/16/2016,Things have changed since I was hear last . tried the Tavern Burger and last hear had the Royal Red Robin was unable to put my hand around the burger but the Tavern Burger ( burger )has shrunk to cut costs and bottom fries where in basket.,https://www.yelp.com/biz/red-robin-gourmet-burgers-portland-3?start=40
Julie W.,"Happy Valley, OR",0,8,2,2.0,2/28/2016,Okay I don't know what's going on with RR anymore. They are trying to be something different. Their bacon is the microwaved kind with no flavor. The fries weren't very hot and haven't been the last couple times. I don't know why I even come. I only go if friends with no taste want to come. The service was alright. But not stellar by any means.,https://www.yelp.com/biz/red-robin-gourmet-burgers-portland-3?start=40
Riley P.,"Los Osos, CA",48,95,167,3.0,11/14/2015,"Adequate but not fabulous... Our waiter was nice but seemed very overwhelmed... Got a chicken sandwich with a gluten free bun. THE BUN WAS NOT GOOD!!!! Sooooo dry and hard I couldn't even eat it... I asked for no mayo cause it's gross and there was mayo... Fries were yummy of course and so was the margarita, but if you're going to offer a gluten free bun, it should be good enough to serve as a substitution.. Not make it an additional price for a terrible bun... I mean hockey puck.",https://www.yelp.com/biz/red-robin-gourmet-burgers-portland-3?start=40
Elle S.,"Portland, OR",0,24,,1.0,7/5/2016,"Worst red robin experience ever. Got takeout, our order was missing an item so went back to ask for it. They rushed it and it was poorly made they offered extra fries, but never gave them to us. We got our (cold after waiting) food home to find that they had only given us 5 fries in our boxes. Since when is red robin SO stingy on fries?!",https://www.yelp.com/biz/red-robin-gourmet-burgers-portland-3?start=40
Jeff R.,"Portland, OR",106,48,51,3.0,10/17/2015,"I got the California chicken burger with bacon which is my usual & it's always good. Love the sweet potatoes fries, but I wish they gave you bigger portions so you didn't have to wait so long for a refill. Staff is usually pretty good too.",https://www.yelp.com/biz/red-robin-gourmet-burgers-portland-3?start=40
P N.,"Portland, OR",0,14,30,2.0,11/14/2015,We enjoy Red Robin but our experience at this location was less than impressive.  While the food and service were good the place is in disrepair.  The women's restroom had born soap dispensers broken with only one of them functioning.  Toilet paper roll was hung from hook on stall door because holder was broken.  Paper towel holder also broken.    These seem like cheap and easy fixes.  Are they that cheap they can't put a few bucks into the space?  Especially when hygiene should be a high priority in a restaurant,https://www.yelp.com/biz/red-robin-gourmet-burgers-portland-3?start=40
Jenn T.,"Redlands, CA",900,940,162,3.0,10/8/2012,"I'm a true fan of red robin always!  But this location was a little bit lacking in the service department.  I ordered a baja wrap, which a whiles back in college, was a wrap.  However, the waiter gave me a BLT burger, which I sent back.  Then a baja sandwich came out and by then I was fed up.  I simply went with it, but I was not satisfied and definitely didn't get what I appetite wanted.  However, maybe it was a miscommunication on my part and they dont make that wrap anymore, so I'm not blaming the waiter.  Simply he could have handled it with less attitude. Otherwise, I love red robin!",https://www.yelp.com/biz/red-robin-gourmet-burgers-portland-3?start=40
Samantha R.,"Salem, OR",21,46,3,4.0,9/7/2014,"My first time at a Red Robin and I have to say it was damn good. We ordered a Chophouse and a Burnin' Love and they were both very tasty. The fries are good. I'm not usually a fan of the ""steak"" cut but these were perfectly cooked, hot and fresh tasting. There is a little menu of dipping sauces that cost 50 cents each and we had the roasted garlic and the green chile varieties. Nothing beats ketchup, but these were a nice break when you're devouring bottomless fries. Our server was attentive and above average for a fast-casual place. We heard the server behind us relentlessly trying to upsell his customers - he obviously took all the corporate training very seriously- but ours was always there when needed and never intrusive and got an above average tip for it.  Sit in the bar for a pleasant screaming kid - free area. There seemed to be a lot of screaming kids coming in and we were glad they offered us the respite of the bar to eat in. Take that, McDonalds!  Of course if you have screaming kids you will feel very welcome here. Lunch for 2 - 2 burgers and 1 drink ( I just had water) and a couple of dipping sauces was a little over 25.00 bucks which seems like a solid value. I'll definitely be going back.",https://www.yelp.com/biz/red-robin-gourmet-burgers-portland-3?start=40
Eliza Jane H.,"Portland, OR",0,28,6,1.0,12/2/2015,"I haven't been to Red Robin in two years because I was disappointed in the quality of service and food I got. Thanks for not surprising me Red Robin! Once again, the food was terrible and the service sucked. Now they have remodeled the place and these stupid lil computers are on each table. Thanks for ruining family conversation Red Robin! One of my kids bought a game I didn't even know they were selling games !!!! So beware of the extra expense on your bill! The quality of the food has gone wayyyy down I thought I had stepped into a Denny's. The cheesy fries with bacon came out with two American cheese slices semi melted just topped on the fries the bacon they forgot and then just brought out separately. Seriously??? Who puts American cheese slices on cheesy fries???? Can you say middle school cafeteria?!  The Chicken salads that were ordered were also poor quality, lettuce not fresh, old fried bits of jalapeño warmed up, gross chicken breast that had a weird watery texture. Nope! Spent too much money for crap food and bad service . I didn't even get into that piece of the review but suffice to say that on a night where the restaurant is Empty you expect attention to detail and speediness. Red Robin failed on so many levels!!! Never going back to this over priced 1 star restaurant ! I could get better food at a Fast Food joint.",https://www.yelp.com/biz/red-robin-gourmet-burgers-portland-3?start=40
Amber H.,"Portland, OR",5,36,40,2.0,7/30/2015,"Food was good but they don't bring out fries when u order ur meal anymore she said it just changed so customers would order appetizers so it's not really bottomless. I also had to wait for long periods of time for refills and more fries, they didn't bring napkins. Service was slow not happy",https://www.yelp.com/biz/red-robin-gourmet-burgers-portland-3?start=40
Sandi S.,"Portland, OR",0,4,,1.0,11/1/2015,"Complete disaster. Stopped by three days prior to holding a large group gathering to warn them. They do not take reservations, but said they appreciated the heads up. We called at 1:30 the day of to remind them again of our group of 18 coming in a an hour. We all arrived and let them know we were all present. We didn't get seated for over an hour and they were not busy. They had plenty of space. Finally got seated and our waitress was fabulous, but the manager was no help. Put a huge damper on my daughter's birthday. She not once helped us. Never going back to this location.",https://www.yelp.com/biz/red-robin-gourmet-burgers-portland-3?start=40
Myranda M.,"Portland, OR",11,23,5,3.0,4/3/2014,"Kind of your typical chain burger restaurant.  The salads are quite yummy tho. The burgers satisfy that grease craving you have and they deliver fries in a lovely little bucket so you don't feel like you're going to over eat them.  I give a 3 star though because the service just sucks. They take a while to notice you're at the door, and we'd have to wait nearly 20 minutes in between each time trying to catch our waitress. Decent alcohol selections tho. So all in all if you want a typial slacky chain restaurant this is the place for you!",https://www.yelp.com/biz/red-robin-gourmet-burgers-portland-3?start=40
Melissa P.,"Portland, OR",10,5,,1.0,11/8/2014,"If I could give negative stars, I would. My family actually ate at this Red Robin multiple times every single week without incident up until tonight. I don't see us EVER returning after the DISGUSTING way that we were treated by the management. We were sitting at our table awaiting our food when the child from the table next to us pounded on our table with both fists.  We were surprised and not happy as we have a 4 and 6 year old who are not permitted to behave that way.  The mother of the child began making comments about how WE HAD A PROBLEM until we finally asked her to stop.  It was impossible to ignore as their table was only about 14-16 inches away from ours.  I asked this woman at least 6 times to just quit talking to me and she called me an obscene name in front of my two small children (as well as her own.)  Both my partner and I said ""Are you kidding?  We have kids sitting here! Just stop talking to us.  Leave us alone!"" This is where Red Robin management really had a chance to shine.  Roger, apparently the manager on duty, approached our tables and without even pausing to find out what was going on told us we need to immediately stop talking.  Yes, just stop talking.  After I was verbally assaulted, called names and harassed in their restaurant, I had every reason to be upset.  My 6 yr old was in tears and visibly very distressed.  Upon his approach, I tried to explain to Roger what had transpired and he actually SNEERED and said, ""Good for you. Now stop talking."" Obviously we decided to leave.  We were basically attacked at our table then the manager comes over and joins in on it??? To add insult to injury, some other person who knew the offensive couple rushed after me as I left and actually grabbed my arm and hissed insults at me while I held my4 year old.  Thanks Red Robin.  I feel so safe in your restaurant after being both verbally and physically attacked.  If Roger wasn't such a dismissive, contemptuous individual I wouldn't blame Red Robin at all, but the response to what happened to me as a regular, frequent patron and HUMAN BEING is beyond unacceptable and ridiculous.  This manager has no business dealing with the public and should be immediately dismissed.BOOOOOOO, Red Robin. If you have kids/family, value your safety and/or expect to be treated with respect as a paying customer DO NOT VISIT THIS RED ROBIN. TWO THUMBS DOWN. UPDATE: I stand by my review and have been contacted by Red Robin with an offer of a gc...But disturbingly I have also been contacted multiple times by the bully who chased me into the lobby.  I received several abusive messages before I blocked him.  It is actually very scary as well as sad.  I am entitled to share my experience here on yelp as I have done.",https://www.yelp.com/biz/red-robin-gourmet-burgers-portland-3?start=40
Zach M.,"Portland, OR",61,3,,1.0,1/30/2015,"My wife went to this Red Robin with a group of co-workers. The service was very slow and she got her meal long before some of her co-workers. She had already finished her meal by the time her boss was served his, a bowl of soup. As he finished his soup, he found a band-aid in the bottom of the bowl. This experience has understandably put my wife off of restaurants.",https://www.yelp.com/biz/red-robin-gourmet-burgers-portland-3?start=40
Jessica H.,"Portland, OR",4,5,,1.0,1/21/2015,"Good lord, what happened to this place? I expected that good food and service would come with the remodel but I think not. My crew and I came in here on the 18th of January to celebrate a birthday. We sat in the bar area and ordered burgers, chili, and fish n chips. Now, I NEVER experienced bad service or food here before so this visit shocked me, especially on a night where it was someone's birthday. Burgers were bland, the fish tasted odd, the tartar sauce tasted like ranch, even the mouth watering steak fries here tasted funny. The server we had also seemed like he had a bad night, since he never smiled. And why did you get rid of those booths in the bar? I actually liked being able to kick back and relax while drinking.  All in all, I would probably not come back to this place again.",https://www.yelp.com/biz/red-robin-gourmet-burgers-portland-3?start=40
MaryBeth D.,"Beaverton, OR",96,103,2,5.0,12/27/2012,Our waitress was so forgiving in the fact that we had to wait for the rest of our party to arrive. She would check in just to make sure we didn't anything while we waited.,https://www.yelp.com/biz/red-robin-gourmet-burgers-portland-3?start=80
tristan p.,"Portland, OR",6,46,,4.0,3/9/2011,It's a guilty pleasure of mine and a great place for a test date. If a girl stays with you after a trip to Dead Robin she's probably pretty legit. Or white trash.,https://www.yelp.com/biz/red-robin-gourmet-burgers-portland-3?start=80
Al M.,"St. Louis, MO",5,181,141,1.0,11/6/2010,"Nasty, nasty, nasty. I'll pass over the fact that they still trot out the tired old corporate lie ""we can't do a rare burger because it's against the law,"" but their food is uniformly underwhelming. Actually, I won't pass over it. At least say something like ""our corporate lawyers told us it's safer to sell crap for food so that's what we do."" Just blatantly lying to my face isn't going to impress me at all. But the food itself isn't good. It's passable, in the way that there are calories in it (an embarrassment of them actually), and there is a component of taste, but it's way overpowered by the wave of grease and equally greasy staff. It's essentially an overpriced McDonalds; I'll just go there in the future when I want crappy junk food.",https://www.yelp.com/biz/red-robin-gourmet-burgers-portland-3?start=80
H W.,"Clackamas, OR",0,3,,1.0,12/7/2015,"My dad and I went in to the mall 205 location on 12/6/15 around 4 pm. first off it wasn't busy, yet no one was at the front to seat us for about 5 min. then when the waitress finally took our order it took 10 min to bring our sodas, that were watered down. then the food came out and i very clearly said ""no mayo"" iv never eaten it so i always say that. well there was some on there. so they took it back, while my dad let his food get cold waiting for mine to come out again he notused that his plate was disgustingly dirty with a greasy build up. he just asked that they put his food on a clean plate. they came out and just wiped off the edges. my food then came back out and AGAIN there was mayo! so i got a different waiter and he took it back once more. at this time we also haven't had a refill since we've been there. finally my burger came out correct COLD but no mayo. no manager was there at all. we have gone to the clackmas location and never had a problem. but the mall 205 was the worst experiences ever.",https://www.yelp.com/biz/red-robin-gourmet-burgers-portland-3?start=80
