Username,location,friend_count,review_count,photo_count,rating,date,review,Url
Sophy V.,"San Diego, CA",257,4,,3.0,5/12/2017,Service was great. Our server was very attentive and sweet. However the food is okay. The burger was cold and the milkshake was watery. Our brownie dessert tasted like the kind you get from a box and heat it up except ours wasn't a tad bit warm.,https://www.yelp.com/biz/red-robin-gourmet-burgers-portland-3?start=20
Tim P.,"Vancouver, WA",0,2,,1.0,8/5/2017,Unbelievably bad slooooow service by far the  Worst I have ever been to.... Numerous tables around us also had extremely slow poor service,https://www.yelp.com/biz/red-robin-gourmet-burgers-portland-3?start=20
Sabrin P.,"Portland, OR",0,2,4,5.0,9/18/2017,LOVE LOVE THIS PLACE . I go here for every occasion and the staff is always nice and very very outgoing.,https://www.yelp.com/biz/red-robin-gourmet-burgers-portland-3?start=20
Ben M.,"Renton, WA",126,12,,2.0,4/25/2017,"We went tonight around 8pm, 4 adults 3 kids. They seated us promptly but there we sat. I don't understand why, when a restaurant is not at all busy it takes forever to get service, then when we do get it our food comes out barely warm, if warm, and our server disappears after telling us they are going to bring fries for one of the kids who asked for them. They were apologetic when they returned and did realized they forgot the fries, and then brought some posts haste. I just don't get it. It's not that difficult, especially when it's not busy. If it were a Friday or Saturday night with a big crowd, then maybe I could see a delay in service and perhaps some warm food but there might have been 10 tables or less...on top of that, when I got my burger, the peppercorn burger, it looked sickened compared to the photoshopped image on the menu, not tasty looking all. I've been here before and had pretty good service and food, so this visit will not deter me from returning in the future in hopes of a better experience. When they are good, they are good!  Tbl 60 check 80977",https://www.yelp.com/biz/red-robin-gourmet-burgers-portland-3?start=20
Rick B.,"Portland, OR",7,9,,4.0,5/25/2017,"Solid menu with a good lineup of beef burgers.  Chicken offerings are very good as well. All come with bottomless fries.  Pretty consistent quality, preparation and presentation are a plus. For a change of pace, try one of their salads.  Local brews on tap.  Outdoor patio right up against Washington/Stark Street A little pricey, but overall, a pleasant dining experience with decent service and a good drink selection.",https://www.yelp.com/biz/red-robin-gourmet-burgers-portland-3?start=20
Laila S.,"Portland, OR",83,161,202,4.0,9/7/2016,"I always tend to get ""togo"" here and it's always been awesome. By the time I finish my drink at the bar, my food is up and I'm ready to go. Tasty, nice atmosphere, especially in this area of mall 205...shudder...thanks for being cool red robin",https://www.yelp.com/biz/red-robin-gourmet-burgers-portland-3?start=20
Rose E.,"Portland, OR",448,462,2334,2.0,12/15/2014,"I'm still not a fan of Red Robin and this experience was no more impressive than any other visit. I went here on the request of my daughter. There wasn't a huge wait to be seated, but the wait for service was longer than it should have been. The two tables on either side of us arrived later, but were served and left sooner than our table. We all had different servers.  Our server was friendly and personable, but the dishes were dirty. We had to send back the silverware and water glasses because there was food stuck to to them.  The food wasn't to my liking. I had the quac burger, but the quac was some frozen concoction of something like coleslaw only green. We had a chips & salsa appetizer which was about a half cup of chips that were soggy in the middle and burnt on the edges. The salsa was the consistency of having been run through a blender and tasted like it had been mixed with spaghetti sauce.  They don't offer up drink or french fry refills anymore, and didn't offer to let us order desert either.",https://www.yelp.com/biz/red-robin-gourmet-burgers-portland-3?start=20
David M.,"Portland, OR",9,3,1,1.0,3/19/2017,Waited 30 minutes to be seated 45 more to get subpar food. The manager needs his ass  whooped for allowing this location to be ran like this.,https://www.yelp.com/biz/red-robin-gourmet-burgers-portland-3?start=20
Pui S.,"Amboy, WA",240,633,11658,1.0,10/24/2015,"This was my second time at Red Robin (first time was in Southern California ---- yearssssssssss ago)! And now I remember why!!!!  A small burger with limited fries (in a small metal ring) will set you back over $10.00. Super sweet bottomless Freckled Lemonade (WHATEVER BOTTOMLESS MEANS TO THEM???), will set you back almost $5.00 and they ain't very attentive about refilling it because it happened just once. No, water was served either. Our waiter pulled a desk tablet right out of my hand, while I was looking through the menu (I still gave him 15% just because.........).  I'm pretty sure this is my last time at Red Robin. Com'on Red Robin gets your act together. :(",https://www.yelp.com/biz/red-robin-gourmet-burgers-portland-3?start=20
KeshiaSkye S.,"Boise, ID",186,195,74,4.0,1/4/2016,"Red robin is always a good go-to! With the prices of fast food these days, you may as well get Res Robin to go! We live within walking distance so we do this on occasion. Each time we've enjoyed food here, whether to go or not, the service is always stellar and the food always fresh and cooked as ordered.  We've never had a wrong to go order also, which is great!",https://www.yelp.com/biz/red-robin-gourmet-burgers-portland-3?start=20
Vinnie B.,"Portland, OR",49,281,254,1.0,8/12/2015,"""If you think bad, bad is what you get""   And I did and it was... So, my amazing Supervisor was like  ""oh hey, I want  take you guys out for lunch""  ""let's go to Red Robin""! So, we were like....ok  (But I cringed) at the thought..see, I've been here before and it was not good.  We all ordered burgers, since it's burger week or something like that..  How do you want your burger cooked ?? they asked. Here is the breakdown; Burger #1 ~  Med...it came well done Burger #2 ~  Med well...it came Med Rare* Burger #3~   Well done...came back Med Burger #4~    Med well....hey got one.  My coworker was not going to eat her Med Rare* burger and I didn't blame her for calling them over to notify the server of this. He just said  oh ok I'll take it back and fix it..we waited... And Waited..and finally we just gave up. finally we just flagged the server and told him it was  now a to go order.... No apology, nothing....it totally was the focus of Our conversation,  instead of talking about life And office stuff we festered over this..... I personally hate leaving one star reviews, but This place made it real easy...., nothing went right. Wrong orders...Bad service...No Apology. I want to say they can do better, but it won't happen on my dime.",https://www.yelp.com/biz/red-robin-gourmet-burgers-portland-3?start=20
Tim J.,"Portland, OR",12,32,,5.0,7/6/2017,"Update, haven't been to red Robin in a long time, but boy was it enjoyable. Came here on a very nice day, in a lift car, and boy was my hamburger, nice and fresh. Service was very friendly and attentive at all times, and I was asked if I needed more fries, or another refill on my drink. After I ate, I went outside to red robins nice little handicapped parking lot, and hailed my last Lyft taxi, to head home. That is one of the most beautiful things about red Robin, is that it's not just the food, and friendly service, but it's also because of the fact that they have a handicapped parking spot, and that was perfect for Lyft to park into to pick me up. So, if you have a handicapped, you are definitely in luck if you use Lyft taxi cab service to pick you up, The handicapped parking lot is so large, that lift will just pull right in, and park without a hitch. So, I just have to say, it was a very wonderful visit today here at red Robin, despite it being close to the 90s outside. Very fresh food, and awesome friendly service all around.",https://www.yelp.com/biz/red-robin-gourmet-burgers-portland-3?start=20
Susan M.,"Estacada, OR",25,7,2,2.0,1/24/2017,I love this restaurant but.... when paying for my to go order with their machine it automatically figures out your tip. It told me that a bill of $14.77 should give a tip of 20%(OK I normally do 15 but today I did 20) would be four dollars and some change. It should be $2.96.,https://www.yelp.com/biz/red-robin-gourmet-burgers-portland-3?start=20
Kennedy B.,"Portland, OR",0,3,,1.0,7/25/2017,"Our server, Ashley, ruined this place for my friends and I. She spent 15 minutes of her time chatting it up with a couple of guys behind us while she forgot our sauce and my friends side. My friend waited to eat her food while she just stood there and chatted. We even rang the call server button and we still waited an extra 10 minutes. Worst service. I was just baffled that she prioritized chatting for 20 minutes over actually helping us. We'll be going to the Gresham location for now on.",https://www.yelp.com/biz/red-robin-gourmet-burgers-portland-3?start=20
Ken W.,"San Francisco, CA",120,185,1068,2.0,4/28/2014,"The service at this location was pretty poor. It took a while for my group of 3 to get out food, and they didn't bring us a basket of fries during the wait, which I usually get offered at the Clackamas location. Upon getting our food my friend was mad because we didn't have a single napkin on our table. We had to ask for both some fries during our wait, as well as some napkins.",https://www.yelp.com/biz/red-robin-gourmet-burgers-portland-3?start=20
Karey R.,"Portland, OR",97,216,22,4.0,1/10/2015,"Sometime in the last 3 months, this restaurant has had a major renovation.  What an improvement!  The bar area is now clearly signed as 21+ (no kids yay!) and is partially screened off instead of being completely exposed to the waiting area like before.  There is a fantastic decorative chandelier made of brown, green, and clear glass bottles.  The plain wooden stools have been replaced by comfy leather and wood stools.  I think they added more TV's?  It's just much more cozy, sophisticated, and chic than before. The main section of the dining area has been rearranged and the furnishings upgraded.  I only walked through on my way to the bathroom so don't recall too many details but it looks great. I'm sorry to say, though, that the bathrooms were NOT renovated.  The women's bathroom continues to display the primary yellow, blue, red, and white dingy tiles and dilapidated feeling.  Too bad, really.  The bathrooms were always dodgy but now, compared to the rest of the public area, it's a stark blemish.  I hope the bathrooms are next on the rejuvenation list. Food was awesome.  Service was excellent.  I LOVE how I can customize all the meals on the Red Robin website and see nutritional info based on my customizations.  Extremely helpful for a gal on a diet like myself.  We'll be back!",https://www.yelp.com/biz/red-robin-gourmet-burgers-portland-3?start=20
Vanessa D.,"Clackamas, OR",0,5,1,1.0,4/12/2017,"Food was alright. However, the service was terrible. After being seated, we were not even acknowledged until fifteen minutes later. Next time we go to red robin, we'll definitely be going to a different location.",https://www.yelp.com/biz/red-robin-gourmet-burgers-portland-3?start=20
R G.,"Portland, OR",1,5,5,1.0,11/11/2015,"Update: My husband wanted to try again, even though this place is dead to me now. Once again, during regular business hours, no response to our call for a takeout order.  ---------- The service here has always been hit-or-miss, but today the staff decided to go on strike, or a work slowdown, or something. We called 4 times to place an order for pickup, and finally my husband went to just order there. He waited, along with a dozen other would-be patrons, and no one ever appeared to seat or serve anyone. Class act, guys. FWIW, Five Guys off Johnson Creek was delighted to get us some amazing burgers double-quick.",https://www.yelp.com/biz/red-robin-gourmet-burgers-portland-3?start=20
Angela M.,"Gresham, OR",0,9,1,2.0,1/25/2017,The food was good but it just took forever to get anything. My sons bottomless fries were out so we ordered some more. Then our drinks were out. When the fries came we ordered refills. While waiting for drinks we ordered dessert on their new electronic device on the table. We got our dessert pretty quickly. Asked about those refills waitress said they were coming. Dessert is almost gone. Still waiting on drinks.....,https://www.yelp.com/biz/red-robin-gourmet-burgers-portland-3?start=20
Jerry M.,"Portland, OR",8,495,1325,4.0,3/26/2016,"Red Robin is well known for their specialty hamburgers with all sorts of extra ingredients embellishing the burger itself.  I'm somewhat of a ""purist"" when it comes to burgers (and I also didn't want to pay over ten dollars!) so I ordered a more ordinary (and less expensive) ""Red's Tavern Double"", which includes just traditional things such as two burger patties, American cheese, lettuce, and tomato.  Red's Tavern Double costs a reasonable $6.99 and also includes ""bottomless fries"". . .a great deal.   OK, the burger was exactly what I wanted, was fire grilled, and was very good.  However, even better (as far as I'm concerned) is that I could substitute ""bottomless steamed broccoli"" in place of the fries.  I have an obsession with broccoli since it is a ""superfood"", so the thought of eating all the broccoli I want was really appealing.  Well, now I know that Red Robin is the place to go for a good burger and to load up on Vitamin A.",https://www.yelp.com/biz/red-robin-gourmet-burgers-portland-3?start=20
Ane D.,"Portland, OR",1,6,3,5.0,12/23/2017,Shout out to our charming and attentive server Analy (according to the receipt) tonight for keeping her cool and giving us great service even when it was slammed.  The holiday season brings large groups (Calling ahead will expedite seating if you have a big group!)  and red robbin's staff managed the rush seamlessly this evening.  Thanks again for a great meal and excellent service. :),https://www.yelp.com/biz/red-robin-gourmet-burgers-portland-3
Jesus M.,"Vancouver, WA",404,140,777,4.0,8/13/2017,We went to this restaurant location to celebrate my grandson's birthday. We picked Red Robin because my wife likes that they sing to the birthday person and give them a small individual sized Sundae. This location was the closest to the auto headlight repair shop we had dropped my son's car at. We asked for a table for 5 and did not have to wait very long to be seated.  Our drink order was taken quickly and served expeditiously. We ordered the large onion ring tower as an appetizer and that was out fairly fast too. Once our food orders were taken the waiter had refills out to us. Our meals came out except they forgot our two special dipping sauces for the fries. We informed the waiter but he also forgot and only brought them out after I order more fries.,https://www.yelp.com/biz/red-robin-gourmet-burgers-portland-3
Bill B.,"Reno, NV",57,86,84,4.0,9/18/2017,"Well..Red Robin is our family ""go to in a pinch"" reliable restaurant for a good food, good service, and decent prices.  The burgers are consistently well prepared as requested and their ""bottomless"" steak fries are very yummy.  The kids' meals are pretty good too (as our youngest kids tell us), because you get unlimited Mac and Cheese and Salad servings, and they make a killer milkshake too.  I almost always order the Chicken Teriyaki Burger (comes with tomato, Swiss cheese, and pineapple) and is also consistently cooked to perfection, juicy and flavorful.   The side salad is fresh and crisp too.  Overall, this is great place to go for lunch or dinner.  Enjoy!",https://www.yelp.com/biz/red-robin-gourmet-burgers-portland-3
Tia S.,"Camas, WA",39,3,,1.0,1/5/2018,"I had a bad experience here once before, but I figured two years is enough time to weed out the bad people that worked there. Apparently I was wrong. Out wait person was ok, but kept forgetting things like the rest of the fries we ordered (3 kids meals split into 2, but only 5 fries!), the paper wrap my husband ordered for his messy burger, a refill on WATER! Not the best service. Then we get home, I fell asleep on the couch, woke up feeling nauseous. 5 minutes later the chicken sandwich came up either  because it decided it didn't like my stomach or it wasn't done all the way. Either way, now I feel like crap. Thank you for year another bad experience Red Robin. Definitely won't be returning here again!",https://www.yelp.com/biz/red-robin-gourmet-burgers-portland-3
Wendy W.,"Portland, OR",29,27,20,4.0,11/26/2017,Well we ordered on a phone call with a woman right now from about 5:55-6:00 and she was just very friendly and knew the menu and all the right suggestions to make . She really made our ordering food a pleasant and quick thing. I will call this location again for my family all because of that service ! Thank you ! ( if her employer want to reward her and I forgot her name she ordered two pub and cheeses in our order and some pretzel bites to stand out . She really should be commended,https://www.yelp.com/biz/red-robin-gourmet-burgers-portland-3
Sean H.,"Anacortes, WA",57,8,1,4.0,5/12/2017,"Service was great, especially compared to other red robins that I have been to.  We were seated fast, and everyone was friendly.  The food was mediocre, but it wasn't terrible.  We had onion rings, fried pickles and I had a Banzai burger.  I don't know if I'd order these things again, but I didn't send it back to the kitchen...  The lava cake was probably the best part of the meal.   If I had to base this review on the food alone, I would have rated it a 3, but the service will bring me back, if I am looking for a quick burger and am in the area.  I am also taking the class into account, when rating.  I don't consider these to be ""gourmet burgers,"" even though Red Robin claims that they are.",https://www.yelp.com/biz/red-robin-gourmet-burgers-portland-3
William L.,"Portland, OR",5,20,10,2.0,2/5/2017,"Arrived to celebrate a birthday and we're not greeted at the door. (Police were standing in the entry... may have been part of the problem) We eventually made our way to the table in the back of the dinning area. (First visit since the rebranding/renovation. Not impressed. Much darker in the entire place.) We had 10 seats to full and a highchair for a toddler. The standard setup looked like it would fit 10 people perfectly and the highchair would sit between the parents. As we started to sit down, the first of two hostesses comes over and asks us to step back and they can add another table for more seating... no one asked for more seats.  After playing musical chairs and moving two tables, we were seated and separated by the giant L shape table we were just crafted. At this point, I was frustrated I couldn't sit near by kids, and they couldn't sit across from their uncle and aunt. We were seated a total of 30 seconds before we were asked if we would want drinks. Greatest moment of the entire service... Brace yourself, it's downhill from here. The kind waitress we had assigned to our table seemed to be overwhelmed by the conundrum created by the tables. After a few minutes of walking through the gauntlet of chairs she was able to get our orders and was gone. We saw her once more when our drinks were delivered and that was it until food was ready.  During the meal, my wife and I had our bottomless fries refilled once, and only one of our lemonades was ever refilled. (I'm still quite parched) My daughter asked for a cheese pizza meal and received pepperoni (and no one responded when we questioned it). Most of the food was good, but far smaller portions than other nearby restaurants for the same price. Overall the food wasn't worth the troubles we had just to be seated. Appreciate the waitress and her effort to make things better but definitely not a visit I want to remember.  Perhaps a one-off bad experience, but this makes two in a row for my family... last time we were here was prior to renovations so let that weigh in on the quality for revisits.",https://www.yelp.com/biz/red-robin-gourmet-burgers-portland-3
Jacob W.,"North Portland, Portland, OR",77,2,1,1.0,11/9/2017,"I ordered Postmates from here and I will never do that again from this location! The food was border line frozen when it got here, there was a god damn hair in my food and they only gave me 6 fucking fries, don't say you have botmless fries and only give someone six fries that where frozen! This place is horrible and will never recommend it to anyone!",https://www.yelp.com/biz/red-robin-gourmet-burgers-portland-3
Dawn B.,"Portland, OR",78,47,36,5.0,9/16/2017,"This is our local RR and reliable fallback for a good meal, familiar menu, and friendly service.  Glad we have this one in the area!",https://www.yelp.com/biz/red-robin-gourmet-burgers-portland-3
Jessie T.,"Portland, OR",161,76,249,4.0,5/7/2016,"It's been a while since I've been to a Red Robin, and today I was there to take some students to celebrate. There were six of us and we sat at a round table with a waiter who had a hilarious and dry sense of humor. He fake pressured us all to get milkshakes and yet we enjoyed getting them.  And I will personally say that if you are going to get a milkshake here, you should get the salted caramel one. It was so perfect in the mixture of sweet and salty.  I had the whiskey River barbecue burger with lettuce instead of a bun and while I could not finish it, it still is a classic favorite. Their barbecue sauce is so complementary to the burger. The staff are friendly and the place is relaxing and really there was nothing that prevented us from having a delightful lunch.",https://www.yelp.com/biz/red-robin-gourmet-burgers-portland-3
Ruben C.,"Beaverton, OR",76,22,8,1.0,10/27/2017,I was here the other day i ordered a burger and my bread was soggy didn't get asked for more bottomless fries i was disappointed and my girls food the chicken was barely warm almost cooked i feel like the food was just sitting at the window for awhile i know this only happens when food sits because i work at a restaurant so food is not coming out at reasonable time  i will not be coming to this location again,https://www.yelp.com/biz/red-robin-gourmet-burgers-portland-3
Ethan J.,"Portland, OR",7,25,,1.0,10/3/2017,"Ordered from GrubHub and asked specifically for no cheese on a salad and no ketchup on a burger.   The salad contained cheese and the burger had ketchup. The onion rings were...bleah. I know this is a chain burger joint and I really shouldn't expect much, but seriously?   Not a mistake I'm going to make again.",https://www.yelp.com/biz/red-robin-gourmet-burgers-portland-3
Chuck D.,"Hood River, OR",12,11,2,1.0,10/5/2017,What a horrible dining experience.  Fries were cold. Our waiter never came back around after we asked for more fries. Never brought our cheese dipping sauce but charged us twice for them. Never brought my sons soda and when he finally stopped by the table fifteen minutes after we had gotten our food he just brought water. We told him again what he had forgotten but we were pretty much done with dinner at this point and he still never brought our requests. I have been to other locations that seem better but this one Is the worst.  Even the wait staffs appearance was borderline sloppy. If you have a choice drive on by and go to a better managed location.,https://www.yelp.com/biz/red-robin-gourmet-burgers-portland-3
Jody J.,"Portland, OR",161,240,1079,4.0,2/7/2016,"Ok peeps... Times have changed at Red Robin. :-)  No more waiting for the waiter or waitress to come with the check.   You can now check out the menu, play games for $1.99, check your Red Robin rewards card, pay your bill unless you're paying cash, leave a tip and print a receipt at your table using the new Ziosks they have placed on the tables.   Pretty convenient it is especially if you are in a hurry but I will say I think we may be losing that personal touch.  :-(  Maybe the next thing will be food runners.  You will order and pay by Ziosk and food runners  or robots will just bring the food.  :-)  The food at Red Robin is decent for a chain and today was no different.  Ordered the California chicken sand and fries.  Service was good and my waitress was very friendly. :-)  Love the guac on my chicken.  :-) Enjoy! 2016-5",https://www.yelp.com/biz/red-robin-gourmet-burgers-portland-3
