Username,location,friend_count,review_count,photo_count,rating,date,review,Url
Tommy_n_Loretta C.,"Shoreview, MN",87,162,245,4.0,6/9/2015,"We have been coming to RR for the past 9 years. It's a great place to have a really good burger and bottomless steak fries. Our boys can't get enough of their bottomless root beer floats. We love the Burnin' Love Burger. Try the Ghost pepper sauce on the side if you like things heated up a notch. They give out free balloons to the kids and sing a song for you if its your birthday. If you are into a full bar and beer on tap; they have that too. Overall it's a great place for a burger. For the vegan and vegetarian folks, they substitute a Boca burger for any of their burgers. I especially love that they offer a free burger and fries to veterans on Veterans' Day.",https://www.yelp.com/biz/red-robin-gourmet-burgers-shoreview?start=20
Kelly T.,"Eden Prairie, MN",10,22,2,3.0,6/24/2015,Sign up for the rewards program! it's worth it! My burger today was 50% off. The burgers are pretty good and service is pretty good considering I went at lunch and the parking lot was so full I wondered if it was completely full at first. I think next time I'll go later in the day.,https://www.yelp.com/biz/red-robin-gourmet-burgers-shoreview?start=20
Jamie W.,"Saint Paul, MN",1,12,,1.0,12/13/2014,"Horrible service!! Came in for dinner, place is well over half empty. Took them a out 10 minutes to notice we were standing by the door waiting to be seated. Another 10 minutes before a drink order was taken. No silverware, no napkins...2 waters for 3 people. Fries under cooked. I have learned my lesson.",https://www.yelp.com/biz/red-robin-gourmet-burgers-shoreview?start=40
Taylor Z.,"Saint Paul, MN",1,4,,1.0,12/13/2014,This was my first time at this location and it sucked!  The waitress was slow. Didn't get silverware or napkins. Poor service.. Never will come back.,https://www.yelp.com/biz/red-robin-gourmet-burgers-shoreview?start=40
Annette L.,"St Paul, MN",8,24,,2.0,11/18/2013,"""Miles"" to go... While I enjoy the food here, I have to say our service this time was terrible. Miles strolled up to the table and called my fiance ""boss"" - immediate no-no. It took forever for our drinks to arrive, and my mom's sandwich didn't arrive with the correct bread because Miles neglected to tell her that they were out. Are all of these things understandable? Sure. But you see, a GOOD server will stop by your table and let you know some of these things -- ""Hey, I'm really sorry, it looks like the bar is short-staffed. Might take a little longer to get your drinks.""  Or, ""Just to let you know, we're out of the ciabatta. Is a regular bun okay, or did you want to look at ordering something else?"" He never actually stopped at our table after the food was delivered. He just breezed by and asked if everything was okay, never actually waiting for an answer before he moved on. Very unprofessional. As a person that formerly worked in the restaurant business, I thought to myself, 'Shouldn't that kind of hospitality be commonplace for a server?' Yet Miles didn't do any of these things. Hence why he ended up with a collective tip from the 3 of us, of less than 5%. Get Miles out of there, and hire quality staff please, that know how to wait tables. And if you, the reader, have the misfortune of being seated in his section, ask for a new server right away. Your experience will be all the better for it.",https://www.yelp.com/biz/red-robin-gourmet-burgers-shoreview?start=40
Jason K.,"Edina, MN",352,1057,370,5.0,7/19/2011,"My friends and Co-workers were on a trip to Red Robin on a monthly trip to a restaurant and a trip to the Shoreview Target store to do a walk through. (We all work at Target HQ) We had about 8 of us there and I was the only one to order a Southwest Chicken Salad, which was awesome. The chicken was perfectly cooked, nice and juicy with a wonderful bed of lettuce and some fried jalepeno on the side. I finished it all, but it could easily be a salad for two. There nice slices of avacado and they gave me my dressing on the side, awesome. Everyone else got a burger and everyone seemend to like it. They had fries coming on whenever you wanted it and my Diet Coke was refilled on a solid pace. I tried a couple sweet potatoe fries and they were very nice with the saltiness mixing with the sweetness of the sweet potatoe. My salad was about 8 minutes later than all the other dishes, so a co-worker said that it was a lot later than everyone, so they comped me the salad. (I made sure to tip the servers, because it wasn't their fault) but the classiness of the business to reconize something that went wrong goes a long way. They had no idea that I was a big Yelper, so their big step up to make things right really went a long way. The place was packed at lunch time, so they must be doing something right. The salad was amazing and they were first class gives the place a 5 star!",https://www.yelp.com/biz/red-robin-gourmet-burgers-shoreview?start=40
Amanda G.,"St Paul, MN",2,35,23,4.0,3/22/2015,"The food is delicious. The service is fast and friendly. The prices are reasonable.  I recently complained via RR's website that they haste no changing table in their men's restroom, only in the women's. They promptly installed one and called to tell me, to apologize, and to offer me a free appetizer on my next visit. Now THAT is customer oriented business. Good job.",https://www.yelp.com/biz/red-robin-gourmet-burgers-shoreview?start=40
Alejandro D.,"Oakdale, MN",0,3,,4.0,6/12/2015,Went with a group of co-workers and was a pretty decent time.  I never knew there was a red robin in Minnesota and when I found out I had to go.  We went at around mid-day and it was fairly slow.  -Our waiter asked what we wanted for drinks. Me and one friend got a Dr pepper and I got a root beer. The waiter had switched them up by mistake which I can see happening easily.  -The waiter then got our orders and had brought out the food and had brought out the wrong one for my friend. He corrected it and said he was sorry.  -We hardly got asked how the meal was or if we needed anything else. We got our refills when needed but other then that nothing.  -We paid our bills and on the way out our waiter didn't bat an eye towards us or even said have a good day or thanks for coming.  Food was excellent but the waiter that waited on us needs to improve a little.,https://www.yelp.com/biz/red-robin-gourmet-burgers-shoreview?start=40
Dawn S.,"St Paul, MN",0,94,,5.0,3/18/2013,"I give Red Robin 5 stars because of the vegetarian burger option. They have boca and gardenburger.  The boca burger has a smoke flavor and a nice texture, a good vessel for the ""burger"" toppings. I have never understood why all restaurants that serve burgers do not always offer a boca burger in place of beef.  You just keep them in the freezer until someone orders.  I HATE black bean burgers because of the seasonings; if I want cumin and taco flavors, I'll go to a Mexican restaurant and order tacos...   So, in my opinion, other burger joints should lose the black bean burger and just stock the boca burgers. For us, the service has always been average to above average.  Nothing to complain about. I do like their sides options.  If you don't want their bottom-less steak fries (and who wouldn't), they do have a side salad, steamed broccoli, sweet potato fries, and a bunch of others as options.",https://www.yelp.com/biz/red-robin-gourmet-burgers-shoreview?start=40
Rich M.,"Monument, CO",6,72,47,1.0,2/25/2015,"Horrible service tonight, could not be slower and never asked how we were doing, no napkins, just tertible",https://www.yelp.com/biz/red-robin-gourmet-burgers-shoreview?start=40
Rick M.,"Shoreview, MN",8,60,,2.0,8/14/2013,"I'm not sure what I miss that others really appreciate about this place.  The dining room is pretty uninspiring, the wait-staff seem friendly enough but also seem like they're in training and the food is average at best, slightly below average more often than not. The bar's okay but nothing to write home about. And the prices seem high given the dining experience and the quality of the food. My three favorite places for hamburgers are Blue Door, Groveland Tap and the Nook/Shamrock. Food quality is far better, IMO. Ambience is quirkier, reflecting the independent ownership vs corporate-dictated decorating. Prices actually seem slightly lower. The wait-staff are always great and know what they're doing and what's working (or not) in the kitchen or at the tap. Yeah, it takes me 10-15 minutes longer to drive there and parking at those places isn't as convenient. But to my tastes, those are minor inconveniences for a much better burger and beer experience.",https://www.yelp.com/biz/red-robin-gourmet-burgers-shoreview?start=40
Kim R.,"Saint Paul, MN",91,359,298,3.0,4/2/2013,"I'm not huge on chain restaurants, so I had never tried Red Robin before this past weekend when some friends suggested meeting for lunch.  This place is pretty big, and the service was great. The menu is very extensive so everyone should be able to find something that suits their fancy. I'm not a red-meat eater, so I steered clear of all of the burger options. After reading a review on Yelp, I decided to try the Whiskey River Chicken wrap with a cup of chicken tortilla soup. The wrap had really nice flavor from the BBQ sauce and ranch, but the chicken was not very hot... The soup I would definitely not order again. It tasted like it was from a can and the flavor was overpowered by too much cumin. We started our meal with the pretzel bites. I was super pumped to try these, because who doesn't like a pretzel with cheese sauce?? Unfortunately, the cheese sauce was not great, it was a little thick and goupy. I  preferred the whole-grain mustard sauce. There was something different about the pretzels themselves, they almost tasted deep fried... I prefer a traditional pretzel, I don't need the extra fat and grease.",https://www.yelp.com/biz/red-robin-gourmet-burgers-shoreview?start=40
Julie S.,"Shoreview, MN",0,11,,2.0,2/15/2015,"Egg was raw.  My husband went in for takeout and got me the Royal Red Robin, and the fried egg was raw.  Not just an over-easy raw yolk.  We're talking slimy clear wiggly raw egg white.  How hard is it to fry an egg?  So gross.  The burger itself wasn't bad, but the egg seriously ruined it.",https://www.yelp.com/biz/red-robin-gourmet-burgers-shoreview?start=40
Markus D.,"Vienna, Austria",70,370,365,5.0,7/31/2013,"Amazing burgers, and very charming service. The strawberry lemonade tasted great. So did the burgers. I had the Berserk burger, their newest treat. Prices are still OK here, too.",https://www.yelp.com/biz/red-robin-gourmet-burgers-shoreview?start=40
David W.,"Delano, MN",0,2,,5.0,3/2/2015,I frequent this restaurant whenever me and my friend jenny are craving a good burger. The servers are very polite and friendly and knowledgeable of the menu. However we went yesterday 3/2/2015 and it did take quite a long time to receive our burgers. We had the pretzel bites which were really good! I wish they would have given us more though seeing as there were 3 of us at our table. A good thing about this place is you get endless fries! ENDLESS!!!!! I had the sweet potato fries which were really good dipped in ranch. I had the Whiskey River Burger which was delicious... it was oozing with BBQ goodness and lots of bacon. I definitely recommend this place if you want to chow down on a good piece of meet.,https://www.yelp.com/biz/red-robin-gourmet-burgers-shoreview?start=40
Dan P.,"Minneapolis, MN",1,58,,2.0,12/20/2013,"Hey, the bottomless steak fries are great-ask them to leave off the 'Red Robin' spice.  The server was effective in a hurried, friendly but impersonal style.  The place was very busy for early on a Thursday night.  The menu is bewildering with plenty of add ons available.  Toll:  $50 for three burger meals, one beverage (a beer) and one appetizer.  Yikes.   But what about the burgers? It's a burger place, I have to talk about the 'gourmet' burgers right?   Ok, here's my take on the burgers.  Less beef than I remember, less beef/burger flavor, more food service bun, more cheese, food service bacon-the salty transparent kind you can almost see through. My old favorite the royal red robin burger (topped with a fried egg) has declined.   The burger competition around town is tough.  Red Robin burgers are going in the wrong direction and value is questionable.  Better consider a name change to Gourmet Steak Fries....and burgers.",https://www.yelp.com/biz/red-robin-gourmet-burgers-shoreview?start=40
Jim R.,"Minneapolis, MN",34,954,1947,3.0,4/17/2011,Busy fried food Nirvana. You get get extra fries for the asking. What's not to like?  Can be a little hectic so don't go if you want calm.,https://www.yelp.com/biz/red-robin-gourmet-burgers-shoreview?start=40
Kate M.,"Minneapolis, MN",64,162,10,3.0,1/9/2013,"Yesterday I felt the call of the potato. I love fries, but I have a particular soft spot for steak fries doused in salt. Red Robin has giant flippers of fries and yep, they're salty and hot.  I tend to order the fancy burgers with the garden burger or chicken since I'm not a total masochist with the bottomless fries and my cholesterol. I used to get the Banzai burger every time, but got tired of the cheese, mayo and sauce turning the burger into a mushy handful. Esp with the garden burger which just seemed to dissolve into  food fight fodder. I tried the bruschetta chicken sandwich last time and was pretty impressed. I hate tomatoes (shhh) but I love balsamic so found the glaze and ciabatta roll saved the sandwich. Last night I tried the A1 Peppercorn with the garden burger. There was a little snafu with the kitchen not getting the *keep* the bacon message, but our server quickly brought out the missing slices. It was very peppercorny (yes I know. the hint was in the name and a little saltier than I like). We went for an early dinner so the place was quieter than usual and our server pretty attentive. Probably helped he had a shadow, but no complaints.",https://www.yelp.com/biz/red-robin-gourmet-burgers-shoreview?start=40
J T.,"Madison, WI",4,251,15,4.0,7/2/2014,"Big burger, good steak fries (all you can eat I guess?).  Stopped in with  group for lunch for work.  The burgers were all cooked to the right temp; service was good.  They kept our drinks full and were quick.  Everything was good. Sure we will go back again at some point.",https://www.yelp.com/biz/red-robin-gourmet-burgers-shoreview?start=40
Ariel H.,"Minneapolis, MN",3,6,13,2.0,12/17/2013,ordered the southwestern chx salad to go..menu said pre tossed in dressing. Salad came with no dressing.,https://www.yelp.com/biz/red-robin-gourmet-burgers-shoreview?start=40
Seppuk U.,"Eagan, MN",3,89,,2.0,1/14/2013,"I don't get it.  I don't get why so many people are raving about this place on here?  Shills?  I stopped in the other night for the first time and in a nutshell here was my experience: A.  Ordered their self proclaimed signature cheeseburger.  It was average.  I've had better burgers at a multitude of joints around the TC.  Most of those joints aren't even concentrating on burgers like this place professes.   And the kicker, the burger was EXPENSIVE.  For a mediocre burger I will not pay these prices. B.  Where was the great service so many rave about?  The menu said I got free refills on my steak fries.   The waitress did not return to my table (it was 8 pm, not busy) until I was finished eating.  That means my water didn't get refilled, nor my fries.  This is great service.  Oh, when she dropped off the food she literally returned 15 seconds later to ask how the food was.  I hadn't even tried it yet.  ""looks good"" ?? That was the last I saw of her for the next 20 minutes.  Correction, I did see her having a great chat with the apparently dreamy bartender while she neglected me, her customer, the one paying the tip.  C.  The Steak Fries.  Whats the big deal?  Could it be the four tons of salt mix they put on them?  Cuz other than that they ain't all that.  Add the salt and BOOM! you have fries you could eat that night or maybe even 6 months from now, because they've been PRESERVED!  As you can tell I was not impressed with this joint.  If I'm paying I doubt I'll be back. Overpriced mediocrity.",https://www.yelp.com/biz/red-robin-gourmet-burgers-shoreview?start=40
Josh W.,"Minneapolis, MN",44,22,6,4.0,3/16/2014,"Ok, the food was fantastic. This earned them a well deserved 4 stars and an opportunity to try again.  The burning love chicken sandwich was great, and the kid loved her pepperoni pizza. To be honest it's the first time I have seen her like pizza from a non-pizza place. (But she orders them anyhow)",https://www.yelp.com/biz/red-robin-gourmet-burgers-shoreview?start=40
J S.,"Irving, TX",4,29,5,1.0,6/9/2014,"Stopped by on a Monday night for a quick chicken sandwich. Ordered and waited just over 30 minutes before walking out. While waiting, listened to the very overwhelmed bartender complain about being short staffed/by herself. Upon leaving, mentioned to the manager my experience, and suggested she get the bartender some help. She told me she was short staffed all over the restaurant...told her that problem was going to take care of itself, as customers will leave and not come back. Went to Green Mill nearby. Same food/better service.",https://www.yelp.com/biz/red-robin-gourmet-burgers-shoreview?start=60
Scott H.,"Anoka, MN",0,8,,1.0,1/17/2015,Horrible service! Fries were served cold and we finished our burgers by the time they brought out hot ones. Should have known when even the hostess was bad. We'll never be back to this poorly managed location.,https://www.yelp.com/biz/red-robin-gourmet-burgers-shoreview?start=60
Clark G.,"Saint Paul, MN",0,5,,5.0,8/8/2015,"This place is the best!! I love the variety of burgers, but had a hard time settling on just one. I will definitely be back to try more burger combinations",https://www.yelp.com/biz/red-robin-gourmet-burgers-shoreview?start=60
Mike C.,"Sunnyvale, CA",16,131,11,4.0,2/29/2012,"The Royal Red Robin Burger - basic california burger with bacon, but also topped with a fried egg! Order with the yolk still runny, best ever! Would have given 5th star, however, requests for runny yolk are hit or miss, I have ordered a number of times this way, but have only received it once.",https://www.yelp.com/biz/red-robin-gourmet-burgers-shoreview?start=60
Richard M.,"Bemidji, MN",12,100,62,4.0,3/7/2012,"Yup! I'm a fan. Went here a couple days ago right at dinner time. I went with a group of 5 and the hostess told me the wait to be seated would be an hour. I knew that was a stretch so we decided to take the challenge. It ends up we made the right choice as we were seated in around 15 minutes! I will say that it was loud with fellow dinners but it wasn't a problem for our group. We ordered a wide variety of mainly burger dishes and everyone liked the meals they ordered. the 5 of us eat for around $60.00 so for great burgers and lots of beers, sodas and shakes for $60.00 I'd say a great value. I recommend.",https://www.yelp.com/biz/red-robin-gourmet-burgers-shoreview?start=60
Judyth B.,"Saint Paul, MN",10,32,1,3.0,8/12/2012,"What a nice staff on the day I was there!  Helpful, accommodating and kind!! Not fine dining but good food at ok prices.  My big problem is the noise level!  Way too loud for any conversation with other members of my party!!!",https://www.yelp.com/biz/red-robin-gourmet-burgers-shoreview?start=60
Beth F.,"Twin Cities, MN",133,294,58,3.0,1/5/2011,"Nothing says happy birthday better than meat and cheese. My husband's birthday and my birthday are three days apart and as email members of Red Robin's birthday club, we each receive a coupon around the same time every year for a free burger and fries--the only thing you pay for is your beverage.  You also receive a complementary sundae and unless you LIKE clapping and singing, you can usually opt out of the usual dog and pony show if your server isn't a tool (and since they haven't received their tip yet, chances are good they'll do whatever you ask).   We found ourselves at the location in Plymouth recently while waiting for our second car to come out of the shop.  It was one of those days where it was snowing {again}, it was an hour and a half past lunch, both adults were ""hangry"" and even more critical, Toddler F. was also wet, hungry and desperate to get out of her car seat.  We'd been driving around aimlessly until we turned a corner and saw the Red Robin.  Hello, lifesaver!  When all was said and done, 2 enormous burgers w/fries + 2 sodas + 1 kid meal of mac & cheese, steamed broccoli and milk + tip = about $41.  And lifesaver or no, that's not exactly a deal.   This week, also known as birthday week at the F. house, we went to the Shoreview location because it is closer to home where 2 enormous burgers w/fries + no soda (NY resolutions) + 1 kid meal of mac & cheese, steamed broccoli and milk + 2 sundaes + tip = about $12 (remember to tip on the full value of the meal, yo!)  And that *is* a deal!   Until the little one came along, I'd never paid close attention to the décor or RR flair but my munchkin LOVES the carousel horses mounted in the dining area.  RR also has balloons near the hostess stand and when we walked into the entry my kid immediately began flirting with the young woman at the hostess stand and earned a pink RR balloon for her efforts which provided entertainment during the meal, the car ride home and at home as well.  Family friendliness is an important factor for me these days so I appreciated the gesture.   Over the past several years, I would guesstimate my attendance to RR at around 15 visits and most of the time the food is consistently pretty good.  Occasionally it is really good and one time it was not so great which I guess is how it goes at these kinds of places.   I'm having a hard time deciding between a rating because the cost of the food generally has an impact on how I'd rate the experience.   4 stars = free RR burger 3 stars = full price RR burger Overall I'm going to go with three.",https://www.yelp.com/biz/red-robin-gourmet-burgers-shoreview?start=60
Nate J.,"Minneapolis, MN",16,188,1,3.0,6/16/2011,This review is only useful in comparison to other chain burger places.  I just can't bring myself to give it a 4 (3.5).  All you can eat fries and a cajun chicken sandwich which was actually spicy (in Minnesota)!!,https://www.yelp.com/biz/red-robin-gourmet-burgers-shoreview?start=60
Charlene R.,"CEDAR E BETHL, MN",14,65,7,3.0,11/5/2011,Bottomless steak fries are a perk. And the onion rings are enormous and pretty tasty. I usually come here for lunch as they have a very good BLTA croissant and their California chicken sandwich is unique as they add an avocado salsa to it. Tortilla soup is pretty good too. Must try their freckled lemonade. My son is hooked on it. Service is usually good. This is a very loud restaurant.,https://www.yelp.com/biz/red-robin-gourmet-burgers-shoreview?start=60
Michael P.,"Rosholt, WI",23,18,4,4.0,11/23/2011,"When we arrived on late Sunday morning, they had trouble seating us because they were short staffed.  Outside of this one-off event, great service. Red Robin has a variety of burgers, all of which are excellent.  The selling point on this place is the bottomless basket of steak fries.  Steak fries!  STEAK FRIES!",https://www.yelp.com/biz/red-robin-gourmet-burgers-shoreview?start=60
Sarah N.,"Saint Paul, MN",27,8,11,5.0,7/21/2008,"Oh Mother of Mary! I can't stress enough of how much I love Red Robin!  I am a member of Red Robin's e-club which means you get a free burger on your birthday (actually the coupon extends within two weeks of your actual birthday). You should sign up! My husband and myself have been frequenting the Red Robin in Shorview for the past three years (ever since the Eagan location was torn down for a Best Buy...boo). I've had the Chili Chili Cheeseburger which is a cheeseburger served open faced with Chipotle mayo, Cheddar cheese, diced red onions and topped with chili. Yum! I remember it being messy and I couldn't finish it, but I had leftovers for the next day. I have also tried the Banzai Burger which is a teriyaki burger that is topped with grilled pineapple, Cheddar cheese, lettuce, tomatoes and mayo. This is probably my favorite that I have tried at Red Robin. The photo that is attached to this posting is the Guacamole Bacon Burger which included guacamole, bacon, swiss cheese, onions, lettuce, tomatoes and mayonnaise. Note : They will cook your burger with ""some pink"" or ""no pink""...I always order my burgers with ""some pink"" and I've been pleasantly surprised that a chain will do this.",https://www.yelp.com/biz/red-robin-gourmet-burgers-shoreview?start=60
Laura F.,"Saint Paul, MN",0,12,,1.0,11/11/2013,Terrible service! 3 strikes in a row and you are out. We will not be spending any more time or money there. It's just not worth it.,https://www.yelp.com/biz/red-robin-gourmet-burgers-shoreview?start=60
