Username,location,friend_count,review_count,photo_count,rating,date,review,Url
Dana J.,"Maplewood, MN",10,78,55,5.0,11/30/2017,"Went there two weeks ago with the boyfriend and my dad. We were told it'd be a 20-30 minute wait (Typical for a Friday evening), but were seated in about 10-15. Our server was GRACE, and she was AMAZING! Normally I don't rant and rave about specific people, but she went above and beyond! She was patient with us, answered questions, very friendly, but professional. Had excellent recommendations. She always kept our drinks full, and endless fries coming! She even offered to let us try one of their famous sauces, (Campfire sauce?!) and it was so delicious! I have the grilled chicken teriyaki burger with grilled pineapple, and the flavors were on point. MY only two complaints about the entire experience is; 1- Coke products 2- bun got a little soggy-couldn't been a little toasted Ask for Grace if you go to this location!",https://www.yelp.com/biz/red-robin-gourmet-burgers-shoreview
Jennifer B.,"Minneapolis, MN",64,143,440,3.0,12/18/2017,"I remember when this place was first built and my friend who worked here used to dress up as the big Robin mascot! Good times. I had not eaten at a Red Robin since then but I remember the burgers being greasy. This past visit I was surprised by how busy it was, the place was packed. We had reservations for 6 people and only waited about 10 mins. So overall the food was ok. Server was very friendly and efficient. I ordered the Red Robin Gourmet Burger with cheddar cheese. The sweet pickle relish stood out otherwise there wasn't anything special to it. Garlic fries were yummy- wide cut with minced garlic and parmesan cheese. Side of fries served with the burgers was small (~10 fries) but the free refill side was large. Noise level in the restaurant was very loud. At the end they have convenient tablets to pay at the table and even print your receipt. For a low key group dinner it worked great but I won't be coming back on my own anytime soon, just not my vibe and there's too many other good burger places out there.",https://www.yelp.com/biz/red-robin-gourmet-burgers-shoreview
Joelle A.,"Saint Paul, MN",37,6,1,5.0,12/27/2017,"The burgers here are great. I've NEVER had a bad meal here. The bottomless basket of fries, is ingenious! Our waitress, Shawn, (we've had her a few times) never fails at being the best waitress! She always finds the best deals for us, because we are ""frequent patrons"" to Red Robin. The bathrooms are clean, as is the restaurant!",https://www.yelp.com/biz/red-robin-gourmet-burgers-shoreview
Dan F.,"Spring, TX",147,385,419,3.0,6/9/2017,"I will tell you straight, the burgers are over priced.  The burgers are ok but the patty tends to be thin and at this price they should be a bit more meaty.  I go here usually due to location (that old adage is right on) or a friend wants to go.  The beers can be big, which is good but pricey.  The service was ok, but the waitress was tired and hey, that happens and I don't need a show, but if she would have asked how I was doing would have been nice.  I am not a cheap guy, I can ball with the best of them, but I like a deal - you dig me yelpers, I know you do.",https://www.yelp.com/biz/red-robin-gourmet-burgers-shoreview
Kelly R.,"Minneapolis, MN",24,14,1,1.0,9/2/2017,"So I ordered it to go... ordered 40.00 worth of items including 2 BOWLS.. not cups of clam chowder.. I didnt even get 1/2 cup worth... see pics... I feel gipped.. the salmon burger was decent .. I ordered from Amazon restaurant delivery and they also did not have the fact the garlic herb fries have parmeson on them and I'm lactose intolerant.. that isn't Red Robins fault I don't think.. more amazons. but it was a bummer..  mostly  they were super cheap on the amount of soup they have in a ""bowl"" size.. worth near 6.00. definately not worth it for a few spoons ful.",https://www.yelp.com/biz/red-robin-gourmet-burgers-shoreview
Stephanie K.,"Minneapolis, MN",94,322,196,3.0,4/14/2017,"Red Robin has some really nice things to offer. It has a huge menu with a million options, which can oftentimes serve as a red flag. You get a lot of choices regarding your meat and your bun, for example. Overall, I thought the food was good.  The unlimited sides and milkshakes is a bit of a joke because it'll take forever to get them and that's more food than anyone should be eating. Overall, I just didn't love this place because of the atmosphere. It has all the class of an Applebees.  I'd rather go to Red Cow for a burger at the same price with a much hipper/cleaner vibe.  I did really like how customizable the kid menu is. You get a lot of different choices for entrees and sides and some are even healthy!  Good luck getting your kid to eat unlimited fills of broccoli, however, when everyone else is eating burgers and fries.",https://www.yelp.com/biz/red-robin-gourmet-burgers-shoreview
Makayla X.,"Minneapolis, MN",60,10,1,1.0,8/10/2017,"Server was great! Came for the burgers though, and they were burnt. Like charred. All I could taste was char. Not impressed. The shakes are good though...",https://www.yelp.com/biz/red-robin-gourmet-burgers-shoreview
Amy R.,"Saint Paul, MN",308,1266,1214,3.0,2/20/2016,"This place used to be really good. Not this visit. Apparently my name is difficult. The server asked me X3 what my name was and still after awhile didn't have my name on the wait list. Eek.  We were stuffed at a small booth. Luckily our little one fit in. Still crammed. With the onslaught of menus, the little mini ipad/pay station, seasonings and all the other hooey on the table, it made it pretty tight and packed. Food was ok. Took a loooooong time to come out. For what we ordered it should not have taken almost 50 min. Endless fries means endless wait times. Refills were pretty scarce. The mini ipad/pay station is a pain. Since when do we have to do our own check outs. Not to mention a 1.99 entertainment fee. Really? We didn't use that thing. Just really disappointed on this visit. Probably won't return in the near future.",https://www.yelp.com/biz/red-robin-gourmet-burgers-shoreview
Tiffany C.,"Maplewood, MN",50,3,1,5.0,8/15/2017,"This place is always very busy. When we went there tonight we sat at our table for over 20 minutes without waitstaff taking a drink order. We decided to leave. We spoke with the manager and not only was she very apologetic she paid for our meal, and our meal was out within minutes. Our waitress Katie K, was incredibly attentive and we never went more than 10 minutes without being checked on. This was over and beyond what they needed to do to fix the situation, and they were kind the entire time. What started as a not so happy Situation turned into a place that I will always recommend to people. Thank you.",https://www.yelp.com/biz/red-robin-gourmet-burgers-shoreview
Riley N.,"Saint Paul, MN",0,18,1,5.0,2/3/2017,"My boyfriend and I went last Friday right during dinner rush, there was a wait- to be expected. But we grabbed a few spots at the bar and were promptly served. The bartender was one of the highlights of the experience. He was knowledgeable and offered great suggestions since I had never been before.  The food was also great, the fry portion was small, and at first I was bummed, until I learned that IT IS UNLIMITED FRIES. How could someone not love this place? Also when we ordered a beer we were asked ""short, tall or extra large"" ..... Extra large?! What  a cool option. We will be back :)",https://www.yelp.com/biz/red-robin-gourmet-burgers-shoreview
Ashley Y.,"Saint Paul, MN",190,9,8,5.0,1/20/2017,"Food was GREAT although it was a little hard to eat the lettuce burger, It was delicious. The servers/workers were enthusiastic and I left happy.",https://www.yelp.com/biz/red-robin-gourmet-burgers-shoreview
Kelsey P.,"Minneapolis, MN",164,155,129,4.0,1/6/2016,"All my life, I thought Red Robin was a fast food joint. You learn something new every day! While admittedly, it's miles from gourmet, the food was pretty damn good! Lots of selection for burgers, and more salads than a lot of places (I think there were 8 or 9?)! I had the Bonzai Salad, which was romaine with carrots and almonds and cabbage and teriyaki chicken, with a delightful ale vinaigrette. It felt ...heavy and left me feeling satisfied for the whole afternoon! When I got back to the office I looked up the nutrition and there were only 450ish calories. Including dressing! Whaaat! I think I just found my new guilty pleasure! Service was a little slower than I would have expected, for how few people were dining, I'd be nervous to see what it's like on an evening.",https://www.yelp.com/biz/red-robin-gourmet-burgers-shoreview
Mike B.,"Minneapolis, MN",0,192,1,2.0,9/14/2016,"Incredibly loud.  This is apparently a thing that some kinds of restaurant think is attractive. They are wrong.  It just indicates their budget for sound deadening material is inadequate. The ""bottomless fries"" would be nice if the server ever came back to give you more of them.  The burger setups are quite good--shame that the burgers they put into them are mediocre.  It is also kind of expensive for what you're getting. I haven't been able to figure out why the parking lot is always full when you can cross 694 and go to Five Guys for better burgers, better fries, and less noise all at a lower price.  I've only gone twice since they opened so maybe they've gotten a lot better.  I will probably never find out, though.",https://www.yelp.com/biz/red-robin-gourmet-burgers-shoreview
Lilly P.,"Minneapolis, MN",2,41,14,2.0,8/27/2016,"Normally we enjoy this location, however our services tonight was very sub par. Overall slow service, slow drinks, slow food, no refills, and no box even when asked. We left with the rest of our food wrapped in napkins...  We witnessed other tables getting good service, sadly just not ours.  Two stars, because the food was good.",https://www.yelp.com/biz/red-robin-gourmet-burgers-shoreview
Kimberley R.,"Saint Paul, MN",0,2,,1.0,8/4/2017,"Ordered last Friday night,  take out.  My son forgot to check the order before leaving the restuarant because the bartender said that was it,  big mistake. Over half the order was missing!!! 1 burger no side or toppings, 1 burger correct, 1 burger completely missing.  Called to talk to manager she said she would credit account by Monday.  It's now Friday and nothing.  What a joke!",https://www.yelp.com/biz/red-robin-gourmet-burgers-shoreview
Aurora R.,"Circle Pines, MN",57,3,,3.0,3/13/2017,"Our waitress seemed to do a lot of walking around looking busy; as far as checking in on us, she met the bare required check ins. The location was decently busy (but our waitress didn't appear to have many tables- we noticed two other tables with like two people). The food was spot on and the blended alcoholic beverage was on point!! I would recommend the place, as long as you're not a very needed eater as the wait staff we had was a little too busy looking with her Fitbit steps than checking on her customers.",https://www.yelp.com/biz/red-robin-gourmet-burgers-shoreview
Robyn M.,"Saint Paul, MN",0,1,,1.0,4/19/2017,"I give zero stars. Poor management as I ask if they had nutritional guidelines of menu told me no I need go online, and then online don't work. Will never go again.",https://www.yelp.com/biz/red-robin-gourmet-burgers-shoreview
Bill G.,"Willow River, MN",47,39,8,4.0,6/26/2016,"Great burgers, great service.. enjoyed eating there.  Floors were a little dirty, but they were busy so I can see that.  I was in a group of 9, so it took longer for our food to get there but the server was very attentative.  Will definitely eat there again.",https://www.yelp.com/biz/red-robin-gourmet-burgers-shoreview
Gregg H.,"Saint Paul, MN",3,6,,1.0,6/27/2016,"My family took my son here for his birthday.  We arrived at 6pm; we didn't get to place our order until 635.  At 730pm, our food had still not gotten to our table.    We use to love to come here for a great meal. However. After this experience I don't think we will be back.  We ended up taking our food home to eat due to the fact that our son needed to be at work by 8pm. Sucks to eat your sit down food on the freeway heading to work.  They couldn't even get the bill right.",https://www.yelp.com/biz/red-robin-gourmet-burgers-shoreview
Jesse M.,"St Paul, MN",6,43,35,4.0,2/9/2016,"Red Robin is a great burger place. It's not gourmet but it's solid, and you get all you can eat steak cut fries! I have heard more than one person I've been with say that the burgers are sort of bland. This is true but it's because they don't salt the meat. Try this: Open your burger bun, take some of the house seasoned salt on the table and generously shake it on. Now try your burger. It makes a world of difference.  The place is way too packed and you'll wait over a 1/2 hour if you go at peak times so be prepared and forewarned.",https://www.yelp.com/biz/red-robin-gourmet-burgers-shoreview
Kim G.,"Cloquet, MN",0,57,56,3.0,10/29/2016,"Not so great tonight. We drive a very long way to come here, and usually have a great meal, but tonight was not one of them. They were busy, and we were seated at a red table that was in everyone's way. Our onion rings were not hot- I saw them sitting for a good 5 minutes, as I was facing the food window and very close up. Our server comped them. My whiskey river garden burger was totally greasy; I have had this at least 4 times but tonight it was gross. They put way too much mayo on typically, and my husband had the whiskey river chicken sandwich which was swimming in mayo as well. We really enjoy Red Robin, and will return, but tonight was not it's best effort.",https://www.yelp.com/biz/red-robin-gourmet-burgers-shoreview?start=20
Scott E.,"Colorado Springs, CO",26,339,46,3.0,4/2/2015,"After singing the jingle for years...Yummmm!, it was time to experience Red Robin. We wondered in around 7PM on a Thursday. The place was moderately full. It is a cross between an Applebees and Upscale hotel bar. Instantly greeted by a college boy. He sat us in the bar in front of the big screens airing hockey. He said that he would be there to help us if we needed it, but that Nessa would be our server. I will divided this review into four categories: 1 - Look and feel.  Four stars for clean, modern and inviting. 2 - Service was one star. While Nessa was great, she was overworked or overwhelmed by the number of tables she had to serve. Her smile was real, her insight for first timers was spot on and her attention after the food arrived and swiftly getting our check was excellent. Once we were seated it was 14 minutes before water was brought to the table. With the wings, there were no napkins or utensils. I asked the host and he brought over some napkins and forks, and said they were ""out of knives"". This was a new reply for me. Apparently Red Robin needs to cut back a bit on advertising and invest in some cutlery. The food did arrive quickly and hot.  3 - Food was four-five stars. Excellent. Impressive. While the wings are small (where do they find chickens that tiny?), they were perfectly cooked. We had bone-in plain batter with their BBQ and spin on buffalo sauce. So yummy. The homemade potato chips that are served with the wings are delicious. We will be back just for this appetizer. We shared the Royal Red Robbin Burger with endless steak fries. This burger had the over easy egg on it. Very good. The fries were awesome. Congrats to the kitchen staff for delivering great food.  4 - Other stuff: Beer list is ok, but no Grain Belt Premium on tap or bottles.  Parking is in a large stand alone lot. Bathrooms are clean. Large full service bar.  Overall a three, but if service improves, an easy four star experience.  We will be back when we have LOTS OF TIME to wait and we will be sure to be properly hydrated before entering. Food is that good.",https://www.yelp.com/biz/red-robin-gourmet-burgers-shoreview?start=20
C G.,"Saint Paul, MN",0,1,,3.0,4/30/2017,Food was ok when it arrived.  Had to ask where our appetizer was and it was then delivered luke-warm.  They were busy but not unusually busy.  Burgers tasted good.,https://www.yelp.com/biz/red-robin-gourmet-burgers-shoreview?start=20
Dan A.,"Minneapolis, MN",7,121,56,1.0,11/25/2015,"Under cooked burger.  Wimpy fries.  Seriously overpriced for what is a crappy drive-in burger.   You can get same thing, and sooner, and for $4.99 at Sonic.  Not that you want that either but you would be half less unhappy paying $5 - than paying $10.89 for a cold cheeseburger. Service?  Didn't  see it.   The beer was flat as well.",https://www.yelp.com/biz/red-robin-gourmet-burgers-shoreview?start=20
Cindy T.,"Minneapolis, MN",89,11,2,3.0,2/28/2016,"Good burger, but very messy. They advertise bottomless fries, but don't give you much to start off with. Had to ask the server for silverware, but overall decent experience.",https://www.yelp.com/biz/red-robin-gourmet-burgers-shoreview?start=20
Bruce F.,"Minneapolis, MN",0,2,,2.0,1/31/2016,"The food is great, service is great, must have let the cleaning staff go when the new menus came out, this store needs a good cleaning from nasty ceiling fans and vents right over your food, to the urine soaked walls of the bathroom, Going to  Plymouth store from now on.",https://www.yelp.com/biz/red-robin-gourmet-burgers-shoreview?start=20
Luke T.,"Tucker, GA",429,616,645,4.0,1/25/2014,"Its cold up here in Minnesoooota. I am not winterized like many that live here, and on this occasion, I left my wallet in my other heavy  jacket.  So, when the bill came.. I was patting down myself and reached for no wallet... OMG  I told the bartender, who was very understanding and let me go back to the hotel to retrieve my wallet. No hassle, no big deal, did not even blink an eye..  I came back in 5 minutes, left a huge tip, thank ful that this embarrasing episode is kept under control. Many thanks again to the bartender.",https://www.yelp.com/biz/red-robin-gourmet-burgers-shoreview?start=20
Abe M.,"St Paul, MN",154,332,114,2.0,1/18/2012,"I went here with the family for the first time over the weekend and I am stumped as to why this place is always full. I wasn't feeling that need to pound down a burger, so I ordered some Game Day Nachos instead. I think that's where I went wrong. These had to be the worst nachos I've ever had. Fake cheese is never good on nachos. The chips were so salty, I could only eat about four before calling it quits. About the only thing half good on the nachos was the presentation. The atmosphere is very busy and loud with kids all around. It almost gives it a chaotic feel. But hey, at least they are kid friendly and the service was alright too. I was happy to leave this place and probably won't be back.",https://www.yelp.com/biz/red-robin-gourmet-burgers-shoreview?start=20
Chris B.,"Fort Benning, GA",10,30,24,5.0,6/18/2015,Bottomless root beer floats bottle less fries and phenomenal burgers. Never had a bad experience at RR and this is no different maybe even best one so far. I've eatin at RR's in three 4 states and this one has out done them all. Thank you,https://www.yelp.com/biz/red-robin-gourmet-burgers-shoreview?start=20
Veronica B.,"Saint Paul, MN",23,208,20,5.0,7/29/2016,"Met a friend for lunch here today.  Got there about 11:40a...No wait....YEAH!!  Had a good server.  We dined because we had the Red Royalty offer of BOGO50%.  We both ordered the Smoked Pepper....strayed from our normal Whiskey River BBQ and some Chili burger.  The burger was FANTASTIC!!  I just re-heated it...phenomenal!!  As we went to pay at the table, she informed our server the discount didn't come off.... Apparently RR has Gourmet and Fine Gourmet burgers....who pays attention to the categories?!  :) The difference IS....the Fine are 1/2 lb burgers rather than 1/3 lb.... Neither of us finished ours, which is the norm, so it wasn't indicative of the bigger burger...sorry.  So the gal said she would have to talk to the manager.  As we waited for him to come to our table...already set ourselves up for the No......  The gal came back with the check and the manager just took the discount off!!  THANK YOU!!  Rather than quibble with patrons over a few $ difference he took care of it.  Alleviating any issues.  THANK YOU Red Robin, looking forward to my next tasty burger from a friendly staff!!",https://www.yelp.com/biz/red-robin-gourmet-burgers-shoreview?start=20
Laura L.,"Minneapolis, MN",0,1,,1.0,9/17/2016,Felt 100% before going.  Had severe nausea and stomach pain only 1 hour after. Then severe vomiting only an hr later.  Still very sick several hours after going.,https://www.yelp.com/biz/red-robin-gourmet-burgers-shoreview?start=20
Steve H.,"Saint Paul, MN",0,2,,3.0,9/11/2016,I love the food and haven't really had bad service but don't ever get the sangria.  They run it on special and I'm not sure why? Maybe because it's awful. It tasted like they put red wine over ice and just threw fruit in.  It was nothing like the description and nothing like any sangria I've ever had.  Should be called wine on ice with added fruit slices.,https://www.yelp.com/biz/red-robin-gourmet-burgers-shoreview?start=20
Madina T.,"Wilson Park, Milwaukee, WI",39,40,14,3.0,11/4/2015,"This place has pretty good food! They offer gluten free options. The portions are huge, so the prices are reasonable. Our food was served within minutes of ordering. I even had some yummy leftovers to take with me.",https://www.yelp.com/biz/red-robin-gourmet-burgers-shoreview?start=20
Peter Y.,"Saint Paul, MN",4,6,1,5.0,1/6/2016,"First time at Red Robins and I would have to say this is a place to come and have drinks and eat burgers! Had a party of two and ordered the Love BG, Banzai BG, root beer float, and freckle lemonade. Didn't know drinks were bottomless so they just kept coming. Food was very decent sized and tasted good. Onion rings were pretty good for appetizers. Service was excellent! Waitress was on point. Very friendly, had good knowledge of what's in the food and very attentive when drinks were low. I would recommend this place to anyone looking for good food and great service!",https://www.yelp.com/biz/red-robin-gourmet-burgers-shoreview?start=20
Mike F.,"Saint Paul, MN",3,37,1,5.0,9/23/2014,"Our favorite.   Lots of variety, all of which is good.   I like the A1 burger, the BBQ burger, the Tavern Double, the Smoke and Pepper burger, the fish and chips, etc, etc.   You really can't go wrong.    The endless fries are good but I can usually only eat one helping because they give you plenty the first time. Service is fast and friendly. There's plenty of room in the parking lot but there's always a bunch of cars parked on the street in front of this place.   Why are they parked there?   Where did they go?",https://www.yelp.com/biz/red-robin-gourmet-burgers-shoreview?start=20
Sharifah I.,"Saint Paul, MN",4,19,6,4.0,4/2/2016,"I've eaten here plenty of times with different experiences good and bad in food, staff, wait times, etc. This review is based on my experience from yesterday. We got there around 4:30ish and was seated right away. It didn't take long for our waitress to come out. It wasn't that busy at that point. Our drinks that weren't made at the bar came out quickly. My mom's pickled pear lemonade took longer but a plain vanilla shake for my five year old took over 20 minutes to get. The appetizer and the meals themselves took long enough to come out as well probably due to how busy it was at the restaurant. I was concerned since people who had arrived after us got drinks and appetizers before us. They messed us the burger my mom ordered and offered to fix it and not charge us for it. The Red Robin rewards are nice to since every so often we'll get a free burger which we did last night. The burgers are decent, gourmet...no. Overall I'll eat there again since the burgers are tasty, the garlic aioli sauce it bomb, and can't beat bottomless fries.",https://www.yelp.com/biz/red-robin-gourmet-burgers-shoreview?start=20
Amanda M.,"Minneapolis, MN",0,9,,2.0,2/2/2015,"I have to imagine they've changed management or something, because this place used to be great, but now I don't think we're ever going back. We visited 2 nights ago and, big surprise, just like last time they were extremely short on cutlery. to the point where I had to ask for some and was given less than what we needed and was told sorry they're short and we got the last of it. (same thing happened our last visit.. and the one before that..) At least this time the service was good. The waitress was nice but was quite busy due to it being dinner rush. My food was warm, but not cooked properly. My boca burger was just simply heated, honestly I wouldn't be shocked if they microwaved it.",https://www.yelp.com/biz/red-robin-gourmet-burgers-shoreview?start=20
Andrew T.,"Saint Paul, MN",52,66,,3.0,7/28/2015,"I recently dined here for the first time. I like the idea of several burger selections. I mean, its a good restaurant. The problem is it does not stand out from the norm in my opinion. There are so many restaurants around that serve this type of food these days. I am not saying the food is bad, I mean they make a great burger, and there are a lot of different choices, but not outstanding as far as I'm concerend. If you ever get a chance to eat here, give it a try, but don't be too surprised if you've experienced something similar in the past.",https://www.yelp.com/biz/red-robin-gourmet-burgers-shoreview?start=20
