Username,location,friend_count,review_count,photo_count,rating,date,review,Url
Marty R.,"Garwood, NJ",1,25,9,2.0,9/11/2014,Ok for drinks and apps. Top shelf jalapeño bbq chicken enchiladas disappointing.  Bland. Rice and beans side-yum. Kids little chicken crispers with side of pineapple below average.  Pineapple slices not trimmed of full rind or core. Waiter very nice. The new table game was $0.99 now - it's been free the last three times we were here. Drug pusher tactics!  I will do my best to avoid returning. Temp set at 68 so bring a sweater.,https://www.yelp.com/biz/chilis-clark-2?start=40
Jacquie G.,"Summit, NJ",212,187,212,2.0,6/27/2014,"I love the Presidente Margarita, but that's really about it.  Great for happy hour with coworkers.  Had the grilled chicken salad with the honey lime vinaigrette.",https://www.yelp.com/biz/chilis-clark-2?start=40
Ronzoni S.,"East Brunswick, NJ",36,15,,2.0,11/10/2014,I ordered chicken fajitas. The condiment spinner that they give you was filled with old hard shredded cheese . I was disgusted and surprised! This place used to be a great place to eat!  Wth happened?,https://www.yelp.com/biz/chilis-clark-2?start=40
Cynthia R.,"Roselle Park, NJ",43,42,,2.0,1/10/2013,"It is alright here. the first time bf and I went, we had a really odd waiter who I guess didn't believe I was 21 and hesitated on giving me my vodka tonic even though I had already shown him ID. Then the rest of the night he was very awkward and I felt like he was behind me the whole time. Almost like he was trying to listen to our conversation. We just laughed about it but it was definitely weird.  I also went not too long ago and it felt like the waiter was trying to kick us out the entire time. Very rushed. A friend and I ordered an appetizer and before we could even begin to eat, my plate came out but hers was no where to be found. So by the time hers came, mine was cold sitting on the side of the table.  Needless to say, I've experienced better hence the 2 stars.",https://www.yelp.com/biz/chilis-clark-2?start=40
Walter O.,"Clark, NJ",145,16,17,3.0,9/3/2014,Food as good as any Chilis. But the service is painfully slow. At least there wasn't the usual half hour wait. Which I won't wait for. Not for a Chilis anyway. Still waiting...,https://www.yelp.com/biz/chilis-clark-2?start=40
Anonymous S.,"Denver, CO",1,48,,1.0,11/23/2015,"Wine served in DIRTY glassware (twice).  Laminated menus and on-table ordering devices visibly greasy, covered with sticky splatters, and gross.  Bathrooms filthy.",https://www.yelp.com/biz/chilis-clark-2?start=40
Shawn D.,"New York, NY",169,4,,2.0,11/8/2015,"Atmosphere is the usual Chili's experience. The waitress was very nice, yet very slow in getting our drinks delivered. They arrived after the appetizers. This was probably due in part because we were seated right by the kitchen and whatever antics were going on in the kitchen, it was very loud and unprofessional. Furthermore, There was a gathering of female servers crowded around one male server by our table and the kitchen, spewing everything unprofessional and acting like a know-it-all. It disrupted the quiet dinner I was having. The food I ordered was not prepared properly. I asked for the dressing to be on the side for my salad and and was served with dressing on the salad. I would have stayed and ordered another drink or two, but the loud sounds coming from the kitchen and having to listen to a know-it-all server spew BS rather than worry about his tables made my experience bad. Probably won't visit this location again.",https://www.yelp.com/biz/chilis-clark-2?start=40
Bryce R.,"Clark, NJ",21,21,,2.0,3/3/2012,"It's a Chilli's, nothing special.  Would rather drive an extra 5 minutes to downtown Westfield or Rahway for a better dining experience at a mom and pop. The place does get very crowded on the weekends and for happy hour.  Actually, I am always shocked at how crowded the restaurant is at all times. Also, most of the food is deceivingly unhealthy for you.  Check out nutritional content before dining, some options that don't seem like they will hurt that much can really set you way back.",https://www.yelp.com/biz/chilis-clark-2?start=40
Dr. R.,"Los Angeles, CA",4,81,5,2.0,11/28/2013,"This place has consistently bad service. It has actually become a joke with me and my wife. We go to chilis if we want to eat cheap. Because the manager always comps one of the meals when things get screwed up. The food itself isn't bad (it's a chain, however good that gets), but the staff is obviously not in it to win it. Honestly, go to Thailand Restaurant next door. Fresh food, family-owned, healthier and much tastier.",https://www.yelp.com/biz/chilis-clark-2?start=40
Paula S.,"Rahway, NJ",0,67,1,1.0,11/17/2014,"Fast food with wait-service. Bright, loud, run by teenagers, over-run with children and ""bar-patrons"" - forgettable menu, no big surprises, typical chain MSG fest.",https://www.yelp.com/biz/chilis-clark-2?start=40
Amber F.,"Rahway, NJ",0,6,3,4.0,5/5/2014,"I came here on a Monday night and I thought the service was very good. Food was also good, especially the California chicken flatbread.",https://www.yelp.com/biz/chilis-clark-2?start=40
Sefali P.,"Avenel, NJ",156,105,95,2.0,12/27/2013,"Cheesesteak sandwich combo with fries: generous serving of fries, but a very small sandwich.",https://www.yelp.com/biz/chilis-clark-2?start=60
Crystal O.,"Union, NJ",0,1,,1.0,10/25/2014,Received poor service today... $1.00 supermarket hamburger buns for their Turkey guacamole burger that when served was soggy returned for a fajita meal that was an extra $3.00 then compensated with a seemingly generous $6.00 reduction but in actuality I was charged the price of the soggy burger..then the tip chart was way off...increased by 5% more...Oh & was served wine in a glass whisky tumbler :( Hmmm..#Verydissappointed!,https://www.yelp.com/biz/chilis-clark-2?start=60
B Q.,"Westfield, NJ",0,20,,1.0,4/4/2016,"we all know when you go to chili's, the food is salty. we went friday night with kids.   everythings was bad.  took forever to get our drinks from bar. the food really is fast food.  a house salad was warm.   lettuce warm,tomato warm. wilted.    one of the fajitas dinners came out wrong.  it took 15 minutes later for my son to get his.   all of us were done with our dinners and he finally got his.   it used to be alot better.   just not worth it.",https://www.yelp.com/biz/chilis-clark-2?start=60
Orlando V.,"Woodbridge Township, NJ",0,35,1,1.0,10/2/2014,"Service was horribly slow, not to mention after my appetizer it took 35 minutes for my meal to arrive. Meal was good and I did have 5 dollars removed off my bill but definitely will not be coming back.",https://www.yelp.com/biz/chilis-clark-2?start=60
K R.,"Manhattan, NY",5,88,88,4.0,1/30/2012,"You know what you're getting when you go to Chili's. You have to be in the mood for the salty, bad-for-you menu, with oversized portions. Even most of the salads clock in at over 1,200 calories! I'm a fan of the black bean burger, chicken enchilada soup, nachos, the new Shiner Bock BBQ burger and the guiltless grilled chicken sandwich. A lot of people like the fries, but I think they're way too salty and usually opt for a different side like steamed brocolli. The ""To-Go"" service at this location is usually pretty good, but last time I picked up an order they forgot my drink and served me soups that had nothing in the broth (server must have skimmed the top of the soup). Overall, you get a good meal here, like I said though, you have to be in the mood for what they're serving. This location gets very busy at dinner time and parking can be a hassle.",https://www.yelp.com/biz/chilis-clark-2?start=60
K T.,"Garwood, NJ",15,129,,1.0,11/13/2015,"made the mistake of letting my kids talk me into returning, still crap",https://www.yelp.com/biz/chilis-clark-2?start=60
Tony L.,"Rahway, NJ",7,28,15,4.0,12/20/2013,"I like the service here, of course, very familiar faces, friendly. I also enjoy meals and my mango ice tea all the time here. The decor and interior is decent, nothing special. Though, they're not as clean as Applebee's but yeah, it's a good place to eat out with families and friends. Update: I've been here a few more times, surprisingly, they have improve, waiters and waitresses are very knowledgable. Plus some dishes I've tried like Mango-Triple Fliapia is really good! But their rice was bland with not much seasoning. Plus our waiter today was cute. Sorry~ off topic.",https://www.yelp.com/biz/chilis-clark-2?start=60
Debbi S.,"Woodbridge Township, NJ",0,12,,2.0,1/8/2014,Chili customer relation department  quickly responded and offered incentive to return. Thanks Chills Guest Relations. Possibly will try another location,https://www.yelp.com/biz/chilis-clark-2?start=60
Mike P.,"Oceanside, CA",8,21,,2.0,1/3/2013,"Waited about 10 minutes for a seat at 9 PM in the holiday season.  I ordered the Parmesan-Crusted Steak.  My medium-rare order arrived well done.  The parmesan crusting was meager and sad looking when compared to the heaping mound on the picture.  The toast was plated with the burnt side down (I didn't notice until I had already deemed the meal a fail).  My wife's burger was bland, the ""86 the tomato"" request was not followed, and her fries were overdone.  We would have sent both meals back, but the server never came back to check on our food.  I would have ordered another beer, but we only saw him when he took the order.  I had to flag down another server to get the check.  Each of our very infrequent visits to Chili's reminds us why we so rarely eat there.",https://www.yelp.com/biz/chilis-clark-2?start=60
Matthew D.,"Newark, NJ",55,161,29,5.0,7/28/2013,Good service and always consistent. raj is a great manager and always is good to us.,https://www.yelp.com/biz/chilis-clark-2?start=60
Sarah P.,"Rahway, NJ",19,11,2,2.0,8/13/2013,The prices went up for sure! I ordered the fajita trio and it was not fresh or sizzling on the hot plate. My boyfriend ordered the country fried chicken and within hours he was sick to his stomach. I'm sorry for the bad review but Chillie's needs to step up their game.,https://www.yelp.com/biz/chilis-clark-2?start=60
Kimberly T.,"Middletown, NJ",0,2,,2.0,11/8/2013,Ok so first of all the pager we got was broken they said a 10-15 minute wait ended up being 30 mins then they ran out of 2 soups. Food is ok Waiter ehh,https://www.yelp.com/biz/chilis-clark-2?start=60
Bryant B.,"Staten Island, NY",0,11,2,3.0,9/21/2013,This review is based on the bar area during happy hour only.  You cannot beat their happy hour specials. $3 margaritas $2.50 domestic pints and a variety of appetizers between 3-5$. They got me there. The food is typical chain food that won't blow you away but to watch a game here on Sunday it's great. Plenty of televisions and the bartender is very attentive and always friendly. My type of a Sunday Funday.,https://www.yelp.com/biz/chilis-clark-2?start=60
Jay P.,"Elizabeth, NJ",137,34,25,5.0,1/21/2012,"I love this place.  I have never had a bad meal here and I have eaten here a decent amount.  I have tried almost everything and it was always good.  Every server I have talked to has a great personality.  I know it's just Chili's, but this place is the best.",https://www.yelp.com/biz/chilis-clark-2?start=60
Tim M.,"Clark, NJ",2,24,,4.0,11/12/2011,"I live in Clark so my wife and I go to Chilis once or twice a month. The food is always decent and the staff are friendly. There is seldom a long wait and they allow you to call ahead to get on the list when there is a wait, which is nice. Overall, it's decent food at a decent price.",https://www.yelp.com/biz/chilis-clark-2?start=60
F D.,"Cranford, NJ",40,39,11,4.0,6/20/2013,"...Chili's good, just like the commercial says...New pretzels appy very good, one of my companies had her usual Texas chesse fries and they were good",https://www.yelp.com/biz/chilis-clark-2?start=60
Dave C.,"Roselle, NJ",0,17,,2.0,7/26/2014,"After the remodel the food and service has become horrible.  Just went there recently after the last time months ago when I went and waited 15mins and had no server come to our table.  We saw people being seat around us and being served.  We got up and left.  We decided to try it out again since it had been a while.  We ordered skins, they were over cooked dry as a bone even with the cheese on top, and they had a weird oil taste to it.  Out main course came, we ordered the buffalo chicken sandwich, it had the same oil taste, that taste of old oil.  The fries over salted as usual tasted the same.  We won't be going back.",https://www.yelp.com/biz/chilis-clark-2?start=60
Joyce A.,"Basking Ridge, NJ",24,29,,1.0,9/4/2011,"I went to this eatery very hungry & usually food always tastes good when you're hungry right? Not so here! The waiter was a nice teenaged kid, but he couldn't help the disgusting cuisine. They brought out chicken & onions in a sizzling pan and it smelled like disinfectant. GROSS. Food was mediocre. Not much of a selection. I much prefer Chevy's!!! Server kept my soda filled & he was nice, but food was bad. Tasteless. Waste of my money. NEVER will go to a Chili's again",https://www.yelp.com/biz/chilis-clark-2?start=60
Caroline E.,"Bradley Beach, NJ",120,2,,2.0,11/25/2012,"I haven't been at a Chili's in a long time and I've been to this particular location in the past.  This time around I wasn't impressed at all. I was there before choir rehearsal so we didn't have that much time and it was a week night.  We had to wait which it is what it is and I really didn't care much but was surprised.  But it also was after Sandy so people probably still were out of power and just wanting to get out.  So our time at the table chilling would be shorter.  Whatever. Since I'm trying to control swelling in old injuries, I decided to order the combo platter that they have and get the grilled salmon and shrimp with broccoli and rice.  Sounds healthy but no. The salmon had so much salt on it and the same for the rice and my poor broccoli was rotten.   I was horrified to see how degraded the vegetable was and how could they not see that, it was gray.  And they steamed it and put it on the plate and served it.  I had the server bring me more and digging into the bowl, I found more rotten broccoli.  When she came to clean our table I had a pile of rotten broccoli in front of me, do you think when I said again it still wasn't good that they'd knock something off the bill or offer me something else. They did not.   Both my dining partners ordered burgers.  The server did not ask them how they liked their beef and served both like hockey pucks.   Next time I'll pass and go to White Diamond or any other eatery in Clark before I go back.",https://www.yelp.com/biz/chilis-clark-2?start=60
A M.,"West Nyack, NY",0,9,,2.0,6/8/2014,"If you like salt, go here. The server was nice but the food...  I got the table side guacamole. The sever said a little salt as she dumps half the container in the guacamole.  My daughter almost choked on a piece too.  I got the cheese enchiladas and my daughter got the kids pepperoni pizza. The cheese was very salty. I thought it was only mine but then my daughter said this cheese is salty. There you have it. Probably won't come back anytime soon.",https://www.yelp.com/biz/chilis-clark-2?start=60
Samantha S.,"Clark, NJ",501,462,,5.0,7/31/2011,"I love Chili's!  The food and drinks are awesome and it's inexpensive, especially with the 2 for $20 deal.  The chips and salsa are addictive, and I also really like the fire roasted corn guacamole.  The Quesadilla Explosion Salad is my favorite here.  I also love their french fries and the Molten Lava cake.  Yum.",https://www.yelp.com/biz/chilis-clark-2?start=80
Sandra D.,"Westfield, NJ",31,19,1,3.0,2/16/2014,"A very popular place.. Can never see the place slightly empty.. Love the steaks, fajita as for the price they offer it's awesome. At the end it's still a fast food joint but will always do for my steak craves",https://www.yelp.com/biz/chilis-clark-2?start=80
Red G.,"Mountain View, CA",6,38,7,4.0,2/20/2009,Order the molten chocolate lava cake and you will love it. Service is great. Try their burgers and salads. I would go back here.,https://www.yelp.com/biz/chilis-clark-2?start=80
C L.,"Clark, NJ",122,16,8,4.0,9/3/2010,always a good experience- love the wings they are the best. And the cheese cake is totally awesome its out of this world.,https://www.yelp.com/biz/chilis-clark-2?start=80
Brian S.,"Boston, MA",6,25,,2.0,3/22/2010,"Only dish I ever liked here was their ground peppercorn burger, which is now off the menu. Everything else is passable.",https://www.yelp.com/biz/chilis-clark-2?start=80
Judee D.,"Roselle, NJ",39,43,70,2.0,5/19/2011,food is very salty & some waitresses can be rude and cutting with their comments. the only reason why I would come is for a quick drink or the molten lava cake.,https://www.yelp.com/biz/chilis-clark-2?start=80
Gregory M.,"Cranford, NJ",239,122,1,3.0,5/24/2008,I went here with a couple of friends for my birthday. the margaritas were good. But the baby back ribs were dry.,https://www.yelp.com/biz/chilis-clark-2?start=80
Cathy F.,"Westfield, NJ",0,6,,5.0,3/25/2011,"This place never ceases to amaze!  The portions are copious, the food is delicious & always fresh with selections to appease any taste.",https://www.yelp.com/biz/chilis-clark-2?start=80
Rosa R.,"Cranford, NJ",0,4,,5.0,7/29/2010,Chili's is definitely one of our favorite places to eat. It's close to home and the service is great at Clark. The food is delicious. There is something for everyone in your family. The prices are very reasonable. Our family has enjoyed many delicious meals. Everyone orders something different so we can share. Whether with your family or a group of friends you are guaranteed to have a good time. Chili's has a very relaxed atmosphere. Make Chili's your next dining experience.,https://www.yelp.com/biz/chilis-clark-2?start=80
Farah C.,"Iselin, NJ",0,21,,2.0,7/21/2010,"The service at this Chili's is usually better than the one on Oak Tree Road.  The food quality is about the same.  The sweet corn soup is really good, as is the guacamole with corn in it.  I should have passed on the queso, it was so salty!!!  I also ordered a side salad with extra slices of avocado for .75 more.  That only gets you two slices of avocado apparently.",https://www.yelp.com/biz/chilis-clark-2?start=80
Alex G.,"Westfield, NJ",0,1,,4.0,5/13/2010,"My tennis team goes out to dinner every week, and the first place we always think of going to is Chili's. The atmosphere is awesome and the service is great. We always learn our waitress's name and converse with her. I shouldn't even have to talk about the food, but I will anyway. I always get the giant Southern Smokehouse Bacon Burger, which is incredible, but some of my teammates get the half rack of baby back ribs or even the delicious salads. Everything is exceptional, though. The only problem we had with it was that they don't take reservations for large parties, like us 12, and when we call in ahead of time to ask for the wait, we end up waiting twice as long. Even so, Chili's hands down is the greatest place to go to get good food and hang out with your friends.",https://www.yelp.com/biz/chilis-clark-2?start=80
